Code,Show Name,Location,Scene
/title/tt0091225/,"Petaluma, California, USA","(Petaluma River is used for almost all waterway scenes, with takeoff from Western Avenue)"
/title/tt0091225/,"California Academy of Sciences, Concourse Drive, Golden Gate Park, San Francisco, California, USA","(Howard is pulled up the CAS steps, then through the African Hall)"
/title/tt0091225/,"Fireman's Fund Building - 777 San Marin Drive, Novato, California, USA",(Ultralight lands in the fountain; building poses as Dynatechnics)
/title/tt0091225/,"Nicasio, California, USA",
/title/tt0091225/,"Rio Vista, California, USA",(Ultralight takes off downtown and flies towards the Sacramento River)
/title/tt0091225/,"Rancho Seco Nuclear Generating Station, Herald, California, USA",(Appears as the Cuyahoga nuclear plant)
/title/tt0091225/,"11th Street, San Francisco, California, USA","(Howard gets off the bus on 11th at Natoma, and sees the TV display in a corner store)"
/title/tt0091225/,"Richmond, California, USA",(Joe Roma's Cajun/Sushi Café; interior)
/title/tt2531344/,"Blackhall Studios, Atlanta, Georgia, USA",
/title/tt4034354/,"Los Angeles, California, USA",
/title/tt0094889/,"Toronto, Ontario, Canada",
/title/tt0094889/,"Jackson Avenue and 50th Avenue, Queens, New York City, New York, USA",(Pats Place)
/title/tt0094889/,"Sandals Royal Plantation, Ocho Rios, St. Ann, Jamaica",
/title/tt0094889/,"Don Jail, Toronto, Ontario, Canada",(as The Cell Block bar)
/title/tt0094889/,"Medical Sciences Building, University of Toronto, Toronto, Ontario, Canada",(class Brian attends)
/title/tt0094889/,"The Water Club, New York City, New York, USA",(Doug and Kerry Coughlin's nightclub/Doug's suicide at the pier)
/title/tt0094889/,"St John's Norway Cemetary, Toronto, Ontario, Canada",(funeral scene)
/title/tt0094889/,"Jamaican Inn, Ocho Rios, St. Ann, Jamaica",
/title/tt0094889/,"Los Angeles, California, USA",
/title/tt0094889/,"New York, USA",
/title/tt0094889/,"199 Chambers St, New York City, New York, USA",(Basketball court)
/title/tt2103188/,"Hollywood, Los Angeles, California, USA",(Vinewood)
/title/tt2103188/,"Fargo, North Dakota, USA",(Ludendorff)
/title/tt0083564/,"West Long Branch, New Jersey, USA",
/title/tt0083564/,"Berkshires, Massachusetts, USA",
/title/tt0083564/,"Hennesy Street, Warner Brothers Burbank Studios - 4000 Warner Boulevard, Burbank, California, USA",(Orphanage exteriors)
/title/tt0083564/,"Stage 15, Warner Brothers Burbank Studios - 4000 Warner Boulevard, Burbank, California, USA",
/title/tt0083564/,"Stage 18, Warner Brothers Burbank Studios - 4000 Warner Boulevard, Burbank, California, USA",
/title/tt0083564/,"New York City, New York, USA",
/title/tt0083564/,"Stage 12, Warner Brothers Burbank Studios - 4000 Warner Boulevard, Burbank, California, USA",
/title/tt0386588/,"City Hall Park, Manhattan, New York City, New York, USA",
/title/tt0386588/,"Hook & Ladder Company #8 - 14 North Moore Street, Manhattan, New York City, New York, USA",
/title/tt0386588/,"New York, USA",
/title/tt0386588/,"New York City, New York, USA",
/title/tt0386588/,"U.S. Customs House, New York City, New York, USA",(behind Sara and she and Hitch talk on the phone)
/title/tt0386588/,"Columbia University - Broadway & 116th Street, Manhattan, New York City, New York, USA",
/title/tt0386588/,"Old Westbury Gardens - 71 Old Westbury Road, Old Westbury, Long Island, New York, USA",
/title/tt0103484/,"Old Town Bar and Restaurant, 45 E. 18th Street in Flatiron District, Manhattan, New York City, New York, USA",(exterior scenes of Riff's Restaurant)
/title/tt0099329/,"Milford Mill Park & Swim Club - 3900 Milford Mill Rd, Windsor Mill, Maryland, USA",(Turkey Point)
/title/tt0099329/,"Sykesville, Maryland, USA",
/title/tt0099329/,"Walt Disney's Golden Oak Ranch - 19802 Placerita Canyon Road, Newhall, California, USA",
/title/tt0099329/,"Maryland, USA",
/title/tt0099329/,"Turkey Point Swim Club, Baltimore, Maryland, USA",
/title/tt0099329/,"Windsor Mill, Maryland, USA",
/title/tt0099329/,USA,
/title/tt0389860/,"Brooklyn Bridge, New York City, New York, USA",
/title/tt0389860/,"Glendale, California, USA",
/title/tt0389860/,"Shaver Lake, California, USA",
/title/tt0389860/,"Long Beach, California, USA",
/title/tt0389860/,"Royce Hall - 340 Royce Drive, UCLA, Westwood, Los Angeles, California, USA",
/title/tt0119190/,"Maui, Hawaii, USA",
/title/tt0119190/,"San Francisco-Oakland Bay Bridge, San Francisco Bay, California, USA",
/title/tt0119190/,"Neiman Marcus Union Square Store - 150 Stockton Street, San Francisco, California, USA",
/title/tt0119190/,"Middle Fork American River, California, USA",(Lyle Van de Groot pursuing Ursula from a raft)
/title/tt0119190/,"First Bank - 550 Montgomery Street, San Francisco, California, USA",(as Stanhope Bank)
/title/tt0119190/,"The Tamalpais Building, San Francisco, California, USA",
/title/tt0170016/,"Stage 31, Universal Studios - 100 Universal City Plaza, Universal City, California, USA",
/title/tt0170016/,"Stage 27, Universal Studios - 100 Universal City Plaza, Universal City, California, USA",
/title/tt0170016/,"Stage 29, Universal Studios - 100 Universal City Plaza, Universal City, California, USA",
/title/tt1193138/,"St. Louis, Missouri, USA",
/title/tt1193138/,"Lambert International Airport - 10701 Lambert International Boulevard, St. Louis, Missouri, USA",
/title/tt1193138/,"Eppley Airfield - 4501 Abbott Drive, Omaha, Nebraska, USA",(interior: airport terminals/entrance)
/title/tt1193138/,"Detroit, Michigan, USA",
/title/tt1193138/,"Las Vegas, Nevada, USA",
/title/tt1193138/,"Miami, Florida, USA",
/title/tt1193138/,"Nebraska, USA",
/title/tt0460740/,"England, UK",
/title/tt0460740/,"London, England, UK",
/title/tt0472181/,"Kaufman Astoria Studios - 3412 36th Street, Astoria, Queens, New York City, New York, USA",
/title/tt0472181/,"Astoria, Queens, New York City, New York, USA",
/title/tt0472181/,"Manhattan, New York City, New York, USA",
/title/tt0472181/,USA,
/title/tt6807662/,"Kumeu Film Studios - 116 Access Road, Kumeu, Auckland, New Zealand",(studio)
/title/tt0075686/,"Beekman Cinema - 1254 2nd Avenue, Manhattan, New York City, New York, USA",(Cinema showing Ingmar Bergman's Face to Face - Alvy waits for Annie and is recognised from television)
/title/tt0075686/,"Filmways Studios - 246 East 127th Street, East Harlem, Manhattan, New York City, New York, USA",(studio)
/title/tt0075686/,"Thalia Cinema - 250 West 95th Street, Upper West Side, Manhattan, New York City, New York, USA",(Alvy runs into Annie with date seeing The Sorrow and the Pity)
/title/tt0075686/,"3rd Avenue, Bronx, New York City, New York, USA",(Steve's Famous Clam Bar)
/title/tt0075686/,"Central Park, Manhattan, New York City, New York, USA",(Park scene - Alvy and Annie mock passers-by)
/title/tt0075686/,"New York Theater, New York City, New York, USA",(Theatre scene with Marshall McLuhan)
/title/tt0075686/,"South Shore, Long Island, New York, USA","(Lobster scene, beach and beach house)"
/title/tt0075686/,"Wall Street Tennis Club, Wall Street, Manhattan, New York City, New York, USA",(Sport Club)
/title/tt0075686/,"Cajun Bistro - 8301 Sunset Blvd., West Hollywood, California, USA",(break-up lunch)
/title/tt0075686/,"East 66th Street, Manhattan, New York City, New York, USA","(Alvy and Rob walking along 66th at 3rd avenue, Rob calls Alvy ""Max"")"
/title/tt0075686/,"5th Avenue, Manhattan, New York City, New York, USA",
/title/tt0075686/,"Brooklyn, New York City, New York, USA",
/title/tt0075686/,"Palos Verdes Peninsula, California, USA",
/title/tt0075686/,"Surf Avenue, Coney Island, Brooklyn, New York City, New York, USA",
/title/tt0075686/,"Upper West Side, Manhattan, New York City, New York, USA",
/title/tt0075686/,"California, USA",
/title/tt0475394/,"Stox Restaurant & Bakery - 9518 Imperial Hwy., Rockwell Defense Plant - Bellflower & Imperial Highway, Downey, California, USA",
/title/tt0475394/,"Stateline, South Lake Tahoe, USA",
/title/tt0475394/,"Los Angeles, California, USA",
/title/tt0406375/,"Los Angeles, California, USA",
/title/tt0406375/,"Stage 30, Sony Pictures Studios - 10202 W. Washington Blvd., Culver City, California, USA",(Budwing house; interior)
/title/tt8050756/,"Chicago Illinois, USA",(street scenes)
/title/tt1714206/,"Georgia, USA",
/title/tt0097428/,"U.S. Customs House, New York City, New York, USA",(Manhattan Museum of Art)
/title/tt0097428/,"Hook & Ladder Company #8 - 14 North Moore Street, Manhattan, New York City, New York, USA",(Ghostbusters headquarters exteriors)
/title/tt0097428/,"Columbia University - Broadway & 116th Street, Manhattan, New York City, New York, USA",(Department of Parapsychology/Weaver Hall)
/title/tt0097428/,"Washington Square Park, Greenwich Village, Manhattan, New York City, New York, USA",(Square Park)
/title/tt8404614/,Uruguay,
/title/tt8404614/,"Buenos Aires, Federal District, Argentina",
/title/tt8404614/,Italy,
/title/tt0374536/,"Sony Pictures Studios - 10202 W. Washington Blvd., Culver City, California, USA",(studio)
/title/tt0374536/,"4427 Radford Ave, Los Angeles, California, USA",
/title/tt0374536/,"Culver Studios - 9336 W. Washington Blvd., Culver City, California, USA",
/title/tt0374536/,"Studio City, Los Angeles, California, USA",
/title/tt0374536/,"Los Angeles, California, USA",
/title/tt0401445/,"Cucuron, Vaucluse, France",(The pond square)
/title/tt0401445/,"Gordes, Vaucluse, France",
/title/tt0401445/,"Bonnieux, Vaucluse, France",
/title/tt0401445/,"Rail Station, Avignon, Vaucluse, France",
/title/tt0401445/,"Marseille Provence airport, Bouches-du-Rhône, France",
/title/tt0401445/,"Albion Riverside, Battersea, London, England, UK",(Max Skinner's London flat)
/title/tt0401445/,"Bluebird Cafe, Kings Road, Chelsea, London, England, UK",
/title/tt0401445/,"Piccadilly Circus, Piccadilly, London, England, UK",
/title/tt0401445/,"London, England, UK",
/title/tt0401445/,UK,
/title/tt0375063/,"Buellton, California, USA",(location)
/title/tt0375063/,"San Diego, California, USA",(location)
/title/tt0375063/,"Oxnard, California, USA",(location)
/title/tt0375063/,"Montebello, California, USA",(End wedding sequence)
/title/tt0375063/,"Hitching Post II, 406 East Highway 246, Buellton, California, USA",(Where Maya waits tables and where Miles recommends the ostrich steak)
/title/tt0375063/,"Sanford Winery, 7250 Santa Rosa Road, Buellton, California, USA",(Miles teaches Jack the finer points of wine tasting)
/title/tt0375063/,"Fess Parker Winery & Vineyard - 6200 Foxen Canyon Road, Los Olivos, California, USA",(Frass Canyon Winery where Miles attempts to drink the spit-bucket)
/title/tt0375063/,"Los Angeles, California, USA",(location)
/title/tt0375063/,"Los Olivos, California, USA",(location)
/title/tt0375063/,"Foxen Winery, 7200 Foxen Canyon Road, Santa Maria, California, USA",(Miles and Jack cheekily fill up glasses)
/title/tt0375063/,"AJ Spurs, 350 East Highway 246, Buellton, California, USA",(where married waitress Cammi works)
/title/tt0375063/,"Firestone Winery, 5000 Zaca Station Road, Los Olivos, California, USA","(Miles, Jack, Stephanie and Maya sneak from a boring lecture)"
/title/tt0375063/,"River Course at the Alisal, Alisal Guest Ranch, 150 Alisal Road, Solvang, California, USA",(Miles and Jack play golf)
/title/tt0070735/,"LaSalle Street Station - 141 W. Van Buren Street, Downtown, Chicago, Illinois, USA",
/title/tt0070735/,"Castle Green Apartments - 99 S. Raymond, Pasadena, California, USA",
/title/tt0070735/,"Brownstone Street, Backlot, Universal Studios - 100 Universal City Plaza, Universal City, California, USA",
/title/tt0070735/,"Hugus Alley, Pasadena, California, USA",
/title/tt0070735/,"Biltmore Hotel - 506 S. Grand Avenue, Downtown, Los Angeles, California, USA",
/title/tt0070735/,"Stage 32, Universal Studios - 100 Universal City Plaza, Universal City, California, USA",
/title/tt0070735/,"Gold Ballroom, Biltmore Hotel - 506 S. Grand Avenue, Downtown, Los Angeles, California, USA",(upscale restaurant)
/title/tt0070735/,"Winston St. & Werdin Pl., Downtown, Los Angeles, California, USA",
/title/tt3289724/,"British Columbia, Canada",
/title/tt3289724/,Canada,
/title/tt0089907/,"Louisville, Kentucky, USA",(one exterior shot only)
/title/tt0089907/,"698 Moulton Avenue, Los Angeles, California, USA",(Uneeda Medical Supply)
/title/tt1528406/,"New York City, New York, USA",
/title/tt6957966/,"Toronto, Ontario, Canada",
/title/tt6957966/,Canada,
/title/tt0109831/,"St. Bartholomew-the-Great, Clerkenwell, London, England, UK",(wedding 4)
/title/tt0109831/,"National Film Theatre, South Bank Centre, South Bank, Lambeth, London, England, UK",(Where Carrie meets Charles brother)
/title/tt0109831/,"Rotherfield Park, East Tisted, Alton, Hampshire, England, UK","(Reception, Wedding 3)"
/title/tt0109831/,"Crown Hotel, High Street, Amersham, Buckinghamshire, England, UK","(The Boatman inn, Somerset - interior)"
/title/tt0109831/,"Luton Hoo Estate, Luton, Bedfordshire, England, UK","(Reception, Wedding 2)"
/title/tt0109831/,"St Michael's, Betchworth, Reigate, Surrey, England, UK",(Wedding 1)
/title/tt0109831/,"Shepperton Studios, Shepperton, Surrey, England, UK",(studio)
/title/tt0108147/,"Los Angeles, California, USA",
/title/tt0108147/,"St. Peter & Paul Church - 666 Filbert Street, San Francisco, California, USA",
/title/tt0108147/,"Coit Tower, San Francisco, California, USA",
/title/tt0108147/,"Maritime Museum Building - 201 Fort Mason, San Francisco, California, USA",
/title/tt4463894/,"Georgia, USA",
/title/tt4463894/,USA,
/title/tt0212346/,"San Antonio, Texas, USA",
/title/tt0212346/,"Omni Austin Hotel Southpark - 4140 Governors Row, Austin, Texas, USA",(pageant hotel)
/title/tt0212346/,"New York City, New York, USA",
/title/tt0212346/,"Austin Studios - 1901 E. 51st Street, Austin, Texas, USA",(studio)
/title/tt0212346/,"Stage 4, Austin Studios - 1901 E. 51st Street, Austin, Texas, USA",(Sandra Bullock steps out in a skintight blue dress)
/title/tt0112346/,"Washington, District of Columbia, USA",
/title/tt0112346/,"Lake Tahoe, California, USA",(Snow at Camp David)
/title/tt0112346/,"Culver Studios - 9336 W. Washington Blvd., Culver City, California, USA",
/title/tt0112346/,"Sony Pictures Studios - 10202 W. Washington Blvd., Culver City, California, USA",
/title/tt2277860/,"Walt Disney Animation Studios - 2100 Riverside Drive, Burbank, California, USA",
/title/tt0497465/,"Oviedo, Asturias, Spain",
/title/tt0497465/,"Barcelona Harbor, Barcelona, Catalonia, Spain",
/title/tt0497465/,"Avilés, Asturias, Spain",
/title/tt0497465/,"La Pedrera - 92 Passeig de Gràcia, Eixample, Barcelona, Catalonia, Spain",(When Vicky and Cristina explore Barcelona)
/title/tt0497465/,"New York City, New York, USA",
/title/tt0118842/,"Red Bank, New Jersey, USA",
/title/tt0118842/,"New Jersey, USA",
/title/tt0118842/,"Leonardo, New Jersey, USA",
/title/tt0118842/,"Keansburg, New Jersey, USA",
/title/tt0118842/,USA,
/title/tt0815236/,"Mellon Arena - 66 Mario Lemieux Place, Pittsburgh, Pennsylvania, USA",
/title/tt0815236/,"Pittsburgh, Pennsylvania, USA",
/title/tt0086425/,"Brennan's Restaurant - 3300 Smith Street, Houston, Texas, USA",(lunch scene with Aurora and Garrett)
/title/tt0086425/,"Houston, Texas, USA",
/title/tt0086425/,"Texas City, Texas, USA",
/title/tt0086425/,"Junction City, Kansas, USA",
/title/tt0086425/,"River Oaks, Houston, Texas, USA",
/title/tt0086425/,"Lincoln, Nebraska, USA",
/title/tt0086425/,"River Cafe, Brooklyn, New York, USA",(lunch with Patsy and her friends)
/title/tt4558376/,"Fiss, Tirol, Austria",
/title/tt4558376/,"Vienna, Austria",
/title/tt0816520/,"Ogden, Utah, USA",
/title/tt0461097/,"Sullivan's Bay, New Zealand",
/title/tt0461097/,"Auckland, New Zealand",
/title/tt0461097/,"Royal View Road, Te Atatu, Auckland, New Zealand",
/title/tt0461097/,"Te Atatu, Auckland, New Zealand",
/title/tt0461097/,"Woodhill Forest, Woodhill, Auckland, New Zealand",
/title/tt0095088/,"Raleigh Studios - 5300 Melrose Avenue, Hollywood, Los Angeles, California, USA",
/title/tt0095088/,"Warner Brothers Burbank Studios - 4000 Warner Boulevard, Burbank, California, USA",(studio)
/title/tt0243155/,"Globe Tavern, 8 Bedale Street, Borough, London, England, UK","(exterior, Bridget's flat)"
/title/tt0243155/,"Momo Restaurant, 25-27 Heddon Street, London, England, UK",(Bridget gets advice from her friends)
/title/tt0243155/,"Borough Market, Borough, London, England, UK",
/title/tt0243155/,"Shere, Surrey, England, UK",(area outside Bridget's parents' house)
/title/tt0243155/,"Tower Bridge, London, England, UK",
/title/tt0243155/,"Costwold Hills, England, UK",
/title/tt0243155/,"La Cantina, London, England, UK",
/title/tt0243155/,"Institute Of Contemporary Arts, Nash House, The Mall, St James's, London, England, UK",(Book launch)
/title/tt0243155/,"Shad Thames, Southwark, London, England, UK",(Bridget and Daniel kiss)
/title/tt0243155/,"King's Cross, London, England, UK",
/title/tt0243155/,"Piccadilly Circus, Piccadilly, London, England, UK",
/title/tt0243155/,"St. Pancras Station, St. Pancras, London, England, UK",
/title/tt0243155/,"Stoke Park House, Park Road, Stoke Poges, Buckinghamshire, England, UK",(Where Hugh Grant and Renee Zellweger spend a night)
/title/tt0243155/,"Shepperton Studios, Shepperton, Surrey, England, UK",(studio)
/title/tt0243155/,"Westminster, London, England, UK",
/title/tt0408839/,"San Francisco, California, USA",
/title/tt0408839/,"Santa Clarita, California, USA",
/title/tt0408839/,"Santa Paula, California, USA",
/title/tt2042568/,"Cafe Reggio, MacDougal Street, Manhattan, New York City, New York, USA",(Llewyn meeting Jean)
/title/tt2042568/,"Caffe Vivaldi - 32 Jones Street, Greenwich Village, Manhattan, New York City, New York, USA",(Where Llewyn and Jean were talking when Llewyn saw the cat through the window on the sidewalk)
/title/tt2042568/,"41st Drive Woodside Queens, New York City, New York, USA",(Llewyn's sister's house)
/title/tt2042568/,"Washington Square Park, Greenwich Village, Manhattan, New York City, New York, USA",(Llewyn and Jean arguing)
/title/tt2042568/,"New York City, New York, USA",
/title/tt2042568/,"Riverhead, Long Island, New York, USA",(Road scenes)
/title/tt0107362/,"RKO Twin Theatre, Times Square, Manhattan, New York City, New York, USA","(premiere of movie ""Jack Slater IV"")"
/title/tt0107362/,"1st Street Viaduct, Los Angeles, California, USA",(car drives here after going off bridge)
/title/tt0107362/,"Times Square, Manhattan, New York City, New York, USA",
/title/tt0107362/,"Angelina Street, Los Angeles, California, USA",(second cousin Frank's house)
/title/tt0107362/,"Terrace Theatre - 300 E. Ocean Boulevard, Long Beach, California, USA",(Jack Slater IV Premiere InteriorTheater/ Lobby)
/title/tt0107362/,"1103 Angelina Street, Los Angeles, California, USA",(second cousin Frank's house)
/title/tt0107362/,"Long Beach, California, USA",
/title/tt0107362/,"New York, USA",
/title/tt0107362/,"Downtown, Los Angeles, California, USA",
/title/tt0107362/,"Malibu, California, USA",(Vivaldi's house)
/title/tt0107362/,"Sony Pictures Studios - 10202 W. Washington Blvd., Culver City, California, USA",
/title/tt0230030/,"Richmond Theatre, The Green, Richmond, Surrey, England, UK",(Lincoln assasination scene)
/title/tt0230030/,"St. Vincent Catholic Church - 621 W. Adams Blvd., Los Angeles, California, USA",
/title/tt0230030/,"Long Beach, California, USA",
/title/tt0230030/,"Stage 15, 20th Century Fox Studios - 10201 Pico Blvd., Century City, Los Angeles, California, USA",(studio)
/title/tt0230030/,"The Forum - 3900 W. Manchester Boulevard, Inglewood, California, USA",
/title/tt0230030/,"Malibu, California, USA",
/title/tt0395495/,"Vancouver, British Columbia, Canada",
/title/tt1666801/,"Conyers, Georgia, USA",(studio)
/title/tt0117765/,"Miami Seaquarium - 4400 Rickenbacker Causeway, Key Biscayne, Florida, USA",
/title/tt0117765/,"Clewiston, Florida, USA",
/title/tt0117765/,"Las Vegas, Nevada, USA",
/title/tt0117765/,"Fort Lauderdale, Florida, USA",
/title/tt0117765/,"Nevada, USA",
/title/tt0077089/,"Paramount Studios - 5555 Melrose Avenue, Hollywood, Los Angeles, California, USA",
/title/tt0318649/,"Delta del Ebro, Tarragona, Catalonia, Spain",
/title/tt0318649/,"Hawley Lake, Hampshire, England, UK",
/title/tt0318649/,Spain,
/title/tt0318649/,UK,
/title/tt1878870/,"Guildford Park Secondary School, Surrey, British Columbia, Canada",
/title/tt1878870/,"Port Moody, British Columbia, Canada",
/title/tt0196229/,"Los Angeles, California, USA",
/title/tt0196229/,"Yonkers, New York, USA",
/title/tt0196229/,"New York City, New York, USA",
/title/tt0356470/,"1272 E Calaveras St. Altadena, California, USA",(Sam's house)
/title/tt0356470/,"Monrovia, California, USA",(Monrovia High School)
/title/tt0356470/,"The Huntington Library, Art Collections, and Botanical Gardens - 1151 Oxford Rd, San Marino, California, USA",(Halloween dance exteriors)
/title/tt0356470/,"City Hall - 100 N. Garfield Avenue, Pasadena, California, USA",(Hal & Fiona's wedding)
/title/tt0356470/,"Stage 22, Warner Brothers Burbank Studios - 4000 Warner Boulevard, Burbank, California, USA",
/title/tt0331632/,"Stanley Park, Vancouver, British Columbia, Canada",
/title/tt0331632/,"Burnaby, British Columbia, Canada",
/title/tt0331632/,"Lion's Gate Studios, North Vancouver, British Columbia, Canada",
/title/tt0331632/,"Vancouver Club, Vancouver, British Columbia, Canada",
/title/tt0331632/,Canada,
/title/tt0066026/,"Griffith Park - 4730 Crystal Springs Drive, Los Angeles, California, USA",(Football game)
/title/tt0066026/,"Stage 18, 20th Century Fox Studios - 10201 Pico Blvd., Century City, Los Angeles, California, USA",(studio)
/title/tt0146882/,"Green Mill - 4802 N. Broadway Avenue, Uptown, Chicago, Illinois, USA",
/title/tt0146882/,"Buck Town, Lincoln Square, Chicago, Illinois, USA",
/title/tt0146882/,"Lincoln Park, Lincoln Park, Chicago, Illinois, USA",
/title/tt0146882/,"Chicago, Illinois, USA",
/title/tt0146882/,"Austin, Chicago, Illinois, USA",
/title/tt0146882/,"Forest Glen, Chicago, Illinois, USA",
/title/tt0146882/,"3733 N Southport Ave, Chicago, Illinois, USA",(Movie theater)
/title/tt0146882/,"Chicago Studio City - 5660 W. Taylor Street, Austin, Chicago, Illinois, USA",(studio)
/title/tt0146882/,"Wicker Park, West Town, Chicago, Illinois, USA",
/title/tt7043012/,"California, USA",
/title/tt0089393/,"Hole in the Rock, Papago Park - 625 North Galvin Parkway, Phoenix, Arizona, USA",(caves)
/title/tt0089393/,"Big Surf - 1500 N. McClintock Drive, Tempe, Arizona, USA",
/title/tt0089393/,"Scottsdale High School, Scottsdale, Arizona, USA",
/title/tt0089393/,"Phoenix, Arizona, USA",
/title/tt0089393/,"Arizona, USA",
/title/tt0097958/,"Blondie Street, Columbia/Warner Bros. Ranch - 411 North Hollywood Way, Burbank, California, USA",(studio) (exterior: Griswold home)
/title/tt0097958/,"John Hancock Center - 875 N. Michigan Avenue, Near North Side, Chicago, Illinois, USA",(Frank Shirley's office)
/title/tt0097958/,"Mattison Boyd Jones House - 727 West Kenneth Road, Glendale, California, USA",(exterior: Frank Shirley's house)
/title/tt0097958/,"Stage 21, Warner Brothers Burbank Studios - 4000 Warner Boulevard, Burbank, California, USA",
/title/tt0097958/,"Stage 18, Warner Brothers Burbank Studios - 4000 Warner Boulevard, Burbank, California, USA",
/title/tt0097958/,"Hwy 9 North of Silverthorne, Colorado, USA",(highway road rage and logging truck scenes)
/title/tt0098878/,"Easton, Washington, USA",
/title/tt0098878/,"Washington, USA",
/title/tt0076729/,"Main Street, Jonesboro, Georgia, USA",(where Bandit and Snowman load the beer)
/title/tt0076729/,"West Palm Beach, Florida, USA",
/title/tt0076729/,"Macon Street and Highway 81, McDonough, Georgia, USA",(where Bandit hides behind a small brick building)
/title/tt0076729/,"Griffith Park - 4730 Crystal Springs Drive, Los Angeles, California, USA",(opening credits)
/title/tt0076729/,"Redan, Georgia, USA",
/title/tt0076729/,"Phillips Rd and S. Stone Mountain Lithonia Rd, Lithonia, Georgia, USA",(The funeral procession)
/title/tt0076729/,"Van Nuys Boulevard, Van Nuys, Los Angeles, California, USA",(opening credits boulevard night drive)
/title/tt0076729/,"Los Angeles, California, USA",(opening credits)
/title/tt0076729/,"11675 Foothill Boulevard, Lake View Terrace, Los Angeles, California, USA",(Smokey Roundup Red 22)
/title/tt0076729/,"Lakewood Fairgrounds, Atlanta, Georgia, USA",(Truck Roadeo scenes)
/title/tt0086659/,"BBC Television Centre, Wood Lane, Shepherd's Bush, London, England, UK",(studio)
/title/tt0086659/,"Denver Mill, Denver, England, UK",(location)
/title/tt0086659/,"Railway bridge, Beeston, England, UK",(location)
/title/tt0106611/,"Montego Bay, Jamaica",
/title/tt0106611/,Jamaica,
/title/tt4687882/,"Mitchell and Mackie Buildings, Milwaukee, Wisconsin, USA","(Daily Report dot Com July 15, 2016)"
/title/tt4687882/,"Paris, France",(season 2)
/title/tt0097136/,"The Old Place - 29983 Mulholland Highway, Cornell, California, USA",
/title/tt0312528/,"Longleaf, Florida, USA",
/title/tt0312528/,"Los Angeles, California, USA",
/title/tt0312528/,"Stage 27, Universal Studios - 100 Universal City Plaza, Universal City, California, USA",
/title/tt0312528/,"Stage 29, Universal Studios - 100 Universal City Plaza, Universal City, California, USA",
/title/tt2404465/,"Fairview-Riverside State Park, Louisiana, USA",
/title/tt0083483/,"Boston, Massachusetts, USA",
/title/tt0083483/,"Independence National Historical Park, Philadelphia, Pennsylvania, USA",(Dr. Craig's visit)
/title/tt0118789/,"Lackawanna, New York, USA",(bowling alley scenes)
/title/tt0118789/,"Gowanda Correctional Facility, Gowanda, New York, USA",(prison scenes)
