Code,Show Name,Location,Scene
/title/tt1655442/,"Oakwood Avenue, Los Angeles, California, USA",(Jack the dog alerts the cop that that George is in trouble on the corner of Oakwood Avenue and June Street)
/title/tt1655442/,"June Street, Los Angeles, California, USA",(Jack the dog alerting the cop that that George is in trouble on the corner of Oakwood Avenue and June Street)
/title/tt1655442/,"104 Fremont Place, Los Angeles, California, USA",(George's house at 1110 La Palmas Avenue)
/title/tt1655442/,"American Film Institute, 2021 North Western Avenue, Los Angeles, California, USA",
/title/tt0285351/,"Los Angeles, California, USA",
/title/tt1078940/,"Bora Bora, Leeward Islands, French Polynesia",
/title/tt1078940/,"Illinois, USA",
/title/tt1078940/,"O'Hare International Airport, Chicago, Illinois, USA",
/title/tt0053779/,"Tivoli, Rome, Lazio, Italy",
/title/tt0053779/,"Via Veneto, Rome, Lazio, Italy",
/title/tt0053779/,"Quirinal Palace, Rome, Lazio, Italy",
/title/tt0053779/,"Cinecittà Studios, Cinecittà, Rome, Lazio, Italy",(studio)
/title/tt0053779/,Vatican City,
/title/tt0053779/,"Piazza San Giovanni Bosco, Rome, Lazio, Italy",(Filming location of Steiners apartment and the announcement of Steiners wife.)
/title/tt0053779/,Italy,
/title/tt0053779/,"Stage 5, Cinecittà Studios, Cinecittà, Rome, Lazio, Italy",
/title/tt0120686/,"Bedford, New York, USA",
/title/tt0120686/,"Bronxville High School - 177 Pondfield Road, Bronxville, New York, USA",
/title/tt0120686/,"Larchmont, New York, USA",
/title/tt0120686/,"Rye, New York, USA",
/title/tt0120686/,"Nyack, New York, USA",
/title/tt0120686/,"Central Park, Manhattan, New York City, New York, USA",
/title/tt0120686/,"Manhattan, New York City, New York, USA",
/title/tt0120686/,"Morristown, New Jersey, USA",
/title/tt1302011/,"Hollywood, Los Angeles, California, USA",
/title/tt0452625/,"Edmonton, Alberta, Canada",
/title/tt0452625/,"Los Angeles, California, USA",
/title/tt0452625/,"University of British Columbia, Robson Square Campus - 800 Robson Street, Vancouver, British Columbia, Canada",
/title/tt0452625/,"Cecil Green Park House - 6251 Cecil Green Park Road, Vancouver, British Columbia, Canada",(Wedding)
/title/tt4082744/,"Orford, Suffolk, England, UK",(King's Head pub)
/title/tt5056196/,"Olbia, Sassari, Sardinia, Italy",
/title/tt1931435/,"Connecticut, USA",
/title/tt1931435/,"Stamford, Connecticut, USA",(acknowledged in film credits)
/title/tt5994364/,"Gimje, North Jeolla Province, South Korea",
/title/tt5994364/,"Fontaine de Tourny, Québec City, Québec, Canada",
/title/tt1942683/,"San Francisco, California, USA",(backgrounds)
/title/tt1942683/,"Lincoln Elementary School, Vallejo, California, USA",(Playground shots)
/title/tt0115243/,"Halifax, Nova Scotia, Canada",
/title/tt0115243/,Namibia,
/title/tt0105812/,"Baldwin Hills, Los Angeles, California, USA",(Sidney and Rhonda's apartment complex)
/title/tt0105812/,"Los Angeles, California, USA",
/title/tt0088933/,"Clearwater, Florida, USA",
/title/tt0088933/,"Southgate Shopping Center - 2515 Florida Ave S, Lakeland, Florida, USA",
/title/tt0384793/,"Veterans Hospital - 1611 Plummer Street, North Hills, Los Angeles, California, USA",
/title/tt0384793/,"Walter Reed Middle School - 4525 Irvine Avenue, North Hollywood, Los Angeles, California, USA",
/title/tt0459159/,"Whitehall, Westminster, London, England, UK",(Malcolm runs to Richmond Terrace)
/title/tt0088000/,"Catalina Park, Tucson, Arizona, USA",
/title/tt0088000/,"Bear Down Gym, University of Arizona, Tucson, Arizona, USA",
/title/tt0088000/,"Cochise Hall - 1018 E South Campus, University of Arizona, Tucson, Arizona, USA",
/title/tt0088000/,"Old Main, University of Arizona, Tucson, Arizona, USA",
/title/tt0088000/,"Alpha Gamma Rho Fraternity House - 638 E. University Boulevard, Tucson, Arizona, USA",(Alpha Beta Aß Fraternity House)
/title/tt0266915/,"Hong Kong, China",
/title/tt0266915/,"Island Eastern Corridor, North Point, Hong Kong, China",(Lee and Carter running naked on highway)
/title/tt0266915/,"Tsim Sha Tsui Police station - 213 Nathan Road, Tsim Sha Tsui, Kowloon, Hong Kong, China",(explosion at American Embassy)
/title/tt0266915/,"Public Square Street, Yau Ma Tei, Kowloon, Hong Kong, China",(police headquarters)
/title/tt0266915/,"Chep Lep Kok International Airport, Hong Kong, China",
/title/tt0266915/,"Las Vegas, Nevada, USA",
/title/tt0266915/,"New York City, New York, USA",
/title/tt0266915/,USA,
/title/tt0247745/,"Fishkill, New York, USA",
/title/tt0247745/,"Wappingers Falls, New York, USA",
/title/tt0247745/,"Poughkeepsie, New York, USA",
/title/tt0247745/,"Rockefeller State Park Preserve, Pleasantville, New York, USA",(highway police HQ)
/title/tt3502262/,"Los Angeles, California, USA",
/title/tt3502262/,"Paramount Studios - 5555 Melrose Avenue, Hollywood, Los Angeles, California, USA",(studio)
/title/tt0328828/,"101 South Glassell, Orange, California, USA",(florist shop)
/title/tt0328828/,"4107 Cedar Avenue, Long Beach, California, USA",(Florist's house)
/title/tt0328828/,"Chicago, Illinois, USA",(aerial shots)
/title/tt0328828/,"4153 Cedar Avenue, Long Beach, California, USA",(Jim Levenstein's house)
/title/tt0328828/,"Lloyd Klein Boutique - 7415 Beverly Boulevard, Los Angeles, California, USA",(Wedding dress shopping)
/title/tt0328828/,"Long Beach, California, USA",
/title/tt0328828/,"Pasadena, California, USA",
/title/tt7979580/,Paris France,
/title/tt0089885/,"Los Angeles, California, USA",
/title/tt1473832/,"St Lawrence Church, West Wycombe, Buckinghamshire, England, UK",(Church Interior)
/title/tt1473832/,"Windsor Great Park, Windsor, Berkshire, England, UK",(Music Festival)
/title/tt1473832/,"Stoney Street, London, England, UK",(Bridget and Shazza leave for the christening)
/title/tt1473832/,"Paddington, London, England, UK",(studio) (Hard News studios and offices)
/title/tt1473832/,"Albert Bridge Road, Battersea, London, England, UK",(Mark and Jack start carrying Bridget to the hospital)
/title/tt1473832/,"Middle Temple Lane, Temple, London, England, UK",(Lane leading to Mark Darcy's Chambers)
/title/tt1486834/,"Stag's Head - Dame Court, Dublin, County Dublin, Ireland",
/title/tt1486834/,"Dublin, County Dublin, Ireland",
/title/tt1486834/,"George Street Diner, 129 George Street, Toronto, Ontario, Canada",(where Chantry asked Wallace to meet up)
/title/tt0091223/,"Mount St. Mary's College, Doheny Mansion - 10 Chester Pl, Los Angeles, California, USA",
/title/tt0066626/,"Studio 41, CBS Television City - 7800 Beverly Boulevard, Fairfax, Los Angeles, California, USA",
/title/tt0139699/,"Georgetown, Texas, USA",
/title/tt0139699/,"Elgin, Texas, USA",
/title/tt0139699/,"1002 W. 2nd Street, Elgin, Texas, USA",(West Canaan High School)
/title/tt0139699/,"CR 456 bridge over Brushy Creek, Coupland, Texas, USA",(Bridge)
/title/tt8304608/,"New York, USA",
/title/tt0306047/,"Lions Gate Film Studios, Vancouver, British Columbia, Canada",(studio)
/title/tt0306047/,"North Shore Studios, North Vancouver, British Columbia, Canada",(studio)
/title/tt0306047/,"West Broadway & Blanca, Vancouver, British Columbia, Canada",
/title/tt0112095/,"Sunset Gower Studios - 1438 N. Gower Street, Hollywood, Los Angeles, California, USA",
/title/tt0112281/,"Berkeley County, South Carolina, USA",
/title/tt0112281/,"British Columbia, Canada",
/title/tt0112281/,"San Antonio, Texas, USA",
/title/tt0112281/,"777 Ranch - 1829 County Road 432, Hondo, Texas, USA",
/title/tt0112281/,"Camp Waldemar - 1005 Ranch Road 1340, Hunt, Texas, USA",
/title/tt0112281/,"Kerrville, Texas, USA",
/title/tt0112281/,"Texas, USA",
/title/tt2205697/,"Wilmington, North Carolina, USA",
/title/tt2205697/,"Wrightsville Beach, North Carolina, USA",
/title/tt6398232/,"New Orleans, Louisiana, USA",
/title/tt4651410/,"Institute For Marine Mammal Studies, 10801 Dolphin Ln, Gulfport, Mississippi, USA",(Where Jenna works)
/title/tt1204975/,"Neon Museum - 770 Las Vegas Boulevard North, Las Vegas, Nevada, USA",(Neon Sign Graveyard)
/title/tt1204975/,"Stratosphere Hotel & Casino - 2000 Las Vegas Boulevard South, Las Vegas, Nevada, USA",(roller coaster ride)
/title/tt0424095/,"California, USA",
/title/tt0493405/,"Echo Park, Los Angeles, California, USA",(Garage)
/title/tt0493405/,"Hollywood, Los Angeles, California, USA",(Freeway)
/title/tt0493405/,"Tommy's Burgers - 2575 W. Beverly Blvd, Los Angeles, California, USA",
/title/tt0493405/,"Interstate 105, El Segundo, California, USA",(Freeway scene with speeder)
/title/tt0493405/,"Riverside Dr, Los Angeles, California, USA",(street scenes)
/title/tt0493405/,"Elysian Park, Los Angeles, California, USA",(street scenes)
/title/tt0493405/,"4th Street Bridge, Los Angeles, California, USA",(SWAT vehicle confrontation)
/title/tt0493405/,"California City, California, USA",
/title/tt0493405/,"Academy Rd, Los Angeles, California, USA",(street scenes)
/title/tt0243736/,"Vancouver, British Columbia, Canada",
/title/tt0243736/,"The Bridge Studios, Burnaby, British Columbia, Canada",
/title/tt0243736/,"Cole St, San Francisco, California, USA",(opening sequence)
/title/tt0243736/,"Spear St, San Francisco, California, USA",(street scenes)
/title/tt0243736/,"1945 22nd St, San Francisco, California, USA",(Matt's house)
/title/tt0243736/,"Crepes On Cole - 100 Carl St, San Francisco, California, USA",
/title/tt0243736/,"SF MUNI, Presidio Division - 949 Presidio Ave, San Francisco, California, USA",
/title/tt0243736/,"De Haro St. & 22nd St., San Francisco, California, USA","(Character's Apartment, South-East corner)"
/title/tt0086856/,"Firestone Rubber Plant - 2323 E. Firestone Blvd., South Gate, California, USA",(Yoyodyne/The Pitt)
/title/tt0086856/,"Rocky Oaks Park - 31500 Mulholland Highway, Malibu, California, USA",(crash site)
/title/tt0086856/,"Biltmore Hotel - 506 S. Grand Avenue, Downtown, Los Angeles, California, USA",(Hotel)
/title/tt0086856/,"Sepulveda Dam, Encino, Los Angeles, California, USA",
/title/tt0086856/,"UCLA Bio-Medical - 900 Veterans Avenue, Westwood, Los Angeles, California, USA",(Banzai Institute Interiors)
/title/tt0086856/,"609 E Channel Rd, Santa Monica, California, USA",(Banzai Institute Front Gate)
/title/tt0086856/,"Alpha Tubing - 2730 E. 37th Street, Vernon, California, USA",(Prof. Hikita's lab 1938)
/title/tt0086856/,"DWP Harbor Plant - 161 N. Island Avenue, Wilmington, Los Angeles, California, USA",(Yoyodyne shock tower)
/title/tt0086856/,"Mount Hollywood Dr Tunnel, Los Angeles, California, USA",(Buckaroo exits tunnel on motorcycle)
/title/tt0276751/,"London Zoo, Regent's Park, London, England, UK",
/title/tt0276751/,"HMV Oxford Circus, Oxford Street, London, England, UK",
/title/tt0276751/,"Woodbridge Chapel, 5 Hayward's Pl, London, England, UK",(SPATs meeting)
/title/tt0276751/,"Kentish Town, London, England, UK",
/title/tt0276751/,"West Hill Primary School - 5 Merton Road, Wandsworth, London, England, UK",(Marcus' School)
/title/tt0276751/,"215 Sutherland Ave, Maida Vale, London, England, UK",(Restaurant where Will breaks up with various women)
/title/tt0276751/,"1 St Stephen's Crescent, Notting Hill, London, England, UK",(Rachel's house)
/title/tt0276751/,"BFI IMAX Cinema, Charlie Chaplin Walk, South Bank, Lambeth, London, England, UK",
/title/tt0276751/,"Hakkasan Restaurant, Hanway Place, Fitzrovia, London, England, UK",
/title/tt0276751/,"London, England, UK",
/title/tt0276751/,"Regent's Park, London, England, UK",
/title/tt0276751/,"Scotswood Street, Islington, London, England, UK",(when Marcus is following Will)
/title/tt3874544/,"Universal City, California, USA",(DreamWorks)
/title/tt0838221/,"Udaipur, Rajasthan, India",
/title/tt0838221/,India,
/title/tt0838221/,USA,
/title/tt0095159/,"Roehampton Church School, Wandsworth, London, England, UK",(prison scenes)
/title/tt0095159/,"Docklands, Poplar, London, England, UK",
/title/tt0095159/,"Onslow Gardens, Kensington, London, England, UK",(Mrs. Coady's house)
/title/tt0095159/,"The Old Court Room, Oxford Town Hall, St Aldate's, Oxford, Oxfordshire, England, UK",(as The Old Bailey)
/title/tt0095159/,"The Mount, Esher, Surrey, England, UK",(Archie's house)
/title/tt0095159/,"Robert's Place, London, England, UK",(Changing car exterior scene)
/title/tt0095159/,"Hatton Garden, Clerkenwell, London, England, UK",(robbery scene)
/title/tt0095159/,"London Heathrow Airport, London Borough of Hillingdon, London, England, UK",
/title/tt0095159/,"Oxford Prison, New Road, Oxford, Oxfordshire, England, UK",
/title/tt0095159/,"Silvermere Haven, Byfleet Road, Cobham, Surrey, England, UK",(The pet cemetery)
/title/tt0095159/,"New Concordia Wharf, Mill Street, London, England, UK",(Archie's bachelor pad)
/title/tt0109254/,"Knott's Berry Farm, Buena Park, California, USA",(location)
/title/tt0109254/,"Tunnel beneath the 6th Street Viaduct, Downtown, Los Angeles, California, USA",
/title/tt0109254/,"Rodeo Drive, Beverly Hills, California, USA",
/title/tt0109254/,"Biltmore Hotel - 506 S. Grand Avenue, Downtown, Los Angeles, California, USA",(Private Security Agents Convention)
/title/tt0109254/,"Regent Beverly Wilshire Hotel - 9500 Wilshire Blvd., Beverly Hills, California, USA",
/title/tt0109254/,"Santa Monica Pier, Santa Monica, California, USA",(Suspicious Truck)
/title/tt0178737/,"St Austell, Cornwall, England, UK",
/title/tt0178737/,"Lulworth Cove, Weymouth, Dorset, England, UK",
/title/tt0178737/,"Osterley Park House, Isleworth, Middlesex, England, UK",
/title/tt0178737/,"Kenwood House, Hampstead Heath, Hampstead, London, England, UK",
/title/tt8518136/,"Old Bethpage, New York, USA",
/title/tt0787475/,"Cloverdale, Surrey, British Columbia, Canada",
/title/tt0787475/,"Greenaway Pool, Cloverdale, British Columbia, Canada",(Parkdale Public Pool)
/title/tt0787475/,"Buntzen Lake, Anmore, British Columbia, Canada",(beach scenes)
/title/tt0787475/,"Burnaby North Secondary School, Burnaby, British Columbia, Canada",
/title/tt0787475/,Canada,
/title/tt8045468/,"Ontario, Canada",
/title/tt2503944/,"Blythe House, 23 Blythe Road, West Kensington, London, England, UK",
/title/tt2503944/,"Al Enam Restaurant, London, England, UK",(UK)
/title/tt2503944/,"Ealing Studios, Ealing, London, England, UK",(Adam's kitchen set)
/title/tt2503944/,UK,
/title/tt2503944/,"Leicester Square, London, England, UK",(Start of chase scene with Michel outside Burger King)
/title/tt0101050/,"KTTV/Fox Television Center - 5746 W. Sunset Blvd., Hollywood, Los Angeles, California, USA",(studio)
/title/tt1204342/,"El Capitan Theatre - 6838 Hollywood Blvd., Hollywood, Los Angeles, California, USA",(Muppet Theater exterior and outer lobby)
/title/tt1204342/,"The Jim Henson Company - 1416 N. La Brea Avenue, Hollywood, Los Angeles, California, USA",(studio) (Muppet Studios)
/title/tt1204342/,"Pink's Hot Dogs - 709 N. La Brea Blvd., Los Angeles, California, USA",(Exterior street scenes)
/title/tt1204342/,"Stage 28, Universal Studios - 100 Universal City Plaza, Universal City, California, USA",(Muppet Theater interiors)
/title/tt1204342/,"Old Westbury Gardens - 71 Old Westbury Road, Old Westbury, Long Island, New York, USA",(exterior of Tex Richman's mansion)
/title/tt1204342/,"Lincoln, California, USA",(driving montage; desert)
/title/tt1204342/,"Las Vegas, Nevada, USA",
/title/tt1204342/,"Glendale, California, USA",
/title/tt1204342/,"Greystone Park & Mansion - 905 Loma Vista Drive, Beverly Hills, California, USA",(interior of Kermit's mansion)
/title/tt1204342/,"Los Angeles Theatre - 615 S. Broadway, Downtown, Los Angeles, California, USA",(Muppet Theater inner lobby)
/title/tt1204342/,"Pasadena, California, USA",
/title/tt1204342/,"Donner Summit, California, USA",(driving montage; snowy mountains)
/title/tt1204342/,"Stage 27, Universal Studios - 100 Universal City Plaza, Universal City, California, USA",
/title/tt1204342/,"Craven Estate - 430 Madeline Avenue, Pasadena, California, USA",(interior)
/title/tt2024432/,"The Colonnade Restaurant, 1879 Cheshire Bridge Rd, Atlanta, Georgia, USA",(Colonnade Restaurant)
/title/tt2024432/,"Cheshire Motor Inn, 1865 Cheshire Bridge Rd, Atlanta, Georgia, USA",(Foxxhole Bar)
/title/tt2024432/,"Atlanta, Georgia, USA",
/title/tt2024432/,"Conyers, Georgia, USA","(Olde Town Conyers, Costley Mill Road)"
/title/tt2024432/,"191 Peachtree Street, Atlanta, Georgia, USA",(1st office lobby)
/title/tt0089791/,"1848 Oxley St., South Pasadena, California, USA",(Pee-wee's house)
/title/tt0089791/,"3rd Street Promenade, Santa Monica, California, USA",(outdoor mall scenes)
/title/tt0089791/,"22000-23000 Sierra Highway, Newhall, California, USA",(Mickey driving away with Pee Wee)
/title/tt0089791/,"Columbia/Warner Bros. Ranch - 411 North Hollywood Way, Burbank, California, USA",
/title/tt0089791/,"North Hollywood Park, North Hollywood, Los Angeles, California, USA",(Pee Wee riding his bicycle on his way to Mario's Magic Shop)
/title/tt0089791/,"Hennesy Street, Warner Brothers Burbank Studios - 4000 Warner Boulevard, Burbank, California, USA",
/title/tt0089791/,"Oxnard, California, USA",(Andy chasing Pee Wee onto train & Pee Wee jumping off train)
/title/tt0089791/,"The Old Road, Newhall, California, USA",(Hitch-hiking scenes with Mickey)
/title/tt0089791/,"Cabazon Dinosaurs- 50770 Seminole Dr, Cabazon, California, USA",(Dinosaurs) (exterior shots)
/title/tt0089791/,"Glendale Grand Central Air Terminal - Grandview Avenue, Glendale, California, USA",(Bus Terminal scene)
/title/tt0089791/,"Stage 21, Warner Brothers Burbank Studios - 4000 Warner Boulevard, Burbank, California, USA",
/title/tt0089791/,"Warner Brothers Burbank Studios - 4000 Warner Boulevard, Burbank, California, USA",(studio)
/title/tt0107050/,"Red Wing, Minnesota, USA",(scenic overlook)
/title/tt0107050/,"Center City, Minnesota, USA",(church)
/title/tt0107050/,"Stillwater, Minnesota, USA",
/title/tt0107050/,"Paisley Park Studios - 7801 Audubon Road, Chanhassen, Minnesota, USA",(studio)
/title/tt0107050/,"Hyacinth Avenue E & Frank Street, St. Paul, Minnesota, USA",
/title/tt0107050/,"St. Paul, Minnesota, USA",
/title/tt0107050/,USA,
/title/tt0107050/,"1137 Hyacinth Avenue, East St. Paul, Minnesota, USA",(Max Goldman's House)
/title/tt0107050/,"Lake Rebecca Park Reserve, 9831 Rebecca Park Trail, Rockford, Minnesota, USA",(Chuck's Bait Shop)
/title/tt0327137/,"Austin, Texas, USA",
/title/tt0327137/,"Austin Studios - 1901 E. 51st Street, Austin, Texas, USA",(studio)
/title/tt0327137/,"Cele Store - 18726 Cameron Road, Manor, Texas, USA",(Bar fight scene)
/title/tt1336608/,"Hollywood, Florida, USA",(beach boardwalk)
/title/tt1336608/,"Chapel of the Ancient Spanish Monastery, North Miami Beach, FL 33160, USA",(Catherine Zeta-Jones dance sequence)
/title/tt0096320/,"323 11th St, Santa Monica, California, USA",(Vincent's house)
/title/tt0096320/,"Rio Grande Gorge Bridge, Taos, New Mexico, USA",
/title/tt0096320/,"Marineland of the Pacific - 6610 Palos Verdes Drive South, Rancho Palos Verdes, California, USA",(Julies Benedict Home on the Island)
/title/tt0096320/,"Donald C. Tillman Water Reclamation Plant - 6100 Woodley Avenue, Van Nuys, Los Angeles, California, USA",(Mr. Webster's Headquarters)
/title/tt0096320/,"Los Alamos, New Mexico, USA",
/title/tt0096320/,"Bradley International Terminal, Los Angeles International Airport - 1 World Way, Los Angeles, California, USA",(airport)
/title/tt0096320/,"Grauman's Chinese Theater - 6925 Hollywood Blvd., Hollywood, Los Angeles, California, USA",
/title/tt0096320/,"3rd Street Promenade, Santa Monica, California, USA",
/title/tt0096320/,"Stage 18, Warner Brothers Burbank Studios - 4000 Warner Boulevard, Burbank, California, USA",
/title/tt0081353/,"Mellieha, Malta",
/title/tt0081353/,"Mediterranean Film Studios, Kalkara, Malta",(studio)
/title/tt0212338/,"364 Port Washington Blvd, Port Washington, NY 11050, USA",(Oyster Bay Drug store.)
/title/tt0212338/,"Greenvale, Long Island, New York, USA",
/title/tt0212338/,"New York City, New York, USA",
/title/tt0212338/,"Pound Ridge, New York, USA",
/title/tt0212338/,"Westchester County Airport, White Plains, New York, USA",
/title/tt0212338/,"Oyster Bay, Long Island, New York, USA",
/title/tt0212338/,"Winnetka, Illinois, USA",
/title/tt0116778/,"Pittsburgh, Pennsylvania, USA",
/title/tt0116778/,"National Bowling Stadium - 300 N. Center Street, Reno, Nevada, USA",
/title/tt0116778/,"Webster, New York, USA",
/title/tt0116778/,"Interstate 80, Reno, Nevada, USA",
/title/tt0096657/,"England, UK",
/title/tt0452594/,"Green Mill - 4802 N. Broadway Avenue, Uptown, Chicago, Illinois, USA",
/title/tt0452594/,"Illinois, USA",
/title/tt0452594/,"Buckingham Fountain, Grant Park, Downtown, Chicago, Illinois, USA",
/title/tt0437954/,"Siena, Tuscany, Italy",
/title/tt0437954/,"Cinecittà Studios, Cinecittà, Rome, Lazio, Italy",(studio)
/title/tt0413267/,"New York City, New York, USA",
/title/tt6311972/,"Sunset Las Palmas Studios - 1040 N Las Palmas Avenue, Hollywood, Los Angeles, California, USA",
/title/tt8816194/,"British Columbia, Canada",
/title/tt2203939/,"New York City, New York, USA",
/title/tt2203939/,"Harrison, New York, USA",(location)
/title/tt0413895/,"Greendale, Victoria, Australia",
/title/tt0413895/,"Hawthorn, Melbourne, Victoria, Australia",
/title/tt0413895/,"Long Beach, California, USA",
/title/tt0413895/,"Spotswood Public School, Spotswood, Victoria, Australia",
/title/tt0413895/,"Melbourne, Victoria, Australia",
/title/tt0413895/,"Bucks County, Pennsylvania, USA",
/title/tt0413895/,"Greendale Farm, Greendale, Victoria, Australia",(farm scenes)
/title/tt3411444/,"Plaza de Toros de Las Ventas, Madrid, Spain",(bullring - inspirated)
/title/tt3411444/,"Estación de Atocha, Madrid, Spain",(train station - inspirated)
/title/tt0429591/,"Sea World, Gold Coast, Queensland, Australia",
/title/tt0429591/,"Great Barrier Reef, Queensland, Australia",
/title/tt0429591/,"Village Roadshow Studios, Oxenford, Queensland, Australia",(studio)
/title/tt0429591/,"Louisiana, USA",
/title/tt3097204/,"Byron Bay, New South Wales, Australia",
/title/tt3097204/,"Ballina Shire, New South Wales, Australia",
/title/tt3097204/,"Arts Factory Lodge, 1 Skinners Shoot Road, Byron Bay, New South Wales, Australia",(the hostel where the lads stay)
/title/tt3097204/,"Circular Quay, Sydney, New South Wales, Australia",
/title/tt3097204/,"Marree, South Australia, Australia",
/title/tt3097204/,"Outback, South Australia, Australia",
/title/tt1408253/,"Los Angeles, California, USA",(Tossed)
/title/tt0327679/,"Ardmore Studios, Herbert Road, Bray, County Wicklow, Ireland",(studio)
/title/tt0327679/,"Powerscourt, County Wicklow, Ireland",
/title/tt0327679/,"Wicklow Town, County Wicklow, Ireland",
/title/tt0077008/,"Los Angeles County Arboretum & Botanic Garden - 301 N. Baldwin Avenue, Arcadia, California, USA",
/title/tt0077008/,"Jungle Set, Warner Brothers Burbank Studios - 4000 Warner Boulevard, Burbank, California, USA",
/title/tt0077008/,"Stage 17, Warner Brothers Burbank Studios - 4000 Warner Boulevard, Burbank, California, USA",
/title/tt0077008/,"Stage 27A, Warner Brothers Burbank Studios - 4000 Warner Boulevard, Burbank, California, USA",
/title/tt0091738/,"Santa Rosa High School, Santa Rosa, California, USA",(Buchanan High School)
/title/tt0091738/,"120 Petaluma Boulevard N, Petaluma, California, USA",(Bodell's Store)
/title/tt0091738/,"Cloverdale Municipal Airport - 220 Airport Road, Cloverdale, California, USA",(airport)
/title/tt0091738/,"Petaluma, California, USA",(street scenes: Peggy and Charlie's hometown)
/title/tt0091738/,"600 Petaluma Boulevard S, Petaluma, California, USA",(Cafe where Peggy meets Michael)
/title/tt0091738/,"226 Liberty Street, Petaluma, California, USA",(Kelcher family house)
/title/tt0091738/,"Santa Rosa, California, USA",(various locations)
/title/tt0109045/,"Mundi Mundi Plains Lookout, Silverton, New South Wales, Australia",
/title/tt0109045/,"Breakaways Reserve, South Australia, Australia",
/title/tt0109045/,"Argent Street, Broken Hill, New South Wales, Australia",
/title/tt0109045/,"Barrett Drive, Alice Springs, Northern Territory, Australia",
/title/tt0109045/,"Central Australia, Australia",
/title/tt0109045/,"Coober Pedy, South Australia, Australia",
/title/tt0109045/,"Erskineville, Sydney, New South Wales, Australia",
/title/tt0109045/,"Lasseter's Casino - Barrett Drive, Alice Springs, Northern Territory, Australia",
/title/tt0109045/,"Moon Plain, South Australia, Australia",
/title/tt0109045/,"New South Wales, Australia",
/title/tt0109045/,"Northern Territory, Australia",
/title/tt0109045/,"Silverton, New South Wales, Australia",
/title/tt0109045/,"Stephen's Creek Hotel, Stephen's Creek, New South Wales, Australia",
/title/tt0109045/,"Sydney Opera House - 2 Macquarie Street, Sydney, New South Wales, Australia",
/title/tt0109045/,"The Castle, The Breakaways, Coober Pedy, South Australia, Australia",(white and yellow rock formation)
/title/tt0109045/,"Underground Motel - Umoona Road, Coober Pedy, South Australia, Australia",
/title/tt0109045/,"The Dog Fence, South Australia, Australia",
/title/tt0257568/,"Outback, South Australia, Australia",
/title/tt0257568/,"Outback, Australia",
/title/tt0257568/,"Brooklyn, New York City, New York, USA",
/title/tt0257568/,"Central Australia, Australia",
/title/tt0257568/,"Fox Studios, Moore Park, Sydney, New South Wales, Australia",(studio)
/title/tt0257568/,"Los Angeles, California, USA",(reshoots)
/title/tt0257568/,"Moon Plain, South Australia, Australia",
/title/tt0257568/,"Northern Territory, Australia",
/title/tt0257568/,"Sydney Opera House - 2 Macquarie Street, Sydney, New South Wales, Australia",
/title/tt1240982/,"Giant's Causeway, County Antrim, Northern Ireland, UK",(Minotaur's Maze)
