Code,Show Name,Location,Scene
/title/tt0272338/,"Claremont, California, USA",
/title/tt0272338/,"Royal Hawaiian Hotel - 2259 Kalakava Avenue, Honolulu, O'ahu, Hawaii, USA",(interior) (poster)
/title/tt0272338/,"San Fernando Valley, Los Angeles, California, USA",
/title/tt0272338/,"Lombardi Apts. - 5633 Topanga Canyon Blvd., Woodland Hills, California, USA",(Barry running through apartment building)
/title/tt0272338/,"California, USA",
/title/tt0272338/,USA,
/title/tt0272338/,"Bank of the West - 19858 Ventura Boulevard, Woodland Hills, Los Angeles, California, USA",(Sanwa Bank)
/title/tt0272338/,"Honolulu International Airport - 300 Rodgers Boulevard, Honolulu, O'ahu, Hawaii, USA",(Hawaii Airport)
/title/tt0272338/,"North Hollywood, Los Angeles, California, USA",
/title/tt0272338/,"Honolulu, O'ahu, Hawaii, USA",
/title/tt0272338/,"Waikiki Beach, Honolulu, O'ahu, Hawaii, USA",
/title/tt1086772/,"Sun City, South Africa",
/title/tt1086772/,"Buford, Georgia, USA",(Dick's Sporting Goods in the Mall of GA)
/title/tt1086772/,"Lawrenceville, Georgia, USA","(Hooters in Lawrenceville, Georgia)"
/title/tt1366344/,"Brooklyn, New York City, New York, USA",
/title/tt1366344/,"The Bronx, New York City, New York, USA",(Noah's Dad's Jewelry Store)
/title/tt0280707/,"Ston Easton Park, Somerset, England, UK",(servants' quarters)
/title/tt0280707/,"Hall Barn, Beaconsfield, Buckinghamshire, England, UK",(Lady Trentham's home / lunch after the hunt scene)
/title/tt0090555/,"Kakadu National Park, Northern Territory, Australia",
/title/tt0090555/,"UDP Falls, Kakadu National Park, Northern Territory, Australia",
/title/tt0090555/,"Northern Territory, Australia",
/title/tt0090555/,"Sydney, New South Wales, Australia",
/title/tt0090555/,"Subway Station Exit, Manhattan Municipal Building, Cnr Chambers & Centre Streets, Manhattan, New York City, New York, USA","(""That's not a knife. This is a knife!"")"
/title/tt0090555/,"5th Avenue, Manhattan, New York City, New York, USA",
/title/tt0090555/,"Columbus Circle Subway, Central Park, Manhattan, New York City, New York, USA",(finale)
/title/tt0090555/,"Disused lower level platforms, 9th Avenue Subway Station, Brooklyn, New York City, New York, USA",
/title/tt0090555/,"Greenwich Village, Manhattan, New York City, New York, USA",
/title/tt0090555/,"Manhattan Municipal Building - 1 Centre Street, Manhattan, New York City, New York, USA",(muggers and big knife)
/title/tt0090555/,"New York City, New York, USA",
/title/tt0090555/,"Astor Place Hairstylists aka Astor Barber, New York City, New York, USA",(Crocodile Dundee goes to see why a crowd has gathered in front of a storefront)
/title/tt3172532/,"Alameda, California, USA","(classroom scenes, Ricky's House scenes)"
/title/tt3172532/,"Golden Gate Park, San Francisco, California, USA",
/title/tt1371150/,"Suffern, New York, USA",(Good Samaritan Hospital)
/title/tt1371150/,"Bellmore, Long Island, New York, USA",(Newbridge Park skating rink)
/title/tt1371150/,"Great Neck, Long Island, New York, USA",(Tennis store)
/title/tt10310140/,"Rutland, Vermont, USA",(Filming location)
/title/tt0129290/,"Biltmore Estate - 1 Approach Road, Asheville, North Carolina, USA",
/title/tt0129290/,"St. Helena, Napa Valley, California, USA",(Funeral Scene)
/title/tt0129290/,"Chapel Hill, North Carolina, USA",(Campus exteriors)
/title/tt0129290/,"Point Richmond, California, USA",
/title/tt0129290/,"University of California, Berkeley, California, USA",(LeConte Hall)
/title/tt8145202/,"Pacific Palisades, Los Angeles, California, USA",
/title/tt8145202/,"Simi Valley, California, USA",
/title/tt8145202/,"Felanitx, Mallorca, Balearic Islands, Spain",
/title/tt8145202/,USA,
/title/tt1068680/,"Griffith Observatory, 2800 E Observatory Rd, Los Angeles, California, USA",
/title/tt1068680/,"Rose Bowl - 1001 Rose Bowl Drive, Pasadena, California, USA",
/title/tt1068680/,"Ontario International Airport - 2900 E. Airport Drive, Ontario, California, USA",(airport)
/title/tt1068680/,"Echo Park, Los Angeles, California, USA",
/title/tt1068680/,"Stage 29, Warner Brothers Burbank Studios - 4000 Warner Boulevard, Burbank, California, USA",
/title/tt1453405/,"Pixar Animation Studios - 1200 Park Avenue, Emeryville, California, USA",
/title/tt3502172/,"New York City, New York, USA",
/title/tt0146402/,USA,
/title/tt0105417/,"Nevada Club, Reno, Nevada, USA",(Casino where Whoopi Goldberg is performing)
/title/tt0105417/,"Ambassador Hotel - 3400 Wilshire Boulevard, Los Angeles, California, USA",
/title/tt0105417/,"San Francisco, California, USA",
/title/tt0105417/,"Club Cal Neva, Reno, Nevada, USA",(Casino visible outside Whoopi Goldberg's Apartment window)
/title/tt0105417/,"St. Paul's Methodist Church -1660 Grandview Avenue, Reno, Nevada, USA",
/title/tt0105417/,"Candlestick Park - 602 Jamestown Avenue, San Francisco, California, USA",
/title/tt0105417/,"Melander Architects, 1679 Church, San Francisco, California, USA",(Pawn Shop)
/title/tt0105417/,"California, USA",
/title/tt2823054/,"Turtle Bay Resort - 57-091 Kamehameha Highway, Kahuku, O'ahu, Hawaii, USA",
/title/tt2823054/,"Kualoa Ranch, O'ahu, Hawaii, USA",
/title/tt2823054/,"Kualoa Ranch - 49560 Kamehameha Highway, Ka'a'awa, O'ahu, Hawaii, USA",
/title/tt2823054/,"Oahu, Hawaii, USA",
/title/tt2823054/,"O'ahu, Hawaii, USA",
/title/tt2823054/,"Kahuku, North Shore, O'ahu, Hawaii, USA",
/title/tt2823054/,"Kamehameha Highway, Lä'ie, O'ahu, Hawaii, USA",
/title/tt2823054/,"Honolulu, O'ahu, Hawaii, USA",
/title/tt2823054/,"Honolulu, Oahu, Hawaii, USA",
/title/tt1598822/,"New York City, New York, USA",
/title/tt1598822/,"Alice Tully Hall, 1941 Broadway, Lincoln Center, Lincoln Center, Manhattan, New York City, New York, USA",(Morgan Stanley Lobby)
/title/tt1598822/,"Queens Museum of Art, Flushing Meadows, Corona Park, Queens, New York City, New York, USA",(second unit exterior)
/title/tt1598822/,"Silvercup Studios - 4222 22nd Street, Long Island City, Queens, New York City, New York, USA",(hospital scenes)
/title/tt0322330/,"3rd Street Promenade, Santa Monica, California, USA",
/title/tt0322330/,"House of Blues - 8430 Sunset Blvd., West Hollywood, California, USA",
/title/tt0322330/,"Los Angeles, California, USA",
/title/tt0322330/,"Santa Monica, California, USA",
/title/tt1987680/,"Black Bass Hotel, Lumberville, Pennsylvania, USA",(on location)
/title/tt1987680/,"The Kimmel Center, Philadelphia, Pennsylvania, USA",(location)
/title/tt1987680/,"East Allegheny Avenue, Philadelphia, Pennsylvania, USA",(street scenes)
/title/tt1987680/,"Center for Architecture and Design, Philadelphia, Pennsylvania, USA",(location)
/title/tt1987680/,"1900 JFK Boulevard, Philadelphia, Pennsylvania, USA",(street scenes)
/title/tt0094137/,"Central Park, Manhattan, New York City, New York, USA",
/title/tt0094137/,"Royal Alexandra Theatre, Toronto, Ontario, Canada",(Theatre where Jack is rehearsing)
/title/tt2268016/,"Savannah, Georgia, USA",(Savannah International Trade & Convention Center - Stripper Convention Interiors)
/title/tt2268016/,"Darien, Georgia, USA",(Friendly Express #74 - Ritchie's mini-mart strip scene)
/title/tt2268016/,"Savannah, Georgia, USA",(10 Whitaker Street) (downtown Tampa scenes)
/title/tt2268016/,"Savannah, Georgia, USA",(Savannah Technical College) (hospital scene)
/title/tt0852713/,"Royce Hall - 340 Royce Drive, UCLA, Westwood, Los Angeles, California, USA",
/title/tt0852713/,"The Pink Motel & Cadillac Jack's Diner, 9457 San Fernando Road, Sun Valley, California, USA",(photo shoot)
/title/tt0852713/,"Los Angeles, California, USA",
/title/tt0852713/,"Westwood, Los Angeles, California, USA",
/title/tt0852713/,"California, USA",
/title/tt3165612/,USA,
/title/tt1255919/,"Shepperton Studios, Studios Road, Shepperton, Surrey, England, UK",
/title/tt0097758/,"Burbank California, USA",
/title/tt0097758/,"1519 Chestnut Street, Wilmington, North Carolina, USA",(Stevenson house)
/title/tt0097758/,"109 N 15th Avenue, Wilmington, North Carolina, USA",(interior of kids houses where Maurice and Brian wreak havoc)
/title/tt0097758/,"Screen Gems Studios - 1223 North 23rd Street, Wilmington, North Carolina, USA",(studio)
/title/tt0097758/,"Stage 7, Screen Gems Studios - 1223 North 23rd Street, Wilmington, North Carolina, USA",(Boy's underworld room)
/title/tt0097758/,"Winter Park Elementary School - 204 MacMillan Avenue, Wilmington, North Carolina, USA",(Ronny wonders who urinated in his apple juice)
/title/tt0097758/,"Shell Island Resort Hotel - 2700 N. Lumina Avenue, Wrightsville Beach, North Carolina, USA",(Malibu)
/title/tt1950235/,"Millbrook, Ontario, Canada",
/title/tt1950235/,"Ontario, Canada",
/title/tt1950235/,"Chicago Illinois, USA",(street scenes)
/title/tt1528071/,"Squamish, British Columbia, Canada",
/title/tt1528071/,"Mission, British Columbia, Canada",
/title/tt1528071/,"British Columbia, Canada",
/title/tt0095631/,"Miami, Arizona, USA",
/title/tt0095631/,"Cameron, Arizona, USA","(Channing, plane chase scene)"
/title/tt0095631/,"Casa Grande, Arizona, USA",
/title/tt0095631/,"Cottonwood, Arizona, USA",
/title/tt0095631/,"Globe, Arizona, USA",
/title/tt0095631/,"Sedona, Arizona, USA",
/title/tt0095631/,"Chicago, Illinois, USA",
/title/tt0095631/,"Grand Central Station, Manhattan, New York City, New York, USA",
/title/tt0095631/,"McCarran International Airport - 5757 Wayne Newton Boulevard, Las Vegas, Nevada, USA",
/title/tt0095631/,"Los Angeles, California, USA",
/title/tt0095631/,"Grand Central Market - 317 S. Broadway, Downtown, Los Angeles, California, USA",
/title/tt0109445/,"Postens Funeral Home - 59 East Lincoln Avenue, Atlantic Highlands, New Jersey, USA",(Undertaker)
/title/tt0109445/,"RST Video - 60 Leonard Avenue, Leonardo, New Jersey, USA",(Video Store)
/title/tt0109445/,"Atlantic Highlands, New Jersey, USA",
/title/tt0109445/,"Middletown, New Jersey, USA",
/title/tt0109445/,"New Jersey, USA",
/title/tt0109707/,"Hollywood Sign, Hollywood Hills, Los Angeles, California, USA",
/title/tt0109707/,"Alverno High School - 200 North Michillinda Avenue, Sierra Madre, California, USA",
/title/tt0109707/,"Boardner's of Hollywood - 1652 North Cherokee Avenue, Hollywood, Los Angeles, California, USA",
/title/tt0109707/,"Eagle Rock, Los Angeles, California, USA",
/title/tt0109707/,"Hollywood, Los Angeles, California, USA",
/title/tt0109707/,"Los Angeles, California, USA",
/title/tt0109707/,"Orpheum Theater - 842 South Broadway, Downtown, Los Angeles, California, USA",
/title/tt0109707/,"Torrance, California, USA",
/title/tt0109707/,USA,
/title/tt5761496/,"Los Angeles, California, USA",
/title/tt0817230/,"The Original Los Angeles Flower Market - 754 Wall St, Los Angeles, California, USA",
/title/tt0817230/,"22432 Pacific Coast Hwy., Malibu, California, USA",(Sean Jackson's house on the beach)
/title/tt0817230/,"Santa Monica, California, USA",
/title/tt0817230/,"Venice, Los Angeles, California, USA",
/title/tt0817230/,"3100 Magnolia Blvd, Burbank, California, USA",(Sienna Bouquet)
/title/tt0817230/,"Burbank, California, USA",
/title/tt0817230/,"Malibu, California, USA",
/title/tt0783234/,"Cardiff, South Glamorgan, Wales, UK",
/title/tt0783234/,"South Wales, Wales, UK",
/title/tt1412386/,"Royal Castle Kanota, Kanota Bagh, Jaipur, Rajasthan, India",(used as the Viceroy Club)
/title/tt1412386/,"Stansted Airport, Essex, England, UK",
/title/tt8526872/,"Mount Hollywood Drive, Los Angeles, California, USA",(Cadillac car chase and explosion)
/title/tt8526872/,"1949 Buckingham Road, Los Angeles, California, USA",(Dolemite's House - Exteriors)
/title/tt0058815/,"Columbia/Sunset Gower Studios - 1438 N. Gower Street, Hollywood, Los Angeles, California, USA",
/title/tt0084805/,"Hurley Mountain Inn, Hurley, New York, USA",(bar scene)
/title/tt0084805/,"Russian Tea Room - 150 W. 57th Street, Manhattan, New York City, New York, USA",
/title/tt1583607/,"Stage 19 - CBS Studio Center, 4024 Radford Avenue, Studio City, Los Angeles, California, USA",
/title/tt0101587/,"Durango, Colorado, USA",
/title/tt0101587/,"Roosevelt Island Tram, Roosevelt Island, New York City, New York, USA",
/title/tt0101587/,"Abiquiu, New Mexico, USA",
/title/tt0101587/,"Plaza Blanca, Abiquiu, New Mexico, USA",
/title/tt0101587/,"Bradley International Terminal, Los Angeles International Airport - 1 World Way, Los Angeles, California, USA",
/title/tt0101587/,"Garson Studios, College of Santa Fe - 1600 Saint Michaels Drive, Santa Fe, New Mexico, USA","(studio) (filmed at) (as Garson Studios, Santa Fe, New Mexico)"
/title/tt0101587/,"Culver Studios - 9336 W. Washington Blvd., Culver City, California, USA","(studio) (filmed at) (as Culver Studios, Culver City, California)"
/title/tt0101587/,"Universal Studios - 100 Universal City Plaza, Universal City, California, USA","(studio) (filmed at) (as Universal Studios, Universal City, California)"
/title/tt1490017/,"New York City, New York, USA",
/title/tt0075592/,"Holt, Norfolk, England, UK",
/title/tt0075592/,"Paris, France",
/title/tt5304992/,"Yankee Stadium - E. 161st Street & River Avenue, Bronx, New York City, New York, USA",
/title/tt0098384/,"Natchitoches, Louisiana, USA",
/title/tt0098384/,USA,
/title/tt0368975/,"Los Angeles, California, USA",
/title/tt0108981/,"BBC Television Centre, Wood Lane, Shepherd's Bush, London, England, UK",(Dibley Interiors)
/title/tt0467421/,"Toronto, Ontario, Canada",
/title/tt0069602/,"Higgin Brigg, Holmfirth, West Yorkshire, England, UK",(Sid's café)
/title/tt0069602/,"The White Horse, Jackson Bridge, Holmfirth, West Yorkshire, England, UK",
/title/tt0069602/,"West Yorkshire, England, UK",
/title/tt2404311/,"Orne, France",
/title/tt2404311/,"Le Sap, Orne, France",
/title/tt2404311/,"L'Aigle, Orne, France",
/title/tt1077258/,"Austin, Texas, USA",
/title/tt1077258/,"Texas, USA",
/title/tt1077258/,"Williamson County Texas, USA",(Historic Jail)
/title/tt0119303/,"Evanston, Illinois, USA",(Normandy Place)
/title/tt0119303/,"3025 Normandy Place, Evanston, Illinois, USA",(Mrs. Hess's house)
/title/tt0119303/,"Haven Middle School - 2417 Prairie Avenue, Evanston, Illinois, USA",
/title/tt0119303/,"Calumet River, South Deering, Chicago, Illinois, USA",
/title/tt0119303/,"4747 West Dempster Street, Skokie, Illinois, USA",(Illinois Federal Trust)
/title/tt0119303/,"3450 W. Touhy Avenue, Skokie, Illinois, USA",
/title/tt0119303/,"Chicago, Illinois, USA",
/title/tt5247022/,"Queens, New York, USA","(Shades Bar, where Paterson goes every night for a beer)"
/title/tt5247022/,"Yonkers, New York, USA",(Paterson's house)
/title/tt5247022/,"Lou Costello Statue, Cianci Park, Ellison Street, Paterson, New Jersey, USA",(bus route)
/title/tt5247022/,"Ward Street, Paterson, New Jersey, USA",(bus route)
/title/tt5247022/,"New Jersey, USA",
/title/tt5247022/,"New York, USA",
/title/tt0107131/,"Bend, Oregon, USA",
/title/tt0107131/,"Mount Hood National Forest, Oregon, USA",
/title/tt0107131/,"Eagle Cap Wilderness Area, Oregon, USA",
/title/tt0107131/,"Joseph, Oregon, USA",
/title/tt0107131/,"Sahalie Falls, Oregon, USA",(Sassy goes over the waterfall)
/title/tt0107131/,"Wahclella Falls, Oregon, USA",(they find the little girl)
/title/tt0107131/,"Benham Falls, Oregon, USA",(Sassy caught in the rapids)
/title/tt0107131/,"Mount Howard, Oregon, USA","(""Where's the house?"" scene)"
/title/tt0107131/,"Smith Rock State Park, Oregon, USA",(introduction of the mountain lion)
/title/tt0107131/,"San Francisco, California, USA",(establishing shot of San Francisco)
/title/tt0107131/,"3501 N Michigan Avenue, Portland, Oregon, USA",(the family's temporary house)
/title/tt0107131/,"5402 SE 37th Avenue, Portland, Oregon, USA",(the family's house)
/title/tt0107131/,"Metropolitan Learning Center - 2033 NW Glisan Street, Portland, Oregon, USA",(interior of kids' school)
/title/tt1958961/,"Rio de Janeiro, Brazil",
/title/tt1958961/,"Oslo, Norway",
/title/tt4380324/,"Warkworth, New Zealand",(Town of Weld)
/title/tt4380324/,"Sydney, New South Wales, Australia",
/title/tt4380324/,"11 Elizabeth St, Warkworth, New Zealand",(Weld Super Store)
/title/tt4380324/,"548 West Coast Road, Oratia, Auckland, New Zealand",(Weld Service Station)
/title/tt0114682/,"Jersey City, New Jersey, USA",(Canton Restaurant)
/title/tt0114682/,"Loma, Nebraska, USA",
/title/tt0114682/,"Hooper, Nebraska, USA",
/title/tt0114682/,"Webster Hall, 125 E 11th St, New York City, New York, USA",
/title/tt0114682/,"Montclair, New Jersey, USA",
/title/tt0114682/,"Monument Valley, Utah, USA",
/title/tt0114682/,"Silver Lake Country Club, Atlanta, Georgia, USA",
/title/tt0114682/,"Rt. 218, Highland Falls, New York, USA",
/title/tt0114682/,"West Point, New York, USA",
/title/tt0114682/,"New Jersey, USA",
/title/tt0120891/,"Pierce, Idaho, USA",
/title/tt0120891/,"Coal Mine Canyon, Tuba City, Arizona, USA",
/title/tt0120891/,"Santa Clarita, California, USA",
/title/tt0120891/,"Lake Piru, California, USA",
/title/tt0120891/,"Santa Fe, New Mexico, USA",
/title/tt0120891/,"Amado, Arizona, USA",
/title/tt0120891/,"Lake Balboa Park - 6300 Balboa Blvd, Van Nuys, California, USA",
/title/tt0120891/,"Cook Ranch, Galisteo, New Mexico, USA",
/title/tt0120891/,"Stage 19, Warner Brothers Burbank Studios - 4000 Warner Boulevard, Burbank, California, USA",
/title/tt0120891/,"Stage 21, Warner Brothers Burbank Studios - 4000 Warner Boulevard, Burbank, California, USA",
/title/tt0120891/,"Stage 23, Warner Brothers Burbank Studios - 4000 Warner Boulevard, Burbank, California, USA",
/title/tt0120891/,"Tucson Mountains, Arizona, USA",
/title/tt0079470/,"El Hadj, Tunisia",(ending scenes - landscape - crucifixion)
/title/tt0079470/,"Kasbah of Sousse, Sousse, Tunisia",(walls of the city)
/title/tt0079470/,Tunisia,(Holy Land)
/title/tt0079470/,"Sousse, Tunisia",
/title/tt0205000/,"Los Angeles, California, USA",
/title/tt0205000/,"1329 Carroll Avenue, Central Los Angeles, Los Angeles, California, USA",
/title/tt0205000/,"Echo Park, Los Angeles, California, USA",
/title/tt0120655/,"Pittsburgh International Airport, Pittsburgh, Pennsylvania, USA",(Listed as General Mitchell Airport in the movie)
/title/tt0120655/,"Grand Concourse Restaurant - 100 W. Station Square Drive, Pittsburgh, Pennsylvania, USA",(restaurant)
/title/tt0120655/,"Highlands, New Jersey, USA",(scene outside of the bar)
/title/tt0120655/,"New Kensington, Pennsylvania, USA",
/title/tt0120655/,"Pittsburgh, Pennsylvania, USA",
/title/tt0120655/,"Franklin Inn Mexican Restaurant Franklin Park, Pittsburgh, Pennsylvania, USA",(Mexican Restaurant)
/title/tt0120655/,"Los Angeles, California, USA",
/title/tt0120655/,"Burger King - 3210 Banksville Rd, Pittsburgh, Pennsylvania, USA",(Mooby's Fast Food Restaurant)
/title/tt1634122/,"Hawley Woods, Farnborough, Hampshire, England, UK",(cable car station)
/title/tt1634122/,"Macau, China",
/title/tt1634122/,France,
/title/tt1634122/,"Brocket Hall, Lemsford, Welwyn Garden City, Hertfordshire, England, UK",
/title/tt0098554/,"Evanston, Illinois, USA",
/title/tt0098554/,"New Trier High School - 385 Winnetka Avenue, Winnetka, Illinois, USA",
/title/tt0098554/,"Northbrook, Illinois, USA",
/title/tt0098554/,"Chicago, Illinois, USA",
/title/tt0098554/,"Winnetka, Illinois, USA",
/title/tt0098554/,"Lake Geneva, Wisconsin, USA",
/title/tt0098554/,"Winnetka Bank - Elm St. & Greenbay Rd., Winnetka, Illinois, USA",
/title/tt0098554/,"495 North Milwaukee Avenue, Chicago, Illinois, USA",(Pub scene)
/title/tt0098554/,"Palace Bowl - 5242 W. 25th Street, Cicero, Illinois, USA",(Bowling alley scenes)
/title/tt0098554/,"Lake Forest, Illinois, USA",
/title/tt0098554/,USA,
/title/tt1714915/,"Tangier, Morocco",
/title/tt1714915/,"82 Alfred Street, Detroit, Michigan, USA",(Adam's mansion)
/title/tt1714915/,"Michigan Theater - 238 Bagley Street, Detroit, Michigan, USA",(Abandoned theatre)
/title/tt1714915/,Morocco,
/title/tt1714915/,USA,
/title/tt0107977/,"Rancho Maria - 25933 Sand Canyon Road, Santa Clarita, California, USA",(ranch location)
/title/tt0107977/,"Santa Clarita, California, USA",
/title/tt0107653/,"England, UK",
/title/tt0055662/,"750 Bel Air Road, Bel Air, Los Angeles, California, USA",(exterior: Beverly Hillbillies mansion)
/title/tt0055662/,"General Service Studios - 1040 N. Las Palmas, Hollywood, Los Angeles, California, USA",
/title/tt0055662/,"Los Angeles, California, USA",
/title/tt1116186/,"Panorama City, Los Angeles, California, USA",
/title/tt0456554/,"Los Angeles, California, USA",
/title/tt0116000/,"Northfield, Minnesota, USA",
/title/tt0116000/,"Blake School - 511 Kenwood Parkway, Minneapolis, Minnesota, USA",
/title/tt0116000/,"Carleton College - One North College Street, Northfield, Minnesota, USA",
/title/tt0116000/,"Columbia Arena 7011 University Ave NE Fridley, Minnesota, USA",(Eden Hall Academy Ice Rink)
/title/tt0116000/,"Irvine Park, St. Paul, Minnesota, USA",
/title/tt0116000/,"Minnehaha Falls, Minneapolis, Minnesota, USA",
/title/tt0116000/,"Summit Hill, St. Paul, Minnesota, USA",
/title/tt0101889/,"Manhattan Bridge, New York City, New York, USA",
/title/tt0101889/,"101 Park Avenue, Manhattan, New York City, New York, USA",
/title/tt0101889/,"15 Ann Street, Manhattan, New York City, New York, USA",(Anne's video shop)
/title/tt0101889/,"Metropolitan Life Tower - 11 Madison Avenue, Manhattan, New York City, New York, USA",(building where Lydia works)
/title/tt0101889/,"Los Angeles, California, USA",
/title/tt0101889/,"146 W. 57th Street, Manhattan, New York City, New York, USA",(Jack Lucas' apartment)
/title/tt0101889/,"294 Fifth Avenue, Manhattan, New York City, New York, USA",(Lydia is eating chinese food here as Parry watches.)
/title/tt0101889/,"157 W. 80th Street, Manhattan, New York City, New York, USA",(Lydia's apartment)
/title/tt0227538/,"Travis Park - 301 E Travis Street, San Antonio, Texas, USA",(the robot kids steal the Third Brain)
/title/tt0227538/,"Santiago, Chile",(flyover shot of San Diablo)
/title/tt0227538/,"Reñaca, Viña del Mar, Región de Valparaíso, Chile",
/title/tt0227538/,"Texas, USA",
/title/tt0227538/,"Austin-Bergstrom International Airport - 3600 Presidential Boulevard, Austin, Texas, USA",(airport in the opening)
/title/tt0227538/,"Villa Del Sol - 6638 Comanche Trail, Austin, Texas, USA",(wedding scene)
/title/tt0120789/,"Valencia High School - 27801 Dickason Drive, Valencia, California, USA",
/title/tt0120789/,"Santa Clarita, California, USA",
/title/tt0120789/,"Parking lot, Malibu Creek State Park - 1925 Las Virgenes Road, Calabasas, California, USA",
/title/tt0120789/,"Blondie Street, Columbia/Warner Bros. Ranch - 411 North Hollywood Way, Burbank, California, USA",
/title/tt0120789/,"Universal Studios - 100 Universal City Plaza, Universal City, California, USA",(studio)
/title/tt0088011/,"Jalapa, Veracruz, Mexico",
/title/tt0088011/,"Mexico City, Distrito Federal, Mexico",
/title/tt0088011/,"Veracruz, Veracruz, Mexico",
/title/tt0088011/,"Veracruz, Mexico",(San Juan de Ulua fortress)
/title/tt0088011/,"Barraca Grande, Mexico",(mountain roads)
/title/tt0088011/,"New York City, New York, USA",
/title/tt0088011/,"Tonaya, Jalisco, Mexico",
/title/tt1216475/,"Walt Disney Animation Studios - 2100 Riverside Drive, Burbank, California, USA",
/title/tt0319343/,"55 Central Park West, Manhattan, New York City, New York, USA",(exterior of Walter and family's apartment)
/title/tt0319343/,"Lincoln Tunnel, New York City, New York, USA",
/title/tt0319343/,"Bethesda Fountain, Central Park, Manhattan, New York City, New York, USA",
/title/tt0319343/,"Midtown, Manhattan, New York City, New York, USA",
/title/tt0319343/,"New York City, New York, USA",
/title/tt0095444/,"Watsonville, California, USA",(town: Crescent Cove)
/title/tt0095444/,"65 & 75 & 85 Nielson St,Watsonville, California, USA",(Interior of the ship was filmed in at the time a Seagate Computer Electronic's Manufacturing Facility. Now it's owned by Watsonville Community Hospital in present time.)
/title/tt0095444/,"2-26 East Lake Ave, Watsonville, California, USA",(Opening Scene in front of Goodwill Store)
/title/tt0095444/,"California, USA",
/title/tt0095444/,USA,
/title/tt4680182/,"Vancouver, British Columbia, Canada",
/title/tt4680182/,"Glover Road, Fort Langley, British Columbia, Canada",(Gloria's family home)
/title/tt4680182/,"Harbour Green Park, Vancouver, British Columbia, Canada",(entrance to Seoul subway station)
/title/tt0387575/,"Castel Film Studios, Bucharest, Romania",
/title/tt0387575/,"Los Angeles, California, USA",
/title/tt0387575/,"California, USA",
/title/tt0091059/,"615 Idlewyld Drive, Fort Lauderdale, Florida, USA","(The Freemans' house, 1978)"
/title/tt0091059/,"Watson Island, Miami, Florida, USA",(Disc Dog tournament opening scene)
/title/tt0091059/,"Fort Lauderdale, Florida, USA",
/title/tt0091059/,"Golden Gate Bridge, San Francisco, California, USA",(flying scene)
/title/tt5117428/,"Nashville, Tennessee, USA",
/title/tt1727776/,"Santa Clarita, California, USA",
/title/tt3824648/,"Manlius, New York, USA",(House Party)
/title/tt8690518/,"British Columbia, Canada",
/title/tt0349205/,"Petaluma, California, USA",
/title/tt0349205/,"Los Angeles, California, USA",
/title/tt0349205/,"California, USA",
/title/tt0078721/,"777 Ledo Way, Bel Air, Los Angeles, California, USA",(George's house)
/title/tt0078721/,"Bellagio Road, Bel Air, Los Angeles, California, USA",
/title/tt0078721/,"Malibu Cove Colony Road - Malibu, California, USA",(beach house)
/title/tt0078721/,"North Cascada & North Bellagio Roads - Los Angeles, California, USA",(Samantha racing home)
/title/tt0078721/,"Beverly Hills, California, USA",
/title/tt0078721/,"Malibu, California, USA",
/title/tt0078721/,"Sunset Blvd., Hollywood, Los Angeles, California, USA",
