Code,Show Name,Location,Scene
/title/tt0078721/,"Metro-Goldwyn-Mayer Studios - 10202 W. Washington Blvd., Culver City, California, USA",(studio)
/title/tt1054606/,"Vancouver, British Columbia, Canada",
/title/tt1054606/,"Orpheum Theatre - 601 Smithe St, Vancouver, British Columbia, Canada",
/title/tt1054606/,"Blackfriars Bridge, Blackfriars, London, England, UK",
/title/tt1054606/,"Battersea Power Station, Battersea, London, England, UK",
/title/tt1054606/,"Bray Film Studios, Windsor, Berkshire, England, UK",(studio)
/title/tt1054606/,"Leadenhall Market, Lime Street, Broadgate, London, England, UK",
/title/tt1054606/,"City of London, England, UK",
/title/tt0108333/,"Seegrotte, Hinterbrühl, Lower Austria, Austria","(underground lake, dungeons)"
/title/tt0108333/,"Castle Landsee, Markt St. Martin, Burgenland, Austria",
/title/tt0108333/,"Castle Petronell, Petronell-Carnuntum, Lower Austria, Austria",(Musketeers' headquarters)
/title/tt0108333/,"Lanhydrock House, Bodmin, Cornwall, England, UK",
/title/tt0108333/,"Boconnoc, Lostwithiel, Cornwall, England, UK",
/title/tt0108333/,"Pelyn, Lostwithiel, Cornwall, England, UK",
/title/tt0108333/,"Retz, Lower Austria, Austria",(windmill)
/title/tt0083767/,"6410 Beacon St., Pittsburgh, Pennsylvania, USA","(party in ""The Crate"")"
/title/tt0083767/,"Island Beach State Park, Berkeley Township, Ocean County, New Jersey, USA","(beach in ""Something to Tide You Over"")"
/title/tt0083767/,"1 Brattleboro Dr. Greensburg, Pennsylvania, USA","(house in ""Prologue"" / ""Epilogue"" - interior shots)"
/title/tt0083767/,"Monroeville, Pennsylvania, USA","(near) (Hill near Penn Hall - ""The Lonesome Death of Jordy Verrill"")"
/title/tt0083767/,"Penn Hall Academy, Monroeville, Pennsylvania, USA","(campus in ""The Crate"")"
/title/tt0083767/,"Pittsburgh, Pennsylvania, USA",
/title/tt0093748/,"El Rancho Motel - 36355 N. US Hwy 41, Gurnee, Illinois, USA",
/title/tt0093748/,"Lambert International Airport - 10701 Lambert International Boulevard, St. Louis, Missouri, USA",
/title/tt0093748/,"The Sun Motel - 140 S Hickory St, Braidwood, Illinois, USA",(Formerly called The Braidwood Inn)
/title/tt0093748/,"LeMoore, California, USA",(rental car night driving scene)
/title/tt0093748/,"LaSalle/Van Buren CTA Station, Chicago, Illinois, USA",(subway station scene when Neal Page and Del Griffith are already in Chicago)
/title/tt0093748/,"Chicago, Illinois, USA",
/title/tt0093748/,"New York City, New York, USA",
/title/tt0090583/,"Grant Park, Downtown, Chicago, Illinois, USA",
/title/tt0090583/,"Kelly's Pub - 949 W. Webster Avenue, Lincoln Park, Chicago, Illinois, USA",
/title/tt0090583/,"Hollywood, Los Angeles, California, USA",
/title/tt0043208/,"Ren-Mar Studios - 846 N. Cahuenga Blvd., Hollywood, Los Angeles, California, USA",(Seasons 3 - 6)
/title/tt0475290/,"Los Angeles Theatre - 615 S. Broadway, Downtown, Los Angeles, California, USA",(Lazy Ol' Moon premiere)
/title/tt0475290/,"Union Station - 800 N. Alameda Street, Downtown, Los Angeles, California, USA",(studio) (Outdoors - Capitol Studios)
/title/tt0475290/,"Whitley Terrace, Whitley Heights, Hollywood, Los Angeles, California, USA","(Hobie waits for Carlotta, playing lasso)"
/title/tt0475290/,"Bronson Caves, Bronson Canyon, Griffith Park - 4730 Crystal Springs Drive, Los Angeles, California, USA",(well of Jehoshaphat in 'Hail Ceasar!')
/title/tt0475290/,"Craven Estate - 430 Madeline Avenue, Pasadena, California, USA",(interiors: Manix meeting with religious leaders)
/title/tt0475290/,"Universal Studios - 100 Universal City Plaza, Universal City, California, USA",(filmed in part at)
/title/tt0475290/,"635 South Mateo Street, Los Angeles, California, USA",(interiors: Joseph Silverman's office)
/title/tt0475290/,"Big Sky Ranch - 4927 Bennett Road, Simi Valley, California, USA",(Roman epic production)
/title/tt0475290/,"The Lot - 1041 N. Formosa Avenue, West Hollywood, California, USA",(filmed in part at)
/title/tt0475290/,"California, USA",
/title/tt0093822/,"Sun Devil Stadium - 500 East Veterans Way, Tempe, Arizona, USA",(grown-up Nathan Jr. playing football)
/title/tt0093822/,"Phoenix, Arizona, USA",
/title/tt0093822/,"Dudleyville, Arizona, USA",
/title/tt0093822/,"Cricle K - 2311 W. Deer Valley Road, Phoenix, Arizona, USA",(Short Stop Convenience Store)
/title/tt0093822/,"Carefree, Arizona, USA",
/title/tt0093822/,"Lost Dutchman State Park - 6109 N. Apache Trail, Apache Junction, Arizona, USA","(H.I. and Glen's chat in the desert, ending up in beating)"
/title/tt0093822/,"Superior, Arizona, USA",
/title/tt0093822/,"827 E. Main Street, Mesa, Arizona, USA",(Double Coupons Supermarket)
/title/tt0093822/,"24th Street Water Treatment Plant - North 24th Street, Phoenix, Arizona, USA",(escapees' hole in the ground)
/title/tt0093822/,USA,
/title/tt0096560/,"Hubert H. Humphrey Metrodome - 501 Chicago Avenue, Minneapolis, Minnesota, USA",(football game footage)
/title/tt0096560/,"University of Iowa - 2222 Old Hwy 218 South, Iowa City, Iowa, USA",(campus exteriors)
/title/tt0373469/,"Standard Hotel - 550 S. Flower Street, Los Angeles, California, USA",
/title/tt0373469/,"Long Beach, California, USA",
/title/tt0373469/,"MacArthur Park, Los Angeles, California, USA",
/title/tt0373469/,"Santa Monica, California, USA",
/title/tt2140373/,"Ontario International Airport - 2900 E. Airport Drive, Ontario, California, USA",(terminal 1)
/title/tt2140373/,"Grauman's Chinese Theater - 6925 Hollywood Blvd., Hollywood, Los Angeles, California, USA",
/title/tt2140373/,"Heritage Square Museum - 3800 Homer Street, Montecito Heights, Los Angeles, California, USA",(Goff's old house)
/title/tt2140373/,"Universal Studios - 100 Universal City Plaza, Universal City, California, USA",(studio)
/title/tt2140373/,"Courthouse Square, Backlot, Universal Studios - 100 Universal City Plaza, Universal City, California, USA",(Goff's Old Town)
/title/tt2140373/,"Beverly Hills Hotel & Bungalows - 9641 Sunset Blvd., Beverly Hills, California, USA",
/title/tt2140373/,"Santa Clarita Studios - 25135 Anza Drive, Santa Clarita, California, USA",(studio)
/title/tt0078239/,"Century City, Los Angeles, California, USA",
/title/tt0078239/,"Metro-Goldwyn-Mayer Studios - 10202 W. Washington Blvd., Culver City, California, USA","(Lot 2 for exteriors, town square)"
/title/tt1636826/,"Blondie Street, Columbia/Warner Bros. Ranch - 411 North Hollywood Way, Burbank, California, USA",
/title/tt3544112/,"Coliemore Harbour, County Dublin, Ireland",(location)
/title/tt3544112/,"Dublin, Ireland",
/title/tt3544112/,"Synge Street CBS, Synge Street, Dublin, Ireland",(School exteriors)
/title/tt3544112/,"Fusco's Cafe, 27 Meath Street, Merchants Quay, Dublin, Ireland","(Cafe scene after filming ""The Riddle of the Model"")"
/title/tt3544112/,"40 Synge Street, Saint Kevin's, Dublin, Ireland",(Exterior of Raphina's home)
/title/tt0491152/,"Long Island, New York, USA",
/title/tt0491152/,"New York, USA",
/title/tt0090418/,"Stage 26, Warner Brothers Burbank Studios - 4000 Warner Boulevard, Burbank, California, USA",(studio)
/title/tt0302640/,"Pasadena, California, USA",
/title/tt0302640/,"Redondo Beach, California, USA",
/title/tt0302640/,"Torrance High School - 2200 W. Carson Street, Torrance, California, USA",
/title/tt0302640/,"El Segundo High School - 640 Main Street, El Segundo, California, USA",
/title/tt0117887/,"Ambassador Hotel - 3400 Wilshire Boulevard, Los Angeles, California, USA",
/title/tt0117887/,"Watson Drug Store - 116 E. Chapman Avenue, Orange, California, USA",
/title/tt0117887/,"Orange County Fairgrounds - 88 Fair Drive, Costa Mesa, California, USA",
/title/tt0117887/,"Plaza Square - Orange, California, USA",
/title/tt0117887/,"Wells-Fargo Bank - 1435 W. Chapman Avenue, Orange, California, USA",(exterior - Erie Public Library scene)
/title/tt0117887/,"490 Prospect Boulevard, Pasadena, California, USA",
/title/tt0117887/,"McKees Rocks, Pennsylvania, USA",
/title/tt0117887/,"Disneyland Park, Disneyland Resort - 1600 S. Disneyland Drive, Anaheim, California, USA",
/title/tt0117887/,"Fairplex - 1101 West McKinley Avenue, Pomona, California, USA",
/title/tt0117887/,"Boulder City, Nevada, USA",
/title/tt0117887/,"Las Vegas, Nevada, USA",
/title/tt0117887/,"Disneyland Resort - 1313 South Harbor Boulevard - Anaheim, California, USA",
/title/tt0110442/,"Baltimore Memorial Stadium - 900 East 33rd St., Baltimore, Maryland, USA",
/title/tt0110442/,"Zella's Pizzeria 1145 Hollins St, Baltimore, Maryland, USA",(Vaughn and Nikki dine together)
/title/tt0110442/,"Fenway Park - 4 Jersey Street, Boston, Massachusetts, USA",
/title/tt0110442/,"Chicago, Illinois, USA",
/title/tt2119543/,"1260 Briarcliff Rd NE, Atlanta, Georgia, USA",(Asa Griggs Candler Jr. Mansion)
/title/tt2119543/,"Atlanta Metro Studios, Union City, Georgia, USA",
/title/tt2910904/,"Sun Theatre, Yarraville, Victoria, Australia",
/title/tt2910904/,"Docklands Studios, Melbourne, Victoria, Australia",
/title/tt2120120/,"Cobourg, Ontario, Canada",
/title/tt2120120/,"Hamilton, Ontario, Canada",
/title/tt2120120/,"Bay Street, Toronto, Ontario, Canada","(Pac Man almost catches Ludlow on Bay St in Yorkville. In DC battle, Ludlow, Eddie, and Lady Lisa fight on Bay St south of Wellesley)"
/title/tt2120120/,"University Avenue, Toronto, Ontario, Canada","(as Washington DC, wide boulevard in final battle)"
/title/tt2120120/,"Pinewood Toronto Studios, Port Lands, Toronto, Ontario, Canada",(Pixels used five stages at Pinewood)
/title/tt2120120/,"Cobourg, Ontario, Canada",(1982 scenes)
/title/tt2120120/,"King Street, Cobourg, Ontario, Canada",(Commercial street where arcade is located)
/title/tt2120120/,"Bobette & Belle, 1121 Queen Street West, Toronto, Ontario, Canada",(Bakery scene with president and first lady)
/title/tt2120120/,"Adelaide Street, Toronto, Ontario, Canada",(First part of Pac Man sequence)
/title/tt2120120/,"790 Laplante Street, Toronto, Ontario, Canada",(Pac Man scenes in parking garage)
/title/tt2120120/,"Osgoode Hall, Toronto, Ontario, Canada","(Brenner, Ludlow, and Violet run past the gates on the way to battle in DC)"
/title/tt2120120/,"South African War Memorial, Toronto, Ontario, Canada",(Granite column with winged figure on top seen in the background of many scenes in DC battle)
/title/tt2120120/,"The Lieutenant-Colonel John Weir Foote, VC, CD, Armoury, a.k.a The James Street Armoury, 200 James Street North, Hamilton, Ontario, Canada","(Staging area for Pac Man battle, both exterior courtyard where they talk to attack survivor, and interior hangar-like space where they get the ghost cars)"
/title/tt2120120/,"120 Adelaide Street West, Toronto, Ontario, Canada","(Brenner emerges from ramp to parking on west side of building, on York St. south of Adelaide, after defeating Pac Man)"
/title/tt2120120/,"Consulate General of the United States, 360 University Avenue, Toronto, Ontario, Canada",(in the background of the crane Cooper is operating in DC battle)
/title/tt2120120/,"The Titled Kilt, 38 The Esplanade, Toronto, Ontario, Canada","(as the Potomac Grill, interior and exterior, bar where Cooper and Brenner meet)"
/title/tt2120120/,"York Boulevard, Hamilton, Ontario, Canada","(Brenner drives away from the White House, past Park Street to Hamilton Public library for scene with Ludlow)"
/title/tt0108872/,"11500 Tennessee Avenue, Los Angeles, California, USA",(studio)
/title/tt0108872/,"California, USA",
/title/tt0108872/,"Los Angeles County, California, USA",
/title/tt0256380/,"Bank of America World Headquarters Building - 100 North Tryon Street, Charlotte, North Carolina, USA",(JPS Funds building)
/title/tt0256380/,"Latta Arcade - 431 S. Tryon Street, Charlotte, North Carolina, USA",
/title/tt0256380/,"Wachusett Mountain, Princeton, Massachusetts, USA",
/title/tt0256380/,"Sterling, Massachusetts, USA",
/title/tt0207201/,"Chinatown, Armour Square, Chicago, Illinois, USA",
/title/tt0207201/,"Pui Tak Centre - 2216 South Wentworth Avenue, Chicago, Illinois, USA",
/title/tt0207201/,"Greystone Park & Mansion - 905 Loma Vista Drive, Beverly Hills, California, USA",(Lauren Holly's wedding site)
/title/tt0207201/,"Culver City, California, USA",
/title/tt0207201/,"Los Angeles, California, USA",
/title/tt0093493/,"Boscov's Camp Hill - 170 South 32nd Street, Camp Hill, Pennsylvania, USA",(Illustra department store)
/title/tt0093493/,"Camp Hill, Pennsylvania, USA",
/title/tt0114319/,"Locust Valley, Long Island, New York, USA",
/title/tt0114319/,"399 Park Avenue, Manhattan, New York City, New York, USA",(as Larrabee Corp. office building)
/title/tt0114319/,"Morgan's Island, Glen Cove, Long Island, New York, USA",
/title/tt0114319/,"Paris, France",
/title/tt0114319/,"Place du Trocadéro, Paris 16, Paris, France",
/title/tt0372532/,"Piccadilly Circus, Piccadilly, London, England, UK",
/title/tt0372532/,"Winkworth Arboretum, Godalming, Surrey, England, UK",(picnic)
/title/tt0372532/,"London, England, UK",
/title/tt0115433/,"Kenwood House, Hampstead Heath, Hampstead, London, England, UK",
/title/tt0115433/,"London, England, UK",
/title/tt0115433/,"Shepperton Studios, Shepperton, Surrey, England, UK","(studio) (studio, Roger & Anita's house interior and exterior set)"
/title/tt0115433/,"Burlington Arcade, Piccadilly, London, England, UK",
/title/tt0115433/,"Borough Market, Borough, London, England, UK",
/title/tt0115433/,"Leicester Square, London, England, UK",
/title/tt0115433/,"St. Luke's & Christ Church, Sydney St, Chelsea, London, England, UK",(Wedding scene)
/title/tt4565520/,"Boca Raton Resort & Club - 501 East Camino Real, Boca Raton, Florida, USA",
/title/tt4565520/,"East St. Louis, Illinois, USA",(hot air balloon)
/title/tt2172584/,"Hollywood Hills, Los Angeles, California, USA",
/title/tt2172584/,"Beverly Hills, California, USA",
/title/tt2172584/,"Children's Hospital - 4650 Sunset Blvd., Los Angeles, California, USA",(Benji visits fan)
/title/tt2172584/,"Toronto, Ontario, Canada",
/title/tt2172584/,"Cinespace Studios, Toronto, Ontario, Canada",(stage)
/title/tt2172584/,Canada,
/title/tt2365580/,"Seattle Public Library, Seattle, Washington, USA",
/title/tt2365580/,"Vancouver, British Columbia, Canada",
/title/tt2365580/,Canada,
/title/tt2365580/,"Seattle, Washington, USA",
/title/tt2365580/,USA,
/title/tt0077003/,"ABC Television Center - 4151 Prospect Avenue, Los Angeles, California, USA",(studio) (1985-1986)
/title/tt1415889/,"Sunset Bronson Studios - 1438 N. Gower Street, Hollywood, Los Angeles, California, USA",(studio)
/title/tt0486946/,"Jemez Springs, New Mexico, USA",(town)
/title/tt0486946/,"Bonanza Creek Ranch - 15 Bonanza Creek Lane, Santa Fe, New Mexico, USA",
/title/tt0486946/,"Point Mugu, California, USA",(driving by)
/title/tt0486946/,"Albuquerque, New Mexico, USA",(bar scene/tossing of the cell phones scene)
/title/tt7545266/,"Los Angeles, California, USA",
/title/tt0841046/,"Los Angeles, California, USA",
/title/tt0088161/,"Biltmore Hotel - 506 S. Grand Avenue, Downtown, Los Angeles, California, USA",
/title/tt0088161/,"South Ocean, New Providence Island, Bahamas",
/title/tt11618536/,"Carpinteria, California, USA",
/title/tt1450321/,"Municipal Buildings, Stirling, Scotland, UK",
/title/tt1450321/,"Edinburgh, Scotland, UK",
/title/tt1450321/,"Hamburg, Germany",
/title/tt1450321/,Belgium,
/title/tt1450321/,"Reeperbahn, St. Pauli, Hamburg-Mitte, Hamburg, Germany",
/title/tt1450321/,Germany,
/title/tt0280590/,"Stewart Internationa Airport, Newburgh, New York, USA",(Winchestertonfieldville Iowa Airport)
/title/tt0280590/,"Carmel, New York, USA",(Wendy's Scene)
/title/tt0280590/,"First Congregational Church - 540 S. Commonwealth Avenue, Los Angeles, California, USA",
/title/tt0280590/,"New York City, New York, USA",
/title/tt0187664/,"Ealing Studios, Ealing, London, England, UK",(studio) (studio: series 2)
/title/tt0116313/,"New York City, New York, USA",
/title/tt0116313/,"200 Riverside Drive, Manhattan, New York City, New York, USA",
/title/tt0116313/,"Miami, Florida, USA",
/title/tt0367089/,"New York City, New York, USA",(location)
/title/tt0367089/,"Ditmas Park West, Brooklyn, New York City, New York, USA",(location)
/title/tt0367089/,"Museum of Natural History, New York City, New York, USA",
/title/tt0119528/,"City Jail, Los Angeles, California, USA",
/title/tt0119528/,"The Bistro Garden - 12950 Ventura Boulevard, Studio City, Los Angeles, California, USA",
/title/tt0119528/,"1004 Highland Street, South Pasadena, California, USA",
/title/tt0119528/,"Los Angeles International Airport - 1 World Way, Los Angeles, California, USA",
/title/tt0119528/,"South Pasadena, California, USA",
/title/tt0080711/,"Grauman's Chinese Theater - 6925 Hollywood Blvd., Hollywood, Los Angeles, California, USA",(final scenes)
/title/tt0080711/,"Los Angeles, California, USA",
/title/tt0080711/,"Venice, Los Angeles, California, USA",
/title/tt0117802/,"Musso & Frank Grill - 6667 Hollywood Blvd., Hollywood, Los Angeles, California, USA","(Confrontation with ""House of Pain"" behind restaurant made to look like the Dresden.)"
/title/tt0117802/,"Formosa Cafe - 7156 Santa Monica Blvd., West Hollywood, California, USA",
/title/tt0117802/,"Stardust Hotel & Casino - 3000 Las Vegas Boulevard South, Las Vegas, Nevada, USA",
/title/tt0117802/,"5874 Franklin Avenue, Hollywood, Los Angeles, California, USA",(Mike's appartment)
/title/tt0117802/,"Hollywood, Los Angeles, California, USA",
/title/tt0117802/,"Fremont Hotel & Casino - 3555 Las Vegas Boulevard South, Las Vegas, Nevada, USA",(Several interior shots including Paradise Buffet)
/title/tt0117802/,"Los Angeles, California, USA",
/title/tt0117802/,"The 101 Coffee Shop, 6145 Franklin Avenue, Los Angeles, California, USA",(Formerly The Hollywood Hills Coffee Shop adjacent to Best Western)
/title/tt0122718/,"Yosemite Valley, Yosemite National Park, California, USA",
/title/tt0122718/,"Stage 27, Universal Studios - 100 Universal City Plaza, Universal City, California, USA",
/title/tt0058808/,"General Service Studios - 1040 N. Las Palmas, Hollywood, Los Angeles, California, USA",(studio)
/title/tt0058808/,"Stage 5, Hollywood Center Studios - 1040 N. Las Palmas Avenue, Hollywood, Los Angeles, California, USA",
/title/tt0908454/,"47 Trinity Street, Barry, Vale of Glamorgan, Wales, UK",(The Wests house)
/title/tt0908454/,"Barry Island, Barry, Vale of Glamorgan, Wales, UK",
/title/tt0908454/,"ITV Wales, Culverhouse Cross, Cardiff, South Glamorgan, Wales, UK",(studio)
/title/tt0185431/,"Long Beach, California, USA",
/title/tt0284722/,"Stage 20, 20th Century Fox Studios - 10201 Pico Blvd., Century City, Los Angeles, California, USA",
/title/tt0138510/,"Pasadena, California, USA",
/title/tt0138510/,"1034 North Madison Avenue, Pasadena, California, USA",(Anton's house)
/title/tt0138510/,"577 East Jackson Street, Pasadena, California, USA",(Randy's house)
/title/tt0138510/,"Hollywood, Los Angeles, California, USA",
/title/tt2226342/,"EUE/Screen Gems Studios Atlanta, 175 Lakewood Way, Atlanta, Georgia, USA",
/title/tt0088794/,"Brighton, Utah, USA",
/title/tt0088794/,"1636 Virginia Avenue, Glendale, California, USA",(Meyer family home)
/title/tt0088794/,"Dan's Market - 3981 Wasatch Boulevard, Holladay, Utah, USA",(grocery store where Charles De Mar says he can't get real drugs)
/title/tt0088794/,"400 South Avenue 60, Los Angeles, California, USA","(Lane Meyer jumps off a bridge;""that's a shame when folks be throwing away a perfectly good white boy)"
/title/tt0088794/,"1633 Virginia Avenue, Glendale, California, USA",(Monique Junot & Smith family home)
/title/tt0088794/,"La Crescenta, California, USA",
/title/tt0088794/,"145 N. Baldwin Avenue, Sierra Madre, California, USA",(Where Lane rear ends Rocko)
/title/tt0088794/,"Hollywood High School - 1521 N. Highland Avenue, Hollywood, Los Angeles, California, USA",(Lane Meyer's high school)
/title/tt0118303/,"Stage 21, 20th Century Fox Studios - 10201 Pico Blvd., Century City, Los Angeles, California, USA",
/title/tt0053604/,"The Lot - 1041 N. Formosa Avenue, West Hollywood, California, USA",(studio)
/title/tt0053604/,"59th Street, Manhattan, New York City, New York, USA",
/title/tt0053604/,"New York City, New York, USA",
/title/tt7014006/,"Palisades Center Mall, West Nyack, New York, USA",(Parking lot)
/title/tt7014006/,"Galleria Mall, White Plains, New York, USA",(mall interiors)
/title/tt7014006/,"Palasades Center Mall, West Nyack, New York, USA",(mall exteriors)
/title/tt0430922/,"Walt Disney's Golden Oak Ranch - 19802 Placerita Canyon Road, Newhall, California, USA",(Battle)
/title/tt0430922/,"El Segundo High School - 640 Main Street, El Segundo, California, USA",
/title/tt0430922/,"2800 Donald Douglas Loop North, Santa Monica, California, USA",(Minotaur Headquarters)
/title/tt0430922/,"Walter Reed Middle School - 4525 Irvine Avenue, North Hollywood, Los Angeles, California, USA",(School)
/title/tt0430922/,"825 Pico Blvd, Santa Monica, California, USA",(Ed's Mini-Mart)
/title/tt0430922/,"3111 Stanford Avenue, Venice, California, USA",(Ronnie's house)
/title/tt0430922/,"632 Lindero Canyon Road, Oak Park, California, USA",(Grocery store)
/title/tt0430922/,"2703 Ocean Front Walk, Venice, California, USA",(Party)
/title/tt0430922/,"Boys & Girls Club of Venice - 2232 Lincoln Blvd, Venice, Los Angeles, California, USA",(interiors)
/title/tt0243655/,"Pennsylvania, USA",
/title/tt3908142/,"Arcata, California, USA",
/title/tt3908142/,"Los Angeles, California, USA",
/title/tt3908142/,"California, USA",
/title/tt3908142/,"Moonrise Herbs, Arcata, California, USA",(The apothecary)
/title/tt0115369/,"Los Angeles, California, USA",
/title/tt0061452/,"Glencree, County Wicklow, Ireland",
/title/tt0061452/,Malta,
/title/tt0061452/,"Mereworth Castle, Mereworth, Kent, England, UK",(Sir James's home)
/title/tt0061452/,"County Wicklow, Ireland",
/title/tt0061452/,"A24, Mickleham, Surrey, England, UK",(Sir James Bond is pursued by SMERSH agent in her Jaguar E-Type)
/title/tt0061452/,"MGM British Studios, Borehamwood, Hertfordshire, England, UK","(Certain street scenes ""Whats New Pussycat"" sequence)"
/title/tt0061452/,"Kent, England, UK",
/title/tt0061452/,"MGM/ATP Studios, Ealing, London, England, UK",(studio)
/title/tt0061452/,"Shepperton Studios, Shepperton, Surrey, England, UK",(studio)
/title/tt0061452/,"Trafalgar Square, St James's, London, England, UK",
/title/tt0061452/,"A24 London Road Dorking, Surrey, England, UK",(Sir James Bond pursues Smersh Agent)
/title/tt0061452/,"Old Windsor, corner of Burfield Road & Priest Hill,",(Milk float chase)
/title/tt0061452/,"Old Windsor, Junction of Oueseley Road & Burfield Row, England, UK",(Where milk van & E-Type Jag collide & explode)
/title/tt0373074/,China,
/title/tt0286788/,"West Wycombe Park, West Wycombe, Buckinghamshire, England, UK",(Dashwood Manor/ wedding scenes/Ian and Daphne on lake)
/title/tt0286788/,"Globe Tavern, 8 Bedale Street, The Borough, London, England, UK","(exterior, youth hostel)"
/title/tt0286788/,"Battersea Park, Battersea, London, England, UK",
/title/tt0286788/,"Henley-on-Thames, Oxfordshire, England, UK",(Henley Regatta)
/title/tt0286788/,"RAF Halton, Halton, Wendover, Buckinghamshire, England, UK",
/title/tt0286788/,"New York City, New York, USA",
/title/tt3513498/,"New York City, New York, USA",
/title/tt1196141/,"New Westminster, British Columbia, Canada",
/title/tt1196141/,"Shaugnessy Elementary School, 4250 Marguerite Street, Vancouver, British Columbia, Canada",(Westmore Middle School Exteriors)
/title/tt1196141/,"337 Fourth Street, New Westminster, British Columbia, Canada",(Rowley's House)
/title/tt1196141/,"Rosemary Mansion, Shaugnessy, Vancouver, British Columbia, Canada",(Halloween House)
/title/tt1196141/,"403 Fourth Avenue, New Westminster, British Columbia, Canada",(Fregley's House)
/title/tt4769836/,"Savannah, Georgia, USA",
/title/tt5212822/,"Toronto, Ontario, Canada",(Season 2)
/title/tt0780622/,"Texas, USA",
/title/tt0780622/,"Hamilton Pools, Austin, Texas, USA",(Where Dawn & Tobey went swimming)
/title/tt1686821/,"London, England, UK",
/title/tt1686821/,"Charterhouse School, Godalming, Surrey, England, UK",
/title/tt1686821/,"Louise Blouin Foundation, London, England, UK",
/title/tt1686821/,"Montana, USA",
/title/tt1686821/,UK,
/title/tt2096672/,"Atlanta, Georgia, USA",
/title/tt2096672/,"Providence, Rhode Island, USA",
/title/tt2096672/,"Santa Clarita, California, USA",
/title/tt0088680/,"28 Howard Street, Soho, Manhattan, New York City, New York, USA",(Kiki's loft apartment)
/title/tt0088680/,"Metropolitan Life Tower - 11 Madison Avenue, Manhattan, New York City, New York, USA",(iron gates outside Paul's workplace)
/title/tt0088680/,"Spring Street Station, Soho, Manhattan, New York City, New York, USA",(subway station scene)
/title/tt0088680/,"Manhattan, New York City, New York, USA",
/title/tt0088680/,"Soho, Manhattan, New York City, New York, USA",
/title/tt0115275/,"ABC Television Center - 4151 Prospect Avenue, Los Angeles, California, USA",(season 1)
/title/tt1655442/,"Paramount Studios - 5555 Melrose Avenue, Hollywood, Los Angeles, California, USA",(studio)
/title/tt1655442/,"Fremont Mansion - 56 Fremont Place, Los Angeles, California, USA",(Peppy's house)
/title/tt1655442/,"Million Dollar Theatre - 307 S. Broadway, Downtown, Los Angeles, California, USA",
/title/tt1655442/,"104 Fremont Place, Los Angeles, California, USA",(George's house)
/title/tt1655442/,"Red Studios, 846 N. Cahuenga Blvd., Hollywood, Los Angeles, California, USA",(studio) (as Red Studios Hollywood)
/title/tt1655442/,"The Ebell of Los Angeles - 743 S Lucerne Blvd, Los Angeles, California, USA",(interiors: auction house)
