Code,Show Name,Location,Scene
/title/tt1650554/,Kick-Ass 2,"Toronto, Ontario, Canada",(Desmond Miller)                        
/title/tt1650554/,Kick-Ass 2,"Pinewood Toronto Studios, Port Lands, Toronto, Ontario, Canada",
/title/tt1650554/,Kick-Ass 2,"Southgate, London, England, UK",
/title/tt1650554/,Kick-Ass 2,"Revival 629, 629 Eastern Avenue, Toronto, Ontario, Canada",(Carp Shop)                        
/title/tt0092312/,21 Jump Street,"New Westminster Secondary School, New Westminster, British Columbia, Canada",(Annala)                        
/title/tt0092312/,21 Jump Street,"Vancouver, British Columbia, Canada",
/title/tt5093026/,Papillon,"Belgrade, Serbia",
/title/tt5093026/,Papillon,"Niksic, Montenegro",
/title/tt5093026/,Papillon,"Ulcinj, Montenegro",
/title/tt5093026/,Papillon,"Kalkara, Malta",(Times of Malta 30-11-2016)                        
/title/tt5093026/,Papillon,"Rabat, Malta",(Times of Malta 30-11-2016)                        
/title/tt0356910/,Mr. & Mrs. Smith,"1565 San Pasqual Street, Pasadena, California, USA",(exteriors: Smith residence)                        
/title/tt0356910/,Mr. & Mrs. Smith,"The Cicada Restaurant and Club - 617 S Olive St, Los Angeles, California, USA","(restaurant, dance club)                        "
/title/tt0356910/,Mr. & Mrs. Smith,"Quality Coffee Shop - 1238 West 7th Street, Los Angeles, California, USA",
/title/tt0356910/,Mr. & Mrs. Smith,"Brooklyn Bridge, New York City, New York, USA",
/title/tt0356910/,Mr. & Mrs. Smith,"Pasadena, California, USA",
/title/tt0356910/,Mr. & Mrs. Smith,"Vincent Thomas Bridge, San Pedro, Los Angeles, California, USA",
/title/tt0356910/,Mr. & Mrs. Smith,"Los Angeles Center Studios - 450 S. Bixel Street, Downtown, Los Angeles, California, USA",(studio)                        
/title/tt0356910/,Mr. & Mrs. Smith,"570 Lexington Avenue, New York City, New York, USA",(Mrs. Smith's office)                        
/title/tt1297754/,Republic of Doyle,"St John's, Newfoundland and Labrador, Canada",
/title/tt0488120/,Fracture,"4411 Noeline Avenue, Encino, Los Angeles, California, USA",(Crawford's house)                        
/title/tt0488120/,Fracture,"Fairmont Miramar Hotel Santa Monica - 101 Wilshire Blvd., Santa Monica, California, USA",
/title/tt0488120/,Fracture,"Standard Hotel - 550 S. Flower Street, Los Angeles, California, USA",
/title/tt0488120/,Fracture,"Dijon Street, Warner Brothers Burbank Studios - 4000 Warner Boulevard, Burbank, California, USA",(studio)                        
/title/tt0488120/,Fracture,"Los Angeles, California, USA",
/title/tt2582782/,Hell or High Water,"Clovis, New Mexico, USA",
/title/tt2582782/,Hell or High Water,"Tucumcari, New Mexico, USA",(location)                        
/title/tt2582782/,Hell or High Water,"Albuquerque, New Mexico, USA",(Rangers headquarters at 320 Gold Ave SW)                        
/title/tt2582782/,Hell or High Water,"Route 66 Casino and Hotel, Albuquerque New Mexico, USA",(as Comanche 66 casino in Oklahoma)                        
/title/tt2582782/,Hell or High Water,"New Mexico, USA",
/title/tt2582782/,Hell or High Water,"NM-156, Caprock Escarpment, Quay County, New Mexico, USA",(winding road)                        
/title/tt2582782/,Hell or High Water,"Safford, Arizona, USA",
/title/tt2582782/,Hell or High Water,"Sunset Motel, East 501 Rte 66, Moriarity, New Mexico, USA",(location)                        
/title/tt2582782/,Hell or High Water,"To'hajiilee, New Mexico, USA",(Shootout scene)                        
/title/tt1535109/,Captain Phillips,Malta,
/title/tt1535109/,Captain Phillips,"Malta Freeport Terminals, Port of Marsaxlokk, Malta",
/title/tt1535109/,Captain Phillips,"Sidi Bibi, Morocco",
/title/tt1535109/,Captain Phillips,"Massachusetts, USA",
/title/tt1535109/,Captain Phillips,"Virginia Beach, Virginia, USA",
/title/tt1535109/,Captain Phillips,"Agadir, Morocco",
/title/tt1535109/,Captain Phillips,"Longcross Studios, Chobham Lane, Longcross, Surrey, England, UK",(studio)                        
/title/tt1535109/,Captain Phillips,"Boston, Massachusetts, USA",
/title/tt1535109/,Captain Phillips,"Lincoln, Massachusetts, USA",(filming across from Sister's house)                        
/title/tt1535109/,Captain Phillips,"Worcester, Massachusetts, USA",(airport)                        
/title/tt5691670/,Under the Silver Lake,"Bronson Caves, Bronson Canyon, Griffith Park - 4730 Crystal Springs Drive, Los Angeles, California, USA",(Crypt Bar interior)                        
/title/tt5691670/,Under the Silver Lake,"Griffith Observatory, 2800 E Observatory Rd, Los Angeles, California, USA",(Exterior: James Dean bust and Isaac Newton statue)                        
/title/tt5691670/,Under the Silver Lake,"Hollywood Forever Cemetery - 6000 Santa Monica Blvd., Hollywood, Los Angeles, California, USA",(Outdoor movie screening and Cathedral Mausoleum interior)                        
/title/tt5691670/,Under the Silver Lake,"Fern Dell, Griffith Park - 4730 Crystal Springs Drive, Los Angeles, California, USA",(Woodland paths beside stream)                        
/title/tt5691670/,Under the Silver Lake,"Bronson Canyon, Griffith Park - 4730 Crystal Springs Drive, Los Angeles, California, USA","(Sam finds the hidden location, with a mysterious hut, which has been erased from online maps)                        "
/title/tt5691670/,Under the Silver Lake,"Griffith Park, Los Angeles, California, USA",
/title/tt5691670/,Under the Silver Lake,"Canfield-Moreno Estate - 1923 Micheltorena Street, Silver Lake, Los Angeles, California, USA",(Songwriter's house)                        
/title/tt0340855/,Monster,"Daytona Beach, Florida, USA",(Daytona International Speedway)                        
/title/tt0340855/,Monster,"Sanford, Florida, USA",
/title/tt0340855/,Monster,"Kissimmee, Florida, USA",
/title/tt0106489/,A Bronx Tale,"Gravesend Neck Road & East 15th Street, Brooklyn, New York City, New York, USA",(Jane's neighborhood)                        
/title/tt0106489/,A Bronx Tale,"Jersey City, New Jersey, USA",(the boxing match scene is filmed at the armory in jersey city)                        
/title/tt0106489/,A Bronx Tale,"Bronx, New York City, New York, USA",
/title/tt0106489/,A Bronx Tale,"4408 30th Avenue, Astoria, Queens, New York City, New York, USA",(Anello family's apartment)                        
/title/tt0106489/,A Bronx Tale,"4810 31st Avenue, Astoria, Queens, New York City, New York, USA",(high school)                        
/title/tt0299658/,Chicago,"Ontario Legislature Building, Queen's Park, Toronto, Ontario, Canada",(as courthouse steps for press conference)                        
/title/tt0299658/,Chicago,"Casa Loma, Toronto, Ontario, Canada","(as office of Billy Flynn, interior)                        "
/title/tt0299658/,Chicago,"Toronto, Ontario, Canada",
/title/tt0299658/,Chicago,"Chicago, Illinois, USA",(exterior shots)                        
/title/tt0299658/,Chicago,"Osgoode Hall, Toronto, Ontario, Canada",(Hospital exterior)                        
/title/tt0299658/,Chicago,"Downsview Park Studios, 40 Carl Hall Road, Toronto, Ontario, Canada",
/title/tt0299658/,Chicago,"Elgin Theatre, Toronto, Ontario, Canada",(as the Chicago Theatre interior)                        
/title/tt1596343/,Fast & Furious 5,Puerto Rico,
/title/tt1596343/,Fast & Furious 5,"Rio de Janeiro, Rio de Janeiro, Brazil",
/title/tt1596343/,Fast & Furious 5,"Parker, Arizona, USA",
/title/tt1596343/,Fast & Furious 5,"Los Angeles, California, USA",
/title/tt1596343/,Fast & Furious 5,"Middle Georgia Regional Airport, 1000 Terminal Dr, Macon, GA 31297, USA",(Hobbs arrives in Rio de Janeiro)                        
/title/tt0056758/,General Hospital,"ABC Television Center - 4151 Prospect Avenue, Los Angeles, California, USA",(studio) (formerly ABC Television Center) (studio D: 1963-77) (studio 54: 1989-)                        
/title/tt0056758/,General Hospital,"Greystone Park & Mansion - 905 Loma Vista Drive, Beverly Hills, California, USA",
/title/tt0056758/,General Hospital,"Mount Rushmore National Memorial - Highway 244, Keystone, South Dakota, USA",
/title/tt0056758/,General Hospital,"Hollywood, Los Angeles, California, USA",
/title/tt0056758/,General Hospital,"Cahuenga Studios, Los Angeles, California, USA",(studio) (1977-78)                        
/title/tt2005151/,War Dogs,Romania,
/title/tt2005151/,War Dogs,"Casablanca, Morocco",
/title/tt2005151/,War Dogs,"El Centro, California, USA",
/title/tt2005151/,War Dogs,"Las Vegas, Nevada, USA",
/title/tt2005151/,War Dogs,"Palace of the Parliament, Bucharest, Romania","(as Tirana, Albania) (background exterior)                        "
/title/tt2005151/,War Dogs,USA,
/title/tt0887883/,Burn After Reading,"Bronx Community College - University Avenue at West 181 Street, Bronx, New York City, New York, USA",
/title/tt0887883/,Burn After Reading,"Tower Records - 809 Route 17, Paramus, New Jersey, USA",(Hardbodies Gym)                        
/title/tt0887883/,Burn After Reading,"Clearview Cinemas Chelsea West - 333 West 23rd Street, New York, USA",(interiors)                        
/title/tt0887883/,Burn After Reading,"Costco Wholesale - 1 Industrial Lane, New Rochelle, New York, USA",(location)                        
/title/tt0887883/,Burn After Reading,"New York City, New York, USA",
/title/tt0887883/,Burn After Reading,"Steiner Studios - 15 Washington Avenue, Brooklyn Navy Yard, Brooklyn, New York City, New York, USA",(studio)                        
/title/tt0887883/,Burn After Reading,"Washington, District of Columbia, USA",
/title/tt0047885/,Blackboard Jungle,"El Segundo, California, USA",
/title/tt0101114/,Heartbeat,"Goathland Garage, Goathland, Whitby, North Yorkshire, England, UK",(Bernie Scripps' garage and funeral parlour)                        
/title/tt0101114/,Heartbeat,"Goathland Railway Station, Cow Wath Bank, Goathland, Whitby, North Yorkshire, England, UK",(Aidensfield station)                        
/title/tt0101114/,Heartbeat,"Brow House Farm, Goathland, Whitby, North Yorkshire, England, UK",(Claude Greengrass' farm)                        
/title/tt0101114/,Heartbeat,"Whitby, North Yorkshire, England, UK",(Whitby)                        
/title/tt0101114/,Heartbeat,"Glendale House, Goathland, Whitby, North Yorkshire, England, UK",(Dr Ferrenby's and Kate Rowan's surgery)                        
/title/tt0101114/,Heartbeat,"Ripon Court House Museum, Ripon, North Yorkshire, England, UK",(Ashfordly Magistrate's Court)                        
/title/tt0101114/,Heartbeat,"Beck Hole, North Yorkshire, England, UK",
/title/tt0101114/,Heartbeat,"Grosmont Railway Station, Front Street, Grosmont, Whitby, North Yorkshire, England, UK",
/title/tt0101114/,Heartbeat,"Grosmont, Whitby, North Yorkshire, England, UK",
/title/tt1032755/,RocknRolla,"Connaught Tunnel, near London City Airport, Newham, East London, London, England, UK",(Chase on railway with Russians after robbery.)                        
/title/tt1032755/,RocknRolla,"Wembley Stadium, Wembley, London, England, UK",
/title/tt1032755/,RocknRolla,"Barbican, London, England, UK",(The scene with the counciler getting his plums squeezed by Lenny)                        
/title/tt1032755/,RocknRolla,"Stoke Park House, Park Road, Stoke Poges, Buckinghamshire, England, UK",(golf course scene)                        
/title/tt1032755/,RocknRolla,"Geffrye Museum of the Home, London, England, UK",(Final scene)                        
/title/tt1298644/,The Hustle,"Majorca, Balearic Islands, Spain",
/title/tt0099422/,Dick Tracy,"Warner Brothers Burbank Studios - 4000 Warner Boulevard, Burbank, California, USA",
/title/tt0099422/,Dick Tracy,"Los Angeles, California, USA",
/title/tt0099422/,Dick Tracy,USA,
/title/tt0452623/,Gone Baby Gone,"Boston, Massachusetts, USA",
/title/tt0452623/,Gone Baby Gone,"Murphy's Law - 837 Summer Street, Boston, Massachusetts, USA",(bar at the end)                        
/title/tt0452623/,Gone Baby Gone,"Dorchester, Boston, Massachusetts, USA",
/title/tt0452623/,Gone Baby Gone,"LoConte Rink - 3449 Veterans Memorial Pkwy, Medford, Massachusetts, USA",
/title/tt0452623/,Gone Baby Gone,"Mount Auburn Cemetery - 330 Mt. Auburn Street, Cambridge, Massachusetts, USA",(funeral scenes)                        
/title/tt0452623/,Gone Baby Gone,"Cambridge, Massachusetts, USA",
/title/tt0452623/,Gone Baby Gone,"GMT Studios - 5701-5751 Buckingham Parkway, Culver City, California, USA",(studio)                        
/title/tt0452623/,Gone Baby Gone,"Moakley Park, Boston, Massachusetts, USA",
/title/tt0452623/,Gone Baby Gone,"Quincy Quarries, Quincy, Massachusetts, USA",
/title/tt0452623/,Gone Baby Gone,"WCVB studio - 5 TV Place, Needham, Massachusetts, USA",
/title/tt0452623/,Gone Baby Gone,"Winchester, Massachusetts, USA",
/title/tt0086960/,Beverly Hills Cop,"609 E Channel Rd, Santa Monica, California, USA",(exteriors: Maitland's Mansion)                        
/title/tt0086960/,Beverly Hills Cop,"City Hall - 455 N. Rexford Drive, Beverly Hills, California, USA",(police headquarters)                        
/title/tt0086960/,Beverly Hills Cop,"Ford Rouge Center - 3001 Miller Road, Dearborn, Michigan, USA",(factory in opening shots)                        
/title/tt0086960/,Beverly Hills Cop,"Biltmore Hotel - 506 S. Grand Avenue, Downtown, Los Angeles, California, USA",(The Beverly Palms Hotel)                        
/title/tt0086960/,Beverly Hills Cop,"635 South Mateo Street, Los Angeles, California, USA",(Detroit Police Station)                        
/title/tt0086960/,Beverly Hills Cop,"Regent Beverly Wilshire Hotel - 9500 Wilshire Blvd., Beverly Hills, California, USA",
/title/tt0086960/,Beverly Hills Cop,"Magnolia Street, Detroit, Michigan, USA",(Truck Chase)                        
/title/tt0086960/,Beverly Hills Cop,"Brush Street, Detroit, Michigan, USA",(Truck Chase)                        
/title/tt0086960/,Beverly Hills Cop,"Korean Air Cargo Terminal, Los Angeles International Airport - 1 World Way, Los Angeles, California, USA",(customs warehouse)                        
/title/tt0086960/,Beverly Hills Cop,"Pershing Square, Downtown, Los Angeles, California, USA",(Banana in the tailpipe scene)                        
/title/tt0086960/,Beverly Hills Cop,"Los Angeles, California, USA",
/title/tt0086960/,Beverly Hills Cop,"Winder Street, Detroit, Michigan, USA",(Truck Chase)                        
/title/tt0086960/,Beverly Hills Cop,"Dearborn, Michigan, USA",(factory in opening shots)                        
/title/tt0086960/,Beverly Hills Cop,"Hollywood, Los Angeles, California, USA",(Strip club scenes)                        
/title/tt0086960/,Beverly Hills Cop,"Downtown, Los Angeles, California, USA",(Eddie's apartment)                        
/title/tt0086960/,Beverly Hills Cop,"Olive Street, Los Angeles, California, USA",
/title/tt0086960/,Beverly Hills Cop,"Rodeo Drive, Beverly Hills, California, USA",(street scene)                        
/title/tt0086960/,Beverly Hills Cop,"Wilshire Boulevard, Los Angeles, California, USA",(Art gallery at 9680 Wilshire Bld) (Axel thrown through the window at 3699 Wilshire Bld)                        
/title/tt0086960/,Beverly Hills Cop,"600 S. Normandie Avenue, Los Angeles, California, USA",(warehouse)                        
/title/tt0086960/,Beverly Hills Cop,"Sunset Blvd., Hollywood, Los Angeles, California, USA",
/title/tt1842530/,Unforgettable,"Silvercup Studios - 4222 22nd Street, Long Island City, Queens, New York City, New York, USA",(studio)                        
/title/tt1842530/,Unforgettable,"Queens, New York City, New York, USA",
/title/tt9099800/,Savage,"Wellington, New Zealand",
/title/tt2103085/,Top of the Lake,"Queenstown, Otago, New Zealand",(season 1)                        
/title/tt2103085/,Top of the Lake,"Bondi Beach, Sydney, New South Wales, Australia",(Season 2)                        
/title/tt0120812/,Rush Hour,"Foo-Chow Restaurant - 949 N Hill Street, Chinatown, Los Angeles, California, USA",
/title/tt0120812/,Rush Hour,"Capitol Records - 1750 N. Vine Street, Hollywood, Los Angeles, California, USA",(exterior only)                        
/title/tt0120812/,Rush Hour,"Hong Kong, China",
/title/tt0120812/,Rush Hour,"556 S Broadway, Los Angeles, California, USA","(FBI raid, explosion)                        "
/title/tt0120812/,Rush Hour,"380 South San Rafael Avenue, Pasadena, California, USA",(exterior: Chinese Consulate in Los Angeles)                        
/title/tt0120812/,Rush Hour,"Chinatown, Los Angeles, California, USA",
/title/tt0120812/,Rush Hour,"Grauman's Chinese Theater - 6925 Hollywood Blvd., Hollywood, Los Angeles, California, USA",
/title/tt0120812/,Rush Hour,"Greystone Park & Mansion - 905 Loma Vista Drive, Beverly Hills, California, USA",(entrance to the Chinese consulate)                        
/title/tt0120812/,Rush Hour,"Daly Market - 2235 Daly St, Los Angeles, California, USA",(exterior: Carter handcuffs Lee to steering wheel)                        
/title/tt0120812/,Rush Hour,USA,
/title/tt0120812/,Rush Hour,"Hollywood, Los Angeles, California, USA",
/title/tt1988386/,Miss Fisher's Murder Mysteries,"Wardlow, 114 Park Drive, Parkville, Melbourne, Victoria, Australia",(Phryne Fisher's House)                        
/title/tt1988386/,Miss Fisher's Murder Mysteries,"Melbourne, Victoria, Australia",
/title/tt0458481/,Sin City: A Dame to Kill For,"Troublemaker Studios - 4900 Old Manor Road, Austin, Texas, USA",
/title/tt0458481/,Sin City: A Dame to Kill For,USA,
/title/tt5827790/,Orígenes secretos,"Madrid, Spain",
/title/tt0094484/,In the Heat of the Night,"Covington, Georgia, USA",
/title/tt0094484/,In the Heat of the Night,"Milstead Village, Georgia, USA",
/title/tt0094484/,In the Heat of the Night,"Laurel Valley, Thibodaux, Louisiana, USA",
/title/tt4633690/,Shot Caller,"Los Lunas, New Mexico, USA",(RAKS building supply where supplies were purchased)                        
/title/tt0328107/,Man on Fire,"Naples, Campania, Italy",
/title/tt0328107/,Man on Fire,"El Paso, Texas, USA",
/title/tt0328107/,Man on Fire,"Mexico City, Distrito Federal, Mexico",
/title/tt0328107/,Man on Fire,"Los Angeles, California, USA",
/title/tt0328107/,Man on Fire,Italy,
/title/tt0328107/,Man on Fire,"California, USA",
/title/tt0172156/,Bad Boys II,Puerto Rico,
/title/tt0172156/,Bad Boys II,"Manatí, Puerto Rico",(City Hall)                        
/title/tt0172156/,Bad Boys II,"Miami Beach, Florida, USA",
/title/tt0172156/,Bad Boys II,"Intersection of US Highway 41 & SW 1st Ave - Miami, Florida, USA",(Haitian Zoe Pounder car chase car pile up)                        
/title/tt0172156/,Bad Boys II,Netherlands,
/title/tt0172156/,Bad Boys II,"Delray Beach, Florida, USA",
/title/tt0172156/,Bad Boys II,"Florida, USA",
/title/tt0172156/,Bad Boys II,"El Eden Motel - 115 SW 8th St, Miami, Florida, USA",(Zoe Pounder car chase; exterior.)                        
/title/tt0172156/,Bad Boys II,"Federal Prison Gun Range, 15801 SW 137th Ave, Miami, Florida, USA",(Firearms Training location for the Actors)                        
/title/tt0172156/,Bad Boys II,"570 Northeast 81st Street - Miami, Florida, USA",(Miami Bank: End of car chase where the dead bodies fall out of the trucks)                        
/title/tt1831575/,Appropriate Adult,"England, UK",
/title/tt0107554/,Menace II Society,"Grape Street, Watts, Los Angeles, California, USA",
/title/tt0107554/,Menace II Society,"Compton Avenue, Watts, Los Angeles, California, USA",
/title/tt0107554/,Menace II Society,"7th Ave and Montclair St., Los Angeles, California, USA",
/title/tt0107554/,Menace II Society,"Pinchers Liquor Store, 5121 Pico Blvd, Los Angeles, California, USA",(Liquor store at the beginning of the movie)                        
/title/tt0107554/,Menace II Society,"South Central Los Angeles, Los Angeles, California, USA",
/title/tt0107554/,Menace II Society,"2181 Cambridge Street, Los Angeles, California, USA",(Graduation party house)                        
/title/tt0107554/,Menace II Society,"3423 West 43rd Place, Los Angeles, California, USA",(Harold & Caine are jacked in front of this address.)                        
/title/tt9307990/,Lincoln Rhyme: Hunt for the Bone Collector,"Morristown, New Jersey, USA",
/title/tt9307990/,Lincoln Rhyme: Hunt for the Bone Collector,"New York, USA",
/title/tt9307990/,Lincoln Rhyme: Hunt for the Bone Collector,"Newark, New Jersey, USA",
/title/tt9307990/,Lincoln Rhyme: Hunt for the Bone Collector,"Kearny, New Jersey, USA",
/title/tt9307990/,Lincoln Rhyme: Hunt for the Bone Collector,"Paterson, New Jersey, USA",
/title/tt9307990/,Lincoln Rhyme: Hunt for the Bone Collector,"Woodland Park, New Jersey, USA",
/title/tt0118887/,Cop Land,"Edgewater, New Jersey, USA","(Garrison, New Jersey)                        "
/title/tt0118887/,Cop Land,"Fairleigh Dickinson University - 1000 River Road, Teaneck, New Jersey, USA",(Stallone under bridge)                        
/title/tt0118887/,Cop Land,"Teaneck, New Jersey, USA",
/title/tt0118887/,Cop Land,"Jersey City, New Jersey, USA",
/title/tt0118887/,Cop Land,"Sony Pictures Studios - 10202 W. Washington Blvd., Culver City, California, USA",(studio) (underwater sequence)                        
/title/tt0118887/,Cop Land,"New Jersey, USA",
/title/tt0118887/,Cop Land,"New York, USA",
/title/tt0118887/,Cop Land,"913 River Rd, Edgewater, New Jersey, USA",(sheriff's office)                        
/title/tt0118887/,Cop Land,"River Rd, Edgewater, New Jersey, USA",(street scenes)                        
/title/tt2294449/,22 Jump Street,"San Juan, Puerto Rico",
/title/tt2294449/,22 Jump Street,"Lafreniere Park - 3000 Downs Blvd, Metairie, Louisiana, USA",(bike patrol scenes)                        
/title/tt2294449/,22 Jump Street,"Milan Street Wharf - Port of New Orleans, New Orleans, Louisiana, USA",(opening sequence)                        
/title/tt2294449/,22 Jump Street,"Historic St James AME Church - 222 N Roman St, New Orleans, Louisiana, USA",(old clandestine police HQ at 21 Jump St)                        
/title/tt2294449/,22 Jump Street,"Tulane University - 6823 St. Charles Avenue, New Orleans, Louisiana, USA",(Metropolitan City State College campus)                        
/title/tt2294449/,22 Jump Street,"Loyola University New Orleans - 6363 St Charles Ave, New Orleans, Louisiana, USA",(Metropolitan City State College campus)                        
/title/tt2294449/,22 Jump Street,Sheraton Old San Juan,(Valet Area)                        
/title/tt0322259/,2 Fast 2 Furious,"Weston, Florida, USA",
/title/tt0322259/,2 Fast 2 Furious,"Universal Studios Florida, Universal Orlando Resort - 1000 Universal Studios Plaza, Orlando, Florida, USA",(studio)                        
/title/tt0322259/,2 Fast 2 Furious,"Boca Raton, Florida, USA",
/title/tt0322259/,2 Fast 2 Furious,"Versailles Restaurant - 3555 SW 8th Street, Miami, Florida, USA",
/title/tt0322259/,2 Fast 2 Furious,"Seven Mile Bridge, Florida Keys, Florida, USA",
/title/tt0322259/,2 Fast 2 Furious,"Hollywood, Florida, USA",
/title/tt0322259/,2 Fast 2 Furious,"Stage 4, Universal Studios - 100 Universal City Plaza, Universal City, California, USA",
/title/tt0322259/,2 Fast 2 Furious,"Miami, Florida, USA",
/title/tt7456312/,The Last Thing He Wanted,Puerto Rico,
/title/tt1197624/,Law Abiding Citizen,"Holmesburg Prison - 8215 Torresdale Avenue, Philadelphia, Pennsylvania, USA",
/title/tt1197624/,Law Abiding Citizen,"Philadelphia City Hall - 1450 John F. Kennedy Blvd., Philadelphia, Pennsylvania, USA",
/title/tt1197624/,Law Abiding Citizen,"Girard Point, Philadelphia, Pennsylvania, USA",
/title/tt1355683/,Black Mass,"Lynn, Massachusetts, USA",
/title/tt1355683/,Black Mass,"Highland St, Chelsea, Massachusetts, USA",(street scenes)                        
/title/tt1355683/,Black Mass,"Harvard Club of Boston, 374 Commonwealth Ave, Boston, Massachusetts, USA",
/title/tt1355683/,Black Mass,"Lancaster St., Boston, Massachusetts, USA",(street scenes)                        
/title/tt1355683/,Black Mass,"Margaret St, Boston, Massachusetts, USA",
/title/tt1355683/,Black Mass,"Randolph, Massachusetts, USA",(Night Club scene)                        
/title/tt1355683/,Black Mass,"Boston, Massachusetts, USA",
/title/tt6819848/,Sleeping in Plastic,"Harrah, Oklahoma, USA",
/title/tt0433309/,Numb3rs,"2515 4th Ave, Los Angeles, California, USA",(Eppes House)                        
/title/tt0433309/,Numb3rs,"Los Angeles Center Studios - 450 S. Bixel Street, Downtown, Los Angeles, California, USA",
/title/tt1152836/,Public Enemies,"Oshkosh, Wisconsin, USA",
/title/tt1152836/,Public Enemies,"Milwaukee, Wisconsin, USA",
/title/tt1152836/,Public Enemies,"Crown Point, Indiana, USA",
/title/tt1152836/,Public Enemies,"Beaver Dam, Wisconsin, USA",
/title/tt1152836/,Public Enemies,"Lockport, Illinois, USA",
/title/tt1152836/,Public Enemies,"Chicago, Illinois, USA",
/title/tt1152836/,Public Enemies,"Tucson, Arizona, USA",(exterior: Congress Hotel front)                        
/title/tt1152836/,Public Enemies,"Clark and Roscoe, Chicago, Illinois, USA",
/title/tt1152836/,Public Enemies,"Old Joliet Prison - 1125 Collins Street, Joliet, Illinois, USA",
/title/tt1152836/,Public Enemies,"Union Station - Canal St. & Jackson Blvd., Near West Side, Chicago, Illinois, USA",
/title/tt0317740/,The Italian Job,"Canazei, Trento, Trentino - Alto Adige, Italy",
/title/tt0317740/,The Italian Job,"Campo San Barnaba, Venice, Veneto, Italy",
/title/tt0317740/,The Italian Job,"Hollywood Boulevard & Vine Street, Hollywood, Los Angeles, California, USA",
/title/tt0317740/,The Italian Job,"Philadelphia, Pennsylvania, USA",
