,Code,Show Name,Location,Scene,geocodedLocation,latitude,longitude
2019,/title/tt0167190/,Hellboy,"Barrandov Studios, Prague, Czech Republic",(studio)                        ,,,
2020,/title/tt0167190/,Hellboy,Czech Republic,,Česko,49.8167003,15.4749544
2021,/title/tt0359013/,Blade: Trinity,"Intersection of Granville and West Georgia Street, Vancouver, British Columbia, Canada",,,,
2022,/title/tt0359013/,Blade: Trinity,"Under the Gardner Expressway, Lakeshore Blvd., Toronto, Ontario, Canada","(car scene, 1st half)                        ",,,
2023,/title/tt0116040/,Daylight,"Cinecittà Studios, Cinecittà, Rome, Lazio, Italy",(studio)                        ,,,
2024,/title/tt0116040/,Daylight,"Rome, Lazio, Italy",(all tunnel shooting/primary location)                        ,"Roma Capitale, Lazio, Italia",41.85223935,12.631036615953583
2025,/title/tt0116040/,Daylight,"Croton-on-Hudson, New York, USA",,"Croton-on-Hudson, Westchester County, New York, 10520, United States of America",41.2083836,-73.8901688
2026,/title/tt0116040/,Daylight,"New Jersey, USA",,"New Jersey, United States of America",40.0757384,-74.4041622
2027,/title/tt0116040/,Daylight,"New York, USA",,"New York, United States of America",40.7127281,-74.0060152
2028,/title/tt11854694/,Special OPS,Jordan,,الأردن,31.1667049,36.941628
2029,/title/tt11854694/,Special OPS,India,,India,22.3511148,78.6677428
2030,/title/tt4244998/,Alpha,"Vancouver, British Columbia, Canada",(main location)                        ,"Vancouver, Metro Vancouver Regional District, British Columbia, Canada",49.2608724,-123.1139529
2031,/title/tt4244998/,Alpha,"Brooks, Alberta, Canada",(location)                        ,"Brooks, Alberta, Canada",50.571027,-111.893005
2032,/title/tt2334879/,White House Down,"Cité du Cinéma, Montréal, Québec, Canada",(studio)                        ,,,
2033,/title/tt2334879/,White House Down,Canada,,Canada,61.0666922,-107.9917071
2034,/title/tt2106361/,Into the Storm,"Detroit, Michigan, USA",,"Detroit, Wayne County, Michigan, United States of America",42.3315509,-83.0466403
2035,/title/tt2106361/,Into the Storm,"Oakland Charter Township, Michigan, USA",(Silverton High School)                        ,"Oakland Charter Township, Oakland County, Michigan, United States of America",42.754860699999995,-83.15655729663453
2036,/title/tt2452242/,Happy!,"Clinton Diner, Maspeth, Queens, New York City, New York, USA",(Diner)                        ,,,
2037,/title/tt1899353/,The Raid,Indonesia,(Jakarta)                        ,Indonesia,-2.4833826,117.8902853
2038,/title/tt0287978/,Daredevil,"Los Angeles, California, USA",,"Los Angeles, Los Angeles County, California, United States of America",34.0536909,-118.2427666
2039,/title/tt0287978/,Daredevil,"Biltmore Hotel - 506 S. Grand Avenue, Downtown, Los Angeles, California, USA","(The Grand Hotel interior, hosting the Black & White Ball)                        ",,,
2040,/title/tt0287978/,Daredevil,"First Congregational Church - 540 S. Commonwealth Avenue, Los Angeles, California, USA",,,,
2041,/title/tt0287978/,Daredevil,"Santa Clarita, California, USA",,"Santa Clarita, Los Angeles County, California, United States of America",34.3916641,-118.542586
2042,/title/tt0287978/,Daredevil,"Downey Studios - 12214 Lakewood Boulevard, Downey, California, USA",(studio)                        ,,,
2043,/title/tt0287978/,Daredevil,"California, USA",,"California, United States of America",36.7014631,-118.7559974
2044,/title/tt0287978/,Daredevil,USA,,United States,39.7837304,-100.4458825
2045,/title/tt1411250/,The Chronicles of Riddick: Rule the Dark,"Montréal, Québec, Canada",,"Montréal, Agglomération de Montréal, Montréal (06), Québec, Canada",45.4972159,-73.6103642
2046,/title/tt9544034/,The Family Man,"Leh, Ladakh, Jammu & Kashmir, India",(Filming City)                        ,,,
2047,/title/tt9544034/,The Family Man,"Kashmir, India",(Filming City)                        ,"Kashmir, Sheo Tehsil, Barmer, Rajasthan, India",26.2644203,71.6027498
2048,/title/tt4230076/,The Defenders,USA,,United States,39.7837304,-100.4458825
2049,/title/tt1764651/,The Expendables 2,"Plovdiv Airport, Bulgaria",(Krumovo Airport)                        ,"Летище Пловдив, 8601, Куклен, Пловдив, 4009, България",42.07693315,24.844065616554147
2050,/title/tt1764651/,The Expendables 2,"Vitosha, Bulgaria",,"Витоша, Перник, България",42.56,23.28
2051,/title/tt1764651/,The Expendables 2,"Devetaki Cave, Bulgaria",,,,
2052,/title/tt1764651/,The Expendables 2,"Lovech, Bulgaria",,"Ловеч, България",43.0443145,24.487966724322504
2053,/title/tt1764651/,The Expendables 2,"Bansko, Bulgaria",,"Банско, Благоевград, 2770, България",41.8344086,23.4841698
2054,/title/tt1764651/,The Expendables 2,"Ognyanovo Reservoir, Bulgaria",,"Огняново, Пазарджик, 4400, България",42.14752,24.41297
2055,/title/tt1764651/,The Expendables 2,China,,中国,35.000074,104.999927
2056,/title/tt0091225/,Howard the Duck,"Petaluma, California, USA","(Petaluma River is used for almost all waterway scenes, with takeoff from Western Avenue)                        ","Petaluma, Sonoma County, California, United States of America",38.270022,-122.60612241304348
2057,/title/tt0091225/,Howard the Duck,"Modesto, California, USA",,"Modesto, Stanislaus County, California, United States of America",37.6390972,-120.9968782
2058,/title/tt0091225/,Howard the Duck,"Black Point, California, USA",(Ultralight loops the Sears Point Bridge)                        ,"Black Point, Fresno County, California, 93605, United States of America",37.2380008,-119.2601236
2059,/title/tt0091225/,Howard the Duck,"Oakland, California, USA",,"Oakland, Alameda County, California, United States of America",37.8044557,-122.2713563
2060,/title/tt0091225/,Howard the Duck,"Sacramento, California, USA",,"Sacramento, Sacramento County, California, United States of America",38.5815719,-121.4943996
2061,/title/tt0091225/,Howard the Duck,"Irving Street, San Francisco, California, USA","(Taxi goes from 9th Avenue onto Irving, then through the 800 block of Irving Street)                        ","Irving Street, Inner Sunset, San Francisco, San Francisco City and County, California, 94122, United States of America",37.7635724,-122.4771362
2062,/title/tt0091225/,Howard the Duck,"Carneros Highway, Napa, California, USA","(Joe Roma's Cajun/Sushi Café; exterior) (coordinates: 38°15'19.7""N 122°19'44.9""W)                        ","Carneros Highway, Stanly, Napa, Napa County, California, 94559, United States of America",38.2575826,-122.3027297
2063,/title/tt0091225/,Howard the Duck,"Industrial Light and Magic - 3210 Kerner Boulevard, San Rafael, California, USA",(studio)                        ,,,
2064,/title/tt1194173/,The Bourne Legacy,"El Nido, Palawan, Philippines",(ending scene)                        ,"El Nido, Palawan, Mimaropa, 5313, Philippines",11.1800079,119.3904846
2065,/title/tt1194173/,The Bourne Legacy,"Manila, Metro Manila, Philippines",,"Manila, First District, Metro Manila, Philippines",14.5907332,120.9809674
2066,/title/tt1194173/,The Bourne Legacy,"Kananaskis Country, Alberta, Canada",(as Alaska)                        ,"Kananaskis Country Golf Course, Kananaskis Trail, Kananaskis Village, Kananaskis Improvement District, Alberta, Canada",50.90414855,-115.1464755019835
2067,/title/tt1194173/,The Bourne Legacy,"Chicago, Illinois, USA",,"Chicago, Cook County, Illinois, United States of America",41.8755616,-87.6244212
2068,/title/tt1194173/,The Bourne Legacy,"Long Island, New York, USA",,"Long Island, Suffolk County, New York, United States of America",40.85172235,-73.09921882199973
2069,/title/tt1194173/,The Bourne Legacy,"Kaufman Astoria Studios - 3412 36th Street, Astoria, Queens, New York City, New York, USA",(studio)                        ,,,
2070,/title/tt1194173/,The Bourne Legacy,"Taft Avenue MRT station, Pasay City, Metro Manila, Philippines",(chase on the footbridge)                        ,,,
2071,/title/tt1194173/,The Bourne Legacy,"Dr. Oliver Bronson House, Hudson, New York, USA",(exteriors: Dr. Shearing's house in the woods)                        ,,,
2072,/title/tt1194173/,The Bourne Legacy,"Empress Diner, East Meadow, Long Island, New York, USA",,,,
2073,/title/tt0993840/,Army of the Dead,"Showboat Atlantic City, Atlantic City, New Jersey, USA",,"Showboat Atlantic City, Delaware Avenue, Carver Hall Apartments, Venice Park, Atlantic City, Atlantic County, New Jersey, 08401, United States of America",39.361178499999994,-74.41806413216578
2074,Code,Show Name,Location,Scene,"Location, Tucker County, West Virginia, United States of America",39.2138905,-79.6371124
2075,/title/tt2103188/,Grand Theft Auto V,"Los Angeles, California, USA",(Los Santos)                        ,"Los Angeles, Los Angeles County, California, United States of America",34.0536909,-118.2427666
2076,/title/tt2103188/,Grand Theft Auto V,"Koreatown, Los Angeles, California, USA",,"Koreatown, Wilshire Boulevard, Koreatown, Los Angeles, Los Angeles County, California, 90005, United States of America",34.0617936,-118.3054475
2077,/title/tt1139592/,Jeepers Creepers 3,"Baton Rouge, Louisiana, USA",,"Baton Rouge, East Baton Rouge Parish, Louisiana, United States of America",30.4459596,-91.18738
2078,/title/tt1139592/,Jeepers Creepers 3,"New Roads, Louisiana, USA","(Sheriff Station, Feed Store)                        ","New Roads, Pointe Coupee Parish, Louisiana, United States of America",30.7015741,-91.4362242
2079,/title/tt1139592/,Jeepers Creepers 3,"Jackson, Louisiana, USA",,"Jackson Parish, Louisiana, United States of America",32.2932692,-92.5628442
2080,/title/tt1139592/,Jeepers Creepers 3,"Village Studios - 4626 Highway 68, Jackson, Louisiana, USA",(studio) (interior: Creeper's Truck)                        ,,,
2081,/title/tt1139592/,Jeepers Creepers 3,"Louisiana, USA",,"Louisiana, United States of America",30.8703881,-92.007126
2082,/title/tt0119190/,George uit de jungle,"Kaua'i, Hawaii, USA",,"Kauaʻi, Kauaʻi County, Hawaii, United States of America",22.050466550000003,-159.55876775017003
2083,/title/tt0119190/,George uit de jungle,"755 Vallejo Street, San Francisco, California, USA",,"755, Vallejo Street, North Beach, San Francisco, San Francisco City and County, California, 94133, United States of America",37.79842097058824,-122.40936132352941
2084,/title/tt0119190/,George uit de jungle,"Filoli Estate - 86 Cañada Road, Woodside, California, USA",,"Filoli Estate, 86, Cañada Road, Highlands, San Mateo County, California, 94062, United States of America",37.469806250000005,-122.31060788438967
2085,/title/tt0119190/,George uit de jungle,"San Francisco, California, USA",,"San Francisco, San Francisco City and County, California, United States of America",37.7790262,-122.4199061
2086,/title/tt0119190/,George uit de jungle,"Bronson Canyon, Griffith Park - 4730 Crystal Springs Drive, Los Angeles, California, USA",,,,
2087,/title/tt0119190/,George uit de jungle,"Las Vegas, Nevada, USA",,"Las Vegas, Clark County, Nevada, United States of America",36.1672559,-115.1485163
2088,/title/tt0119190/,George uit de jungle,"Lombard Street, San Francisco, California, USA",(George runs along a crooked street)                        ,"Lombard Street, Russian Hill, San Francisco, San Francisco City and County, California, 94133-1312, United States of America",37.802076,-122.4188091
2089,/title/tt0105946/,Babylon 5,"Sun Valley, Los Angeles, California, USA",(studio)                        ,"Sun Valley, Los Angeles, Los Angeles County, California, 91352, United States of America",34.2175042,-118.3703576
2090,/title/tt1413492/,12 Strong,"Mines Near Orogrande New Mexico, USA",,,,
2091,/title/tt1413492/,12 Strong,"Socorro, New Mexico, USA",,"Socorro, Socorro County, New Mexico, United States of America",34.0572858,-106.8930799
2092,/title/tt1413492/,12 Strong,"Albuquerque, New Mexico, USA",,"Albuquerque, Bernalillo County, New Mexico, United States of America",35.0841034,-106.6509851
2093,/title/tt1413492/,12 Strong,"Santa Clarita, California, USA",,"Santa Clarita, Los Angeles County, California, United States of America",34.3916641,-118.542586
2094,/title/tt8289480/,Treadstone,"Budapest, Hungary",,"Budapest, Közép-Magyarország, 1011, Magyarország",47.4983815,19.0404707
2095,/title/tt0080745/,Flash Gordon,"Airstrip, Breakish, Skye, Highland, Scotland, UK",,,,
2096,/title/tt0080745/,Flash Gordon,"EMI Elstree Studios, Borehamwood, Hertfordshire, England, UK",(studio) (studio: made at)                        ,,,
2097,/title/tt0082340/,Escape from New York,"Fox Theater - 527 N. Grand Boulevard, St. Louis, Missouri, USA",(Broadway theatre relics)                        ,,,
2098,/title/tt0082340/,Escape from New York,"Union Station - 1 St Louis Union Station, St. Louis, Missouri, USA",(fight in Madison Square Gardens)                        ,,,
2099,/title/tt0082340/,Escape from New York,"Civil Courts Building - Twelfth Street, St. Louis, Missouri, USA",(hideout of Brain)                        ,,,
2100,/title/tt0082340/,Escape from New York,"Grand Hall, Union Station - 1 St Louis Union Station, St. Louis, Missouri, USA",(fight in Madison Square Gardens)                        ,,,
2101,/title/tt0082340/,Escape from New York,"Atlanta, Georgia, USA",(MARTA rapid transit system scenes deleted)                        ,"Atlanta, Georgia, United States of America",33.7490987,-84.3901849
2102,/title/tt0082340/,Escape from New York,"Indian Dunes - 28700 Henry Mayo Drive, Valencia, California, USA",(Glider sequences)                        ,,,
2103,/title/tt0082340/,Escape from New York,"The Wiltern - 3790 Wilshire Blvd., Los Angeles, California, USA",,"Wiltern Theatre and Pellissier Building, 3780, Wilshire Boulevard, Koreatown, Los Angeles, Los Angeles County, California, 90010, United States of America",34.061270199999996,-118.30856470082979
2104,/title/tt0082340/,Escape from New York,"Los Angeles, California, USA",,"Los Angeles, Los Angeles County, California, United States of America",34.0536909,-118.2427666
2105,/title/tt0082340/,Escape from New York,"Davis-Monthan Air Force Base, Tucson, Arizona, USA",(Airplane graveyard scene deleted - Gullfire Glider over Leningrad scenes deleted)                        ,"Davis-Monthan Air Force Base, Yuma Street, Vandenberg Village, Tucson, Pima County, Arizona, 85707-3529, United States of America",32.17079565,-110.86990239630313
2106,/title/tt0082340/,Escape from New York,"California Institute of the Arts, Valencia, California, USA",(The scene where Snake tries to start the Datsun and one of the Duke of New York's minions comes out of the engine compartment was filmed in the Main Lobby of Cal Arts.)                        ,,,
2107,/title/tt0082340/,Escape from New York,"Hartsfield-Jackson Atlanta International Airport - 6000 North Terminal Parkway, Atlanta, Georgia, USA",(Bank robbery scenes deleted)                        ,"Hartsfield–Jackson Atlanta International Airport, 6000, North Terminal Parkway, Jamestown Court, Cooks Crossing, College Park, Clayton County, Georgia, 30337, United States of America",33.63779875,-84.42927118585675
2108,/title/tt0082340/,Escape from New York,"Santa Clarita, California, USA",,"Santa Clarita, Los Angeles County, California, United States of America",34.3916641,-118.542586
2109,/title/tt0082340/,Escape from New York,"New York Harbor, New York City, New York, USA",,,,
2110,/title/tt0082340/,Escape from New York,"Valencia, California, USA",,"Valencia, Santa Clarita, Los Angeles County, California, 91355, United States of America",34.413819,-118.5610378
2111,/title/tt0082340/,Escape from New York,"Missouri, USA",,"Missouri, United States of America",38.7604815,-92.5617875
2112,/title/tt6807662/,The New Legends of Monkey,"Kumeu Film Studios, 116 Access Rd, Kumeu 0891, New Zealand",,,,
2113,/title/tt1855199/,End of Watch,"Los Angeles, California, USA",,"Los Angeles, Los Angeles County, California, United States of America",34.0536909,-118.2427666
2114,/title/tt0475394/,Smokin' Aces,"South Lake Tahoe, California, USA",,"South Lake Tahoe, Amador, California, United States of America",38.9332411,-119.9843482
2115,/title/tt0475394/,Smokin' Aces,"Las Vegas, Nevada, USA",,"Las Vegas, Clark County, Nevada, United States of America",36.1672559,-115.1485163
2116,/title/tt0475394/,Smokin' Aces,"El Dorado County, California, USA",,,,
2117,/title/tt0475394/,Smokin' Aces,"California, USA",,"California, United States of America",36.7014631,-118.7559974
2118,/title/tt0406375/,Zathura: A Space Adventure,"South Pasadena, California, USA",,"South Pasadena, Los Angeles County, California, 91030, United States of America",34.1133062,-118.1478291
2119,/title/tt0406375/,Zathura: A Space Adventure,"Sony Pictures Studios - 10202 W. Washington Blvd., Culver City, California, USA",(studio)                        ,,,
2120,/title/tt5822564/,The Kitchen,"New York City, New York, USA",,"New York, United States of America",40.7127281,-74.0060152
2121,/title/tt8050756/,The Owl House,Paris France,(location)                        ,"Paris, Île-de-France, France métropolitaine, France",48.8566969,2.3514616
2122,/title/tt0097428/,Ghostbusters II,"Fire Station 23 - 225 E. 5th Street, Los Angeles, California, USA",(interiors: Ghostbusters headquarters)                        ,"Fire Station 23, 225, East 5th Street, Skid Row, Downtown, Los Angeles, Los Angeles County, California, 90013, United States of America",34.0458225,-118.24658608422999
2123,/title/tt0097428/,Ghostbusters II,"Greystone Park & Mansion - 905 Loma Vista Drive, Beverly Hills, California, USA",,,,
2124,/title/tt0097428/,Ghostbusters II,"Val's Restaurant, 10130 Riverside Drive, Toluca Lake, California, USA",(restaurant where Dana and Peter have dinner)                        ,,,
2125,/title/tt0097428/,Ghostbusters II,"Stage 15, Warner Brothers Burbank Studios - 4000 Warner Boulevard, Burbank, California, USA",(studio)                        ,,,
2126,/title/tt0097428/,Ghostbusters II,"Stage 16, Warner Brothers Burbank Studios - 4000 Warner Boulevard, Burbank, California, USA",(studio)                        ,,,
2127,/title/tt1020558/,Centurion,"Cairngorm Mountains, Highland, Scotland, UK",,,,
2128,/title/tt1020558/,Centurion,"Badenoch and Strathspey, Highland, Scotland, UK",,"Strathspey & Badenoch Herald, High Street, Inverallan, Grantown-on-Spey, Highland, Scotland, PH26 3HB, United Kingdom",57.3297522,-3.6093822
2129,/title/tt1020558/,Centurion,"Surrey, England, UK",,"Surrey, Mickleham, Mole Valley, Surrey, South East, England, United Kingdom",51.2715316,-0.3414523511290909
2130,/title/tt1020558/,Centurion,"H Stage, Pinewood Studios, Iver Heath, Buckinghamshire, England, UK",(studio)                        ,,,
2131,/title/tt1020558/,Centurion,"G Stage, Shepperton Studios, Shepperton, Surrey, England, UK",(studio)                        ,,,
2132,/title/tt12546328/,Crash Bandicoot 4: It's About Time,"Chicago Illinois, USA",(beach scenes)                        ,"Chicago, Cook County, Illinois, United States of America",41.8755616,-87.6244212
2133,/title/tt0067116/,The French Connection,"Château d'If, Marseille, Bouches-du-Rhône, France","(secret meeting between Charnier, Nicoli and Devereaux)                        ","Château d'If, Rue Georges Beuchat, Îles du Frioul, 7e Arrondissement, Marseille, Bouches-du-Rhône, Provence-Alpes-Côte d'Azur, France métropolitaine, 13007, France",43.27986085,5.325270475179353
2134,/title/tt0067116/,The French Connection,"Le Copain 891 1st Ave, New York City, New York, USA",(French Restaurant)                        ,,,
2135,/title/tt0067116/,The French Connection,"86th Street, Brooklyn, New York City, New York, USA",(chase scene)                        ,"86th Street, Gravesend, Brooklyn, Kings County, New York, 11223, United States of America",40.592721,-73.97823
2136,/title/tt0067116/,The French Connection,"La samaritaine - 2 Quai du Vieux-Port, Marseille, Bouches-du-Rhône, France",,,,
2137,/title/tt0067116/,The French Connection,"Onderdonk Avenue, Ridgewood, Queens, New York City, New York, USA",,"Onderdonk Avenue, Ridgewood, Queens County, New York, 11385, United States of America",40.710727,-73.918623
2138,/title/tt0067116/,The French Connection,"Wards Island, New York City, New York, USA",(the final shootout scene)                        ,"Wards Island, New York, 11102, United States of America",40.7876012,-73.9254149
2139,/title/tt0067116/,The French Connection,"Grand Central Station Shuttle, Manhattan, New York City, New York, USA",,,,
2140,/title/tt0067116/,The French Connection,"Chez Fonfon - 140 Rue du Vallon des Auffes, Marseille, Bouches-du-Rhône, France",(opening scene: Charnier exits the restaurant)                        ,,,
2141,/title/tt0067116/,The French Connection,"Rue Baussenque, Marseille, Bouches-du-Rhône, France",(street scenes)                        ,"Rue Baussenque, Hôtel de Ville, Le Panier, 2e Arrondissement, Marseille, Bouches-du-Rhône, Provence-Alpes-Côte d'Azur, France métropolitaine, 13002, France",43.2986085,5.3667262
2142,/title/tt0067116/,The French Connection,"912 Broadway, Brooklyn, New York City, New York, USA","(""Rio Piedras"" theater - actually the Broadway Theater - Santa Clause scene)                        ","912, Broadway, Brooklyn, Kings County, New York, 11206, United States of America",40.69776842857143,-73.93647357142858
2143,/title/tt0067116/,The French Connection,"Avenue De L'Amiral Ganteaume, Cassis, Bouches-du-Rhône, France",(Charnier's house)                        ,"Avenue de l'Amiral Ganteaume, La Grande Bastide, Cassis, Marseille, Bouches-du-Rhône, Provence-Alpes-Côte d'Azur, France métropolitaine, 13260, France",43.2146206,5.5355868
2144,/title/tt0067116/,The French Connection,"Putnam Avenue, Ridgewood, Queens, New York City, New York, USA",,"Putnam Avenue, Ridgewood, Queens County, New York, 11385, United States of America",40.703538,-73.903381
2145,/title/tt0067116/,The French Connection,"Washington, District of Columbia, USA",,"Washington, District of Columbia, 20230, United States of America",38.8949924,-77.0365581
2146,/title/tt0067116/,The French Connection,"Manhattan, New York City, New York, USA",,"Manhattan, New York County, New York, United States of America",40.7896239,-73.9598939
2147,/title/tt0067116/,The French Connection,"940 2nd Avenue, New York City, New York, USA",(scene where Charnier and Nicoli buy fruit and Popeye is watching)                        ,"2nd Avenue, East Village, Manhattan Community Board 3, Manhattan, New York County, New York, 10012-3332, United States of America",40.723986,-73.9909867
2148,/title/tt0067116/,The French Connection,"Dover Street and Water Street, Manhattan, New York City, New York, USA",(scene where Sal parks the Lincoln on Dover street by the Brooklyn Bridge)                        ,,,
2149,/title/tt0067116/,The French Connection,"Henry Hudson Parkway Route 9A at Junction 24, New York City, New York, USA",(car accident scene)                        ,,,
2150,/title/tt0067116/,The French Connection,"Ratner's Restaurant, 138 Delancey Street, New York City, New York, USA",(scene where Sal and Angie emerge)                        ,,,
2151,/title/tt0067116/,The French Connection,"Ronaldo Maia Flowers, 27 East 67th Street at Madison, New York City, New York, USA",(scene where Charnier gives Popeye the slip)                        ,,,
2152,/title/tt0067116/,The French Connection,"South Street at Market Street, near Manhattan Bridge, New York City, New York, USA",(scene where Doyle emerges from a bar)                        ,,,
2153,/title/tt0067116/,The French Connection,"Ellery Street, Brooklyn, New York City, New York, USA",(Doyle and Russo beat a suspect)                        ,"Ellery Street, Brooklyn, Kings County, New York, 11206, United States of America",40.69948,-73.939728
2154,/title/tt0067116/,The French Connection,"Plage du bestouan, Cassis, Bouches-du-Rhône, France",,"Plage du Bestouan, Avenue Jean-Jacques Garcin, Cassis, Marseille, Bouches-du-Rhône, Provence-Alpes-Côte d'Azur, France métropolitaine, 13260, France",43.212976299999994,5.531031103393383
2155,/title/tt0067116/,The French Connection,USA,,United States,39.7837304,-100.4458825
2156,/title/tt0067116/,The French Connection,"National Mall, Washington, District of Columbia, USA",(Sal meets Charnier)                        ,"National Mall, Washington, District of Columbia, United States of America",38.8854281,-77.0414734922376
2157,/title/tt0067116/,The French Connection,"Cassis, Bouches-du-Rhône, France",,"Cassis, Marseille, Bouches-du-Rhône, Provence-Alpes-Côte d'Azur, France métropolitaine, 13260, France",43.2140359,5.5396318
2158,/title/tt0144117/,The Boondock Saints,"Toronto, Ontario, Canada",,"Toronto, Peel, Golden Horseshoe, Ontario, Canada",43.6534817,-79.3839347
2159,/title/tt0144117/,The Boondock Saints,"Longfellow Bridge, Boston, Massachusetts, USA",,"Longfellow Bridge, Cambridge, Suffolk County, Massachusetts, 02114-3203, United States of America",42.361396,-71.0728848
2160,/title/tt0144117/,The Boondock Saints,"South Boston, Boston, Massachusetts, USA",,"South Boston, Boston, Suffolk County, Massachusetts, 02127, United States of America",42.3334312,-71.0494949
2161,/title/tt0144117/,The Boondock Saints,"Boston, Massachusetts, USA",,"Boston, Suffolk County, Massachusetts, United States of America",42.3602534,-71.0582912
2162,/title/tt0144117/,The Boondock Saints,USA,,United States,39.7837304,-100.4458825
2163,/title/tt1321511/,Oldboy,"New Orleans, Louisiana, USA",,"New Orleans, Orleans Parish, Louisiana, United States of America",29.9499323,-90.0701156
2164,/title/tt11079116/,Superman: Man of Tomorrow,"Chicago, Illinois USA",(Metropolis)                        ,"Chicago, Cook County, Illinois, United States of America",41.8755616,-87.6244212
