,Code,Show Name,Location,Scene,geocodedLocation,latitude,longitude
0,/title/tt1648190/,The Dark Tower,"Cape Town Film Studios, Cape Town, Western Cape, South Africa",,"Cape Town Film Studios, Film City Boulevard, Houghton, Cape Town Ward 16, Eersterivier, City of Cape Town, Western Cape, 7784, South Africa",-34.0315617,18.719156772105897
1,/title/tt1648190/,The Dark Tower,"New York City, New York, USA",,"New York, United States of America",40.7127281,-74.0060152
2,/title/tt1648190/,The Dark Tower,South Africa,,South Africa,-28.8166236,24.991639
3,/title/tt1390411/,In the Heart of the Sea,"La Gomera, Canary Islands, Spain",,"La Gomera, Hermigua, Santa Cruz de Tenerife, Canarias, España",28.119242,-17.225640691220967
4,/title/tt1390411/,In the Heart of the Sea,"Canary Islands, Spain",,"Canarias, La Orotava, Santa Cruz de Tenerife, Canarias, España",28.2935785,-16.621447121144122
5,/title/tt1390411/,In the Heart of the Sea,"London, England, UK",,"London, Greater London, England, United Kingdom",51.5073219,-0.1276474
6,/title/tt1390411/,In the Heart of the Sea,UK,,United Kingdom,54.7023545,-3.2765753
7,/title/tt0360717/,King Kong,"Shelly Bay, Wellington, New Zealand",(Skull Island)                        ,"Shelly Bay, Shelly Bay Road, Maupuia, Wellington, Wellington City, Wellington, 6021, New Zealand",-41.2952851,174.8193465
8,/title/tt0360717/,King Kong,"Seaview, Wellington, New Zealand",(New York Set)                        ,"Seaview, Lower Hutt, Lower Hutt City, Wellington, 5010, New Zealand",-41.2426034,174.9045756
9,/title/tt0360717/,King Kong,"Hutt Valley, Wellington, New Zealand",(New York City Settings)                        ,"Lower Hutt, Lower Hutt City, Wellington, 5010, New Zealand",-41.2125751,174.9057626
10,/title/tt0360717/,King Kong,"Kapiti Island, Wellington Region, New Zealand",(Venture Ocean Scenes)                        ,,,
11,/title/tt0360717/,King Kong,"Miramar, Wellington, New Zealand",(studio) (various studio warehouses)                        ,"Miramar, Wellington, Wellington City, Wellington, 6021, New Zealand",-41.3133541,174.8196538
12,/title/tt0360717/,King Kong,"Stone Street Studios, Stone Street, Miramar, Wellington, New Zealand",(studio)                        ,,,
13,/title/tt0360717/,King Kong,"Civic Theatre, Queen Street, Auckland Central Business District, Auckland, New Zealand",(New York Alhambra theatre)                        ,"Civic Theatre, 269, Queen Street, Auckland Central, Waitematā, Auckland, 1010, New Zealand",-36.85114095,174.76391209159578
14,/title/tt0978764/,Sucker Punch,Canada,,Canada,61.0666922,-107.9917071
15,/title/tt0978764/,Sucker Punch,"British Columbia, Canada",,"British Columbia, Canada",55.001251,-125.002441
16,/title/tt0363547/,Dawn of the Dead,"Thornhill Square Mall, Thornhill, Ontario, Canada",(demolished shortly after film came out)                        ,,,
17,/title/tt0363547/,Dawn of the Dead,"Park Lake, Backlot, Universal Studios - 100 Universal City Plaza, Universal City, California, USA",,,,
18,/title/tt0363547/,Dawn of the Dead,"Santa Catalina Island, Channel Islands, California, USA",(sailboat scenes)                        ,,,
19,/title/tt0363547/,Dawn of the Dead,"Brampton, Ontario, Canada",,"Brampton, Peel Region, Golden Horseshoe, Ontario, Canada",43.6858146,-79.7599337
20,/title/tt0363547/,Dawn of the Dead,"Clearwater, Florida, USA",(exploding group near end scene)                        ,"Clearwater, Pinellas County, Florida, United States of America",27.9658533,-82.8001026
21,/title/tt0363547/,Dawn of the Dead,"5 Garden Wood Avenue, Caledon, Ontario, Canada",(Ana's house)                        ,"87170, 5, Garden Wood Avenue, Valleywood, Mayfield West, Caledon, Peel Region, Golden Horseshoe, Ontario, L7C 4C3, Canada",43.7446815,-79.8274045326087
22,/title/tt7394816/,Primal,Puerto Rico,,"Puerto Rico, Orocovis, Puerto Rico, United States of America",18.2214149,-66.41328179513847
23,/title/tt0120667/,Fantastic Four,"Surrey, British Columbia, Canada",(Central City building)                        ,"Surrey, Metro Vancouver Regional District, British Columbia, Canada",49.1913033,-122.8491439
24,/title/tt0120667/,Fantastic Four,"University of British Columbia, Robson Square Campus - 800 Robson Street, Vancouver, British Columbia, Canada",,,,
25,/title/tt0120667/,Fantastic Four,"New Orleans, Louisiana, USA",,"New Orleans, Orleans Parish, Louisiana, United States of America",29.9499323,-90.0701156
26,/title/tt3606756/,Incredibles 2,"Walt Disney Animation Studios - 2100 Riverside Drive, Burbank, California, USA",,,,
27,/title/tt3606756/,Incredibles 2,"Chicago, Illinois, USA",,"Chicago, Cook County, Illinois, United States of America",41.8755616,-87.6244212
28,/title/tt0120735/,"Lock, Stock and Two Smoking Barrels","St John Street, Clerkenwell, London, England, UK",(JD's bar)                        ,"St. John Street, Clerkenwell, London Borough of Islington, London, Greater London, England, EC1M 6PE, United Kingdom",51.5197935,-0.1017052
29,/title/tt0120735/,"Lock, Stock and Two Smoking Barrels","The Royal Oak Public House, Columbia Road, Bethnal Green, London, England, UK",(Samoan Jo's - the South Seas bar)                        ,,,
30,/title/tt0120735/,"Lock, Stock and Two Smoking Barrels","19, Park Street, Borough, SE1, London, England, UK",(the hideout)                        ,"Lloyd Recruitment Services, 19, Park Street, Broad Green, London Borough of Croydon, London, Greater London, England, CR0 1YF, United Kingdom",51.3736157,-0.0982058
31,/title/tt0120735/,"Lock, Stock and Two Smoking Barrels","Bethnal Green Town Hall, Bethnal Green, London, England, UK",,"Bethnal Green, Roman Road, Globe Town, Bethnal Green, London Borough of Tower Hamlets, London, Greater London, England, E2 0HU, United Kingdom",51.5272449,-0.054752
32,/title/tt0120735/,"Lock, Stock and Two Smoking Barrels","Borough Market, Borough, London, England, UK",,"Borough Market, Winchester Walk, Borough, Southwark, London Borough of Southwark, London, Greater London, England, SE1 9AQ, United Kingdom",51.50558625,-0.090487028540277
33,/title/tt0120735/,"Lock, Stock and Two Smoking Barrels","Royal Oak Hotel - 73 Columbia Road, Bethnal Green, London, England, UK",,,,
34,/title/tt0120735/,"Lock, Stock and Two Smoking Barrels","Cheshire Street, Shoreditch, London, England, UK",,"Cheshire Street, Spitalfields, Whitechapel, London Borough of Tower Hamlets, London, Greater London, England, E2 6EH, United Kingdom",51.5236463,-0.0686077
35,/title/tt0120735/,"Lock, Stock and Two Smoking Barrels","Southwark Bridge, Southwark, London, England, UK",,"Southwark Bridge, Bankside, Southwark, London Borough of Southwark, City of London, Greater London, England, SE1 9HA, United Kingdom",51.5088978,-0.0940433
36,/title/tt0120735/,"Lock, Stock and Two Smoking Barrels","13-15 Park Street, London, England, UK",,"Park Street, Mayfair, City of Westminster, London, Greater London, England, W1K 2JS, United Kingdom",51.5108885,-0.1546327
37,/title/tt0120735/,"Lock, Stock and Two Smoking Barrels",UK,,United Kingdom,54.7023545,-3.2765753
38,/title/tt4172430/,13 Hours,"Attard, Malta",,"Ħ'Attard, Malta, ATD 1301, Malta",35.8909172,14.4430093
39,/title/tt4172430/,13 Hours,Morocco,,Maroc / ⵍⵎⵖⵔⵉⴱ / المغرب,31.1728205,-7.3362482
40,/title/tt4172430/,13 Hours,"Ta' Qali, Malta",(Film Set)                        ,"Ta' Qali, Ħ'Attard, Malta, MST 4128, Malta",35.8923492,14.4196785
41,/title/tt5688068/,Above Suspicion,"Lexington, Kentucky, USA",,"Lexington, Fayette County, Kentucky, United States of America",38.0464066,-84.4970393
42,/title/tt5688068/,Above Suspicion,"Berry, Kentucky, USA",(Bank)                        ,"Berry, Harrison County, Kentucky, 41003, United States of America",38.5206283,-84.3843829
43,/title/tt5688068/,Above Suspicion,"Cawood, Kentucky, USA",,"Cawood, Harlan County, Kentucky, 40815, United States of America",36.7839771,-83.2282326
44,/title/tt1617661/,Jupiter Ascending,"Natural History Museum, South Kensington, London, England, UK",(interiors)                        ,"Natural History Museum, Queen's Gate, Brompton, Royal Borough of Kensington and Chelsea, London, Greater London, England, SW7 5QL, United Kingdom",51.4955742,-0.1790756
45,/title/tt1617661/,Jupiter Ascending,"Guggenheim Museum, Bilbao, Vizcaya, País Vasco, Spain",(Exterior shots)                        ,"Guggenheim, Abandoibarra etorbidea / Avenida Abandoibarra, Abando, Bilbao, Bilboaldea, Bizkaia, Euskadi, 48009, España",43.2686489,-2.93667
46,/title/tt1617661/,Jupiter Ascending,"Bilbao, Bizkaia, Spain",(Exterior shots)                        ,"Bilbao, Bilboaldea, Bizkaia, Euskadi, España",43.2630051,-2.9349915
47,/title/tt1617661/,Jupiter Ascending,"Chicago, Illinois, USA",,"Chicago, Cook County, Illinois, United States of America",41.8755616,-87.6244212
48,/title/tt1617661/,Jupiter Ascending,"Littlebrook Power Station, Dartford, Kent, England, UK",,"Littlebrook Power Station, Dartford, Kent, South East, England, United Kingdom",51.46404855,0.24677313297357115
49,/title/tt1617661/,Jupiter Ascending,"Leavesden Studios, Leavesden, Hertfordshire, England, UK",,"Warner Bros. Studios Leavesden, Abbots Langley, Leavesden, Hertfordshire, East of England, England, WD25 7LP, United Kingdom",51.68980175,-0.4226993868476693
50,/title/tt1617661/,Jupiter Ascending,"England, UK",,"England, United Kingdom",52.7954791,-0.5402402866174321
51,/title/tt1617661/,Jupiter Ascending,"The Willis Tower, Chicago, Illinois, USA",(Caine shows his new wings)                        ,"Willis Tower, 233, South Wacker Drive, Loop, Chicago, Cook County, Illinois, 60606, United States of America",41.878871700000005,-87.63590893936448
52,/title/tt0187636/,Farscape,"Bondi Beach, Sydney, New South Wales, Australia",,"Bondi Beach, Sydney, Waverley Council, New South Wales, 2026, Australia",-33.8906977,151.2724119
53,/title/tt0187636/,Farscape,"Sydney Olympic Park, Sydney, New South Wales, Australia","(Season 2, 3, 4)                        ","Sydney Olympic Park, Mountain X BMX, Sydney Olympic Park, Sydney, City of Parramatta Council, New South Wales, 2127, Australia",-33.8387399,151.06909245693873
54,/title/tt0187636/,Farscape,"Woolwich, Sydney, New South Wales, Australia",,"Woolwich, Sydney, The Council of the Municipality of Hunters Hill, New South Wales, 2110, Australia",-33.8401988,151.1710614
55,/title/tt0112442/,Bad Boys,"Miami, Florida, USA",,"Miami, Miami-Dade County, Florida, United States of America",25.7742658,-80.1936589
56,/title/tt0112442/,Bad Boys,"Art Deco District, South Beach, Miami Beach, Florida, USA",,,,
57,/title/tt0112442/,Bad Boys,"Park Avenue, Miami Beach, Florida, USA",,"Park Avenue, Miami Beach, Miami-Dade County, Florida, 33139, United States of America",25.7970004,-80.1308407
58,/title/tt0112442/,Bad Boys,USA,,United States,39.7837304,-100.4458825
59,/title/tt0112442/,Bad Boys,"Coral Gables, Florida, USA",,"Coral Gables, Miami-Dade County, Florida, United States of America",25.72149,-80.2683838
60,/title/tt0112442/,Bad Boys,"South Beach, Miami Beach, Florida, USA",,"South Beach, 5th Street, South Beach, Miami Beach, Miami-Dade County, Florida, 33139, United States of America",25.7744291,-80.1332415
61,/title/tt1488606/,Triple Frontier,"Soacha, Bogotá, Colombia",(ambush scene)                        ,"Banco de Colombia, Autopista Bogotá-Girardot, Soacha, Sibaté, Cundinamarca, 250070, Colombia",4.5449186,-74.2445623
62,/title/tt1488606/,Triple Frontier,"Old Pali Rd, Honolulu, Hawaii, USA",(Lorea's house)                        ,"Old Pali Road, Nuuanu, Honolulu, Honolulu County, Hawaii, 96817-1713, United States of America",21.3489939,-157.8227233
63,/title/tt1488606/,Triple Frontier,"Hawaii, USA",,"Hawaii, United States of America",19.58726775,-155.42688965312746
64,/title/tt1483013/,Oblivion,"Dettifoss, Vatnajökull National Park, Iceland",,,,
65,/title/tt1483013/,Oblivion,"June Lake, California, USA",,"June Lake, Mono County, California, 93529, United States of America",37.78075065,-119.08080154145367
66,/title/tt1483013/,Oblivion,"Hrossaborg, Iceland",,"Hrossaborg, Dalabyggð, Vesturland, Ísland",65.23094,-22.05044
67,/title/tt1483013/,Oblivion,"New York City, New York, USA",,"New York, United States of America",40.7127281,-74.0060152
68,/title/tt1483013/,Oblivion,"Empire State Building - 350 Fifth Avenue, Manhattan, New York City, New York, USA",,,,
69,/title/tt1483013/,Oblivion,"St. Francisville, Louisiana, USA",,"St. Francisville, West Feliciana Parish, Louisiana, United States of America",30.7807244,-91.3763353
70,/title/tt1483013/,Oblivion,USA,,United States,39.7837304,-100.4458825
71,/title/tt0090022/,Silverado,"White Rock, New Mexico, USA",(opening scene)                        ,"White Rock, San Juan County, New Mexico, United States of America",36.5677788,-109.0264854
72,/title/tt0090022/,Silverado,"Los Alamos, New Mexico, USA",(opening scene)                        ,"Los Alamos, Los Alamos County, New Mexico, United States of America",35.8814009,-106.2989958
73,/title/tt0090022/,Silverado,"Abiquiu, New Mexico, USA",,"Abiquiu, Rio Arriba County, New Mexico, United States of America",36.2070977,-106.3186283
74,/title/tt0090022/,Silverado,"Santa Ana Pueblo, New Mexico, USA",,"Santa Ana Pueblo, Sandoval County, New Mexico, United States of America",35.4289238,-106.6189184
75,/title/tt0090022/,Silverado,"Nambe, New Mexico, USA",,"Nambe, Santa Fe County, New Mexico, 87506, United States of America",35.8933654,-105.982529
76,/title/tt0090022/,Silverado,"White Rock Overlook, Black Mesa, New Mexico, USA",,,,
77,/title/tt7942796/,Magnum P.I.,"Hawaii, USA",,"Hawaii, United States of America",19.58726775,-155.42688965312746
78,/title/tt0286716/,Hulk,"Victorville, California, USA",,"Victorville, San Bernardino County, California, United States of America",34.5361067,-117.2911565
79,/title/tt0286716/,Hulk,"Universal City, California, USA",,"Universal City, Los Angeles County, California, 91608, United States of America",34.1412926,-118.3584364
80,/title/tt0286716/,Hulk,"Lawrence Berkeley National Laboratory - 1 Cyclotron Rd., Berkeley, California, USA",,"Lawrence Berkeley National Laboratory, Cyclotron Road, Northside, Berkeley, Alameda County, California, 94720, United States of America",37.87695875,-122.24563027311041
81,/title/tt0286716/,Hulk,"Mountain Home State Forest, California, USA",,"Mountain Home, Santa Clara County, California, United States of America",37.1210583,-121.7957849
82,/title/tt0286716/,Hulk,"Wendover, Utah, USA",,"Wendover, Tooele County, Utah, 84083, United States of America",40.7374014,-114.0304541
83,/title/tt0286716/,Hulk,"Page, Arizona, USA",,"Page, Coconino County, Arizona, 86040-0418, United States of America",36.9148305,-111.4572942
84,/title/tt0286716/,Hulk,"Golden Gate Bridge, San Francisco, California, USA",,"Golden Gate Bridge, Moore Road, Belvedere Island, Marin County, California, 94965, United States of America",37.8176155,-122.47831240371913
85,/title/tt0286716/,Hulk,"Stage 35, Universal Studios - 100 Universal City Plaza, Universal City, California, USA",,,,
86,/title/tt0286716/,Hulk,"Montgomery & Vallejo Streets, North Beach, San Francisco, California, USA",,,,
87,/title/tt0286716/,Hulk,"San Francisco, California, USA",,"San Francisco, San Francisco City and County, California, United States of America",37.7790262,-122.4199061
88,/title/tt0286716/,Hulk,"Dumont Dunes, California, USA",,"Dumont Dunes, San Bernardino County, California, United States of America",35.6833036,-116.2194652
89,/title/tt0286716/,Hulk,"Falls Lake, Backlot, Universal Studios - 100 Universal City Plaza, Universal City, California, USA",,,,
90,/title/tt0286716/,Hulk,"Stage 1, Universal Studios - 100 Universal City Plaza, Universal City, California, USA",,,,
91,/title/tt0286716/,Hulk,"Stage 27, Universal Studios - 100 Universal City Plaza, Universal City, California, USA",,,,
92,/title/tt0286716/,Hulk,"Telegraph Hill, San Francisco, California, USA",,"Telegraph Hill, San Francisco, San Francisco City and County, California, 94113, United States of America",37.800785,-122.4040908
93,/title/tt0286716/,Hulk,USA,,United States,39.7837304,-100.4458825
94,/title/tt0096684/,Quantum Leap,"Lancaster, California, USA",,"Lancaster, Los Angeles County, California, United States of America",34.6981064,-118.1366153
95,/title/tt0096684/,Quantum Leap,"Big Sky Ranch - 4927 Bennett Road, Simi Valley, California, USA",,,,
96,/title/tt7134096/,The Rhythm Section,"Dublin, Ireland",(London scenes)                        ,"Dublin, County Dublin, Leinster, Ireland",53.3497645,-6.2602732
97,/title/tt7134096/,The Rhythm Section,"Cádiz, Andalucía, Spain","(City of Marseille, France, street and bus explosion scenes)                        ","Cádiz, Bahía de Cádiz, Andalucía, España",36.5297438,-6.2928976
98,/title/tt7134096/,The Rhythm Section,"Lough Dan, County Wicklow, Ireland",(Loch Frey)                        ,"Lough Dan, Ballinrush Track, Ballinrush, Togher, The Municipal District of Wicklow, County Wicklow, Leinster, Ireland",53.0696114,-6.279194564764599
99,/title/tt7134096/,The Rhythm Section,Spain,,España,39.3262345,-4.8380649
100,/title/tt7134096/,The Rhythm Section,"New York City, New York, USA",(Street scenes)                        ,"New York, United States of America",40.7127281,-74.0060152
101,/title/tt7134096/,The Rhythm Section,"Estudios el Alamo, Madrid, Spain",(studio) (Studios)                        ,,,
102,/title/tt0083944/,First Blood,"Hope, British Columbia, Canada",,"Hope, British Columbia, Canada",49.3799438,-121.4413515
103,/title/tt0083944/,First Blood,"North Vancouver, British Columbia, Canada",,"North Vancouver, Metro Vancouver Regional District, British Columbia, V7M 1H9, Canada",49.3207133,-123.0737831
104,/title/tt0083944/,First Blood,"Pitt Meadows, British Columbia, Canada",,"Pitt Meadows, Metro Vancouver Regional District, British Columbia, Canada",49.2207623,-122.6901534
105,/title/tt0083944/,First Blood,Canada,,Canada,61.0666922,-107.9917071
106,/title/tt6533240/,Nomis,"Winnipeg, Manitoba, Canada",(ACTRA Manitoba)                        ,"Winnipeg, Winnipeg (city), Manitoba, Canada",49.8955367,-97.1384584
107,/title/tt6533240/,Nomis,"Chicago, Illinois, USA",,"Chicago, Cook County, Illinois, United States of America",41.8755616,-87.6244212
108,/title/tt0803096/,Warcraft: The Beginning,"Canadian Motion Picture Park Studios, Burnaby, British Columbia, Canada",(studio) (filmed in part at) (as CMPP Studios)                        ,,,
109,/title/tt0803096/,Warcraft: The Beginning,"Torres del Paine, Región de Magallanes y de la Antártica Chilena, Chile",,"Torres del Paine, Provincia de Última Esperanza, Región de Magallanes y de la Antártica Chilena, 6170000, Chile",-51.08285725,-72.96148023378075
110,/title/tt0376994/,X-Men: The Last Stand,"Hatley Castle, Royal Roads, Colwood, British Columbia, Canada",(Xavier's 'School for the Gifted')                        ,,,
111,/title/tt0376994/,X-Men: The Last Stand,"Golden Ears Provincial Park, British Columbia, Canada",(mountain/cave scene)                        ,"Golden Ears Provincial Park, Area F (McConnell Creek/Hatzic Prairie), British Columbia, Canada",49.487882400000004,-122.38530104498244
112,/title/tt0376994/,X-Men: The Last Stand,"University of British Columbia, Robson Square Campus - 800 Robson Street, Vancouver, British Columbia, Canada",,,,
113,/title/tt0376994/,X-Men: The Last Stand,"Vancouver, British Columbia, Canada",,"Vancouver, Metro Vancouver Regional District, British Columbia, Canada",49.2608724,-123.1139529
114,/title/tt0376994/,X-Men: The Last Stand,"Golden Gate Bridge, San Francisco, California, USA",,"Golden Gate Bridge, Moore Road, Belvedere Island, Marin County, California, 94965, United States of America",37.8176155,-122.47831240371913
115,/title/tt0376994/,X-Men: The Last Stand,"San Francisco, California, USA",(background shots only)                        ,"San Francisco, San Francisco City and County, California, United States of America",37.7790262,-122.4199061
116,/title/tt8652642/,Wu Assassins,"Vancouver, British Columbia, Canada",,"Vancouver, Metro Vancouver Regional District, British Columbia, Canada",49.2608724,-123.1139529
117,/title/tt0078346/,Superman,"Range Road 264, Blackie, Calgary, Alberta, Canada","(The Kent's farm) (coordinates: 50.675111, -113.558333)                        ",,,
118,/title/tt0078346/,Superman,"British Columbian Icefields, Canada",(Fortress of Solitude)                        ,,,
119,/title/tt0078346/,Superman,"Hoover Dam, Arizona-Nevada Border, USA",,,,
120,/title/tt0078346/,Superman,"High River, Alberta, Canada",,"High River, Town of High River, Alberta, T1V 1P2, Canada",50.5797079,-113.8569213
121,/title/tt0078346/,Superman,"Kananaskis Country, Alberta, Canada",(The missile base sequence)                        ,"Kananaskis Country Golf Course, Kananaskis Trail, Kananaskis Village, Kananaskis Improvement District, Alberta, Canada",50.90414855,-115.1464755019835
122,/title/tt0078346/,Superman,"Hollywood Sign, Hollywood Hills, Los Angeles, California, USA",,"Hollywood Sign, Mount Lee Drive, Hollywood Hills, Los Angeles, Los Angeles County, California, 90068, United States of America",34.1340991,-118.3216523
123,/title/tt0078346/,Superman,"New York Daily News Building - 42nd Street, Manhattan, New York City, New York, USA",(Daily Planet)                        ,,,
124,/title/tt0078346/,Superman,"Solow Building, West 57th Street, New York City, New York, USA",(Superman catches a Burglar scaling the building)                        ,"Solow Building, 9, West 57th Street, Midtown, Manhattan Community Board 5, Manhattan, New York County, New York, 10019, United States of America",40.763835349999994,-73.97495327349418
125,/title/tt0078346/,Superman,"Albert R. Broccoli 007 Stage, Pinewood Studios, Iver Heath, Buckinghamshire, England, UK",(Arctic ice flow and exterior entrance to the Fortress of Solitude)                        ,,,
126,/title/tt0078346/,Superman,"Grand Central Station, Manhattan, New York City, New York, USA",,"Grand Central Terminal, 89, East 42nd Street, Midtown East, Manhattan Community Board 5, Manhattan, New York County, New York, 10017, United States of America",40.752701200000004,-73.97724987363358
127,/title/tt0078346/,Superman,"Red Rock State Park, Church Rock, New Mexico, USA",,"Red Rock State Park, Gallup, McKinley County, New Mexico, 86311, United States of America",35.5418998,-108.6116143
128,/title/tt0078346/,Superman,"Alberta, Canada",,"Alberta, Canada",55.001251,-115.002136
129,/title/tt4975856/,Future Man,"Montreal, Québec, Canada",,"Montréal, Agglomération de Montréal, Montréal (06), Québec, Canada",45.4972159,-73.6103642
130,/title/tt11946300/,Deep Blue Sea 3,"Cape Town, South Africa",(location)                        ,"Cape Town, City of Cape Town, Western Cape, 8001, South Africa",-33.928992,18.417396
131,/title/tt1212428/,The Lost City of Z,Colombia,,Colombia,2.8894434,-73.783892
132,/title/tt1212428/,The Lost City of Z,"Sierra Nevada de Santa Marta, Magdalena, Colombia",(jungle)                        ,"Sierra Nevada de Santa Marta, Magdalena, Colombia",10.835,-73.675
133,/title/tt1212428/,The Lost City of Z,"Belfast City Hall, Belfast, Northern Ireland, UK",(Press Conference)                        ,"Belfast City Hall, Donegall Square South, Linen Quarter, Town Parks, Belfast, County Antrim, Northern Ireland, BT1 5GS, United Kingdom",54.596422950000004,-5.929466360965295
134,/title/tt1212428/,The Lost City of Z,"Rio Don Diego, Magdalena, Colombia",(river scenes)                        ,"Río Don Diego, Santa Marta, Magdalena, Colombia",11.2311842,-73.7009945
135,/title/tt1212428/,The Lost City of Z,"Northern Ireland, UK",,"Northern Ireland, United Kingdom",54.6294982,-6.7654416
136,/title/tt1212428/,The Lost City of Z,"Ballintoy, County Antrim, Northern Ireland, UK",(church seen in a flash of reminiscence)                        ,"Ballintoy, County Antrim, Northern Ireland, BT54 6LX, United Kingdom",55.2367811,-6.3593257
137,/title/tt1212428/,The Lost City of Z,UK,,United Kingdom,54.7023545,-3.2765753
138,/title/tt1212428/,The Lost City of Z,"Belfast, County Antrim, Northern Ireland, UK",(hospital)                        ,"Belfast, County Antrim, Northern Ireland, BT1 5GS, United Kingdom",54.5964411,-5.9302761
139,/title/tt0330793/,The Punisher,"Fort De Soto Park - 3500 Pinellas Bayway S., Tierra Verde, Florida, USA",(Pier Scene)                        ,,,
140,/title/tt0330793/,The Punisher,"University of Tampa, Tampa, Florida, USA",(movie theatre scenes)                        ,"Barnes & Noble, 200, UT Poe Parkway, Ridgewood Park, Hyde Park, Tampa, Hillsborough County, Florida, 33606, United States of America",27.9461314,-82.4654237
141,/title/tt0330793/,The Punisher,"The Claw - 13801 N. 46th Street, University of South Florida, Tampa, Florida, USA",(golf course)                        ,,,
142,/title/tt0330793/,The Punisher,"W. Twiggs St. @ N. Ashley Dr., Tampa, Florida, USA",(death scene with Travolta)                        ,,,
143,/title/tt0330793/,The Punisher,"Florida, USA",,"Florida, United States of America",27.7567667,-81.4639835
144,/title/tt0330793/,The Punisher,"Wyndam Hotel, 725 S. Harbor Island Blvd., Harbor Island, Tampa, Florida, USA",(Travolta walks by the water with his henchmen - now Westin Hotel)                        ,,,
145,/title/tt0330793/,The Punisher,"100 N. Tampa St., Tampa, Florida, USA",(Saint's office tower - rain of money here)                        ,"100, North Tampa Street, Harbour Island, Tampa, Hillsborough County, Florida, 33603, United States of America",27.9454769,-82.458264233652
146,/title/tt0330793/,The Punisher,"Laurel Street Bridge, 5 W. Laurel St., Tampa, Florida, USA",(jumps partially open bridge after killing assassin)                        ,,,
147,/title/tt0330793/,The Punisher,"Harbor Island, Tampa, Florida, USA",,,,
