,Code,Show Name,Location,Scene,geocodedLocation,latitude,longitude
1400,/title/tt0086859/,Against All Odds,"Chichén Itzá, Yucatán, Mexico",(Mayan Football Pitch)                        ,"Chichen Itzá, MEX 180, Privada Piste II, San Felipe Nuevo, X-Calakoop, Tinum, Yucatán, 97751, México",20.68285195,-88.5687196355205
1401,/title/tt0086859/,Against All Odds,"Cozumel, Quintana Roo, Mexico",,"Cozumel, Quintana Roo, México",20.4317585,-86.92027456597663
1402,/title/tt0086859/,Against All Odds,"Tulum, Quintana Roo, Mexico",,"Zona Arqueológica de Tulum, Avenida Ruinas Tulum, Tulum, Quintana Roo, 77780, México",20.2152358,-87.42953531439221
1403,/title/tt0086859/,Against All Odds,"Sacred Centote, Yucatán, Mexico",(Disposal of body)                        ,,,
1404,/title/tt0086859/,Against All Odds,"Yucatán, Mexico",,"Yucatán, México",20.6845957,-88.8755669
1405,/title/tt0086859/,Against All Odds,"Hollywood Palace Theater - 1735 N. Vine Street, Hollywood, Los Angeles, California, USA",,,,
1406,/title/tt0086859/,Against All Odds,Mexico,,"Ciudad de México, 06060, México",19.4326296,-99.1331785
1407,/title/tt0086859/,Against All Odds,"Manhattan Beach, California, USA",,"Manhattan Beach, Los Angeles County, California, 90266, United States of America",33.8915985,-118.3951241
1408,Code,Show Name,Location,Scene,"Location, Tucker County, West Virginia, United States of America",39.2138905,-79.6371124
1409,/title/tt0113749/,Mallrats,"Eden Prairie Center Mall - 8251 Flying Cloud Drive, Eden Prairie, Minnesota, USA",,"Eden Prairie Center, 8251, Flying Cloud Drive, Eden Prairie, Hennepin County, Minnesota, 55344, United States of America",44.854353950000004,-93.42483139956855
1410,/title/tt0113749/,Mallrats,"U.S. 1 Flea Market, New Brunswick, New Jersey, USA",,,,
1411,/title/tt0113749/,Mallrats,"Minneapolis, Minnesota, USA",,"Minneapolis, Hennepin County, Minnesota, United States of America",44.9772995,-93.2654692
1412,/title/tt0113749/,Mallrats,"Minnesota, USA",,"Minnesota, United States of America",45.9896587,-94.6113288
1413,/title/tt0113749/,Mallrats,"New Jersey, USA",,"New Jersey, United States of America",40.0757384,-74.4041622
1414,/title/tt0113749/,Mallrats,USA,,United States,39.7837304,-100.4458825
1415,/title/tt0113749/,Mallrats,"Palos Verdes Peninsula, California, USA",,"Palos Verdes Peninsula High School, Silver Spur Road, Rancho Palos Verdes, Los Angeles County, California, 90274, United States of America",33.77984925,-118.37219683021539
1416,/title/tt0102782/,Return to the Blue Lagoon,"Taveuni Island, Fiji",,"Taveuni, Northern, Fiji",-16.8261493,-179.9354607
1417,/title/tt3312830/,Youth,"Flims, Kanton Graubünden, Switzerland",(Spa at Park Hotel Waldhaus)                        ,"Flims, Imboden, Graubünden/Grigioni/Grischun, Switzerland",46.8332439,9.2834557
1418,/title/tt3312830/,Youth,"Kandersteg, Kanton Bern, Switzerland",,"Kandersteg, Verwaltungskreis Frutigen-Niedersimmental, Verwaltungsregion Oberland, Bern/Berne, 3718, Switzerland",46.4975866,7.6756638
1419,/title/tt3312830/,Youth,"Rome, Lazio, Italy",,"Roma Capitale, Lazio, Italia",41.85223935,12.631036615953583
1420,/title/tt3312830/,Youth,"Piazza San Marco, Venice, Veneto, Italy",(dream sequence)                        ,"Piazza San Marco, San Marco, Venezia-Murano-Burano, Venezia, Veneto, Italia",45.43427335,12.338531461710627
1421,/title/tt3312830/,Youth,"London, England, UK",,"London, Greater London, England, United Kingdom",51.5073219,-0.1276474
1422,/title/tt1846197/,Morden i Sandhamn,"Sandhamn, Stockholms län, Sweden",,"Sandhamn, Värmdö kommun, Stockholms län, Svealand, Sverige",59.2878469,18.917834
1423,/title/tt0118742/,Bliss,"Vancouver, British Columbia, Canada",,"Vancouver, Metro Vancouver Regional District, British Columbia, Canada",49.2608724,-123.1139529
1424,/title/tt0290002/,Meet the Fockers,"Chicago, Illinois, USA",(2nd unit)                        ,"Chicago, Cook County, Illinois, United States of America",41.8755616,-87.6244212
1425,/title/tt0290002/,Meet the Fockers,"Los Angeles County Arboretum & Botanic Garden - 301 N. Baldwin Avenue, Arcadia, California, USA",,,,
1426,/title/tt0290002/,Meet the Fockers,"Ontario International Airport - 2900 E. Airport Drive, Ontario, California, USA",,,,
1427,/title/tt0290002/,Meet the Fockers,"Pasadena, California, USA",,"Pasadena, Los Angeles County, California, United States of America",34.1476452,-118.1444779
1428,/title/tt0290002/,Meet the Fockers,"Stage 16, Universal Studios - 100 Universal City Plaza, Universal City, California, USA",,,,
1429,/title/tt8521376/,Little Voice,"New York City, New York, USA",,"New York, United States of America",40.7127281,-74.0060152
1430,/title/tt5501104/,Gräns,"Kapellskär, Norrtälje, Sweden",(ship terminal)                        ,"Kapellskär, Räfsnäs, Norrtälje kommun, Stockholms län, Svealand, 76015, Sverige",59.7203711,19.0607758
1431,/title/tt2547584/,The Light Between Oceans,"Stanley, Tasmania, Australia",,"Stanley, Circular Head, Tasmania, 7331, Australia",-40.7605718,145.2945184
1432,/title/tt2547584/,The Light Between Oceans,"Dunedin, Otago, New Zealand",(New Zealand)                        ,"Dunedin, Dunedin City, Otago, 9016, New Zealand",-45.8740984,170.5035755
1433,/title/tt2547584/,The Light Between Oceans,New Zealand,,New Zealand / Aotearoa,-41.5000831,172.8344077
1434,/title/tt1292566/,How to Be Single,"New York City, New York, USA",,"New York, United States of America",40.7127281,-74.0060152
1435,/title/tt1292566/,How to Be Single,"149 Broadway, Brooklyn, New York City, New York, USA",(Alice's apartment)                        ,"Meadowsweet, 149, Broadway, Brooklyn, Kings County, New York, 11211, United States of America",40.7103472,-73.9631701
1436,/title/tt1292566/,How to Be Single,USA,,United States,39.7837304,-100.4458825
1437,/title/tt5179408/,You Me Her,"Vancouver, British Columbia, Canada",,"Vancouver, Metro Vancouver Regional District, British Columbia, Canada",49.2608724,-123.1139529
1438,/title/tt1663676/,Awkward.,"Los Angeles, California, USA",,"Los Angeles, Los Angeles County, California, United States of America",34.0536909,-118.2427666
1439,/title/tt2091935/,Mr. Right,"New Orleans, Louisiana, USA",,"New Orleans, Orleans Parish, Louisiana, United States of America",29.9499323,-90.0701156
1440,/title/tt0427229/,Failure to Launch,"Gadsden, Alabama, USA",,"Gadsden, Etowah County, Alabama, 35901, United States of America",34.010929,-85.9989596
1441,/title/tt0427229/,Failure to Launch,"Leesburg, Alabama, USA",,"Leesburg, Cherokee County, Alabama, 35983, United States of America",34.1798177,-85.7613555
1442,/title/tt0427229/,Failure to Launch,"Baltimore, Maryland, USA",,"Baltimore, Maryland, United States of America",39.2908816,-76.610759
1443,/title/tt0427229/,Failure to Launch,"New Castle, Delaware, USA",,"New Castle, New Castle County, Delaware, 19720, United States of America",39.6620572,-75.5663132
1444,/title/tt0427229/,Failure to Launch,"Annapolis, Maryland, USA",,"Annapolis, Anne Arundel County, Maryland, United States of America",38.9786401,-76.492786
1445,/title/tt0427229/,Failure to Launch,"Alabama, USA",,"Alabama, United States of America",33.2588817,-86.8295337
1446,/title/tt0427229/,Failure to Launch,"Maryland, USA",,"Maryland, United States of America",39.5162234,-76.9382069
1447,/title/tt0427229/,Failure to Launch,USA,,United States,39.7837304,-100.4458825
1448,/title/tt4080728/,Een man die Ove heet,"Trollhättan, Västra Götalands län, Sweden",,"Trollhättan, Trollhättans kommun, Västra Götalands län, Götaland, 46183, Sverige",58.2827931,12.2908612
1449,/title/tt4080728/,Een man die Ove heet,"Norra kyrkogården, Uddevalla, Västra Götalands län, Sweden",(cemetery scenes)                        ,"Norra kyrkogården, Karlsberg, Uddevalla, Uddevalla kommun, Västra Götalands län, Götaland, Sverige",58.35415965,11.935774508913356
1450,/title/tt4080728/,Een man die Ove heet,"Valldemosa, Mallorca, Balearic Islands, Spain",(exterior scenes)                        ,,,
1451,/title/tt4080728/,Een man die Ove heet,"Vänersborg, Västra Götalands län, Sweden","(Ove teaching Parvaneh how to drive at Edsgatan, Vänersborg)                        ","Vänersborg, Vänersborgs kommun, Västra Götalands län, Götaland, 462 80, Sverige",58.3811988,12.3226877
1452,/title/tt2884206/,I Origins,"Delhi, India",,"Delhi, Kotwali Tehsil, Central Delhi, Delhi, 110006, India",28.6517178,77.2219388
1453,/title/tt2884206/,I Origins,"Brooklyn, New York, USA",,"Brooklyn, Kings County, New York, United States of America",40.6501038,-73.9495823
1454,/title/tt0790772/,Rules of Engagement,"Sony Pictures Studios - 10202 W. Washington Blvd., Culver City, California, USA",,,,
1455,/title/tt1311071/,Kill Your Darlings,"Columbia University, New York City, New York, USA",,"Columbia University, West 120th Street, Morningside Heights, Manhattan Community Board 9, Manhattan, New York County, New York, 10027, United States of America",40.8079488,-73.96179735775709
1456,/title/tt1311071/,Kill Your Darlings,"New York City, New York, USA",,"New York, United States of America",40.7127281,-74.0060152
1457,/title/tt0116191/,Emma,"Evershot, Dorset, England, UK",(Highbury village)                        ,"Evershot, Dorset, South West England, England, DT2 0JW, United Kingdom",50.8385953,-2.6056702
1458,/title/tt0116191/,Emma,"Breakspear House, Harefield, London, England, UK",,"Breakspear House, Dovecot Mews, London Borough of Hillingdon, London, Greater London, England, UB9 6QS, United Kingdom",51.5956394,-0.4699405
1459,/title/tt0116191/,Emma,"Claydon House, Middle Claydon, Buckinghamshire, England, UK",(Donwell Abbey/Crown ball scene)                        ,"Claydon House, Queen Catherine Road, Middle Claydon, Buckinghamshire, South East, England, MK18 2EU, United Kingdom",51.921875549999996,-0.955589140335596
1460,/title/tt0116191/,Emma,"Crichel House, Newtown, Dorset, England, UK",(Donwell Abbey interiors)                        ,"Crichel, Long Crichel, Dorset, South West England, England, United Kingdom",50.89066215,-2.0368400421358204
1461,/title/tt0116191/,Emma,"London, England, UK",,"London, Greater London, England, United Kingdom",51.5073219,-0.1276474
1462,/title/tt0116191/,Emma,"Stafford House, West Stafford, Dorset, England, UK",,,,
1463,/title/tt0821640/,Ghosts of Girlfriends Past,"Castle Hill, Crane Estate - 280 Argilla Road, Ipswich, Massachusetts, USA",,,,
1464,/title/tt0821640/,Ghosts of Girlfriends Past,"Dover, Massachusetts, USA",(interior)                        ,"Dover, Norfolk County, Massachusetts, 02030, United States of America",42.2459311,-71.2828342
1465,/title/tt0821640/,Ghosts of Girlfriends Past,"Boston, Massachusetts, USA",,"Boston, Suffolk County, Massachusetts, United States of America",42.3602534,-71.0582912
1466,/title/tt0821640/,Ghosts of Girlfriends Past,"Sudbury, Massachusetts, USA",(Martha & Mary Chapel wedding scene)                        ,"Sudbury, Middlesex County, Massachusetts, 01776, United States of America",42.3834278,-71.4161725
1467,/title/tt7026672/,Every Day,"George Street Diner, Toronto, Ontario, Canada",(Diner Scene)                        ,"George Street Diner, 129, George Street, Toronto Centre, Old Toronto, Toronto, Peel, Golden Horseshoe, Ontario, M5A 2N4, Canada",43.6529726,-79.3714782
1468,/title/tt7026672/,Every Day,"Port Credit Library, Mississauga, Ontario, Canada",(library)                        ,"Port Credit, Queen Street East, Port Credit, Mississauga, Peel Region, Golden Horseshoe, Ontario, L5G 3B5, Canada",43.5560546,-79.5870828
1469,/title/tt7026672/,Every Day,"Toronto, Ontario, Canada",(Ripley's Aquarium of Canada)                        ,"Toronto, Peel, Golden Horseshoe, Ontario, Canada",43.6534817,-79.3839347
1470,/title/tt0081777/,Xanadu,"Pan-Pacific Auditorium - 7600 W. Beverly Boulevard, Fairfax, Los Angeles, California, USA",(Destroyed by fire in 1989)                        ,,,
1471,/title/tt0081777/,Xanadu,"Hollywood General Studios - 6642 Santa Monica Boulevard, Hollywood, Los Angeles, California, USA",(interior: Xanadu club)                        ,,,
1472,/title/tt0081777/,Xanadu,"Palisades Park, Malibu, California, USA",(Kira first kisses Sonny.)                        ,,,
1473,/title/tt0081777/,Xanadu,"Fiorucci Store, Beverly Hills, California, USA",(Gene Kelly dance scene.)                        ,,,
1474,/title/tt0081777/,Xanadu,"Hollywood Center Studios - 1040 N. Las Palmas Avenue, Hollywood, Los Angeles, California, USA",(interior: Xanadu club)                        ,"Hollywood Center Studios, Romaine Street, Hollywood, Los Angeles, Los Angeles County, California, 90038, United States of America",34.08981165,-118.33500930891499
1475,/title/tt0081777/,Xanadu,"Santa Monica, California, USA",,"Santa Monica, Los Angeles County, California, United States of America",34.0250724,-118.4965129
1476,/title/tt0115736/,Bound,"Talmadge Apartments - 3278 Wilshire Boulevard, Los Angeles, California, USA",,,,
1477,/title/tt0115736/,Bound,"Los Angeles, California, USA",,"Los Angeles, Los Angeles County, California, United States of America",34.0536909,-118.2427666
1478,/title/tt5133998/,Kara Sevda,"Istanbul, Turkey",,"İstanbul, Beyazıt Meydanı, Beyazıt Mahallesi, Fatih, İstanbul, Marmara Bölgesi, 34126, Türkiye",41.0096215,28.9651867
1479,/title/tt1702439/,Safe Haven,"Southport, North Carolina, USA",,"Southport, Brunswick County, North Carolina, United States of America",33.921563,-78.0202677
1480,/title/tt0063518/,Romeo and Juliet,"Lazio, Italy",,"Lazio, Italia",41.9808038,12.7662312
1481,/title/tt0063518/,Romeo and Juliet,"Viterbo, Lazio, Italy",,"Viterbo, Lazio, Italia",42.49368885,11.945067829807687
1482,/title/tt0063518/,Romeo and Juliet,"Artena, Rome, Lazio, Italy",,"Via Artena, La Valle, Valmontone, Roma Capitale, Lazio, 00038, Italia",41.773885,12.9189783
1483,/title/tt0063518/,Romeo and Juliet,"Palazzo Borghese, Artena, Rome, Lazio, Italy",,,,
1484,/title/tt0063518/,Romeo and Juliet,"Rome, Lazio, Italy",,"Roma Capitale, Lazio, Italia",41.85223935,12.631036615953583
1485,/title/tt0063518/,Romeo and Juliet,Italy,,Italia,42.6384261,12.674297
1486,/title/tt2871832/,Cedar Cove,"Vancouver, British Columbia, Canada",,"Vancouver, Metro Vancouver Regional District, British Columbia, Canada",49.2608724,-123.1139529
1487,/title/tt1216492/,Leap Year,"Aran Islands, County Galway, Ireland",,,,
1488,/title/tt1216492/,Leap Year,"Connemara, County Galway, Ireland",,"Connemara National Park, N59, Letterfrack, Ballynakill ED, Conamara Municipal District, County Galway, Connacht, Ireland",53.5303027,-9.878957584029806
1489,/title/tt1216492/,Leap Year,"Wicklow National Park, County Wicklow, Ireland",,"Wicklow, County Wicklow, Leinster, A67 PP78, Ireland",52.9802376,-6.0414184
1490,/title/tt1216492/,Leap Year,"County Galway, Ireland",,"County Galway, Connacht, Ireland",53.34350465,-8.873374084151076
1491,/title/tt1216492/,Leap Year,"Temple Bar, Dublin, County Dublin, Ireland",,"Temple Bar, Royal Exchange A ED, Dublin 2, County Dublin, Leinster, Ireland",53.3454957,-6.2631139
1492,/title/tt1216492/,Leap Year,"Luggala Estate, County Wicklow, Ireland",,,,
1493,/title/tt1216492/,Leap Year,"Laragh, County Wicklow, Ireland",,"Laragh, Brockagh, County Wicklow, Leinster, Ireland",53.0083959,-6.2976441
1494,/title/tt1924396/,La migliore offerta,"Trieste, Friuli-Venezia Giulia, Italy",,"Trieste, UTI Giuliana / Julijska MTU, Friuli Venezia Giulia, Italia",45.6500335,13.7706559
1495,/title/tt1924396/,La migliore offerta,"Milan, Lombardia, Italy",,"Milano, Lombardia, Italia",45.4668,9.1905
1496,/title/tt1924396/,La migliore offerta,"Old Town Square, Old Town, Prague, Czech Republic",(final scenes in Prague)                        ,"Staroměstské náměstí, Staré Město, Praha, okres Hlavní město Praha, Hlavní město Praha, Praha, Česká republika",50.087469850000005,14.421163984200046
1497,/title/tt1924396/,La migliore offerta,"Villa Mainardis, Via Gorizzo 31, Gorizzo, Italy",(Old villa scenes)                        ,,,
1498,/title/tt1924396/,La migliore offerta,"Vienna, Austria",,"Wien, 1010, Österreich",48.2083537,16.3725042
1499,/title/tt1924396/,La migliore offerta,"Bolzano, Trentino-Alto Adige, Italy",,"Bolzano - Bozen, Trentino-Alto Adige/Südtirol, 39010, Italia",46.65594215,11.229637264169462
1500,/title/tt1924396/,La migliore offerta,"Milan, Lombardy, Italy",,"Milano, Lombardia, Italia",45.4668,9.1905
1501,/title/tt2935476/,Far from the Madding Crowd,"Mapperton, Beaminster, Dorset, England, UK",(Bathsheba Everdene's farm)                        ,"Mapperton House, B3163, Beaminster, Dorset, South West England, England, DT8 3NR, United Kingdom",50.79448315,-2.70575055322027
1502,/title/tt2935476/,Far from the Madding Crowd,"West Bay, Dorset, England, UK",(coastline)                        ,"West Bay, Dorset, South West England, England, DT6 4HA, United Kingdom",50.7113266,-2.7615661
1503,/title/tt2935476/,Far from the Madding Crowd,"Sherborne, Dorset, England, UK",(Casterbridge market)                        ,"Sherborne, Dorset, South West England, England, DT9 3NZ, United Kingdom",50.9486876,-2.5197693
1504,/title/tt2935476/,Far from the Madding Crowd,"Forde Abbey, Chard, Somerset, England, UK",(Corn Exchange)                        ,,,
1505,/title/tt2935476/,Far from the Madding Crowd,"England, UK",,"England, United Kingdom",52.7954791,-0.5402402866174321
1506,/title/tt0083412/,Fame,"Manhattan, New York City, New York, USA",,"Manhattan, New York County, New York, United States of America",40.7896239,-73.9598939
1507,/title/tt4799066/,Midnight Sun,"Vancouver, British Columbia, Canada",,"Vancouver, Metro Vancouver Regional District, British Columbia, Canada",49.2608724,-123.1139529
1508,/title/tt0424993/,Employee of the Month,"Albuquerque, New Mexico, USA",,"Albuquerque, Bernalillo County, New Mexico, United States of America",35.0841034,-106.6509851
1509,/title/tt2080323/,Hotel Desire,"Berlin, Germany",,"Berlin, 10117, Deutschland",52.5170365,13.3888599
1510,/title/tt0762107/,I Now Pronounce You Chuck & Larry,"Bensonhurst, Brooklyn, New York City, New York, USA",,"Bensonhurst, Brooklyn, Kings County, New York, 11214, United States of America",40.6049772,-73.9934061
1511,/title/tt0762107/,I Now Pronounce You Chuck & Larry,"FDNY Engine 280 Ladder 132 - 489 St. Johns Place, Brooklyn, New York City, New York, USA",(Chuck & Larry's Firehouse)                        ,"FDNY Engine 280/Ladder 132, 489-491, Saint Johns Place, Prospect Heights, Brooklyn, Kings County, New York, 11238, United States of America",40.67350965,-73.9616236784845
1512,/title/tt0762107/,I Now Pronounce You Chuck & Larry,"New York City, New York, USA",,"New York, United States of America",40.7127281,-74.0060152
1513,/title/tt0362225/,Ne le dis à personne,"Boulevard périphérique, Paris 16, Paris, France",,,,
1514,/title/tt0362225/,Ne le dis à personne,"Cité Griset, Rue Griset, Paris 11, Paris, France",,,,
1515,/title/tt0362225/,Ne le dis à personne,"Boulevard Ney, Paris 18, Paris, France",,"Boulevard Ney, Quartier des Grandes-Carrières, Paris, Île-de-France, France métropolitaine, 75018, France",48.8975433,2.3292334
1516,/title/tt0362225/,Ne le dis à personne,"Marché aux Puces, Paris 18, Paris, France",,"Marché aux Puces, Rue des Rosiers, Paris 18e Arrondissement, Saint-Ouen-sur-Seine, Saint-Denis, Paris, Île-de-France, France métropolitaine, 75018, France",48.9023101,2.3422827
1517,/title/tt0362225/,Ne le dis à personne,"Place François 1er, Paris 8, Paris, France",,"Place François 1er, Quartier des Champs-Élysées, Paris, Île-de-France, France métropolitaine, 75008, France",48.8662046,2.30781896279308
1518,/title/tt0362225/,Ne le dis à personne,"Quartier des Gatines, Plaisir, Yvelines, France",,,,
1519,/title/tt0362225/,Ne le dis à personne,"Rue des Marronniers, Paris 16, Paris, France",,"Rue des Marronniers, Hameau Boileau, Paris 16e Arrondissement, Paris, Île-de-France, France métropolitaine, 75016, France",48.8545105,2.2768969
1520,/title/tt0362225/,Ne le dis à personne,"Rue du Pont-Neuf, Paris 1, Paris, France",,"Rue du Pont Neuf, Quartier Saint-Germain-l'Auxerrois, Paris 1er Arrondissement, Paris, Île-de-France, France métropolitaine, 75001, France",48.8589945,2.3431234
1521,/title/tt0415463/,Zoey 101,"Pepperdine University - 24255 Pacific Coast Highway, Malibu, California, USA",,,,
1522,/title/tt0415463/,Zoey 101,"Santa Clarita, California, USA",,"Santa Clarita, Los Angeles County, California, United States of America",34.3916641,-118.542586
1523,/title/tt0056923/,Charade,"Carré Marigny stamp outdoor market, Paris 8, Paris, France",,,,
1524,/title/tt0056923/,Charade,"Métro Varenne, Paris 7, Paris, France",(as Métro St-Jacques)                        ,"Métro 13, Accès Parking Invalides, Quartier des Invalides, Paris, Île-de-France, France métropolitaine, 75007, France",48.8591189,2.3143767
1525,/title/tt0056923/,Charade,"24 Rue Censier, Paris, France",,"24, Rue Censier, Quartier du Jardin des Plantes, Paris, Île-de-France, France métropolitaine, 75005, France",48.8404114,2.3523366
1526,/title/tt0056923/,Charade,"American Embassy - 2 Avenue Gabriel, Paris 8, Paris, France",,,,
1527,/title/tt0056923/,Charade,"Comédie-Française, 2 Rue de Richelieu, Paris 1, Paris, France",,,,
1528,/title/tt0056923/,Charade,"Le Cochon à l'oreille Restaurant - 15 rue Montmartre, Paris 1, Paris, France",,,,
1529,/title/tt0056923/,Charade,"Halles de Paris, Paris 1, Paris, France",,,,
1530,/title/tt0056923/,Charade,"Studios de Boulogne-Billancourt/SFP - 2 Rue de Silly, Boulogne-Billancourt, Hauts-de-Seine, France",(studio)                        ,,,
1531,/title/tt0056923/,Charade,"Port de la Tournelle, Paris 5, Paris, France",,"Port de la Tournelle, Pont de Sully, Quartier Saint-Victor, Paris, Île-de-France, France métropolitaine, 75004, France",48.850506300000006,2.3543287868388925
1532,/title/tt0056923/,Charade,"Notre Dame Cathedral, Paris, France","(exterior: S side, Peter & Regina by Seine River)                        ","Cathédrale Notre-Dame, 6, Parvis Notre-Dame - Place Jean-Paul II, Quartier Les Îles, Paris, Île-de-France, France métropolitaine, 75004, France",48.85293705,2.3500501225000026
1533,/title/tt0270288/,Confessions of a Dangerous Mind,"Montréal, Québec, Canada",,"Montréal, Agglomération de Montréal, Montréal (06), Québec, Canada",45.4972159,-73.6103642
1534,/title/tt0270288/,Confessions of a Dangerous Mind,"Tucson, Arizona, USA",,"Tucson, Pima County, Arizona, United States of America",32.2228765,-110.9748477
1535,/title/tt0270288/,Confessions of a Dangerous Mind,"Nogales, Arizona, USA",,"Nogales, Santa Cruz County, Arizona, 85621, United States of America",31.3402134,-110.9360818
1536,/title/tt0270288/,Confessions of a Dangerous Mind,"Veluzat Motion Picture Ranch, Saugus, California, USA",,,,
1537,/title/tt0270288/,Confessions of a Dangerous Mind,"Santa Clarita, California, USA",,"Santa Clarita, Los Angeles County, California, United States of America",34.3916641,-118.542586
1538,/title/tt0067093/,Fiddler on the Roof,"Lekenik, Croatia",(Anatevka)                        ,"Lekenik, Općina Lekenik, Sisačko-moslavačka županija, 44272, Hrvatska",45.5843916,16.2120842
1539,/title/tt0067093/,Fiddler on the Roof,"Zagreb, Croatia",,"Zagreb, Grad Zagreb, Hrvatska",45.813177,15.977048
1540,/title/tt0067093/,Fiddler on the Roof,"Mala, Croatia",,"Mala, Medveščak, Gornji grad - Medveščak, Zagreb, 10009, Hrvatska",45.822551,15.9779788
1541,/title/tt0067093/,Fiddler on the Roof,"Pinewood Studios, Iver Heath, Buckinghamshire, England, UK",(studio)                        ,"Pinewood Studios, Pinewood Green, Iver, Iver Heath, Buckinghamshire, South East, England, SL0 0QJ, United Kingdom",51.54831515,-0.5346765566753087
1542,/title/tt0110308/,The Last Seduction,"Irvington, New York, USA",,"Irvington, Town of Greenburgh, Westchester County, New York, United States of America",41.0350625,-73.86485213574096
1543,/title/tt0110308/,The Last Seduction,"New York, USA",,"New York, United States of America",40.7127281,-74.0060152
1544,/title/tt0079522/,Manhattan,"Solomon R. Guggenheim Museum - 1071 Fifth Avenue, Manhattan, New York City, New York, USA",,,,
1545,/title/tt0079522/,Manhattan,"American Museum of Natural History - Central Park West at 79th Street, Manhattan, New York City, New York, USA",,,,
1546,/title/tt0079522/,Manhattan,"Fifth Avenue, Manhattan, New York City, New York, USA",,,,
1547,/title/tt0079522/,Manhattan,"Metropolitan Museum of Art, Manhattan, New York City, New York, USA",,"The Metropolitan Museum of Art, 1000, 5th Avenue, Manhattan Community Board 8, Manhattan, New York County, New York, 10035, United States of America",40.779443650000005,-73.96336411385192
1548,/title/tt0079522/,Manhattan,"Queensboro Bridge, Manhattan, New York City, New York, USA",,"Queensboro Bridge, West Road, Manhattan Community Board 8, Manhattan, New York County, New York, 10044, United States of America",40.75573455,-73.95189258066381
1549,/title/tt0079522/,Manhattan,"Broadway, Manhattan, New York City, New York, USA",,"Broadway, Inwood, Manhattan Community Board 12, Manhattan, New York County, New York, 10463, United States of America",40.8732847,-73.911655
1550,/title/tt0079522/,Manhattan,"Dalton School - 61 East 91st Street, Upper East Side, Manhattan, New York City, New York, USA",,,,
1551,/title/tt0079522/,Manhattan,"East Side, Manhattan, New York City, New York, USA",,"USA Shaolin Temple, 102, Allen Street, Lower East Side, Manhattan Community Board 3, Manhattan, New York County, New York, 10002, United States of America",40.7187636,-73.9903134
1552,/title/tt0079522/,Manhattan,"Empire Diner, 210 10th Avenue, Manhattan, New York City, New York, USA",,"Empire Diner, 210, 10th Avenue, Chelsea, Manhattan Community Board 4, Manhattan, New York County, New York, 10011, United States of America",40.7471834,-74.0043111
