,Code,Show Name,Location,Scene,geocodedLocation,latitude,longitude
573,/title/tt1133985/,Green Lantern,"Los Angeles, California, USA",(reshoots)                        ,"Los Angeles, Los Angeles County, California, United States of America",34.0536909,-118.2427666
574,/title/tt1133985/,Green Lantern,USA,,United States,39.7837304,-100.4458825
575,/title/tt1133985/,Green Lantern,"Burbank, California, USA",,"Burbank, Los Angeles County, California, United States of America",34.1816482,-118.3258554
576,/title/tt0480249/,I Am Legend,"USS Intrepid, New York City, New York, USA",(golf practice)                        ,"USS Intrepid, 1, Hudson River Park Esplanade, Hell's Kitchen, Manhattan Community Board 4, Manhattan, New York County, New York, 10019, United States of America",40.76473335,-74.00083980660943
577,/title/tt0480249/,I Am Legend,"West Amwell, New Jersey, USA",,"Amwell, East Amwell Township, Hunterdon County, New Jersey, 08525, United States of America",40.4314941,-74.7521061
578,/title/tt0480249/,I Am Legend,"Dumbo, Brooklyn, New York City, New York, USA",,"DUMBO, Brooklyn, Kings County, New York, 11201-1832, United States of America",40.7029052,-73.9901167
579,/title/tt0480249/,I Am Legend,"Washington Heights, Manhattan, New York City, New York, USA",,"Washington Heights, Manhattan Community Board 12, Manhattan, New York County, New York, United States of America",40.8401984,-73.9402214
580,/title/tt0480249/,I Am Legend,"11 Washington Square North, Greenwich Village, Manhattan, New York City, New York, USA",(exteriors: Robert Neville's house)                        ,"11, Washington Square North, Greenwich Village, Manhattan Community Board 2, Manhattan, New York County, New York, 10003, United States of America",40.7313355,-73.9965091
581,/title/tt0480249/,I Am Legend,"Herald Square, Manhattan, New York City, New York, USA",(Neville driving)                        ,"Herald Square, Manhattan Community Board 5, Manhattan, New York County, New York, United States of America",40.7495023,-73.9879917140461
582,/title/tt0480249/,I Am Legend,"New York City, New York, USA",,"New York, United States of America",40.7127281,-74.0060152
583,/title/tt0480249/,I Am Legend,"20 East Fourth Street, Manhattan, New York City, New York, USA",(video store)                        ,,,
584,/title/tt0480249/,I Am Legend,"Temple of Dendur, Metropolitan Museum of Art, Manhattan, New York City, New York, USA",(Neville fishing)                        ,,,
585,/title/tt0480249/,I Am Legend,"Los Angeles, California, USA",,"Los Angeles, Los Angeles County, California, United States of America",34.0536909,-118.2427666
586,/title/tt0480249/,I Am Legend,"Madison Square Park, Manhattan, New York City, New York, USA",(deer hunting)                        ,"Madison Square Park, Manhattan, New York County, New York, United States of America",40.74220365,-73.9880191041057
587,/title/tt0480249/,I Am Legend,"Mt. Airy, New Jersey, USA",(Vermont survivors settlement)                        ,"Mount Airy, West Amwell Township, Hunterdon County, New Jersey, 08530, United States of America",40.3987166,-74.9071106
588,/title/tt0479143/,Rocky Balboa,"Philadelphia Museum of Art - 2600 Benjamin Franklin Parkway, Philadelphia, Pennsylvania, USA",(Rocky steps)                        ,"Philadelphia Museum of Art, 2600, Benjamin Franklin Parkway, Spring Garden, Philadelphia, Philadelphia County, Pennsylvania, 19130, United States of America",39.965563849999995,-75.18151277315162
589,/title/tt0479143/,Rocky Balboa,"1818 East Tusculum Street, Kensington, North Philadelphia, Pennsylvania, USA",(Rocky's old home)                        ,"1818, East Tusculum Street, Kensington, Philadelphia, Philadelphia County, Pennsylvania, 19134, United States of America",39.990236653061224,-75.12430344897959
590,/title/tt0479143/,Rocky Balboa,"Philadelphia City Hall - 1450 John F. Kennedy Blvd., Philadelphia, Pennsylvania, USA",,,,
591,/title/tt0479143/,Rocky Balboa,"3091 Emerald Street, Philadelphia, Pennsylvania, USA",(Rocky's home)                        ,"3091, Emerald Street, Tioga Park, Philadelphia, Philadelphia County, Pennsylvania, 19134, United States of America",39.992706636363636,-75.11404245454546
592,/title/tt0479143/,Rocky Balboa,"2007 Walnut Street, Philadelphia, Pennsylvania, USA",(Irish Pub showing computed boxing match)                        ,"Walnut Street, Schuylkill Yards, Philadelphia, Philadelphia County, Pennsylvania, 19104-2989, United States of America",39.9514262,-75.1809286
593,/title/tt0479143/,Rocky Balboa,"Laurel Hill Cemetery, Fairmount Park, Philadelphia, Pennsylvania, USA",(Adrian's grave)                        ,,,
594,/title/tt0479143/,Rocky Balboa,"Philadelphia Convention Center - 1700 Market Street, Philadelphia, Pennsylvania, USA",,,,
595,/title/tt0479143/,Rocky Balboa,"Pennsylvania, USA",,"Pennsylvania, United States of America",40.9699889,-77.7278831
596,/title/tt0479143/,Rocky Balboa,"Cira Centre - 2929 Arch Street, Philadelphia, Pennsylvania, USA",(Rocky's son workplace)                        ,"Cira Centre, 2929, Arch Street, Schuylkill Yards, Philadelphia, Philadelphia County, Pennsylvania, 19104-2892, United States of America",39.9572797,-75.18245630112375
597,/title/tt0080455/,The Blues Brothers,"Dixie Square Mall - 151st Street & Dixie Highway, Harvey, Illinois, USA",(Shopping Mall Complex)                        ,,,
598,/title/tt0080455/,The Blues Brothers,"Pilgrim Baptist Church - 9114 S. Burley Avenue, South Chicago, Chicago, Illinois, USA",(Church scene with James Brown)                        ,,,
599,/title/tt0080455/,The Blues Brothers,"22 W. Van Buren Street, The Loop, Downtown, Chicago, Illinois, USA",(Jake and Elwood's apartment)                        ,,,
600,/title/tt0080455/,The Blues Brothers,"West Wind Motel - 28W721 Roosevelt Rd., West Chicago, Illinois, USA",(Motel scene with Twiggy)                        ,,,
601,/title/tt0080455/,The Blues Brothers,"Chez Paul Restaurant - 660 N. Rush Street, Near North Side, Chicago, Illinois, USA",(Restaurant)                        ,,,
602,/title/tt0080455/,The Blues Brothers,"Cooks Picnic Grove, Bangs Lake, Wauconda, Illinois, USA",(beach scene)                        ,,,
603,/title/tt0080455/,The Blues Brothers,"Joliet Prison - Collins Street, Joliet, Illinois, USA",(Prison)                        ,,,
604,/title/tt0080455/,The Blues Brothers,"Daniel Hoan Memorial Bridge, Milwaukee, Wisconsin, USA",(Car chase with Nazis - car hangs off bridge)                        ,,,
605,/title/tt0080455/,The Blues Brothers,"Hollywood Palladium - 6215 Sunset Blvd., Hollywood, Los Angeles, California, USA",(interiors: Palace Hotel Ballroom - First Performance of the Blues Brothers)                        ,,,
606,/title/tt0080455/,The Blues Brothers,"Intersection of W. Talcott & Devon Ave, Park Ridge, Illinois, USA",(Police chase & spin out)                        ,,,
607,/title/tt0080455/,The Blues Brothers,"East 95th Street Bridge, South Deering, Chicago, Illinois, USA",(Bluesmobile car jumps over bridge)                        ,"East 95th Street, South Deering, Chicago, Cook County, Illinois, 60617, United States of America",41.7223644,-87.583645
608,/title/tt0080455/,The Blues Brothers,"1623 S. 51st Court, Cicero, Illinois, USA",(Mrs. Tarantino's House)                        ,,,
609,/title/tt0080455/,The Blues Brothers,"Mannheim Road, Cook County, Illinois, USA",(Holiday Inn - Murph and the Magic Tones)                        ,"Mannheim Road, Franklin Park, Leyden Township, Cook County, Illinois, 60132, United States of America",41.9432782,-87.8856526
610,/title/tt0080455/,The Blues Brothers,"Singapore Lake, Backlot, Universal Studios - 100 Universal City Plaza, Universal City, California, USA",(Good 'Ole Boys motor-home crashes into lake)                        ,,,
611,/title/tt0080455/,The Blues Brothers,"North Lagoon, Jackson Park, Hyde Park, Chicago, Illinois, USA",,,,
612,/title/tt0080455/,The Blues Brothers,"South Side, Chicago, Illinois, USA",,"S, Lakefront Trail, Near South Side, South Loop, Chicago, Cook County, Illinois, 60605, United States of America",41.856439,-87.6110589
613,/title/tt0080455/,The Blues Brothers,"Van Buren & LaSalle Streets, The Loop, Downtown, Chicago, Illinois, USA",,,,
614,/title/tt0080455/,The Blues Brothers,"Hollywood, Los Angeles, California, USA",,"Hollywood, Los Angeles, Los Angeles County, California, 90028-8127, United States of America",34.0980031,-118.329523
615,/title/tt0080455/,The Blues Brothers,"Chicago, Illinois, USA",,"Chicago, Cook County, Illinois, United States of America",41.8755616,-87.6244212
616,/title/tt0080455/,The Blues Brothers,"20 E. Randolph Street, Downtown, Chicago, Illinois, USA",(Bus Station)                        ,,,
617,/title/tt0080455/,The Blues Brothers,"Harvey, Illinois, USA",,"Harvey, Thornton Township, Cook County, Illinois, 60426, United States of America",41.6100344,-87.6467132
618,/title/tt0080455/,The Blues Brothers,"City Hall - 121 N. LaSalle Street, The Loop, Downtown, Chicago, Illinois, USA",(Siege at City Hall-County Building - Steven Spielberg cameo)                        ,,,
619,/title/tt0080455/,The Blues Brothers,"South Lagoon, Jackson Park, Hyde Park, Chicago, Illinois, USA",,,,
620,/title/tt0080455/,The Blues Brothers,"Park Ridge, Illinois, USA",,"Park Ridge, Cook County, Illinois, United States of America",42.0112329,-87.8406031
621,/title/tt0080455/,The Blues Brothers,USA,,United States,39.7837304,-100.4458825
622,/title/tt1155076/,The Karate Kid,"Huangshan Mountains, China",,,,
623,/title/tt1155076/,The Karate Kid,"Beijing, China",,"北京市, 东城区, 北京市, 100010, China 中国",39.906217,116.3912757
624,/title/tt1155076/,The Karate Kid,USA,,United States,39.7837304,-100.4458825
625,/title/tt1592154/,Nikita,"Revival 629, 629 Eastern Avenue, Toronto, Ontario, Canada",(studio) (movie studio)                        ,,,
626,/title/tt1592154/,Nikita,"Toronto, Ontario, Canada",,"Toronto, Peel, Golden Horseshoe, Ontario, Canada",43.6534817,-79.3839347
627,/title/tt8364368/,Crawl,"Belgrade, Serbia",,"Београд, Град Београд, Централна Србија, 11000, Србија (Serbia)",44.8178131,20.4568974
628,/title/tt1365519/,Tomb Raider,"Wilton House, Wilton, Salisbury, Wiltshire, England, UK",,"Wilton, Wiltshire, South West England, England, SP2 0JP, United Kingdom",51.0805315,-1.8607051
629,/title/tt1365519/,Tomb Raider,"Epping, Cape Town, Western Cape, South Africa",,"Epping Industria 1, Cape Town, City of Cape Town, Western Cape, South Africa",-33.9333695,18.534577
630,/title/tt1365519/,Tomb Raider,"London, England, UK",,"London, Greater London, England, United Kingdom",51.5073219,-0.1276474
631,/title/tt1365519/,Tomb Raider,"Warner Bros. Studios, Leavesden, Hertfordshire, England, UK",(studio)                        ,"Warner Bros Studios Leavesden, Essex Lane, Warner Bros. Studios Leavesden, Abbots Langley, Three Rivers, Hertfordshire, East of England, England, WD25 7LP, United Kingdom",51.6934642,-0.4205376395864987
632,/title/tt1365519/,Tomb Raider,South Africa,,South Africa,-28.8166236,24.991639
633,/title/tt1365519/,Tomb Raider,"Cape Town, Western Cape, South Africa",,"Cape Town, City of Cape Town, Western Cape, 8001, South Africa",-33.928992,18.417396
634,/title/tt9625664/,Trauma Center,"San Juan, Puerto Rico",(studio) (location)                        ,"San Juan, Puerto Rico, 00901, United States of America",18.465299,-66.116666
635,/title/tt5461944/,Hotel Mumbai,"Adelaide Studios, 226 Fullarton Road, Glenside, South Australia, Australia","(studio) (interiors: Taj Mahal Hotel, Mumbai)                        ",,,
636,/title/tt5461944/,Hotel Mumbai,"Adelaide, South Australia, Australia",(studio) (studio: South Australian Film Corporation)                        ,"Adelaide, Adelaide City Council, South Australia, Australia",-34.9281805,138.5999312
637,/title/tt1596350/,This Means War,"Vancouver, British Columbia, Canada",,"Vancouver, Metro Vancouver Regional District, British Columbia, Canada",49.2608724,-123.1139529
638,/title/tt1596350/,This Means War,"Steveston, Richmond, British Columbia, Canada",,"Steveston, Richmond, Metro Vancouver Regional District, British Columbia, Canada",49.1280561,-123.177415512419
639,/title/tt1596350/,This Means War,"Los Angeles, California, USA",,"Los Angeles, Los Angeles County, California, United States of America",34.0536909,-118.2427666
640,/title/tt1846589/,Hunter Killer,Bulgaria,,Бългaрия,42.6073975,25.4856617
641,/title/tt1846589/,Hunter Killer,"Pinewood Studios, Iver Heath, Buckinghamshire, England, UK",(studio)                        ,"Pinewood Studios, Pinewood Green, Iver, Iver Heath, Buckinghamshire, South East, England, SL0 0QJ, United Kingdom",51.54831515,-0.5346765566753087
642,/title/tt1846589/,Hunter Killer,UK,,United Kingdom,54.7023545,-3.2765753
643,/title/tt6679794/,Outlaw King,"Linlithgow Palace, Linlithgow, West Lothian, Scotland, UK",,"Linlithgow Palace, Kirkgate, Preston, Linlithgow Bridge, Linlithgow, West Lothian, Scotland, EH49, United Kingdom",55.97872045,-3.600557431533725
644,/title/tt6679794/,Outlaw King,"Berwick Bridge 'the Old Bridge', Berwick Upon Tweed, Northumberland, England, UK",,"Berwick Bridge, Old Bridge, Berwick-upon-Tweed, Northumberland, North East England, England, TD15 1AL, United Kingdom",55.7678226,-2.008131917871481
645,/title/tt6679794/,Outlaw King,"Mugdock Country Park, Milngavie, Glasgow, Scotland, UK",,,,
646,/title/tt6679794/,Outlaw King,"Coral Beach, Isle of Skye, Scotland, UK",,,,
647,/title/tt6679794/,Outlaw King,"Edinburgh, Scotland, UK",,"Edinburgh, City of Edinburgh, Scotland, EH1 3EG, United Kingdom",55.9533456,-3.1883749
648,/title/tt6679794/,Outlaw King,"Isle of Skye, Scotland, UK",,"Skye, Highland, Scotland, United Kingdom",57.363045,-6.301979224806201
649,/title/tt6679794/,Outlaw King,"Glasgow, Scotland, UK",,"Glasgow, Glasgow City, Scotland, G2 9SA, United Kingdom",55.8609825,-4.2488787
650,/title/tt6679794/,Outlaw King,"Dunfermline Abbey Nave, Dunfermline, Fife, Scotland, UK",(interiors)                        ,"Dunfermline Abbey, St Catherine's Wynd, Heritage Quarter, Abbey Parks, Dunfermline, Fife, Scotland, KY12 7NA, United Kingdom",56.0699085,-3.4635633052631576
651,/title/tt6679794/,Outlaw King,"Tantallon Castle, East Lothian",(location)                        ,"Tantallon Castle, A198, Auldhame, Tyninghame, East Lothian, Scotland, EH39 5PW, United Kingdom",56.056490999999994,-2.650709343406835
652,/title/tt6679794/,Outlaw King,"Scotland, UK",,"Scotland, United Kingdom",56.7861112,-4.1140518
653,/title/tt6679794/,Outlaw King,"England, UK",,"England, United Kingdom",52.7954791,-0.5402402866174321
654,/title/tt3079380/,Spy,"Budapest, Hungary",,"Budapest, Közép-Magyarország, 1011, Magyarország",47.4983815,19.0404707
655,/title/tt3079380/,Spy,"Lake Balaton, Hungary","(as itself & at the beginning as Varna, Bulgaria)                        ","Balaton, Közép-Dunántúl, Dunántúl, 8174, Magyarország",46.8836527,17.846663499449168
656,/title/tt3079380/,Spy,"Four Seasons Hotel Gresham Palace, Budapest, Hungary",,,,
657,/title/tt3079380/,Spy,"Danube River, Budapest, Hungary",,"Duna, Budapest, Közép-Magyarország, 1055, Magyarország",47.5119922,19.0426256
658,/title/tt3079380/,Spy,"Hungarian Parliament Building, Budapest, Hungary",,,,
659,/title/tt3079380/,Spy,"Budapest Whale, Budapest, Hungary",(open air concert in Paris)                        ,,,
660,/title/tt3079380/,Spy,"Tihany, Hungary",,"Tihany, Balatonfüredi járás, Veszprém megye, Közép-Dunántúl, Dunántúl, 8237, Magyarország",46.9122292,17.8917574
661,/title/tt3079380/,Spy,"Origo Studios, Budapest, Hungary",(studio)                        ,"Origo Studios, 9, Rákospalota, XV. kerület, Közép-Magyarország, 1151, Magyarország",47.5801079,19.13692565665975
662,/title/tt3079380/,Spy,"Paris, France",,"Paris, Île-de-France, France métropolitaine, France",48.8566969,2.3514616
663,/title/tt3079380/,Spy,France,,France,46.603354,1.8883335
664,/title/tt4396630/,The Gifted,"Atlanta Metro Studios, Union City, Georgia, USA",,,,
665,/title/tt4396630/,The Gifted,"Dallas, Texas, USA",(pilot)                        ,"Dallas, Dallas County, Texas, United States of America",32.7762719,-96.7968559
666,/title/tt4396630/,The Gifted,"Georgia, USA",,"Georgia, United States of America",32.3293809,-83.1137366
667,/title/tt0093560/,The Monster Squad,"Warner Brothers Burbank Studios - 4000 Warner Boulevard, Burbank, California, USA",(studio) (Studio/town square)                        ,,,
668,/title/tt0093560/,The Monster Squad,"Richland Avenue Elementary School - 11562 Richland Avenue, Los Angeles, California, USA",(School)                        ,,,
669,/title/tt0093560/,The Monster Squad,"Universal Studios - 100 Universal City Plaza, Universal City, California, USA",(Mansion)                        ,,,
670,/title/tt1013752/,Fast & Furious,Dominican Republic,,República Dominicana,19.0974031,-70.3028026
671,/title/tt1013752/,Fast & Furious,Mexico,,"Ciudad de México, 06060, México",19.4326296,-99.1331785
672,/title/tt1013752/,Fast & Furious,"Long Beach, California, USA",,"Long Beach, Los Angeles County, California, United States of America",33.7690164,-118.1916048
673,/title/tt1013752/,Fast & Furious,"722 E Kensington Rd, Los Angeles, California, USA",(Dom's house)                        ,"722, East Kensington Road, Echo Park, Los Angeles, Los Angeles County, California, 90026, United States of America",34.068863050000004,-118.25148819110248
674,/title/tt1013752/,Fast & Furious,"Backlot, Universal Studios - 100 Universal City Plaza, Universal City, California, USA",,,,
675,/title/tt1013752/,Fast & Furious,"Soggy Dry Lake, Lucerne Valley, California, USA",,,,
676,/title/tt1013752/,Fast & Furious,"W 8th St & S Hoover St, Los Angeles, California, USA",,,,
677,/title/tt6475714/,Monster Hunter,"Western Cape, South Africa",,"Western Cape, South Africa",-33.546977,20.72753
678,/title/tt6475714/,Monster Hunter,"Cape Town, Western Cape, South Africa",,"Cape Town, City of Cape Town, Western Cape, 8001, South Africa",-33.928992,18.417396
679,/title/tt5807780/,Spider-Man,"New York City, New York, USA",,"New York, United States of America",40.7127281,-74.0060152
680,/title/tt5807780/,Spider-Man,"Chicago Illinois, USA",(Additional Buildings)                        ,"Chicago, Cook County, Illinois, United States of America",41.8755616,-87.6244212
681,/title/tt5807780/,Spider-Man,China,,中国,35.000074,104.999927
682,/title/tt5807780/,Spider-Man,"Shanghai, China",,"上海市, China 中国",31.2322758,121.4692071
683,/title/tt3393786/,Jack Reacher: Never Go Back,"New Orleans, Louisiana, USA",,"New Orleans, Orleans Parish, Louisiana, United States of America",29.9499323,-90.0701156
684,/title/tt3393786/,Jack Reacher: Never Go Back,"Baton Rouge, Louisiana, USA",(as Washington DC exteriors)                        ,"Baton Rouge, East Baton Rouge Parish, Louisiana, United States of America",30.4459596,-91.18738
685,/title/tt3393786/,Jack Reacher: Never Go Back,"311 Park Road, Metairie Park Country Day School, New Orleans, Louisiana, USA",(as Pembroke girls school)                        ,,,
686,/title/tt3393786/,Jack Reacher: Never Go Back,"Metairie, Louisiana, USA",,"Metairie, Jefferson Parish, Louisiana, 70011, United States of America",29.9899926,-90.1505426
687,/title/tt3393786/,Jack Reacher: Never Go Back,"Washington, District of Columbia, USA",(CGI background plates and general views)                        ,"Washington, District of Columbia, 20230, United States of America",38.8949924,-77.0365581
688,/title/tt3393786/,Jack Reacher: Never Go Back,USA,,United States,39.7837304,-100.4458825
689,/title/tt3393786/,Jack Reacher: Never Go Back,"LaPlace, Louisiana, USA",(diner in opening scene)                        ,"LaPlace, St. John the Baptist Parish, Louisiana, 70068, United States of America",30.0665907,-90.4800848
690,/title/tt3393786/,Jack Reacher: Never Go Back,"Ted's Frostop Diner - 3100 Calhoun St, New Orleans, Louisiana, USA",(take away diner)                        ,,,
691,/title/tt3393786/,Jack Reacher: Never Go Back,"New York City, New York, USA",,"New York, United States of America",40.7127281,-74.0060152
692,/title/tt0329101/,Freddy vs. Jason,"Buntzen Lake, Anmore, British Columbia, Canada",,"Buntzen Lake, Pumphouse Road, Anmore, Metro Vancouver Regional District, British Columbia, V3H 4W5, Canada",49.347628400000005,-122.86013423429901
693,/title/tt0329101/,Freddy vs. Jason,"Toronto, Ontario, Canada",,"Toronto, Peel, Golden Horseshoe, Ontario, Canada",43.6534817,-79.3839347
694,/title/tt0329101/,Freddy vs. Jason,"Vancouver, British Columbia, Canada",,"Vancouver, Metro Vancouver Regional District, British Columbia, Canada",49.2608724,-123.1139529
695,/title/tt0329101/,Freddy vs. Jason,"Universal Studios Hollywood - 1000 Universal Studios Blvd, Universal City, California, USA",(Streets)                        ,,,
696,/title/tt0329101/,Freddy vs. Jason,"2170 W 35th Avenue, Vancouver, British Columbia, Canada",(Blake's house)                        ,"West 35th Avenue, South Cambie, Vancouver, Metro Vancouver Regional District, British Columbia, V6J 3G6, Canada",49.2394027,-123.116015
697,/title/tt1905041/,Fast & Furious 6,"Tenerife, Canary Islands, Spain",,"Tenerife, La Orotava, Santa Cruz de Tenerife, Canarias, España",28.2935785,-16.621447121144122
698,/title/tt1905041/,Fast & Furious 6,"Liverpool, Merseyside, England, UK",(Portions of the London chase scenes filmed around Water Street.)                        ,,,
699,/title/tt1905041/,Fast & Furious 6,"Wembley Stadium, Wembley, London, England, UK",,"Wembley Stadium, Royal Route, London Borough of Brent, London, Greater London, England, HA9 0BU, United Kingdom",51.55606945,-0.27960339379401444
700,/title/tt1905041/,Fast & Furious 6,"Puente de Silva, Santa María de Guía, Gran Canaria, Spain",,,,
701,/title/tt1905041/,Fast & Furious 6,"Bentwaters Parks, Rendlesham, Suffolk, England, UK",(Airfield Hardened Aircraft Shelter site)                        ,"Bentwaters Parks, Rendlesham, East Suffolk, Suffolk, East of England, England, United Kingdom",52.123254849999995,1.4303430013580778
702,/title/tt1905041/,Fast & Furious 6,"Echo Park, Los Angeles, California, USA",,"Echo Park, Los Angeles, Los Angeles County, California, United States of America",34.0779819,-118.2567824
703,/title/tt1905041/,Fast & Furious 6,"Longcross Studios, Chobham Lane, Longcross, Surrey, England, UK",,,,
704,/title/tt1905041/,Fast & Furious 6,"Canary Islands, Spain",,"Canarias, La Orotava, Santa Cruz de Tenerife, Canarias, España",28.2935785,-16.621447121144122
705,/title/tt1905041/,Fast & Furious 6,"722 E Kensington Rd, Los Angeles, California, USA",(Dom's house)                        ,"722, East Kensington Road, Echo Park, Los Angeles, Los Angeles County, California, 90026, United States of America",34.068863050000004,-118.25148819110248
706,/title/tt1905041/,Fast & Furious 6,"A Stage, Shepperton Studios, Shepperton, Surrey, England, UK",,,,
707,/title/tt1905041/,Fast & Furious 6,"D Stage, Shepperton Studios, Shepperton, Surrey, England, UK",,,,
708,/title/tt0111503/,True Lies,"Seven Mile Bridge, Florida Keys, Florida, USA",(bridge escape)                        ,,,
709,/title/tt0111503/,True Lies,"Rosecliff Mansion - 548 Bellevue Avenue, Newport, Rhode Island, USA",(Ballroom scenes)                        ,"Rosecliff Mansion, 548, Bellevue Avenue, Salve Regina University, Ward 3, Newport, Newport County, Rhode Island, 02840, United States of America",41.4649956,-71.30459738149852
710,/title/tt0111503/,True Lies,"Toronto, Ontario, Canada",,"Toronto, Peel, Golden Horseshoe, Ontario, Canada",43.6534817,-79.3839347
711,/title/tt0111503/,True Lies,"1200 Brickell Avenue, Miami, Florida, USA",(Harry saving his daughter from the terrorists)                        ,"Interterra Building, 1200, Brickell Avenue, The Roads, Miami, Miami-Dade County, Florida, 33131, United States of America",25.76211035,-80.1923056
712,/title/tt0111503/,True Lies,"Marathon, Florida, USA",,"Marathon, Monroe County, Florida, United States of America",24.7137524,-81.0903512
713,/title/tt0111503/,True Lies,"Alverno High School - 200 North Michillinda Avenue, Sierra Madre, California, USA",,,,
714,/title/tt0111503/,True Lies,"Boreal Mountain Resort - 19455 Boreal Ridge Road, Soda Springs, California, USA",,,,
715,/title/tt0111503/,True Lies,"Bethesda, Maryland, USA",,"Bethesda, Montgomery County, Maryland, 22814, United States of America",38.9848265,-77.0946459
716,/title/tt0111503/,True Lies,"Santa Clarita, California, USA",,"Santa Clarita, Los Angeles County, California, United States of America",34.3916641,-118.542586
717,/title/tt0111503/,True Lies,"Overseas Highway, Key Largo, Florida, USA",(bridge escape)                        ,"Overseas Highway, Rock Harbor, Key Largo, Monroe County, Florida, 33037, United States of America",25.0698683,-80.4676738
718,/title/tt0111503/,True Lies,"Chinatown, Washington, District of Columbia, USA",(Helen meets Simon)                        ,"Chinatown, Washington, District of Columbia, 20220, United States of America",38.9003422,-77.0214430167629
719,/title/tt0111503/,True Lies,"Greenwich Studios - 12100 Ivan Tors Boulevard, Miami, Florida, USA",(studio)                        ,,,
720,/title/tt0111503/,True Lies,"San Diego, California, USA",,"San Diego, San Diego County, California, United States of America",32.7174209,-117.1627714
721,/title/tt0111503/,True Lies,"Virginia Key, Florida, USA",,"Virginia Key, Miami, Miami-Dade County, Florida, 33149, United States of America",25.7449289,-80.1458679
722,/title/tt0111503/,True Lies,"Key Largo, Florida, USA",,"Key Largo, Monroe County, Florida, United States of America",25.109291,-80.4240159821747
