,Code,Show Name,Location,Scene,geocodedLocation,latitude,longitude
1304,/title/tt2406566/,Atomic Blonde,"Gedächtniskirche, Charlottenburg, Berlin, Germany",,"Neue Kaiser-Wilhelm-Gedächtniskirche, Budapester Straße, Charlottenburg, Charlottenburg-Wilmersdorf, 10789, Deutschland",52.50489465,13.334612982608693
1305,/title/tt2406566/,Atomic Blonde,Germany,,Deutschland,51.0834196,10.4234469
1306,/title/tt2406566/,Atomic Blonde,"Berlin Cathedral, Mitte, Berlin, Germany",(background exterior)                        ,"Berliner Dom, Am Lustgarten, Spandauer Vorstadt, Mitte, Berlin, 10178, Deutschland",52.5190822,13.40109417160804
1307,/title/tt2406566/,Atomic Blonde,"Tempelhof, Berlin, Germany",,"Tempelhof, Tempelhof-Schöneberg, Berlin, Deutschland",52.4632921,13.3864477
1308,/title/tt2406566/,Atomic Blonde,"Fernsehturm, Mitte, Berlin, Germany",(background exterior)                        ,"Berliner Fernsehturm, Panoramastraße, Spandauer Vorstadt, Mitte, Berlin, 10178, Deutschland",52.520822749999994,13.409420934251044
1309,/title/tt0458481/,Sin City: A Dame to Kill For,"Troublemaker Studios - 4900 Old Manor Road, Austin, Texas, USA",,,,
1310,/title/tt0458481/,Sin City: A Dame to Kill For,USA,,United States,39.7837304,-100.4458825
1311,/title/tt5827790/,Orígenes secretos,"Madrid, Spain",,"Madrid, Área metropolitana de Madrid y Corredor del Henares, Comunidad de Madrid, 28001, España",40.4167047,-3.7035825
1312,/title/tt0082136/,The Cannonball Run,"Atlanta, Georgia, USA",(Motel at start of race)                        ,"Atlanta, Georgia, United States of America",33.7490987,-84.3901849
1313,/title/tt0082136/,The Cannonball Run,"Old Tucson - 201 S. Kinney Road, Tucson, Arizona, USA",,"Old Tucson, 201, Kinney Road, Tucson Estates, Pima County, Arizona, 85735, United States of America",32.2186224,-111.1300273
1314,/title/tt0082136/,The Cannonball Run,"Lawrenceville, Georgia, USA",(Ambulance scene after boat crash)                        ,"Lawrenceville, Gwinnett County, Georgia, United States of America",33.9562149,-83.9879625
1315,/title/tt0082136/,The Cannonball Run,"Las Vegas, Nevada, USA",,"Las Vegas, Clark County, Nevada, United States of America",36.1672559,-115.1485163
1316,/title/tt0082136/,The Cannonball Run,"Portofino Inn - 260 Portofino way - Redondo Beach, California, USA",(End of race)                        ,,,
1317,/title/tt0343818/,"I, Robot","Vancouver, British Columbia, Canada",,"Vancouver, Metro Vancouver Regional District, British Columbia, Canada",49.2608724,-123.1139529
1318,/title/tt0343818/,"I, Robot","Surrey, British Columbia, Canada",,"Surrey, Metro Vancouver Regional District, British Columbia, Canada",49.1913033,-122.8491439
1319,/title/tt0343818/,"I, Robot","Dumont Dunes, California, USA",,"Dumont Dunes, San Bernardino County, California, United States of America",35.6833036,-116.2194652
1320,/title/tt0343818/,"I, Robot","Central City Mall, Surrey, British Columbia, Canada",(robot army vs. humans street battle)                        ,"Central City, 10153, King George Boulevard, Whalley, Surrey, Metro Vancouver Regional District, British Columbia, V3T 0A8, Canada",49.1853915,-122.8475271
1321,/title/tt0870154/,Jungle Cruise,"Kaua'i, Hawaii, USA",,"Kauaʻi, Kauaʻi County, Hawaii, United States of America",22.050466550000003,-159.55876775017003
1322,/title/tt0870154/,Jungle Cruise,"Atlanta, Georgia, USA",,"Atlanta, Georgia, United States of America",33.7490987,-84.3901849
1323,/title/tt0870154/,Jungle Cruise,USA,,United States,39.7837304,-100.4458825
1324,/title/tt1060277/,Cloverfield,"New York Street, Warner Brothers Burbank Studios - 4000 Warner Boulevard, Burbank, California, USA",,,,
1325,/title/tt1060277/,Cloverfield,"Westfield Santa Anita Shopping Center - 400 South Baldwin Avenue, Arcadia, California, USA",,,,
1326,/title/tt1060277/,Cloverfield,"Santa Clarita, California, USA",,"Santa Clarita, Los Angeles County, California, United States of America",34.3916641,-118.542586
1327,/title/tt1060277/,Cloverfield,"Warner Brothers Burbank Studios - 4000 Warner Boulevard, Burbank, California, USA",(studio)                        ,,,
1328,/title/tt1060277/,Cloverfield,"Coney Island, Brooklyn, New York, USA",(Ferris Wheel)                        ,"Coney Island, Brooklyn, Kings County, New York, 11224, United States of America",40.57592745,-73.99219674341339
1329,/title/tt0106697/,Demolition Man,"Louisville, Kentucky, USA",,"Louisville, Jefferson County, Kentucky, United States of America",38.2542376,-85.759407
1330,/title/tt0106697/,Demolition Man,"Pasadena, California, USA",(Wasteland scenes)                        ,"Pasadena, Los Angeles County, California, United States of America",34.1476452,-118.1444779
1331,/title/tt0106697/,Demolition Man,"Fleur Daniels Chemical Company, Irvine, California, USA",(Museum exteriors)                        ,,,
1332,/title/tt0106697/,Demolition Man,"San Diego Convention Center, San Diego, California, USA",(On the way to Taco Bell)                        ,"San Diego Convention Center, 111, West Harbor Drive, Gaslamp Quarter, Banker's Hill, San Diego, San Diego County, California, 92101, United States of America",32.7063457,-117.16191188768504
1333,/title/tt0106697/,Demolition Man,"2nd Street Tunnel between Hill and Figueroa, Los Angeles, California, USA",,,,
1334,/title/tt0106697/,Demolition Man,"Los Angeles Convention Center - 1201 S. Figueroa Street, Downtown, Los Angeles, California, USA",,,,
1335,/title/tt0106697/,Demolition Man,"Westlake Village, California, USA",,"Westlake Village, Los Angeles County, California, United States of America",34.1460234,-118.8061794
1336,/title/tt0106697/,Demolition Man,"Pacific Design Center - 8687 Melrose Avenue, West Hollywood, California, USA",,"Pacific Design Center, Melrose Avenue, West Hollywood, Los Angeles County, California, 90069, United States of America",34.08237595,-118.38241523654585
1337,/title/tt0106697/,Demolition Man,"Stage 16, Warner Brothers Burbank Studios - 4000 Warner Boulevard, Burbank, California, USA",,,,
1338,/title/tt5074352/,Dangal,"Pune, Maharashtra, India",,"Pune, Pune City, Pune District, Maharashtra, 411001, India",18.521428,73.8544541
1339,/title/tt5074352/,Dangal,"Delhi, India","(Jawaharlal Nehru Stadium, Talkatora Stadium, Tyagraj Stadium)                        ","Delhi, Kotwali Tehsil, Central Delhi, Delhi, 110006, India",28.6517178,77.2219388
1340,/title/tt0328107/,Man on Fire,"Naples, Campania, Italy",,"Napoli, Campania, Italia",40.8359336,14.2487826
1341,/title/tt0328107/,Man on Fire,"El Paso, Texas, USA",,"El Paso, El Paso County, Texas, United States of America",31.7754152,-106.4646348
1342,/title/tt0328107/,Man on Fire,"Mexico City, Distrito Federal, Mexico",,"México, Calle Benito Juárez, Unidad Habitacional Integración Latinoamericana, Naucalpan, 04350, México",19.337797000000002,-99.17851255290537
1343,/title/tt0328107/,Man on Fire,"Los Angeles, California, USA",,"Los Angeles, Los Angeles County, California, United States of America",34.0536909,-118.2427666
1344,/title/tt0328107/,Man on Fire,Italy,,Italia,42.6384261,12.674297
1345,/title/tt0328107/,Man on Fire,"California, USA",,"California, United States of America",36.7014631,-118.7559974
1346,/title/tt0367882/,Indiana Jones and the Kingdom of the Crystal Skull,"Iguazú Waterfalls, Misiones, Argentina",,,,
1347,/title/tt0367882/,Indiana Jones and the Kingdom of the Crystal Skull,"Iguaçu Falls, Parque Nacional do Iguaçu, Foz do Iguaçu, Paraná, Brazil",,,,
1348,/title/tt0367882/,Indiana Jones and the Kingdom of the Crystal Skull,"Bridgeport, Connecticut, USA",,"Bridgeport, Fairfield County, Connecticut, United States of America",41.1670412,-73.2048348
1349,/title/tt0367882/,Indiana Jones and the Kingdom of the Crystal Skull,"Hamakua Coast, Hawaii, USA",,,,
1350,/title/tt0367882/,Indiana Jones and the Kingdom of the Crystal Skull,"Fresno Chandler Downtown Airport, Fresno, California, USA",(airport scenes)                        ,,,
1351,/title/tt0367882/,Indiana Jones and the Kingdom of the Crystal Skull,"Essex, Connecticut, USA",,"Essex, Middlesex County, Connecticut, United States of America",41.353432,-72.3906406
1352,/title/tt0367882/,Indiana Jones and the Kingdom of the Crystal Skull,"Deming, New Mexico, USA",,"Deming, Luna County, New Mexico, United States of America",32.2627416,-107.7581979
1353,/title/tt0367882/,Indiana Jones and the Kingdom of the Crystal Skull,"Downey Studios - 12214 Lakewood Boulevard, Downey, California, USA",(studio)                        ,,,
1354,/title/tt0367882/,Indiana Jones and the Kingdom of the Crystal Skull,"Pasadena, California, USA",,"Pasadena, Los Angeles County, California, United States of America",34.1476452,-118.1444779
1355,/title/tt0367882/,Indiana Jones and the Kingdom of the Crystal Skull,"Eagle Field - 11163 N. Eagle Avenue, Firebaugh, California, USA",,,,
1356,/title/tt0367882/,Indiana Jones and the Kingdom of the Crystal Skull,"Freeway Park, Backlot, Universal Studios - 100 Universal City Plaza, Universal City, California, USA",,,,
1357,/title/tt0367882/,Indiana Jones and the Kingdom of the Crystal Skull,"Paramount Studios - 5555 Melrose Avenue, Hollywood, Los Angeles, California, USA",(diner scene)                        ,,,
1358,/title/tt0367882/,Indiana Jones and the Kingdom of the Crystal Skull,"Faye Spanos Concert Hall Stockton, California, USA",(Exterior Indy's Classroom)                        ,"Faye Spanos Concert Hall, Dave Brubeck Way, El Pinal, Stockton, San Joaquin County, California, 95204, United States of America",37.97993425,-121.30824059488565
1359,/title/tt0367882/,Indiana Jones and the Kingdom of the Crystal Skull,"Warner Brothers Burbank Studios - 4000 Warner Boulevard, Burbank, California, USA",(studio)                        ,,,
1360,/title/tt0172156/,Bad Boys II,Puerto Rico,,"Puerto Rico, Orocovis, Puerto Rico, United States of America",18.2214149,-66.41328179513847
1361,/title/tt0172156/,Bad Boys II,"Manatí, Puerto Rico",(City Hall)                        ,"Manatí, Puerto Rico, 00701, United States of America",18.4271372,-66.4929477
1362,/title/tt0172156/,Bad Boys II,"Miami Beach, Florida, USA",,"Miami Beach, Miami-Dade County, Florida, United States of America",25.7929198,-80.1353006
1363,/title/tt0172156/,Bad Boys II,"Intersection of US Highway 41 & SW 1st Ave - Miami, Florida, USA",(Haitian Zoe Pounder car chase car pile up)                        ,,,
1364,/title/tt0172156/,Bad Boys II,Netherlands,,Nederland,52.5001698,5.7480821
1365,/title/tt0172156/,Bad Boys II,"Delray Beach, Florida, USA",,"Delray Beach, Palm Beach County, Florida, 33483-4534, United States of America",26.4614625,-80.0728201
1366,/title/tt0172156/,Bad Boys II,"Florida, USA",,"Florida, United States of America",27.7567667,-81.4639835
1367,/title/tt0172156/,Bad Boys II,"El Eden Motel - 115 SW 8th St, Miami, Florida, USA",(Zoe Pounder car chase; exterior.)                        ,,,
1368,/title/tt0172156/,Bad Boys II,"Federal Prison Gun Range, 15801 SW 137th Ave, Miami, Florida, USA",(Firearms Training location for the Actors)                        ,,,
1369,/title/tt0172156/,Bad Boys II,"570 Northeast 81st Street - Miami, Florida, USA",(Miami Bank: End of car chase where the dead bodies fall out of the trucks)                        ,"570, Northeast 81st Street, Little Haiti, Little River, Miami, Miami-Dade County, Florida, 33138, United States of America",25.8488991,-80.1855904
1370,/title/tt0211443/,Jason X,"Toronto, Ontario, Canada",,"Toronto, Peel, Golden Horseshoe, Ontario, Canada",43.6534817,-79.3839347
1371,/title/tt0211443/,Jason X,Canada,,Canada,61.0666922,-107.9917071
1372,/title/tt0093507/,Masters of the Universe,"Whittier, California, USA",,"Whittier, Los Angeles County, California, United States of America",33.9708782,-118.0308396
1373,/title/tt0093507/,Masters of the Universe,"California, USA",,"California, United States of America",36.7014631,-118.7559974
1374,/title/tt0093507/,Masters of the Universe,"Vasquez Rocks Natural Area Park - 10700 W. Escondido Canyon Rd., Agua Dulce, California, USA",,,,
1375,/title/tt0093507/,Masters of the Universe,USA,,United States,39.7837304,-100.4458825
1376,Code,Show Name,Location,Scene,"Location, Tucker County, West Virginia, United States of America",39.2138905,-79.6371124
1377,/title/tt0214341/,Dragon Ball Z,"Los Angeles, California, USA",(Location)                        ,"Los Angeles, Los Angeles County, California, United States of America",34.0536909,-118.2427666
1378,/title/tt1091191/,Lone Survivor,"Albuquerque, New Mexico, USA",,"Albuquerque, Bernalillo County, New Mexico, United States of America",35.0841034,-106.6509851
1379,/title/tt1091191/,Lone Survivor,"I-25 Studios, Albuquerque, New Mexico, USA",(Sound Stages)                        ,"KOB-Channel 4, Broadcast Plaza Southwest, Barelas, Old Town, Albuquerque, Bernalillo County, New Mexico, 87102-3116, United States of America",35.0818995,-106.6659548
1380,/title/tt1091191/,Lone Survivor,Afghanistan,(location)                        ,افغانستان,33.7680065,66.2385139
1381,/title/tt0485301/,Torchwood,"Roald Dahl Plass, Cardiff, South Glamorgan, Wales, UK",,,,
1382,/title/tt0485301/,Torchwood,"Tredegar House, Newport, Wales, UK",,"Tredegar House, Jamaica Circle, Coedkernew, Newport, Gwent, Cymru / Wales, NP10, United Kingdom",51.561359,-3.0275888
1383,/title/tt0485301/,Torchwood,"BBC Wales, Cardiff, South Glamorgan, Wales, UK",(studio)                        ,,,
1384,/title/tt0485301/,Torchwood,"Los Angeles, California, USA",(Miracle Day)                        ,"Los Angeles, Los Angeles County, California, United States of America",34.0536909,-118.2427666
1385,/title/tt6663582/,The Spy Who Dumped Me,"Budapest, Hungary",(Stage / Interiors)                        ,"Budapest, Közép-Magyarország, 1011, Magyarország",47.4983815,19.0404707
1386,/title/tt6663582/,The Spy Who Dumped Me,"Vienna, Austria",(street scenes)                        ,"Wien, 1010, Österreich",48.2083537,16.3725042
1387,/title/tt6663582/,The Spy Who Dumped Me,"Amsterdam, Netherlands",(location)                        ,"Amsterdam, Noord-Holland, Nederland",52.3727598,4.8936041
1388,/title/tt6663582/,The Spy Who Dumped Me,"Atlanta, Georgia, USA",(reshoots)                        ,"Atlanta, Georgia, United States of America",33.7490987,-84.3901849
1389,/title/tt6663582/,The Spy Who Dumped Me,Austria,,Österreich,47.2000338,13.199959
1390,/title/tt6663582/,The Spy Who Dumped Me,Denmark,(location)                        ,Danmark,55.670249,10.3333283
1391,/title/tt6663582/,The Spy Who Dumped Me,"Kelenföld Vasútállomás, Budapest, Hungary",(Vienna Central Station [Wien Hauptbahnhof])                        ,"Kelenföld vasútállomás, Zelk Zoltán út, Saxlehner András park, Őrmező, XI. kerület, Budapest, Közép-Magyarország, 1112, Magyarország",47.4643522,19.0201131
1392,/title/tt6663582/,The Spy Who Dumped Me,Germany,,Deutschland,51.0834196,10.4234469
1393,/title/tt6663582/,The Spy Who Dumped Me,"Szabadság tér, Budapest, Hungary",(Sebastian and the girls drive out of the underground car park in Paris and also when minutes later they make a U-turn with the car)                        ,"Szabadság tér, Lipótváros, V. kerület, Közép-Magyarország, 1054, Magyarország",47.5037495,19.050543656230893
1394,/title/tt6663582/,The Spy Who Dumped Me,USA,,United States,39.7837304,-100.4458825
1395,/title/tt2294449/,22 Jump Street,"San Juan, Puerto Rico",,"San Juan, Puerto Rico, 00901, United States of America",18.465299,-66.116666
1396,/title/tt2294449/,22 Jump Street,"Lafreniere Park - 3000 Downs Blvd, Metairie, Louisiana, USA",(bike patrol scenes)                        ,,,
1397,/title/tt2294449/,22 Jump Street,"Milan Street Wharf - Port of New Orleans, New Orleans, Louisiana, USA",(opening sequence)                        ,,,
1398,/title/tt2294449/,22 Jump Street,"Historic St James AME Church - 222 N Roman St, New Orleans, Louisiana, USA",(old clandestine police HQ at 21 Jump St)                        ,,,
1399,/title/tt2294449/,22 Jump Street,"Tulane University - 6823 St. Charles Avenue, New Orleans, Louisiana, USA",(Metropolitan City State College campus)                        ,,,
1400,/title/tt2294449/,22 Jump Street,"Loyola University New Orleans - 6363 St Charles Ave, New Orleans, Louisiana, USA",(Metropolitan City State College campus)                        ,,,
1401,/title/tt2294449/,22 Jump Street,Sheraton Old San Juan,(Valet Area)                        ,"Sheraton Old San Juan, Calle Comercio, La Perla, San Juan Antiguo, San Juan, Puerto Rico, 00901, United States of America",18.464166,-66.11227486172284
1402,/title/tt5363918/,Disenchantment,"New York City, New York, USA",,"New York, United States of America",40.7127281,-74.0060152
1403,/title/tt0322259/,2 Fast 2 Furious,"Weston, Florida, USA",,"Weston, Broward County, Florida, United States of America",26.103632,-80.40310198173701
1404,/title/tt0322259/,2 Fast 2 Furious,"Universal Studios Florida, Universal Orlando Resort - 1000 Universal Studios Plaza, Orlando, Florida, USA",(studio)                        ,,,
1405,/title/tt0322259/,2 Fast 2 Furious,"Boca Raton, Florida, USA",,"Boca Raton, Palm Beach County, Florida, United States of America",26.3586885,-80.0830984
1406,/title/tt0322259/,2 Fast 2 Furious,"Versailles Restaurant - 3555 SW 8th Street, Miami, Florida, USA",,"Versailles Restaurant, 3555, Southwest 8th Street, Little Havana, Silver Court Trailer Park, Miami, Miami-Dade County, Florida, 33135, United States of America",25.7649886,-80.2527677
1407,/title/tt0322259/,2 Fast 2 Furious,"Seven Mile Bridge, Florida Keys, Florida, USA",,,,
1408,/title/tt0322259/,2 Fast 2 Furious,"Hollywood, Florida, USA",,"Hollywood, Broward County, Florida, United States of America",26.0112014,-80.1494901
1409,/title/tt0322259/,2 Fast 2 Furious,"Stage 4, Universal Studios - 100 Universal City Plaza, Universal City, California, USA",,,,
1410,/title/tt0322259/,2 Fast 2 Furious,"Miami, Florida, USA",,"Miami, Miami-Dade County, Florida, United States of America",25.7742658,-80.1936589
1411,/title/tt1197624/,Law Abiding Citizen,"Holmesburg Prison - 8215 Torresdale Avenue, Philadelphia, Pennsylvania, USA",,,,
1412,/title/tt1197624/,Law Abiding Citizen,"Philadelphia City Hall - 1450 John F. Kennedy Blvd., Philadelphia, Pennsylvania, USA",,,,
1413,/title/tt1197624/,Law Abiding Citizen,"Girard Point, Philadelphia, Pennsylvania, USA",,"Girard, 1200, North Front Street, Northern Liberties, Philadelphia, Philadelphia County, Pennsylvania, 19120, United States of America",39.968916,-75.1362338
1414,/title/tt0065511/,C.C. & Company,"Old Tucson - 201 S. Kinney Road, Tucson, Arizona, USA",,"Old Tucson, 201, Kinney Road, Tucson Estates, Pima County, Arizona, 85735, United States of America",32.2186224,-111.1300273
1415,/title/tt0065511/,C.C. & Company,"Sonoran Desert, Arizona, USA",,"Sonoran Desert, Bates Well Road, Pima County, Arizona, United States of America",32.2598642,-112.9262583
1416,/title/tt2719848/,Everest,"South Base Camp, Mount Everest, Nepal",,,,
1417,/title/tt2719848/,Everest,"Kathmandu, Nepal",,"Kathmandu, Kamaladi Marg, Kamalpokhari, Baghbazar, काठमाडौं, वाग्मती प्रदेश, 46600, Nepal",27.708317,85.3205817
1418,/title/tt2719848/,Everest,"Val Senales, Trentino-Alto Adige, Italy",,"Schnalstal, Trentino-Alto Adige/Südtirol, 39020, Italia",46.7162072,10.8590364
1419,/title/tt2719848/,Everest,"Pinewood Studios, Iver Heath, Buckinghamshire, England, UK",,"Pinewood Studios, Pinewood Green, Iver, Iver Heath, Buckinghamshire, South East, England, SL0 0QJ, United Kingdom",51.54831515,-0.5346765566753087
1420,/title/tt2719848/,Everest,"South Tyrol, Italy",,"Bolzano - Bozen, Trentino-Alto Adige/Südtirol, 39010, Italia",46.65594215,11.229637264169462
1421,/title/tt0118583/,Alien: Resurrection,"Ottawa, Ontario, Canada",,"Ottawa, Eastern Ontario, Ontario, K1P 1J1, Canada",45.421106,-75.690308
1422,/title/tt0118583/,Alien: Resurrection,"Winnipeg, Manitoba, Canada",,"Winnipeg, Winnipeg (city), Manitoba, Canada",49.8955367,-97.1384584
1423,/title/tt0118583/,Alien: Resurrection,USA,,United States,39.7837304,-100.4458825
1424,/title/tt0118583/,Alien: Resurrection,"Stage 15, 20th Century Fox Studios - 10201 Pico Blvd., Century City, Los Angeles, California, USA",(studio)                        ,,,
1425,/title/tt3717490/,Power Rangers,"Kamloops, British Columbia, Canada",(location)                        ,"Kamloops, Thompson-Nicola Regional District, British Columbia, Canada",50.6758269,-120.3394159
1426,/title/tt3717490/,Power Rangers,"Steveston, Richmond, British Columbia, Canada",,"Steveston, Richmond, Metro Vancouver Regional District, British Columbia, Canada",49.1280561,-123.177415512419
1427,/title/tt3717490/,Power Rangers,"Templeton Secondary School, Vancouver, British Columbia, Canada",,"Templeton Secondary School, 727, Templeton Drive, Grandview-Woodland, Vancouver, Metro Vancouver Regional District, British Columbia, V5L 4N8, Canada",49.278221450000004,-123.06124945393216
1428,/title/tt5541338/,Six,"Wilmington, North Carolina, USA",,"Wilmington, New Hanover County, North Carolina, United States of America",34.2257282,-77.9447107
1429,/title/tt5541338/,Six,"Vancouver, British Columbia, Canada",(Season 2)                        ,"Vancouver, Metro Vancouver Regional District, British Columbia, Canada",49.2608724,-123.1139529
1430,/title/tt1590193/,The Commuter,"Sacramento, California, USA",,"Sacramento, Sacramento County, California, United States of America",38.5815719,-121.4943996
1431,/title/tt1590193/,The Commuter,"Pinewood Studios, Iver Heath, Buckinghamshire, England, UK",,"Pinewood Studios, Pinewood Green, Iver, Iver Heath, Buckinghamshire, South East, England, SL0 0QJ, United Kingdom",51.54831515,-0.5346765566753087
1432,/title/tt0242653/,The Matrix Revolutions,"Martin Place, Sydney, New South Wales, Australia",,"Martin Place, Sydney, Council of the City of Sydney, New South Wales, 2000, Australia",-33.8678177,151.210759
1433,/title/tt0242653/,The Matrix Revolutions,"Sydney Central Business District, Sydney, New South Wales, Australia",,,,
1434,/title/tt0242653/,The Matrix Revolutions,"Royal Botanic Gardens, Sydney, New South Wales, Australia",(Oracle/Architect meeting)                        ,"Royal Botanic Garden, Bridge Street, Sydney, Council of the City of Sydney, New South Wales, 2000, Australia",-33.86274455,151.21564205661
1435,/title/tt0242653/,The Matrix Revolutions,"Oakland, California, USA",,"Oakland, Alameda County, California, United States of America",37.8044557,-122.2713563
1436,/title/tt0242653/,The Matrix Revolutions,"Alameda, California, USA",,"Alameda County, California, United States of America",37.6090291,-121.899142
1437,/title/tt0317740/,The Italian Job,"Canazei, Trento, Trentino - Alto Adige, Italy",,"Canazei, Comun General de Fascia, Provincia di Trento, Trentino-Alto Adige/Südtirol, 38032, Italia",46.4768809,11.7710748
1438,/title/tt0317740/,The Italian Job,"Campo San Barnaba, Venice, Veneto, Italy",,"Campo San Barnaba, Dorsoduro, Venezia-Murano-Burano, Venezia, Veneto, Italia",45.4330364,12.32498836685835
1439,/title/tt0317740/,The Italian Job,"Hollywood Boulevard & Vine Street, Hollywood, Los Angeles, California, USA",,,,
1440,/title/tt0317740/,The Italian Job,"Philadelphia, Pennsylvania, USA",,"Philadelphia, Philadelphia County, Pennsylvania, United States of America",39.9527237,-75.1635262
1441,/title/tt0317740/,The Italian Job,"Metro Station, Hollywood & Highland Center, Hollywood, Los Angeles, California, USA",,,,
1442,/title/tt0317740/,The Italian Job,"Genoa, Liguria, Italy",,"Genova, Liguria, Italia",44.40726,8.9338624
1443,/title/tt0317740/,The Italian Job,"Los Angeles River, California, USA",(Test-driving the Minis)                        ,"Los Angeles River, Los Angeles, Los Angeles County, California, 91303-2211, United States of America",34.1952667,-118.5886446
1444,/title/tt0317740/,The Italian Job,"Sepulveda Dam, Encino, Los Angeles, California, USA",(Test-driving the Minis and later car chase sequence)                        ,,,
1445,/title/tt0317740/,The Italian Job,"Franklin Avenue & Vine Street, Hollywood, Los Angeles, California, USA",,,,
1446,/title/tt0317740/,The Italian Job,"Hollywood Sign, Hollywood Hills, Los Angeles, California, USA",,"Hollywood Sign, Mount Lee Drive, Hollywood Hills, Los Angeles, Los Angeles County, California, 90068, United States of America",34.1340991,-118.3216523
1447,/title/tt0317740/,The Italian Job,"West Hollywood, California, USA",(Sunset Tower overlooking the Sunset Strip)                        ,"West Hollywood, Los Angeles County, California, United States of America",34.0923014,-118.3692894
1448,/title/tt0317740/,The Italian Job,"Lago Fedaia, Trentino, Italy",(lake scene)                        ,"Lago Fedaia, E618, Canazei, Comun General de Fascia, Provincia di Trento, Trentino-Alto Adige/Südtirol, 32023, Italia",46.4586394,11.8633339
1449,/title/tt0317740/,The Italian Job,"Passo Sella, Trentino, Italy",(mountaintop scene)                        ,"Passo Sella - Jëuf de Sela - Sellajoch, SS242, Canazei, Comun General de Fascia, Provincia di Trento, Trentino-Alto Adige/Südtirol, 38032, Italia",46.5080187,11.7674125
1450,/title/tt0317740/,The Italian Job,"7th St/Metro Center Station, Downtown, Los Angeles, California, USA",(some interior shots as Hollywood & Highland Metro station)                        ,"7th Street/Metro Center, West 7th Street, Financial District, Downtown, Los Angeles, Los Angeles County, California, 90017, United States of America",34.0486587,-118.258743
1451,/title/tt0317740/,The Italian Job,"Everett St, Los Angeles, California, USA",(Car chase sequence; cars clear dam and head toward downtown)                        ,"Everett Street, Echo Park, Los Angeles, Los Angeles County, California, 90026, United States of America",34.0702538,-118.2489734
