,Code,Show Name,Location,Scene,geocodedLocation,latitude,longitude
414,/title/tt0089393/,Just One of the Guys,"Arcadia, Phoenix, Arizona, USA",,"Arcadia, Camelback East, Phoenix, Maricopa County, Arizona, United States of America",33.4995258,-111.95811929829402
415,/title/tt0089393/,Just One of the Guys,"Sony Pictures Studios - 10202 W. Washington Blvd., Culver City, California, USA",(Final scene on city street)                        ,,,
416,/title/tt0089393/,Just One of the Guys,USA,,United States,39.7837304,-100.4458825
417,/title/tt0375355/,Joey,"Warner Brothers Burbank Studios - 4000 Warner Boulevard, Burbank, California, USA",(studio)                        ,,,
418,/title/tt2077886/,The Phantom of the Opera at the Royal Albert Hall,"Royal Albert Hall, South Kensington, London, England, UK",(performance venue)                        ,"Royal Albert Hall, 4, Kensington Gore, Knightsbridge, City of Westminster, London, Greater London, England, SW7 2AP, United Kingdom",51.501004449999996,-0.17739457896545874
419,/title/tt6043142/,Skin,"Kingston, New York, USA",,"Kingston, Ulster County, New York, 12401, United States of America",41.9287812,-74.0023702
420,/title/tt6043142/,Skin,USA,,United States,39.7837304,-100.4458825
421,/title/tt2726560/,The Longest Ride,"Winston-Salem, North Carolina, USA",(Bull Riding Arena)                        ,"Winston-Salem, Forsyth County, North Carolina, United States of America",36.0998131,-80.2440518
422,/title/tt2726560/,The Longest Ride,"Jacksonville, North Carolina, USA",(Bull Riding Arena)                        ,"Jacksonville, Onslow County, North Carolina, United States of America",34.7494749,-77.4208221
423,/title/tt2726560/,The Longest Ride,"Wallace, North Carolina, USA",(Soda Shop)                        ,"Wallace, Duplin County, North Carolina, United States of America",34.735724,-77.9952628
424,/title/tt6908274/,Durante la tormenta,"Gran Canaria, Canary Islands, Spain",,"Gran Canaria, Tejeda, Las Palmas, Canarias, España",27.9580004,-15.6062305376665
425,/title/tt6908274/,Durante la tormenta,"L'Ametlla del Vallés, Barcelona",,"Carretera de Barcelona, Can Camp, Can Noble, l'Ametlla del Vallès, Vallès Oriental, Catalunya, 08480, España",41.6618892,2.2665778
426,/title/tt0118789/,Buffalo '66,"Buffalo, New York, USA",,"Buffalo, Erie County, New York, United States of America",42.8867166,-78.8783922
427,/title/tt0118789/,Buffalo '66,"Woodlawn, New York, USA",(Scott Wood's stripper bar scenes)                        ,"Woodlawn, Bronx River Greenway, The Bronx, Bronx County, New York, 10470, United States of America",40.8957527,-73.8624521
428,/title/tt0272338/,Punch-Drunk Love,"Le Petit Chateau - 4615 Lankershim Blvd, North Hollywood, Los Angeles, California, USA",(Restaurant Barry and Lena are kicked out of when Barry destroys the bathroom)                        ,,,
429,/title/tt0272338/,Punch-Drunk Love,"10101 Canoga Avenue, Chatsworth, Los Angeles, California, USA",(Barry's office)                        ,"10101, Canoga Avenue, Chatsworth, Los Angeles, Los Angeles County, California, 91311, United States of America",34.253724,-118.597409
430,/title/tt0272338/,Punch-Drunk Love,"Los Angeles, California, USA",,"Los Angeles, Los Angeles County, California, United States of America",34.0536909,-118.2427666
431,/title/tt0272338/,Punch-Drunk Love,"390 W. Foothill Boulevard, La Verne, California, USA",(Furniture & Mattress)                        ,"390, West Foothill Boulevard, La Verne, Los Angeles County, California, 91767, United States of America",34.109044236753434,-117.7524877102603
432,/title/tt0272338/,Punch-Drunk Love,"Oahu, Hawaii, USA",,"Oʻahu, Mililani, Honolulu County, Hawaii, United States of America",21.48349555,-158.03640389298
433,/title/tt0272338/,Punch-Drunk Love,"Hawaii, USA",,"Hawaii, United States of America",19.58726775,-155.42688965312746
434,/title/tt0272338/,Punch-Drunk Love,"99 Cents Only Stores - 19836 Ventura Boulevard, Woodland Hills, Los Angeles, California, USA",(Barry's workplace)                        ,,,
435,/title/tt0272338/,Punch-Drunk Love,"19762 Ventura Boulevard, Woodland Hills, Los Angeles, California, USA",(Barry runs down the boulevard passing this address.)                        ,"Ventura Boulevard, Woodland Hills, Los Angeles, Los Angeles County, California, 91365, United States of America",34.1669601,-118.5929066
436,/title/tt0272338/,Punch-Drunk Love,"Hollywood, Los Angeles, California, USA",,"Hollywood, Los Angeles, Los Angeles County, California, 90028-8127, United States of America",34.0980031,-118.329523
437,/title/tt0272338/,Punch-Drunk Love,"Chatsworth, Los Angeles, California, USA",,"Chatsworth, Los Angeles, Los Angeles County, California, United States of America",34.2595715,-118.6023247
438,/title/tt0272338/,Punch-Drunk Love,"Kahala Mandarin Oriental Hotel - 5000 Kabala Avenue, Honolulu, O'ahu, Hawaii, USA",,,,
439,/title/tt1086772/,Blended,South Africa,(Family Vacation Spot)                        ,South Africa,-28.8166236,24.991639
440,/title/tt1086772/,Blended,"Buford, Georgia, USA",(Historic Downtown Buford)                        ,"Buford, Gwinnett County, Georgia, United States of America",34.1206564,-84.0043513
441,/title/tt1086772/,Blended,"Buford, Georgia, USA",(Lake Lanier Islands Legacy Resort)                        ,"Buford, Gwinnett County, Georgia, United States of America",34.1206564,-84.0043513
442,/title/tt1086772/,Blended,"6262 Chestnut Hill Road, Flowery Branch, Georgia, USA",(Little League baseball field)                        ,"6262, Chestnut Hill Road, Flowery Branch, Hall County, Georgia, 30542, United States of America",34.171798,-83.95711220408164
443,/title/tt3172532/,The Diary of a Teenage Girl,"San Francisco, California, USA",,"San Francisco, San Francisco City and County, California, United States of America",37.7790262,-122.4199061
444,/title/tt3172532/,The Diary of a Teenage Girl,"Oakland, California, USA",(some bar scenes)                        ,"Oakland, Alameda County, California, United States of America",37.8044557,-122.2713563
445,/title/tt0129290/,Patch Adams,"Asheville, North Carolina, USA",,"Asheville, Buncombe County, North Carolina, United States of America",35.6009498,-82.5540161
446,/title/tt0129290/,Patch Adams,"University of North Carolina, Chapel Hill, North Carolina, USA","(Campus exteriors, interior library scene)                        ","University of North Carolina, Purefoy Road, High Park, Chapel Hill, Orange County, North Carolina, 27514, United States of America",35.90503535,-79.04775326525107
447,/title/tt0129290/,Patch Adams,"Berkeley, California, USA",,"Berkeley, Alameda County, California, United States of America",37.8708393,-122.2728639
448,/title/tt0129290/,Patch Adams,"Mare Island, Vallejo, California, USA",(studio)                        ,"Mare Island, Vallejo, Solano County, California, 94592, United States of America",38.0954755,-122.2724704
449,/title/tt0129290/,Patch Adams,"San Francisco, California, USA",,"San Francisco, San Francisco City and County, California, United States of America",37.7790262,-122.4199061
450,/title/tt0129290/,Patch Adams,"Piedmont, California, USA",,"Piedmont, Alameda County, California, 94611, United States of America",37.8243715,-122.231635
451,/title/tt1068680/,Yes Man,"Memorial Stadium - 10th Street and Stadium Drive, University of Nebraska, Lincoln, Nebraska, USA",(b-roll)                        ,,,
452,/title/tt1068680/,Yes Man,"Hollywood Bowl - 2301 N. Highland Avenue, Hollywood, Los Angeles, California, USA",,,,
453,/title/tt1068680/,Yes Man,"5928 York Blvd, Los Angeles, California, USA",,"York Boulevard, Highland Park, Los Angeles, Los Angeles County, California, 90042, United States of America",34.1178621,-118.1879809
454,/title/tt1068680/,Yes Man,"Koreatown, Los Angeles, California, USA",(jumper scene/ stephanie's apartment)                        ,"Koreatown, Wilshire Boulevard, Koreatown, Los Angeles, Los Angeles County, California, 90005, United States of America",34.0617936,-118.3054475
455,/title/tt1068680/,Yes Man,"Pasadena, California, USA",,"Pasadena, Los Angeles County, California, United States of America",34.1476452,-118.1444779
456,/title/tt6108178/,Disobedience,"Golders Green, London, England, UK",,"Golders Green, London Borough of Barnet, London, Greater London, England, NW11 7NX, United Kingdom",51.5718315,-0.1955219
457,/title/tt6108178/,Disobedience,"Hampstead Garden Suburb, London, England, UK",(Home)                        ,"Hampstead Garden Suburb, London Borough of Barnet, London, Greater London, England, NW11 6QG, United Kingdom",51.5805081,-0.1806164
458,/title/tt6108178/,Disobedience,"England, UK",,"England, United Kingdom",52.7954791,-0.5402402866174321
459,/title/tt0381681/,Before Sunset,"Seine River, Paris, France",,"Seine, Quartier des Quinze-Vingts, Paris, Île-de-France, France métropolitaine, 75012, France",48.850761,2.3692388821039394
460,/title/tt0381681/,Before Sunset,"Rue Saint Julien le Pauvre, Paris 5, Paris, France",,"Rue Saint-Julien Le Pauvre, Quartier de la Sorbonne, Paris, Île-de-France, France métropolitaine, 75005, France",48.8525857,2.3475273
461,/title/tt0381681/,Before Sunset,"Promenade Plantée, Paris 12, Paris, France",(park)                        ,"Promenade Plantée, Quartier du Bel-Air, Paris, Île-de-France, France métropolitaine, 75012, France",48.8401561,2.4054658
462,/title/tt0381681/,Before Sunset,"Quai de la Tournelle, Paris 5, Paris, France",(where Céline and Jesse take the bateau mouche)                        ,"Quai de la Tournelle, Quartier Saint-Victor, Paris, Île-de-France, France métropolitaine, 75005, France",48.8494363,2.3566693
463,/title/tt0381681/,Before Sunset,"Cour de l'Étoile-d'Or, 75 rue du Faubourg-Saint-Antoine, Paris 11, Paris, France",(Céline's apartment)                        ,,,
464,/title/tt0381681/,Before Sunset,France,,France,46.603354,1.8883335
465,/title/tt2823054/,Mike and Dave Need Wedding Dates,"Honolulu, Hawaii, USA",,"Honolulu, Honolulu County, Hawaii, United States of America",21.304547,-157.8556764
466,/title/tt2823054/,Mike and Dave Need Wedding Dates,"Hawaii, USA",,"Hawaii, United States of America",19.58726775,-155.42688965312746
467,/title/tt2823054/,Mike and Dave Need Wedding Dates,"Turtle Bay Resort - 57-091 Kamehameha Highway Kahuku, Hawaii, USA",,,,
468,/title/tt2823054/,Mike and Dave Need Wedding Dates,"North Shore, Oahu, Hawaii, USA",,,,
469,/title/tt2823054/,Mike and Dave Need Wedding Dates,"North Shore, O'ahu, Hawaii, USA",,,,
470,/title/tt2823054/,Mike and Dave Need Wedding Dates,"Kahuku, O'ahu, Hawaii, USA",,,,
471,/title/tt2823054/,Mike and Dave Need Wedding Dates,"Kamehameha Highway, O'ahu, Hawaii, USA",,,,
472,/title/tt2823054/,Mike and Dave Need Wedding Dates,"Waimea Bay, North Shore, O'ahu, Hawaii, USA",,,,
473,/title/tt2823054/,Mike and Dave Need Wedding Dates,"Lä'ie, O'ahu, Hawaii, USA",,,,
474,/title/tt2823054/,Mike and Dave Need Wedding Dates,USA,,United States,39.7837304,-100.4458825
475,Code,Show Name,Location,Scene,"Location, Tucker County, West Virginia, United States of America",39.2138905,-79.6371124
476,/title/tt1598822/,New Year's Eve,"Brooklyn Bridge, New York City, New York, USA",(second unit aerial shot)                        ,"Brooklyn Bridge, Dover Street, Financial District, Manhattan Community Board 1, Manhattan, New York County, New York, 10038, United States of America",40.70569125,-73.9963578678543
477,/title/tt1598822/,New Year's Eve,"Statue of Liberty, Liberty Island, New York Harbor, New York City, New York, USA",(second unit aerial shot)                        ,,,
478,/title/tt1598822/,New Year's Eve,"Radio City Music Hall - 1260 6th Avenue, Rockefeller Center, Manhattan, New York City, New York, USA",(Rockettes scene)                        ,,,
479,/title/tt1598822/,New Year's Eve,"Brooklyn Museum - 200 Eastern Parkway, Brooklyn, New York City, New York, USA",(second unit exterior)                        ,"Brooklyn Museum, 200, Eastern Parkway, Prospect Heights, Brooklyn, Kings County, New York, 11238, United States of America",40.6709108,-73.96331573047141
480,/title/tt0171804/,Boys Don't Cry,"Greenville, Texas, USA",(Courthouse scene)                        ,"Greenville, Hunt County, Texas, United States of America",33.1384488,-96.1108066
481,/title/tt0171804/,Boys Don't Cry,"Texas, USA",,"Texas, United States of America",31.8160381,-99.5120986
482,/title/tt0171804/,Boys Don't Cry,"Austin, Texas, USA",,"Austin, Travis County, Texas, United States of America",30.2711286,-97.7436995
483,/title/tt0171804/,Boys Don't Cry,USA,,United States,39.7837304,-100.4458825
484,/title/tt0322330/,Freaky Friday,"Dorris Place Elementary School - 2225 Dorris Place, Los Angeles, California, USA",,,,
485,/title/tt0322330/,Freaky Friday,"Argyle Hotel - 8358 Sunset Blvd., West Hollywood, California, USA",,,,
486,/title/tt0322330/,Freaky Friday,"Palisades High School - 15777 Bowdoin Street, Pacific Palisades, Los Angeles, California, USA",,,,
487,/title/tt0322330/,Freaky Friday,"Pacific Palisades, Los Angeles, California, USA",,"Pacific Palisades, Los Angeles, Los Angeles County, California, United States of America",34.0480643,-118.5264706
488,/title/tt2729716/,The Haves and the Have Nots,"Douglas County, Georgia, USA",,"Douglas County, Georgia, United States of America",33.6995565,-84.7622973
489,/title/tt0467200/,The Other Boleyn Girl,"Ely Cathedral, Chapter House, The College, Ely, Cambridgeshire, England, UK",,,,
490,/title/tt0467200/,The Other Boleyn Girl,"Windsor, Berkshire, England, UK",(location)                        ,"Windsor, Windsor and Maidenhead, South East, England, SL4 1SY, United Kingdom",51.4814958,-0.6133183
491,/title/tt0467200/,The Other Boleyn Girl,"Knole, Sevenoaks, Kent, England, UK",(exteriors: Whitehall Palace)                        ,"Knole House, Stable Court, Sevenoaks, Kent, South East, England, TN15 0RP, United Kingdom",51.26636565,0.20537192372775886
492,/title/tt0467200/,The Other Boleyn Girl,"Manor House, Great Chalfield, Wiltshire, England, UK",,"Great Chalfield Manor, Nibbs Terrace, Holt, Wiltshire, South West England, England, BA14 6BW, United Kingdom",51.36733045,-2.2024535398550356
493,/title/tt0467200/,The Other Boleyn Girl,"Dover Castle, Dover, Kent, England, UK",(Tower of London)                        ,"Dover Castle, Upper Road, Guston, Dover, Kent, South East, England, CT16 1HW, United Kingdom",51.1289759,1.3228764412873386
494,/title/tt0467200/,The Other Boleyn Girl,"Bude, Cornwall, England, UK",,"Bude, Cornwall, South West England, England, EX23 8, United Kingdom",50.8285252,-4.5469361
495,/title/tt0467200/,The Other Boleyn Girl,"Kent, England, UK",,"Kent, Egerton, Ashford, Kent, South East, England, United Kingdom",51.20707485,0.7210361813401444
496,/title/tt0467200/,The Other Boleyn Girl,"Bolebroke Castle, Hartfield, East Sussex, England, UK",,,,
497,/title/tt0163978/,The Beach,"Phi Phi Leh Island, Thailand",(secluded beach)                        ,,,
498,/title/tt0163978/,The Beach,"Thanon Khao San, Talad Yot, Phra Nakhon, Bangkok, Thailand",(Bangkok street scenes)                        ,,,
499,/title/tt0163978/,The Beach,"Krabi, Thailand",,"กระบี่, จังหวัดกระบี่, KRABI 81000, ประเทศไทย",8.0610907,98.9161607
500,/title/tt0163978/,The Beach,"London, England, UK",,"London, Greater London, England, United Kingdom",51.5073219,-0.1276474
501,/title/tt0163978/,The Beach,UK,,United Kingdom,54.7023545,-3.2765753
502,/title/tt0397535/,Memoirs of a Geisha,"California State Railroad Museum - 111 I Street, Sacramento, California, USA",(interiors: railroad station)                        ,"California State Railroad Museum, 125, I Street, Sacramento, Sacramento County, California, 95814, United States of America",38.58497285,-121.50430271143694
503,/title/tt0397535/,Memoirs of a Geisha,"Hakone Gardens - 21000 Big Basin Way, Saratoga, California, USA",,,,
504,/title/tt0397535/,Memoirs of a Geisha,"Kiyomizu Temple, Kyoto, Japan",,"清水寺, 音羽道, 今熊野南日吉町, 清閑寺下山町, 東山区, 京都府, 605-0826, 日本 (Japan)",34.994303,135.7844388864188
505,/title/tt0397535/,Memoirs of a Geisha,"The Huntington Library, Art Collections, and Botanical Gardens - 1151 Oxford Rd, San Marino, California, USA",,,,
506,/title/tt0397535/,Memoirs of a Geisha,"Yamashiro Restaurant - 1999 N. Sycamore Avenue, Hollywood, Los Angeles, California, USA",(Kyoto teahouse and geisha school)                        ,,,
507,/title/tt0397535/,Memoirs of a Geisha,"Kyoto, Japan",,"京都市, 京都府, 日本 (Japan)",35.021041,135.7556075
508,/title/tt0397535/,Memoirs of a Geisha,"Sacramento, California, USA",,"Sacramento, Sacramento County, California, United States of America",38.5815719,-121.4943996
509,/title/tt0397535/,Memoirs of a Geisha,"American River, Sacramento, California, USA",(Pilot Hill Section)                        ,"American River, Rancho Cordova, Sacramento County, California, 95819-6055, United States of America",38.6051945,-121.3128946
510,/title/tt0397535/,Memoirs of a Geisha,"Los Angeles, California, USA",,"Los Angeles, Los Angeles County, California, United States of America",34.0536909,-118.2427666
511,/title/tt0397535/,Memoirs of a Geisha,"Presidio, Golden Gate National Recreation Area, San Francisco, California, USA",,,,
512,/title/tt0397535/,Memoirs of a Geisha,"Thousand Oaks, California, USA",(Kyoto Gion district set)                        ,"Thousand Oaks, Ventura County, California, United States of America",34.17142715,-118.91058772974445
513,/title/tt9642982/,Belgravia,"Syon House, Syon Park, Brentford, Middlesex, England, UK",(Lady Maria Grey's Templemore House - interiors)                        ,,,
514,/title/tt9642982/,Belgravia,"Wrotham Park, Barnet, Hertfordshire, England, UK","(Lady Brockenhurst's country estate, Lymington Park)                        ","Wrotham Park, Hertsmere, Hertfordshire, East of England, England, EN5 4RY, United Kingdom",51.6775134,-0.1957087
515,/title/tt9642982/,Belgravia,"Brocket Hall, Lemsford, Welwyn Garden City, Hertfordshire, England, UK",,"Brocket Hall, Ayot Green, Ayot St Peter, Welwyn Hatfield, Hertfordshire, East of England, England, AL6 9BA, United Kingdom",51.80276485,-0.24050912270270453
516,/title/tt9642982/,Belgravia,"Hampton Court Palace, East Molesey, Surrey, England, UK","(Hyde Park, Green Park and Kensington Gardens)                        ",,,
517,/title/tt0852713/,The House Bunny,"University of Southern California, Los Angeles, California, USA",,"University of Southern California, Flower Street, University Park, Los Angeles, Los Angeles County, California, 90089-0871, United States of America",34.0218833,-118.28586726915088
518,/title/tt0852713/,The House Bunny,"Playboy Mansion - 10236 Charing Cross Road, Holmby Hills, Los Angeles, California, USA",,,,
519,/title/tt0852713/,The House Bunny,"Farmers Market - 6333 W. 3rd Street, Fairfax, Los Angeles, California, USA",,,,
520,/title/tt0852713/,The House Bunny,"Holmby Hills, Los Angeles, California, USA",,,,
521,/title/tt0852713/,The House Bunny,"Sun Valley, California, USA",,"Sun Valley, Los Angeles, Los Angeles County, California, 91352, United States of America",34.2175042,-118.3703576
522,/title/tt0852713/,The House Bunny,USA,,United States,39.7837304,-100.4458825
523,/title/tt3165612/,Sleeping with Other People,"New York City, New York, USA",,"New York, United States of America",40.7127281,-74.0060152
524,/title/tt3165612/,Sleeping with Other People,"New York, USA",,"New York, United States of America",40.7127281,-74.0060152
525,/title/tt1950235/,Let It Snow,"Brantford, Ontario, Canada",,"Brantford, Southwestern Ontario, Ontario, N3T 2M3, Canada",43.1408157,-80.2631733
526,/title/tt1950235/,Let It Snow,"Toronto, Ontario, Canada",,"Toronto, Peel, Golden Horseshoe, Ontario, Canada",43.6534817,-79.3839347
527,/title/tt1950235/,Let It Snow,"Pinewood Toronto Studios, Port Lands, Toronto, Ontario, Canada",(studio)                        ,"Pinewood Toronto Studios, Munition Street, Toronto—Danforth, Old Toronto, Toronto, Peel, Golden Horseshoe, Ontario, M4M 3P2, Canada",43.6465663,-79.35106457413957
528,/title/tt1848220/,Muhtesem Yüzyil,"Topkapi Palace, Istanbul, Turkey",,"Topkapı Sarayı, Valide Taşlığı, Cankurtaran, Cankurtaran Mahallesi, Fatih, İstanbul, Marmara Bölgesi, 34122, Türkiye",41.0129795,28.98406594221219
529,/title/tt5117876/,Descendants 2,"British Columbia, Canada",,"British Columbia, Canada",55.001251,-125.002441
530,/title/tt0817230/,Valentine's Day,"Pacific Ave & N Venice Blvd., Venice, Los Angeles, California, USA",,,,
531,/title/tt0817230/,Valentine's Day,"Marriott Hotel - 4100 Admiralty Way, Marina del Rey, California, USA",(Rooftop)                        ,"Marina del Rey Marriott, 4100, Admiralty Way, Marina del Rey, Los Angeles County, California, 90292, United States of America",33.9821995,-118.46018866262813
532,/title/tt0817230/,Valentine's Day,"Marina del Rey, California, USA",,"Marina del Rey, Los Angeles County, California, 90292, United States of America",33.9776848,-118.4486479
533,/title/tt0817230/,Valentine's Day,"University High School - 11800 Texas Avenue, West Los Angeles, Los Angeles, California, USA",,,,
534,/title/tt0817230/,Valentine's Day,"Los Angeles, California, USA",,"Los Angeles, Los Angeles County, California, United States of America",34.0536909,-118.2427666
535,/title/tt0817230/,Valentine's Day,"Beverly Hills, California, USA",,"Beverly Hills, Los Angeles County, California, United States of America",34.0696501,-118.3963062
536,/title/tt0817230/,Valentine's Day,"The Bistro Garden - 12950 Ventura Boulevard, Studio City, Los Angeles, California, USA",,,,
537,/title/tt3797868/,The Choice,"North Carolina, USA",,"North Carolina, United States of America",35.6729639,-79.0392919
538,/title/tt3797868/,The Choice,"Wrightsville Beach North Carolina, USA",(Dockside)                        ,"Wrightsville Beach, New Hanover County, North Carolina, United States of America",34.2079917,-77.7955907
539,/title/tt1412386/,The Best Exotic Marigold Hotel,"Jaipur, Rajasthan, India","(Railway Station, The Airport and a lot of sightseeing places. The hotel was located in Jaipur as described in the movie.)                        ","Jaipur, Jaipur Tehsil, Jaipur, Rajasthan, 302001, India",26.916194,75.820349
540,/title/tt1412386/,The Best Exotic Marigold Hotel,"Udaipur, Rajasthan, India",,"Udaipur, Rajasthan, 313001, India",24.578721,73.6862571
541,/title/tt1412386/,The Best Exotic Marigold Hotel,India,,India,22.3511148,78.6677428
542,/title/tt0084805/,Tootsie,"Hurley, New York, USA",,"Hurley, Town of Hurley, Ulster County, New York, United States of America",41.915060499999996,-74.06112642506818
543,/title/tt0084805/,Tootsie,"National Video Center - 460 W. 42nd Street, Manhattan, New York City, New York, USA",,,,
544,/title/tt0084805/,Tootsie,"New York City, New York, USA",,"New York, United States of America",40.7127281,-74.0060152
545,/title/tt5288312/,Skam,"Oslo, Norway",(main location)                        ,"Oslo, 0026, Norge",59.9133301,10.7389701
546,/title/tt5304992/,Set It Up,"New York City, New York, USA",,"New York, United States of America",40.7127281,-74.0060152
547,/title/tt0032943/,Tweestrijd der gevoelens,"Metro-Goldwyn-Mayer Studios - 10202 W. Washington Blvd., Culver City, California, USA",(studio)                        ,,,
548,/title/tt11316854/,Gabriel's Inferno,"Syracuse, New York, USA","(Syracuse, NY)                        ","Syracuse, Onondaga County, New York, United States of America",43.0481221,-76.1474244
549,/title/tt0098384/,Steel Magnolias,"Taylor House - 320 Jefferson, Natchitoches, Louisiana, USA",,,,
550,/title/tt0098384/,Steel Magnolias,"Louisiana, USA",,"Louisiana, United States of America",30.8703881,-92.007126
551,/title/tt0368975/,Sleepover,"Long Beach Polytechnic High School - 1600 Atlantic Avenue, Long Beach, California, USA",(School Hallways)                        ,,,
552,/title/tt0120889/,What Dreams May Come,"Angel Falls, Canaima National Park, Estado Bolívar, Venezuela",,,,
553,/title/tt0120889/,What Dreams May Come,"Blackfeet Indian Reservation, Montana, USA",,,,
554,/title/tt0120889/,What Dreams May Come,"San Francisco, California, USA",,"San Francisco, San Francisco City and County, California, United States of America",37.7790262,-122.4199061
555,/title/tt0120889/,What Dreams May Come,"St. Vincent's Church, San Rafael, California, USA",(church scenes)                        ,,,
556,/title/tt0120889/,What Dreams May Come,"Mare Island, Vallejo, California, USA",(stage)                        ,"Mare Island, Vallejo, Solano County, California, 94592, United States of America",38.0954755,-122.2724704
557,/title/tt0120889/,What Dreams May Come,"Filoli Estate - 86 Cañada Road, Woodside, California, USA",,"Filoli Estate, 86, Cañada Road, Highlands, San Mateo County, California, 94062, United States of America",37.469806250000005,-122.31060788438967
558,/title/tt0120889/,What Dreams May Come,"Oakland, California, USA",(Church scenes)                        ,"Oakland, Alameda County, California, United States of America",37.8044557,-122.2713563
559,/title/tt5247022/,Paterson,"Paterson, New Jersey, USA",(downtown: bus route)                        ,"Paterson, Passaic County, New Jersey, United States of America",40.9167654,-74.171811
560,/title/tt5247022/,Paterson,"Great Falls Historic District, Paterson, New Jersey, USA",(waterfall)                        ,,,
561,/title/tt5247022/,Paterson,"South Broadway, Yonkers, New York, USA",(bus breakdown)                        ,"South Broadway, Hicksville, Oyster Bay, Nassau County, New York, 11801, United States of America",40.7619177,-73.5169018
