,Code,Show Name,Location,Scene,geocodedLocation,latitude,longitude
529,/title/tt0098350/,,"Malham Rocks, Malham, North Yorkshire, England, UK",,,,
530,/title/tt0108909/,,"Mississauga, Ontario, Canada",,"Mississauga, Peel Region, Golden Horseshoe, Ontario, Canada",43.590338,-79.645729
531,/title/tt0061024/,,"Arapaho Falls, Indian Peaks Wilderness, Colorado, USA",,,,
532,/title/tt0061024/,,"Rocky Mountains, Colorado, USA",,"AEG Live Rocky Mountains, 930, West 7th Avenue, Santa Fe Arts District, Denver, Denver County, Colorado, 80204, United States of America",39.7271888,-104.9991566
533,/title/tt0334541/,,"Santa Clarita, California, USA",,"Santa Clarita, Los Angeles County, California, United States of America",34.3916641,-118.542586
534,/title/tt0334541/,,"Veluzat Motion Picture Ranch, Saugus, California, USA",,,,
535,/title/tt0125454/,,"California, USA",,"California, United States of America",36.7014631,-118.7559974
536,/title/tt0072516/,,"Reseda High School - 18230 Kittridge Avenue, Reseda, Los Angeles, California, USA",(as Larkspur High School),"Reseda High School, Kittridge Street, Reseda, Los Angeles, Los Angeles County, California, 91335, United States of America",34.188551849999996,-118.52951759109843
537,/title/tt0072516/,,"Ray-Art Studios - 6625 Variel Avenue, Canoga Park, Los Angeles, California, USA",(studio),,,
538,/title/tt1836195/,,"Hawaii, USA",,"Hawaii, United States of America",19.58726775,-155.42688965312746
