Code,Show Name,Location,Scene
/title/tt0041838/,"Bou-Saada, Algiers, Algeria",
/title/tt0041838/,"Alabama Hills, Lone Pine, California, USA",
/title/tt0041838/,"Paramount Studios - 5555 Melrose Avenue, Hollywood, Los Angeles, California, USA",(studio)
/title/tt0488988/,"Manhattan, New York City, New York, USA",
/title/tt0488988/,"Steiner Studios - 15 Washington Avenue, Brooklyn Navy Yard, Brooklyn, New York City, New York, USA",(The Dakota)
/title/tt7025976/,"Château de Vaux-le-Vicomte, Vaux-le-Vicomte, Seine-et-Marne, France",
/title/tt7025976/,"Cathédrale Saint-Maclou, Pontoise, Val-d'Oise, France",(The scene in the church)
/title/tt7628846/,"Ponferrada, León, Castilla y León, Spain",
/title/tt0056264/,"Cook's Bay, Moorea, French Polynesia",
/title/tt0056264/,"Matawaii Bay, Tahiti, French Polynesia",(arrival of the Bounty)
/title/tt0056264/,"Hawaii, USA",
/title/tt0056264/,"Metro-Goldwyn-Mayer Studios - 10202 W. Washington Blvd., Culver City, California, USA",(studio)
/title/tt0056264/,"Tahiti, French Polynesia",(including later retakes)
/title/tt0056264/,"Hal Roach Studios - 8822 Washington Blvd., Culver City, California, USA",(studio)
/title/tt0056264/,"Honolulu, O'ahu, Hawaii, USA",
/title/tt0056264/,"South Pacific, Pacific Ocean",
/title/tt0050613/,"Mount Fuji, Shizuoka, Japan",(Castle exterior)
/title/tt0050613/,"Tokyo-Eigan Studios, Tokyo, Japan",(studio)
/title/tt0050613/,"Tamagawa River, Tokyo, Japan",
/title/tt0765432/,"Stammheim Prison, Stuttgart, Baden-Württemberg, Germany",
/title/tt0765432/,"Berlin, Germany",
/title/tt0765432/,"Prague, Czech Republic",
/title/tt0765432/,"Rome, Lazio, Italy",
/title/tt1135989/,"Jordan River, Israel",(scene of the story of two monks)
/title/tt1135989/,"Kibbutz Beit Nir, Israel",(location)
/title/tt1135989/,Israel,(location)
/title/tt0319930/,"Hollywood, Los Angeles, California, USA",
/title/tt0319930/,"Universal Studios - 100 Universal City Plaza, Universal City, California, USA",
/title/tt0319930/,"Venice High School - 13000 Venice Boulevard, Venice, Los Angeles, California, USA",
/title/tt0319930/,"Washington Middle School - 1505 N Marengo Avenue, Pasadena, California, USA",
/title/tt0110963/,"Basilique de Saint-Quentin, Saint-Quentin, Aisne, France",(church)
/title/tt0110963/,"Château de Maulnes, Cruzy-le-Châtel, Yonne, France",
/title/tt0110963/,"Rambouillet, Yvelines, France",
/title/tt0427969/,"Los Angeles City Hall - 200 North Spring Street, Downtown, Los Angeles, California, USA",
/title/tt0427969/,"Newcastle, Ontario, Canada",
/title/tt0427969/,"Toronto, Ontario, Canada",
/title/tt0427969/,"635 South Mateo Street, Los Angeles, California, USA",(shop where Chester Sinclair's wife worked)
/title/tt0427969/,Canada,
/title/tt0427969/,"California, USA",
/title/tt0075560/,"Botallack Manor Farm, Botallack, St Just, Cornwall, England, UK","(Nampara, Season 1)"
/title/tt0075560/,"Port Isaac Harbour, Port Isaac, Cornwall, England, UK",(Season 1)
/title/tt0075560/,"Towednack Church, Towednack, St Ives, Cornwall, England, UK",(Francis Poldark and Elizabeth Chynoweth's wedding)
/title/tt0075560/,"Charlestown, Cornwall, England, UK",
/title/tt0075560/,"Godolphin House, Godolphin Cross, Cornwall, England, UK","(Trenwith, Season 1)"
/title/tt0075560/,"Levant Mine, Trewellard, St Just, Cornwall, England, UK",
/title/tt0075560/,"Mousehole, Cornwall, England, UK","(Miner rebellion, Season 1)"
/title/tt0075560/,"Porthluney Cove, Cornwall, England, UK","(Ross galloping across beach, Season 1)"
/title/tt0075560/,"Seal Hole Cave, St Agnes, Cornwall, England, UK",(Demelza's cave)
/title/tt0075560/,"Cudden Point, Mount's Bay, Cornwall, England, UK",
/title/tt0075560/,"Lamorna Cove, Lamorna, Cornwall, England, UK",(as Sawle village)
/title/tt0075560/,"Luxulyan, Cornwall, England, UK",
/title/tt0075560/,"Pendeen Manor Farm, Pendeen, Cornwall, England, UK",
/title/tt0075560/,"Port Quin, Cornwall, England, UK",
/title/tt0075560/,"Porthcurno, Cornwall, England, UK",
/title/tt0075560/,"Portloe, Cornwall, England, UK",
/title/tt0075560/,"River Fowey, Cornwall, England, UK",
/title/tt0075560/,"St. Enodoc Church, Rock, Cornwall, England, UK",(Rowella Chynoweth and Arthur Solway's wedding)
/title/tt0075560/,"The Keigwin Arms, Mousehole, Cornwall, England, UK",
/title/tt0075560/,"Trerice Manor, Newlyn, Cornwall, England, UK",
/title/tt1864750/,"Lisbon, Portugal",
/title/tt1864750/,"Guadalajara, Castilla-La Mancha, Spain",
/title/tt1864750/,"Algodor, Toledo, Castilla-La Mancha, Spain",
/title/tt3782838/,"MediaPro Studios, Bucharest, Romania",
/title/tt0051994/,"Pinewood Studios, Iver Heath, Buckinghamshire, England, UK","(studio) (made at) (as Pinewood Studios, London, England)"
/title/tt0051994/,"Ruislip Lido, Ruislip, Middlesex, England, UK",(scenes of survivors trying to get into lifeboats)
/title/tt0051994/,"Benington, Hertfordshire, England, UK",(Tom Farrell and his family set off for Queenstown to join the Titanic)
/title/tt6718730/,"London, England, UK",
/title/tt6718730/,"Chatham Historic Dockyard, Chatham, Kent, England, UK",(exterior scenes)
/title/tt6718730/,"Old Royal Naval College, Greenwich, London, England, UK",(exterior scenes)
/title/tt1566501/,"Durango, Mexico",
/title/tt1566501/,"Castillo de Chapultepec, Mexico City, Distrito Federal, Mexico",
/title/tt1566501/,"Mexico City, Distrito Federal, Mexico",
/title/tt2345112/,"Austin, Texas, USA",
/title/tt0095082/,"Indianapolis, Indiana, USA",
/title/tt0095082/,"Cincinnati, Ohio, USA",
/title/tt0095082/,"Louisville, Kentucky, USA",(Churchill Downs Railroad Station)
/title/tt0066549/,"Uzhhorod, Ukraine",(battlefield)
/title/tt0066549/,"Dino De Laurentiis Cinematografica Studios, Rome, Lazio, Italy",(interiors)
/title/tt0066549/,"Naples, Italy",(interior scenes)
/title/tt6958212/,"Lake Gairdner National Park, South Australia, Australia",
/title/tt6958212/,"Outback, South Australia, Australia",
/title/tt6958212/,"Mid Northern South Australia, South Australia, Australia",
/title/tt6958212/,"Ooraminna Station, Northern Territory, Australia",(western town: Henry)
/title/tt6958212/,"Simpson Desert, South Australia, Australia",
/title/tt6958212/,"Central Australia, Australia",
/title/tt6958212/,"Trephina Gorge Nature Park, Northern Territory, Australia",
/title/tt6958212/,"Outback, Australia",
/title/tt6958212/,"Hale, Northern Territory, Australia",(western town: Henry)
/title/tt6958212/,"Maryvale Road, Hale, Northern Territory, Australia",(western town: Henry)
/title/tt6958212/,"Outback, Northern Territory, Australia",
/title/tt0067372/,"Blaenau Ffestiniog, Gwynedd, Wales, UK",
/title/tt0067372/,"Haughterslaw near North Charlton, Northumberland, England, UK",(the walking forest scenes)
/title/tt0067372/,"Porthmadog, Gwynedd, Wales, UK",
/title/tt0067372/,"St Aidan's Church, Bamburgh, Northumberland, England, UK",
/title/tt0067372/,"Bamburgh Castle, Bamburgh, Northumberland, England, UK","(Cawdor Castle, Dunsinane)"
/title/tt0067372/,"Harlech Castle, Harlech, Gwynedd, Wales, UK",
/title/tt10964530/,"Mount Magnet, Western Australia, Australia",
/title/tt0455957/,"Salamanca, Salamanca, Castilla y León, Spain",
/title/tt0455957/,"Ocaña, Toledo, Castilla-La Mancha, Spain",(British soldiers exterior scene)
/title/tt0455957/,"Parque del Retiro, Madrid, Spain",
/title/tt0455957/,"Madrid, Spain",
/title/tt0455957/,"Royal Palace of Aranjuez, Aranjuez, Madrid, Spain",
/title/tt0455957/,"Talamanca de Jarama, Madrid, Spain",
/title/tt0455957/,"Parque Natural de la Cuenca Alta del Manzanares, Madrid, Spain",
/title/tt0455957/,"Alcalá de Henares, Madrid, Spain",
/title/tt5807292/,UK,
/title/tt0085328/,"Venice, Veneto, Italy","(Several monuments are seen, and several sequences take place in the typical canals and bridges system.)"
/title/tt5239494/,"Pinewood Studios, Iver Heath, Buckinghamshire, England, UK",(studio)
/title/tt0031507/,"Noel, Missouri, USA",
/title/tt0031507/,"Bagnall Dam, Lake of the Ozarks, Missouri, USA",
/title/tt0031507/,"Jamestown, California, USA",
/title/tt3182620/,Ukraine,
/title/tt3182620/,"L Stage, Pinewood Studios, Iver Heath, Buckinghamshire, England, UK",
/title/tt7473890/,"Dover Castle, Dover, Kent, England, UK",(as King Lear's Castle)
/title/tt7473890/,"Dover Castle, Dover, Kent, England, UK",(Location)
/title/tt8482584/,"Weatherford, Texas, USA",
/title/tt0063794/,"Dorogobuzh, Smolensk Province, Russia",(battle scenes)
/title/tt0063794/,"Joseph-Volokolamsk Monastery, Russia",(1812 Great fire of Moscow)
/title/tt0063794/,"Moscow province, Russia",(Napoleon's Army invading Russia)
/title/tt0063794/,"Tavrichesky Palace, St. Petersburg, Russia",(Natasha's first ball and appearance of the Tzar)
/title/tt0063794/,"The Kremlin, Moscow, Russia",(Napoleon's invasion of Moscow)
/title/tt0063794/,"Vorobyevy Hills, Moscow, Russia",
/title/tt0063794/,"Yasnaya Polyana, Russia",(Russian lansdcapes)
/title/tt0063794/,"Catherine Palace, Pushkin, Pushkinsky District, St. Petersburg, Russia",
/title/tt0063794/,"Ivankovo, Russia",(hunting scenes with wolves and borzoi dogs)
/title/tt0063794/,"Moscow, Russia",
/title/tt0063794/,"Moskva River, Russia",
/title/tt0063794/,"Mukachevo, Ukraine",(Battle of Schengrabitz)
/title/tt0063794/,"Neva River, St. Petersburg, Russia",(Prince Andrei Bolkonsky and Pierre Bezukhov discuss their friendship)
/title/tt0063794/,"Ostankino Palace, Moscow, Russia",
/title/tt0063794/,"Red Square, Kitai-gorod, Tverskoy District, Moscow, Russia",(fire/Napoleon's invasion)
/title/tt0063794/,"Smolensk, Russia",
/title/tt0063794/,"St. Isaacs Square, St. Petersburg, Russia",
/title/tt0063794/,"Summer Palace, St. Petersburg, Russia",
/title/tt0063794/,"Tarutino, Russia",(Kutuzov and the Russian Army HQ)
/title/tt0063794/,"Tula province, Russia",
/title/tt6324614/,"Vilnius, Vilnius County, Lithuania",
/title/tt9106672/,"Prague, Czech Republic",
/title/tt9106672/,"Munich, Bavaria, Germany",
/title/tt9106672/,Czech Republic,
/title/tt9106672/,Germany,
/title/tt0108858/,"Culverthorpe Hall, Grantham, Lincolnshire, England, UK",
/title/tt0108858/,"Rome, Lazio, Italy",
/title/tt0108858/,"Stamford, Lincolnshire, England, UK",(Middlemarch)
/title/tt0108858/,"2 King's Mill Lane, Stamford, UK",(The Green Dragon)
/title/tt0108858/,"Assembly Rooms, 22 St George's Square, Stamford, UK",(Bulstrode's Bank)
/title/tt0108858/,"Browne's Hospital, Broad Street, Stamford, UK",(The Old Infirmary)
/title/tt0108858/,"Grimsthorpe Castle, Grimsthorpe, UK",(Quallingham)
/title/tt0108858/,"9 High Street St Martin's, St Martins, Stamford, UK",(Mawmsey's the Grocers)
/title/tt0108858/,"St Mary's Street, Stamford, UK","(the Vincys' house, the Plymdales' house, Spooner the jeweller's, Turnbull's the estate agents)"
/title/tt0108858/,"Walcot Hall, Walcot Rd Barnack, Peterborough, Stamford PE9 3EU, UK",(Freshitt Hall and the stables became the coach yard of the White Hart Inn)
/title/tt0108858/,"Dorset, England, UK",
/title/tt1979319/,"Omihachiman, Shiga, Japan",
/title/tt1979319/,"Kyoto, Kyoto, Japan",
/title/tt1979319/,"Tottori, Tottori, Japan",
/title/tt1979319/,"Omiya, Saitama, Japan",
/title/tt1979319/,"Ibaraki, Osaka, Japan",
/title/tt0081059/,Italy,(locations)
/title/tt1742683/,"Washington, District of Columbia, USA",
/title/tt3675680/,Vatican City,
/title/tt3675680/,Italy,
/title/tt3674140/,"Aimorés, Minas Gerais, Brazil","(Salgado's hometown, Instituto Terra)"
/title/tt3674140/,"Pará, Brazil",(Zo'é tribe)
/title/tt3674140/,Brazil,
/title/tt3674140/,Indonesia,
/title/tt0112681/,Hungary,
/title/tt0112681/,"Nagymaros railway station, Pest county, Hungary",(arched train shelter scene)
/title/tt0112681/,"Pécel, Hungary",
/title/tt0252444/,"Nilpena Station, South Australia, Australia",
/title/tt0252444/,"Sydney, New South Wales, Australia",
/title/tt0252444/,"Western Australia, Australia",
/title/tt0252444/,"Gibson Desert, Western Australia, Australia",
/title/tt0252444/,"McLaren Vale, South Australia, Australia",
/title/tt0252444/,"Onkaparinga River National Park & Recreation Park, South Australia, Australia",(Moore River Native Settlement)
/title/tt0252444/,"South Australia, Australia",
/title/tt0252444/,"Outback, South Australia, Australia",
/title/tt0252444/,"Pilbara, Western Australia, Australia",
/title/tt0252444/,"Southern Vales, South Australia, Australia",(location: McLaren Vale)
/title/tt0252444/,"Jigalong, Western Australia, Australia",
/title/tt0252444/,"Meekatharra, Western Australia, Australia",
/title/tt0252444/,"Sydney, Australia",
/title/tt0252444/,"Belair, South Australia, Australia",(location: Belair National Park)
/title/tt0252444/,"Fleurieu Peninsula, South Australia, Australia",(location: Onkaparinga River National Park & Recreation Park)
/title/tt0252444/,"Far Northern South Australia, South Australia, Australia",
/title/tt0252444/,"North Adelaide, Adelaide, South Australia, Australia",(location: St Marks College)
/title/tt3026488/,"Barnim, Brandenburg, Germany",
/title/tt3026488/,Germany,
/title/tt4411618/,"Cowiche, Washington, USA",
/title/tt4411618/,"Los Angeles, California, USA",
/title/tt4411618/,"Bostwick, Georgia, USA",
/title/tt4411618/,"Gay, Georgia, USA",
/title/tt0049092/,"Hurricane, Utah, USA",
/title/tt0049092/,"Snow Canyon State Park - 1002 Snow Canyon Drive, Ivins, Utah, USA",
/title/tt0049092/,"St. George, Utah, USA",
/title/tt0049092/,"Universal Studios - 100 Universal City Plaza, Universal City, California, USA",(studio)
/title/tt6792282/,"Pamplona, Navarra, Spain",
/title/tt0052365/,"Fort La Latte, Côtes-d'Armor, France",
/title/tt0052365/,"Lim Fiord, Croatia",
/title/tt0052365/,"Bavaria Studios, Bavariafilmplatz 7, Geiselgasteig, Grünwald, Bavaria, Germany",
/title/tt1588337/,Morocco,(report from the Associated Press)
/title/tt11358398/,"Dulles International Airport, 1 Saarinen Circle, Dulles, Virginia, USA",(Secretary Kim arrives in Washington DC.)
/title/tt11358398/,"Washington, USA",
/title/tt0145503/,"Vienna, Austria",
/title/tt0145503/,"Berlin, Germany",
/title/tt0145503/,"Pergamon Museum, Mitte, Berlin, Germany",
/title/tt0145503/,France,
/title/tt0145503/,"Bokréta Street 15, Budapest, Hungary",(Sonnenschein family estate)
/title/tt0086904/,"West Wycombe Park, West Wycombe, Buckinghamshire, England, UK",
/title/tt0086904/,"Althorp House, Althorp, Northamptonshire, England, UK",(interiors)
/title/tt0086904/,"Brasenose College, Brasenose Lane, Oxford, Oxfordshire, England, UK",
/title/tt0086904/,"Oxford University, Oxford, Oxfordshire, England, UK",
/title/tt0086904/,"Stamford, Lincolnshire, England, UK",(Outside the Crown Hotel)
/title/tt0086904/,"Broad Street, Oxford, Oxfordshire, England, UK",
/title/tt0086904/,"England, UK",
/title/tt0108961/,"Burslem, Stoke-on-Trent, Staffordshire, England, UK",
/title/tt0108961/,"11 Tranmere Grove, Ipswich, Suffolk, England, UK",
/title/tt0108961/,"14 Chesterfield Drive, Ipswich, Suffolk, England, UK",
/title/tt0108961/,"18 Chesterfield Drive, Ipswich, Suffolk, England, UK",
/title/tt0108961/,"7 Tranmere Grove, Ipswich, Suffolk, England, UK",
/title/tt0108961/,"Ancaster, Lincolnshire, England, UK",
/title/tt0108961/,"Aston Eyre, Gloucestershire, England, UK",
/title/tt0108961/,"Basing House, Hampshire, England, UK",
/title/tt0108961/,"Bawsey, Norfolk, England, UK",
/title/tt0108961/,"Birdoswald, Cumbria, England, UK",
/title/tt0108961/,"Blaenavon, Torfaen, Gwent, Wales, UK",
/title/tt0108961/,"Boleigh, Cornwall, England, UK",
/title/tt0108961/,"Bursledon, Hampshire, England, UK",
/title/tt0108961/,"Castle Hill, Ipswich, Suffolk, England, UK",
/title/tt0108961/,"Castleford, West Yorkshire, England, UK",
/title/tt0108961/,"Cheshunt, Hertfordshire, England, UK",
/title/tt0108961/,"Cirencester, Gloucestershire, England, UK",
/title/tt0108961/,"Dénia, Alicante, Comunitat Valenciana, Spain",
/title/tt0108961/,"Downpatrick, County Down, Northern Ireland, UK",
/title/tt0108961/,"Ely Cathedral, Chapter House, The College, Ely, Cambridgeshire, England, UK",
/title/tt0108961/,"Finlaggan, Islay, Argyll and Bute, Scotland, UK",
/title/tt0108961/,"Govan, Glasgow, Strathclyde, Scotland, UK",
/title/tt0108961/,"Greenwich, London, England, UK",
/title/tt0108961/,"Hartlepool, County Durham, England, UK",
/title/tt0108961/,"High Ercall, Shropshire, England, UK",
/title/tt0108961/,"Hylton, Sunderland, Tyne & Wear, England, UK",
/title/tt0108961/,"Ironbridge, Shropshire, England, UK",
/title/tt0108961/,"Kinlochbervie, Highland, Scotland, UK",
/title/tt0108961/,"Launceston, Cornwall, England, UK",
/title/tt0108961/,"Leven, Fife, Scotland, UK",
/title/tt0108961/,"Llangorse, Powys, Wales, UK",
/title/tt0108961/,"Mallorca, Balearic Islands, Spain",
/title/tt0108961/,"Maryland, USA",
/title/tt0108961/,"Mine Howe, Orkney, Scotland, UK",
/title/tt0108961/,"Much Wenlock, Shropshire, England, UK",
/title/tt0108961/,"Navan, County Armagh, Northern Ireland, UK",
/title/tt0108961/,"Normanton, Lincolnshire, England, UK",
/title/tt0108961/,"Papcastle, Cumbria, England, UK",
/title/tt0108961/,"Peak District, Derbyshire, England, UK",
/title/tt0108961/,"Raunds, Northamptonshire, England, UK",
/title/tt0108961/,"Ribchester, Lancashire, England, UK",
/title/tt0108961/,"Rycote Chapel, Thame, Oxfordshire, England, UK",
/title/tt0108961/,"Sanday, Orkney, Scotland, UK",
/title/tt0108961/,"Sedgefield, County Durham, England, UK",
/title/tt0108961/,"Smallhythe, Kent, England, UK",
/title/tt0108961/,"Stanton Harcourt, Oxfordshire, England, UK",
/title/tt0108961/,"Syndale, Kent, England, UK",
/title/tt0108961/,"Teignmouth, Devon, England, UK",
/title/tt0108961/,"Thetford, Norfolk, England, UK",
/title/tt0108961/,"Tintagel, Cornwall, England, UK",
/title/tt0108961/,"Turkdean, Gloucestershire, England, UK",
/title/tt0108961/,"Waddon, Dorset, England, UK",
/title/tt0108961/,"Winchester, Hampshire, England, UK",
/title/tt0108961/,"Wittenham, Oxfordshire, England, UK",
/title/tt0108961/,"York, North Yorkshire, England, UK",
/title/tt0346293/,"Prague, Czech Republic",
/title/tt0166485/,"Ipoh, Malaysia",
/title/tt0166485/,Malaysia,
/title/tt0166485/,"Penang Port, Penang, Malaysia",(19th Century Siam Port)
/title/tt0166485/,"Perak, Malaysia",
/title/tt0166485/,"Selangor, Malaysia",
/title/tt0166485/,"Papan, Malaysia",
/title/tt0166485/,"Ipoh, Perak, Malaysia",
/title/tt0166485/,USA,
/title/tt7278824/,"Manziana, Rome, Lazio, Italy",
/title/tt7278824/,"Orvieto, Terni, Umbria, Italy",
/title/tt0092997/,"Laird International Studio - 9336 W. Washington Blvd., Culver City, California, USA",
/title/tt0092997/,"East Overland Avenue & South Virginia Street - El Paso, Texas, USA",(pickup truck on its way to the Chicken Champ restaurant)
/title/tt2473794/,"Wentworth Woodhouse, Wentworth, Rotherham, South Yorkshire, England, UK","(Royal Academy of Arts exhibition, London - interiors)"
/title/tt2473794/,"Watford, Hertfordshire, England, UK",(Chelsea)
/title/tt2473794/,"Hampermill House, Three Rivers, Hertfordshire, UK",(Turner's house at 118-119 Cheyne Walk in Chelsea)
/title/tt2473794/,"Herringfleet Mill, Suffolk, England, UK",(exterior scenes)
/title/tt2473794/,"Theatre Royal, Stratford, Newham, London, England, UK",(theatre performance mocking Turner)
/title/tt2473794/,"Wales, UK",
/title/tt2473794/,"Stangate Creek, Kent, England, UK",(rowing scenes)
/title/tt0318974/,"Steiner Ranch - 896 Sayers Road, Bastrop, Texas, USA",(Bexar & Alamo scenes)
/title/tt0318974/,"Dripping Springs, Texas, USA",
/title/tt0318974/,"Paramount Theatre - 713 Congress, Austin, Texas, USA",
/title/tt0318974/,"Texas, USA",
/title/tt0318974/,"Bastrop, Texas, USA",(battle of San Jacinto)
/title/tt0318974/,"Wimberley, Texas, USA",
/title/tt2544766/,"Dam Square, Amsterdam, Noord-Holland, Netherlands",(Funeral Scene)
/title/tt2544766/,"Zierikzee, Zeeland, Netherlands",(The Amsterdam Harbour and Mob for Michiel de Ruyter residence / Last time leaving to Mediterranean / and more)
/title/tt2544766/,"Texel, Noord-Holland, Netherlands",(Exterior shots)
/title/tt2544766/,"Lelystad, Flevoland, Netherlands",(Naval interior/exterior)
/title/tt0098260/,"Paddington, London, England, UK",
/title/tt0098260/,"Bayswater, Paddington, London, England, UK",
/title/tt0098260/,"Chelsea Embankment, Chelsea, London, England, UK",
/title/tt0098260/,"Longleat, Wiltshire, England, UK",
/title/tt0098260/,"London, England, UK",
/title/tt4597870/,"Old Street, Petersburg, Virginia, USA",
/title/tt4597870/,"Richmond, Virginia, USA",(location)
/title/tt0119280/,"Taymouth Castle, Perth and Kinross, Scotland, UK",(Film location for Balmoral Castle)
/title/tt0119280/,"Ardverikie estate, Highland, Scotland, UK",
/title/tt0119280/,"Luton Hoo Estate, Luton, Bedfordshire, England, UK",
/title/tt0119280/,"Wilton House, Wilton, Salisbury, Wiltshire, England, UK",(Queen's Office)
/title/tt0058085/,"Comunidad Valenciana, Spain",
/title/tt0058085/,"Lake Santillana, Spain",(lake)
/title/tt0058085/,"Manzanares el Real, Madrid, Spain",(battle against the Persians)
/title/tt0058085/,"Sagunto, Valencia, Comunidad Valenciana, Spain",(Ravenna)
/title/tt0058085/,"Valencia, Comunidad Valenciana, Spain",
/title/tt2674454/,"Edinburgh, Scotland, UK",(location)
/title/tt2674454/,"George Street, Glasgow, Strathclyde, Scotland, UK",
/title/tt0061648/,"Bere Regis, Dorset, England, UK",
/title/tt0061648/,"Graveyard, St Nicholas Church, Sydling St Nicholas, Dorset, England, UK",(Weatherbury church: grave of Fanny)
/title/tt0061648/,"Friar Waddon House, Weymouth, Dorset, England, UK",(exteriors: Squire Boldwood's house)
/title/tt0061648/,"Market Place, Market Square, Devizes, Wiltshire, England, UK",(fair)
/title/tt0061648/,"Abbotsbury, Dorset, England, UK",
/title/tt0061648/,"Corn Exchange, Devizes, Wiltshire, England, UK",
/title/tt0061648/,"Dorchester, Dorset, England, UK",
/title/tt0061648/,"Maiden Castle, Dorchester, Dorset, England, UK",(Troy shows off his swordsmanship to Bathsheba)
/title/tt0061648/,"Weymouth, Dorset, England, UK",(Bathsheba and Troy on the beach)
/title/tt0061648/,"Horton, Dorset, England, UK",
/title/tt0061648/,"Shaftesbury, Dorset, England, UK",(Town Hall rear - Fanny struggles up the hill to the poorhouse)
/title/tt0061648/,"St Nicholas Church, Sydling St Nicholas, Dorset, England, UK",(Weatherbury church)
/title/tt0061648/,"Thornhill House, Sturminster Newton, Blackmore Vale, Dorset, England, UK",(interiors: Squire Boldwood's house)
/title/tt0061648/,"West Lulworth, Dorset, England, UK",
/title/tt0061648/,"Wiltshire, England, UK",
/title/tt0424205/,Romania,
/title/tt0424205/,Germany,
/title/tt0424205/,UK,
/title/tt0424205/,"Barlin, Pas-de-Calais, France",
/title/tt0829459/,"Karachi, Pakistan",
/title/tt0829459/,"Mumbai, Maharashtra, India",
/title/tt0829459/,Pakistan,
/title/tt0829459/,"Marseille, Bouches-du-Rhône, France",
/title/tt0829459/,France,
/title/tt0829459/,USA,
/title/tt0829459/,"The Austin American-Statesman, 305 S Congress Ave, Austin, TX 78704, United States",(Wall Street Journal offices)
/title/tt10348700/,"Palomino, La Guajira, Colombia",
/title/tt10348700/,"Santa Fe de Antioquia, Colombia",
/title/tt2093991/,"Shreveport, Louisiana, USA",
/title/tt0338806/,"MediaPro Studios, Bucharest, Romania",
/title/tt0338806/,UK,
/title/tt10793982/,Iran,
/title/tt0092804/,"Avondale, Harare, Zimbabwe",(exteriors: home of Donald Woods)
/title/tt0092804/,"Charles Prince Airport, Zimbabwe",(Maseru Airport)
/title/tt0092804/,"Grand Hotel, Shurugwi, Zimbabwe",(party on new year's eve)
/title/tt0092804/,"Harare, Zimbabwe",(Biko Imprisonment filmed in Harare police cells)
/title/tt0092804/,"Macheke River, Zimbabwe",(Telle Bridge Border Post)
/title/tt0092804/,"Mombasa, Kenya",(beach scenes)
/title/tt0092804/,"Ridge Road, Avondale, Harare, Zimbabwe",(exteriors: home of Donald Woods)
/title/tt0092804/,"Sandown Park Racecourse, Esher, Surrey, England, UK",(Johannesburg Airport)
/title/tt0092804/,"Shurugwi, Zimbabwe","(Stutterheim, South Africa)"
/title/tt0092804/,Kenya,(South Africa)
/title/tt0107004/,"Moab, Utah, USA",
/title/tt0107004/,"Monument Valley, Arizona, USA",
/title/tt0107004/,"Red Mesa, Arizona, USA",
/title/tt0107004/,"Williams, Arizona, USA",(Grand Canyon Railway)
/title/tt0107004/,"Tucson, Arizona, USA",
/title/tt0107004/,"San Francisco Peaks, Arizona, USA",
/title/tt0107004/,"Teec Nos Pos, Arizona, USA",
/title/tt3759298/,"Nida, Lithuania",(Siberia)
/title/tt0025913/,"Reichsparteitag-Gelände, Nuremberg, Bavaria, Germany",
/title/tt0057590/,"Dorset, England, UK",
/title/tt0057590/,"Woodfall Films, Curzon Street, London, England, UK",(studio)
/title/tt0321897/,"Syon House, Syon Park, Brentford, Middlesex, England, UK",(Henleigh Grandcourt's estate interiors)
/title/tt0321897/,"Henley-on-Thames, Oxfordshire, England, UK",(horseback riding and hunt scenes)
/title/tt0321897/,"Avington Park, Winchester, Hampshire, England, UK",(Quentcham Hall)
/title/tt0321897/,"Forde Abbey, Chard, Somerset, England, UK",(The Abbey)
/title/tt0321897/,"Greys Court, Henley-on-Thames, Oxfordshire, England, UK",(Lydia Glasher's home)
/title/tt0321897/,"Waddesdon Manor, Waddesdon, Buckinghamshire, England, UK",(casino exteriors)
/title/tt0321897/,"London, England, UK",
/title/tt0321897/,"Surrey, England, UK",
/title/tt0060588/,"Masshoona, Egypt",
/title/tt0060588/,"Pinewood Studios, Iver Heath, Buckinghamshire, England, UK",(studio)
/title/tt0060588/,"Marylebone Station, Marylebone, London, England, UK",(Col Stewarts arrival from Khartoum/ British arny departure for Khartoum)
/title/tt2515030/,"Chiriquí, Panama",
/title/tt3658364/,"Prague, Czech Republic",
/title/tt3658364/,"Bavaria, Germany",
/title/tt3658364/,Germany,
