,Code,Show Name,Location,Scene,geocodedLocation,latitude,longitude
863,/title/tt0302640/,The Hot Chick,"Los Angeles, California, USA",,"Los Angeles, Los Angeles County, California, United States of America",34.0536909,-118.2427666
864,/title/tt0117887/,That Thing You Do!,"Dresden Room Restaurant - 1760 N. Vermont Avenue, Los Feliz, Los Angeles, California, USA",(Guy meets Del Paxton.)                        ,,,
865,/title/tt0117887/,That Thing You Do!,"Orpheum Theater - 842 South Broadway, Downtown, Los Angeles, California, USA",(Recongnizable Location)                        ,,,
866,/title/tt0117887/,That Thing You Do!,"Leo Carrillo State Beach - 35000 W. Pacific Coast Highway, Malibu, California, USA",,,,
867,/title/tt0117887/,That Thing You Do!,"Erie, Pennsylvania, USA",,"Erie, Erie County, Pennsylvania, United States of America",42.1294712,-80.0852695
868,/title/tt0117887/,That Thing You Do!,"Hollywood United Methodist Church - 6817 Franklin Avenue, Hollywood, Los Angeles, California, USA",,,,
869,/title/tt0117887/,That Thing You Do!,"Umami Burger - 852 S. Broadway, Los Angeles, California, USA",(Take-out restaurant where Guy is introduced to Mr. White.)                        ,"Umami Burger, 852, South Broadway, Historic Core District, Downtown, Los Angeles, Los Angeles County, California, 90015, United States of America",34.0424851,-118.2556527
870,/title/tt0117887/,That Thing You Do!,"Orange, California, USA",,"Orange County, California, United States of America",33.7500378,-117.8704931
871,/title/tt0117887/,That Thing You Do!,"Henderson, Nevada, USA",,"Henderson, Clark County, Nevada, United States of America",36.0301134,-114.9826194
872,/title/tt0117887/,That Thing You Do!,"Oil field, north of, Brea, California, USA",,,,
873,/title/tt0117887/,That Thing You Do!,"Pasadena, California, USA",,"Pasadena, Los Angeles County, California, United States of America",34.1476452,-118.1444779
874,/title/tt0117887/,That Thing You Do!,"CBS Television City - 7800 Beverly Boulevard, Fairfax, Los Angeles, California, USA",(studio) (studio 33) (Hollywood Showcase scenes)                        ,"CBS Television City, Beverly Boulevard, Fairfax, Los Angeles, Los Angeles County, California, 90036, United States of America",34.0746936,-118.35963130080704
875,/title/tt0117887/,That Thing You Do!,"Los Angeles, California, USA",,"Los Angeles, Los Angeles County, California, United States of America",34.0536909,-118.2427666
876,/title/tt0054533/,The Dick Van Dyke Show,"Desilu Cahuenga Studios, 846 N. Cahuenga Blvd. Los Angeles, California, USA",(studio)                        ,,,
877,/title/tt0110442/,Major League II,"Harrisburg, Pennsylvania, USA",,"Harrisburg, Dauphin County, Pennsylvania, United States of America",40.2663107,-76.8861122
878,/title/tt0110442/,Major League II,"Oriole Park at Camden Yards - 333 W. Camden Street, Baltimore, Maryland, USA",,,,
879,/title/tt0110442/,Major League II,"Guaranteed Rate Field - 333 W. 35th Street, Armour Square, Chicago, Illinois, USA",,"Guaranteed Rate Field, 333, West 35th Street, Armour Square, Chicago, Cook County, Illinois, 60616, United States of America",41.8300162,-87.63256264837347
880,/title/tt0110442/,Major League II,"Baltimore, Maryland, USA",,"Baltimore, Maryland, United States of America",39.2908816,-76.610759
881,/title/tt0110442/,Major League II,"Cleveland, Ohio, USA",,"Cleveland, Cuyahoga County, Ohio, United States of America",41.5051613,-81.6934446
882,/title/tt2119543/,The House with a Clock in Its Walls,"Greenville Street, Newnan, Georgia, USA",,"Greenville Street Park, Newnan, Coweta, Georgia, United States of America",33.3714476,-84.80028395714145
883,/title/tt2119543/,The House with a Clock in Its Walls,"Champ's Clock Shop - 3834 King Drive Douglasville, Georgia, USA",(Special Clock Sound Recording)                        ,,,
884,/title/tt2119543/,The House with a Clock in Its Walls,"Atlanta, Georgia, USA",,"Atlanta, Georgia, United States of America",33.7490987,-84.3901849
885,/title/tt2910904/,The Dressmaker,"Horsham, Victoria, Australia",,"Horsham, Rural City of Horsham, Victoria, 3400, Australia",-36.7148099,142.2018105
886,/title/tt2910904/,The Dressmaker,"Mount Rothwell, Little River, Victoria, Australia",,,,
887,/title/tt2120120/,Pixels,"Toronto, Ontario, Canada",,"Toronto, Peel, Golden Horseshoe, Ontario, Canada",43.6534817,-79.3839347
888,/title/tt2120120/,Pixels,"Revival 629, 629 Eastern Avenue, Toronto, Ontario, Canada",,,,
889,/title/tt2120120/,Pixels,"900 Bay Street, Toronto, Ontario, Canada","(Ludlow, Eddie, and Lady Lisa run up the front steps during the final battle)                        ","Mowat Block, 900, Bay Street, Toronto Centre, Old Toronto, Toronto, Peel, Golden Horseshoe, Ontario, M5S 1Z6, Canada",43.6631944,-79.38733603719238
890,/title/tt2120120/,Pixels,"Princess Margaret School, Toronto, Ontario, Canada",(President's classroom visit) (choir kids seen on TV during ball)                        ,"Princess Margaret, Etobicoke, Toronto, Peel, Golden Horseshoe, Ontario, M9B 6H6, Canada",43.6728194,-79.5550377
891,/title/tt2120120/,Pixels,"George Brown College Waterfront Campus, Toronto, Ontario, Canada",(Where Eddie drives into the water in Pac Man sequence)                        ,"George Brown College - Waterfront Campus, 51, Dockside Drive, Spadina—Fort York, Old Toronto, Toronto, Peel, Golden Horseshoe, Ontario, M5A 3Y5, Canada",43.644143,-79.36564054138904
892,/title/tt2120120/,Pixels,"Rouge Park, Scarborough, Toronto, Ontario, Canada",(Centipede battle)                        ,"Rouge Park, Scarborough, Toronto, Peel, Golden Horseshoe, Ontario, M1B 5X3, Canada",43.8045003,-79.1580323
893,/title/tt2120120/,Pixels,"Victoria Park, Cobourg, Ontario, Canada",(Young Brenner and Young Cooper cycle through park)                        ,"Victoria Park, Coverdale, Cobourg, Northumberland County, Central Ontario, Ontario, Canada",43.95883945,-78.16185032522773
894,/title/tt2120120/,Pixels,"Scotland Yard, 56 The Esplanade, Toronto, Ontario, Canada",(bar where they celebrate after defeating Centipede)                        ,"Scotland Yard, The Esplanade, Spadina—Fort York, Old Toronto, Toronto, Peel, Golden Horseshoe, Ontario, M5E 1A7, Canada",43.6470473,-79.3740872
895,/title/tt2120120/,Pixels,"33 Delisle Avenue, Toronto, Ontario, Canada",(Apartment building where Brenner catches up to Centipede)                        ,"33, Delisle Avenue, Toronto—St. Paul's, Old Toronto, Toronto, Peel, Golden Horseshoe, Ontario, M4T 2S9, Canada",43.68838635,-79.39652148173937
896,/title/tt2120120/,Pixels,"Laplante Street, Toronto, Ontario, Canada","(Final part of Pac Man sequence, where Pac Man gets the final power pellet)                        ",,,
897,/title/tt2120120/,Pixels,"Four Seasons Centre for the Performing Arts, Toronto, Ontario, Canada","(Brenner, Cooper, and Violet run past on the way to the mothership. It is also in the background when they are reacting to Max Headroom.)                        ","Four Seasons Centre for the Performing Arts, 145, Queen Street West, Spadina—Fort York, Old Toronto, Toronto, Peel, Golden Horseshoe, Ontario, M5H, Canada",43.65059655,-79.38553674786671
898,/title/tt2120120/,Pixels,"Canada Life Building, Toronto, Ontario, Canada",(Explodes near beginning of DC battle)                        ,"Canada Life, 330, University Avenue, Spadina—Fort York, Old Toronto, Toronto, Peel, Golden Horseshoe, Ontario, M5H, Canada",43.65167769999999,-79.3876147149821
899,/title/tt2120120/,Pixels,"Huron Street, Toronto, Ontario, Canada",(The school bus where Ludlow battles ninjas is on Huron just north of Russell)                        ,"Huron Street, University—Rosedale, Old Toronto, Toronto, Peel, Golden Horseshoe, Ontario, M5T 1H1, Canada",43.6542672,-79.3965199
900,/title/tt2120120/,Pixels,"Ontario Legislature Building, Queen's Park, Toronto, Ontario, Canada","(Seen in background of two different Frogger scenes in DC battle, with camera looking north on University Ave)                        ",,,
901,/title/tt2120120/,Pixels,"University of Toronto, Toronto, Ontario, Canada",(several scenes from battle in DC)                        ,"University of Toronto, King's College Circle, University—Rosedale, Old Toronto, Toronto, Peel, Golden Horseshoe, Ontario, M5S 1A1, Canada",43.663461999999996,-79.39775965337452
902,/title/tt2120120/,Pixels,"Yorkville, Toronto, Ontario, Canada","(scenes where Pac Man chases Ludlow, on Bay St, from Yorkville to Cumberland)                        ","Yorkville, Old Toronto, Toronto, Peel, Golden Horseshoe, Ontario, M5R 1C1, Canada",43.6713861,-79.3901677
903,/title/tt2120120/,Pixels,"Novotel, 45 The Esplanade, Toronto, Ontario, Canada",(Brenner gets in to his truck after meeting Cooper at the Potomac Grill)                        ,"Novotel, 45, The Esplanade, Spadina—Fort York, Old Toronto, Toronto, Peel, Golden Horseshoe, Ontario, M5E 1A7, Canada",43.646654,-79.37411907725917
904,/title/tt2120120/,Pixels,"Petuxent Instatution, Jessup, Maryland, USA","(exteriors, prison where Eddie Plant is before the demand scans the parked cars are employee/visitor cars for the prison and the parked cop cars next to the gate are real MD state trooper cars.)                        ",,,
905,/title/tt0108872/,My So-Called Life,"University High School - 11800 Texas Avenue, West Los Angeles, Los Angeles, California, USA",(Liberty High School)                        ,,,
906,/title/tt0108872/,My So-Called Life,"South Pasadena, California, USA",,"South Pasadena, Los Angeles County, California, 91030, United States of America",34.1133062,-118.1478291
907,/title/tt0108872/,My So-Called Life,USA,,United States,39.7837304,-100.4458825
908,/title/tt0795461/,Scary Movie 5,"Atlanta, Georgia, USA",,"Atlanta, Georgia, United States of America",33.7490987,-84.3901849
909,/title/tt0256380/,Shallow Hal,"Charlotte, North Carolina, USA",,"Charlotte, Mecklenburg County, North Carolina, United States of America",35.2272,-80.843083
910,/title/tt0256380/,Shallow Hal,"Concord, North Carolina, USA",(Hal's Apartment)                        ,"Concord, Cabarrus County, North Carolina, United States of America",35.4093772,-80.5797416
911,/title/tt0256380/,Shallow Hal,"The Capital Grill- Charlotte, North Carolina, USA",,,,
912,/title/tt0256380/,Shallow Hal,"Los Angeles, California, USA",,"Los Angeles, Los Angeles County, California, United States of America",34.0536909,-118.2427666
913,/title/tt0207201/,What Women Want,"Dresden Room Restaurant - 1760 N. Vermont Avenue, Los Feliz, Los Angeles, California, USA",(Back Door Piano Lounge)                        ,,,
914,/title/tt0207201/,What Women Want,"Drake Hotel - 140 E. Walton Pl., Near North Side, Chicago, Illinois, USA",,"Drake Hotel, 140, East Walton Place, Near North Side, Chicago, Cook County, Illinois, 60611, United States of America",41.900403999999995,-87.62340144999999
915,/title/tt0207201/,What Women Want,"Culver Studios - 9336 W. Washington Blvd., Culver City, California, USA",(studio)                        ,,,
916,/title/tt0207201/,What Women Want,"Chicago, Illinois, USA",,"Chicago, Cook County, Illinois, United States of America",41.8755616,-87.6244212
917,/title/tt0207201/,What Women Want,"Long Beach, California, USA",,"Long Beach, Los Angeles County, California, United States of America",33.7690164,-118.1916048
918,/title/tt0207201/,What Women Want,"University of Southern California, Los Angeles, California, USA",,"University of Southern California, Flower Street, University Park, Los Angeles, Los Angeles County, California, 90089-0871, United States of America",34.0218833,-118.28586726915088
919,/title/tt0093493/,Mannequin,"Wanamaker's Department Store - 1313 Chestnut Street, Philadelphia, Pennsylvania, USA",(Prince and Company department store)                        ,,,
920,/title/tt0093493/,Mannequin,"Philadelphia, Pennsylvania, USA",,"Philadelphia, Philadelphia County, Pennsylvania, United States of America",39.9527237,-75.1635262
921,/title/tt0093493/,Mannequin,"Cumberland County, Pennsylvania, USA",,"Cumberland, Pennsylvania, 17081, United States of America",40.1541581,-77.2803933
922,/title/tt0114319/,Sabrina,"Salutation House, West Island, Glen Cove, Long Island, New York, USA",(Larrabee mansion)                        ,,,
923,/title/tt0114319/,Sabrina,"Glen Cove, Long Island, New York, USA",,,,
924,/title/tt0114319/,Sabrina,"Martha's Vineyard, Massachusetts, USA",,"Martha's Vineyard, West Tisbury, Dukes County, Massachusetts, United States of America",41.3918832,-70.62085427857699
925,/title/tt0114319/,Sabrina,"New York City, New York, USA",,"New York, United States of America",40.7127281,-74.0060152
926,/title/tt0114319/,Sabrina,"Pont Alexandre III, Paris 7, Paris, France",,"Pont Alexandre III, Quartier des Invalides, Paris, Île-de-France, France métropolitaine, 75007, France",48.8630102,2.3134682
927,/title/tt0372532/,The Wedding Date,"St James's Church, Shere, Surrey, England, UK",(wedding)                        ,,,
928,/title/tt0372532/,The Wedding Date,"Chilworth Manor, Chilworth, Guildford, Surrey, England, UK",,"Chilworth Manor, Halfpenny Lane, St. Martha, Guildford, Surrey, South East, England, GU4 8NL, United Kingdom",51.2206329,-0.5310167611203902
929,/title/tt0372532/,The Wedding Date,"England, UK",,"England, United Kingdom",52.7954791,-0.5402402866174321
930,/title/tt0372532/,The Wedding Date,"New York City, New York, USA",,"New York, United States of America",40.7127281,-74.0060152
931,/title/tt0115433/,101 Dalmatians,"Minster Court, EC3, London, England, UK",(exterior: House Of DeVil)                        ,"Minster Court, Upminster, London Borough of Havering, London, Greater London, England, RM11 3TJ, United Kingdom",51.5605106,0.2361091
932,/title/tt0115433/,101 Dalmatians,"Trafalgar Square, St James's, London, England, UK",,"Trafalgar Square, St. James's, Covent Garden, City of Westminster, London, Greater London, England, WC2, United Kingdom",51.508037,-0.12804941070724718
933,/title/tt0115433/,101 Dalmatians,"Oxfordshire, England, UK",,"Oxfordshire, South East, England, United Kingdom",51.833333,-1.25
934,/title/tt0115433/,101 Dalmatians,"Hambleden, Buckinghamshire, England, UK",(Town in the countryside)                        ,"Hambleden, Buckinghamshire, South East, England, RG9 6RP, United Kingdom",51.5719351,-0.8691036
935,/title/tt0115433/,101 Dalmatians,"Battersea Park, London, England, UK",(Walking the dogs)                        ,"Battersea Park, Battersea, London Borough of Wandsworth, London, Greater London, England, United Kingdom",51.479193300000006,-0.15707865471804333
936,/title/tt0115433/,101 Dalmatians,"St. James's Park, St. James's, London, England, UK",(Bikes in the lake scene)                        ,"St. James's Park, St. James's, Victoria, City of Westminster, London, Greater London, England, SW1A 2BJ, United Kingdom",51.5030696,-0.13318501913023192
937,/title/tt0115433/,101 Dalmatians,"Soho Square, Soho, London, England, UK",,"Soho Square, Soho, City of Westminster, London, Greater London, England, United Kingdom",51.515296,-0.13220573392798368
938,/title/tt0115433/,101 Dalmatians,"Sarum Chase, 23 West Heath Road, Hampstead, London, England, UK",(Cruella Devil's mansion)                        ,"Sarum Chase, 23, West Heath Road, North End, West Hampstead, London Borough of Camden, London, Greater London, England, NW3 7UX, United Kingdom",51.56232545,-0.18967010565183748
939,/title/tt4565520/,The Layover,"St. Louis, Missouri, USA",,"Saint Louis, City of Saint Louis, Missouri, 63102-1102, United States of America",38.6264178,-90.1998378
940,/title/tt4565520/,The Layover,"Vancouver, British Columbia, Canada",,"Vancouver, Metro Vancouver Regional District, British Columbia, Canada",49.2608724,-123.1139529
941,/title/tt2172584/,Maps to the Stars,"Hollywood, Los Angeles, California, USA",,"Hollywood, Los Angeles, Los Angeles County, California, 90028-8127, United States of America",34.0980031,-118.329523
942,/title/tt2172584/,Maps to the Stars,"Revival 629, 629 Eastern Avenue, Toronto, Ontario, Canada",(Stage)                        ,,,
943,/title/tt2172584/,Maps to the Stars,"Chateau Marmont - 8221 Sunset Blvd., Hollywood, Los Angeles, California, USA",(meeting Carrie Fisher)                        ,"Chateau Marmont, 8221, West Sunset Boulevard, Sunset Strip, Hollywood Hills West, West Hollywood, Los Angeles County, California, 90046, United States of America",34.098249749999994,-118.36840487975618
944,/title/tt2172584/,Maps to the Stars,"Los Angeles, California, USA",,"Los Angeles, Los Angeles County, California, United States of America",34.0536909,-118.2427666
945,/title/tt2172584/,Maps to the Stars,"Hollywood Boulevard, Hollywood, Los Angeles, California, USA",,"Hollywood Boulevard, Whitley Heights Historic District, Hollywood, Los Angeles, Los Angeles County, California, 90028, United States of America",34.1015833,-118.3324947
946,/title/tt2172584/,Maps to the Stars,USA,,United States,39.7837304,-100.4458825
947,/title/tt2365580/,"Where'd You Go, Bernadette","Pittsburgh, Pennsylvania, USA",,"Pittsburgh, Allegheny County, Pennsylvania, United States of America",40.4416941,-79.9900861
948,/title/tt2365580/,"Where'd You Go, Bernadette",Greenland,(Antarctica)                        ,Kalaallit Nunaat,77.6192349,-42.8125967
949,/title/tt2365580/,"Where'd You Go, Bernadette","31st Street Studios, Pittsburgh, Pennsylvania, USA",,,,
950,/title/tt2365580/,"Where'd You Go, Bernadette","Pennsylvania, USA",,"Pennsylvania, United States of America",40.9699889,-77.7278831
951,/title/tt2365580/,"Where'd You Go, Bernadette","Washington, USA",,"Washington, District of Columbia, 20230, United States of America",38.8949924,-77.0365581
952,/title/tt0077003/,Diff'rent Strokes,"Metromedia Square - 5746 Sunset Boulevard, Hollywood, Los Angeles, California, USA",(studio) (1978-1982)                        ,,,
953,/title/tt0077003/,Diff'rent Strokes,"Universal Studios - 100 Universal City Plaza, Universal City, California, USA",(studio) (1982-1985)                        ,,,
954,/title/tt1415889/,Good Luck Charlie,"Los Angeles Center Studios - 450 S. Bixel Street, Downtown, Los Angeles, California, USA",,,,
955,/title/tt1415889/,Good Luck Charlie,"501 Palmetto Drive, Pasadena, California, USA",(Exterior: Duncan House)                        ,"501, Palmetto Drive, Pasadena, Los Angeles County, California, 91105, United States of America",34.137429969696974,-118.16069443434343
956,/title/tt0486946/,Wild Hogs,"Madrid, New Mexico, USA",,"Madrid, Santa Fe County, New Mexico, United States of America",35.4023125,-106.15423678007406
957,/title/tt0486946/,Wild Hogs,"Angel Fire, New Mexico, USA",(Camping scenes)                        ,"Angel Fire, Colfax County, New Mexico, 87710, United States of America",36.3930879,-105.2850091
958,/title/tt0486946/,Wild Hogs,"Rio Grande Gorge Bridge, Taos, New Mexico, USA",,"Rio Grande Gorge Bridge, Taos County, New Mexico, 87577, United States of America",36.4762545,-105.7329532
959,/title/tt0486946/,Wild Hogs,"Pojoaque, New Mexico, USA",,"Pojoaque, Santa Fe County, New Mexico, 87506, United States of America",35.8928461,-106.0225635
960,/title/tt0486946/,Wild Hogs,"New Mexico, USA",,"New Mexico, United States of America",34.5708167,-105.993007
961,/title/tt7545266/,Like a Boss,"Atlanta, Georgia, USA",,"Atlanta, Georgia, United States of America",33.7490987,-84.3901849
962,/title/tt0841046/,Walk Hard: The Dewey Cox Story,"Sony Pictures Studios - 10202 W. Washington Blvd., Culver City, California, USA",,,,
963,/title/tt0088161/,Splash,"Nassau, New Providence Island, Bahamas",,"Nassau, Sidney Poitier Bridge, New Providence, 242, Bahamas",25.0769738,-77.3237203
964,/title/tt0088161/,Splash,"Los Angeles, California, USA",,"Los Angeles, Los Angeles County, California, United States of America",34.0536909,-118.2427666
965,/title/tt0088161/,Splash,"New York City, New York, USA",,"New York, United States of America",40.7127281,-74.0060152
966,Code,Show Name,Location,Scene,"Location, Tucker County, West Virginia, United States of America",39.2138905,-79.6371124
967,/title/tt11618536/,Shithouse,"Los Angeles, California, USA",,"Los Angeles, Los Angeles County, California, United States of America",34.0536909,-118.2427666
968,/title/tt1450321/,Filth,"Trollhättan, Västra Götalands län, Sweden",,"Trollhättan, Trollhättans kommun, Västra Götalands län, Götaland, 46183, Sverige",58.2827931,12.2908612
969,/title/tt1450321/,Filth,"Airport, Ostend, Flanders, Belgium",,"Ostend–Bruges International Airport, Torhoutsesteenweg, Nieuwe Stad, Stene, Oostende, West-Vlaanderen, Vlaanderen, 8400, België - Belgique - Belgien",51.2003974,2.874168446044633
970,/title/tt1450321/,Filth,"Glasgow, Strathclyde, Scotland, UK",,"DoubleTree by Hilton Glasgow Strathclyde, Phoenix Crescent, Strathclyde Business Park, Shawhead (farm), Bellshill, North Lanarkshire, Scotland, ML4 3JQ, United Kingdom",55.8317061,-4.0333295
971,/title/tt1450321/,Filth,"Karbon, Glasgow, Strathclyde, Scotland, UK",,,,
972,/title/tt1450321/,Filth,UK,,United Kingdom,54.7023545,-3.2765753
973,/title/tt1450321/,Filth,"St. Pauli, Hamburg-Mitte, Hamburg, Germany",,"St. Pauli, Hamburg, Deutschland",53.5539347,9.9594316
974,/title/tt0280590/,Mr. Deeds,"New Milford, Connecticut, USA",,"New Milford, Litchfield County, Connecticut, United States of America",41.5770993,-73.4105803
975,/title/tt0280590/,Mr. Deeds,"Camp Whittle - 31701 Rim of the World Drive, Fawnskin, Big Bear Valley, San Bernardino National Forest, California, USA",,,,
976,/title/tt0280590/,Mr. Deeds,"Felt Forum, Madison Square Garden - 4 Pennsylvania Plaza, Manhattan, New York City, New York, USA",,,,
977,/title/tt0280590/,Mr. Deeds,"Los Angeles, California, USA",,"Los Angeles, Los Angeles County, California, United States of America",34.0536909,-118.2427666
978,/title/tt0187664/,Spaced,"23 Carleton Road, Tufnell Park, London, England, UK",(exteriors: 23 Meteor Street)                        ,"23, Carleton Road, Holloway, London Borough of Islington, London, Greater London, England, N7 0QH, United Kingdom",51.554048050000006,-0.13052404670155046
979,/title/tt0187664/,Spaced,"Twickenham Film Studios, St Margarets, Twickenham, Middlesex, England, UK",(studio) (series 1)                        ,,,
980,/title/tt0116313/,The First Wives Club,"Robbins & Appleton Building, 1 Bond Street, New York City, New York, USA",(The Cynthia Swann Griffin Crisis Center for Women)                        ,,,
981,/title/tt0116313/,The First Wives Club,"100 Vandam Street, Soho, Manhattan, New York City, New York, USA",,,,
982,/title/tt0116313/,The First Wives Club,"Brooklyn College, City University of New York, Brooklyn, New York City, New York, USA",,,,
983,/title/tt2709768/,The Secret Life of Pets,"New York City, New York, USA",,"New York, United States of America",40.7127281,-74.0060152
984,/title/tt0367089/,The Squid and the Whale,"Park Slope, Brooklyn, New York City, New York, USA",(location)                        ,"Park Slope, Brooklyn, Kings County, New York, United States of America",40.6701033,-73.9859723
985,/title/tt0367089/,The Squid and the Whale,"Brooklyn College, City University of New York, Brooklyn, New York City, New York, USA",(location)                        ,,,
986,/title/tt0367089/,The Squid and the Whale,"Midwood High School, Brooklyn, New York City, New York, USA",(location)                        ,"Midwood High School, East 26th Street, Brooklyn, Kings County, New York, 11210, United States of America",40.632824049999996,-73.95230355739466
987,/title/tt0119528/,Liar Liar,"Los Angeles City Hall - 200 North Spring Street, Downtown, Los Angeles, California, USA",,"Los Angeles City Hall, 200, North Spring Street, Civic Center, Downtown, Los Angeles, Los Angeles County, California, 90012, United States of America",34.0537767,-118.2428987
988,/title/tt0119528/,Liar Liar,"Los Angeles, California, USA",,"Los Angeles, Los Angeles County, California, United States of America",34.0536909,-118.2427666
989,/title/tt0119528/,Liar Liar,"Universal Studios - 100 Universal City Plaza, Universal City, California, USA",(studio)                        ,,,
990,/title/tt0119528/,Liar Liar,"Alhambra, California, USA",,"Alhambra, Los Angeles County, California, United States of America",34.093042,-118.12706
991,/title/tt0119528/,Liar Liar,"Pasadena, California, USA",,"Pasadena, Los Angeles County, California, United States of America",34.1476452,-118.1444779
992,/title/tt0080711/,Fade to Black,"302 Market Street, Venice, California, USA",(Eric and Stella Binford's House)                        ,"302, Market Street, Venice, Los Angeles, Los Angeles County, California, 90291, United States of America",33.989891300000004,-118.4696254
993,/title/tt0080711/,Fade to Black,"Hollywood, Los Angeles, California, USA",(some exteriors)                        ,"Hollywood, Los Angeles, Los Angeles County, California, 90028-8127, United States of America",34.0980031,-118.329523
994,/title/tt0080711/,Fade to Black,"Ocean Front Walk, Venice Beach, Venice, Los Angeles, California, USA",,,,
995,/title/tt0117802/,Swingers,"Three Clubs, 1123 VINE ST, Hollywood, California, USA",(Bar)                        ,,,
996,/title/tt0117802/,Swingers,"Dresden Room Restaurant - 1760 N. Vermont Avenue, Los Feliz, Los Angeles, California, USA",,,,
997,/title/tt0117802/,Swingers,"Los Feliz, Los Angeles, California, USA",,"Los Feliz, Los Angeles, Los Angeles County, California, United States of America",34.1076561,-118.2875062
998,/title/tt0117802/,Swingers,"The Derby - 4500 Los Feliz Blvd., Los Feliz, Los Angeles, California, USA",,,,
999,/title/tt0117802/,Swingers,"Best Western Inn - 6141 Franklin Avenue, Hollywood, Los Angeles, California, USA",,,,
