,Code,Show Name,Location,Scene,geocodedLocation,latitude,longitude
423,/title/tt1453405/,Monsters Universiteit,"Walt Disney Animation Studios - 2100 Riverside Drive, Burbank, California, USA",,,,
424,/title/tt3502172/,Mozart in the Jungle,"Purchase, New York, USA",(interior concert scenes)                        ,"Purchase, Harrison, Westchester County, New York, 10577, United States of America",41.0409305,-73.7145746
425,/title/tt0146402/,Addams Family Reunion,"California, USA",,"California, United States of America",36.7014631,-118.7559974
426,/title/tt0146402/,Addams Family Reunion,"Los Angeles, California, USA",,"Los Angeles, Los Angeles County, California, United States of America",34.0536909,-118.2427666
427,/title/tt0105417/,Sister Act,"St. Paul's Church, Church Street, Noe Valley, San Francisco, California, USA",,,,
428,/title/tt0105417/,Sister Act,"Reno Main Post Office, 50 S. Virginia Street, Reno, Nevada, USA",(Police Station Exteriors)                        ,,,
429,/title/tt0105417/,Sister Act,"Hollywood United Methodist Church - 6817 Franklin Avenue, Hollywood, Los Angeles, California, USA",,,,
430,/title/tt0105417/,Sister Act,"Virginia Street, Reno, Nevada, USA",,,,
431,/title/tt0105417/,Sister Act,"Santa Monica Airport - 3223 Donald Douglas Loop S., Santa Monica, California, USA",,"Santa Monica Airport, Donald Douglas Loop South, Santa Monica, Los Angeles County, California, 90405, United States of America",34.0174769,-118.44755251631068
432,/title/tt0105417/,Sister Act,"195 N. Virginia Street, Reno, Nevada, USA",(Whoopi Goldberg's Apartment)                        ,"195, North Virginia Street, Reno, Washoe County, Nevada, 89501, United States of America",39.526692499999996,-119.8136225024713
433,/title/tt0105417/,Sister Act,"Hall Realty, Church Street, San Francisco, California, USA",,"Hall Realty, 1651, Church Street, Noe Valley, San Francisco, San Francisco City and County, California, 94110, United States of America",37.7444047,-122.4266021
434,/title/tt0105417/,Sister Act,"Los Angeles, California, USA",,"Los Angeles, Los Angeles County, California, United States of America",34.0536909,-118.2427666
435,/title/tt0105417/,Sister Act,USA,,United States,39.7837304,-100.4458825
436,/title/tt2823054/,Mike and Dave Need Wedding Dates,"Honolulu, Hawaii, USA",,"Honolulu, Honolulu County, Hawaii, United States of America",21.304547,-157.8556764
437,/title/tt2823054/,Mike and Dave Need Wedding Dates,"Hawaii, USA",,"Hawaii, United States of America",19.58726775,-155.42688965312746
438,/title/tt2823054/,Mike and Dave Need Wedding Dates,"Turtle Bay Resort - 57-091 Kamehameha Highway Kahuku, Hawaii, USA",,,,
439,/title/tt2823054/,Mike and Dave Need Wedding Dates,"North Shore, Oahu, Hawaii, USA",,,,
440,/title/tt2823054/,Mike and Dave Need Wedding Dates,"North Shore, O'ahu, Hawaii, USA",,,,
441,/title/tt2823054/,Mike and Dave Need Wedding Dates,"Kahuku, O'ahu, Hawaii, USA",,,,
442,/title/tt2823054/,Mike and Dave Need Wedding Dates,"Kamehameha Highway, O'ahu, Hawaii, USA",,,,
443,/title/tt2823054/,Mike and Dave Need Wedding Dates,"Waimea Bay, North Shore, O'ahu, Hawaii, USA",,,,
444,/title/tt2823054/,Mike and Dave Need Wedding Dates,"Lä'ie, O'ahu, Hawaii, USA",,,,
445,/title/tt2823054/,Mike and Dave Need Wedding Dates,USA,,United States,39.7837304,-100.4458825
446,/title/tt1598822/,New Year's Eve,"Brooklyn Bridge, New York City, New York, USA",(second unit aerial shot)                        ,"Brooklyn Bridge, Dover Street, Financial District, Manhattan Community Board 1, Manhattan, New York County, New York, 10038, United States of America",40.70569125,-73.9963578678543
447,/title/tt1598822/,New Year's Eve,"Statue of Liberty, Liberty Island, New York Harbor, New York City, New York, USA",(second unit aerial shot)                        ,,,
448,/title/tt1598822/,New Year's Eve,"Radio City Music Hall - 1260 6th Avenue, Rockefeller Center, Manhattan, New York City, New York, USA",(Rockettes scene)                        ,,,
449,/title/tt1598822/,New Year's Eve,"Brooklyn Museum - 200 Eastern Parkway, Brooklyn, New York City, New York, USA",(second unit exterior)                        ,"Brooklyn Museum, 200, Eastern Parkway, Prospect Heights, Brooklyn, Kings County, New York, 11238, United States of America",40.6709108,-73.96331573047141
450,/title/tt0322330/,Freaky Friday,"Dorris Place Elementary School - 2225 Dorris Place, Los Angeles, California, USA",,,,
451,/title/tt0322330/,Freaky Friday,"Argyle Hotel - 8358 Sunset Blvd., West Hollywood, California, USA",,,,
452,/title/tt0322330/,Freaky Friday,"Palisades High School - 15777 Bowdoin Street, Pacific Palisades, Los Angeles, California, USA",,,,
453,/title/tt0322330/,Freaky Friday,"Pacific Palisades, Los Angeles, California, USA",,"Pacific Palisades, Los Angeles, Los Angeles County, California, United States of America",34.0480643,-118.5264706
454,/title/tt2494280/,Stretch,"Bardot, 1737 N.Vine St.., Hollywood, California, USA",(Nightclub)                        ,,,
455,/title/tt1987680/,The Upside,"Gilham Street, Philadelphia, Pennsylvania, USA",(location)                        ,"Gilham Street, Lawndale, Philadelphia, Philadelphia County, Pennsylvania, 19012, United States of America",40.052532,-75.095287
456,/title/tt1987680/,The Upside,"Hawk Mountain Sanctuary, Eckville, Pennsylvania, USA",(Scenic overlook w/ hang gliders)                        ,"Hawk Mountain Sanctuary, Eckville, Albany Township, Berks County, Pennsylvania, United States of America",40.6356471,-75.9867623
457,/title/tt1987680/,The Upside,"XIX Restaurant, Bellevue Hotel, Philadelphia, Pennsylvania, USA",(location)                        ,,,
458,/title/tt1987680/,The Upside,"Sun Center Studios, Aston, Pennsylvania, USA",(studio)                        ,,,
459,/title/tt1987680/,The Upside,"Kensington Avenue, Philadelphia, Pennsylvania, USA",(street scenes)                        ,"Kensington Avenue, Northwood, Philadelphia, Philadelphia County, Pennsylvania, 19124, United States of America",40.0078347,-75.0927788
460,/title/tt1987680/,The Upside,"New York City, New York, USA",,"New York, United States of America",40.7127281,-74.0060152
461,/title/tt6317068/,Final Space,"New York City, New York, USA",(on location)                        ,"New York, United States of America",40.7127281,-74.0060152
462,/title/tt0094137/,3 Men and a Baby,"Toronto, Ontario, Canada",,"Toronto, Peel, Golden Horseshoe, Ontario, Canada",43.6534817,-79.3839347
463,/title/tt0094137/,3 Men and a Baby,"Manhattan, New York City, New York, USA",,"Manhattan, New York County, New York, United States of America",40.7896239,-73.9598939
464,/title/tt0094137/,3 Men and a Baby,"Scotia Plaza, Toronto, Ontario, Canada",(Construction site that Peter visits is Scotia Plaza being built)                        ,"Scotia Plaza, 40, King Street West, Commerce Court, Old Toronto, Toronto, Peel, Golden Horseshoe, Ontario, M5H 1H1, Canada",43.6494883,-79.37955671553408
465,/title/tt2268016/,Magic Mike XXL,"Tybee Island, Georgia, USA",(Mike's beach rental house at the corner of Solomon and 2nd Avenue)                        ,"Tybee Island, Chatham County, Georgia, 31328, United States of America",31.9987321,-80.8469427
466,/title/tt2268016/,Magic Mike XXL,"Myrtle Beach, South Carolina, USA",,"Myrtle Beach, Horry County, South Carolina, United States of America",33.6956461,-78.8900409
467,/title/tt2268016/,Magic Mike XXL,"Jekyll Island, Georgia, USA",(Jekyll Island Convention Center - Stripper Convention Exterior)                        ,"Jekyll Island, Glynn County, Georgia, 31527, United States of America",31.0655982,-81.41431464659931
468,/title/tt2268016/,Magic Mike XXL,"Tybee Island, Georgia, USA",(Dunes Inn & Suites located at 1409 Butler Avenue) (pool party & hotel room scenes)                        ,"Tybee Island, Chatham County, Georgia, 31328, United States of America",31.9987321,-80.8469427
469,/title/tt2268016/,Magic Mike XXL,"Savannah, Georgia, USA",(Gentlemen's Club located on Montgomery Cross Road) (Mad Mary's Drag Club scene)                        ,"Savannah, Chatham County, Georgia, United States of America",32.0809263,-81.0911768
470,/title/tt0852713/,The House Bunny,"University of Southern California, Los Angeles, California, USA",,"University of Southern California, Flower Street, University Park, Los Angeles, Los Angeles County, California, 90089-0871, United States of America",34.0218833,-118.28586726915088
471,/title/tt0852713/,The House Bunny,"Playboy Mansion - 10236 Charing Cross Road, Holmby Hills, Los Angeles, California, USA",,,,
472,/title/tt0852713/,The House Bunny,"Farmers Market - 6333 W. 3rd Street, Fairfax, Los Angeles, California, USA",,,,
473,/title/tt0852713/,The House Bunny,"Holmby Hills, Los Angeles, California, USA",,,,
474,/title/tt0852713/,The House Bunny,"Sun Valley, California, USA",,"Sun Valley, Los Angeles, Los Angeles County, California, 91352, United States of America",34.2175042,-118.3703576
475,/title/tt0852713/,The House Bunny,USA,,United States,39.7837304,-100.4458825
476,/title/tt3165612/,Sleeping with Other People,"New York City, New York, USA",,"New York, United States of America",40.7127281,-74.0060152
477,/title/tt3165612/,Sleeping with Other People,"New York, USA",,"New York, United States of America",40.7127281,-74.0060152
478,/title/tt1255919/,Holmes & Watson,"Hampton Court Palace, East Molesey, Surrey, England, UK",(location)                        ,,,
479,/title/tt1255919/,Holmes & Watson,"The Historic Dockyard Chatham, Chatham, Kent, England, UK",(location)                        ,,,
480,/title/tt0097758/,Little Monsters,"Wilmington, North Carolina, USA",,"Wilmington, New Hanover County, North Carolina, United States of America",34.2257282,-77.9447107
481,/title/tt0097758/,Little Monsters,USA,,United States,39.7837304,-100.4458825
482,/title/tt0097758/,Little Monsters,"Wilmington National Cemetery - 2011 Market Street, Wilmington, North Carolina, USA",(Eric dares Brian)                        ,,,
483,/title/tt0097758/,Little Monsters,"1703 Princess Street, Wilmington, North Carolina, USA",(Todd's house)                        ,"1703, Princess Street, Princess Place, Wilmington, New Hanover County, North Carolina, 28405, United States of America",34.23828008163265,-77.92758146938775
484,/title/tt0097758/,Little Monsters,"Stage 4, Screen Gems Studios - 1223 North 23rd Street, Wilmington, North Carolina, USA",(Stevenson house interiors; monsters attempting to scare baby)                        ,,,
485,/title/tt0097758/,Little Monsters,"Forest Hills Global Elementary - 602 Colonial Drive, Wilmington, North Carolina, USA",(school)                        ,,,
486,/title/tt0097758/,Little Monsters,"Roanoke Cement Factory - 6411 Ideal Cement Road, Castle Hayne, North Carolina, USA",(The Underworld)                        ,,,
487,/title/tt0097758/,Little Monsters,"Boston, Massachusetts, USA",,"Boston, Suffolk County, Massachusetts, United States of America",42.3602534,-71.0582912
488,/title/tt1950235/,Let It Snow,"Brantford, Ontario, Canada",,"Brantford, Southwestern Ontario, Ontario, N3T 2M3, Canada",43.1408157,-80.2631733
489,/title/tt1950235/,Let It Snow,"Toronto, Ontario, Canada",,"Toronto, Peel, Golden Horseshoe, Ontario, Canada",43.6534817,-79.3839347
490,/title/tt1950235/,Let It Snow,"Pinewood Toronto Studios, Port Lands, Toronto, Ontario, Canada",(studio)                        ,"Pinewood Toronto Studios, Munition Street, Toronto—Danforth, Old Toronto, Toronto, Peel, Golden Horseshoe, Ontario, M4M 3P2, Canada",43.6465663,-79.35106457413957
491,/title/tt1528071/,Horns,"Vancouver, British Columbia, Canada",,"Vancouver, Metro Vancouver Regional District, British Columbia, Canada",49.2608724,-123.1139529
492,/title/tt1528071/,Horns,"32786 Lougheed Hwy, Mission, British Columbia, Canada",(Eve's Diner Scenes)                        ,"Lougheed Highway, Silverdale, Mission, British Columbia, V4S 1H7, Canada",49.1639786,-122.4061005
493,/title/tt1528071/,Horns,Canada,,Canada,61.0666922,-107.9917071
494,/title/tt0095631/,Midnight Run,New Zealand,(river scene)                        ,New Zealand / Aotearoa,-41.5000831,172.8344077
495,/title/tt0095631/,Midnight Run,"Upper Salt River Canyon, Arizona, USA",,,,
496,/title/tt0095631/,Midnight Run,"Williams, Arizona, USA",,"Williams, Coconino County, Arizona, United States of America",35.2503394,-112.1869481
497,/title/tt0095631/,Midnight Run,"Cornville, Arizona, USA",,"Cornville, Yavapai County, Arizona, United States of America",34.7395165,-111.9058275625
498,/title/tt0095631/,Midnight Run,"Flagstaff, Arizona, USA",,"Flagstaff, Coconino County, Arizona, United States of America",35.1987522,-111.6518229
499,/title/tt0095631/,Midnight Run,"New York City, New York, USA",,"New York, United States of America",40.7127281,-74.0060152
500,/title/tt0095631/,Midnight Run,"Amtrack Railroad Station - 598 Dey Street, Niles, Michigan, USA",,,,
501,/title/tt0095631/,Midnight Run,"Clarkdale, Arizona, USA",,"Clarkdale, Yavapai County, Arizona, 86324, United States of America",34.7711319,-112.0579367
502,/title/tt0095631/,Midnight Run,"Las Vegas, Nevada, USA",,"Las Vegas, Clark County, Nevada, United States of America",36.1672559,-115.1485163
503,/title/tt0095631/,Midnight Run,"Michigan Central Railroad Niles Depot, Niles, Michigan, USA",,,,
504,/title/tt0095631/,Midnight Run,"Lake Mead, Nevada, USA",,"Lake Mead, Boulder City, Clark County, Nevada, United States of America",36.217208150000005,-114.4109763071589
505,/title/tt0109445/,Clerks,"Quick Stop Groceries - 58 Leonard Avenue, Leonardo, New Jersey, USA",,,,
506,/title/tt0109445/,Clerks,"Comic World - 1690 Route 38, Mount Holly, New Jersey, USA",,,,
507,/title/tt0109445/,Clerks,"Leonard Avenue, Leonardo, New Jersey, USA",,,,
508,/title/tt0109445/,Clerks,"Leonardo, New Jersey, USA",,"Leonardo, Henry Hudson Bike Trail, Leonardo, Middletown Township, Monmouth, New Jersey, 07737, United States of America",40.420418999999995,-74.06045445356699
509,/title/tt0109445/,Clerks,USA,,United States,39.7837304,-100.4458825
510,/title/tt0109445/,Clerks,"Red Bank, New Jersey, USA",,"Red Bank, New Jersey, United States of America",40.3470543,-74.0643065
511,/title/tt0109707/,Ed Wood,"Hollywood United Methodist Church - North Campus - 4301 Cahuenga Blvd, Toluca Lake, Los Angeles, California, USA",,,,
512,/title/tt0109707/,Ed Wood,"Tower Theatre - 802 S. Broadway, Downtown, Los Angeles, California, USA",(theater interior used to represent Pantages Theater interior)                        ,"Tower Theatre, 802, South Broadway, Historic Core District, Downtown, Los Angeles, Los Angeles County, California, 90013, United States of America",34.043458799999996,-118.25452018117771
513,/title/tt0109707/,Ed Wood,"Ambassador Hotel - 3400 Wilshire Boulevard, Los Angeles, California, USA",,,,
514,/title/tt0109707/,Ed Wood,"Downtown, Los Angeles, California, USA",,"Downtown, Los Angeles, Los Angeles County, California, United States of America",34.0428494,-118.2476732
515,/title/tt0109707/,Ed Wood,"Gardena, California, USA",,"Gardena, Los Angeles County, California, United States of America",33.8963593,-118.3053037
516,/title/tt0109707/,Ed Wood,"Long Beach, California, USA",,"Long Beach, Los Angeles County, California, United States of America",33.7690164,-118.1916048
517,/title/tt0109707/,Ed Wood,"Norwalk, California, USA",,"Norwalk, Los Angeles County, California, United States of America",33.9092802,-118.0849169
518,/title/tt0109707/,Ed Wood,"Pantages Theater - 6233 Hollywood Blvd., Hollywood, Los Angeles, California, USA",,"Pantages Theater, Walk of Fame, Whitley Heights Historic District, Hollywood, Los Angeles, Los Angeles County, California, 90028-5420, United States of America",34.1022047,-118.32576733237735
519,/title/tt0109707/,Ed Wood,"California, USA",,"California, United States of America",36.7014631,-118.7559974
520,/title/tt5761496/,Get Shorty,"Albuquerque, New Mexico, USA",,"Albuquerque, Bernalillo County, New Mexico, United States of America",35.0841034,-106.6509851
521,/title/tt0817230/,Valentine's Day,"Pacific Ave & N Venice Blvd., Venice, Los Angeles, California, USA",,,,
522,/title/tt0817230/,Valentine's Day,"Marriott Hotel - 4100 Admiralty Way, Marina del Rey, California, USA",(Rooftop)                        ,"Marina del Rey Marriott, 4100, Admiralty Way, Marina del Rey, Los Angeles County, California, 90292, United States of America",33.9821995,-118.46018866262813
523,/title/tt0817230/,Valentine's Day,"Marina del Rey, California, USA",,"Marina del Rey, Los Angeles County, California, 90292, United States of America",33.9776848,-118.4486479
524,/title/tt0817230/,Valentine's Day,"University High School - 11800 Texas Avenue, West Los Angeles, Los Angeles, California, USA",,,,
525,/title/tt0817230/,Valentine's Day,"Los Angeles, California, USA",,"Los Angeles, Los Angeles County, California, United States of America",34.0536909,-118.2427666
526,/title/tt0817230/,Valentine's Day,"Beverly Hills, California, USA",,"Beverly Hills, Los Angeles County, California, United States of America",34.0696501,-118.3963062
527,/title/tt0817230/,Valentine's Day,"The Bistro Garden - 12950 Ventura Boulevard, Studio City, Los Angeles, California, USA",,,,
528,/title/tt0783234/,The Baker,"Grosmont, Abergavenny, Gwent, Wales, UK",,,,
529,/title/tt0783234/,The Baker,"Monmouthshire, Wales, UK",,"Monmouthshire, Cymru / Wales, United Kingdom",51.7501058,-2.8333331
530,/title/tt0783234/,The Baker,"London, England, UK",,"London, Greater London, England, United Kingdom",51.5073219,-0.1276474
531,/title/tt1412386/,The Best Exotic Marigold Hotel,"Jaipur, Rajasthan, India","(Railway Station, The Airport and a lot of sightseeing places. The hotel was located in Jaipur as described in the movie.)                        ","Jaipur, Jaipur Tehsil, Jaipur, Rajasthan, 302001, India",26.916194,75.820349
532,/title/tt1412386/,The Best Exotic Marigold Hotel,"Udaipur, Rajasthan, India",,"Udaipur, Rajasthan, 313001, India",24.578721,73.6862571
533,/title/tt1412386/,The Best Exotic Marigold Hotel,India,,India,22.3511148,78.6677428
534,/title/tt8526872/,Dolemite Is My Name,"2636 East Colorado Boulevard, Pasadena, California, USA",(Dolphin Record Shop)                        ,"Poo-Bah Record Shop, 2636, East Colorado Boulevard, Lamanda Park, Pasadena, Los Angeles County, California, 91107, United States of America",34.1459454,-118.095953
535,/title/tt8526872/,Dolemite Is My Name,"2208 West 11th Street, Los Angeles, California, USA",(Dunbar Hotel - Exteriors)                        ,"2208, West 11th Street, Alvarado Terrace Historic District, Pico-Union, Los Angeles, Los Angeles County, California, 90006, United States of America",34.050786816326536,-118.28213991836735
536,/title/tt0058815/,I Dream of Jeannie,"Dryden Flight Research Center, Edwards Air Force Base, California, USA",(offices)                        ,,,
537,/title/tt0058815/,I Dream of Jeannie,"Columbia/Warner Bros. Ranch - 411 North Hollywood Way, Burbank, California, USA",,,,
538,/title/tt6107796/,Schemers,"Dundee, Scotland, UK",,"Dundee, Dundee City, Scotland, DD1 1SA, United Kingdom",56.4605938,-2.97019
539,/title/tt0084805/,Tootsie,"Hurley, New York, USA",,"Hurley, Town of Hurley, Ulster County, New York, United States of America",41.915060499999996,-74.06112642506818
540,/title/tt0084805/,Tootsie,"National Video Center - 460 W. 42nd Street, Manhattan, New York City, New York, USA",,,,
541,/title/tt0084805/,Tootsie,"New York City, New York, USA",,"New York, United States of America",40.7127281,-74.0060152
542,/title/tt1583607/,Hot in Cleveland,"CBS Studio Center - 4024 Radford Avenue, Studio City, Los Angeles, California, USA",,,,
543,/title/tt2989524/,Carrie Pilby,"New York, USA",,"New York, United States of America",40.7127281,-74.0060152
544,/title/tt0101587/,City Slickers,"Ghost Ranch, Abiquiu, New Mexico, USA",,,,
545,/title/tt0101587/,City Slickers,"Nambe Pueblo, Nambe, New Mexico, USA",,,,
546,/title/tt0101587/,City Slickers,"New Mexico, USA",,"New Mexico, United States of America",34.5708167,-105.993007
547,/title/tt0101587/,City Slickers,"Pamplona, Navarra, Spain",,"Pamplona/Iruña, Navarra - Nafarroa, España",42.8184538,-1.6442556
548,/title/tt0101587/,City Slickers,"Santa Clara Pueblo, Santa Clara, New Mexico, USA",,,,
549,/title/tt0101587/,City Slickers,"Colorado, USA",,"Colorado, United States of America",38.7251776,-105.6077167
550,/title/tt0101587/,City Slickers,"Santa Fe, New Mexico, USA",,"Santa Fe, Santa Fe County, New Mexico, United States of America",35.6869996,-105.9377997
551,/title/tt0101587/,City Slickers,"New York City, New York, USA",,"New York, United States of America",40.7127281,-74.0060152
552,/title/tt0101587/,City Slickers,USA,,United States,39.7837304,-100.4458825
553,/title/tt1490017/,De Lego Film,"Fox Studios, Moore Park, Sydney, New South Wales, Australia",,"Fox Studios Australia, Moore Park, Sydney, Council of the City of Sydney, New South Wales, 2021, Australia",-33.890960899999996,151.22750517838074
554,/title/tt1490017/,De Lego Film,"Boston, Massachusetts, USA",,"Boston, Suffolk County, Massachusetts, United States of America",42.3602534,-71.0582912
555,/title/tt0075592/,Tales of the Unexpected,"Montego Bay, Cornwall, Jamaica",,"Montego Bay, Saint James, Cornwall County, Jamaika",18.4724603,-77.9217357
556,/title/tt0075592/,Tales of the Unexpected,"Anglia Television, Norwich, Norfolk, England, UK",(studio)                        ,"Anglia Television, Agricultural Hall Plain, Lakenham, Norwich, Norfolk, East of England, England, NR1 3JG, United Kingdom",52.62884525,1.298411806348859
557,/title/tt5304992/,Set It Up,"New York City, New York, USA",,"New York, United States of America",40.7127281,-74.0060152
558,/title/tt0100395/,Postcards from the Edge,"Los Angeles, California, USA",,"Los Angeles, Los Angeles County, California, United States of America",34.0536909,-118.2427666
559,/title/tt0098384/,Steel Magnolias,"Taylor House - 320 Jefferson, Natchitoches, Louisiana, USA",,,,
560,/title/tt0098384/,Steel Magnolias,"Louisiana, USA",,"Louisiana, United States of America",30.8703881,-92.007126
561,/title/tt0368975/,Sleepover,"Long Beach Polytechnic High School - 1600 Atlantic Avenue, Long Beach, California, USA",(School Hallways)                        ,,,
562,/title/tt0108981/,The Vicar of Dibley,"Turville, Buckinghamshire, England, UK",(Dibley Exteriors)                        ,"Turville, Buckinghamshire, South East, England, RG9 6QL, United Kingdom",51.6138294,-0.8929779
563,/title/tt0467421/,Twitches,"Casa Loma, 1 Austin Terrace, Toronto, Ontario, Canada",(Coventry)                        ,"Casa Loma, 1, Austin Terrace, Toronto—St. Paul's, Old Toronto, Toronto, Peel, Golden Horseshoe, Ontario, M5R 1X9, Canada",43.6781015,-79.409415775
564,/title/tt0069602/,Last of the Summer Wine,"Hollowgate, Holmfirth, West Yorkshire, England, UK",(Nora Batty's and Compo's houses)                        ,"Hollowgate, Cliff, Holme Valley, Kirklees, West Yorkshire, Yorkshire and the Humber, England, HD9 3JH, United Kingdom",53.5693886,-1.7888813
565,/title/tt0069602/,Last of the Summer Wine,"Holmfirth, West Yorkshire, England, UK",,"Holmfirth, Kirklees, West Yorkshire, Yorkshire and the Humber, England, HD9 7DE, United Kingdom",53.5703517,-1.7870301
566,/title/tt0069602/,Last of the Summer Wine,"Marsden, West Yorkshire, England, UK",,"Marsden, Kirklees, West Yorkshire, Yorkshire and the Humber, England, HD7 6BX, United Kingdom",53.6007726,-1.9279026
567,/title/tt0069602/,Last of the Summer Wine,"BBC Television Centre, Wood Lane, Shepherd's Bush, London, England, UK",(1973-1990)                        ,,,
568,Code,Show Name,Location,Scene,"Location, Tucker County, West Virginia, United States of America",39.2138905,-79.6371124
569,/title/tt2404311/,Malavita,"Gacé, Orne, France",,"Gacé, Mortagne-au-Perche, Orne, Normandie, France métropolitaine, 61230, France",48.79436,0.2954592
570,/title/tt2404311/,Malavita,"Paris, France",,"Paris, Île-de-France, France métropolitaine, France",48.8566969,2.3514616
571,/title/tt2404311/,Malavita,"New York City, New York, USA",,"New York, United States of America",40.7127281,-74.0060152
572,/title/tt2404311/,Malavita,"Studios de Paris, La Cité du Cinéma, Saint-Denis, Seine-Saint-Denis, France",,,,
573,/title/tt1077258/,Planet Terror,"Tulum, Quintana Roo, Mexico",,"Zona Arqueológica de Tulum, Avenida Ruinas Tulum, Tulum, Quintana Roo, 77780, México",20.2152358,-87.42953531439221
574,/title/tt1077258/,Planet Terror,"Luling, Texas, USA",,"Luling, Caldwell County, Texas, 78468, United States of America",29.680314,-97.6473265
575,/title/tt1077258/,Planet Terror,USA,,United States,39.7837304,-100.4458825
576,/title/tt0119303/,Home Alone 3,"3026 Normandy Pl., Evanston, Illinois, USA",(The family's house)                        ,"3026, Normandy Place, Evanston, Evanston Township, Cook County, Illinois, 60201, United States of America",42.0574945,-87.7192048
577,/title/tt0119303/,Home Alone 3,"2621 Noyes Street, Evanston, Illinois, USA",(The hideout)                        ,"2621, Noyes Street, Evanston, Evanston Township, Cook County, Illinois, 60201, United States of America",42.0582235,-87.7104849
578,/title/tt0119303/,Home Alone 3,"3023 Normandy Place, Evanston, Illinois, USA",(The other neighbor's house)                        ,"3023, Normandy Place, Evanston, Evanston Township, Cook County, Illinois, 60201, United States of America",42.05784649665317,-87.71879866589559
579,/title/tt0119303/,Home Alone 3,"San Francisco, California, USA",,"San Francisco, San Francisco City and County, California, United States of America",37.7790262,-122.4199061
580,/title/tt0119303/,Home Alone 3,Hong Kong,,"香港島 Hong Kong Island, 香港 Hong Kong, China 中国",22.2793278,114.1628131
