,Code,Show Name,Location,Scene,geocodedLocation,latitude,longitude
1262,/title/tt0243736/,40 Days and 40 Nights,"Golden Gate Bridge Pavilion, San Francisco, California, USA",(opening sequence)                        ,,,
1263,/title/tt0243736/,40 Days and 40 Nights,"Haight St, San Francisco, California, USA",(opening sequence)                        ,"Haight Street, Lower Haight, San Francisco, San Francisco City and County, California, 94143, United States of America",37.7716433,-122.4341705
1264,/title/tt0243736/,40 Days and 40 Nights,"Grant Ave, San Francisco, California, USA",(street scenes)                        ,"Grant Avenue, North Beach, San Francisco, San Francisco City and County, California, 94113, United States of America",37.8015732,-122.40779
1265,/title/tt0243736/,40 Days and 40 Nights,"Pier 9, The Embarcadero, San Francisco, California, USA",(CyberNanny's office)                        ,"Pier 9, The Embarcadero, Northeast Waterfront Historic District, San Francisco, San Francisco City and County, California, 94111, United States of America",37.800791399999994,-122.3965530928354
1266,/title/tt0243736/,40 Days and 40 Nights,"Caffe Trieste - 601 Vallejo St, San Francisco, California, USA",,"Caffe Trieste, 601, Vallejo Street, North Beach, San Francisco, San Francisco City and County, California, 94133, United States of America",37.7986305,-122.4073519
1267,/title/tt0243736/,40 Days and 40 Nights,"Southern Heights Ave. & 22nd St., San Francisco, California, USA",(Character's Apartment)                        ,,,
1268,/title/tt0086856/,The Adventures of Buckaroo Banzai Across the 8th Dimension,"Lake View Medical Center - 11600 Eldridge Avenue, Lake View Terrace, Los Angeles, California, USA",(hospital)                        ,,,
1269,/title/tt0086856/,The Adventures of Buckaroo Banzai Across the 8th Dimension,"Rabbit Dry Lake, Lucerne Valley, California, USA",(Texas Vista test site - end)                        ,,,
1270,/title/tt0086856/,The Adventures of Buckaroo Banzai Across the 8th Dimension,"757 Kingman Avenue, Santa Monica Canyon, Pacific Palisades, Los Angeles, California, USA",(Buckaroo's House)                        ,,,
1271,/title/tt0086856/,The Adventures of Buckaroo Banzai Across the 8th Dimension,"El Mirage Dry Lake, California, USA",(Texas Vista test site - start)                        ,"El Mirage Dry Lake, Alegre Lane, San Bernardino County, California, United States of America",34.642436599999996,-117.59821798766575
1272,/title/tt0086856/,The Adventures of Buckaroo Banzai Across the 8th Dimension,"Sepulveda VA Hospital - 16111 Plummer, Sepulveda, Los Angeles, California, USA",(President's hospital room)                        ,,,
1273,/title/tt0086856/,The Adventures of Buckaroo Banzai Across the 8th Dimension,"Venice Jail - 685 Venice Blvd., Venice, Los Angeles, California, USA",(New Brunswick Police Station)                        ,,,
1274,/title/tt0086856/,The Adventures of Buckaroo Banzai Across the 8th Dimension,"ARMCO Steel Plant - 524 Border Avenue, Torrance, California, USA",(Lectoid launch hanger at Yoyodyne Propulsion)                        ,,,
1275,/title/tt0086856/,The Adventures of Buckaroo Banzai Across the 8th Dimension,"Bill Brothers Bldg - 440 Seaton Street, Downtown, Los Angeles, California, USA",(Nightclub)                        ,,,
1276,/title/tt0086856/,The Adventures of Buckaroo Banzai Across the 8th Dimension,"VA Hospital - 11301 Wilshire Blvd., Brentwood, Los Angeles, California, USA",(Home for the Criminally Insane)                        ,,,
1277,/title/tt0086856/,The Adventures of Buckaroo Banzai Across the 8th Dimension,"Bethlehem Steel Corporation - 3300 E. Slauson Avenue, Vernon, California, USA",(Banzai Institute Laboratory)                        ,,,
1278,/title/tt0276751/,About a Boy,"Lady Margaret Road, Kentish Town, London, England, UK",,,,
1279,/title/tt0276751/,About a Boy,"Notting Hill, London, England, UK",,"Notting Hill, Royal Borough of Kensington and Chelsea, London, Greater London, England, W11 2PA, United Kingdom",51.5109995,-0.2055267
1280,/title/tt0276751/,About a Boy,"St James Walk, Clerkenwell, London, England, UK",(Will's apartment)                        ,,,
1281,/title/tt0276751/,About a Boy,"Bayswater, London, England, UK",,"Bayswater, Poplar Place, Bayswater, City of Westminster, London, Greater London, England, W2, United Kingdom",51.5122764,-0.1883854
1282,/title/tt0276751/,About a Boy,"Southfields, London, England, UK",,"Southfields, Crowthorne Close, Southfields, London Borough of Wandsworth, London, Greater London, England, SW18 5RX, United Kingdom",51.4457751,-0.2066142
1283,/title/tt0276751/,About a Boy,"St James C of E Church, Clerkenwell Close, Clerkenwell, London, England, UK",(Will decides not to volunteer)                        ,,,
1284,/title/tt0276751/,About a Boy,"31 Oseney Crescent, Kentish Town, London, England, UK",(Fiona and Marcus' house)                        ,"Oseney Crescent, Kentish Town, London Borough of Camden, London, Greater London, England, NW5 2BD, United Kingdom",51.5477412,-0.1338711
1285,/title/tt0276751/,About a Boy,"Acton Town Hall, Winchester Street, London, England, UK",(Talent show)                        ,,,
1286,/title/tt0276751/,About a Boy,"Clerkenwell, London, England, UK",,"Clerkenwell, London Borough of Islington, London, Greater London, England, EC1R 0EA, United Kingdom",51.5237268,-0.1055555
1287,/title/tt0276751/,About a Boy,"Hanway Place, Fitzrovia, London, England, UK",,"Hanway Place, Fitzrovia, City of Westminster, London, Greater London, England, W1T 1UB, United Kingdom",51.5169254,-0.1314992
1288,/title/tt0276751/,About a Boy,"Oseney Crescent, Kentish Town, London, England, UK",,"Oseney Crescent, Kentish Town, London Borough of Camden, London, Greater London, England, NW5 2BD, United Kingdom",51.5477412,-0.1338711
1289,/title/tt0276751/,About a Boy,"Scotswood Street, Clerkenwell, London, England, UK",,"Scotswood Street, Clerkenwell Green, Clerkenwell, London Borough of Islington, London, Greater London, England, EC1R 0AU, United Kingdom",51.5240311,-0.1061226
1290,/title/tt0276751/,About a Boy,"Shepperton Studios, Shepperton, Surrey, England, UK",,,,
1291,/title/tt3874544/,The Boss Baby,"Glendale, California, USA",(DreamWorks Animation)                        ,"Glendale, Los Angeles County, California, United States of America",34.1469416,-118.2478471
1292,/title/tt0065421/,The AristoCats,"Walt Disney Feature Animation - 500 S. Buena Vista Street, Burbank, California, USA",,,,
1293,/title/tt0838221/,The Darjeeling Limited,"Osian, Rajasthan, India",(train stopped in desert scene)                        ,"Osian Tehsil, Jodhpur District, Rajasthan, 342303, India",26.8752018,72.83939473074892
1294,/title/tt0838221/,The Darjeeling Limited,"Jodhpur, Rajasthan, India",,"Jodhpur, Jodhpur Tehsil, Jodhpur District, Rajasthan, India",26.2967719,73.0351433
1295,/title/tt0838221/,The Darjeeling Limited,"Long Island, New York, USA",,"Long Island, Suffolk County, New York, United States of America",40.85172235,-73.09921882199973
1296,/title/tt0095159/,A Fish Called Wanda,"Bermondsey, London, England, UK",(Archie & Wanda's apartment)                        ,"Bermondsey, London Borough of Southwark, London, Greater London, England, SE16 4DB, United Kingdom",51.4970125,-0.063268
1297,/title/tt0095159/,A Fish Called Wanda,"Clerkenwell Green, Clerkenwell, London, England, UK",(Mrs. Coady walks her dogs exterior scenes)                        ,"Clerkenwell Green, Clerkenwell, London Borough of Islington, London, Greater London, England, EC1R 0EG, United Kingdom",51.5230119,-0.1051077
1298,/title/tt0095159/,A Fish Called Wanda,"Aubrey House, Maida Avenue, Maida Vale, London, England, UK",(Ken's apartment)                        ,"Aubrey House, 7, Maida Avenue, Paddington, City of Westminster, London, Greater London, England, W2 1TQ, United Kingdom",51.5236185,-0.17777140140889713
1299,/title/tt0095159/,A Fish Called Wanda,"St Thomas Street, Oxford, Oxfordshire, England, UK",,"St Thomas Street, St Thomas', City Centre, Oxford, Oxfordshire, South East, England, OX1 1JR, United Kingdom",51.751768,-1.2659266
1300,/title/tt0095159/,A Fish Called Wanda,"Twickenham Film Studios, St Margarets, Twickenham, Middlesex, England, UK",(studio)                        ,,,
1301,/title/tt0095159/,A Fish Called Wanda,"Lincoln's Inn, New Square, London, England, UK",(Archie's legal office)                        ,"Lincoln's Inn, Cursitor Street, City of London, Greater London, England, EC4, United Kingdom",51.51565625,-0.11216006513421142
1302,/title/tt0095159/,A Fish Called Wanda,"Culvert Place, London, England, UK",(The Hideout)                        ,"Culvert Place, Clapham Junction, London Borough of Wandsworth, London, Greater London, England, SW11 5AY, United Kingdom",51.4702233,-0.1564247
1303,/title/tt0095159/,A Fish Called Wanda,"Little Venice, Paddington, London, England, UK",,,,
1304,/title/tt0095159/,A Fish Called Wanda,"Old Bailey, London, England, UK",,"Central Criminal Court, Warwick Square, Blackfriars, City of London, Greater London, England, EC4M 7BP, United Kingdom",51.515687400000004,-0.10172235021586998
1305,/title/tt0095159/,A Fish Called Wanda,"St John's Gate, Clerkenwell, London, England, UK",(Ken disposes of the evidence)                        ,"St John's Gate, Farringdon, Clerkenwell, London Borough of Islington, London, Greater London, England, EC1M 4PP, United Kingdom",51.5220042,-0.10274906217249638
1306,/title/tt0095159/,A Fish Called Wanda,"Richmond Magistrates Court, The Court House, Parkshot, Richmond, England, UK",(Outside court scene)                        ,,,
1307,/title/tt0095159/,A Fish Called Wanda,"Reed's Wharf, Mill Street, London, England, UK",(Hanging in the window scene)                        ,"Reeds Wharf, 33, Mill Street, Butler's Wharf, Bermondsey, London Borough of Southwark, London, Greater London, England, SE16 4TG, United Kingdom",51.501979250000005,-0.07009439596854411
1308,/title/tt0109254/,Beverly Hills Cop III,"Paramount's Great America Amusement Park, Great America Parkway, Santa Clara, California, USA",(Wonderworld Amusement Park)                        ,,,
1309,/title/tt0109254/,Beverly Hills Cop III,"Stage 50, Universal Studios - 100 Universal City Plaza, Universal City, California, USA",(Alien Attack ride)                        ,,,
1310,/title/tt0109254/,Beverly Hills Cop III,"Detroit, Michigan, USA",,"Detroit, Wayne County, Michigan, United States of America",42.3315509,-83.0466403
1311,/title/tt0109254/,Beverly Hills Cop III,"City Hall - 455 N. Rexford Drive, Beverly Hills, California, USA",(Police Station)                        ,,,
1312,/title/tt0109254/,Beverly Hills Cop III,"Pasadena, California, USA",,"Pasadena, Los Angeles County, California, United States of America",34.1476452,-118.1444779
1313,/title/tt0109254/,Beverly Hills Cop III,"Santa Monica Beach, Santa Monica, California, USA",,"Hotel Carmel, 201, Broadway, Santa Monica, Los Angeles County, California, 90401, United States of America",34.0137654,-118.4954584
1314,/title/tt0109254/,Beverly Hills Cop III,"Beverly Hills Police Department - 464 N Rexford Drive, Beverly Hills, California, USA",,,,
1315,/title/tt0307453/,Shark Tale,"Los Angeles, California, USA",,"Los Angeles, Los Angeles County, California, United States of America",34.0536909,-118.2427666
1316,/title/tt2084712/,Young & Hungry,"CBS Studio Center - 4024 Radford Avenue, Studio City, Los Angeles, California, USA",(studio)                        ,,,
1317,/title/tt0178737/,Mansfield Park,"Kirby Hall, Corby, Northamptonshire, England, UK",(Mansfield Park)                        ,"Kirby Hall, Kirby Lane, Deene, Corby, Northamptonshire, East Midlands, England, NN17 3EN, United Kingdom",52.5245263,-0.6368262702140142
1318,/title/tt0178737/,Mansfield Park,"Charlestown, Cornwall, England, UK",(Portsmouth)                        ,"Charlestown, Cornwall, South West England, England, PL25 3AJ, United Kingdom",50.3329873,-4.7577601
1319,/title/tt0178737/,Mansfield Park,"Eton College, Eton, Berkshire, England, UK",(library)                        ,,,
1320,/title/tt0178737/,Mansfield Park,"Fenton House, Windmill Hill, Hampstead, London, England, UK",,,,
1321,/title/tt0178737/,Mansfield Park,"Portsmouth, Hampshire, England, UK",,"Portsmouth, South East, England, PO1 5QH, United Kingdom",50.8036831,-1.075614
1322,/title/tt8518136/,Dickinson,"Brooklyn, New York, USA",,"Brooklyn, Kings County, New York, United States of America",40.6501038,-73.9495823
1323,/title/tt0787475/,Hot Rod,"Pemberton Avenue, North Vancouver, British Columbia, Canada",,"Pemberton Avenue, Norgate, District of North Vancouver, Metro Vancouver Regional District, British Columbia, V7P, Canada",49.3170275,-123.1079313
1324,/title/tt0787475/,Hot Rod,"North Burnaby, British Columbia, Canada",,"Royal Canadian Legion - Branch 148 (North Burnaby) [Site], 4356, Hastings Street, Burnaby Heights, Burnaby, Metro Vancouver Regional District, British Columbia, V5C 2J6, Canada",49.2807911,-123.007004
1325,/title/tt0787475/,Hot Rod,"50's Drive In, Burnaby, British Columbia, Canada",(burger stand scenes)                        ,,,
1326,/title/tt0787475/,Hot Rod,"Vancouver, British Columbia, Canada",,"Vancouver, Metro Vancouver Regional District, British Columbia, Canada",49.2608724,-123.1139529
1327,/title/tt0787475/,Hot Rod,"Sir Charles Tupper Secondary School - 419 East 24th Avenue, Vancouver, British Columbia, Canada",(Auditorium)                        ,"Sir Charles Tupper Secondary School, East 24th Avenue, Riley Park, Vancouver, Metro Vancouver Regional District, British Columbia, V5V 3P2, Canada",49.249646549999994,-123.09533492699057
1328,/title/tt8129006/,Central Park,"New York City, New York, USA",(main location)                        ,"New York, United States of America",40.7127281,-74.0060152
1329,/title/tt8045468/,Run,"Toronto, Ontario, Canada",,"Toronto, Peel, Golden Horseshoe, Ontario, Canada",43.6534817,-79.3839347
1330,/title/tt2503944/,Burnt,"The Langham Hotel, Regent Street, Marylebone London, England, UK",,,,
1331,/title/tt2503944/,Burnt,"New Orleans, Louisiana, USA",,"New Orleans, Orleans Parish, Louisiana, United States of America",29.9499323,-90.0701156
1332,/title/tt2503944/,Burnt,"London, England, UK",,"London, Greater London, England, United Kingdom",51.5073219,-0.1276474
1333,/title/tt2503944/,Burnt,"Portobello Road Market, Portobello Road, Notting Hill, London, England, UK","(Street food scene with character David filmed on Portobello, restaurant Goode & Wright behind, the others in shot now shut down at time of writing 2016)                        ","Portobello Market, Portobello Road, Notting Hill, Royal Borough of Kensington and Chelsea, London, Greater London, England, W11 1LU, United Kingdom",51.5160858,-0.2051174
1334,/title/tt2503944/,Burnt,USA,,United States,39.7837304,-100.4458825
1335,/title/tt2503944/,Burnt,"West London Film Studios, London, England, UK",(studio)                        ,,,
1336,/title/tt0101050/,Blossom,"Ren-Mar Studios - 846 N. Cahuenga Blvd., Hollywood, Los Angeles, California, USA",(studio) (1991)                        ,,,
1337,/title/tt0101050/,Blossom,"Sunset Gower Studios - 1438 N. Gower Street, Hollywood, Los Angeles, California, USA",(studio)                        ,,,
1338,/title/tt1204342/,The Muppets,"Bonanza Casino - 4720 North Virginia Street, Reno, Nevada, USA",(Pachulow Casino exteriors and interior extablishing shots)                        ,"Bonanza Casino, 4720, North Virginia Street, Reno, Washoe County, Nevada, 89506, United States of America",39.57108735,-119.82549220999697
1339,/title/tt1204342/,The Muppets,"Midwest Street, Warner Brothers Burbank Studios - 4000 Warner Boulevard, Burbank, California, USA","(Smalltown for musical number ""Life's a Happy Song"")                        ",,,
1340,/title/tt1204342/,The Muppets,"Pink Palace - 10100 Sunset Boulevard, Holmby Hills, Los Angeles, California, USA",(Miss Piggy's office)                        ,,,
1341,/title/tt1204342/,The Muppets,"Roxie Theatre - 518 South Broadway, Downtown, Los Angeles, California, USA","(exterior street scenes during ""Man or Muppet"")                        ","Roxie Theatre, 518, South Broadway, Historic Core District, Downtown, Los Angeles, Los Angeles County, California, 90013, United States of America",34.047399,-118.25092735314685
1342,/title/tt1204342/,The Muppets,"Santa Barbara, California, USA",,"Santa Barbara, Santa Barbara County, California, United States of America",34.4221319,-119.7026673
1343,/title/tt1204342/,The Muppets,"Paris, France",(Arc de Triomphe)                        ,"Paris, Île-de-France, France métropolitaine, France",48.8566969,2.3514616
1344,/title/tt1204342/,The Muppets,"Angels Flight Railway - 351 S Hill St, Los Angeles, California, USA",(Muppet or Man song)                        ,"Angels Flight, South Hill Street, Bunker Hill, Downtown, Los Angeles, Los Angeles County, California, 90071, United States of America",34.0511576,-118.2499232
1345,/title/tt1204342/,The Muppets,"City National Towers - 515 South Flower Street, Los Angeles, California, USA",(Tex Richman's office)                        ,,,
1346,/title/tt1204342/,The Muppets,"Google Zürich, Brandschenkestrasse 110, Zürich, Switzerland",(Scooter gets picked up by the Muppets)                        ,"Google Switzerland GmbH, 110, Brandschenkestrasse, Enge, Kreis 2, Zürich, Bezirk Zürich, Zürich, 8002, Switzerland",47.3656492,8.5248522
1347,/title/tt1204342/,The Muppets,"Hollywood, Los Angeles, California, USA",,"Hollywood, Los Angeles, Los Angeles County, California, 90028-8127, United States of America",34.0980031,-118.329523
1348,/title/tt1204342/,The Muppets,"Mels drive-in - 1660 North Highland Avenue, Hollywood, Los Angeles, California, USA",(Diner exterior and interior)                        ,"Mel's Drive-In, Highland Avenue, Whitley Heights Historic District, Hollywood, Los Angeles, Los Angeles County, California, 90028, United States of America",34.10091135,-118.3383538614675
1349,/title/tt1204342/,The Muppets,"Walt Disney's Golden Oak Ranch - 19802 Placerita Canyon Road, Newhall, California, USA",(Smalltown)                        ,,,
1350,/title/tt1204342/,The Muppets,"Knollview Mansion - 4545 White Oak Avenue, Encino, California, USA",(exterior of Kermit's mansion)                        ,,,
1351,/title/tt1204342/,The Muppets,"Stage 6, Walt Disney Studios, 500 South Buena Vista Street, Burbank, California, USA",(Kermit's office; Kermit announces that Scooter will run the show)                        ,,,
1352,/title/tt2024432/,Identity Thief,"Chattanooga, Tennessee, USA",(Market Street Bridge)                        ,"Chattanooga, Hamilton County, Tennessee, United States of America",35.0457219,-85.3094883
1353,/title/tt2024432/,Identity Thief,"Rome, Georgia, USA",(street scenes)                        ,"Rome, Floyd County, Georgia, 30161, United States of America",34.257038,-85.1646726
1354,/title/tt2024432/,Identity Thief,"Hampton, Georgia, USA","(Accident when the two main characters meet face to face, also on the side of the road a few scenes later)                        ","Hampton, Henry County, Georgia, United States of America",33.3870578,-84.2829784
1355,/title/tt2024432/,Identity Thief,"855 Peachtree Street, Atlanta, Georgia, USA",(New company offices)                        ,"ViewPoint, 845-855, Peachtree Street Northeast, Atlanta, Georgia, 30308, United States of America",33.777874999999995,-84.38389570545843
1356,/title/tt2024432/,Identity Thief,"Denver, Colorado, USA",(Sandy Patterson's house)                        ,"Denver, Denver County, Colorado, United States of America",39.7392364,-104.9848623
1357,/title/tt2024432/,Identity Thief,"Lumber City, Georgia",(Railroad Trestle visible during scene)                        ,"Lumber City, Telfair County, Georgia, 31549, United States of America",31.9293488,-82.6795831
1358,/title/tt0089791/,Pee-wee's Big Adventure,"Wheel Inn Restaurant - 50900 Seminole Drive, Cabazon, California, USA",(Truck stop and dinosaurs)                        ,,,
1359,/title/tt0089791/,Pee-wee's Big Adventure,"Mi Tierra Market - 17529 Sierra Highway, Canyon Country, California, USA",(as Apache Bar/Tequila dance scene)                        ,,,
1360,/title/tt0089791/,Pee-wee's Big Adventure,"San Antonio, Texas, USA",(Alamo-exterior front shot)                        ,"San Antonio, Bexar County, Texas, United States of America",29.4246002,-98.4951405
1361,/title/tt0089791/,Pee-wee's Big Adventure,"Fairplex - 1101 West McKinley Avenue, Pomona, California, USA",(Rodeo scene set in Texas)                        ,"Fairplex Garden Railroad, West McKinley Avenue, Pomona, Los Angeles County, California, 91768, United States of America",34.08262535,-117.76461248793103
1362,/title/tt0089791/,Pee-wee's Big Adventure,"Studio Drive-In - 5250 Sepulveda Blvd, Culver City, California, USA",(studio) (The Studio Drive-In closed in 1993 and was demolished in 1998)                        ,,,
1363,/title/tt0089791/,Pee-wee's Big Adventure,"Griffith Park - 4730 Crystal Springs Drive, Los Angeles, California, USA",,,,
1364,/title/tt0089791/,Pee-wee's Big Adventure,"King Gillette Ranch, Malibu Creek State Park - Mulholland Highway, Calabasas, California, USA",(Tour de France dream)                        ,,,
1365,/title/tt0089791/,Pee-wee's Big Adventure,"Stage 20, Warner Brothers Burbank Studios - 4000 Warner Boulevard, Burbank, California, USA",,,,
1366,/title/tt0089791/,Pee-wee's Big Adventure,"Santa Clarita, California, USA",,"Santa Clarita, Los Angeles County, California, United States of America",34.3916641,-118.542586
1367,/title/tt0089791/,Pee-wee's Big Adventure,"Ahmanson Mansion - 401 South Hudson Place, Hancock Park, Los Angeles, California, USA",(Francis' mansion)                        ,,,
1368,/title/tt0089791/,Pee-wee's Big Adventure,"Mission San Fernando Rey - 15151 San Fernando Mission Boulevard, Mission Hills, Los Angeles, California, USA",(Alamo tour-interior & courtyard)                        ,,,
1369,/title/tt0089791/,Pee-wee's Big Adventure,"Stage 4, Warner Brothers Burbank Studios - 4000 Warner Boulevard, Burbank, California, USA",,,,
1370,/title/tt0107050/,Grumpy Old Men,"Lake Rebecca, Rockford, Minnesota, USA",(fishing hole)                        ,"Lake Rebecca, Tamarack Street, Independence, Hennepin County, Minnesota, 55373, United States of America",45.06489125,-93.74190087187665
1371,/title/tt0107050/,Grumpy Old Men,"Half Time Rec, 1013 Front Avenue, Saint Paul, Minnesota, USA",(Slippery's Tavern)                        ,"Half Time Rec., 1013, Front Avenue, St. Paul, Ramsey County, Minnesota, 55103, United States of America",44.9703217,-93.1429804
1372,/title/tt0107050/,Grumpy Old Men,"Faribault, Minnesota, USA",(opening credits/drug store)                        ,"Faribault County, Minnesota, United States of America",43.6647961,-93.9510501
1373,/title/tt0107050/,Grumpy Old Men,"Paisley Park, Chanhassen, Minnesota, USA",,"Paisley Park Studios, 7801, Audubon Road, Ashling Meadows, Greenwood Shores, Chanhassen, Carver County, Minnesota, 55317, United States of America",44.86166555,-93.56067202214953
1374,/title/tt0107050/,Grumpy Old Men,"Divine Redeemer Hospital - 724 19th Avenue N., South St. Paul, Minnesota, USA",,,,
1375,/title/tt0107050/,Grumpy Old Men,"South St. Paul, Minnesota, USA",,"South St. Paul, Dakota County, Minnesota, 55075, United States of America",44.8938832,-93.0368359
1376,/title/tt0107050/,Grumpy Old Men,"Minnesota, USA",,"Minnesota, United States of America",45.9896587,-94.6113288
1377,/title/tt0107050/,Grumpy Old Men,"1133 Hyacinth Avenue, East St. Paul, Minnesota, USA",(John Gustafson's House)                        ,,,
1378,/title/tt0107050/,Grumpy Old Men,"1122 Hyacinth Avenue, East St. Paul, Minnesota, USA",(Ariel Truax's House)                        ,,,
1379,/title/tt0460637/,Everybody Hates Chris,"Paramount Studios - 5555 Melrose Avenue, Hollywood, Los Angeles, California, USA",,,,
1380,/title/tt1563742/,Overboard,"Steveston, Richmond, British Columbia, Canada",,"Steveston, Richmond, Metro Vancouver Regional District, British Columbia, Canada",49.1280561,-123.177415512419
1381,/title/tt0327137/,Secondhand Lions,"Lockhart, Texas, USA",(credits at end of movie)                        ,"Lockhart, Caldwell County, Texas, 78644, United States of America",29.8832105,-97.6736292
1382,/title/tt0327137/,Secondhand Lions,"Pflugerville, Texas, USA",,"Pflugerville, Travis County, Texas, United States of America",30.4393696,-97.6200043
1383,/title/tt0327137/,Secondhand Lions,"Texas, USA",,"Texas, United States of America",31.8160381,-99.5120986
1384,/title/tt1661326/,Shake It Up,"Los Angeles Center Studios - 450 S. Bixel Street, Downtown, Los Angeles, California, USA",,,,
1385,/title/tt1336608/,Rock of Ages,"Miami, Florida, USA",,"Miami, Miami-Dade County, Florida, United States of America",25.7742658,-80.1936589
1386,/title/tt1336608/,Rock of Ages,"Fort Lauderdale, Florida, USA",,"Fort Lauderdale, Broward County, Florida, United States of America",26.1223084,-80.1433786
1387,/title/tt1336608/,Rock of Ages,"Wilshire United Methodist Church, Los Angeles, CA 90005, USA",(exterior of Catherine Zeta-Jones dance sequence)                        ,"Wilshire United Methodist Church, South Plymouth Boulevard, Windsor Square, Los Angeles, Los Angeles County, California, 90005, United States of America",34.0611218,-118.3234095
1388,/title/tt0096320/,Twins,"1126 Hillcrest Avenue, Oak Knoll, Pasadena, California, USA",(mansion)                        ,"1126, Hillcrest Avenue, Oak Knoll, Pasadena, Los Angeles County, California, 91106, United States of America",34.12763110669732,-118.13472788914437
1389,/title/tt0096320/,Twins,"Houston, Texas, USA",,"Houston, Harris County, Texas, United States of America",29.7589382,-95.3676974
