,Code,Show Name,Location,Scene,geocodedLocation,latitude,longitude
680,/title/tt3659388/,,"Budapest Ferihegy International Airport, Budapest, Hungary",,"Budapest Liszt Ferenc Nemzetközi Repülőtér, Rákóczi Ferenc utca, Nagyhangács, Rákoshegy, XVII. kerület, Budapest, Közép-Magyarország, 1174, Magyarország",47.43527295,19.25351003145765
681,/title/tt3659388/,,"Jet Propulsion Laboratory - 4800 Oak Grove Parkway, Pasadena, California, USA",(Satellite Communications Center),,,
682,/title/tt4520988/,,"Iceland, Sagaøya","(beach, forest)",,,
683,/title/tt1199099/,,"Goodrich Castle, Goodrich, Ross-on-Wye, Herefordshire, England, UK",,,,
684,/title/tt1199099/,,"Puzzle Wood, Perrygrove Road, Coleford, Forest of Dean, Gloucestershire, England, UK",,"Puzzle Wood, Perrygrove Road, Coleford, Forest of Dean, Gloucestershire, South West England, England, GL16 8QB, United Kingdom",51.781297,-2.61095
685,/title/tt8103070/,,"Georgia, USA",,"Georgia, United States of America",32.3293809,-83.1137366
686,/title/tt0303461/,,"Sable Ranch - 25933 Sand Canyon Road, Santa Clarita, California, USA",,,,
687,/title/tt0303461/,,"20th Century Fox Studios - 10201 Pico Blvd., Century City, Los Angeles, California, USA",(studio),,,
688,/title/tt0303461/,,"Santa Clarita, California, USA",,"Santa Clarita, Los Angeles County, California, United States of America",34.3916641,-118.542586
689,/title/tt0303461/,,USA,,United States,39.7837304,-100.4458825
690,/title/tt6139732/,,"Longcross, Surrey, England, UK",(studio),"Longcross, Burma Road, Chobham, Runnymede, Surrey, South East, England, KT16 0EX, United Kingdom",51.385277,-0.5950836
691,/title/tt6139732/,,Jordan,,الأردن,31.1667049,36.941628
692,/title/tt0325980/,,"Wallilabou Bay, St Vincent and the Grenadines",,"Wallilabou, Saint Patrick, Saint Vincent and the Grenadines",13.2538343,-61.2429381
693,/title/tt0325980/,,"Kingstown, St Vincent, St Vincent and the Grenadines",,"Kingstown, Saint George, VC0100, Saint Vincent and the Grenadines",13.1561864,-61.2279621
694,/title/tt0325980/,,"Mexican Street, Backlot, Universal Studios - 100 Universal City Plaza, Universal City, California, USA",,,,
695,/title/tt0325980/,,"Little Europe, Backlot, Universal Studios - 100 Universal City Plaza, Universal City, California, USA",,,,
696,/title/tt0325980/,,"Los Angeles, California, USA",,"Los Angeles, Los Angeles County, California, United States of America",34.0536909,-118.2427666
697,/title/tt0325980/,,"Walt Disney Studios, 500 South Buena Vista Street, Burbank, California, USA",(studio),,,
698,/title/tt0367594/,,"York, North Yorkshire, England, UK",,"York, Yorkshire and the Humber, England, YO1 8SG, United Kingdom",53.9590555,-1.0815361
699,/title/tt0367594/,,"England, UK",,"England, United Kingdom",52.7954791,-0.5402402866174321
700,/title/tt0367594/,,"Buford, Georgia, USA",(Violet's house),"Buford, Gwinnett County, Georgia, United States of America",34.1206564,-84.0043513
701,/title/tt0367594/,,"Armory, Hatfield House, Hatfield, Hertfordshire, England, UK",(interior of Veruca's house),,,
702,/title/tt0367594/,,"A Stage, Pinewood Studios, Iver Heath, Buckinghamshire, England, UK",,,,
703,/title/tt0367594/,,"E Stage, Pinewood Studios, Iver Heath, Buckinghamshire, England, UK",,,,
704,/title/tt0367594/,,"Wrotham Park, Barnet, Hertfordshire, England, UK",(exterior of Veruca's house),"Wrotham Park, Hertsmere, Hertfordshire, East of England, England, EN5 4RY, United Kingdom",51.6775134,-0.1957087
705,/title/tt0367594/,,UK,,United Kingdom,54.7023545,-3.2765753
706,/title/tt0367594/,,"R Stage, Shepperton Studios, Shepperton, Surrey, England, UK",,,,
707,/title/tt0367594/,,"C Stage, Pinewood Studios, Iver Heath, Buckinghamshire, England, UK",(interior of Boutique Department Store),,,
708,/title/tt0367594/,,"Bab al-Yaman, Sana'a, Yemen","(Marrakesh, Morocco)","باب اليمن, مديرية صنعاء القديمة, مدينة صنعاء, أمانة العاصمة, 14050, اليَمَن al-Yaman",15.35121,44.21465
709,/title/tt0092005/,,"419 N Main St, Brownsville, Oregon, USA",(Downtown Castle Rock),"419, North Main Street, Brownsville, Linn County, Oregon, 97327, United States of America",44.39460457142857,-122.98455207792207
710,/title/tt0092005/,,"N Main St, Brownsville, Oregon, USA",(Crossing bridge when returning home),"North Main Street, Brownsville, Linn County, Oregon, 97327, United States of America",44.3995574,-122.9846081
711,/title/tt0092005/,,"Holloway Heights, Brownsville, Oregon, USA",(Gordie shoots in a alley behind Blue Point Diner),"Holloway Heights, Brownsville, Linn County, Oregon, 97327, United States of America",44.395101,-122.986389
712,/title/tt0092005/,,"Baptist Cemetery, Brownsville, Oregon, USA",(Gordie's dream),"Pleasant Butte Baptist Cemetery, Seven Mile Lane, Brownsville, Linn County, Oregon, 97327, United States of America",44.4196573,-123.0169321
713,/title/tt0092005/,,"Houston Road, Veneta, Oregon, USA",(Mailbox Baseball scene),,,
714,/title/tt0092005/,,"McCloud River Railroad, McCloud, California, USA",,,,
715,/title/tt0092005/,,"Gooseline Railroad, Cottage Grove, Oregon, USA",(Wisconsin),,,
716,/title/tt0092005/,,"Yreka Western Railroad, Yreka, California, USA",,"Yreka Western Railroad, Yreka, Siskiyou County, California, 96097, United States of America",41.708132,-122.635668
717,/title/tt0092005/,,"Veneta, Oregon, USA",,"Veneta, Lane County, Oregon, 97487, United States of America",44.0488807,-123.3515141
718,/title/tt0092005/,,"325 Fisher St, Brownsville, Oregon, USA",(Gordie Lachance's house),"325, Fisher Street, Brownsville, Linn County, Oregon, 97327, United States of America",44.39325766434282,-122.98789902367164
719,/title/tt0092005/,,"25850 Tidball Ln, Veneta, Oregon, USA",(Castle Rock Salvage),"25850, Tidball Lane, Veneta, Lane County, Oregon, 97487, United States of America",44.0503934138237,-123.32358428800912
720,/title/tt0092005/,,"N Main St & Park Ave, Brownsville, Oregon, USA",(Vern finds a penny),,,
721,/title/tt0092005/,,"McCloud, California, USA",,"McCloud, CA 89, Curtis, McCloud, Siskiyou County, California, 96057, United States of America",41.2497685,-122.13526634266401
722,/title/tt0092005/,,"California, USA",,"California, United States of America",36.7014631,-118.7559974
723,/title/tt0092005/,,"Oregon, USA",,"Oregon, United States of America",43.9792797,-120.737257
724,/title/tt0926084/,,"Lavenham, Suffolk, England, UK",(Godric's Hollow background),"Lavenham, Suffolk, East of England, England, CO10 9RD, United Kingdom",52.1100356,0.7978942
725,/title/tt0926084/,,"Malham Cove, Malham, North Yorkshire, England, UK",(Harry and Hermione dance scene inside the shelter tent in a digtally created Malham Cove),"Malham Cove, Trough Gate, Malham, Craven, North Yorkshire, Yorkshire and the Humber, England, BD23 4DJ, United Kingdom",54.0726842,-2.1579062
726,/title/tt0926084/,,"Yorkshire Dales National Park, North Yorkshire, England, UK",,"Yorkshire Dales National Park, Bainbridge, Richmondshire, North Yorkshire, Yorkshire and the Humber, England, United Kingdom",54.26164245,-2.1909464243391255
727,/title/tt0926084/,,"Queensway Tunnel, Liverpool, Merseyside, England, UK",(Motorbike tunnel scene),,,
728,/title/tt0926084/,,"16 Heathgate, Hampstead Garden Suburb, London, England, UK",(Hermione Leaving her parents house),"Heathgate, Hampstead Garden Suburb, London Borough of Barnet, London, Greater London, England, NW11 7AN, United Kingdom",51.5788424,-0.1886559
729,/title/tt0926084/,,"Leavesden Studios, Leavesden, Hertfordshire, England, UK",,"Warner Bros. Studios Leavesden, Abbots Langley, Leavesden, Hertfordshire, East of England, England, WD25 7LP, United Kingdom",51.68980175,-0.4226993868476693
730,/title/tt0926084/,,"Rannoch Moor, Highland, Scotland, UK","(Scene where Death Eaters halt Hogwarts Express, filmed using the 'Jacobite' steam engine on the west highland main line)",,,
731,/title/tt0926084/,,"De Vere House, Lavenham, Suffolk, England, UK",(house where Harry Potter was born),,,
732,/title/tt0926084/,,"Weston Hills, Baldock, Hertfordshire, England, UK",(Forest scenes),,,
733,/title/tt0926084/,,"Pinewood Studios, Iver Heath, Buckinghamshire, England, UK",,"Pinewood Studios, Pinewood Green, Iver, Iver Heath, Buckinghamshire, South East, England, SL0 0QJ, United Kingdom",51.54831515,-0.5346765566753087
734,/title/tt1270797/,,"San Francisco, California, USA",,"San Francisco, San Francisco City and County, California, United States of America",37.7790262,-122.4199061
735,/title/tt1270797/,,"California, USA",,"California, United States of America",36.7014631,-118.7559974
736,/title/tt1270797/,,USA,,United States,39.7837304,-100.4458825
737,/title/tt1270797/,,"The Merchants Exchange Building, 465 California St #1600, San Francisco, CA 94104, United States",(Michelinie & McFarlane law office exterior),,,
738,/title/tt2375692/,,"Cape Town Film Studios, Cape Town, Western Cape, South Africa",,"Cape Town Film Studios, Film City Boulevard, Houghton, Cape Town Ward 16, Eersterivier, City of Cape Town, Western Cape, 7784, South Africa",-34.0315617,18.719156772105897
739,/title/tt0102057/,,"Kaua'i, Hawaii, USA",(Neverland exteriors),"Kauaʻi, Kauaʻi County, Hawaii, United States of America",22.050466550000003,-159.55876775017003
740,/title/tt0102057/,,"Culver Studios - 9336 W. Washington Blvd., Culver City, California, USA",(studio),,,
741,/title/tt0102057/,,"Ballroom, Park Plaza Hotel - 607 S. Park View Street, Los Angeles, California, USA",(Great Ormond Street banquet),,,
742,/title/tt0102057/,,"Los Angeles, California, USA",,"Los Angeles, Los Angeles County, California, United States of America",34.0536909,-118.2427666
743,/title/tt0102057/,,"Stage 12, Sony Pictures Studios - 10202 W. Washington Blvd., Culver City, California, USA",(exterior of Nevertree),,,
744,/title/tt0102057/,,"Stage 30, Sony Pictures Studios - 10202 W. Washington Blvd., Culver City, California, USA",(Lost Boys playground),,,
745,/title/tt0102057/,,USA,,United States,39.7837304,-100.4458825
746,/title/tt2379713/,,"Erfoud, Morocco",(SPECTRE lair) (desert),"Erfoud ⴰⵔⴼⵓⴷ أرفود, Pachalik de Arfoud, Province d'Errachidia إقليم الرشيدية, Drâa-Tafilalet ⴷⴰⵔⵄⴰ-ⵜⴰⴼⵉⵍⴰⵍⵜ درعة تافيلالت, 52200, Maroc",31.4324061,-4.2342572
747,/title/tt2379713/,,"Rome, Lazio, Italy",,"Roma Capitale, Lazio, Italia",41.85223935,12.631036615953583
748,/title/tt2379713/,,"Tangier, Morocco",,"Tanger ⵟⴰⵏⵊⴰ طنجة, pachalik de Tanger طنجة, Préfecture de Tanger-Assilah عمالة طنجة-أصيلة, Tanger-Tétouan-Al Hoceima ⵟⴰⵏⵊ-ⵟⵉⵜⴰⵡⵉⵏ-ⵍⵃⵓⵙⵉⵎⴰ طنجة تطوان الحسيمة, 90013, Maroc",35.777103,-5.803792
749,/title/tt2379713/,,"Oujda, Morocco",(Oriental Desert Express train scenes),"Oujda وجدة‎, Pachalik d'Oujda باشوية وجدة, Préfecture d'Oujda-Angad عمالة وجدة - أنجاد, Oriental ⵜⴰⵏⴳⵎⵓⴹⵜ الشرقية, 60043, Maroc",34.677874,-1.929306
750,/title/tt2379713/,,"London, England, UK",,"London, Greater London, England, United Kingdom",51.5073219,-0.1276474
751,/title/tt2379713/,,"Blenheim Palace, Woodstock, Oxfordshire, England, UK",(Start of Rome car chase at night) (exterior: Palazzo Cadenza SPECTRE meeting) (two day shoot),"Blenheim Palace, Grand Bridge, Blenheim, West Oxfordshire, Oxfordshire, South East, England, OX20 1PX, United Kingdom",51.841967249999996,-1.3625986224673587
752,/title/tt2379713/,,"Rule's Restaurant, Covent Garden, London, England, UK","(Restaurant dining room where M, Q and Miss Moneypenny meet)","Rules, 34-35, Maiden Lane, St Clement Danes, Covent Garden, City of Westminster, London, Greater London, England, WC2E 7LB, United Kingdom",51.5108285,-0.12319056346859711
753,/title/tt2379713/,,"Zócalo, Colonia Centro, Cuauhtémoc, Mexico City, Distrito Federal, Mexico",(Opening Day of the Dead sequence),"Zócalo, Calle Plaza de la Constitución, Cuauhtémoc, 06010, México",19.4322987,-99.1323909
754,/title/tt2379713/,,"Tolsa Square, Mexico City, Distrito Federal, Mexico",(Opening Day of the Dead sequence),,,
755,/title/tt2379713/,,"Cable Car Station, Das Central Hotel, Auweg 3, Sölden, Austria",(Cable car sequence),,,
756,/title/tt2379713/,,"Villa di Fiorano, Via Appia Antica, Rome, Lazio, Italy",(Lucia Sciarra's Italian palatial villa house),"Villa di Fiorano, Via Appia Antica, Zona XX Aeroporto di Ciampino, Roma, Roma Capitale, 00043, Italia",41.799086,12.576017199999999
757,/title/tt2379713/,,"Mexico City, Distrito Federal, Mexico",(Opening Day of the Dead sequence),"México, Calle Benito Juárez, Unidad Habitacional Integración Latinoamericana, Naucalpan, 04350, México",19.337797000000002,-99.17851255290537
758,/title/tt2379713/,,"Colonia Centro, Mexico City, Distrito Federal, Mexico",(Opening Day of the Dead sequence),"México, Calle Benito Juárez, Unidad Habitacional Integración Latinoamericana, Naucalpan, 04350, México",19.337797000000002,-99.17851255290537
759,/title/tt2379713/,,"Freemason's Hall, Great Queen Street, Covent Garden, London, England, UK",(Corridors of British Intelligence Headquarters),"Freemasons' Hall, 60, Great Queen Street, Holborn, London Borough of Camden, London, Greater London, England, WC2B 5AZ, United Kingdom",51.515298650000005,-0.12079688684234866
760,/title/tt2379713/,,"National Museum of Art, Mexico City, Distrito Federal, Mexico",(Opening Day of the Dead sequence),,,
761,/title/tt2379713/,,"Garibaldi Museum, Largo di Porta San Pancrazio 9, Rome, Lazio, Italy",(James Bond drives through archway in Rome),,,
762,/title/tt2379713/,,"St. Peter's Square, Vatican City",(Rome car chase at night),"Forum Sancti Petri, Piazza Retta, Città del Vaticano",41.9022353,12.457357310298008
763,/title/tt2379713/,,"Albert R. Broccoli 007 Stage, Pinewood Studios, Iver Heath, Buckinghamshire, England, UK",(Westminster Bridge) (replica),,,
764,/title/tt2379713/,,"Tolsá Plaza, Mexico City, Distrito Federal, Mexico",(Opening Day of the Dead sequence),,,
765,/title/tt2379713/,,"Forum Romanum, Rome, Lazio, Italy",,"Forum Romanum, Via di San Teodoro, Rione X Campitelli, Municipio Roma I, Roma, Roma Capitale, Lazio, 00153, Italia",41.89172375,12.486671454923293
766,/title/tt2379713/,,"Corso Vittorio, Rome, Lazio, Italy",(Rome car chase at night),,,
767,/title/tt2379713/,,"Lungotevere, Rome, Lazio, Italy",(Rome car chase at night),"Lungotevere dei Tebaldi, Rione VII Regola, Municipio Roma I, Roma, Roma Capitale, Lazio, 0186, Italia",41.8946014,12.4688675
768,/title/tt2379713/,,"Piazza Giovanni Agnelli, Rome, Lazio, Italy",(Funeral of Marco Sciarra),"Piazza Giovanni Agnelli, Quartiere XXXII Europa, Roma, Roma Capitale, Lazio, 00144, Italia",41.8313491,12.4777197
769,/title/tt2379713/,,"1 Stanley Crescent, Notting Hill, London, England, UK",(exteriors: James Bond's apartment),"1, Stanley Crescent, Notting Hill, Royal Borough of Kensington and Chelsea, London, Greater London, England, W11 2NA, United Kingdom",51.5111525,-0.2045562
770,/title/tt2379713/,,"Borgo Vittorio, Rome, Lazio, Italy",,"Borgo Vittorio, Rione XIV Borgo, Municipio Roma I, Roma, Roma Capitale, Lazio, 00193, Italia",41.9042529,12.4604031
771,/title/tt2379713/,,"Altaussee, Austria",(Snow scenes),"Altaussee, Bezirk Liezen, Steiermark, 8992, Österreich",47.6398954,13.7640614
772,/title/tt2379713/,,"Jagdhaus Seewiese, Altaussee, Austria",(Snow scenes),"Jagdhaus Seewiese, 55, Fischerndorf, Altaussee, Bezirk Liezen, Steiermark, 8992, Österreich",47.6496408,13.7946278
773,/title/tt2379713/,,"Spring Gardens, London, England, UK",(MI6 Hildebrand safe house),"Spring Gardens, Westminster, Covent Garden, City of Westminster, London, Greater London, England, SW1A 2BU, United Kingdom",51.5063895,-0.1282209
774,/title/tt2379713/,,"Scalo De Pinedo, Rome, Lazio, Italy",(Rome car chase at night),"Scalo De Pinedo, Quartiere I Flaminio, Roma, Roma Capitale, Lazio, 001963, Italia",41.9131145,12.4718691
775,/title/tt2379713/,,"Kartitsch, Austria",(Snow scenes),"Gemeinde Kartitsch, Bezirk Lienz, Tirol, 9941, Österreich",46.700626650000004,12.493543103084402
776,/title/tt2379713/,,"Colonia Centro, Cuauhtémoc, Mexico City, Distrito Federal, Mexico",(Opening Day of the Dead sequence),"Cuauhtémoc, Avenida Chapultepec, Cuauhtémoc, Ciudad de México, 06600, México",19.4256622,-99.1546449
777,/title/tt2379713/,,"Mexico City Cathedral, Mexico City, Distrito Federal, Mexico",(Opening Day of the Dead sequence),,,
778,/title/tt2379713/,,"Altare della Patria, Piazza Venezia, Rome, Lazio, Italy",,,,
779,/title/tt2379713/,,"Westminster Abbey, Westminster, London, England, UK",(James Bond and Eve Moneypenny scene) (environs),"Westminster Abbey, 20, Dean's Yard, Westminster, Millbank, City of Westminster, London, Greater London, England, SW1P 3PA, United Kingdom",51.4993619,-0.12739984672471022
780,/title/tt2379713/,,"Vauxhall, London, England, UK",(London boat and helicopter chase) (final scenes),"Vauxhall, London Borough of Lambeth, London, Greater London, England, SE11 5AW, United Kingdom",51.4874834,-0.1229297
781,/title/tt2379713/,,"The Quattro Fontane, Rome, Lazio, Italy",(Rome car chase at night),"Quattro Fontane, Via XX Settembre, Rione II Trevi, Municipio Roma I, Roma, Roma Capitale, Lazio, 00187, Italia",41.9019686,12.4907386
782,/title/tt2379713/,,"Janiculum Hill, Rome, Lazio, Italy",(Rome car chase at night),"Mura gianicolensi, Viale delle Mura Gianicolensi, Monteverde, Quartiere XII Gianicolense, Roma, Roma Capitale, Lazio, 00120, Italia",41.8869773,12.461205
783,/title/tt2379713/,,"Fontana dell'Acqua Paola, Janiculum Hill, Rome, Lazio, Italy",(Rome car chase at night),,,
784,/title/tt2379713/,,"Giulio Cesare, Rome, Lazio, Italy",(Rome car chase at night),"Giulio Cesare, Viale Giulio Cesare, Rione XXII Prati, Quartiere XIV Trionfale, Roma, Roma Capitale, Lazio, 00192, Italia",41.9087349,12.4560902
785,/title/tt2379713/,,"Aventine Hill, Rome, Lazio, Italy",(Rome car chase at night),"Salita delle Pendici dell'Aventino, Lungotevere Aventino, Rione XII Ripa, Municipio Roma I, Roma, Roma Capitale, Lazio, 00153, Italia",41.8849718,12.47908482100029
786,/title/tt2379713/,,"Tiber River Waterfront, Rome, Lazio, Italy",(Rome car chase at night),,,
787,/title/tt2379713/,,"Via Appia Antica, Rome, Lazio, Italy",(Lucia Sciarra's Italian palatial villa house),"Via Appia Antica, Quartiere IX Appio-Latino, Roma, Roma Capitale, Lazio, 00179, Italia",41.8550491,12.5173117
788,/title/tt2379713/,,"Via della Conciliazione, Rome, Lazio, Italy",(Rome car chase at night),"Via della Conciliazione, Rione XIV Borgo, Municipio Roma I, Roma, Roma Capitale, Lazio, 00193, Italia",41.9023681,12.4636338
789,/title/tt2379713/,,"Passetto di Borgo, Rome, Lazio, Italy",(Rome car chase at night),"Passetto di Borgo, Piazza Pia, Rione XIV Borgo, Municipio Roma I, Roma, Roma Capitale, Lazio, 00193, Italia",41.903273,12.45813341666669
790,/title/tt2379713/,,"Ponte Sant'Angelo, Rome, Lazio, Italy",(Rome car chase at night),"Ponte Sant'Angelo, Rione XIV Borgo, Municipio Roma I, Roma, Roma Capitale, Lazio, 00193, Italia",41.9019185,12.466446628598355
791,/title/tt2379713/,,"Lambeth Bridge, Millbank, London, England, UK",(London boat and helicopter chase) (final scenes),"Lambeth Bridge, Westminster, Millbank, City of Westminster, London, Greater London, England, SW1P 4PN, United Kingdom",51.4945455,-0.12305300897163444
792,/title/tt2379713/,,"Regent's Canal, Camden Lock, London, England, UK",(MI6 basement bunker hideout used by Q),,,
793,/title/tt2379713/,,"Sisto Bridge, Rome, Lazio, Italy",(James Bond lands on bridge at end of Rome car chase at night),"Basilica di San Sisto Vecchio, Viale delle Terme di Caracalla, Rione XIX Celio, Municipio Roma I, Roma, Roma Capitale, Lazio, 00183, Italia",41.88051145,12.495887937332173
794,/title/tt2379713/,,"St. Peter's Basilica, Vatican City",(Rome car chase at night),"Basilica Sancti Petri, Forum Sancti Petri, Città del Vaticano, 00120, Città del Vaticano",41.9021569,12.453712068088656
795,/title/tt2379713/,,"Via Nomentana, Rome, Lazio, Italy",,"Via Nomentana, Quartiere V Nomentano, Roma, Roma Capitale, Lazio, 00141, Italia",41.9295777,12.5262604
796,/title/tt2379713/,,"Backlot, Pinewood Studios, Iver Heath, Buckinghamshire, England, UK",(MI6 Headquarters) (model) (miniature),,,
797,/title/tt2379713/,,"Lambeth, London, England, UK",(London boat and helicopter chase) (final scenes),"Lambeth, London Borough of Lambeth, London, Greater London, England, SE1 7GD, United Kingdom",51.5013012,-0.117287
798,/title/tt2379713/,,"Trafalgar Square, St James's, London, England, UK",(environs),"Trafalgar Square, St. James's, Covent Garden, City of Westminster, London, Greater London, England, WC2, United Kingdom",51.508037,-0.12804941070724718
799,/title/tt2379713/,,"B Stage, Pinewood Studios, Iver Heath, Buckinghamshire, England, UK",(studio),,,
800,/title/tt2379713/,,"Q Stage, Pinewood Studios, Iver Heath, Buckinghamshire, England, UK",(studio),,,
801,/title/tt2379713/,,"South Bank, Lambeth, London, England, UK",(London boat and helicopter chase) (final scenes),"South Bank, Lambeth, London Borough of Lambeth, London, Greater London, England, SE1 9NL, United Kingdom",51.5080347,-0.1096808
802,/title/tt2379713/,,"Via delle Quattro Fontane, Rome, Lazio, Italy",(Rome car chase at night),"Via delle Quattro Fontane, Rione II Trevi, Municipio Roma I, Roma, Roma Capitale, Lazio, 00187, Italia",41.9010516,12.4923341
803,/title/tt2379713/,,"Stadium of Domitian, Rome, Lazio, Italy",(Rome car chase at night),"Stadio di Domiziano, 3, Via di Tor Sanguigna, Rione VI Parione, Municipio Roma I, Roma, Roma Capitale, Lazio, 00186, Italia",41.9002159,12.4725305
804,/title/tt2379713/,,"Tiefenbachferner Glacier, Rettenbach, Austria",(Chase in snow),,,
805,/title/tt2379713/,,"Salzkammergut, Austria",(Snow scenes),"Salzkammergut, Linzer Gasse, Altstadt, Salzburg, 5020, Österreich",47.8035704,13.047335
806,/title/tt2379713/,,"Garden of the Oranges, Rome, Lazio, Italy",(Rome car chase at night),,,
807,/title/tt2379713/,,Vatican City,(Rome car chase at night),"Città del Vaticano, 00120, Città del Vaticano",41.9034912,12.4528349
808,/title/tt2379713/,,"Westminster, Westminster, London, England, UK",(London boat and helicopter chase) (final scenes),"Westminster, Millbank, City of Westminster, London, Greater London, England, SW1P 3JX, United Kingdom",51.5004439,-0.1265398
809,/title/tt2379713/,,"Big Ben, Houses of Parliament, Westminster, London, England, UK",(London boat and helicopter chase) (final scenes),,,
810,/title/tt2379713/,,"Vauxhall Cross - 85 Albert Embankment, Vauxhall, London, England, UK",(London boat and helicopter chase) (final scenes),"Secret Intelligence Service (MI6), 85, Albert Embankment, Vauxhall, London Borough of Lambeth, London, Greater London, England, SE1 7TP, United Kingdom",51.487292350000004,-0.1243769864578416
811,/title/tt2379713/,,"Lambeth Bridge, Westminster, London, England, UK",(London boat and helicopter chase) (final scenes),"Lambeth Bridge, Westminster, Millbank, City of Westminster, London, Greater London, England, SW1P 4PN, United Kingdom",51.4945455,-0.12305300897163444
812,/title/tt2379713/,,"Great George Street, London, England, UK",(Government office circular courtyard),"Great George Street, Westminster, Millbank, City of Westminster, London, Greater London, England, SW1A 2JX, United Kingdom",51.5009634,-0.1263011
813,/title/tt2379713/,,"Covent Garden, London, England, UK",(Street scene outside M's restaurant),"Royal Opera House, Bow Street, St Clement Danes, Covent Garden, City of Westminster, London, Greater London, England, WC2E 9DD, United Kingdom",51.512873600000006,-0.12254367918576929
814,/title/tt2379713/,,"Teatro di Marcello, Via del Teatro di Marcello, Rome, Lazio, Italy",(Rome car chase at night),,,
815,/title/tt2379713/,,"Camden Lock, Chalk Farm Road, Camden, London, England, UK",(London boat and helicopter chase) (final scenes),,,
816,/title/tt2379713/,,"Oxfordshire, England, UK",(Palazzo Cadenza),"Oxfordshire, South East, England, United Kingdom",51.833333,-1.25
817,/title/tt2379713/,,"C Stage, Pinewood Studios, Iver Heath, Buckinghamshire, England, UK",(studio),,,
818,/title/tt2379713/,,"R Stage, Pinewood Studios, Iver Heath, Buckinghamshire, England, UK",(studio),,,
819,/title/tt2379713/,,"Islington, London, England, UK",(MI6 basement bunker hideout used by Q),"Islington, Greater London, England, N1, United Kingdom",51.5384287,-0.0999051
820,/title/tt2379713/,,"Ötztal Alps , Austria",(snow scenes),"Ötztaler Alpen, Gemeinde Kaunertal, Bezirk Landeck, Tirol, Österreich",46.9213022,10.775287597364876
821,/title/tt2379713/,,"Canals, Camden Lock, London, England, UK",,,,
822,/title/tt2379713/,,"Whitehall, Westminster, London, England, UK",(Final scenes) (environs),"Whitehall, City of Westminster, London, Greater London, England, SW1A 2NH, United Kingdom",51.5023278,-0.1260826
823,/title/tt2379713/,,"Centro Histórico District, Mexico City, Distrito Federal, Mexico",(Opening Day of the Dead sequence),,,
824,/title/tt0076759/,,"Ajim, Jerba, Tunisia","(Mos Eisley, Tatooine)",,,
825,/title/tt0076759/,,"Sidi Driss Hotel, Matmata, Tunisia","(Lars family homestead, Tatooine)",,,
826,/title/tt0076759/,,"Yuma, Arizona, USA",(Tatooine scenes; special edition),"Yuma, Yuma County, Arizona, 85364, United States of America",32.6926588,-114.6276157
827,/title/tt0076759/,,"Elstree Studios, Borehamwood, Hertfordshire, England, UK",(studio),"Elstree Studios, Shenley Road, Elstree and Borehamwood, Hertsmere, Hertfordshire, East of England, England, WD6 1JG, United Kingdom",51.657052050000004,-0.2675206399488197
828,/title/tt0076759/,,"Sidi Bouhel, Tunisia",(R2 is captured by Jawas),,,
829,/title/tt0076759/,,"Shed 1, Cardington Airship Hangars, Bedfordshire, England, UK",(Yavin 4 rebel base),,,
