,Code,Show Name,Location,Scene,geocodedLocation,latitude,longitude
587,/title/tt0090557/,'Round Midnight,"Lyon, Rhône, Rhône-Alpes, France",,"Lyon, Métropole de Lyon, Circonscription départementale du Rhône, Auvergne-Rhône-Alpes, France métropolitaine, France",45.7578137,4.8320114
588,/title/tt0090557/,'Round Midnight,"New York City, New York, USA",,"New York, United States of America",40.7127281,-74.0060152
589,/title/tt0055278/,Paris Blues,"Studios de Boulogne, Avenue Jean-Baptiste Clément, Boulogne-Billancourt, Hauts-de-Seine, France",(studio)                        ,,,
590,/title/tt0119194/,Ghosts,"Amsterdam, Noord-Holland, Netherlands",,"Amsterdam, Noord-Holland, Nederland",52.3727598,4.8936041
591,/title/tt0119194/,Ghosts,"Cologne, North Rhine-Westphalia, Germany",,"Köln, Regierungsbezirk Köln, Nordrhein-Westfalen, 50667, Deutschland",50.938361,6.959974
592,/title/tt0119194/,Ghosts,"Sherman Oaks, Los Angeles, California, USA",,"Sherman Oaks, Los Angeles, Los Angeles County, California, 91403, United States of America",34.1508718,-118.4489865
593,/title/tt0210299/,Songcatcher,"Asheville, North Carolina, USA",,"Asheville, Buncombe County, North Carolina, United States of America",35.6009498,-82.5540161
594,/title/tt0116745/,Kansas City,"Kansas City, Kansas, USA",,"Kansas City, Wyandotte County, Kansas, United States of America",39.1134562,-94.626497
595,/title/tt0038622/,Humoresque,"Warner Brothers Burbank Studios - 4000 Warner Boulevard, Burbank, California, USA",(studio)                        ,,,
596,/title/tt0038622/,Humoresque,"Laguna Beach, California, USA",(beach scenes)                        ,"Laguna Beach, Orange County, California, United States of America",33.5426975,-117.785366
597,/title/tt1242499/,Hollyoaks Later,"Belfast, County Antrim, Northern Ireland, UK",,"Belfast, County Antrim, Northern Ireland, BT1 5GS, United Kingdom",54.5964411,-5.9302761
598,/title/tt0041604/,Love Happy,"General Service Studios - 1040 N. Las Palmas, Hollywood, Los Angeles, California, USA",(studio)                        ,,,
599,/title/tt0063808/,Wild in the Streets,"Sunset Strip, West Hollywood, California, USA",,"Sunset Strip, West Hollywood, Los Angeles County, California, United States of America",34.0938564,-118.3767660046168
600,/title/tt0063808/,Wild in the Streets,"Hollywood, Los Angeles, California, USA",,"Hollywood, Los Angeles, Los Angeles County, California, 90028-8127, United States of America",34.0980031,-118.329523
601,/title/tt0063808/,Wild in the Streets,"Bullocks Wilshire, 3050 Wilshire Blvd Los Angeles, California, USA",,,,
602,/title/tt0063808/,Wild in the Streets,"Hollywood Hills, Los Angeles, California, USA",,"Hollywood Hills, Los Angeles, Los Angeles County, California, United States of America",34.1311792,-118.3355474
603,/title/tt0063808/,Wild in the Streets,"National Mall, Washington, District of Columbia, USA",,"National Mall, Washington, District of Columbia, United States of America",38.8854281,-77.0414734922376
604,/title/tt0063808/,Wild in the Streets,"Los Angeles, California, USA",,"Los Angeles, Los Angeles County, California, United States of America",34.0536909,-118.2427666
605,/title/tt0063808/,Wild in the Streets,"5214 Wilshire Boulevard, Los Angeles, California, USA","(Fox Ritz Theatre, later the Lindy Opera House, demolished 1977 - concert venue)                        ","Wilshire Boulevard, Westwood Village, Westwood, Los Angeles, Los Angeles County, California, 90024-3990, United States of America",34.0584002,-118.4453576
606,/title/tt0426615/,In the Mix,"Hollywood, Los Angeles, California, USA",,"Hollywood, Los Angeles, Los Angeles County, California, 90028-8127, United States of America",34.0980031,-118.329523
607,/title/tt0426615/,In the Mix,"Los Angeles, California, USA",,"Los Angeles, Los Angeles County, California, United States of America",34.0536909,-118.2427666
608,/title/tt0427089/,Confetti,"Spielplatz Sun Club, St Albans, Hertfordshire, England, UK",,,,
609,/title/tt10147546/,Homecoming: A Film by Beyoncé,"Coachella Valley Music and Arts Festival, 81-800 Avenue 51, Indio, California, USA",,,,
610,/title/tt6204018/,Ted - För kärlekens skull,"Göteborg, Västra Götalands län, Sweden",,"Göteborg, Göteborgs Stad, Västra Götalands län, Götaland, 41106, Sverige",57.7072326,11.9670171
611,/title/tt0099691/,Graffiti Bridge,"Eden Prairie, Minnesota, USA",,"Eden Prairie, Hennepin County, Minnesota, United States of America",44.8546856,-93.470786
612,/title/tt0099691/,Graffiti Bridge,"Minnesota, USA",,"Minnesota, United States of America",45.9896587,-94.6113288
613,/title/tt0072201/,Stardust,"Granada, Andalucía, Spain",(La Calahorra Castle)                        ,"Granada, Comarca de la Vega de Granada, Granada, Andalucía, España",37.183054,-3.6021928
614,/title/tt0072201/,Stardust,"Edgwarebury Hotel, Barnet Lane, Elstree, Hertfordshire, England, UK",,,,
615,/title/tt0072201/,Stardust,"St Bernard's Church, Mandeville Road, Northolt, Middlesex, England, UK",(funeral of Jim's mother)                        ,,,
616,/title/tt0072201/,Stardust,"London, England, UK",,"London, Greater London, England, United Kingdom",51.5073219,-0.1276474
617,/title/tt0072201/,Stardust,"Marbella, Málaga, Andalucía, Spain",,"Marbella, Costa del Sol Occidental, Málaga, Andalucía, España",36.508976,-4.88562
618,/title/tt0072201/,Stardust,"New York City, New York, USA",,"New York, United States of America",40.7127281,-74.0060152
619,/title/tt1533817/,Stomp the Yard 2: Homecoming,"Atlanta, Georgia, USA",,"Atlanta, Georgia, United States of America",33.7490987,-84.3901849
620,/title/tt0069090/,Pink Floyd: Live at Pompeii,"Roman Amphitheatre, Pompeii, Naples, Campania, Italy",,,,
621,/title/tt0069090/,Pink Floyd: Live at Pompeii,"Caserta, Campania, Italy",(Reggia di Caserta)                        ,"Caserta, Campania, Italia",41.20348345,14.117057688141852
622,/title/tt0069090/,Pink Floyd: Live at Pompeii,"London, England, UK",,"London, Greater London, England, United Kingdom",51.5073219,-0.1276474
623,/title/tt0102913/,Shout,"Circle Drive, Backlot, Universal Studios - 100 Universal City Plaza, Universal City, California, USA",(Colonial Mansion)                        ,,,
624,/title/tt0102370/,Madonna: Truth or Dare,"Houston, Texas, USA",,"Houston, Harris County, Texas, United States of America",29.7589382,-95.3676974
625,/title/tt0102370/,Madonna: Truth or Dare,"Palace of Auburn Hills - 4 Championship Drive, Auburn Hills, Michigan, USA",,,,
626,/title/tt0102370/,Madonna: Truth or Dare,"Toronto, Ontario, Canada",,"Toronto, Peel, Golden Horseshoe, Ontario, Canada",43.6534817,-79.3839347
627,/title/tt0102370/,Madonna: Truth or Dare,"Detroit, Michigan, USA",,"Detroit, Wayne County, Michigan, United States of America",42.3315509,-83.0466403
628,/title/tt0102370/,Madonna: Truth or Dare,"New York City, New York, USA",,"New York, United States of America",40.7127281,-74.0060152
629,/title/tt0102370/,Madonna: Truth or Dare,"Paris, France",,"Paris, Île-de-France, France métropolitaine, 75004, France",48.8566969,2.3514616
630,/title/tt0102370/,Madonna: Truth or Dare,"Tokyo, Japan",,"東京都, 日本 (Japan)",35.6828387,139.7594549
631,/title/tt0484111/,The Good Night,"Ealing Studios, Ealing, London, England, UK",,"Ealing Studios, London Borough of Ealing, London, Greater London, England, United Kingdom",51.50903755,-0.30734058249777363
632,/title/tt0484111/,The Good Night,"London, England, UK",,"London, Greater London, England, United Kingdom",51.5073219,-0.1276474
633,/title/tt0143080/,Zoom,"Boston, Massachusetts, USA",,"Boston, Suffolk County, Massachusetts, United States of America",42.3602534,-71.0582912
634,Code,Show Name,Location,Scene,"Location, Tucker County, West Virginia, United States of America",39.2138905,-79.6371124
635,/title/tt0096180/,Stormy Monday,"Walker, Tyne & Wear, England, UK",,"Walker, Newcastle upon Tyne, Tyne and Wear, North East England, England, NE6 3BA, United Kingdom",54.9716047,-1.5541737
636,/title/tt0096180/,Stormy Monday,"Gateshead, Tyne & Wear, England, UK",,"Gateshead, Tyne and Wear, North East England, England, United Kingdom",54.9625789,-1.6019294
637,/title/tt0096180/,Stormy Monday,"Queen Street, Newcastle upon Tyne, UK",(Car blows up)                        ,"Queen Street, Grainger Town, Newcastle upon Tyne, Tyne and Wear, North East England, England, NE1 3JL, United Kingdom",54.9692117,-1.6078474
638,/title/tt0096180/,Stormy Monday,"High Level Bridge, Newcastle upon Tyne, Gateshead, Newcastle, England, UK",(Cosmo and Finney meet)                        ,"High Level Bridge, Tyne Bridge, Grainger Town, Newcastle upon Tyne, Tyne and Wear, North East England, England, NE1 3UF, United Kingdom",54.966873449999994,-1.6084778355654687
639,/title/tt0063894/,The Dick Cavett Show,"ABC Television Center - 4151 Prospect Avenue, Los Angeles, California, USA",,,,
640,/title/tt0095895/,Powaqqatsi,"Jaisalmer, Rajasthan, India",,"Jaisalmer, Rajasthan, India",27.02801615,70.7785056232077
641,/title/tt0095895/,Powaqqatsi,"Kaiser-Wilhelm-Gedächtniskirche, Berlin, Germany",,"Kaiser-Wilhelm-Gedächtniskirche, Kurfürstendamm, Charlottenburg, Charlottenburg-Wilmersdorf, 10789, Deutschland",52.5047053,13.3350328
642,/title/tt0095895/,Powaqqatsi,"Bhaktapur, Nepal",,"Bhaktapur, भक्तपुर, वाग्मती प्रदेश, 44880, Nepal",27.6720657,85.428171
643,/title/tt0095895/,Powaqqatsi,"Cuzco, Peru",,"Cusco, 08001, Peru",-13.5170887,-71.9785356
644,/title/tt0095895/,Powaqqatsi,"Hong Kong, China",,"香港島 Hong Kong Island, 香港 Hong Kong, China 中国",22.2793278,114.1628131
645,/title/tt0095895/,Powaqqatsi,"Kathmandu, Nepal",,"Kathmandu, Kamaladi Marg, Kamalpokhari, Baghbazar, काठमाडौं, वाग्मती प्रदेश, 46600, Nepal",27.708317,85.3205817
646,/title/tt0095895/,Powaqqatsi,"Serra Pelada, Pará, Brazil",,"Serra Pelada, Curionópolis, Microrregião de Parauapebas, Mesorregião Sudeste Paraense, Pará, Região Norte, Brasil",-5.9464861,-49.6612072
647,/title/tt0407936/,Lackawanna Blues,"Los Angeles, California, USA",,"Los Angeles, Los Angeles County, California, United States of America",34.0536909,-118.2427666
648,/title/tt0099595/,The Forbidden Dance,"Los Angeles County Arboretum & Botanic Garden - 301 N. Baldwin Avenue, Arcadia, California, USA",,,,
649,/title/tt2796782/,The Oscars,"Los Angeles, California, USA",,"Los Angeles, Los Angeles County, California, United States of America",34.0536909,-118.2427666
650,/title/tt9886006/,Kono Oto Tomare!,"Tokyo, Japan",,"東京都, 日本 (Japan)",35.6828387,139.7594549
651,/title/tt0085551/,Get Crazy,"The Wiltern - 3790 Wilshire Blvd., Los Angeles, California, USA",,"Wiltern Theatre and Pellissier Building, 3780, Wilshire Boulevard, Koreatown, Los Angeles, Los Angeles County, California, 90010, United States of America",34.061270199999996,-118.30856470082979
652,/title/tt0093163/,Hearts of Fire,"Bristol, England, UK",(concert scenes)                        ,"Bristol, City of Bristol, South West England, England, United Kingdom",51.4538022,-2.5972985
653,/title/tt0093163/,Hearts of Fire,"Hamilton, Ontario, Canada",,"Hamilton, Golden Horseshoe, Ontario, L8P 0B3, Canada",43.2560802,-79.8728583
654,/title/tt0093163/,Hearts of Fire,"Toronto, Ontario, Canada",,"Toronto, Peel, Golden Horseshoe, Ontario, Canada",43.6534817,-79.3839347
655,/title/tt0093163/,Hearts of Fire,UK,,United Kingdom,54.7023545,-3.2765753
656,/title/tt1549571/,Pure Country 2: The Gift,"Nashville, Tennessee, USA",,"Nashville-Davidson, Davidson County, Tennessee, United States of America",36.1622296,-86.7743531
657,/title/tt1549571/,Pure Country 2: The Gift,USA,,United States,39.7837304,-100.4458825
658,/title/tt0812243/,Ex Drummer,"Ostend, Flanders, Belgium",,"Oostende, West-Vlaanderen, Vlaanderen, 8400, België - Belgique - Belgien",51.2258565,2.919496
659,/title/tt0812243/,Ex Drummer,Belgium,,België / Belgique / Belgien,50.6402809,4.6667145
660,/title/tt0103757/,Bad Channels,"Los Angeles, California, USA",,"Los Angeles, Los Angeles County, California, United States of America",34.0536909,-118.2427666
661,/title/tt0478829/,Vitus,"Zürich, Kanton Zürich, Switzerland",,"Zürich, Bezirk Zürich, Zürich, Switzerland",47.3723941,8.5423328
662,/title/tt0478829/,Vitus,"Solothurn, Kanton Solothurn, Switzerland",,"Solothurn, Bezirk Solothurn, Amtei Solothurn-Lebern, Solothurn, Switzerland",47.2081355,7.5384045
663,/title/tt1229360/,It Might Get Loud,"Detroit, Michigan, USA",,"Detroit, Wayne County, Michigan, United States of America",42.3315509,-83.0466403
664,/title/tt1229360/,It Might Get Loud,"Headley Grange, Headley, Hampshire, England, UK",,"Headley Grange, Headley, East Hampshire, Hampshire, South East, England, GU35 8NG, United Kingdom",51.11377085,-0.8194832797095731
665,/title/tt1229360/,It Might Get Loud,"Austin, Texas, USA",,"Austin, Travis County, Texas, United States of America",30.2711286,-97.7436995
666,/title/tt1229360/,It Might Get Loud,"Nashville, Tennessee, USA",,"Nashville-Davidson, Davidson County, Tennessee, United States of America",36.1622296,-86.7743531
667,/title/tt1229360/,It Might Get Loud,"Seattle, Washington, USA",,"Seattle, King County, Washington, United States of America",47.6038321,-122.3300624
668,/title/tt0170980/,The Mike Douglas Show,"Cleveland, Ohio, USA",(studio) (studio:)                        ,"Cleveland, Cuyahoga County, Ohio, United States of America",41.5051613,-81.6934446
669,/title/tt0170980/,The Mike Douglas Show,"KYW - 5th & Market Streets, Philadelphia, Pennsylvania, USA",(studio)                        ,,,
670,/title/tt0170980/,The Mike Douglas Show,"Philadelphia, Pennsylvania, USA",,"Philadelphia, Philadelphia County, Pennsylvania, United States of America",39.9527237,-75.1635262
671,/title/tt1409008/,Memphis Beat,"New Orleans, Louisiana, USA",,"New Orleans, Orleans Parish, Louisiana, United States of America",29.9499323,-90.0701156
672,/title/tt5213534/,Supersonic,"Knebworth House, Knebworth, Stevenage, Hertfordshire, England, UK",,"Knebworth, Station Approach, Knebworth, Hertfordshire, East of England, England, SG3 6AT, United Kingdom",51.8670421,-0.187051
673,/title/tt1042499/,Filth and Wisdom,"London, England, UK",,"London, Greater London, England, United Kingdom",51.5073219,-0.1276474
674,/title/tt1042499/,Filth and Wisdom,UK,,United Kingdom,54.7023545,-3.2765753
675,/title/tt1791504/,Beastie Boys: Fight for Your Right Revisited,"Warner Brothers Burbank Studios - 4000 Warner Boulevard, Burbank, California, USA",,,,
676,/title/tt5662106/,Beyoncé: Lemonade,"Louisiana, USA",,"Louisiana, United States of America",30.8703881,-92.007126
677,/title/tt5662106/,Beyoncé: Lemonade,"Madewood Plantation - 4250 Highway 308, Napoleonville, Louisiana, USA",,,,
678,/title/tt9406716/,Pantene Altin Kelebek Ödül Töreni,"Zorlu Center, Istanbul, Turkey",,"Zorlu Center, 2, Koru Sokak, Levazım Mahallesi, Beşiktaş, İstanbul, Marmara Bölgesi, 3430, Türkiye",41.0658357,29.0172586
679,/title/tt0084171/,Jekyll and Hyde... Together Again,"Los Angeles, California, USA",,"Los Angeles, Los Angeles County, California, United States of America",34.0536909,-118.2427666
680,/title/tt5032492/,Teit meistä kauniin,"Heinola, Finland",,"Heinola, Lahden seutukunta, Päijät-Häme, Manner-Suomi, Suomi",61.2027188,26.031371
681,/title/tt5032492/,Teit meistä kauniin,"Nuorisoseurantalo, Koria, Elimäki, Kouvola, Finland",(final scene concert venue)                        ,,,
682,/title/tt5032492/,Teit meistä kauniin,"Nuorisoseurantalo, Koria, Elimäki, Kouvola, Finland",,,,
683,/title/tt0096223/,Tapeheads,"Los Angeles, California, USA",,"Los Angeles, Los Angeles County, California, United States of America",34.0536909,-118.2427666
684,/title/tt0461694/,Vier Minuten,"Luckau, Brandenburg, Germany",,"Luckau, Dahme-Spreewald, Brandenburg, 15926, Deutschland",51.8524163,13.7150055
685,/title/tt0461694/,Vier Minuten,"Mannheim, Baden-Württemberg, Germany",,"Mannheim, Baden-Württemberg, 68159, Deutschland",49.489591,8.467236
686,/title/tt0391666/,Morangos com Açúcar,"Natal, Rio Grande do Norte, Brazil",,"Natal, Região Geográfica Imediata de Natal, Região Geográfica Intermediária de Natal, Rio Grande do Norte, Região Nordeste, Brasil",-5.805398,-35.2080905
687,/title/tt0391666/,Morangos com Açúcar,"Costa do Sol, Lisbon, Portugal",,"Costa do Sol, 144, Rua Domingos Sequeira, Areias, Estoril, Cascais e Estoril, Cascais, Lisboa, Grande Lisboa, Área Metropolitana de Lisboa, 2765-542, Portugal",38.6982789,-9.3746811
688,/title/tt0391666/,Morangos com Açúcar,"Funchal, Madeira, Portugal",,"Funchal, Madeira, 9000-072, Portugal",32.6496497,-16.9086783
689,/title/tt0391666/,Morangos com Açúcar,"Lisbon, Portugal",,"Lisboa, Grande Lisboa, Área Metropolitana de Lisboa, Portugal",38.7077507,-9.1365919
690,/title/tt0391666/,Morangos com Açúcar,"London, England, UK",,"London, Greater London, England, United Kingdom",51.5073219,-0.1276474
691,/title/tt0391666/,Morangos com Açúcar,"NPB Studios, Vialonga, Lisbon, Portugal",,,,
692,/title/tt0095037/,"Distant Voices, Still Lives","Liverpool, Merseyside, England, UK",,,,
693,/title/tt1014809/,Until the Light Takes Us,"Milan, Italy",,"Milano, Lombardia, Italia",45.4668,9.1905
694,/title/tt1014809/,Until the Light Takes Us,"Trondheim fengsel, Trondheim, Sør-Trøndelag, Norway",(interview) (Varg Vikernes' interview)                        ,,,
695,/title/tt1014809/,Until the Light Takes Us,Norway,,"Norge, Namsos, Trøndelag, Norge",64.5731537,11.52803643954819
696,/title/tt1014809/,Until the Light Takes Us,USA,,United States,39.7837304,-100.4458825
697,/title/tt0058555/,Scorpio Rising,"Brooklyn, New York City, New York, USA",,"Brooklyn, Kings County, New York, United States of America",40.6501038,-73.9495823
698,/title/tt0058555/,Scorpio Rising,"Walden's Pond, New York, USA",,"Walden's Pond, Walden Lane, Eddy Corners, City of Saratoga Springs, Saratoga County, New York, 12866, United States of America",43.052222900000004,-73.772071186385
699,/title/tt2442526/,Ring of Fire,"Atlanta, Georgia, USA",,"Atlanta, Georgia, United States of America",33.7490987,-84.3901849
700,/title/tt1047011/,Song for Marion,"Durham Johnston Comprehensive School, County Durham, England, UK",(interior)                        ,,,
701,/title/tt1047011/,Song for Marion,"Devon Crescent, County Durham, England, UK",(interior scenes in garage)                        ,,,
702,/title/tt1047011/,Song for Marion,"Tyne Journal Theatre, Newcastle upon Tyne, England, UK",(interior choir contest)                        ,,,
703,/title/tt1047011/,Song for Marion,"Crystal Palace, London, England, UK",,"Crystal Palace, London Borough of Bromley, London, Greater London, England, SE19 2GA, United Kingdom",51.4193664,-0.0711328
704,/title/tt1047011/,Song for Marion,"Battersea Park, Battersea, London, England, UK",(Arthur going for a stroll after his argument with Marion)                        ,"Battersea Park, Battersea, London Borough of Wandsworth, London, Greater London, England, United Kingdom",51.479193300000006,-0.15707865471804333
705,/title/tt0061589/,Dont Look Back,"Greenwood, Mississippi, USA","(footage of Dylan singing ""Only a Pawn in Their Game"")                        ","Greenwood, Leflore County, Mississippi, United States of America",33.5162315,-90.1795281
706,/title/tt0061589/,Dont Look Back,"Manchester, England, UK",,"Manchester, Greater Manchester, North West England, England, United Kingdom",53.4794892,-2.2451148
707,/title/tt0061589/,Dont Look Back,"London, England, UK",,"London, Greater London, England, United Kingdom",51.5073219,-0.1276474
708,Code,Show Name,Location,Scene,"Location, Tucker County, West Virginia, United States of America",39.2138905,-79.6371124
709,/title/tt0065872/,I Never Sang for My Father,"New York City, New York, USA",,"New York, United States of America",40.7127281,-74.0060152
710,/title/tt0065872/,I Never Sang for My Father,"JFK International Airport, Jamaica, Queens, New York City, New York, USA",(Terminal 2 - Gene meets his parents at the airport)                        ,,,
711,/title/tt1171225/,Brütal Legend,"Record Surplus, 11609 West Pico Boulevard, Los Angeles, California, USA",(record store in live-action Jack Black game intro)                        ,,,
712,/title/tt0407398/,Hi Hi Puffy AmiYumi,"New York City, New York, USA",,"New York, United States of America",40.7127281,-74.0060152
713,/title/tt0407398/,Hi Hi Puffy AmiYumi,"Los Angeles, California, USA",,"Los Angeles, Los Angeles County, California, United States of America",34.0536909,-118.2427666
714,/title/tt1837613/,Northern Soul,"Bentley Lane, Bury, Greater Manchester, England, UK",(Bridge Matt drives under in the final scene.)                        ,"Bentley Lane, Chesham, Bury, Greater Manchester, North West England, England, BL9 6RZ, United Kingdom",53.6239955,-2.2874662
715,/title/tt1837613/,Northern Soul,"Burnley, Lancashire, England, UK",,"Burnley, Lancashire, North West England, England, United Kingdom",53.7907262,-2.2439196
716,/title/tt0488349/,Yellow,"New York City, New York, USA",,"New York, United States of America",40.7127281,-74.0060152
717,/title/tt2218364/,Sigur Rós: Fjögur píanó,"Los Angeles, California, USA",,"Los Angeles, Los Angeles County, California, United States of America",34.0536909,-118.2427666
718,/title/tt0381270/,Ils se marièrent et eurent beaucoup d'enfants,"Marrakech, Morocco",,"Marrakech ⵎⵕⵕⴰⴽⵛ مراكش, Pachalik de Marrakech, Préfecture de Marrakech عمالة مراكش, Marrakech-Safi ⵎⵕⵕⴰⴽⵛ-ⴰⵙⴼⵉ مراكش-أسفي, 40034, Maroc",31.6258257,-7.9891608
719,/title/tt1964831/,Katy Perry: Last Friday Night (T.G.I.F.),"Agoura Hills, California, USA",,"Agoura Hills, Los Angeles County, California, 91301, United States of America",34.14791,-118.7657042
720,/title/tt0087188/,E la nave va,"Cinecittà Studios, Cinecittà, Rome, Lazio, Italy",(studio)                        ,,,
721,/title/tt0061610/,Elvis beat en blues,"Long Beach Naval Station, San Pedro, Los Angeles, California, USA",,,,
722,/title/tt4238858/,The Fits,"Cincinnati, Ohio, USA",,"Cincinnati, Hamilton County, Ohio, United States of America",39.1014537,-84.5124602
723,/title/tt0033601/,Fighting Bill Fargo,"Universal Studios - 100 Universal City Plaza, Universal City, California, USA",(studio)                        ,,,
724,/title/tt0073822/,Trollflöjten,"Drottningholm Castle Theater, Drottningholm Castle, Drottningholm, Stockholms län, Sweden",,,,
725,/title/tt0073822/,Trollflöjten,"Filmhusateljéerna, Filmhuset, Svenska Filminstitutet, Gärdet, Stockholm, Stockholms län, Sweden",(studio)                        ,,,
726,/title/tt0073822/,Trollflöjten,"Stockholm, Stockholms län, Sweden",,"Stockholm, Stockholms kommun, Stockholms län, Svealand, 111 29, Sverige",59.3251172,18.0710935
727,/title/tt0073800/,O thiasos,"Ioannina, Greece",,"Ιωάννινα, Δήμος Ιωαννιτών, Περιφερειακή Ενότητα Ιωαννίνων, Περιφέρεια Ηπείρου, Αποκεντρωμένη Διοίκηση Ηπείρου - Δυτικής Μακεδονίας, 45333, Ελλάδα",39.6639818,20.8522784
728,/title/tt0073800/,O thiasos,"Mesolongi, Greece",(Exteriors of the Old Railroad Station of Mesolongi)                        ,"Μεσολόγγι, Δήμος Ιεράς Πόλεως Μεσολογγίου, Περιφερειακή Ενότητα Αιτωλοακαρνανίας, Περιφέρεια Δυτικής Ελλάδας, Αποκεντρωμένη Διοίκηση Πελοποννήσου, Δυτικής Ελλάδας και Ιονίου, 30200, Ελλάδα",38.3686353,21.4283544
729,/title/tt0073800/,O thiasos,"Zagorohoria, Ipiros, Greece",(mountain scene)                        ,,,
730,/title/tt0073800/,O thiasos,"Lefkada, Greece","(Prison of Lefkada, now demolished)                        ","Λευκάδα, Δήμος Λευκάδας, Περιφερειακή Ενότητα Λευκάδας, Περιφέρεια Ιονίων Νήσων, Αποκεντρωμένη Διοίκηση Πελοποννήσου, Δυτικής Ελλάδας και Ιονίου, Ελλάδα",38.7064968,20.64176774486984
731,/title/tt0073800/,O thiasos,"Lefkada, Greece",(Filippa Papagou Street)                        ,"Λευκάδα, Δήμος Λευκάδας, Περιφερειακή Ενότητα Λευκάδας, Περιφέρεια Ιονίων Νήσων, Αποκεντρωμένη Διοίκηση Πελοποννήσου, Δυτικής Ελλάδας και Ιονίου, Ελλάδα",38.7064968,20.64176774486984
732,/title/tt0073800/,O thiasos,"Karditsa, Greece",(Public Market of Karditsa)                        ,"Καρδίτσα, Δήμος Καρδίτσας, Περιφερειακή Ενότητα Καρδίτσας, Περιφέρεια Θεσσαλίας, Αποκεντρωμένη Διοίκηση Θεσσαλίας - Στερεάς Ελλάδας, 43100, Ελλάδα",39.3634604,21.9211192
733,/title/tt0073800/,O thiasos,"Karditsa, Greece",(interiors of a hotel)                        ,"Καρδίτσα, Δήμος Καρδίτσας, Περιφερειακή Ενότητα Καρδίτσας, Περιφέρεια Θεσσαλίας, Αποκεντρωμένη Διοίκηση Θεσσαλίας - Στερεάς Ελλάδας, 43100, Ελλάδα",39.3634604,21.9211192
734,/title/tt0073800/,O thiasos,"Xanthi, Greece",(Antika Square)                        ,"Ξάνθη, Δήμος Ξάνθης, Περιφερειακή Ενότητα Ξάνθης, Περιφέρεια Ανατολικής Μακεδονίας και Θράκης, Αποκεντρωμένη Διοίκηση Μακεδονίας - Θράκης, 67100, Ελλάδα",41.1380289,24.8862688
