,Code,Show Name,Location,Scene,geocodedLocation,latitude,longitude
325,/title/tt0062994/,,"Warner Brothers Burbank Studios - 4000 Warner Boulevard, Burbank, California, USA",(studio) (interiors),,,
326,/title/tt0384642/,,"Bean Town Coffee Bar - 45 N. Baldwin Avenue, Sierra Madre, California, USA",(Coffee Bar),,,
327,/title/tt0384642/,,"Freeway Park, Backlot, Universal Studios - 100 Universal City Plaza, Universal City, California, USA",,,,
328,/title/tt0384642/,,"Colonial Street, Backlot, Universal Studios - 100 Universal City Plaza, Universal City, California, USA",,,,
329,/title/tt0096018/,,"Union Beach, New Jersey, USA",,"Union Beach, New Jersey, United States of America",40.4464962,-74.1781988
330,/title/tt0096018/,,"Route 9W, Palisades NY, Rockland County, New York, USA",(Gas station in beginning where license plates are changed on van),,,
331,/title/tt0096018/,,"Alice Tully Hall, 1941 Broadway, Lincoln Center, Lincoln Center, Manhattan, New York City, New York, USA",(Danny's music audition),,,
332,/title/tt0096018/,,"Empire Stages of New York - 25-19 Borden Street, Long Island City, Queens, New York City, New York, USA",(studio),,,
333,/title/tt0096018/,,"Broadway and West 66 Street, New York, USA",(River Phoenix running from Julliard across B'way to phone booth),,,
334,/title/tt2548214/,,"21, Brakes Crescent, Miami, Queensland, Australia",(Rita's House),"Brakes Crescent, Miami, Gold Coast City, Queensland, 4220, Australia",-28.0712947,153.4447744
335,/title/tt2548214/,,"Southport Pier, Gold Coast, Queensland, Australia",(The Ocean Cafe),,,
336,/title/tt2548214/,,"Burleigh Heads, Queensland, Australia",(Mako Island seashore),"Burleigh Heads, Gold Coast City, Queensland, Australia",-28.1021343,153.4395799
337,/title/tt0098966/,,"Douai Abbey School, Reading, Berkshire, England, UK",,,,
338,/title/tt0098966/,,"Burton Dassett Hills, Warwickshire, England, UK",(outdoor filming - Peter uses red phone box),"Burton Dassett Hills Country Park, Burton Dassett CP, Stratford-on-Avon, Warwickshire, England, United Kingdom",52.1649139,-1.4218981946999083
339,/title/tt0098966/,,"Banbury, Oxfordshire, England, UK",,"Banbury, Station Road, Banbury, Cherwell, Oxfordshire, South East, England, OX16 5AB, United Kingdom",52.0605712,-1.3277563
340,/title/tt0098966/,,"London, England, UK",,"London, Greater London, England, United Kingdom",51.5073219,-0.1276474
341,/title/tt0098966/,,"New York City, New York, USA",,"New York, United States of America",40.7127281,-74.0060152
342,/title/tt0498381/,,"Atlanta, Georgia, USA",,"Atlanta, Georgia, United States of America",33.7490987,-84.3901849
343,/title/tt0498381/,,"Decatur, Georgia, USA",,"Decatur, DeKalb County, Georgia, United States of America",33.7737582,-84.296069
344,/title/tt0498381/,,"1 Main St. Grantville, GA 30220, USA",(Town where girl was abducted),"1, Main Street, Grantville, Coweta, Georgia, 30220, United States of America",33.234485,-84.835491
345,/title/tt0108394/,,"Piscine Pontoise - 19 Rue de Pontoise, Paris 5, Paris, France",(swimming pool),"Piscine Pontoise, Rue de Pontoise, Quartier Saint-Victor, Paris, Île-de-France, France métropolitaine, 75005, France",48.8490865,2.3517529668744435
346,/title/tt0108394/,,"Rue de l'Alboni, Paris 16, Paris, France",(Julie running after Olivier's car),"Rue de l'Alboni, Paris 16e Arrondissement, Paris, Île-de-France, France métropolitaine, 75016, France",48.8569256,2.2863602
347,/title/tt0108394/,,"Paris, France",,"Paris, Île-de-France, France métropolitaine, 75004, France",48.8566969,2.3514616
348,/title/tt0108394/,,"Studio Paris Est, Le Pré-Saint-Gervais, Seine-Saint-Denis, France",(studio),,,
349,/title/tt1175709/,,"Fairfield University - 1073 N. Benson Road, Fairfield, Connecticut, USA",,"Fairfield University, 1073, North Benson Road, Tunxis Hill, Fairfield, Fairfield County, Connecticut, 06824, United States of America",41.15967565,-73.25740310197213
350,/title/tt1175709/,,"Bridgeport, Connecticut, USA",,"Bridgeport, Fairfield County, Connecticut, United States of America",41.1670412,-73.2048348
351,/title/tt1175709/,,"New York City, New York, USA",,"New York, United States of America",40.7127281,-74.0060152
352,/title/tt1175709/,,"Waterbury, Connecticut, USA",,"Waterbury, New Haven County, Connecticut, United States of America",41.5538091,-73.0438362
353,/title/tt1175709/,,"Newtown, Connecticut, USA",,"Newtown, Fairfield County, Connecticut, United States of America",41.4134764,-73.3086445
354,/title/tt1175709/,,"The Basket Shop, Gaylordsville, Connecticut, USA",('All Good Things' shop),,,
355,/title/tt3622592/,,"Central Cabarrus High School - Concord, North Carolina, USA",(High School Scenes),"Central Cabarrus High School, Central Cabarrus High Road, Concord, Cabarrus County, North Carolina, 28025, United States of America",35.36244385,-80.58261365365598
356,/title/tt3622592/,,"Kannapolis, North Carolina, USA",,"Kannapolis, Cabarrus County, North Carolina, United States of America",35.4874708,-80.621438
357,/title/tt3622592/,,"Los Angeles, California, USA",,"Los Angeles, Los Angeles County, California, United States of America",34.0536909,-118.2427666
358,/title/tt3622592/,,USA,,United States,39.7837304,-100.4458825
359,/title/tt3622592/,,"California, USA",,"California, United States of America",36.7014631,-118.7559974
360,/title/tt0045793/,,"Hawaii, USA",,"Hawaii, United States of America",19.58726775,-155.42688965312746
361,/title/tt0045793/,,"Diamond Head, O'ahu, Hawaii, USA",,,,
362,/title/tt0045793/,,"Waialae Golf Course - 4997 Kahala Avenue, Honolulu, O'ahu, Hawaii, USA",(Prewitt caught while trying to join his company the night after the attack),,,
363,/title/tt0045793/,,"Schofield Barracks, Wilkina Drive, O'ahu, Hawaii, USA",(on location),,,
364,/title/tt0045793/,,"Kolekole Pass, O'ahu, Hawaii, USA",(Prewitt hiking up the pass as punishment),,,
365,/title/tt0094812/,,"Burlington, North Carolina, USA",(Burlington Athletic Stadium),"Burlington, Alamance County, North Carolina, United States of America",36.0956918,-79.4377991
366,/title/tt0094812/,,"Greensboro, North Carolina, USA",(World War Memorial Stadium),"Greensboro, Guilford County, North Carolina, United States of America",36.0726355,-79.7919754
367,/title/tt0094812/,,"North Carolina, USA",,"North Carolina, United States of America",35.6729639,-79.0392919
368,/title/tt0094812/,,"Wilson, North Carolina, USA",(Fleming Stadium),"Wilson County, North Carolina, United States of America",35.7059114,-77.9175714
369,/title/tt0094812/,,"Duke University, Durham, North Carolina, USA",,"Duke University, Sumter Street, Burch Avenue, Mill Grove, Durham, Durham County, North Carolina, 27708, United States of America",36.00015569999999,-78.94422972195878
370,/title/tt0094812/,,"Six Flags Over Texas - 2201 Road to Six Flags Street E., Arlington, Texas, USA",,,,
371,/title/tt0758766/,,"201 West 72nd Street, Manhattan, New York City, New York, USA",(interiors),"The Alexandria, 201, West 72nd Street, Upper West Side, Manhattan Community Board 7, Manhattan, New York County, New York, 10023, United States of America",40.7792301,-73.98240724279347
372,/title/tt0758766/,,"7th Ave Entrance, Madison Square Garden - 50th Street and Eighth Avenue, Manhattan, New York City, New York, USA",,,,
373,/title/tt0758766/,,"New York City, New York, USA",,"New York, United States of America",40.7127281,-74.0060152
374,/title/tt0758766/,,"Tower Records - 1961 Broadway, Manhattan, New York City, New York, USA",,,,
375,/title/tt0080365/,,"Burbank City Hall - 275 E. Olive Ave, Burbank, California, USA",(The place where Julian is accosted by the press after being arrested),"Burbank City Hall, 275, Olive Avenue, Burbank, Los Angeles County, California, 91502, United States of America",34.18207,-118.3081036
376,/title/tt0080365/,,"Hollywood Boulevard, Hollywood, Los Angeles, California, USA",(Julian's drive in the Ford Pinto),"Hollywood Boulevard, Whitley Heights Historic District, Hollywood, Los Angeles, Los Angeles County, California, 90028, United States of America",34.1015833,-118.3324947
377,/title/tt0080365/,,"Tower Records - 1028 Westwood Blvd, Westwood, Los Angeles, California, USA",,,,
378,/title/tt0080365/,,"Paramount Studios - 5555 Melrose Avenue, Hollywood, Los Angeles, California, USA",(Polo Lounge) (Apartment of Julian) (Bedroom of Michelle) (Office of Detective Sunday),,,
379,/title/tt0080365/,,"Perino's Restaurant - 4101 Wilshire Boulevard, Los Angeles, California, USA",(demolished),,,
380,/title/tt0080365/,,"Palm Springs, California, USA",(Julian does a sub gig for Leon that happens to be a rough trick and the beginning of his future demise as the #1 gigolo in L.A.'s HiSo),"Palm Springs, Riverside County, California, United States of America",33.8246269,-116.540303
381,/title/tt0080365/,,"2389 Yosemite, Palm Springs, California, USA",(Rheiman's house),"2389, Yosemite Drive, Palm Springs, Riverside County, California, 92264, United States of America",33.78879906596222,-116.53512108486694
382,/title/tt0080365/,,"Sterling International Towers - 10390 Wilshire Blvd, Los Angeles, California, USA",(Leon's apartment),,,
383,/title/tt0080365/,,"Southern California, California, USA",,"University of Southern California, Flower Street, University Park, Los Angeles, Los Angeles County, California, 90089-0871, United States of America",34.0218833,-118.28586726915088
384,/title/tt0080365/,,"Whitewater, California, USA",(road scenes),"Whitewater, Riverside County, California, United States of America",33.9250147,-116.6383477
385,/title/tt0080365/,,"Mt. Olympus, Hollywood Hills, Los Angeles, California, USA",,,,
386,/title/tt0080365/,,"Rodeo Drive, Beverly Hills, California, USA",,"Rodeo Drive, Beverly Hills, Los Angeles County, California, 90210, United States of America",34.0677138,-118.4015534
387,/title/tt0080365/,,"Westwood Boulevard, Westwood, Los Angeles, California, USA",,"Westwood Boulevard, Westwood Village, Westwood, Los Angeles, Los Angeles County, California, 90024, United States of America",34.0609075,-118.4454788
388,/title/tt0080365/,,"Beverly Hills Hotel & Bungalows - 9641 Sunset Blvd., Beverly Hills, California, USA",(Julian acts on the behalf of Anne's procurement agency as a limo chauffeur for widow Mrs Dubron. We see how he sells himself for future 'business'),,,
389,/title/tt0080365/,,"The Daisy - 326 N Rodeo Dr, Beverly Hills, California, USA",(as the Daisy Café) (Julian meets with Leon at café),,,
390,/title/tt0080365/,,"CA-111 Hwy, Whitewater, California, USA",(road scenes),"CA 111, Snow Creek, Palm Springs, Riverside County, California, United States of America",33.9156335,-116.6715199
391,/title/tt0080365/,,"Weyburn Avenue, Los Angeles, California, USA",(street scenes),"Weyburn Avenue, Westwood Village, Westwood, Los Angeles, Los Angeles County, California, 90024-2704, United States of America",34.0619187,-118.4481073
392,/title/tt0080365/,,"1365 S Oakland Avenue, Pasadena, California, USA",(Lisa Williams' mansion),"1365, South Oakland Avenue, Madison Heights, Pasadena, Los Angeles County, California, 91106, United States of America",34.12272138844446,-118.13971600435714
393,/title/tt0080365/,,"Eurochow Restaurant - 1099 Westwood Boulevard, Westwood, Los Angeles, California, USA",,,,
394,/title/tt0080365/,,"Westwood Village, Westwood, Los Angeles, California, USA",,"Westwood Village, Westwood, Los Angeles, Los Angeles County, California, 90024-3990, United States of America",34.0594537,-118.4442462
395,/title/tt0080365/,,"Hollywood, Los Angeles, California, USA",,"Hollywood, Los Angeles, Los Angeles County, California, 90028-8127, United States of America",34.0980031,-118.329523
396,/title/tt0080365/,,"Malibu, California, USA",,"Malibu, Los Angeles County, California, 90265-4797, United States of America",34.035591,-118.689423
397,/title/tt0080365/,,"Westwood, Los Angeles, California, USA",,"Westwood, Los Angeles, Los Angeles County, California, 90024-3990, United States of America",34.0561207,-118.4306347
398,/title/tt0080365/,,"California, USA",,"California, United States of America",36.7014631,-118.7559974
399,/title/tt4226388/,,"Friedrichstraße, Kreuzberg, Berlin, Germany",(apartment buildings and Victoria's café),"Friedrichstraße, Kreuzberg, Friedrichshain-Kreuzberg, Berlin, 10969, Deutschland",52.5028169,13.3911473
400,/title/tt4226388/,,"Zimmerstraße, Kreuzberg, Berlin, Germany",(robbery),,,
401,/title/tt4226388/,,"Berlin, Germany",,"Berlin, 10117, Deutschland",52.5170365,13.3888599
402,/title/tt4986098/,,"Gran Canaria, Canary Islands, Spain",,"Gran Canaria, Tejeda, Las Palmas, Canarias, España",27.9580004,-15.6062305376665
403,/title/tt4986098/,,"Campus de Tafira, Gran Canaria, Canary Islands, Spain",(Some interiors),,,
404,/title/tt0892791/,,"New York City, New York, USA",,"New York, United States of America",40.7127281,-74.0060152
405,/title/tt0387131/,,"Canary Wharf, Isle of Dogs, London, England, UK",(interiors),"Canary Wharf, Isle of Dogs, London Borough of Tower Hamlets, London, Greater London, England, E14 5AX, United Kingdom",51.5048954,-0.0190006
406,/title/tt0387131/,,"Winnipeg, Manitoba, Canada",,"Winnipeg, Winnipeg (city), Manitoba, Canada",49.8955367,-97.1384584
407,/title/tt0387131/,,"Tate Modern, Bankside, Southwark, London, England, UK",(interior press conference scene),"Tate Modern, Bankside, Southwark, London Borough of Southwark, London, Greater London, England, SE1 9TG, United Kingdom",51.507456649999995,-0.09934365815375101
408,/title/tt0387131/,,"Canary Wharf Underground Station, Canary Wharf, Isle of Dogs, London, England, UK",(interiors),"Adam, Reuters Plaza, Canary Wharf, Isle of Dogs, London Borough of Tower Hamlets, London, Greater London, England, E14 5AJ, United Kingdom",51.5037578,-0.0192977
409,/title/tt0387131/,,"Winnipeg, Manitoba, Canada",(KDH Laboratory: sequence deleted),"Winnipeg, Winnipeg (city), Manitoba, Canada",49.8955367,-97.1384584
410,/title/tt0387131/,,"Studio Babelsberg, Potsdam, Brandenburg, Germany",(studio) (interiors),"Studio Babelsberg, 15, Babelsberg, Potsdam, Brandenburg, 14482, Deutschland",52.38260355,13.113726021425222
411,/title/tt0387131/,,"Lord Errol Restaurant, Nairobi, Kenya",(British High Commission cocktail party),,,
412,/title/tt0387131/,,"London, England, UK",,"London, Greater London, England, United Kingdom",51.5073219,-0.1276474
413,/title/tt0387131/,,"Nairobi City Mortuary, Nairobi, Kenya",(deceased body being identified),"City Mortuary, Round About, Opposite Daystar University, Mbagathi Way, Ngong Rd, Nairobi, Mbagathi Way, Highview estate, Hurlingham, Nairobi, 30728, Kenya",-1.2994240499999998,36.80255054494054
414,/title/tt0387131/,,"Bankside, Southwark, London, England, UK",,"Bankside, Southwark, London Borough of Southwark, London, Greater London, England, SE1 9TG, United Kingdom",51.5074991,-0.0993021
415,/title/tt0387131/,,"River Thames, England, UK",,"River Thames, Bisham, Windsor and Maidenhead, South East, England, OX1 4LB, United Kingdom",51.5601534,-0.7793712
416,/title/tt0387131/,,"Akademie der Künste, Berlin, Germany",(British High Commission offices),"Akademie der Künste, 4, Pariser Platz, Mitte, Berlin, 10117, Deutschland",52.5154125,13.379618031158628
417,/title/tt0387131/,,"Brandenburg, Germany",,"Brandenburg, Deutschland",52.8455492,13.2461296
418,/title/tt0387131/,,"Records Office, Kenyatta Hospital, Nairobi, Kenya",,,,
419,/title/tt0387131/,,"Racecourse Karen, Nairobi, Kenya",,,,
420,/title/tt0387131/,,"River Road, Nairobi, Kenya",,"River Road, Ngara, Nairobi, 00300, Kenya",-1.2847578,36.830793
421,/title/tt0387131/,,"Kiambu, Kenya",,"Kiambu, Central Kenya, Kenya",-1.03207695,36.81568670212907
422,/title/tt0387131/,,"Central Province, Kenya",,"Central bar, Juja Road, Kariobangi, Nairobi, 00611, Kenya",-1.2591659,36.8693614
423,/title/tt0387131/,,"Z. Boskovic Air Charters, Wilson Airport, Nairobi, Kenya",,,,
424,/title/tt0387131/,,"Wilson Airport, Nairobi, Kenya",,"Wilson Airport, Langata Link Road, Siwaka Estate, Nairobi, P. O. BOX 41362, Kenya",-1.32439265,36.81116805559256
425,/title/tt0387131/,,"Kiambu Police Station, Kiambu, Kenya",(police station sequence),"Kiambu Police Station, Kiambu Road, Edenville, Thathi-ini, Kiambu, Central Kenya, 00900, Kenya",-1.1725295999999998,36.83245078648374
426,/title/tt0387131/,,"Rift Valley, Kenya",(car chase),"Rift Valley, Frankfurter Straße, Hüttenberg, Lahn-Dill-Kreis, Regierungsbezirk Gießen, Hessen, 35578, Deutschland",50.538602100000006,8.543610614351664
427,/title/tt0387131/,,"Lake Magadi, Kenya","(Lake Turkana, Kenya)","Lake Magadi, C58, Magadi, Kajiado, Kenya",-1.75715105,36.276363166854615
428,/title/tt0387131/,,"Lokichoggio, Kenya",,"Lokichogio, Turkana, Kenya",4.2050673,34.3600434
429,/title/tt0387131/,,"Kenya-Sudan Border, Kenya",(aerial views) (food drop),,,
430,/title/tt0387131/,,"England, UK",,"England, United Kingdom",52.7954791,-0.5402402866174321
431,/title/tt0109456/,,"11400 Olympic Boulevard, West Los Angeles, Los Angeles, California, USA",,"Olympic Boulevard, East Los Angeles, Los Angeles County, California, 90022, United States of America",34.0189191,-118.174151
432,/title/tt0109456/,,"Los Angeles, California, USA",,"Los Angeles, Los Angeles County, California, United States of America",34.0536909,-118.2427666
433,/title/tt0109456/,,"West Hollywood, California, USA",,"West Hollywood, Los Angeles County, California, United States of America",34.0923014,-118.3692894
434,/title/tt0218967/,,"Tarrytown, New York, USA",,"Tarrytown, Town of Greenburgh, Westchester County, New York, 10591, United States of America",41.0762077,-73.8587461
435,/title/tt0218967/,,"Los Angeles, California, USA",,"Los Angeles, Los Angeles County, California, United States of America",34.0536909,-118.2427666
436,/title/tt0218967/,,"Newark, New Jersey, USA",,"Newark, Essex County, New Jersey, United States of America",40.735657,-74.1723667
437,/title/tt1571249/,,"Kensico Dam, Valhalla, New York, USA",(Milo and Lance landscaping job),"Kensico Dam Plaza, 1, Town of North Castle, Westchester County, New York, United States of America",41.072304849999995,-73.76635467758057
438,/title/tt1571249/,,"New York City, New York, USA",,"New York, United States of America",40.7127281,-74.0060152
439,/title/tt1033643/,,"Planet Hollywood Resort and Casino - 3667 Las Vegas Boulevard South, Las Vegas, Nevada, USA",,,,
440,/title/tt1033643/,,"Oheka Castle - 135 West Gate Drive, Huntington, Long Island, New York, USA",,,,
441,/title/tt1033643/,,"Las Vegas, Nevada, USA",,"Las Vegas, Clark County, Nevada, United States of America",36.1672559,-115.1485163
442,/title/tt0093936/,,"Somers, New York, USA",,"Somers, Town of Somers, Westchester County, New York, 10589, United States of America",41.3281498,-73.6856857
443,/title/tt0093936/,,"1166 Avenue of the Americas, New York City, New York, USA",(Pemrose Interiors and Executive Offices),"1166 Avenue of the Americas, 1166, 6th Avenue, Midtown, Manhattan Community Board 5, Manhattan, New York County, New York, 10019, United States of America",40.756877849999995,-73.98200360000001
444,/title/tt0093936/,,"101 Park Avenue, Manhattan, New York City, New York, USA",(Brantley's First Job),"101 Park Avenue, 101, Park Avenue, Murray Hill, Manhattan Community Board 5, Manhattan, New York County, New York, 10016, United States of America",40.7508354,-73.97760948434279
445,/title/tt0093936/,,"New York City, New York, USA",,"New York, United States of America",40.7127281,-74.0060152
446,/title/tt0093936/,,"Kaufman Astoria Studios - 3412 36th Street, Astoria, Queens, New York City, New York, USA",(studio),,,
447,/title/tt6920356/,,"Venice, Italy",(Trip with Lover),"Venezia, Veneto, Italia",45.4371908,12.3345898
448,/title/tt0102744/,,"Alice Springs, Northern Territory, Australia",,"Alice Springs, Town of Alice Springs, Northern Territory, 0870, Australia",-23.6983884,133.8812885
449,/title/tt0102744/,,"Warrnambool, Victoria, Australia",,"Warrnambool, City of Warrnambool, Victoria, 3280, Australia",-38.3826241,142.4814191
450,/title/tt0102744/,,"Glebe, Sydney, New South Wales, Australia",,"Glebe, Sydney, Council of the City of Sydney, New South Wales, 2037, Australia",-33.8777782,151.1862377
451,/title/tt0102744/,,"Victoria, Australia",,"Victoria, Australia",-36.5986096,144.6780052
452,/title/tt0067185/,,"400 Beach St, Santa Cruz, California, USA",(amusement park),"400, Beach Street, Beach & Boardwalk Commercial District, Downtown, Santa Cruz, Santa Cruz County, California, 95060, United States of America",36.9631594440124,-122.02249253437023
453,/title/tt0067185/,,"Holy Cross Cemetery - 1500 Mission Road, Colma, California, USA",(cemeteries),,,
454,/title/tt0067185/,,"Sutro Baths, San Francisco, California, USA",(Maude's protest scene),"Sutro Baths, Sutro Baths Upper Trail, San Francisco, San Francisco City and County, California, 94121-1545, United States of America",37.7802435,-122.5136480374664
455,/title/tt0067185/,,"Emeryville, California, USA",(salt flats with sculptures),"Emeryville, Alameda County, California, 94608, United States of America",37.8314089,-122.2865266
456,/title/tt0067185/,,"Mori Point, Pacifica, California, USA",(car off cliff at end),"Mori Point (GGNRA), Fairway Park, Pacifica, San Mateo County, California, United States of America",37.6189033,-122.49178092105544
457,/title/tt0067185/,,"St. Thomas Aquinas Church, 751 Waverley Street, Palo Alto, California, USA",(church funeral scene),,,
458,/title/tt0067185/,,"950 Skyway Road, San Carlos Airport, San Carlos, California, USA",(Wrecking Yard Scene),,,
459,/title/tt0067185/,,"Berkeley, California, USA",,"Berkeley, Alameda County, California, United States of America",37.8708393,-122.2728639
460,/title/tt0067185/,,"Menlo Park, California, USA",(Tarzan yell),"Menlo Park, San Mateo County, California, United States of America",37.4519671,-122.1779927
461,/title/tt0067185/,,"Oakland, California, USA",,"Oakland, Alameda County, California, United States of America",37.8044557,-122.2713563
462,/title/tt0067185/,,"Daly City, California, USA",,"Daly City, San Mateo County, California, United States of America",37.6904826,-122.4726708
463,/title/tt0067185/,,"San Bruno, California, USA",,"San Bruno, San Mateo County, California, United States of America",37.6261715,-122.4332435
464,/title/tt0067185/,,"Redwood City, California, USA",,"Redwood City, San Mateo County, California, United States of America",37.4863239,-122.2325233
465,/title/tt0067185/,,"Colma, California, USA",,"Colma, San Mateo County, California, United States of America",37.6766821,-122.4596031
466,/title/tt0067185/,,"Palo Alto, California, USA",,"Palo Alto, Santa Clara County, California, United States of America",37.4443293,-122.1598465
467,/title/tt0067185/,,"Santa Cruz, California, USA",,"Santa Cruz County, California, United States of America",37.050096,-121.9905908
468,/title/tt0085154/,,"Conemaugh, Pennsylvania, USA",,"Conemaugh, Cambria County, Pennsylvania, 15901, United States of America",40.3267408,-78.9080805
469,/title/tt0085154/,,"Point Stadium - 100 Johns Street, Johnstown, Pennsylvania, USA",,,,
470,/title/tt0455612/,,"1197 Avon Avenue SW, Atlanta, Georgia, USA",(Madea's House),"1197, Avon Avenue Southwest, Atlanta, Georgia, 30310, United States of America",33.72255705,-84.42718769781926
471,/title/tt4486986/,,"Barcelona, Spain",,"Barcelona, Barcelonès, Catalunya, 08001, España",41.3828939,2.1774322
472,/title/tt4486986/,,"Phuket, Thailand",,"จังหวัดภูเก็ต, ประเทศไทย",7.9366015,98.3529292
473,/title/tt1655460/,,"1818 Joshua Dr., Lawrenceville, Georgia, USA",(Rick and Marisa's residence),,,
474,/title/tt1655460/,,"Atlanta, Georgia, USA",,"Atlanta, Georgia, United States of America",33.7490987,-84.3901849
475,/title/tt1655460/,,"Lawrenceville, Georgia, USA",,"Lawrenceville, Gwinnett County, Georgia, United States of America",33.9562149,-83.9879625
476,/title/tt1655460/,,"Manhattan, New York City, New York, USA",,"Manhattan, New York County, New York, United States of America",40.7896239,-73.9598939
477,/title/tt1655460/,,"New York City, New York, USA",,"New York, United States of America",40.7127281,-74.0060152
478,/title/tt0062430/,,"Katonah, New York, USA",(Lawrenceville train station),"Katonah, Town of Bedford, Westchester County, New York, 10536, United States of America",41.25877,-73.6853852
479,/title/tt0062430/,,"Mount Kisco, New York, USA",(Ice skating on Wallace Pond in Leonard Park),"Mount Kisco, Westchester County, New York, 10549, United States of America",41.2042616,-73.7270761
480,/title/tt0062430/,,"Bedford Village, New York, USA",(Lawrenceville Inn and Village Green),"Bedford, Town of Bedford, Westchester County, New York, 10506, United States of America",41.2041304,-73.642509
481,/title/tt0062430/,,"Gracie Square, Manhattan, New York City, New York, USA",,"Gracie Square, Yorkville, Manhattan Community Board 8, Manhattan, New York County, New York, 10028, United States of America",40.7735703,-73.9456049
482,/title/tt0062430/,,"Malibu, California, USA",,"Malibu, Los Angeles County, California, 90265-4797, United States of America",34.035591,-118.689423
483,/title/tt0062430/,,"Los Angeles County Music Center - 135 N. Grand Avenue, Downtown, Los Angeles, California, USA",,,,
484,/title/tt0062430/,,"Stage 18, 20th Century Fox Studios - 10201 Pico Blvd., Century City, Los Angeles, California, USA",(studio),,,
485,/title/tt0062430/,,"48th Street Playhouse, Manhattan, New York City, New York, USA","(""Tell Me Darling"" theatre)",,,
486,/title/tt0130414/,,"Pembrokeshire, Wales, UK",,"Pembrokeshire, Cymru / Wales, United Kingdom",51.8339209,-4.916667
487,/title/tt0130414/,,"Snowdonia, Gwynedd, Wales, UK",,"Snowdonia National Park, Trawsfynydd, Gwynedd, Cymru / Wales, United Kingdom",52.9155626,-3.8326012926334223
488,/title/tt0283084/,,"Bel Air, Maryland, USA",,"Bel Air, Harford County, Maryland, United States of America",39.5355063,-76.3490396
