,Code,Show Name,Location,Scene,geocodedLocation,latitude,longitude
163,/title/tt0096332/,,"Luxeuil-les-Bains, Haute-Saône, France",(baths where Tomas meets Tereza),"Luxeuil-les-Bains, Lure, Haute-Saône, Bourgogne-Franche-Comté, France métropolitaine, 70300, France",47.817177,6.3808865
164,/title/tt0096332/,,France,,France,46.603354,1.8883335
165,/title/tt0096332/,,USA,,United States,39.7837304,-100.4458825
166,/title/tt0104454/,,"Peppard Cottage, Peppard Common, Henley-on-Thames, Oxfordshire, England, UK",(Howards End),,,
167,/title/tt0104454/,,"Royal Holloway College, Egham, Surrey, England, UK",,"Royal Holloway College, Egham Hill, Runnymede, Surrey, South East, England, TW20 0BN, United Kingdom",51.4259874,-0.5675885
168,/title/tt0104454/,,"Simpson's-in-the-Strand, Strand, London, England, UK",(Restaurant where Margaret and Henry have lunch with Evie and her fiancé),"Simpson's-in-the-Strand, 100, Strand, St Clement Danes, Covent Garden, City of Westminster, London, Greater London, England, WC2R 0EW, United Kingdom",51.5105048,-0.1206359
169,/title/tt0104454/,,"The Baltic Exchange, St. Mary Axe, Broadgate, London, England, UK",(Bank where Mr Bast seeks work),,,
170,/title/tt0104454/,,"Admiralty Arch, The Mall, St. James's, London, England, UK",,"Admiralty Arch, Whitehall, St. James's, Covent Garden, City of Westminster, London, Greater London, England, SW1A 2DY, United Kingdom",51.506736950000004,-0.12862615456568355
171,/title/tt0104454/,,"Dorchester-on-Thames, Oxfordshire, England, UK",(village scenes),"Dorchester On Thames, Oxfordshire, South East, England, OX10 7HH, United Kingdom",51.6436232,-1.1662644
172,/title/tt0104454/,,Italy,,Italia,42.6384261,12.674297
173,/title/tt0104454/,,"Oxford Town Hall, St Aldate's, Oxford, Oxfordshire, England, UK",(Lecture scene),"Oxford Town Hall, St Aldate's, St Ebbes, City Centre, Oxford, Oxfordshire, South East, England, OX1 1BX, United Kingdom",51.7516033,-1.2567755123387276
174,/title/tt0104454/,,"Park Street, Southwark, London, England, UK",(Leonard Bast's flat),"Park Street, Borough, Southwark, London Borough of Southwark, London, Greater London, England, SE1 9EF, United Kingdom",51.5068922,-0.0935045
175,/title/tt0104454/,,"Regency Row, Victoria Square, Westminster, London, England, UK",,,,
176,/title/tt0104454/,,"Borough Market, Borough, London, England, UK",,"Borough Market, Winchester Walk, Borough, Southwark, London Borough of Southwark, London, Greater London, England, SE1 9AQ, United Kingdom",51.50558625,-0.090487028540277
177,/title/tt0103488/,,"Stage 44, Universal Studios - 100 Universal City Plaza, Universal City, California, USA",,,,
178,/title/tt3318220/,,"Huizen, Holland",(Youth/Cycling Area),"Huizen, Noord-Holland, Nederland",52.296484449999994,5.240582040690262
179,/title/tt3318220/,,"AAC Amsterdam Sports Club, Amsterdam, Holland",(Final running match),,,
180,/title/tt3318220/,,"Lage Vuursche, Holland",(Marc's House),"Lage Vuursche, Baarn, Utrecht, Nederland",52.18548715,5.224827909907685
181,/title/tt3318220/,,"Parkweg 10, 1272 CV Huizen, Netherlands",(Training camp location),"Scouting Vasanta, 10, Parkweg, Westereng, Huizen, Noord-Holland, Nederland, 1272CV, Nederland",52.2936023,5.2140786
182,/title/tt5635086/,,"Keighley, Bradford, West Yorkshire, England, UK",,"Keighley, Bradford, West Yorkshire, Yorkshire and the Humber, England, United Kingdom",53.86764515,-1.9387085955617687
183,/title/tt5635086/,,"Bradford, West Yorkshire, England, UK",,"Bradford, West Yorkshire, Yorkshire and the Humber, England, United Kingdom",53.7944229,-1.7519186
184,/title/tt5635086/,,"Far Laithe Farm, Laycock, Keighley, Bradford, West Yorkshire, England, UK",(Saxby farm),"Far Laithe, Tarn Lane, Keighley, Bradford, West Yorkshire, Yorkshire and the Humber, England, BD22 0PU, United Kingdom",53.870363,-1.9500371
185,/title/tt0398375/,,"Santa Rosa, California, USA",(aerial scenes),"Santa Rosa, Sonoma County, California, United States of America",38.4404925,-122.7141049
186,/title/tt0398375/,,"Gold Ballroom, Biltmore Hotel - 506 S. Grand Avenue, Downtown, Los Angeles, California, USA",,,,
187,/title/tt0398375/,,"Pasadena, California, USA",,"Pasadena, Los Angeles County, California, United States of America",34.1476452,-118.1444779
188,/title/tt0398375/,,"Stage 16, Warner Brothers Burbank Studios - 4000 Warner Boulevard, Burbank, California, USA",,,,
189,/title/tt0398375/,,"Colorado Street Bridge, Pasadena, California, USA",,"Colorado Street Bridge, Colorado Boulevard, Pasadena, Los Angeles County, California, 91123, United States of America",34.1445005,-118.1652411
190,/title/tt0398375/,,"Westin St. Francis Hotel - 335 Powell Street, San Francisco, California, USA",,"The Westin St. Francis, 335, Powell Street, Union Square, San Francisco, San Francisco City and County, California, 94102, United States of America",37.7877488,-122.40897430328698
191,/title/tt0048280/,,"Chicago Illinois, USA",,"Chicago, Cook County, Illinois, United States of America",41.8755616,-87.6244212
192,/title/tt1067774/,,"Paris, France","(Grace, Emma and Meg look down at Paris and the Eiffel Tower from their plabe)","Paris, Île-de-France, France métropolitaine, 75004, France",48.8566969,2.3514616
193,/title/tt1067774/,,"Dunakeszi, Pest, Hungary",,"Dunakeszi, Dunakeszi járás, Pest megye, Közép-Magyarország, 2120, Magyarország",47.6316697,19.1294055
194,/title/tt1067774/,,Hungary,,Magyarország,47.1817585,19.5060937
195,/title/tt1067774/,,"Denton, Texas, USA",(opening sequence),"Denton County, Texas, United States of America",33.1838787,-97.1413417
196,/title/tt1067774/,,"Voie Georges Pompidou, Paris 1, Paris, France","(Grace, Emma and Meg's bus ride across Paris)","Voie Georges Pompidou, Quartier Saint-Germain-l'Auxerrois, Paris 8e Arrondissement, Paris, Île-de-France, France métropolitaine, 75008, France",48.8637557,2.3213931
197,/title/tt1067774/,,"Pont de Bir Hakeim, Paris 15, Paris, France","(Grace, Emma and Meg's bus ride across Paris)","Pont de Bir Hakeim, Paris 16e Arrondissement, Paris, Île-de-France, France métropolitaine, 75016, France",48.8565657,2.2865914
198,/title/tt1067774/,,"Parvis Notre Dame, Ile de la Cité, Paris 4, Paris, France","(Grace, Emma and Meg's bus ride across Paris)",,,
199,/title/tt1067774/,,"Rue Saint-Jacques, Paris 5, Paris, France","(Grace, Emma and Meg's bus ride across Paris)","Rue Saint-Jacques, Quartier de la Sorbonne, Paris, Île-de-France, France métropolitaine, 75005, France",48.8513994,2.3458565
200,/title/tt1067774/,,"Avenue des Champs-Élysées, Paris 8, Paris, France",(viewed from the Arch of Triumph),"Avenue des Champs-Élysées, Paris 8e Arrondissement, Paris, Île-de-France, France métropolitaine, 75008, France",48.865669,2.3203067
201,/title/tt1067774/,,"Cour Carrée, Musée du Louvre, Paris 1, Paris, France","(Grace, Emma and Meg arrive at the Louvre)",,,
202,/title/tt1067774/,,"Place du Carrousel, Paris 1, Paris, France","(Grace, Emma and Meg arrive at the Louvre)","Place du Carrousel, Quartier Saint-Germain-l'Auxerrois, Paris 1er Arrondissement, Paris, Île-de-France, France métropolitaine, 75001, France",48.8602191,2.3335248
203,/title/tt1067774/,,"Rue Cardinal Dubois, Paris 18, Paris, France","(Grace, Emma and Meg observe Paris from Montmartre)",,,
204,/title/tt1067774/,,"Eiffel Tower, Paris, France","(Grace, Emma and Meg run down the satairs of the Eiffel Tower)","Tour Eiffel, 5, Avenue Anatole France, Quartier du Gros-Caillou, Paris, Île-de-France, France métropolitaine, 75007, France",48.858260200000004,2.2944990543196795
205,/title/tt1067774/,,"Port de Fontvieille, Monaco-Ville, Monaco",(aerial view),"Port de Fontvieille, Avenue Albert II, Fontvieille, Monaco, 98020, Monaco",43.730239,7.4174002
206,/title/tt1067774/,,"Casino de Monte Carlo, Monte Carlo, Monaco",(aerial view),"Casino de Monte Carlo, Place du Casino, Monte-Carlo, Monaco, 98000, Monaco",43.7391605,7.428023
207,/title/tt1067774/,,"Paris Charles de Gaulle Airport, Roissy-en-France, Val-d'Oise, France",(Owen arrives at Paris airport),,,
208,/title/tt1067774/,,"Avenue des Anciens Combattants d'Afrique du Nord, Beausoleil, Alpes-Maritimes, France",(Meg and Riley ride a scooter),,,
209,/title/tt1067774/,,"Avenue Saint-Martin, Monaco-Ville, Monaco",(Théo and Grace watch a fireworks display),"Avenue Saint-Martin, Monaco-Ville, Monaco, 98000, Monaco",43.7316136,7.4264641
210,/title/tt1067774/,,"Hall de l'Hôtel de Paris, Place du Casino, Monte Carlo, Monaco",(the police intervenes at the hotel),,,
211,/title/tt1067774/,,"Place Charles de Gaulle, Paris 8, Paris, France","(Grace, Emma and Meg's bus ride across Paris)","Place Charles de Gaulle, Quartier du Faubourg-du-Roule, Paris, Île-de-France, France métropolitaine, 75008, France",48.8733498,2.2957038
212,/title/tt1067774/,,USA,,United States,39.7837304,-100.4458825
213,/title/tt0425123/,,"1660 Mason St, San Francisco, California, USA",(Elizabeth's apartament),"1660, Mason Street, Russian Hill-Macondray Lane Historic District, San Francisco, San Francisco City and County, California, 94133, United States of America",37.79896505,-122.41208812952853
214,/title/tt0425123/,,"Abandoned Planet, 518 Valencia St, San Francisco, California, USA",(bookshop),,,
215,/title/tt0425123/,,"Golden Gate Bridge, San Francisco, California, USA",(aerial shots),"Golden Gate Bridge, Moore Road, Belvedere Island, Marin County, California, 94965, United States of America",37.8176155,-122.47831240371913
216,/title/tt0425123/,,"18th St, San Francisco, California, USA",(street scenes),"18th Street, Potrero Hill, San Francisco, San Francisco City and County, California, 90103, United States of America",37.7622763,-122.4013322
217,/title/tt0425123/,,"1652 Stockton St, San Francisco, California, USA",(restaurant where David saved a man),"1652, Stockton Street, North Beach, San Francisco, San Francisco City and County, California, 94133, United States of America",37.80094087755102,-122.40918104081632
218,/title/tt0425123/,,"Arkansas St, San Francisco, California, USA",(street scenes),"Arkansas Street, Potrero Hill, San Francisco, San Francisco City and County, California, 94124, United States of America",37.7573526,-122.3979998
219,/title/tt1758772/,,"Santa Clarita, California, USA",,"Santa Clarita, Los Angeles County, California, United States of America",34.3916641,-118.542586
220,/title/tt0066301/,,"Cuernavaca, Morelos, Mexico",,"Cuernavaca, Morelos, 62000, México",18.9218274,-99.2342282
221,/title/tt0066301/,,"Picacho Peak State Park, Arizona, USA",,"Picacho Peak State Park, Wymola, Pinal County, Arizona, 85141, United States of America",32.6350791,-111.4188893366426
222,/title/tt0066301/,,"Sierrita Mountains, Arizona, USA",,,,
223,/title/tt0066301/,,"Ironwood Forest National Monument, Arizona, USA",,"Ironwood Forest National Monument, Farmers Way, Red Rock, Pinal County, Arizona, 85145, United States of America",32.4449519,-111.65212774769238
224,/title/tt0066301/,,"Arivaca, Arizona, USA",,"Arivaca, Pima County, Arizona, 85601, United States of America",31.5769832,-111.3306751
225,/title/tt0066301/,,"Bavispe, Sonora, Mexico",,"Bavispe, Sonora, México",30.64958635,-109.07011790903056
226,/title/tt0093191/,,"Cinema Paris - Kurfürstendamm 211, Berlin, Germany",,"Cinema Paris, Kurfürstendamm, Charlottenburg, Charlottenburg-Wilmersdorf, 10719, Deutschland",52.5020922,13.3249378
227,/title/tt0093191/,,"Kaiser Wilhelm Gedächtniskirche, Berlin, Germany",,"Kaiser-Wilhelm-Gedächtniskirche, Kurfürstendamm, Charlottenburg, Charlottenburg-Wilmersdorf, 10789, Deutschland",52.5047053,13.3350328
228,/title/tt0093191/,,"Siegessäule, Tiergarten, Berlin, Germany",,"Siegessäule, Großer Stern, Botschaftsviertel, Tiergarten, Mitte, Berlin, 10785, Deutschland",52.51450815,13.350110811262352
229,/title/tt0093191/,,Germany,,Deutschland,51.0834196,10.4234469
230,/title/tt0093191/,,"Oranienstraße, Kreuzberg, Berlin, Germany",(Damiel walks on the street with his armour),"Oranienstraße, Kreuzberg, Friedrichshain-Kreuzberg, Berlin, 10969, Deutschland",52.5049348,13.4060778
231,/title/tt0093191/,,"Oranienplatz, Kreuzberg, Berlin, Germany",(Damiel walks on the street with his armour),"Oranienplatz, Kreuzberg, Friedrichshain-Kreuzberg, Berlin, 10999, Deutschland",52.5022061,13.415694029947764
232,/title/tt0093191/,,"Charlottenburg, Berlin, Germany",,"Charlottenburg, Charlottenburg-Wilmersdorf, Deutschland",52.515747,13.3096834
233,/title/tt0093191/,,"Mitte, Berlin, Germany",,"Mitte, Berlin, Deutschland",52.5176896,13.4023757
234,/title/tt0092492/,,"South Pasadena, California, USA",,"South Pasadena, Los Angeles County, California, 91030, United States of America",34.1133062,-118.1478291
235,/title/tt3984356/,,"DeLowe Pawn Shop, 2111 Headland Dr, East Point, Georgia, USA",(Pawn shop exterior),,,
236,/title/tt3984356/,,"808 Ralph McGill Blvd NE, Atlanta, Georgia, USA",(Roof scene looking towards Atlanta near end of film),"808, Ralph McGill Boulevard Northeast, Linwood, Atlanta, Georgia, 30308, United States of America",33.77033347518419,-84.35507738066222
237,/title/tt3984356/,,"230 Clevland Avenue, Atlanta, Georgia, USA","(Shopping center, at 10: 21 min.)",,,
238,/title/tt0487189/,,"Manchester, England, UK",(location),"Manchester, Greater Manchester, North West England, England, United Kingdom",53.4794892,-2.2451148
239,/title/tt1763303/,,"Northridge, Los Angeles, California, USA",,"Northridge, Los Angeles, Los Angeles County, California, 91324, United States of America",34.2345615,-118.5369316
240,/title/tt0091445/,,"Glen Ellyn, Illinois, USA",,"Glen Ellyn, DuPage County, Illinois, 60137, United States of America",41.8775293,-88.0670118
241,/title/tt0091445/,,"Lake Ellyn Park - 645 Lenox Rd., Glen Ellyn, Illinois, USA",,,,
242,/title/tt0091445/,,"West Chicago, Illinois, USA",(railroad underpass),"West Chicago, DuPage County, Illinois, 60185, United States of America",41.8847507,-88.2039607
243,/title/tt0091445/,,"2185 Linden Ave., Highland Park, Illinois, USA",(Maggie's house),"2185, Linden Avenue, Highland Park, Illinois, 60035, United States of America",42.192498,-87.79571585714285
244,/title/tt0091445/,,"Arlington High School - 502 West Euclid Ave., Arlington Heights, Illinois, USA",(interior: school),,,
245,/title/tt0091445/,,"Wilmette, Illinois, USA",,"Wilmette, New Trier Township, Cook County, Illinois, 60091, United States of America",42.0757315,-87.7193768
246,/title/tt0091445/,,"Chicago, Illinois, USA",,"Chicago, Cook County, Illinois, United States of America",41.8755616,-87.6244212
247,/title/tt1602620/,,"Paris, France",,"Paris, Île-de-France, France métropolitaine, 75004, France",48.8566969,2.3514616
248,/title/tt7131334/,,"Krause Berry Farm - 6179 248 St., Langley, British Columbia, Canada",(County Fair scenes),,,
249,/title/tt0332047/,,"Niagara Falls, Ontario, Canada",,"Niagara Falls, Niagara Region, Golden Horseshoe, Ontario, Canada",43.100983,-79.115295
250,/title/tt0332047/,,"East Boston High School - 86 White Street, East Boston, Boston, Massachusetts, USA",,"East Boston High School, 86, White Street, Eagle Hill, East Boston, Boston, Suffolk County, Massachusetts, 02128, United States of America",42.3811091,-71.03495138168807
251,/title/tt0332047/,,"SkyDome, Toronto, Ontario, Canada",(road trip -- deleted scene),"Rogers Centre, 1, Blue Jays Way, Spadina—Fort York, Old Toronto, Toronto, Golden Horseshoe, Ontario, M5V 1J1, Canada",43.6416641,-79.38919882366382
252,/title/tt0332047/,,"Toronto, Ontario, Canada",,"Toronto, Golden Horseshoe, Ontario, Canada",43.6534817,-79.3839347
253,/title/tt5978724/,,"Ohio, USA",,"Ohio, United States of America",40.2253569,-82.6881395
254,/title/tt1103153/,,"Woodstock, Georgia, USA",,"Woodstock, Cherokee County, Georgia, United States of America",34.1014112,-84.5192192
255,/title/tt1103153/,,"Marietta, Georgia, USA",(street scenes),"Marietta, Cobb, Georgia, United States of America",33.9528472,-84.5496148
256,/title/tt1103153/,,"Riverwood Studios - 600 Chestlehurst Rd, Senoia, Georgia, USA",(studio),,,
257,/title/tt1103153/,,"Nassau, Bahamas",,"Nassau, 242, Bahamas",25.0783456,-77.3383331
258,/title/tt1103153/,,"Ville Franche, Villefranche-sur-Mer, Alpes-Maritimes, France",,"La Ville, Villefranche-sur-Mer, Nice, Alpes-Maritimes, Provence-Alpes-Côte d'Azur, France métropolitaine, 06230, France",43.7051542,7.311853
259,/title/tt1103153/,,"Douglas County, Georgia, USA",,"Douglas County, Georgia, United States of America",33.6995565,-84.7622973
260,/title/tt1103153/,,"Alpes-Maritimes, France",,"Alpes-Maritimes, Provence-Alpes-Côte d'Azur, France métropolitaine, France",43.9210587,7.1790785
261,/title/tt1103153/,,South of France,,"The South of France, 1254, Westchester Avenue, The Bronx, Bronx County, New York, 10472, United States of America",40.831752,-73.8662124
262,/title/tt1103153/,,"Hôtel du Cap, Antibes, Alpes-Maritimes, France",(French Hotel),,,
263,/title/tt1103153/,,"Culver Studios - 9336 W. Washington Blvd., Culver City, California, USA",,,,
264,/title/tt1103153/,,"Cap d'Antibes, Antibes, Alpes-Maritimes, France",,"Cap d'Antibes, Antibes, Grasse, Alpes-Maritimes, Provence-Alpes-Côte d'Azur, France métropolitaine, 06160, France",43.5548344,7.1284027
265,/title/tt1103153/,,"Tributary Subdivision Douglasville, Georgia, USA",(on location),"Tributary, Douglasville, Douglas County, Georgia, United States of America",33.7129313,-84.6426467
266,/title/tt0120770/,,"Billboard Live, Los Angeles, California, USA",(Roxbury exterior),,,
267,/title/tt0120770/,,"Encino, Los Angeles, California, USA",(party),"Encino, Los Angeles, Los Angeles County, California, 91316-3402, United States of America",34.1591324,-118.5016166
268,/title/tt0120770/,,"Whisky a Go Go - 8901 Sunset Blvd., Hollywood, Los Angeles, California, USA",,,,
269,/title/tt0120770/,,"Los Angeles, California, USA",,"Los Angeles, Los Angeles County, California, United States of America",34.0536909,-118.2427666
270,/title/tt0119223/,,"Sarasota, Florida, USA",,"Sarasota, Sarasota County, Florida, United States of America",27.3364347,-82.5306527
271,/title/tt0119223/,,"Cortez, Florida, USA",,"Cortez, Manatee County, Florida, 34215, United States of America",27.463983499999998,-82.66833164315068
272,/title/tt0119223/,,"Central Park, Manhattan, New York City, New York, USA",,"Central Park, Manhattan, New York County, New York, United States of America",40.7827725,-73.9653627406542
273,/title/tt0119223/,,"Hotel Carter, Manhattan, New York City, New York, USA",,"Hotel Carter, 250, West 43rd Street, Times Square, Manhattan Community Board 5, Times Square, New York County, New York, 10036, United States of America",40.7573577,-73.9882305
274,/title/tt0119223/,,"Yonkers, New York, USA",,"Yonkers, Westchester County, New York, United States of America",40.9312099,-73.8987469
275,/title/tt0119223/,,"Port Washington, Long Island, New York, USA",,"Port Washington, North Hempstead, Nassau County, New York, United States of America",40.8254914,-73.68128200830327
276,/title/tt0119223/,,"Manhattan, New York City, New York, USA",,"Manhattan, New York County, New York, United States of America",40.7896239,-73.9598939
277,/title/tt0299930/,,"Hollywood, Los Angeles, California, USA",,"Hollywood, Los Angeles, Los Angeles County, California, 90028-8127, United States of America",34.0980031,-118.329523
278,/title/tt0299930/,,USA,,United States,39.7837304,-100.4458825
279,/title/tt0299930/,,"Los Angeles, California, USA",,"Los Angeles, Los Angeles County, California, United States of America",34.0536909,-118.2427666
280,/title/tt0058329/,,"San Jose, California, USA",(film's first scene),"San Jose, Santa Clara County, California, United States of America",37.3361905,-121.8905833
281,/title/tt0058329/,,"Blue Ridge Mountains, Virginia, USA",,,,
282,/title/tt0058329/,,"30th Street Station - 3001 Market Street, Philadelphia, Pennsylvania, USA",(train station),"30th Street Station, 2955, Market Street, Schuylkill Yards, Philadelphia, Philadelphia County, Pennsylvania, 19139, United States of America",39.9552836,-75.1821442
283,/title/tt0058329/,,"New Jersey, USA",(Atlantic County),"New Jersey, United States of America",40.0757384,-74.4041622
284,/title/tt0058329/,,"Philadelphia, Pennsylvania, USA",(train station),"Philadelphia, Philadelphia County, Pennsylvania, United States of America",39.9527237,-75.1635262
285,/title/tt0058329/,,"Sanders St., Baltimore Maryland, USA",(Long shot of Marnie's mother's house. Final shot in the film.),"Sanders Street, Riverside, Baltimore, Maryland, 21230, United States of America",39.2758496,-76.608411
286,/title/tt0058329/,,"Universal Studios - 100 Universal City Plaza, Universal City, California, USA",(studio),,,
287,/title/tt0058329/,,"Atlantic County, New Jersey, USA",(Hamilton Township),"Atlantic County, New Jersey, United States of America",39.5143268,-74.6632883
288,/title/tt1549572/,,"New Haven, Connecticut, USA",,"New Haven, New Haven County, Connecticut, United States of America",41.3082138,-72.9250518
289,/title/tt1758692/,,"Avalon, Santa Catalina Island, Channel Islands, California, USA",(early relationship development),,,
290,/title/tt1758692/,,"Santa Monica Pier, Santa Monica, California, USA",(first dating scenes),"Santa Monica Pier, Santa Monica, Los Angeles County, California, United States of America",34.00889605,-118.49740225045329
291,/title/tt1758692/,,"Bradley International Terminal, Los Angeles International Airport - 1 World Way, Los Angeles, California, USA",(Anna's return from England),,,
292,/title/tt5320412/,,"Icheon, Gyeonggi Province, South Korea",(Lake scenes),"이천시, 경기도, 대한민국",37.2808823,127.4429132
293,/title/tt5320412/,,"Naju Image Theme Park, Gongsan-myeon, Naju, Jeollanam, South Korea",(Rain ritual and palace scenes),,,
294,/title/tt5320412/,,"Unjusa Temple, Hwasun County, South Jeolla, South Korea",,,,
295,/title/tt5320412/,,"Saseongam Hermitage, Mount Osan, Gurye County, South Korea",(Lair of the assassins),,,
296,/title/tt5320412/,,"Seyeonjeong Pavilion, Bogil island, Jeollanam, South Korea",(palace scenes),,,
297,/title/tt5320412/,,"Miryang lake, Miryang, South Korea",(The secret lake house meeting place of Wang So and Hae Soo),"밀양, 중앙로, 가곡동, 경상남도, 70-26, 대한민국",35.4745489,128.7712395
298,/title/tt5320412/,,"Seon-gyojang residence, Gangneung, Gangwon, South Korea",(palace scenes),,,
299,/title/tt0088206/,,"Chicago, Illinois, USA",,"Chicago, Cook County, Illinois, United States of America",41.8755616,-87.6244212
300,/title/tt0088206/,,"Black Park Country Park, Wexham, Buckinghamshire, England, UK",,,,
301,/title/tt0086361/,,"Orpheum Theater - 842 South Broadway, Downtown, Los Angeles, California, USA",(opening sequence - dance audition),,,
302,/title/tt0086361/,,"Central Park, Manhattan, New York City, New York, USA",,"Central Park, Manhattan, New York County, New York, United States of America",40.7827725,-73.9653627406542
303,/title/tt9731360/,,"Sydney, New South Wales, Australia",(location),"Sydney, New South Wales, Australia",-33.8548157,151.2164539
304,/title/tt0349080/,,"Filmbyen, Avedøre, Sjælland, Denmark",,,,
305,/title/tt0105415/,,"109 Eastlake Avenue, Seattle, Washington, USA",(The concert venue where Chris Cornell sings.),"Eastlake Avenue, South Lake Union, First Hill, Seattle, King County, Washington, 98191, United States of America",47.6181157,-122.3291685
306,/title/tt0105415/,,"OK Hotel, 212 Alaskan Way S, Seattle, WA 98104, United States",(Java Stop),,,
307,/title/tt0105415/,,USA,,United States,39.7837304,-100.4458825
308,/title/tt0090103/,,"Royce Hall - 340 Royce Drive, UCLA, Westwood, Los Angeles, California, USA","(arrival in Los Angeles scene, Delta Tau Delta fraternity party scenes)",,,
309,/title/tt0090103/,,"Cornell University, Ithaca, New York, USA",,"Johnson Museum of Art, 114, Central Avenue, East Ithaca, Ithaca, Ithaca Town, Tompkins County, New York, 14853, United States of America",42.4507221,-76.48620432707092
310,/title/tt0090103/,,"Griffith Park - 4730 Crystal Springs Drive, Los Angeles, California, USA",,,,
311,/title/tt0090103/,,"Big Bear Lake, Big Bear Valley, San Bernardino National Forest, California, USA",(Stanfield Cutoff Bridge),,,
312,/title/tt0090103/,,"Stockton, California, USA",,"Stockton, San Joaquin County, California, United States of America",37.9577016,-121.2907796
313,/title/tt0086793/,,"Paris, France",,"Paris, Île-de-France, France métropolitaine, 75004, France",48.8566969,2.3514616
314,/title/tt0086793/,,"Marineland of the Pacific - 6610 Palos Verdes Drive South, Rancho Palos Verdes, California, USA",(Aqualand),,,
315,/title/tt0086793/,,"Los Angeles, California, USA",,"Los Angeles, Los Angeles County, California, United States of America",34.0536909,-118.2427666
316,/title/tt0089798/,,"Long Beach, California, USA","(Press-Telegram, 604 Pine Avenue)","Long Beach, Los Angeles County, California, United States of America",33.7690164,-118.1916048
317,/title/tt0089798/,,"Los Angeles, California, USA",,"Los Angeles, Los Angeles County, California, United States of America",34.0536909,-118.2427666
318,/title/tt0089798/,,"New York, USA",,"New York, United States of America",40.7127281,-74.0060152
319,/title/tt1640571/,,"RMS Queen Mary - 1126 Queens Highway, Long Beach, California, USA",,,,
320,/title/tt1640571/,,"San Pedro, Los Angeles, California, USA",,"San Pedro, Los Angeles, Los Angeles County, California, 90731, United States of America",33.7358518,-118.2922934
321,/title/tt0062994/,,"Warner Brother Theatre, Hill Street, Los Angeles, California, USA",(interior Ziegfeld Theatre),,,
322,/title/tt0062994/,,"Brownstone Street, Warner Brothers Burbank Studios - 4000 Warner Boulevard, Burbank, California, USA",,,,
323,/title/tt0062994/,,"Statue of Liberty, Liberty Island, New York Harbor, New York City, New York, USA","(last shot of ""Don't Rain on My Parade"")",,,
324,/title/tt0062994/,,"Oak Grove Estate, San Marino, California, USA",,,,
