,Code,Show Name,Location,Scene,geocodedLocation,latitude,longitude
531,/title/tt0111477/,,"Winona, Ontario, Canada",(Stop 50 Resturant),"Winona, Hamilton, Golden Horseshoe, Ontario, L8E 5L1, Canada",43.2079674,-79.6511553
532,/title/tt0111477/,,"Toronto, Ontario, Canada",,"Toronto, Golden Horseshoe, Ontario, Canada",43.6534817,-79.3839347
533,/title/tt0839995/,,"Niagara Falls, Ontario, Canada",,"Niagara Falls, Niagara Region, Golden Horseshoe, Ontario, Canada",43.100983,-79.115295
534,/title/tt0839995/,,"New York City, New York, USA",,"New York, United States of America",40.7127281,-74.0060152
535,/title/tt0839995/,,"Paris, France",,"Paris, Île-de-France, France métropolitaine, 75004, France",48.8566969,2.3514616
536,/title/tt0062598/,,"Vibble, Gotlands län, Sweden",,"Vibble, Gotlands kommun, Gotlands län, Götaland, 622 59, Sverige",57.6038368,18.2496614
537,/title/tt0062598/,,"Kantongatan 3, 178 93 Drottningholm, Sweden",(The house where Tommy en Annika lives),"Kanton, Drottningholm, Ekerö kommun, Stockholms län, Svealand, 17893, Sverige",59.3189864,17.8695136
538,/title/tt0062598/,,"57°37'02.7""N 18°16'34.4""E",(Villa Villekulla),"Länna, Visborg, Visby, Gotlands kommun, Gotlands län, Götaland, 621 81, Sverige",57.6151468,18.2777012
