,Code,Show Name,Location,Scene,geocodedLocation,latitude,longitude
489,/title/tt0283084/,,"Berlin, Maryland, USA",,"Berlin, Worcester County, Maryland, United States of America",38.3226154,-75.2176892
490,/title/tt0283084/,,"Fair Hill Natural Resources Area - 376 Fair Hill Drive, Fair Hill, Maryland, USA",,,,
491,/title/tt0283084/,,"Havre de Grace, Maryland, USA",(Victorian house located there),"Havre de Grace, Harford County, Maryland, 21078, United States of America",39.5489964,-76.0914718
492,/title/tt0480242/,,"Jamestown, Rhode Island, USA",,"Jamestown, Newport County, Rhode Island, 02835, United States of America",41.4970465,-71.3672755
493,/title/tt0480242/,,"Seven Stars Bakery, Hope Street, Providence, Rhode Island, USA",(Ice cream shop),"Seven Stars Bakery, 820, Hope Street, Blackstone, Providence, Providence County, Rhode Island, 02905, United States of America",41.8495814,-71.3950854
494,/title/tt0480242/,,"Providence, Rhode Island, USA",(Opening scenes),"Providence, Providence County, Rhode Island, United States of America",41.8239891,-71.4128343
495,/title/tt0480242/,,"Westerly, Rhode Island, USA",,"Westerly, Washington County, Rhode Island, United States of America",41.3775996,-71.8272911
496,/title/tt0480242/,,"New Jersey, USA",,"New Jersey, United States of America",40.0757384,-74.4041622
497,/title/tt0962726/,,"Murray High School - 5440 S. State Street, Murray, Utah, USA",,"Murray High School, State Street, Murray, Salt Lake County, Utah, 84107, United States of America",40.6541589,-111.89033137790432
498,/title/tt0962726/,,"Stanford University, Palo Alto, California, USA",,"Stanford University, Welch Road, Stanford, Palo Alto, Santa Clara County, California, 94305-6015, United States of America",37.431313849999995,-122.16936535498309
499,/title/tt0070903/,,"Ballston Spa, New York, USA",,"Ballston Spa, Town of Milton, Saratoga County, New York, 12020, United States of America",43.0009087,-73.8490111
500,/title/tt0070903/,,"Malibu, California, USA",,"Malibu, Los Angeles County, California, 90265-4797, United States of America",34.035591,-118.689423
501,/title/tt0070903/,,"Union Station - 800 N. Alameda Street, Downtown, Los Angeles, California, USA",,,,
502,/title/tt0070903/,,"Stage 21, Warner Brothers Burbank Studios - 4000 Warner Boulevard, Burbank, California, USA",,,,
503,/title/tt0093640/,,"Omni Shorehan Hotel - 2500 Calvert Street NW, Rock Creek Park, Washington, District of Columbia, USA",(party where Tom first meets Susan),,,
504,/title/tt0093640/,,"1503 30th St NW, Washington, District of Columbia, USA",(Tom's Apartment),"1503, 30th Street Northwest, Georgetown, Washington, District of Columbia, 20566, United States of America",38.9094506,-77.05897986776117
505,/title/tt0093640/,,"Hotel Washington - 515 15th Street, Washington, District of Columbia, USA",,,,
506,/title/tt0093640/,,"Arlington, Virginia, USA",,"Arlington, Arlington County, Virginia, United States of America",38.8903961,-77.0841585
507,/title/tt0093640/,,"The Pentagon - 48 N. Rotary Road, Arlington, Virginia, USA",,,,
508,/title/tt0093640/,,"Washington, District of Columbia, USA",,"Washington, District of Columbia, 20230, United States of America",38.8949924,-77.0365581
509,/title/tt0093640/,,"Department of the Interior Building, 1849 C Street, NW, Washington, District of Columbia, USA",(Pentagon interiors - note black and white tiles floors),,,
510,/title/tt0093640/,,"Trump International Hotel, Washington, D.C., 1100 Pennsylvania Ave NW, Washington, DC 20004, United States",,,,
511,/title/tt0096324/,,"Los Angeles County, California, USA",(most exteriors),"Los Angeles County, California, United States of America",34.3155072,-118.2096814
512,/title/tt0124298/,,"7218 Topanga Canyon Boulevard, Canoga Park, Los Angeles, California, USA",(adult video store),"Topanga Canyon Boulevard, Canoga Park, Los Angeles, Los Angeles County, California, 91303, United States of America",34.1979929,-118.605932
513,/title/tt0124298/,,"11628 Ventura Boulevard, Studio City, California, USA","(Baseball card shop where Adam meets Eve, including parking lot in back)","Ventura Boulevard, Studio City, Los Angeles, Los Angeles County, California, 91604, United States of America",34.1431931,-118.3918833
514,/title/tt0124298/,,"7216 Topanga Canyon Boulevard, Canoga Park, Los Angeles, California, USA",,"Topanga Canyon Boulevard, Canoga Park, Los Angeles, Los Angeles County, California, 91303, United States of America",34.1979929,-118.605932
515,/title/tt0124298/,,"5450 S Slauson Ave, Culver City, California, USA",(Storage garage under freeway ramps),,,
516,/title/tt0124298/,,"Canoga Park, Los Angeles, California, USA",,"Canoga Park, Los Angeles, Los Angeles County, California, 91303, United States of America",34.2010541,-118.5977282
517,/title/tt0124298/,,"Hollywood, Los Angeles, California, USA",,"Hollywood, Los Angeles, Los Angeles County, California, 90028-8127, United States of America",34.0980031,-118.329523
518,/title/tt0124298/,,"Studio City, Los Angeles, California, USA",(studio),"Studio City, Los Angeles, Los Angeles County, California, 91604, United States of America",34.1483989,-118.3961877
519,/title/tt0124298/,,"Westlake Village, California, USA",,"Westlake Village, Los Angeles County, California, United States of America",34.1460234,-118.8061794
520,/title/tt1837654/,,"2096 Adanac Street, Vancouver, British Columbia, Canada",(Chance Harbor High School),"Adanac Street, Strathcona, Vancouver, Metro Vancouver Regional District, British Columbia, V5L 2C4, Canada",49.2776659,-123.0773839
521,/title/tt1837654/,,"North Vancouver, British Columbia, Canada",,"North Vancouver, Metro Vancouver Regional District, British Columbia, V7M 1H9, Canada",49.3207133,-123.0737831
522,/title/tt1837654/,,"Steveston, Richmond, British Columbia, Canada",,"Steveston, Richmond, Metro Vancouver Regional District, British Columbia, Canada",49.1280561,-123.177415512419
523,/title/tt3205376/,,New Zealand,,New Zealand / Aotearoa,-41.5000831,172.8344077
524,/title/tt1985443/,,"Brasov, Romania",,"Brașov, România",45.6523093,25.6102746
525,/title/tt1985443/,,"Rasnov, Romania",,"Râșnov, Brașov, 505400, România",45.5909577,25.4655999
526,/title/tt1985443/,,"Transylvania, Romania",,"Ardeal, Mureș, 547065, România",46.5971623,24.3740295
527,/title/tt1985443/,,Romania,,România,45.9852129,24.6859225
528,/title/tt0133189/,,"Wendover, Utah, USA",(salt flats),"Wendover, Tooele County, Utah, 84083, United States of America",40.7374014,-114.0304541
529,/title/tt7418206/,,"Billy Miner Pub - 22355 River Rd, Maple Ridge, British Columbia, Canada",(pub),"The Billy Miner Pub, 22355, River Road, Haney, Maple Ridge, Metro Vancouver Regional District, British Columbia, V2X1Z9, Canada",49.21210915,-122.60354382634151
530,/title/tt2139555/,,"Lombard Street, Lombard Street, San Francisco, California, USA",(Me going to Her's wedding),"Lombard Street, Russian Hill, San Francisco, San Francisco City and County, California, 94133-1312, United States of America",37.8021014,-122.4188882
531,/title/tt3169706/,,"Onllwyn, Powys, Wales",(they filmed in the town they helped),"Onllwyn Road, Tawe-Uchaf, Coelbren, Powys, Cymru / Wales, SA10 9NS, United Kingdom",51.7902223,-3.6750972
532,/title/tt3169706/,,"Kingsgate Road, West Hampstead, London, England, UK","(Marchmont Street, including Gay's the Word bookshop)","Kingsgate Road, West Hampstead, London Borough of Camden, London, Greater London, England, NW6 4PP, United Kingdom",51.5425848,-0.1954684
533,/title/tt3169706/,,"Slough, Berkshire, England, UK",,"Slough Trading Estate industrial railway, Berkshire Avenue, Slough Trading Estate, Cippenham, Britwell, South East, England, SL1 4SZ, United Kingdom",51.5213243,-0.6170276
534,/title/tt3169706/,,"London, England, UK",,"London, Greater London, England, United Kingdom",51.5073219,-0.1276474
535,/title/tt0396592/,,"Philadelphia, Pennsylvania, USA",,"Philadelphia, Philadelphia County, Pennsylvania, United States of America",39.9527237,-75.1635262
536,/title/tt0396592/,,"California, USA",,"California, United States of America",36.7014631,-118.7559974
537,/title/tt0396592/,,"Los Angeles, California, USA",,"Los Angeles, Los Angeles County, California, United States of America",34.0536909,-118.2427666
538,/title/tt10887902/,,"Illinois, USA",,"Illinois, United States of America",40.0796606,-89.4337288
539,/title/tt10887902/,,"Lockport, Illinois, USA",,"Lockport, Will County, Illinois, 3333, United States of America",41.5894753,-88.057837
540,/title/tt0086617/,,"Artransa Park Film Studios, Mobbs Lane, Epping, Sydney, New South Wales, Australia",(studio),,,
541,/title/tt0086617/,,"Mort Bay Studios, Balmain, Sydney, New South Wales, Australia",(studio),,,
542,/title/tt0086617/,,"New South Wales, Australia",,"New South Wales, Australia",-31.8759835,147.2869493
543,/title/tt0320970/,,"Los Angeles, California, USA",,"Los Angeles, Los Angeles County, California, United States of America",34.0536909,-118.2427666
544,/title/tt0104437/,,"Wet 'n Wild Water Park - 2601 Las Vegas Boulevard South, Las Vegas, Nevada, USA",,,,
545,/title/tt0104437/,,"Hard Rock Cafe - 4475 Paradise Road, Las Vegas, Nevada, USA",,,,
546,/title/tt0104437/,,"Las Vegas, Nevada, USA",,"Las Vegas, Clark County, Nevada, United States of America",36.1672559,-115.1485163
547,/title/tt0057345/,,"Rome, Lazio, Italy",,"Roma Capitale, Lazio, Italia",41.85223935,12.631036615953583
548,/title/tt0038787/,,"Miami, Florida, USA",(establishing shots of Miami bungalow where Devlin and Alicia first meet; street scenes when Alicia and Devlin in car),"Miami, Miami-Dade County, Florida, United States of America",25.7742658,-80.1936589
549,/title/tt0038787/,,"Beverly Hills, California, USA",(Sebastian's home exterior/patio when Alicia not feeling well),"Beverly Hills, Los Angeles County, California, United States of America",34.0696501,-118.3963062
550,/title/tt0460745/,,"Vancouver, British Columbia, Canada",,"Vancouver, Metro Vancouver Regional District, British Columbia, Canada",49.2608724,-123.1139529
551,/title/tt0460745/,,"SW Marine Dr, University Endowment Lands, British Columbia, Canada",(motorcycle ride road),"Southwest Marine Drive, Dunbar-Southlands, University Endowment Lands, Metro Vancouver Regional District, British Columbia, V6N 2C4, Canada",49.2357811,-123.1996804
552,/title/tt4189492/,,"Revival 629, 629 Eastern Avenue, Toronto, Ontario, Canada",(Stage),,,
553,/title/tt0117218/,,"Courthouse Square, Backlot, Universal Studios - 100 Universal City Plaza, Universal City, California, USA",,,,
554,/title/tt0117218/,,"Mayfield Senior School - 500 Bellefontaine Street, Pasadena, California, USA",(Dean Richmond's office),"Mayfield Senior School, Bellefontaine Place, Pasadena, Los Angeles County, California, 91184, United States of America",34.1302858,-118.1614605
555,/title/tt0117218/,,"San Marino, California, USA",,"San Marino, Los Angeles County, California, 91108, United States of America",34.1215947,-118.1057394
556,/title/tt0117218/,,"Beverly Hills, California, USA",,"Beverly Hills, Los Angeles County, California, United States of America",34.0696501,-118.3963062
557,/title/tt0090563/,,"Marseille, Bouches-du-Rhône, France",,"Marseille, Bouches-du-Rhône, Provence-Alpes-Côte d'Azur, France métropolitaine, 13000, France",43.2961743,5.3699525
558,/title/tt0090563/,,"Narbonne, Aude, France",(exteriors: toys store),"Narbonne, Aude, Occitanie, France métropolitaine, 11100, France",43.1837661,3.0042121
559,/title/tt0090563/,,"Paris, France",,"Paris, Île-de-France, France métropolitaine, 75004, France",48.8566969,2.3514616
560,/title/tt0847150/,,"Dyrham Park, Dyrham, Gloucestershire, England, UK",(Allenham exterior/interior),"Dyrham Park, Dyrham and Hinton, Dyrham, South Gloucestershire, South West England, England, United Kingdom",51.480068599999996,-2.3693425843631992
561,/title/tt0847150/,,"Clovelly Pier, Clovelly, Devon, England, UK",(shopping for fish at the pier),,,
562,/title/tt0847150/,,"Lincoln's Inn, Holborn, London, England, UK",(Col. Brandon visits Eliza and baby),"Lincoln's Inn, Cursitor Street, City of London, Greater London, England, EC4, United Kingdom",51.51565625,-0.11216006513421142
563,/title/tt0847150/,,"Loseley Park, Guildford, Surrey, England, UK",(Barton Park ext./Delaford library),"Loseley Park, Old Portsmouth Road, Artington, Guildford, Surrey, South East, England, GU3 1LT, United Kingdom",51.2150613,-0.5818821
564,/title/tt0847150/,,"Buckinghamshire, England, UK",,"Buckinghamshire, Waddesdon, Buckinghamshire, South East, England, United Kingdom",51.840894,-0.8998073587480795
565,/title/tt0847150/,,"Holborn, London, England, UK",,"Holborn, London Borough of Camden, London, Greater London, England, WC1V 6DW, United Kingdom",51.5179341,-0.1195284
566,/title/tt0847150/,,"Devon, England, UK",,"Devon, Tedburn St. Mary, Teignbridge, Devon, South West England, England, United Kingdom",50.724165,-3.660795843955193
567,/title/tt0103859/,,"New York, USA",,"New York, United States of America",40.7127281,-74.0060152
568,/title/tt1263670/,,"Paul's Monterey Inn - 1000 Juan Tabo Boulevard NE, Albuquerque, New Mexico, USA",(Tommy and Bad meet here before the concert.),,,
569,/title/tt1263670/,,"Santa Fe Opera - 301 Opera Drive, Santa Fe, New Mexico, USA",,,,
570,/title/tt1263670/,,"Evangelo's Cocktail Lounge - 200 W. San Francisco Street, Santa Fe, New Mexico, USA",(Bad meets Jean's uncle playing piano and also plays here.),,,
571,/title/tt1263670/,,"Albuquerque Convention Center - 401 2nd Street NW, Albuquerque, New Mexico, USA",,"Albuquerque Convention Center, 401, 2nd Street Northwest, Downtown Albuquerque, Albuquerque, Bernalillo County, New Mexico, 87102, United States of America",35.08696705,-106.6478051605243
572,/title/tt1263670/,,"Los Angeles, California, USA",,"Los Angeles, Los Angeles County, California, United States of America",34.0536909,-118.2427666
573,/title/tt1263670/,,"Albuquerque, New Mexico, USA",,"Albuquerque, Bernalillo County, New Mexico, United States of America",35.0841034,-106.6509851
574,/title/tt0048845/,,"CBS Broadcast Center, Manhattan, New York City, New York, USA","(studio) (1967-1978, 1987-2000)","CBS Broadcast Center, 11th Avenue, Hell's Kitchen, Manhattan Community Board 4, Manhattan, New York County, New York, 10018, United States of America",40.76953315,-73.99067563237543
575,/title/tt0048845/,,"Clinton, New Jersey, USA",,"Clinton, Hunterdon County, New Jersey, 08809, United States of America",40.6362878,-74.9116603
576,/title/tt0048845/,,"New York City, New York, USA",,"New York, United States of America",40.7127281,-74.0060152
577,/title/tt0252076/,,"Waldorf-Astoria Hotel - 301 Park Avenue, Manhattan, New York City, New York, USA",(Hotel Beresford),"Waldorf-Astoria Hotel, 301, Park Avenue, Midtown East, Manhattan Community Board 5, Manhattan, New York County, New York, 10037, United States of America",40.756502,-73.97336164306073
578,/title/tt0252076/,,"Bronx, New York City, New York, USA",,"Bronx County, New York, United States of America",40.8506558,-73.8665241
579,/title/tt0252076/,,"Chicago, Illinois, USA",,"Chicago, Cook County, Illinois, United States of America",41.8755616,-87.6244212
580,/title/tt0252076/,,"New York City, New York, USA",,"New York, United States of America",40.7127281,-74.0060152
581,/title/tt0252076/,,"Park Avenue, Manhattan, New York City, New York, USA",,"Park Avenue, Murray Hill, Manhattan Community Board 5, Manhattan, New York County, New York, 10037, United States of America",40.7509833,-73.9786564
582,/title/tt0083470/,,"Century Towers - 2220 & 2222 Avenue of the Stars, Century City, Los Angeles, California, USA",,,,
583,/title/tt0083470/,,"Sun Valley, Los Angeles, California, USA",,"Sun Valley, Los Angeles, Los Angeles County, California, 91352, United States of America",34.2175042,-118.3703576
584,/title/tt0809497/,,"Los Angeles, California, USA",,"Los Angeles, Los Angeles County, California, United States of America",34.0536909,-118.2427666
585,/title/tt0109403/,,"Charleston, South Carolina, USA",,"Charleston, Charleston County, South Carolina, United States of America",32.7876012,-79.9402728
586,/title/tt0109403/,,"Mount Pleasant, South Carolina, USA",,"Mount Pleasant, Charleston County, South Carolina, United States of America",32.7940651,-79.8625851
587,/title/tt0109403/,,"South Carolina, USA",,"South Carolina, United States of America",33.6874388,-80.4363743
588,/title/tt0109403/,,"Wilmington, North Carolina, USA",(location),"Wilmington, New Hanover County, North Carolina, United States of America",34.2257282,-77.9447107
589,/title/tt1294226/,,"Wormsloe Plantation - 7601 Skidway Road, Savannah, Georgia, USA",,,,
590,/title/tt1294226/,,"Georgia Aquarium, Atlanta, Georgia, USA",,"Georgia Aquarium, 225, Baker Street Northwest, Atlanta, Georgia, 30313, United States of America",33.76326745,-84.39511726814364
591,/title/tt0236493/,,"Tunnel Ogarrio, San Luis Potosí, Mexico",,,,
592,/title/tt0236493/,,"McCarran International Airport - 5757 Wayne Newton Boulevard, Las Vegas, Nevada, USA",,,,
593,/title/tt0236493/,,Mexico,,"Ciudad de México, 06060, México",19.4326296,-99.1331785
594,/title/tt0236493/,,"Summerlin Parkway, Las Vegas, Nevada, USA",,"Summerlin Parkway, Queensridge, Las Vegas, Clark County, Nevada, 89145-5800, United States of America",36.1780474,-115.2875631
595,/title/tt0866439/,,"Kylerhea, Skye, Highland, Scotland, UK",,,,
596,/title/tt0866439/,,"Fort William, Glen Coe, Highland, Scotland, UK",,,,
597,/title/tt0866439/,,"Glenelg, Highland, Scotland, UK",,"Glenelg, Highland, Scotland, IV40 8LB, United Kingdom",57.2124802,-5.6208263
598,/title/tt0866439/,,"Central Park, Manhattan, New York City, New York, USA",,"Central Park, Manhattan, New York County, New York, United States of America",40.7827725,-73.9653627406542
599,/title/tt0866439/,,"Edlesborough, Buckinghamshire, England, UK",,"Edlesborough, Buckinghamshire, South East, England, LU6 2HS, United Kingdom",51.8663877,-0.5852479
600,/title/tt0866439/,,"Mayfair, London, England, UK",,"Mayfair, City of Westminster, London, Greater London, England, W1K 3DN, United Kingdom",51.5110872,-0.147058
601,/title/tt0866439/,,"Oxford Street, London, England, UK",,"Oxford Street, Mayfair, City of Westminster, London, Greater London, England, W1C 2QQ, United Kingdom",51.5136825,-0.1562527
602,/title/tt0866439/,,"Piccadilly, London, England, UK",,"Piccadilly, St. James's, Mayfair, City of Westminster, London, Greater London, England, W1J 9HW, United Kingdom",51.5090502,-0.1366425
603,/title/tt0866439/,,"Washington Square Park, Greenwich Village, Manhattan, New York City, New York, USA",,,,
604,/title/tt0866439/,,"NBC-TV Studios, 30 Rockefeller Plaza, New York City, New York, USA",,,,
605,/title/tt0866439/,,"Grace Church - 802 Broadway, Manhattan, New York City, New York, USA",,"Grace Church, 802, Broadway, NoHo, Manhattan Community Board 2, Manhattan, New York County, New York, 10003, United States of America",40.731967499999996,-73.99089624462103
606,/title/tt0975645/,,"141 N Grand Ave, Pasadena, California, USA",(Alfred Hitchcock's house - interiors),"141, North Grand Avenue, Pasadena, Los Angeles County, California, 91103, United States of America",34.14794040428267,-118.16282886086373
607,/title/tt0975645/,,"Downtown, Los Angeles, California, USA",,"Downtown, Los Angeles, Los Angeles County, California, United States of America",34.0428494,-118.2476732
608,/title/tt0975645/,,"Pasadena, California, USA",,"Pasadena, Los Angeles County, California, United States of America",34.1476452,-118.1444779
609,/title/tt0975645/,,"Los Angeles, California, USA",,"Los Angeles, Los Angeles County, California, United States of America",34.0536909,-118.2427666
610,/title/tt0975645/,,"20th Century Fox Studios - 10201 Pico Blvd., Century City, Los Angeles, California, USA",,,,
611,/title/tt0096463/,,"Staten Island Ferry, New York Harbor, New York City, New York, USA",,,,
612,/title/tt0096463/,,"South Street Seaport - 19 Fulton Street, Manhattan, New York City, New York, USA",,,,
613,/title/tt0096463/,,"Vernon Valley Great Gorge Ski Resort, New Jersey, USA",,,,
614,/title/tt0096463/,,"Central Park, Manhattan, New York City, New York, USA",,"Central Park, Manhattan, New York County, New York, United States of America",40.7827725,-73.9653627406542
615,/title/tt0096463/,,"New York City, New York, USA",,"New York, United States of America",40.7127281,-74.0060152
616,/title/tt0096463/,,"U.S. Customs House, New York City, New York, USA",,,,
617,/title/tt0087100/,,"Los Feliz, Los Angeles, California, USA",,"Los Feliz, Los Angeles, Los Angeles County, California, United States of America",34.1076561,-118.2875062
618,/title/tt0087100/,,"6057 Scenic Avenue, Los Angeles, California, USA",(Joanna Crane's Apartment Building),"6057, Scenic Avenue, Hollywood Hills, Los Angeles, Los Angeles County, California, 90068, United States of America",34.11016228571428,-118.32197842857143
619,/title/tt0087100/,,"1542 Orange Grove Avenue, Hollywood, Los Angeles, California, USA",(Ben's house),,,
620,/title/tt3760922/,,"Chicago, Illinois, USA",(just establishing shots of the City),"Chicago, Cook County, Illinois, United States of America",41.8755616,-87.6244212
621,/title/tt1038919/,,"60-15 Eliot Avenue, Middle Village, Queens, New York City, New York, USA",(exterior shot of tattoo shop),"Eliot Avenue, Middle Village, Queens County, New York, 11379, United States of America",40.7223555,-73.8849505
622,/title/tt1038919/,,"Nyack, New York, USA",,"Nyack, Town of Orangetown, Rockland County, New York, 10960, United States of America",41.091121,-73.9196794
623,/title/tt1038919/,,"Trump Taj Mahal Casino and Resort - 1000 Boardwalk at Virginia Avenue, Atlantic City, New Jersey, USA",,,,
624,/title/tt1038919/,,"Brooklyn, New York City, New York, USA",,"Brooklyn, Kings County, New York, United States of America",40.6501038,-73.9495823
625,/title/tt1038919/,,"Harlem, New York, USA",,"Harlem, Manhattan Community Board 10, Manhattan, New York County, New York, United States of America",40.8078786,-73.9454154
626,/title/tt1038919/,,"Manhattan Avenue, Greenpoint, Brooklyn, New York City, New York, USA",(4th of July parade),"Manhattan Avenue, Greenpoint, Brooklyn, Kings County, New York, 11222, United States of America",40.7227516,-73.9501974
627,/title/tt0098453/,,"1345 Carroll Avenue, Los Angeles, California, USA",(Madame Serena's home),"Thriller House, 1345, Carroll Avenue, Echo Park, Los Angeles, Los Angeles County, California, 90026, United States of America",34.06971,-118.2544788
628,/title/tt0098453/,,"Griffith Park - 4730 Crystal Springs Drive, Los Angeles, California, USA",(Tunnel),,,
629,/title/tt0098453/,,"244 South Irving Boulevard, Los Angeles, California, USA",(Randa's house),"244, South Irving Boulevard, Windsor Square, Los Angeles, Los Angeles County, California, 90004, United States of America",34.07021866524554,-118.31828244052694
630,/title/tt4787052/,,"Büyükdere, Mektep Sk. No:9, 34453 Sariyer/Istanbul, TurKey",(Defne's house),,,
631,/title/tt4787052/,,"Hayat Sokağı No:2, Levent, 34330 Beşiktaş/İstanbul, Turkey","(Omer's house, season 1)",,,
632,/title/tt0022689/,,"Santa Catalina Island, Channel Islands, California, USA",(beach scenes),,,
633,/title/tt0022689/,,"RKO Studios - 780 N. Gower Street, Hollywood, Los Angeles, California, USA",(studio),,,
634,/title/tt1091722/,,"West Mifflin, Pennsylvania, USA",(Kennywood Park),"West Mifflin, Allegheny County, Pennsylvania, 15110, United States of America",40.3634026,-79.8664375
635,/title/tt1091722/,,"707 Orchard St, Carnegie, Pennsylvania, USA",(Connell's mother's house),,,
636,/title/tt1091722/,,"729 Orchard St, Carnegie, Pennsylvania, USA",(Connell's house),,,
637,/title/tt1091722/,,"Ludlow Street, Lower East Side, Manhattan, New York City, New York, USA",(Em's apartment),"Ludlow Street, East Village, Manhattan Community Board 3, Manhattan, New York County, New York, 10002, United States of America",40.7225385,-73.9870926
638,/title/tt1091722/,,"950 Brodhead Road, Coraopolis, Pennsylvania, USA",(Bar),,,
639,/title/tt1091722/,,"2600 Ardmore Blvd, Pittsburgh, Pennsylvania, USA",(Velvet Touch),,,
640,/title/tt1091722/,,"403 Edwood Court, McCandless, Pennsylvania, USA",(James' house),"403, Edwood Court, Fox Ridge, McCandless, Allegheny County, Pennsylvania, 15237, United States of America",40.560640640390474,-80.03243418188647
641,/title/tt1091722/,,"Braddock Road, Pittsburgh, Pennsylvania, USA",(Em's house),"South Braddock Avenue, Park Place, Pittsburgh, Allegheny County, Pennsylvania, 15208, United States of America",40.4467039,-79.8953346
642,/title/tt0960731/,,"Santa Paula, California, USA",(Motorcyle jump),"Santa Paula, Ventura County, California, United States of America",34.3541659,-119.0592705
643,/title/tt0960731/,,"Calistoga, Napa Valley, California, USA",,"Calistoga, Napa County, California, 94515, United States of America",38.5787966,-122.5797054
644,/title/tt0960731/,,"Pasadena, California, USA",,"Pasadena, Los Angeles County, California, United States of America",34.1476452,-118.1444779
645,/title/tt0960731/,,"Hot Dog on a Stick - 1633 Ocean Front Walk, Santa Monica, California, USA",(street scenes),"Hot Dog on a Stick, Ocean Front Walk, Santa Monica, Los Angeles County, California, 90401, United States of America",34.00984605,-118.49507187420784
646,/title/tt0960731/,,"Long Beach, California, USA",,"Long Beach, Los Angeles County, California, United States of America",33.7690164,-118.1916048
647,/title/tt0960731/,,"Santa Monica, California, USA",,"Santa Monica, Los Angeles County, California, United States of America",34.0250724,-118.4965129
648,/title/tt0960731/,,"South Pasadena, California, USA",,"South Pasadena, Los Angeles County, California, 91030, United States of America",34.1133062,-118.1478291
