Code,Show Name,Location,Scene
/title/tt9170108/,Raised by Wolves,"Film Afrika Studios, Cape Town, South Africa",
/title/tt4052886/,Lucifer,"Vancouver, British Columbia, Canada",(Season 1 & 2)                        
/title/tt4052886/,Lucifer,"Warner Brothers Burbank Studios - 4000 Warner Boulevard, Burbank, California, USA",(studio)                        
/title/tt0805647/,The Witches,"Surrey, England, UK",
/title/tt4685762/,The Craft: Legacy,"Toronto, Ontario, Canada",
/title/tt6905686/,Lovecraft Country,"Illinois, USA",
/title/tt6905686/,Lovecraft Country,"Cinespace Film Studios, Chicago, Illinois, USA",(studio)                        
/title/tt6905686/,Lovecraft Country,"Blackhall Studios, Atlanta, Georgia, USA",
/title/tt0944947/,Game of Thrones,"Split, Split-Dalmatia County, Croatia",
/title/tt0944947/,Game of Thrones,"Dubrovnik, Croatia",
/title/tt0944947/,Game of Thrones,"Ouarzazate, Morocco",
/title/tt0944947/,Game of Thrones,"Harland and Wolff Paint Hall, Titanic-Quarter, Belfast, County Antrim, Northern Ireland, UK",
/title/tt0944947/,Game of Thrones,"Valletta, Malta",
/title/tt0944947/,Game of Thrones,"Klis Fortress, Klis, Croatia",
/title/tt0944947/,Game of Thrones,"Seville, Andalucia, Spain",
/title/tt0944947/,Game of Thrones,"Real Alcázar, Seville, Andalucia, Spain",(Water Gardens of Dorne)                        
/title/tt0944947/,Game of Thrones,"Doune Castle, Doune, Stirling, Scotland, UK",
/title/tt0944947/,Game of Thrones,"Ballymoney, County Antrim, Northern Ireland, UK",
/title/tt0944947/,Game of Thrones,"Belfast, County Antrim, Northern Ireland, UK",
/title/tt0944947/,Game of Thrones,"Carncastle, County Antrim, Northern Ireland, UK",
/title/tt0944947/,Game of Thrones,"Ramparts, Essaouira, Morocco",(ramparts of Astapor)                        
/title/tt0944947/,Game of Thrones,"El Chorrillo, Pechina, Almeria, Andalucia, Spain",(Vaes Dothrak)                        
/title/tt0944947/,Game of Thrones,"Svínafellsjökull Glacier, Iceland",
/title/tt0944947/,Game of Thrones,"Cordoba, Andalucía, Spain",(Long Bridge of Volantis)                        
/title/tt0944947/,Game of Thrones,"Giant's Causeway, County Antrim, Northern Ireland, UK",
/title/tt0944947/,Game of Thrones,"Canet de Mar, Barcelona, Catalonia, Spain",(location)                        
/title/tt0944947/,Game of Thrones,"Barrika, Vizcaya, País Vasco, Spain",(Dragonstone beach exterior scenes)                        
/title/tt0944947/,Game of Thrones,"Malpartida de Cáceres, Cáceres, Extremadura, Spain",
/title/tt0944947/,Game of Thrones,"Los Angeles, California, USA",
/title/tt0944947/,Game of Thrones,"Itálica, Santiponce, Sevilla, Andalucía, Spain",(Dragonpit summit)                        
/title/tt0944947/,Game of Thrones,"Almodóvar del Río, Córdoba, Andalucía, Spain",(Interior castle)                        
/title/tt0944947/,Game of Thrones,"La Alcazaba, Almería, Almería, Andalucia, Spain","(House Martell, Water gardens of Dorne)                        "
/title/tt0460681/,Supernatural,"Buntzen Lake, Anmore, British Columbia, Canada",
/title/tt0460681/,Supernatural,"Vancouver, British Columbia, Canada",
/title/tt0460681/,Supernatural,"Old Terminal Pub, New Westminster, British Columbia, Canada",
/title/tt0460681/,Supernatural,"Riverview Hospital, Coquitlam, British Columbia, Canada",
/title/tt0460681/,Supernatural,"South Terminal, Vancouver International Airport, Sea Island, Richmond, British Columbia, Canada",
/title/tt0460681/,Supernatural,"Heritage Village Museum, Burnaby, British Columbia, Canada",
/title/tt0460681/,Supernatural,"Richmond, British Columbia, Canada",
/title/tt4574334/,Stranger Things,"Jackson, Georgia, USA",
/title/tt4574334/,Stranger Things,"Gwinnett Place Mall, Duluth, Georgia, USA",(Starcourt Mall)                        
/title/tt4574334/,Stranger Things,"Emory University - 201 Dowman Dr, Atlanta, Georgia, USA",(Hawkins National Laboratory)                        
/title/tt4574334/,Stranger Things,"Tiffany's Kitchen - 7413 Lee Road, Lithia Springs, Georgia, USA",(Benny's Burgers)                        
/title/tt4574334/,Stranger Things,"Patrick Henry High School - 109 S Lee Street, Stockbridge, Georgia, USA",(School)                        
/title/tt4574334/,Stranger Things,"North Oak Street, Jackson, Georgia, USA",(Downtown)                        
/title/tt4574334/,Stranger Things,"Jackson Drug - 4 2nd Street, Jackson, Georgia, USA",(General Store)                        
/title/tt4574334/,Stranger Things,"Malibu, California, USA",(Beach)                        
/title/tt4574334/,Stranger Things,"12 Oak Street, Jackson, Georgia, USA",(Cinema)                        
/title/tt4574334/,Stranger Things,"Douglas County, Georgia, USA",
/title/tt10266874/,Helstrom,"Vancouver, British Columbia, Canada",
/title/tt4955642/,The Good Place,"Universal Studios - 100 Universal City Plaza, Universal City, California, USA",(studio)                        
/title/tt4955642/,The Good Place,"Universal City, California, USA",
/title/tt4955642/,The Good Place,"California, USA",
/title/tt10324122/,Secret Society of Second-Born Royals,"Mississauga, Ontario, Canada",
/title/tt0107120/,Hocus Pocus,"Plimouth Plantation - 137 Warren Avenue, Plymouth, Massachusetts, USA",(Google Maps)                        
/title/tt0107120/,Hocus Pocus,"4 Ocean Ave, Salem, Massachusetts, USA",(Max's house exterior)                        
/title/tt0107120/,Hocus Pocus,"Marblehead, Massachusetts, USA",(cemetery in the daytime)                        
/title/tt0107120/,Hocus Pocus,"Pioneer Village, Forest River Park - West Avenue, Salem, Massachusetts, USA",
/title/tt0107120/,Hocus Pocus,"Walt Disney Studios, 500 South Buena Vista Street, Burbank, California, USA",
/title/tt0107120/,Hocus Pocus,"Park Plaza Hotel - 607 S. Park View Street, Los Angeles, California, USA",
/title/tt5180504/,The Witcher,"Ogrodzieniec, Slaskie, Poland",(castle)                        
/title/tt5180504/,The Witcher,"Gran Canaria, Canary Islands, Spain",
/title/tt5180504/,The Witcher,"Maspalomas, Gran Canaria, Canary Islands, Spain",
/title/tt5180504/,The Witcher,"Guayedra, Gran Canaria, Canary Islands, Spain",
/title/tt5180504/,The Witcher,"La Palma, Canary Islands",(filming location)                        
/title/tt5180504/,The Witcher,"Roque Nublo, Gran Canaria, Canary Islands, Spain",
/title/tt5180504/,The Witcher,"Tamadaba, Gran Canaria, Canary Islands, Spain",
/title/tt5180504/,The Witcher,"Origo Studios, Budapest, Hungary",(studio)                        
/title/tt10404698/,Monsterland,"Kingston, New York, USA",
/title/tt3006802/,Outlander,"Doune Castle, Doune, Stirling, Scotland, UK",(Castle Leoch)                        
/title/tt3006802/,Outlander,"Blackness Castle, Blackness, Falkirk, West Lothian, Scotland, UK",(Fort William)                        
/title/tt3006802/,Outlander,"Culross, Fife, Scotland, UK",
/title/tt3006802/,Outlander,"Scotland, UK",
/title/tt3006802/,Outlander,"Pollok House, Glasgow, Strathclyde, Scotland, UK",(parkland)                        
/title/tt3006802/,Outlander,"Hopetoun House, South Queensferry, Edinburgh, Scotland, UK",
/title/tt1843230/,Once Upon a Time,"Steveston, Richmond, British Columbia, Canada",
/title/tt1843230/,Once Upon a Time,"Vancouver, British Columbia, Canada",
/title/tt1843230/,Once Upon a Time,"The Bridge Studios, Burnaby, British Columbia, Canada","(Stages 5/6, 7)                        "
/title/tt10183988/,Julie and the Phantoms,"Vancouver, British Columbia, Canada",
/title/tt10183988/,Julie and the Phantoms,"The Bridge Studios, Burnaby, British Columbia, Canada",
/title/tt1405406/,The Vampire Diaries,"598 Abernathy Road, NE, Atlanta, Georgia, USA",(Salvatore Boarding House)                        
/title/tt1405406/,The Vampire Diaries,"Chicago, Illinois, USA",
/title/tt1405406/,The Vampire Diaries,"2104 Floyd Street NE, Covington, Georgia, USA",(the gilbert house)                        
/title/tt1405406/,The Vampire Diaries,"2129 East Street SE, Covington, Georgia, USA",(Tyler's House)                        
/title/tt1405406/,The Vampire Diaries,"Conyers, Georgia, USA",
/title/tt1405406/,The Vampire Diaries,"Monroe, Georgia, USA",
/title/tt9140560/,WandaVision,"Atlanta, Georgia, USA",
/title/tt1548850/,Misfits,"Southmere Lakeside Complex, Thamesmead South, London, England, UK",(community center exterior)                        
/title/tt1548850/,Misfits,"London, England, UK",
/title/tt0241527/,Harry Potter en de steen der wijzen,"Alnwick Castle, Alnwick, Northumberland, England, UK",(Hogwarts School of Witchcraft and Wizardry: broomstick flying lessons)                        
/title/tt0241527/,Harry Potter en de steen der wijzen,"Pedestrian Bridge, York Railway Station, Station Road, York, North Yorkshire, England, UK",(Hagrid passes ticket for Platform 9¾ to Harry)                        
/title/tt0241527/,Harry Potter en de steen der wijzen,"Goathland Railway Station, Cow Wath Bank, Goathland, Whitby, North Yorkshire, England, UK",(Hogsmeade station)                        
/title/tt0241527/,Harry Potter en de steen der wijzen,"12 Picket Post Close, Martin's Heron, Bracknell, Berkshire, England, UK",(Dursley house; exterior)                        
/title/tt0241527/,Harry Potter en de steen der wijzen,"Black Park, Iver Heath, Buckinghamshire, England, UK",(dark forest)                        
/title/tt0241527/,Harry Potter en de steen der wijzen,"West Highland Railway Line, Scotland, UK",(Train journey to Hogwarts)                        
/title/tt0241527/,Harry Potter en de steen der wijzen,"Glen Nevis, Fort William, Highland, Scotland, UK",(Quidditch scenes: background landscape)                        
/title/tt0241527/,Harry Potter en de steen der wijzen,"Leadenhall Market, Lime Street, Broadgate, London, England, UK",(The Leaky Cauldron)                        
/title/tt0241527/,Harry Potter en de steen der wijzen,"Duke Humfrey's Library, Bodleian Library, Broad Street, Oxford, Oxfordshire, England, UK","(Hogwarts School, library scenes)                        "
/title/tt0241527/,Harry Potter en de steen der wijzen,"Divinity School, Bodleian Library, Broad Street, Oxford, Oxfordshire, England, UK","(Hogwarts School, sanatorium scenes)                        "
/title/tt0241527/,Harry Potter en de steen der wijzen,"Leavesden Studios, Leavesden, Hertfordshire, England, UK",(studio)                        
/title/tt0241527/,Harry Potter en de steen der wijzen,"England, UK",
/title/tt0241527/,Harry Potter en de steen der wijzen,"D Stage, Leavesden Studios, Leavesden, Hertfordshire, England, UK",(Dursley house interior; train compartment scenes)                        
/title/tt0241527/,Harry Potter en de steen der wijzen,"F Stage, Leavesden Studios, Leavesden, Hertfordshire, England, UK",(Hut-on-the-Rock; moving marble staircases; Devil's Snare room)                        
/title/tt0241527/,Harry Potter en de steen der wijzen,"A Stage, Leavesden Studios, Leavesden, Hertfordshire, England, UK",(Gringotts vaults; moving portraits; Gryffindor common room and boys dormitory; girls' bathroom; Quidditch scenes; Hermione sets Snape's cloak on fire)                        
/title/tt0241527/,Harry Potter en de steen der wijzen,"H Stage, Leavesden Studios, Leavesden, Hertfordshire, England, UK",(Harry discovers the dead unicorn in the forest)                        
/title/tt0241527/,Harry Potter en de steen der wijzen,"North Yorkshire Moors Railway, 12 Park Street, Pickering, North Yorkshire, England, UK",
/title/tt0241527/,Harry Potter en de steen der wijzen,"Goathland, Whitby, North Yorkshire, England, UK",
/title/tt0115963/,The Craft,"Verdugo Hills High School - 10625 Plainview Avenue, Tujunga, Los Angeles, California, USA",
/title/tt0115963/,The Craft,"Chateau Bradbury Estate - 2232 S. California Avenue, Duarte, California, USA",(party house)                        
/title/tt0115963/,The Craft,"Harbor Place Tower - 525 E. Seaside Way, Long Beach, California, USA",
/title/tt0115963/,The Craft,"Sony Pictures Studios - 10202 W. Washington Blvd., Culver City, California, USA",(studio)                        
/title/tt0115963/,The Craft,"Sunland, California, USA",
/title/tt0115963/,The Craft,"Duarte, California, USA",
/title/tt0115963/,The Craft,"Los Angeles, California, USA",
/title/tt0115963/,The Craft,USA,
/title/tt0118276/,Buffy the Vampire Slayer,"1313 Cota Drive, Torrance, California, USA",(Buffy's house)                        
/title/tt0118276/,Buffy the Vampire Slayer,"El Pueblo Apartments - 4616 Greenwood Place, Los Feliz, Los Angeles, California, USA",(establishing shots of Giles' apartment)                        
/title/tt0118276/,Buffy the Vampire Slayer,"California State University Northridge - 18111 Nordhoff Street, Northridge, Los Angeles, California, USA",(shots from the Oviatt Library)                        
/title/tt0118276/,Buffy the Vampire Slayer,"Ennis House - 2607 Glendower Avenue, Los Feliz, Los Angeles, California, USA",(Angel's mansion)                        
/title/tt0118276/,Buffy the Vampire Slayer,"1800 Stewart St., Santa Monica, California, USA",(studio)                        
/title/tt0118276/,Buffy the Vampire Slayer,"Walt Disney's Golden Oak Ranch - 19802 Placerita Canyon Road, Newhall, California, USA",
/title/tt5932548/,Britannia,"Wales, UK",
/title/tt5932548/,Britannia,"Ashridge, Hertfordshire, England, UK",(Druid camp)                        
/title/tt0100944/,The Witches,"Headland Hotel, Newquay, Cornwall, England, UK",
/title/tt0100944/,The Witches,"Cookham Dean, Berkshire, England, UK",(Helga's English House + Village Scenes)                        
/title/tt0100944/,The Witches,"Charnwold, Hills Lane, Cookham, Berkshire, England, UK",(Woman in Black approaches Luke)                        
/title/tt0100944/,The Witches,"Dean Manor, Hills Lane, Cookham, Berkshire, England, UK",(Helga's house)                        
/title/tt0100944/,The Witches,"Bigfrith Lane, Cookham, Berkshire, England, UK",(Children walking to school)                        
/title/tt0100944/,The Witches,"Hardangerjøkulen glacier, Finse, Norway",(opening sequence gliding over the snowy mountain tops)                        
/title/tt0411008/,Lost,"Waimea Bay, Waimea Bay Beach Park, O'ahu, Hawaii, USA",
/title/tt0411008/,Lost,"O'ahu, Hawaii, USA",
/title/tt0411008/,Lost,"North Shore, O'ahu, Hawaii, USA",
/title/tt0094721/,Beetlejuice,"East Corinth, Vermont, USA","(Peaceful Pines, CT)                        "
/title/tt0094721/,Beetlejuice,"General Store, East Corinth, Vermont, USA",(Maitland Hardware Store)                        
/title/tt6334354/,The Suicide Squad,Panama,
/title/tt6334354/,The Suicide Squad,"Atlanta, Georgia, USA",
/title/tt7556122/,The Old Guard,"Marrakech, Morocco",
/title/tt7556122/,The Old Guard,Morocco,(Somalia)                        
/title/tt7556122/,The Old Guard,"Shepperton Studios, Studios Road, Shepperton, Surrey, England, UK",
/title/tt7556122/,The Old Guard,"The Prospect of Whitby, 57 Wapping Wall, Wapping, London, England, UK",(Old historic pub)                        
/title/tt7556122/,The Old Guard,"Fetter Lane, Holborn, London, England, UK",(Merrick HQ street exterior)                        
/title/tt5606664/,Doctor Sleep,"Covington, Georgia, USA",(Doctor Sleep)                        
/title/tt5606664/,Doctor Sleep,"Georgia, USA",
/title/tt5606664/,Doctor Sleep,"Blackhall Studios, Atlanta, Georgia, USA",
/title/tt1620981/,The Addams Family,"Cinesite Studios - 565 Great Northern Way, Vancouver, British Columbia, Canada",
/title/tt5197820/,Van Helsing,"Vancouver, British Columbia, Canada",
/title/tt0101272/,The Addams Family,"Toluca Lake, Los Angeles, California, USA",(frontage to Addams Family mansion)                        
/title/tt0101272/,The Addams Family,"Hollywood Center Studios - 1040 N. Las Palmas Avenue, Hollywood, Los Angeles, California, USA",(studio)                        
/title/tt0101272/,The Addams Family,"Los Angeles, California, USA",
/title/tt0101272/,The Addams Family,"VA Hospital - 11301 Wilshire Blvd., Brentwood, Los Angeles, California, USA",
/title/tt0101272/,The Addams Family,"Sylmar, Los Angeles, California, USA",(Wampum Court Motel)                        
/title/tt0101272/,The Addams Family,"Santa Clarita, California, USA",
/title/tt0101272/,The Addams Family,"California, USA",
/title/tt7984734/,The Lighthouse,"Cape Forchu, Nova Scotia, Canada","(location, lighthouse)                        "
/title/tt7984734/,The Lighthouse,"Nova Scotia, Canada",
/title/tt2850386/,The Croods: A New Age,"Los Angeles, California, USA",(beach scenes)                        
/title/tt7126948/,Wonder Woman 1984,"Fuerteventura, Canary Islands, Spain",
/title/tt7126948/,Wonder Woman 1984,"Washington, District of Columbia, USA","(Wisconsin Ave, between K and M Street NW)                        "
/title/tt7126948/,Wonder Woman 1984,"Tenerife, Canary Islands, Spain",
/title/tt7126948/,Wonder Woman 1984,"National Museum of Natural History, Washington DC, USA",
/title/tt7126948/,Wonder Woman 1984,"Warner Bros. Studios, Leavesden, Hertfordshire, England, UK",(studio)                        
/title/tt7126948/,Wonder Woman 1984,"Torrington Square, Bloomsbury, London, England, UK",(location)                        
/title/tt7126948/,Wonder Woman 1984,"Almería, Andalucía, Spain",
/title/tt3501632/,Thor: Ragnarok,"Mount Tamborine, Queensland, Australia",
/title/tt3501632/,Thor: Ragnarok,"Atlanta, Georgia, USA",
/title/tt3501632/,Thor: Ragnarok,"Dirk Hartog Island, Australia",
/title/tt2560140/,Shingeki no kyojin,"Chicago, Illinois, USA",(river and bridges)                        
/title/tt7908628/,What We Do in the Shadows,"Toronto, Ontario, Canada",
/title/tt1099212/,Twilight,"218 Rim Drive, Washougal, Columbia River Gorge, Washington, USA",(Edward and Bella tree scene)                        
/title/tt1099212/,Twilight,"Corbett Elementary School - 35800 East Historic Columbia River Highway, Corbett, Columbia River Gorge, Oregon, USA",
/title/tt1099212/,Twilight,"Silver Falls State Park, Sublimity, Oregon, USA",(forest scenes)                        
/title/tt1099212/,Twilight,"Madison High School, Portland, Oregon, USA",(Forks High School interiors and cafeteria)                        
/title/tt1099212/,Twilight,"Stonecliff Inn Restaurant & Bar - 17900 S. Clackamas River Drive, Oregon City, Oregon, USA",
/title/tt1099212/,Twilight,"Gresham, Oregon, USA",
/title/tt1099212/,Twilight,"Vernonia, Oregon, USA",(as Forks)                        
/title/tt1099212/,Twilight,"Blue Heron Paper Company - 419 Main Street, Oregon City, Oregon, USA",
/title/tt1099212/,Twilight,"Multnomah Falls Lodge - 5000 E Historic Columbia River Hwy, Corbett, Columbia River Gorge, Oregon, USA",
/title/tt1099212/,Twilight,"The Shire - 28852 State Route 14, Prindle, Columbia River Gorge, Washington, USA",(baseball scene)                        
/title/tt1099212/,Twilight,"Multnomah Falls, Columbia River Gorge, Oregon, USA",
/title/tt1099212/,Twilight,"Oxbow Regional Park, Sandy River Gorge, Oregon, USA",
/title/tt1099212/,Twilight,"Portland, Oregon, USA",
/title/tt1099212/,Twilight,"Hyatt Valencia - 24500 Town Center Drive, Valencia, California, USA",(hiding out in Phoenix hotel)                        
/title/tt1099212/,Twilight,"Damascus, Oregon, USA",(Forks cafe)                        
/title/tt1099212/,Twilight,"Washington, USA",
/title/tt1099212/,Twilight,USA,
/title/tt0120737/,The Lord of the Rings: The Fellowship of the Ring,"Wellington, New Zealand",(Bree)                        
/title/tt0120737/,The Lord of the Rings: The Fellowship of the Ring,"Kaitoke Regional Park, Wellington Region, New Zealand",(Rivendell) (River Anduin)                        
/title/tt0120737/,The Lord of the Rings: The Fellowship of the Ring,"Port Waikato, Waikato, New Zealand",(Weathertop)                        
/title/tt0120737/,The Lord of the Rings: The Fellowship of the Ring,"Milford Sound, Fiordland National Park, Southland, New Zealand",
/title/tt0120737/,The Lord of the Rings: The Fellowship of the Ring,"Rangitikei River, Manawatu-Wanganui, New Zealand",(River Anduin)                        
/title/tt0120737/,The Lord of the Rings: The Fellowship of the Ring,"Tongariro National Park, Central Plateau, New Zealand",(Mordor)                        
/title/tt0120737/,The Lord of the Rings: The Fellowship of the Ring,"Tarras, Wanaka, Otago, New Zealand",(Ford of Bruinen)                        
/title/tt0120737/,The Lord of the Rings: The Fellowship of the Ring,"Poet's Corner, Upper Hutt, Wellington, New Zealand",(River Anduin)                        
/title/tt0120737/,The Lord of the Rings: The Fellowship of the Ring,"Upper Hutt, Wellington, New Zealand",
/title/tt0120737/,The Lord of the Rings: The Fellowship of the Ring,"Twizel, Canterbury, New Zealand",
/title/tt0120737/,The Lord of the Rings: The Fellowship of the Ring,"Arrowtown Recreational Reserve, Arrowtown, Otago, New Zealand",(Ford of Bruinen)                        
/title/tt0120737/,The Lord of the Rings: The Fellowship of the Ring,"Lake Alta, The Remarkables, Nelson, South Island, New Zealand",(Dimrill Dale)                        
/title/tt0120737/,The Lord of the Rings: The Fellowship of the Ring,"Abel Tasman National Park, South Island, Tasman region, New Zealand",(exteriors of Moria)                        
/title/tt0120737/,The Lord of the Rings: The Fellowship of the Ring,"Takaka Hill, Nelson, South Island, New Zealand",(forest near Bree)                        
/title/tt0120737/,The Lord of the Rings: The Fellowship of the Ring,"Mount Owen, Tasman district, Nelson, South Island, New Zealand",(Dimrill Dale)                        
/title/tt0120737/,The Lord of the Rings: The Fellowship of the Ring,"Closeburn, Southern Lakes, South Island, New Zealand",(Amon Hen)                        
/title/tt0120737/,The Lord of the Rings: The Fellowship of the Ring,"Hutt Valley, Wellington, New Zealand",(exteriors of Moria)                        
/title/tt0120737/,The Lord of the Rings: The Fellowship of the Ring,"Keeling Farm, Manakau, Horowhenua District, North Island, New Zealand",(Bucklebury Ferry)                        
/title/tt0120737/,The Lord of the Rings: The Fellowship of the Ring,"Mount Olympus, Nelson, South Island, New Zealand",(Eregion)                        
/title/tt0120737/,The Lord of the Rings: The Fellowship of the Ring,"Chicago Illinois, USA",
/title/tt7975244/,Jumanji: The Next Level,"Calgary, Alberta, Canada",
/title/tt7975244/,Jumanji: The Next Level,"Shiprock, New Mexico, USA",
/title/tt7975244/,Jumanji: The Next Level,"Hawaii, USA",
/title/tt7975244/,Jumanji: The Next Level,"Atlanta, Georgia, USA",
/title/tt7975244/,Jumanji: The Next Level,"Georgia, USA",
/title/tt7975244/,Jumanji: The Next Level,"Blackhall Studios, Atlanta, Georgia, USA",
/title/tt2771200/,Beauty and the Beast,"Shepperton Studios, Shepperton, Surrey, England, UK",
/title/tt2771200/,Beauty and the Beast,"Ashridge Estate, Hertfordshire, England, UK",(Mob of villagers march to the Beast's castle)                        
/title/tt2771200/,Beauty and the Beast,UK,
/title/tt2771200/,Beauty and the Beast,"A Stage, Shepperton Studios, Shepperton, Surrey, England, UK",(castle entrance; castle terrace; rooftop walkway)                        
/title/tt2771200/,Beauty and the Beast,"C Stage, Shepperton Studios, Shepperton, Surrey, England, UK",(ballroom)                        
/title/tt2771200/,Beauty and the Beast,"E Stage, Shepperton Studios, Shepperton, Surrey, England, UK",
/title/tt2771200/,Beauty and the Beast,"G Stage, Shepperton Studios, Shepperton, Surrey, England, UK",(interior of Gaston's tavern)                        
/title/tt6587640/,Trolls World Tour,"Glendale, California, USA",(DreamWorks Animation)                        
/title/tt2632424/,The Originals,"New Orleans, Louisiana, USA",
/title/tt2632424/,The Originals,"Olde Town Conyers, Georgia, USA","(Center Street, Commercial Street, Railroad Street)                        "
/title/tt0107688/,The Nightmare Before Christmas,"Skellington Productions - 375 7th Street, San Francisco, California, USA",(studio)                        
/title/tt8594324/,Ghosts,"West Horsley, West Horsley, Surrey, England, Uk",(Button House)                        
/title/tt2527338/,Star Wars: Episode IX - The Rise of Skywalker,"Wadi Rum, Jordan",(planet Pasaana)                        
/title/tt2527338/,Star Wars: Episode IX - The Rise of Skywalker,"Cardington studios, Hangar 2, Cardington Airfield, Bedford MK42 0TF, United Kingdom",(Bedfordshire)                        
Code,Show Name,Location,Scene
/title/tt2527338/,Star Wars: Episode IX - The Rise of Skywalker,"Wadi Rum, Jordan",(planet Pasaana)                        
/title/tt2527338/,Star Wars: Episode IX - The Rise of Skywalker,"Cardington studios, Hangar 2, Cardington Airfield, Bedford MK42 0TF, United Kingdom",(Bedfordshire)                        
/title/tt1567432/,Teen Wolf,"Northridge, Los Angeles, California, USA",
/title/tt1567432/,Teen Wolf,"Clark Residences - 306 Loma Drive - Los Angeles, California, USA",(The Eichen House)                        
/title/tt1567432/,Teen Wolf,"11 W Andrews Dr NW, Atlanta, Georgia, USA",(Lydia's house)                        
/title/tt1567432/,Teen Wolf,"Palisades High School - 15777 Bowdoin Street, Pacific Palisades, Los Angeles, California, USA",(Beacon Hills High School)                        
/title/tt1567432/,Teen Wolf,"4470 Thurgood Estates Dr, Ellenwood, Georgia, USA",(Allison's house)                        
/title/tt1567432/,Teen Wolf,"885 Courtenay Dr Ne, Atlanta, Georgia, USA",(Isaac's house)                        
