Code,Show Name,Location,Scene
/title/tt1628841/,Independence Day: Resurgence,"London, England, UK",
/title/tt1628841/,Independence Day: Resurgence,"Utah, USA",
/title/tt1628841/,Independence Day: Resurgence,"Nevada, USA",
/title/tt1628841/,Independence Day: Resurgence,"Tingley Coliseum - 300 San Pedro NE, Albuquerque, New Mexico, USA",(studio) (adapted space)                        
/title/tt1628841/,Independence Day: Resurgence,"Los Angeles, California, USA",(additional photography)                        
/title/tt1628841/,Independence Day: Resurgence,"Burj Khalifa, United Arab Emirates",
/title/tt1628841/,Independence Day: Resurgence,"Marina Bay Sands - 10 Bayfront Avenue, Singapore",
/title/tt0120812/,Rush Hour,"Foo-Chow Restaurant - 949 N Hill Street, Chinatown, Los Angeles, California, USA",
/title/tt0120812/,Rush Hour,"Capitol Records - 1750 N. Vine Street, Hollywood, Los Angeles, California, USA",(exterior only)                        
/title/tt0120812/,Rush Hour,"Hong Kong, China",
/title/tt0120812/,Rush Hour,"556 S Broadway, Los Angeles, California, USA","(FBI raid, explosion)                        "
/title/tt0120812/,Rush Hour,"380 South San Rafael Avenue, Pasadena, California, USA",(exterior: Chinese Consulate in Los Angeles)                        
/title/tt0120812/,Rush Hour,"Chinatown, Los Angeles, California, USA",
/title/tt0120812/,Rush Hour,"Grauman's Chinese Theater - 6925 Hollywood Blvd., Hollywood, Los Angeles, California, USA",
/title/tt0120812/,Rush Hour,"Greystone Park & Mansion - 905 Loma Vista Drive, Beverly Hills, California, USA",(entrance to the Chinese consulate)                        
/title/tt0120812/,Rush Hour,"Daly Market - 2235 Daly St, Los Angeles, California, USA",(exterior: Carter handcuffs Lee to steering wheel)                        
/title/tt0120812/,Rush Hour,USA,
/title/tt0120812/,Rush Hour,"Hollywood, Los Angeles, California, USA",
/title/tt0164052/,Hollow Man,"Los Angeles, California, USA",
/title/tt0164052/,Hollow Man,"Washington, District of Columbia, USA",
/title/tt2854926/,Tag,"Spokane, Washington, USA",
/title/tt2854926/,Tag,"Peachtree City, Georgia, USA",(on location)                        
/title/tt2854926/,Tag,"North River Tavern, Sandy Springs, Georgia, USA",(exterior of restaurant)                        
/title/tt2302755/,Olympus Has Fallen,"Bossier City, Louisiana, USA",
/title/tt2302755/,Olympus Has Fallen,"Brooklyn, New York City, New York, USA",(street scenes)                        
/title/tt2302755/,Olympus Has Fallen,"New York City, New York, USA",(stock footage) (stock footage only) (scenes from 1998 film The Siege)                        
/title/tt2302755/,Olympus Has Fallen,"Shreveport, Louisiana, USA",
/title/tt0186566/,Space Cowboys,"Six Flags Magic Mountain - 26101 Magic Mountain Parkway, Valencia, California, USA",(roller coaster)                        
/title/tt0186566/,Space Cowboys,"Houston, Texas, USA",(NASA Johnson Space Center. University of Houston - Downtown north parking lot)                        
/title/tt0186566/,Space Cowboys,"Rockwell Defense Plant - Bellflower & Imperial Highway, Downey, California, USA",
/title/tt0186566/,Space Cowboys,"Victorville, California, USA",
/title/tt0186566/,Space Cowboys,"Piru, California, USA",
/title/tt0186566/,Space Cowboys,"Halfway House Cafe - 15564 Sierra Highway, Santa Clarita, California, USA",
/title/tt0186566/,Space Cowboys,"Santa Clarita, California, USA",
/title/tt0186566/,Space Cowboys,"Stage 23, Warner Brothers Burbank Studios - 4000 Warner Boulevard, Burbank, California, USA",
/title/tt0186566/,Space Cowboys,"Johnson Space Center - 2101 NASA Rd., Houston, Texas, USA",(Change scene to present after Edwards AFB)                        
/title/tt0186566/,Space Cowboys,"Johnson Space Center - 2101 NASA Rd., Houston, Texas, USA",
/title/tt0186566/,Space Cowboys,"Houston, Texas, USA",
/title/tt0186566/,Space Cowboys,"Texas, USA",
/title/tt8755226/,Daybreak,"Albuquerque, New Mexico, USA",
/title/tt8755226/,Daybreak,"New Mexico State Film Office, Santa Fe, New Mexico, USA",
/title/tt2406566/,Atomic Blonde,"Budapest, Hungary","(as Berlin, Germany) (main shooting location)                        "
/title/tt2406566/,Atomic Blonde,"Berlin, Germany",
/title/tt2406566/,Atomic Blonde,"Studio Babelsberg, Potsdam, Brandenburg, Germany",
/title/tt2406566/,Atomic Blonde,"Gedächtniskirche, Charlottenburg, Berlin, Germany",
/title/tt2406566/,Atomic Blonde,Germany,
/title/tt2406566/,Atomic Blonde,"Berlin Cathedral, Mitte, Berlin, Germany",(background exterior)                        
/title/tt2406566/,Atomic Blonde,"Tempelhof, Berlin, Germany",
/title/tt2406566/,Atomic Blonde,"Fernsehturm, Mitte, Berlin, Germany",(background exterior)                        
/title/tt0458481/,Sin City: A Dame to Kill For,"Troublemaker Studios - 4900 Old Manor Road, Austin, Texas, USA",
/title/tt0458481/,Sin City: A Dame to Kill For,USA,
/title/tt5827790/,Orígenes secretos,"Madrid, Spain",
/title/tt0082136/,The Cannonball Run,"Atlanta, Georgia, USA",(Motel at start of race)                        
/title/tt0082136/,The Cannonball Run,"Old Tucson - 201 S. Kinney Road, Tucson, Arizona, USA",
/title/tt0082136/,The Cannonball Run,"Lawrenceville, Georgia, USA",(Ambulance scene after boat crash)                        
/title/tt0082136/,The Cannonball Run,"Las Vegas, Nevada, USA",
/title/tt0082136/,The Cannonball Run,"Portofino Inn - 260 Portofino way - Redondo Beach, California, USA",(End of race)                        
/title/tt0343818/,"I, Robot","Vancouver, British Columbia, Canada",
/title/tt0343818/,"I, Robot","Surrey, British Columbia, Canada",
/title/tt0343818/,"I, Robot","Dumont Dunes, California, USA",
/title/tt0343818/,"I, Robot","Central City Mall, Surrey, British Columbia, Canada",(robot army vs. humans street battle)                        
/title/tt0870154/,Jungle Cruise,"Kaua'i, Hawaii, USA",
/title/tt0870154/,Jungle Cruise,"Atlanta, Georgia, USA",
/title/tt0870154/,Jungle Cruise,USA,
/title/tt1060277/,Cloverfield,"New York Street, Warner Brothers Burbank Studios - 4000 Warner Boulevard, Burbank, California, USA",
/title/tt1060277/,Cloverfield,"Westfield Santa Anita Shopping Center - 400 South Baldwin Avenue, Arcadia, California, USA",
/title/tt1060277/,Cloverfield,"Santa Clarita, California, USA",
/title/tt1060277/,Cloverfield,"Warner Brothers Burbank Studios - 4000 Warner Boulevard, Burbank, California, USA",(studio)                        
/title/tt1060277/,Cloverfield,"Coney Island, Brooklyn, New York, USA",(Ferris Wheel)                        
/title/tt0106697/,Demolition Man,"Louisville, Kentucky, USA",
/title/tt0106697/,Demolition Man,"Pasadena, California, USA",(Wasteland scenes)                        
/title/tt0106697/,Demolition Man,"Fleur Daniels Chemical Company, Irvine, California, USA",(Museum exteriors)                        
/title/tt0106697/,Demolition Man,"San Diego Convention Center, San Diego, California, USA",(On the way to Taco Bell)                        
/title/tt0106697/,Demolition Man,"2nd Street Tunnel between Hill and Figueroa, Los Angeles, California, USA",
/title/tt0106697/,Demolition Man,"Los Angeles Convention Center - 1201 S. Figueroa Street, Downtown, Los Angeles, California, USA",
/title/tt0106697/,Demolition Man,"Westlake Village, California, USA",
/title/tt0106697/,Demolition Man,"Pacific Design Center - 8687 Melrose Avenue, West Hollywood, California, USA",
/title/tt0106697/,Demolition Man,"Stage 16, Warner Brothers Burbank Studios - 4000 Warner Boulevard, Burbank, California, USA",
/title/tt5074352/,Dangal,"Pune, Maharashtra, India",
/title/tt5074352/,Dangal,"Delhi, India","(Jawaharlal Nehru Stadium, Talkatora Stadium, Tyagraj Stadium)                        "
/title/tt0328107/,Man on Fire,"Naples, Campania, Italy",
/title/tt0328107/,Man on Fire,"El Paso, Texas, USA",
/title/tt0328107/,Man on Fire,"Mexico City, Distrito Federal, Mexico",
/title/tt0328107/,Man on Fire,"Los Angeles, California, USA",
/title/tt0328107/,Man on Fire,Italy,
/title/tt0328107/,Man on Fire,"California, USA",
/title/tt0367882/,Indiana Jones and the Kingdom of the Crystal Skull,"Iguazú Waterfalls, Misiones, Argentina",
/title/tt0367882/,Indiana Jones and the Kingdom of the Crystal Skull,"Iguaçu Falls, Parque Nacional do Iguaçu, Foz do Iguaçu, Paraná, Brazil",
/title/tt0367882/,Indiana Jones and the Kingdom of the Crystal Skull,"Bridgeport, Connecticut, USA",
/title/tt0367882/,Indiana Jones and the Kingdom of the Crystal Skull,"Hamakua Coast, Hawaii, USA",
/title/tt0367882/,Indiana Jones and the Kingdom of the Crystal Skull,"Fresno Chandler Downtown Airport, Fresno, California, USA",(airport scenes)                        
/title/tt0367882/,Indiana Jones and the Kingdom of the Crystal Skull,"Essex, Connecticut, USA",
/title/tt0367882/,Indiana Jones and the Kingdom of the Crystal Skull,"Deming, New Mexico, USA",
/title/tt0367882/,Indiana Jones and the Kingdom of the Crystal Skull,"Downey Studios - 12214 Lakewood Boulevard, Downey, California, USA",(studio)                        
/title/tt0367882/,Indiana Jones and the Kingdom of the Crystal Skull,"Pasadena, California, USA",
/title/tt0367882/,Indiana Jones and the Kingdom of the Crystal Skull,"Eagle Field - 11163 N. Eagle Avenue, Firebaugh, California, USA",
/title/tt0367882/,Indiana Jones and the Kingdom of the Crystal Skull,"Freeway Park, Backlot, Universal Studios - 100 Universal City Plaza, Universal City, California, USA",
/title/tt0367882/,Indiana Jones and the Kingdom of the Crystal Skull,"Paramount Studios - 5555 Melrose Avenue, Hollywood, Los Angeles, California, USA",(diner scene)                        
/title/tt0367882/,Indiana Jones and the Kingdom of the Crystal Skull,"Faye Spanos Concert Hall Stockton, California, USA",(Exterior Indy's Classroom)                        
/title/tt0367882/,Indiana Jones and the Kingdom of the Crystal Skull,"Warner Brothers Burbank Studios - 4000 Warner Boulevard, Burbank, California, USA",(studio)                        
/title/tt0172156/,Bad Boys II,Puerto Rico,
/title/tt0172156/,Bad Boys II,"Manatí, Puerto Rico",(City Hall)                        
/title/tt0172156/,Bad Boys II,"Miami Beach, Florida, USA",
/title/tt0172156/,Bad Boys II,"Intersection of US Highway 41 & SW 1st Ave - Miami, Florida, USA",(Haitian Zoe Pounder car chase car pile up)                        
/title/tt0172156/,Bad Boys II,Netherlands,
/title/tt0172156/,Bad Boys II,"Delray Beach, Florida, USA",
/title/tt0172156/,Bad Boys II,"Florida, USA",
/title/tt0172156/,Bad Boys II,"El Eden Motel - 115 SW 8th St, Miami, Florida, USA",(Zoe Pounder car chase; exterior.)                        
/title/tt0172156/,Bad Boys II,"Federal Prison Gun Range, 15801 SW 137th Ave, Miami, Florida, USA",(Firearms Training location for the Actors)                        
/title/tt0172156/,Bad Boys II,"570 Northeast 81st Street - Miami, Florida, USA",(Miami Bank: End of car chase where the dead bodies fall out of the trucks)                        
/title/tt0211443/,Jason X,"Toronto, Ontario, Canada",
/title/tt0211443/,Jason X,Canada,
/title/tt0093507/,Masters of the Universe,"Whittier, California, USA",
/title/tt0093507/,Masters of the Universe,"California, USA",
/title/tt0093507/,Masters of the Universe,"Vasquez Rocks Natural Area Park - 10700 W. Escondido Canyon Rd., Agua Dulce, California, USA",
/title/tt0093507/,Masters of the Universe,USA,
Code,Show Name,Location,Scene
/title/tt0214341/,Dragon Ball Z,"Los Angeles, California, USA",(Location)                        
/title/tt1091191/,Lone Survivor,"Albuquerque, New Mexico, USA",
/title/tt1091191/,Lone Survivor,"I-25 Studios, Albuquerque, New Mexico, USA",(Sound Stages)                        
/title/tt1091191/,Lone Survivor,Afghanistan,(location)                        
/title/tt0485301/,Torchwood,"Roald Dahl Plass, Cardiff, South Glamorgan, Wales, UK",
/title/tt0485301/,Torchwood,"Tredegar House, Newport, Wales, UK",
/title/tt0485301/,Torchwood,"BBC Wales, Cardiff, South Glamorgan, Wales, UK",(studio)                        
/title/tt0485301/,Torchwood,"Los Angeles, California, USA",(Miracle Day)                        
/title/tt6663582/,The Spy Who Dumped Me,"Budapest, Hungary",(Stage / Interiors)                        
/title/tt6663582/,The Spy Who Dumped Me,"Vienna, Austria",(street scenes)                        
/title/tt6663582/,The Spy Who Dumped Me,"Amsterdam, Netherlands",(location)                        
/title/tt6663582/,The Spy Who Dumped Me,"Atlanta, Georgia, USA",(reshoots)                        
/title/tt6663582/,The Spy Who Dumped Me,Austria,
/title/tt6663582/,The Spy Who Dumped Me,Denmark,(location)                        
/title/tt6663582/,The Spy Who Dumped Me,"Kelenföld Vasútállomás, Budapest, Hungary",(Vienna Central Station [Wien Hauptbahnhof])                        
/title/tt6663582/,The Spy Who Dumped Me,Germany,
/title/tt6663582/,The Spy Who Dumped Me,"Szabadság tér, Budapest, Hungary",(Sebastian and the girls drive out of the underground car park in Paris and also when minutes later they make a U-turn with the car)                        
/title/tt6663582/,The Spy Who Dumped Me,USA,
/title/tt2294449/,22 Jump Street,"San Juan, Puerto Rico",
/title/tt2294449/,22 Jump Street,"Lafreniere Park - 3000 Downs Blvd, Metairie, Louisiana, USA",(bike patrol scenes)                        
/title/tt2294449/,22 Jump Street,"Milan Street Wharf - Port of New Orleans, New Orleans, Louisiana, USA",(opening sequence)                        
/title/tt2294449/,22 Jump Street,"Historic St James AME Church - 222 N Roman St, New Orleans, Louisiana, USA",(old clandestine police HQ at 21 Jump St)                        
/title/tt2294449/,22 Jump Street,"Tulane University - 6823 St. Charles Avenue, New Orleans, Louisiana, USA",(Metropolitan City State College campus)                        
/title/tt2294449/,22 Jump Street,"Loyola University New Orleans - 6363 St Charles Ave, New Orleans, Louisiana, USA",(Metropolitan City State College campus)                        
/title/tt2294449/,22 Jump Street,Sheraton Old San Juan,(Valet Area)                        
/title/tt5363918/,Disenchantment,"New York City, New York, USA",
/title/tt0322259/,2 Fast 2 Furious,"Weston, Florida, USA",
/title/tt0322259/,2 Fast 2 Furious,"Universal Studios Florida, Universal Orlando Resort - 1000 Universal Studios Plaza, Orlando, Florida, USA",(studio)                        
/title/tt0322259/,2 Fast 2 Furious,"Boca Raton, Florida, USA",
/title/tt0322259/,2 Fast 2 Furious,"Versailles Restaurant - 3555 SW 8th Street, Miami, Florida, USA",
/title/tt0322259/,2 Fast 2 Furious,"Seven Mile Bridge, Florida Keys, Florida, USA",
/title/tt0322259/,2 Fast 2 Furious,"Hollywood, Florida, USA",
/title/tt0322259/,2 Fast 2 Furious,"Stage 4, Universal Studios - 100 Universal City Plaza, Universal City, California, USA",
/title/tt0322259/,2 Fast 2 Furious,"Miami, Florida, USA",
/title/tt1197624/,Law Abiding Citizen,"Holmesburg Prison - 8215 Torresdale Avenue, Philadelphia, Pennsylvania, USA",
/title/tt1197624/,Law Abiding Citizen,"Philadelphia City Hall - 1450 John F. Kennedy Blvd., Philadelphia, Pennsylvania, USA",
/title/tt1197624/,Law Abiding Citizen,"Girard Point, Philadelphia, Pennsylvania, USA",
/title/tt0065511/,C.C. & Company,"Old Tucson - 201 S. Kinney Road, Tucson, Arizona, USA",
/title/tt0065511/,C.C. & Company,"Sonoran Desert, Arizona, USA",
/title/tt2719848/,Everest,"South Base Camp, Mount Everest, Nepal",
/title/tt2719848/,Everest,"Kathmandu, Nepal",
/title/tt2719848/,Everest,"Val Senales, Trentino-Alto Adige, Italy",
/title/tt2719848/,Everest,"Pinewood Studios, Iver Heath, Buckinghamshire, England, UK",
/title/tt2719848/,Everest,"South Tyrol, Italy",
/title/tt0118583/,Alien: Resurrection,"Ottawa, Ontario, Canada",
/title/tt0118583/,Alien: Resurrection,"Winnipeg, Manitoba, Canada",
/title/tt0118583/,Alien: Resurrection,USA,
/title/tt0118583/,Alien: Resurrection,"Stage 15, 20th Century Fox Studios - 10201 Pico Blvd., Century City, Los Angeles, California, USA",(studio)                        
/title/tt3717490/,Power Rangers,"Kamloops, British Columbia, Canada",(location)                        
/title/tt3717490/,Power Rangers,"Steveston, Richmond, British Columbia, Canada",
/title/tt3717490/,Power Rangers,"Templeton Secondary School, Vancouver, British Columbia, Canada",
/title/tt5541338/,Six,"Wilmington, North Carolina, USA",
/title/tt5541338/,Six,"Vancouver, British Columbia, Canada",(Season 2)                        
/title/tt1590193/,The Commuter,"Sacramento, California, USA",
/title/tt1590193/,The Commuter,"Pinewood Studios, Iver Heath, Buckinghamshire, England, UK",
/title/tt0242653/,The Matrix Revolutions,"Martin Place, Sydney, New South Wales, Australia",
/title/tt0242653/,The Matrix Revolutions,"Sydney Central Business District, Sydney, New South Wales, Australia",
/title/tt0242653/,The Matrix Revolutions,"Royal Botanic Gardens, Sydney, New South Wales, Australia",(Oracle/Architect meeting)                        
/title/tt0242653/,The Matrix Revolutions,"Oakland, California, USA",
/title/tt0242653/,The Matrix Revolutions,"Alameda, California, USA",
/title/tt0317740/,The Italian Job,"Canazei, Trento, Trentino - Alto Adige, Italy",
/title/tt0317740/,The Italian Job,"Campo San Barnaba, Venice, Veneto, Italy",
/title/tt0317740/,The Italian Job,"Hollywood Boulevard & Vine Street, Hollywood, Los Angeles, California, USA",
/title/tt0317740/,The Italian Job,"Philadelphia, Pennsylvania, USA",
/title/tt0317740/,The Italian Job,"Metro Station, Hollywood & Highland Center, Hollywood, Los Angeles, California, USA",
/title/tt0317740/,The Italian Job,"Genoa, Liguria, Italy",
/title/tt0317740/,The Italian Job,"Los Angeles River, California, USA",(Test-driving the Minis)                        
/title/tt0317740/,The Italian Job,"Sepulveda Dam, Encino, Los Angeles, California, USA",(Test-driving the Minis and later car chase sequence)                        
/title/tt0317740/,The Italian Job,"Franklin Avenue & Vine Street, Hollywood, Los Angeles, California, USA",
/title/tt0317740/,The Italian Job,"Hollywood Sign, Hollywood Hills, Los Angeles, California, USA",
/title/tt0317740/,The Italian Job,"West Hollywood, California, USA",(Sunset Tower overlooking the Sunset Strip)                        
/title/tt0317740/,The Italian Job,"Lago Fedaia, Trentino, Italy",(lake scene)                        
/title/tt0317740/,The Italian Job,"Passo Sella, Trentino, Italy",(mountaintop scene)                        
/title/tt0317740/,The Italian Job,"7th St/Metro Center Station, Downtown, Los Angeles, California, USA",(some interior shots as Hollywood & Highland Metro station)                        
/title/tt0317740/,The Italian Job,"Everett St, Los Angeles, California, USA",(Car chase sequence; cars clear dam and head toward downtown)                        
/title/tt0317740/,The Italian Job,"The Vincent Thomas Bridge, San Pedro, CA 90731, United States",(crew meets at a metal recycling processing yard with the bridge in the background)                        
/title/tt1458175/,The Next Three Days,"Pittsburgh, Pennsylvania, USA",
/title/tt1458175/,The Next Three Days,"Taganga, Santa Marta, Magdalena, Colombia",(final scenes)                        
/title/tt1458175/,The Next Three Days,"Pittsburgh International Airport, Pittsburgh, Pennsylvania, USA",(airport terminal)                        
/title/tt0106977/,The Fugitive,"Bryson City, North Carolina, USA",
/title/tt0106977/,The Fugitive,"Cheoah Dam, Tapoco, North Carolina, USA","(Dam sequences, exterior)                        "
/title/tt0106977/,The Fugitive,"Great Smoky Mountains Railroad, Dillsboro, North Carolina, USA",
/title/tt0106977/,The Fugitive,"Pullman, Chicago, Illinois, USA","(2nd pay phone scene, running atop rowhouses, home of one armed man)                        "
/title/tt0106977/,The Fugitive,"Sylva, North Carolina, USA",
/title/tt0106977/,The Fugitive,"11219 S St Lawrence Ave, Chicago, Illinois, USA",
/title/tt0106977/,The Fugitive,"Chicago Hilton & Towers - 720 S. Michigan Avenue, Downtown, Chicago, Illinois, USA",
/title/tt0106977/,The Fugitive,"Blue Ridge Mountains, North Carolina, USA",
/title/tt0106977/,The Fugitive,"City Hall - 121 N. LaSalle Street, The Loop, Downtown, Chicago, Illinois, USA",
/title/tt0106977/,The Fugitive,"Merrill C. Meigs Field, Near South Side, Chicago, Illinois, USA",
/title/tt0106977/,The Fugitive,"Cook County Hospital - 1835 W. Harrison Street, Near West Side, Chicago, Illinois, USA",
/title/tt0106977/,The Fugitive,"The Loop, Downtown, Chicago, Illinois, USA",
/title/tt0106977/,The Fugitive,"Near South Side, Chicago, Illinois, USA",
/title/tt0106977/,The Fugitive,"Hyde Park, Chicago, Illinois, USA",
/title/tt0106977/,The Fugitive,USA,
/title/tt0106977/,The Fugitive,"Richard J. Daley Memorial Plaza, The Loop, Downtown, Chicago, Illinois, USA",
/title/tt2230051/,High School DxD,"Tokyo, Japan",
/title/tt2109248/,Transformers: Age of Extinction,"Monument Valley, Utah, USA",
/title/tt2109248/,Transformers: Age of Extinction,"Jasper, Michigan, USA",(South of Adrian)                        
/title/tt2109248/,Transformers: Age of Extinction,"Austin, Texas, USA",
/title/tt2109248/,Transformers: Age of Extinction,"Chicago, Illinois, USA",
/title/tt2109248/,Transformers: Age of Extinction,"Taylor, Texas, USA","(2nd street, Main Street bridge)                        "
/title/tt2109248/,Transformers: Age of Extinction,"Uptown Theatre - 4814-4816 N. Broadway Avenue, Uptown, Chicago, Illinois, USA",(abandoned theatre)                        
/title/tt2109248/,Transformers: Age of Extinction,"Pflugerville, Texas, USA",
/title/tt2109248/,Transformers: Age of Extinction,"Melber Lane, Manor, Texas, USA",(Cade Yaeger's House)                        
/title/tt2109248/,Transformers: Age of Extinction,"Milford, Michigan, USA",(General Motors Milford Proving Grounds)                        
/title/tt2109248/,Transformers: Age of Extinction,"McCormick Place - 2301 S. Lake Shore Drive, Near South Side, Chicago, Illinois, USA",(KSI Labs)                        
/title/tt2109248/,Transformers: Age of Extinction,"Kayenta, Arizona, USA",
/title/tt2109248/,Transformers: Age of Extinction,"300 East Randolph Street, Chicago, Illinois, USA",(KSI lobby and headquarters building)                        
/title/tt2109248/,Transformers: Age of Extinction,"Three Natural Bridges, Wulong, Chongqing, China",
/title/tt2109248/,Transformers: Age of Extinction,"Quarry Bay, Hong Kong",
/title/tt2109248/,Transformers: Age of Extinction,"West Kowloon Waterfront, West Kowloon, Hong Kong",
/title/tt2109248/,Transformers: Age of Extinction,"Central, Hong Kong",
/title/tt0060009/,Mission: Impossible,"Paramount Studios - 5555 Melrose Avenue, Hollywood, Los Angeles, California, USA",(seasons 2 to 7)                        
/title/tt0409847/,Cowboys & Aliens,"Santa Fe, New Mexico, USA",
/title/tt0409847/,Cowboys & Aliens,"Randsburg, California, USA",
/title/tt0409847/,Cowboys & Aliens,"Bonanza Creek Ranch - 15 Bonanza Creek Lane, Santa Fe, New Mexico, USA",
/title/tt2290553/,Northmen - A Viking Saga,Germany,
/title/tt0419706/,Doom,"Prague, Czech Republic",
/title/tt0419706/,Doom,"Barrandov Studios, Prague, Czech Republic",
/title/tt2393845/,Kill Me Three Times,"Lancelin, Western Australia, Australia",
/title/tt2393845/,Kill Me Three Times,"Sunset Hospital, Dalkeith, Perth, Western Australia, Australia",
/title/tt2393845/,Kill Me Three Times,"Margaret River, Western Australia, Australia",
/title/tt2393845/,Kill Me Three Times,"Dalkeith, Perth, Western Australia, Australia",
/title/tt0389722/,30 Days of Night,"Auckland, New Zealand",
/title/tt0389722/,30 Days of Night,"Hobsonville Aerodrome, Hobsonville, Auckland, New Zealand",
/title/tt0389722/,30 Days of Night,"Waiorau Snow Farm, Cadrona Valley, Wanaka, Otago, New Zealand",
/title/tt0111301/,Street Fighter,"Vancouver Film Studios, Vancouver, British Columbia, Canada",(studio) (re-shoots)                        
/title/tt0111301/,Street Fighter,"Brisbane, Queensland, Australia",
/title/tt0111301/,Street Fighter,"Gold Coast, Queensland, Australia",(some exteriors)                        
/title/tt0111301/,Street Fighter,Australia,
/title/tt0111301/,Street Fighter,Canada,
/title/tt1253863/,300: Rise of an Empire,"New Boyana Film Studios, Sofia, Bulgaria",
/title/tt1253863/,300: Rise of an Empire,"Red Studios, 846 N. Cahuenga Blvd., Hollywood, Los Angeles, California, USA",(studio)                        
/title/tt1253863/,300: Rise of an Empire,USA,
/title/tt0145660/,Austin Powers: The Spy Who Shagged Me,"Space Needle - 400 Broad Street, Seattle Center, Seattle, Washington, USA",
/title/tt0145660/,Austin Powers: The Spy Who Shagged Me,"New York Street, Backlot, Universal Studios - 100 Universal City Plaza, Universal City, California, USA",
/title/tt0145660/,Austin Powers: The Spy Who Shagged Me,"Marine Corps Air Station Tustin, Tustin, California, USA",
/title/tt1980209/,Pain & Gain,"Miami, Florida, USA",
/title/tt1552211/,The Last Days of American Crime,"Cape Town, Western Cape, South Africa",
/title/tt1552211/,The Last Days of American Crime,South Africa,
/title/tt0496806/,Ocean's Thirteen,"Bellagio Casino & Hotel - 3600 Las Vegas Boulevard South, Las Vegas, Nevada, USA",
/title/tt0496806/,Ocean's Thirteen,"Lake Las Vegas, Henderson, Nevada, USA",(Reuben Tishkoff's house)                        
/title/tt0496806/,Ocean's Thirteen,"Moorgate, London, England, UK",(street scenes)                        
/title/tt0496806/,Ocean's Thirteen,"Rosamond, California, USA",
/title/tt0496806/,Ocean's Thirteen,"Clark County, Nevada, USA",
