Code,Show Name,Location,Scene
/title/tt0093870/,RoboCop,"Ross Avenue & Arts Plaza - Dallas, Texas, USA",(Shell filling station that gets blown up)                        
/title/tt0093870/,RoboCop,"1201 Elm Street - Dallas, Texas, USA",(OCP boardroom interiors)                        
/title/tt1028528/,Death Proof,"Texas Chili Parlor, 1409 Lavaca St, Austin, Texas, USA",
/title/tt1028528/,Death Proof,"1415 South Congress Avenue - Austin, Texas, USA",(Stuntman Mike in his car watching the girls)                        
/title/tt1136608/,District 9,"Johannesburg, South Africa",
/title/tt1136608/,District 9,"Stone Street Studios, Stone Street, Miramar, Wellington, New Zealand",(studio)                        
/title/tt1136608/,District 9,South Africa,
/title/tt2140479/,The Accountant,"Atlanta, Georgia, USA","(stand in for Plainfield, Naperville, & Chicago, Illinois)                        "
/title/tt2140479/,The Accountant,"Academy of Medicine, Georgia Tech, Georgia, USA",(Location for Treasury offices and press conferences.)                        
/title/tt5886046/,Escape Room,"Chicago, Illinois, USA",
/title/tt6436726/,7500,"MMC Studios, Cologne, North Rhine-Westphalia, Germany",(airplane interiors)                        
/title/tt0073972/,Charlie's Angels,"189 N. Robertson Blvd., Beverly Hills, California, USA",(Charles Townsend Investigations office building)                        
/title/tt0073972/,Charlie's Angels,"Sunhala - 4551 Kahala Avenue, Honolulu, O'ahu, Hawaii, USA",(Charles Townsend Hawaiian office)                        
/title/tt0073972/,Charlie's Angels,"20th Century Fox Studios - 10201 Pico Blvd., Century City, Los Angeles, California, USA",(studio)                        
/title/tt0381849/,3:10 to Yuma,"Diablo Canyon, Santa Fe, New Mexico, USA",(railroad tunnels)                        
/title/tt0381849/,3:10 to Yuma,"Ghost Ranch, Abiquiu, New Mexico, USA",
/title/tt0381849/,3:10 to Yuma,"Clifton, Arizona, USA",
/title/tt0381849/,3:10 to Yuma,"Cerro Pelon Ranch - 5547 Hwy 41, North Galisteo, New Mexico, USA",
/title/tt0381849/,3:10 to Yuma,"Bonanza Creek Ranch - 15 Bonanza Creek Lane, Santa Fe, New Mexico, USA",
/title/tt1272878/,2 Guns,"Kenner, Louisiana, USA",
/title/tt1272878/,2 Guns,"Albuquerque, New Mexico, USA",(street scenes)                        
/title/tt1272878/,2 Guns,"Louisiana, USA",
/title/tt1272878/,2 Guns,"San Cristobal, New Mexico, USA",
/title/tt1272878/,2 Guns,"Estancia, New Mexico, USA",
/title/tt1272878/,2 Guns,"Santa Fe, New Mexico, USA",(studio) (Garson Studios)                        
/title/tt0816462/,Conan the Barbarian,Bulgaria,
/title/tt0816462/,Conan the Barbarian,"Blue Grotto, Zurrieq, Malta",(sea side)                        
/title/tt0816462/,Conan the Barbarian,"Vitosha, Bulgaria",
/title/tt0816462/,Conan the Barbarian,Malta,
/title/tt0816462/,Conan the Barbarian,"New Boyana Film Studios, Sofia, Bulgaria",
/title/tt0316654/,Spider-Man 2,"Spring Street Towers - 650 S. Spring Street, Downtown, Los Angeles, California, USA",(bank)                        
/title/tt0316654/,Spider-Man 2,"Ivar Theatre - 1605 N. Ivar Avenue, Hollywood, Los Angeles, California, USA",
/title/tt0316654/,Spider-Man 2,"Barclay Inter-Continental Hotel - 111 E. 48th Street, Manhattan, New York City, New York, USA",
/title/tt0316654/,Spider-Man 2,"Chicago, Illinois, USA",(train)                        
/title/tt0316654/,Spider-Man 2,"Cypress Hills Cemetery, Brooklyn, New York City, New York, USA",
/title/tt0316654/,Spider-Man 2,"Sony Pictures Studios - 10202 W. Washington Blvd., Culver City, California, USA",(studio)                        
/title/tt0316654/,Spider-Man 2,"Sunnyside, Queens, New York City, New York, USA",
/title/tt0316654/,Spider-Man 2,"Forest Hills, Queens, New York City, New York, USA",
Code,Show Name,Location,Scene
/title/tt1320253/,The Expendables,Brazil,
/title/tt1320253/,The Expendables,"Rio de Janeiro, Brazil",
/title/tt1320253/,The Expendables,"Louisiana, USA",
/title/tt1320253/,The Expendables,"Fort Macomb, New Orleans, Louisiana, USA",(Barney's fight scene)                        
/title/tt1320253/,The Expendables,USA,
/title/tt1320253/,The Expendables,"Los Angeles, California, USA",
/title/tt3663490/,The Librarians,"Portland, Oregon, USA",
/title/tt4572514/,Patriots Day,"Mason St. Malden, Massachusetts, USA",(Big firefight in street where one brother gets killed)                        
/title/tt4572514/,Patriots Day,"Quincy, Massachusetts, USA",
/title/tt4572514/,Patriots Day,"Malden, Massachusetts, USA",(Filming City)                        
/title/tt4572514/,Patriots Day,"Southfield, South Weymouth, Massachusetts, USA",
/title/tt4572514/,Patriots Day,"Framingham, Massachusetts, USA","(Watertown, Massachusetts)                        "
/title/tt4572514/,Patriots Day,"Somerville, Massachusetts, USA",
/title/tt4572514/,Patriots Day,"Emmanuel College, Boston, Massachusetts, USA",(UMass Dartmouth dorm)                        
/title/tt4572514/,Patriots Day,"421 Main St. Malden, Massachusetts, USA",(New York Pizza date)                        
/title/tt4572514/,Patriots Day,"Malden, Massachusetts, USA",(Patrick & Jessica's apartment-exterior)                        
/title/tt4572514/,Patriots Day,"Simmons College, 300 The Fenway, Boston, Massachusetts, USA",(UMass Dartmouth exteriors)                        
/title/tt0109506/,The Crow,"Screen Gems Studios - 1223 North 23rd Street, Wilmington, North Carolina, USA",(studio)                        
/title/tt0109506/,The Crow,"Wilmington, North Carolina, USA",(interiors)                        
/title/tt3475734/,Agent Carter,"Los Angeles, California, USA",
/title/tt3475734/,Agent Carter,"Warner Brothers Burbank Studios - 4000 Warner Boulevard, Burbank, California, USA",(street scenes)                        
/title/tt0790724/,Jack Reacher,"Strip District, Pittsburgh, Pennsylvania, USA",(DeLucas Resturant; 1st fight scene)                        
/title/tt0790724/,Jack Reacher,"North Shore Riverfront Trail, Pittsburgh, Pennsylvania, USA",(shooting site)                        
/title/tt0790724/,Jack Reacher,"625 Stanwix Tower Apartments, Pittsburgh, Pennsylvania, USA",(Parking lot sniper location)                        
/title/tt0790724/,Jack Reacher,"801 Ohio River Boulevard, Sewickley, Pennsylvania, USA","(as Three Rivers Motel, demolished)                        "
/title/tt0790724/,Jack Reacher,"Sewickley, Pennsylvania, USA",(Motel scenes)                        
/title/tt0790724/,Jack Reacher,"618 Windom Street, Pittsburgh, Pennsylvania, USA",(Jeb's house)                        
/title/tt0790724/,Jack Reacher,"9th St, Pittsburgh, Pennsylvania, USA",(street scenes)                        
/title/tt0808151/,Angels & demons - Het bernini mysterie,"St. Peter's Basilica, Vatican City",
/title/tt0808151/,Angels & demons - Het bernini mysterie,"Piazza del Popolo, Rome, Lazio, Italy",
/title/tt0808151/,Angels & demons - Het bernini mysterie,"Piazza Navona, Rome, Lazio, Italy",
/title/tt0808151/,Angels & demons - Het bernini mysterie,"Royal Palace, Caserta, Campania, Italy",
/title/tt0808151/,Angels & demons - Het bernini mysterie,"Hollywood Park Racetrack - 1050 S. Prairie Avenue, Inglewood, California, USA",(St Peter's Basilica exterior; Piazza Navona) (Park has since been demolished)                        
/title/tt0808151/,Angels & demons - Het bernini mysterie,"Royce Hall - 340 Royce Drive, UCLA, Westwood, Los Angeles, California, USA",(Harvard University exteriors)                        
/title/tt0808151/,Angels & demons - Het bernini mysterie,Vatican City,
/title/tt1133985/,Green Lantern,"San Diego, California, USA",(aeriel city shots)                        
/title/tt1133985/,Green Lantern,"Main St & St Mary St, Madisonville, Louisiana, USA",
/title/tt1133985/,Green Lantern,"Warner Brothers Burbank Studios - 4000 Warner Boulevard, Burbank, California, USA",(studio)                        
/title/tt1133985/,Green Lantern,"Soggy Dry Lake, Lucerne Valley, California, USA",
/title/tt1133985/,Green Lantern,"Los Angeles, California, USA",(reshoots)                        
/title/tt1133985/,Green Lantern,USA,
/title/tt1133985/,Green Lantern,"Burbank, California, USA",
/title/tt0480249/,I Am Legend,"USS Intrepid, New York City, New York, USA",(golf practice)                        
/title/tt0480249/,I Am Legend,"West Amwell, New Jersey, USA",
/title/tt0480249/,I Am Legend,"Dumbo, Brooklyn, New York City, New York, USA",
/title/tt0480249/,I Am Legend,"Washington Heights, Manhattan, New York City, New York, USA",
/title/tt0480249/,I Am Legend,"11 Washington Square North, Greenwich Village, Manhattan, New York City, New York, USA",(exteriors: Robert Neville's house)                        
/title/tt0480249/,I Am Legend,"Herald Square, Manhattan, New York City, New York, USA",(Neville driving)                        
/title/tt0480249/,I Am Legend,"New York City, New York, USA",
/title/tt0480249/,I Am Legend,"20 East Fourth Street, Manhattan, New York City, New York, USA",(video store)                        
/title/tt0480249/,I Am Legend,"Temple of Dendur, Metropolitan Museum of Art, Manhattan, New York City, New York, USA",(Neville fishing)                        
/title/tt0480249/,I Am Legend,"Los Angeles, California, USA",
/title/tt0480249/,I Am Legend,"Madison Square Park, Manhattan, New York City, New York, USA",(deer hunting)                        
/title/tt0480249/,I Am Legend,"Mt. Airy, New Jersey, USA",(Vermont survivors settlement)                        
/title/tt0479143/,Rocky Balboa,"Philadelphia Museum of Art - 2600 Benjamin Franklin Parkway, Philadelphia, Pennsylvania, USA",(Rocky steps)                        
/title/tt0479143/,Rocky Balboa,"1818 East Tusculum Street, Kensington, North Philadelphia, Pennsylvania, USA",(Rocky's old home)                        
/title/tt0479143/,Rocky Balboa,"Philadelphia City Hall - 1450 John F. Kennedy Blvd., Philadelphia, Pennsylvania, USA",
/title/tt0479143/,Rocky Balboa,"3091 Emerald Street, Philadelphia, Pennsylvania, USA",(Rocky's home)                        
/title/tt0479143/,Rocky Balboa,"2007 Walnut Street, Philadelphia, Pennsylvania, USA",(Irish Pub showing computed boxing match)                        
/title/tt0479143/,Rocky Balboa,"Laurel Hill Cemetery, Fairmount Park, Philadelphia, Pennsylvania, USA",(Adrian's grave)                        
/title/tt0479143/,Rocky Balboa,"Philadelphia Convention Center - 1700 Market Street, Philadelphia, Pennsylvania, USA",
/title/tt0479143/,Rocky Balboa,"Pennsylvania, USA",
/title/tt0479143/,Rocky Balboa,"Cira Centre - 2929 Arch Street, Philadelphia, Pennsylvania, USA",(Rocky's son workplace)                        
/title/tt0080455/,The Blues Brothers,"Dixie Square Mall - 151st Street & Dixie Highway, Harvey, Illinois, USA",(Shopping Mall Complex)                        
/title/tt0080455/,The Blues Brothers,"Pilgrim Baptist Church - 9114 S. Burley Avenue, South Chicago, Chicago, Illinois, USA",(Church scene with James Brown)                        
/title/tt0080455/,The Blues Brothers,"22 W. Van Buren Street, The Loop, Downtown, Chicago, Illinois, USA",(Jake and Elwood's apartment)                        
/title/tt0080455/,The Blues Brothers,"West Wind Motel - 28W721 Roosevelt Rd., West Chicago, Illinois, USA",(Motel scene with Twiggy)                        
/title/tt0080455/,The Blues Brothers,"Chez Paul Restaurant - 660 N. Rush Street, Near North Side, Chicago, Illinois, USA",(Restaurant)                        
/title/tt0080455/,The Blues Brothers,"Cooks Picnic Grove, Bangs Lake, Wauconda, Illinois, USA",(beach scene)                        
/title/tt0080455/,The Blues Brothers,"Joliet Prison - Collins Street, Joliet, Illinois, USA",(Prison)                        
/title/tt0080455/,The Blues Brothers,"Daniel Hoan Memorial Bridge, Milwaukee, Wisconsin, USA",(Car chase with Nazis - car hangs off bridge)                        
/title/tt0080455/,The Blues Brothers,"Hollywood Palladium - 6215 Sunset Blvd., Hollywood, Los Angeles, California, USA",(interiors: Palace Hotel Ballroom - First Performance of the Blues Brothers)                        
/title/tt0080455/,The Blues Brothers,"Intersection of W. Talcott & Devon Ave, Park Ridge, Illinois, USA",(Police chase & spin out)                        
/title/tt0080455/,The Blues Brothers,"East 95th Street Bridge, South Deering, Chicago, Illinois, USA",(Bluesmobile car jumps over bridge)                        
/title/tt0080455/,The Blues Brothers,"1623 S. 51st Court, Cicero, Illinois, USA",(Mrs. Tarantino's House)                        
/title/tt0080455/,The Blues Brothers,"Mannheim Road, Cook County, Illinois, USA",(Holiday Inn - Murph and the Magic Tones)                        
/title/tt0080455/,The Blues Brothers,"Singapore Lake, Backlot, Universal Studios - 100 Universal City Plaza, Universal City, California, USA",(Good 'Ole Boys motor-home crashes into lake)                        
/title/tt0080455/,The Blues Brothers,"North Lagoon, Jackson Park, Hyde Park, Chicago, Illinois, USA",
/title/tt0080455/,The Blues Brothers,"South Side, Chicago, Illinois, USA",
/title/tt0080455/,The Blues Brothers,"Van Buren & LaSalle Streets, The Loop, Downtown, Chicago, Illinois, USA",
/title/tt0080455/,The Blues Brothers,"Hollywood, Los Angeles, California, USA",
/title/tt0080455/,The Blues Brothers,"Chicago, Illinois, USA",
/title/tt0080455/,The Blues Brothers,"20 E. Randolph Street, Downtown, Chicago, Illinois, USA",(Bus Station)                        
/title/tt0080455/,The Blues Brothers,"Harvey, Illinois, USA",
/title/tt0080455/,The Blues Brothers,"City Hall - 121 N. LaSalle Street, The Loop, Downtown, Chicago, Illinois, USA",(Siege at City Hall-County Building - Steven Spielberg cameo)                        
/title/tt0080455/,The Blues Brothers,"South Lagoon, Jackson Park, Hyde Park, Chicago, Illinois, USA",
/title/tt0080455/,The Blues Brothers,"Park Ridge, Illinois, USA",
/title/tt0080455/,The Blues Brothers,USA,
/title/tt1155076/,The Karate Kid,"Huangshan Mountains, China",
/title/tt1155076/,The Karate Kid,"Beijing, China",
/title/tt1155076/,The Karate Kid,USA,
/title/tt1592154/,Nikita,"Revival 629, 629 Eastern Avenue, Toronto, Ontario, Canada",(studio) (movie studio)                        
/title/tt1592154/,Nikita,"Toronto, Ontario, Canada",
/title/tt8364368/,Crawl,"Belgrade, Serbia",
/title/tt1365519/,Tomb Raider,"Wilton House, Wilton, Salisbury, Wiltshire, England, UK",
/title/tt1365519/,Tomb Raider,"Epping, Cape Town, Western Cape, South Africa",
/title/tt1365519/,Tomb Raider,"London, England, UK",
/title/tt1365519/,Tomb Raider,"Warner Bros. Studios, Leavesden, Hertfordshire, England, UK",(studio)                        
/title/tt1365519/,Tomb Raider,South Africa,
/title/tt1365519/,Tomb Raider,"Cape Town, Western Cape, South Africa",
/title/tt9625664/,Trauma Center,"San Juan, Puerto Rico",(studio) (location)                        
/title/tt5461944/,Hotel Mumbai,"Adelaide Studios, 226 Fullarton Road, Glenside, South Australia, Australia","(studio) (interiors: Taj Mahal Hotel, Mumbai)                        "
/title/tt5461944/,Hotel Mumbai,"Adelaide, South Australia, Australia",(studio) (studio: South Australian Film Corporation)                        
/title/tt1596350/,This Means War,"Vancouver, British Columbia, Canada",
/title/tt1596350/,This Means War,"Steveston, Richmond, British Columbia, Canada",
/title/tt1596350/,This Means War,"Los Angeles, California, USA",
/title/tt1846589/,Hunter Killer,Bulgaria,
/title/tt1846589/,Hunter Killer,"Pinewood Studios, Iver Heath, Buckinghamshire, England, UK",(studio)                        
/title/tt1846589/,Hunter Killer,UK,
/title/tt6679794/,Outlaw King,"Linlithgow Palace, Linlithgow, West Lothian, Scotland, UK",
/title/tt6679794/,Outlaw King,"Berwick Bridge 'the Old Bridge', Berwick Upon Tweed, Northumberland, England, UK",
/title/tt6679794/,Outlaw King,"Mugdock Country Park, Milngavie, Glasgow, Scotland, UK",
/title/tt6679794/,Outlaw King,"Coral Beach, Isle of Skye, Scotland, UK",
/title/tt6679794/,Outlaw King,"Edinburgh, Scotland, UK",
/title/tt6679794/,Outlaw King,"Isle of Skye, Scotland, UK",
/title/tt6679794/,Outlaw King,"Glasgow, Scotland, UK",
/title/tt6679794/,Outlaw King,"Dunfermline Abbey Nave, Dunfermline, Fife, Scotland, UK",(interiors)                        
/title/tt6679794/,Outlaw King,"Tantallon Castle, East Lothian",(location)                        
/title/tt6679794/,Outlaw King,"Scotland, UK",
/title/tt6679794/,Outlaw King,"England, UK",
/title/tt3079380/,Spy,"Budapest, Hungary",
/title/tt3079380/,Spy,"Lake Balaton, Hungary","(as itself & at the beginning as Varna, Bulgaria)                        "
/title/tt3079380/,Spy,"Four Seasons Hotel Gresham Palace, Budapest, Hungary",
/title/tt3079380/,Spy,"Danube River, Budapest, Hungary",
/title/tt3079380/,Spy,"Hungarian Parliament Building, Budapest, Hungary",
/title/tt3079380/,Spy,"Budapest Whale, Budapest, Hungary",(open air concert in Paris)                        
/title/tt3079380/,Spy,"Tihany, Hungary",
/title/tt3079380/,Spy,"Origo Studios, Budapest, Hungary",(studio)                        
/title/tt3079380/,Spy,"Paris, France",
/title/tt3079380/,Spy,France,
/title/tt4396630/,The Gifted,"Atlanta Metro Studios, Union City, Georgia, USA",
/title/tt4396630/,The Gifted,"Dallas, Texas, USA",(pilot)                        
/title/tt4396630/,The Gifted,"Georgia, USA",
/title/tt0093560/,The Monster Squad,"Warner Brothers Burbank Studios - 4000 Warner Boulevard, Burbank, California, USA",(studio) (Studio/town square)                        
/title/tt0093560/,The Monster Squad,"Richland Avenue Elementary School - 11562 Richland Avenue, Los Angeles, California, USA",(School)                        
/title/tt0093560/,The Monster Squad,"Universal Studios - 100 Universal City Plaza, Universal City, California, USA",(Mansion)                        
/title/tt1013752/,Fast & Furious,Dominican Republic,
/title/tt1013752/,Fast & Furious,Mexico,
/title/tt1013752/,Fast & Furious,"Long Beach, California, USA",
/title/tt1013752/,Fast & Furious,"722 E Kensington Rd, Los Angeles, California, USA",(Dom's house)                        
/title/tt1013752/,Fast & Furious,"Backlot, Universal Studios - 100 Universal City Plaza, Universal City, California, USA",
/title/tt1013752/,Fast & Furious,"Soggy Dry Lake, Lucerne Valley, California, USA",
/title/tt1013752/,Fast & Furious,"W 8th St & S Hoover St, Los Angeles, California, USA",
/title/tt6475714/,Monster Hunter,"Western Cape, South Africa",
/title/tt6475714/,Monster Hunter,"Cape Town, Western Cape, South Africa",
/title/tt5807780/,Spider-Man,"New York City, New York, USA",
/title/tt5807780/,Spider-Man,"Chicago Illinois, USA",(Additional Buildings)                        
/title/tt5807780/,Spider-Man,China,
/title/tt5807780/,Spider-Man,"Shanghai, China",
/title/tt3393786/,Jack Reacher: Never Go Back,"New Orleans, Louisiana, USA",
/title/tt3393786/,Jack Reacher: Never Go Back,"Baton Rouge, Louisiana, USA",(as Washington DC exteriors)                        
/title/tt3393786/,Jack Reacher: Never Go Back,"311 Park Road, Metairie Park Country Day School, New Orleans, Louisiana, USA",(as Pembroke girls school)                        
/title/tt3393786/,Jack Reacher: Never Go Back,"Metairie, Louisiana, USA",
/title/tt3393786/,Jack Reacher: Never Go Back,"Washington, District of Columbia, USA",(CGI background plates and general views)                        
/title/tt3393786/,Jack Reacher: Never Go Back,USA,
/title/tt3393786/,Jack Reacher: Never Go Back,"LaPlace, Louisiana, USA",(diner in opening scene)                        
/title/tt3393786/,Jack Reacher: Never Go Back,"Ted's Frostop Diner - 3100 Calhoun St, New Orleans, Louisiana, USA",(take away diner)                        
/title/tt3393786/,Jack Reacher: Never Go Back,"New York City, New York, USA",
/title/tt0329101/,Freddy vs. Jason,"Buntzen Lake, Anmore, British Columbia, Canada",
/title/tt0329101/,Freddy vs. Jason,"Toronto, Ontario, Canada",
/title/tt0329101/,Freddy vs. Jason,"Vancouver, British Columbia, Canada",
/title/tt0329101/,Freddy vs. Jason,"Universal Studios Hollywood - 1000 Universal Studios Blvd, Universal City, California, USA",(Streets)                        
/title/tt0329101/,Freddy vs. Jason,"2170 W 35th Avenue, Vancouver, British Columbia, Canada",(Blake's house)                        
/title/tt1905041/,Fast & Furious 6,"Tenerife, Canary Islands, Spain",
/title/tt1905041/,Fast & Furious 6,"Liverpool, Merseyside, England, UK",(Portions of the London chase scenes filmed around Water Street.)                        
/title/tt1905041/,Fast & Furious 6,"Wembley Stadium, Wembley, London, England, UK",
/title/tt1905041/,Fast & Furious 6,"Puente de Silva, Santa María de Guía, Gran Canaria, Spain",
/title/tt1905041/,Fast & Furious 6,"Bentwaters Parks, Rendlesham, Suffolk, England, UK",(Airfield Hardened Aircraft Shelter site)                        
/title/tt1905041/,Fast & Furious 6,"Echo Park, Los Angeles, California, USA",
/title/tt1905041/,Fast & Furious 6,"Longcross Studios, Chobham Lane, Longcross, Surrey, England, UK",
/title/tt1905041/,Fast & Furious 6,"Canary Islands, Spain",
/title/tt1905041/,Fast & Furious 6,"722 E Kensington Rd, Los Angeles, California, USA",(Dom's house)                        
/title/tt1905041/,Fast & Furious 6,"A Stage, Shepperton Studios, Shepperton, Surrey, England, UK",
/title/tt1905041/,Fast & Furious 6,"D Stage, Shepperton Studios, Shepperton, Surrey, England, UK",
/title/tt0111503/,True Lies,"Seven Mile Bridge, Florida Keys, Florida, USA",(bridge escape)                        
/title/tt0111503/,True Lies,"Rosecliff Mansion - 548 Bellevue Avenue, Newport, Rhode Island, USA",(Ballroom scenes)                        
/title/tt0111503/,True Lies,"Toronto, Ontario, Canada",
/title/tt0111503/,True Lies,"1200 Brickell Avenue, Miami, Florida, USA",(Harry saving his daughter from the terrorists)                        
/title/tt0111503/,True Lies,"Marathon, Florida, USA",
/title/tt0111503/,True Lies,"Alverno High School - 200 North Michillinda Avenue, Sierra Madre, California, USA",
/title/tt0111503/,True Lies,"Boreal Mountain Resort - 19455 Boreal Ridge Road, Soda Springs, California, USA",
/title/tt0111503/,True Lies,"Bethesda, Maryland, USA",
/title/tt0111503/,True Lies,"Santa Clarita, California, USA",
/title/tt0111503/,True Lies,"Overseas Highway, Key Largo, Florida, USA",(bridge escape)                        
/title/tt0111503/,True Lies,"Chinatown, Washington, District of Columbia, USA",(Helen meets Simon)                        
/title/tt0111503/,True Lies,"Greenwich Studios - 12100 Ivan Tors Boulevard, Miami, Florida, USA",(studio)                        
/title/tt0111503/,True Lies,"San Diego, California, USA",
/title/tt0111503/,True Lies,"Virginia Key, Florida, USA",
/title/tt0111503/,True Lies,"Key Largo, Florida, USA",
/title/tt0111503/,True Lies,"Sepulveda Dam, Encino, Los Angeles, California, USA",(Harry threatens Simon)                        
/title/tt4648786/,Harriet,"Petersburg, Virginia, USA",
/title/tt4648786/,Harriet,"Powhatan, Virginia, USA",
/title/tt4648786/,Harriet,"Charles City, Virginia, USA",
/title/tt4648786/,Harriet,"Mathews, Virginia, USA",
/title/tt3322314/,Luke Cage,"New York City, New York, USA",
/title/tt0163025/,Jurassic Park III,"Nevada, USA",
/title/tt0163025/,Jurassic Park III,"El Mirage Dry Lake, California, USA",
/title/tt0163025/,Jurassic Park III,"Occidental College - 1600 Campus Road, Eagle Rock, Los Angeles, California, USA",
/title/tt0163025/,Jurassic Park III,"Kern River, California, USA",
/title/tt0163025/,Jurassic Park III,"South Pasadena, California, USA",
/title/tt0163025/,Jurassic Park III,"Falls Lake, Backlot, Universal Studios - 100 Universal City Plaza, Universal City, California, USA",
/title/tt0163025/,Jurassic Park III,"Stage 12, Universal Studios - 100 Universal City Plaza, Universal City, California, USA",
/title/tt0163025/,Jurassic Park III,"Stage 27, Universal Studios - 100 Universal City Plaza, Universal City, California, USA",
/title/tt0163025/,Jurassic Park III,"Stage 44, Universal Studios - 100 Universal City Plaza, Universal City, California, USA",
/title/tt7390646/,Black and Blue,"DeGaulle Manor Housing Project - 3010 Sandra Drive, New Orleans, Louisiana, USA",(Drug dealers apartment)                        
/title/tt7390646/,Black and Blue,"Evergreen Supermarket, 3011 Sandra Dr, New Orleans, LA 70114, United States",(Super Market)                        
/title/tt0102798/,Robin Hood: Prince of Thieves,"Hadrian's Wall, Northumberland, England, UK",(Where Robin fights some sheriffs men before arriving at his father's castle)                        
/title/tt0102798/,Robin Hood: Prince of Thieves,"Alnwick Castle, Alnwick, Northumberland, England, UK",
/title/tt0102798/,Robin Hood: Prince of Thieves,"Hardraw Force Waterfall, Hardraw, Hawes, North Yorkshire, England, UK",(Where Marion sees Robin swimming)                        
/title/tt0102798/,Robin Hood: Prince of Thieves,"Seven Sisters, East Sussex, England, UK",(Where Robin and Azim land from France)                        
/title/tt0102798/,Robin Hood: Prince of Thieves,"Hulne Priory, Northumberland, England, UK",(Maid Marion's home)                        
/title/tt0102798/,Robin Hood: Prince of Thieves,"Burnham Beeches, Buckinghamshire, England, UK",
/title/tt0102798/,Robin Hood: Prince of Thieves,"Metz, Moselle, France",
/title/tt0102798/,Robin Hood: Prince of Thieves,"Calvados, France",
