Code,Show Name,Location,Scene
/title/tt4244998/,Alpha,"Vancouver, British Columbia, Canada",(main location)                        
/title/tt4244998/,Alpha,"Brooks, Alberta, Canada",(location)                        
/title/tt2334879/,White House Down,"Cité du Cinéma, Montréal, Québec, Canada",(studio)                        
/title/tt2334879/,White House Down,Canada,
/title/tt2106361/,Into the Storm,"Detroit, Michigan, USA",
/title/tt2106361/,Into the Storm,"Oakland Charter Township, Michigan, USA",(Silverton High School)                        
/title/tt2452242/,Happy!,"Clinton Diner, Maspeth, Queens, New York City, New York, USA",(Diner)                        
/title/tt1899353/,The Raid,Indonesia,(Jakarta)                        
/title/tt0287978/,Daredevil,"Los Angeles, California, USA",
/title/tt0287978/,Daredevil,"Biltmore Hotel - 506 S. Grand Avenue, Downtown, Los Angeles, California, USA","(The Grand Hotel interior, hosting the Black & White Ball)                        "
/title/tt0287978/,Daredevil,"First Congregational Church - 540 S. Commonwealth Avenue, Los Angeles, California, USA",
/title/tt0287978/,Daredevil,"Santa Clarita, California, USA",
/title/tt0287978/,Daredevil,"Downey Studios - 12214 Lakewood Boulevard, Downey, California, USA",(studio)                        
/title/tt0287978/,Daredevil,"California, USA",
/title/tt0287978/,Daredevil,USA,
/title/tt1411250/,The Chronicles of Riddick: Rule the Dark,"Montréal, Québec, Canada",
/title/tt9544034/,The Family Man,"Leh, Ladakh, Jammu & Kashmir, India",(Filming City)                        
/title/tt9544034/,The Family Man,"Kashmir, India",(Filming City)                        
/title/tt4230076/,The Defenders,USA,
/title/tt1764651/,The Expendables 2,"Plovdiv Airport, Bulgaria",(Krumovo Airport)                        
/title/tt1764651/,The Expendables 2,"Vitosha, Bulgaria",
/title/tt1764651/,The Expendables 2,"Devetaki Cave, Bulgaria",
/title/tt1764651/,The Expendables 2,"Lovech, Bulgaria",
/title/tt1764651/,The Expendables 2,"Bansko, Bulgaria",
/title/tt1764651/,The Expendables 2,"Ognyanovo Reservoir, Bulgaria",
/title/tt1764651/,The Expendables 2,China,
/title/tt0091225/,Howard the Duck,"Petaluma, California, USA","(Petaluma River is used for almost all waterway scenes, with takeoff from Western Avenue)                        "
/title/tt0091225/,Howard the Duck,"Modesto, California, USA",
/title/tt0091225/,Howard the Duck,"Black Point, California, USA",(Ultralight loops the Sears Point Bridge)                        
/title/tt0091225/,Howard the Duck,"Oakland, California, USA",
/title/tt0091225/,Howard the Duck,"Sacramento, California, USA",
/title/tt0091225/,Howard the Duck,"Irving Street, San Francisco, California, USA","(Taxi goes from 9th Avenue onto Irving, then through the 800 block of Irving Street)                        "
/title/tt0091225/,Howard the Duck,"Carneros Highway, Napa, California, USA","(Joe Roma's Cajun/Sushi Café; exterior) (coordinates: 38°15'19.7""N 122°19'44.9""W)                        "
/title/tt0091225/,Howard the Duck,"Industrial Light and Magic - 3210 Kerner Boulevard, San Rafael, California, USA",(studio)                        
/title/tt1194173/,The Bourne Legacy,"El Nido, Palawan, Philippines",(ending scene)                        
/title/tt1194173/,The Bourne Legacy,"Manila, Metro Manila, Philippines",
/title/tt1194173/,The Bourne Legacy,"Kananaskis Country, Alberta, Canada",(as Alaska)                        
/title/tt1194173/,The Bourne Legacy,"Chicago, Illinois, USA",
/title/tt1194173/,The Bourne Legacy,"Long Island, New York, USA",
/title/tt1194173/,The Bourne Legacy,"Kaufman Astoria Studios - 3412 36th Street, Astoria, Queens, New York City, New York, USA",(studio)                        
/title/tt1194173/,The Bourne Legacy,"Taft Avenue MRT station, Pasay City, Metro Manila, Philippines",(chase on the footbridge)                        
/title/tt1194173/,The Bourne Legacy,"Dr. Oliver Bronson House, Hudson, New York, USA",(exteriors: Dr. Shearing's house in the woods)                        
/title/tt1194173/,The Bourne Legacy,"Empress Diner, East Meadow, Long Island, New York, USA",
/title/tt0993840/,Army of the Dead,"Showboat Atlantic City, Atlantic City, New Jersey, USA",
Code,Show Name,Location,Scene
/title/tt2103188/,Grand Theft Auto V,"Los Angeles, California, USA",(Los Santos)                        
/title/tt2103188/,Grand Theft Auto V,"Koreatown, Los Angeles, California, USA",
/title/tt1139592/,Jeepers Creepers 3,"Baton Rouge, Louisiana, USA",
/title/tt1139592/,Jeepers Creepers 3,"New Roads, Louisiana, USA","(Sheriff Station, Feed Store)                        "
/title/tt1139592/,Jeepers Creepers 3,"Jackson, Louisiana, USA",
/title/tt1139592/,Jeepers Creepers 3,"Village Studios - 4626 Highway 68, Jackson, Louisiana, USA",(studio) (interior: Creeper's Truck)                        
/title/tt1139592/,Jeepers Creepers 3,"Louisiana, USA",
/title/tt0119190/,George uit de jungle,"Kaua'i, Hawaii, USA",
/title/tt0119190/,George uit de jungle,"755 Vallejo Street, San Francisco, California, USA",
/title/tt0119190/,George uit de jungle,"Filoli Estate - 86 Cañada Road, Woodside, California, USA",
/title/tt0119190/,George uit de jungle,"San Francisco, California, USA",
/title/tt0119190/,George uit de jungle,"Bronson Canyon, Griffith Park - 4730 Crystal Springs Drive, Los Angeles, California, USA",
/title/tt0119190/,George uit de jungle,"Las Vegas, Nevada, USA",
/title/tt0119190/,George uit de jungle,"Lombard Street, San Francisco, California, USA",(George runs along a crooked street)                        
/title/tt0105946/,Babylon 5,"Sun Valley, Los Angeles, California, USA",(studio)                        
/title/tt1413492/,12 Strong,"Mines Near Orogrande New Mexico, USA",
/title/tt1413492/,12 Strong,"Socorro, New Mexico, USA",
/title/tt1413492/,12 Strong,"Albuquerque, New Mexico, USA",
/title/tt1413492/,12 Strong,"Santa Clarita, California, USA",
/title/tt8289480/,Treadstone,"Budapest, Hungary",
/title/tt0080745/,Flash Gordon,"Airstrip, Breakish, Skye, Highland, Scotland, UK",
/title/tt0080745/,Flash Gordon,"EMI Elstree Studios, Borehamwood, Hertfordshire, England, UK",(studio) (studio: made at)                        
/title/tt0082340/,Escape from New York,"Fox Theater - 527 N. Grand Boulevard, St. Louis, Missouri, USA",(Broadway theatre relics)                        
/title/tt0082340/,Escape from New York,"Union Station - 1 St Louis Union Station, St. Louis, Missouri, USA",(fight in Madison Square Gardens)                        
/title/tt0082340/,Escape from New York,"Civil Courts Building - Twelfth Street, St. Louis, Missouri, USA",(hideout of Brain)                        
/title/tt0082340/,Escape from New York,"Grand Hall, Union Station - 1 St Louis Union Station, St. Louis, Missouri, USA",(fight in Madison Square Gardens)                        
/title/tt0082340/,Escape from New York,"Atlanta, Georgia, USA",(MARTA rapid transit system scenes deleted)                        
/title/tt0082340/,Escape from New York,"Indian Dunes - 28700 Henry Mayo Drive, Valencia, California, USA",(Glider sequences)                        
/title/tt0082340/,Escape from New York,"The Wiltern - 3790 Wilshire Blvd., Los Angeles, California, USA",
/title/tt0082340/,Escape from New York,"Los Angeles, California, USA",
/title/tt0082340/,Escape from New York,"Davis-Monthan Air Force Base, Tucson, Arizona, USA",(Airplane graveyard scene deleted - Gullfire Glider over Leningrad scenes deleted)                        
/title/tt0082340/,Escape from New York,"California Institute of the Arts, Valencia, California, USA",(The scene where Snake tries to start the Datsun and one of the Duke of New York's minions comes out of the engine compartment was filmed in the Main Lobby of Cal Arts.)                        
/title/tt0082340/,Escape from New York,"Hartsfield-Jackson Atlanta International Airport - 6000 North Terminal Parkway, Atlanta, Georgia, USA",(Bank robbery scenes deleted)                        
/title/tt0082340/,Escape from New York,"Santa Clarita, California, USA",
/title/tt0082340/,Escape from New York,"New York Harbor, New York City, New York, USA",
/title/tt0082340/,Escape from New York,"Valencia, California, USA",
/title/tt0082340/,Escape from New York,"Missouri, USA",
/title/tt6807662/,The New Legends of Monkey,"Kumeu Film Studios, 116 Access Rd, Kumeu 0891, New Zealand",
/title/tt1855199/,End of Watch,"Los Angeles, California, USA",
/title/tt0475394/,Smokin' Aces,"South Lake Tahoe, California, USA",
/title/tt0475394/,Smokin' Aces,"Las Vegas, Nevada, USA",
/title/tt0475394/,Smokin' Aces,"El Dorado County, California, USA",
/title/tt0475394/,Smokin' Aces,"California, USA",
/title/tt0406375/,Zathura: A Space Adventure,"South Pasadena, California, USA",
/title/tt0406375/,Zathura: A Space Adventure,"Sony Pictures Studios - 10202 W. Washington Blvd., Culver City, California, USA",(studio)                        
/title/tt5822564/,The Kitchen,"New York City, New York, USA",
/title/tt8050756/,The Owl House,Paris France,(location)                        
/title/tt0097428/,Ghostbusters II,"Fire Station 23 - 225 E. 5th Street, Los Angeles, California, USA",(interiors: Ghostbusters headquarters)                        
/title/tt0097428/,Ghostbusters II,"Greystone Park & Mansion - 905 Loma Vista Drive, Beverly Hills, California, USA",
/title/tt0097428/,Ghostbusters II,"Val's Restaurant, 10130 Riverside Drive, Toluca Lake, California, USA",(restaurant where Dana and Peter have dinner)                        
/title/tt0097428/,Ghostbusters II,"Stage 15, Warner Brothers Burbank Studios - 4000 Warner Boulevard, Burbank, California, USA",(studio)                        
/title/tt0097428/,Ghostbusters II,"Stage 16, Warner Brothers Burbank Studios - 4000 Warner Boulevard, Burbank, California, USA",(studio)                        
/title/tt1020558/,Centurion,"Cairngorm Mountains, Highland, Scotland, UK",
/title/tt1020558/,Centurion,"Badenoch and Strathspey, Highland, Scotland, UK",
/title/tt1020558/,Centurion,"Surrey, England, UK",
/title/tt1020558/,Centurion,"H Stage, Pinewood Studios, Iver Heath, Buckinghamshire, England, UK",(studio)                        
/title/tt1020558/,Centurion,"G Stage, Shepperton Studios, Shepperton, Surrey, England, UK",(studio)                        
/title/tt12546328/,Crash Bandicoot 4: It's About Time,"Chicago Illinois, USA",(beach scenes)                        
/title/tt0067116/,The French Connection,"Château d'If, Marseille, Bouches-du-Rhône, France","(secret meeting between Charnier, Nicoli and Devereaux)                        "
/title/tt0067116/,The French Connection,"Le Copain 891 1st Ave, New York City, New York, USA",(French Restaurant)                        
/title/tt0067116/,The French Connection,"86th Street, Brooklyn, New York City, New York, USA",(chase scene)                        
/title/tt0067116/,The French Connection,"La samaritaine - 2 Quai du Vieux-Port, Marseille, Bouches-du-Rhône, France",
/title/tt0067116/,The French Connection,"Onderdonk Avenue, Ridgewood, Queens, New York City, New York, USA",
/title/tt0067116/,The French Connection,"Wards Island, New York City, New York, USA",(the final shootout scene)                        
/title/tt0067116/,The French Connection,"Grand Central Station Shuttle, Manhattan, New York City, New York, USA",
/title/tt0067116/,The French Connection,"Chez Fonfon - 140 Rue du Vallon des Auffes, Marseille, Bouches-du-Rhône, France",(opening scene: Charnier exits the restaurant)                        
/title/tt0067116/,The French Connection,"Rue Baussenque, Marseille, Bouches-du-Rhône, France",(street scenes)                        
/title/tt0067116/,The French Connection,"912 Broadway, Brooklyn, New York City, New York, USA","(""Rio Piedras"" theater - actually the Broadway Theater - Santa Clause scene)                        "
/title/tt0067116/,The French Connection,"Avenue De L'Amiral Ganteaume, Cassis, Bouches-du-Rhône, France",(Charnier's house)                        
/title/tt0067116/,The French Connection,"Putnam Avenue, Ridgewood, Queens, New York City, New York, USA",
/title/tt0067116/,The French Connection,"Washington, District of Columbia, USA",
/title/tt0067116/,The French Connection,"Manhattan, New York City, New York, USA",
/title/tt0067116/,The French Connection,"940 2nd Avenue, New York City, New York, USA",(scene where Charnier and Nicoli buy fruit and Popeye is watching)                        
/title/tt0067116/,The French Connection,"Dover Street and Water Street, Manhattan, New York City, New York, USA",(scene where Sal parks the Lincoln on Dover street by the Brooklyn Bridge)                        
/title/tt0067116/,The French Connection,"Henry Hudson Parkway Route 9A at Junction 24, New York City, New York, USA",(car accident scene)                        
/title/tt0067116/,The French Connection,"Ratner's Restaurant, 138 Delancey Street, New York City, New York, USA",(scene where Sal and Angie emerge)                        
/title/tt0067116/,The French Connection,"Ronaldo Maia Flowers, 27 East 67th Street at Madison, New York City, New York, USA",(scene where Charnier gives Popeye the slip)                        
/title/tt0067116/,The French Connection,"South Street at Market Street, near Manhattan Bridge, New York City, New York, USA",(scene where Doyle emerges from a bar)                        
/title/tt0067116/,The French Connection,"Ellery Street, Brooklyn, New York City, New York, USA",(Doyle and Russo beat a suspect)                        
/title/tt0067116/,The French Connection,"Plage du bestouan, Cassis, Bouches-du-Rhône, France",
/title/tt0067116/,The French Connection,USA,
/title/tt0067116/,The French Connection,"National Mall, Washington, District of Columbia, USA",(Sal meets Charnier)                        
/title/tt0067116/,The French Connection,"Cassis, Bouches-du-Rhône, France",
/title/tt0144117/,The Boondock Saints,"Toronto, Ontario, Canada",
/title/tt0144117/,The Boondock Saints,"Longfellow Bridge, Boston, Massachusetts, USA",
/title/tt0144117/,The Boondock Saints,"South Boston, Boston, Massachusetts, USA",
/title/tt0144117/,The Boondock Saints,"Boston, Massachusetts, USA",
/title/tt0144117/,The Boondock Saints,USA,
/title/tt1321511/,Oldboy,"New Orleans, Louisiana, USA",
/title/tt11079116/,Superman: Man of Tomorrow,"Chicago, Illinois USA",(Metropolis)                        
/title/tt1528406/,Fairy Tail: Fearî teiru,"Tokyo, Japan",
/title/tt6468680/,Marvel's Avengers,"San Francisco, California, USA",
/title/tt0489099/,Jumper,"Giza, Egypt",
/title/tt0489099/,Jumper,"Peterborough, Ontario, Canada",
/title/tt0489099/,Jumper,"Newport, Michigan, USA",
/title/tt0489099/,Jumper,"Manhattan, New York City, New York, USA",
/title/tt0489099/,Jumper,"Paris, France",
/title/tt0489099/,Jumper,"Tokyo, Japan",
/title/tt0489099/,Jumper,"Boscolo Hotel Exedra, Piazza della Repubblica, Rome, Lazio, Italy",
/title/tt0489099/,Jumper,"The Colosseum, Rome, Lazio, Italy",
/title/tt0489099/,Jumper,"Toronto, Ontario, Canada",
/title/tt0489099/,Jumper,"New York, USA",
/title/tt0489099/,Jumper,"Louisiana, USA",
/title/tt0489099/,Jumper,Mexico,
/title/tt0489099/,Jumper,"Fox Baja Studios, Rosarito, Baja California Norte, Mexico",(studio)                        
/title/tt5758778/,Skyscraper,Hong Kong,
/title/tt5758778/,Skyscraper,"Vancouver, British Columbia, Canada",
/title/tt5758778/,Skyscraper,"Hong Kong Cultural Centre, Salisbury Road, Tsim Sha Tsui, Hong Kong",(The Skyscraper)                        
/title/tt4463894/,Shaft,"Atlanta, Georgia, USA",
/title/tt4463894/,Shaft,"New York, USA",
/title/tt4463894/,Shaft,"New York City, New York, USA",
/title/tt0212346/,Miss Congeniality,"Bass Concert Hall, Performing Arts Center - 23rd St. & Dedmon Drive, University of Texas, Austin, Texas, USA",
/title/tt0212346/,Miss Congeniality,"Austin, Texas, USA",
/title/tt0212346/,Miss Congeniality,"Round Rock, Texas, USA",
/title/tt0212346/,Miss Congeniality,"Arneson River Theater, San Antonio, Texas, USA",
/title/tt0212346/,Miss Congeniality,"Driskill Hotel - 604 Brazos, Austin, Texas, USA",
/title/tt1440129/,Battleship,"O'ahu, Hawaii, USA",
/title/tt1440129/,Battleship,"Raleigh Studios Baton Rouge, Celtic Media Centre, Baton Rouge, Louisiana, USA",
/title/tt1440129/,Battleship,"Auckland, New Zealand",
/title/tt1440129/,Battleship,"San Diego, California, USA",
/title/tt1440129/,Battleship,USA,
/title/tt1731141/,Ender's Game,"Duffey Lake, British Columbia, Canada",(Lake scenery)                        
/title/tt1731141/,Ender's Game,"New Orleans, Louisiana, USA",
/title/tt0187078/,Gone in Sixty Seconds,"Long Beach Naval Shipyard - Ocean Boulevard & Navy Way, Long Beach, California, USA",(chase scenes)                        
/title/tt0187078/,Gone in Sixty Seconds,"Hamilton, Ontario, Canada",(Chase scenes on multilane main street and alleys)                        
/title/tt0187078/,Gone in Sixty Seconds,"Lone Pine, California, USA",
/title/tt0187078/,Gone in Sixty Seconds,"Beverly Hills, California, USA",
/title/tt0187078/,Gone in Sixty Seconds,"Hollywood, Los Angeles, California, USA",
/title/tt0187078/,Gone in Sixty Seconds,"Quality Coffee Shop - 1238 West 7th Street, Los Angeles, California, USA",
/title/tt0187078/,Gone in Sixty Seconds,"San Pedro, Los Angeles, California, USA",
/title/tt0187078/,Gone in Sixty Seconds,"Yamashiro Restaurant - 1999 N. Sycamore Avenue, Hollywood, Los Angeles, California, USA",
/title/tt0187078/,Gone in Sixty Seconds,"Independence, California, USA",
/title/tt0472033/,9,"Starz Animation, Toronto, Ontario, Canada",(studio)                        
/title/tt0472033/,9,"Duncan Studio, Los Angeles, California, USA",(studio)                        
/title/tt6964748/,Alex Rider,"Sinaia, Romania",
/title/tt6964748/,Alex Rider,"42 Reverdy Road, London, England, UK",(Alex Rider's House)                        
/title/tt6141246/,The Aeronauts,"Greenwich Naval College, London, England, UK",(exterior scenes)                        
/title/tt6141246/,The Aeronauts,"West London Film Studios, London, England, UK",(studio)                        
/title/tt6141246/,The Aeronauts,"Oxford, UK",(The Bodleian Library)                        
/title/tt6141246/,The Aeronauts,"Hatfield House, Hertfordshire, England, UK",(banquet)                        
/title/tt6141246/,The Aeronauts,"London, England, UK",
/title/tt6141246/,The Aeronauts,"England, UK",
/title/tt0089881/,Ran,"Aso, Kumamoto, Japan",
/title/tt0089881/,Ran,"Kumamoto Castle, Kumamoto, Japan",
/title/tt0089881/,Ran,"Kokonoe, Oita, Japan",
/title/tt0089881/,Ran,"Nagoya Castle, Nagoya, Aichi, Japan",
/title/tt0089881/,Ran,"Toho Studios, Tokyo, Japan",(studio)                        
/title/tt1055369/,Transformers: Revenge of the Fallen,"Luxor, Egypt",
/title/tt1055369/,Transformers: Revenge of the Fallen,"Bethlehem, Pennsylvania, USA",
/title/tt1055369/,Transformers: Revenge of the Fallen,"Wadi Rum, Jordan",
/title/tt1055369/,Transformers: Revenge of the Fallen,"Davis-Monthan Air Force Base, Tucson, Arizona, USA",(airplane boneyard)                        
/title/tt1055369/,Transformers: Revenge of the Fallen,"Steven F. Udvar-Hazy Center - 14390 Air and Space Museum Parkway, Chantilly, Virginia, USA",
/title/tt1055369/,Transformers: Revenge of the Fallen,"Eastern State Penitentiary - 2124 Fairmont Avenue, Philadelphia, Pennsylvania, USA",
/title/tt1055369/,Transformers: Revenge of the Fallen,"Philadelphia, Pennsylvania, USA",
/title/tt1055369/,Transformers: Revenge of the Fallen,"Tucson International Airport, Tucson, Arizona, USA",
/title/tt1055369/,Transformers: Revenge of the Fallen,"Lone Pine, California, USA",
/title/tt1055369/,Transformers: Revenge of the Fallen,"Palmdale, California, USA",
/title/tt1055369/,Transformers: Revenge of the Fallen,"Edwards Air Force Base, California, USA",
/title/tt1055369/,Transformers: Revenge of the Fallen,"Queensway Bridge, Long Beach, California, USA",
/title/tt1055369/,Transformers: Revenge of the Fallen,"City Hall - Broad and 15th Streets, Philadelphia, Pennsylvania, USA",
/title/tt1055369/,Transformers: Revenge of the Fallen,"Paris, France",
/title/tt1055369/,Transformers: Revenge of the Fallen,"Richmond Generating Station - 3901 N. Delaware Avenue, Philadelphia, Pennsylvania, USA",
/title/tt1055369/,Transformers: Revenge of the Fallen,"Playa Vista Studios, Playa del Rey, Los Angeles, California, USA",(studio)                        
/title/tt0057076/,From Russia with Love,"Yerebatan Saray Sarniçi, Sultanahmet Square, Sultanahmet, Istanbul, Turkey",(Basilica Cistern - James Bond and Kerim Bey escape with the Lektor decoding machine)                        
/title/tt0057076/,From Russia with Love,"Crinan, Argyll and Bute, Scotland, UK",(finale helicopter and boat chase scenes)                        
/title/tt0057076/,From Russia with Love,"Bay of Pendik, Turkey",(finale boat chase scenes)                        
/title/tt0057076/,From Russia with Love,"Lunga, Argyll and Bute, Scotland, UK",(pier for finale boat chase scenes)                        
/title/tt0057076/,From Russia with Love,"Blue Mosque, Istanbul, Turkey",
/title/tt0057076/,From Russia with Love,"Topkapi Palace, Istanbul, Turkey",
/title/tt0057076/,From Russia with Love,"Hurley, Berkshire, England, UK",(James Bond and Sylvia Trench have picnic by the river)                        
/title/tt0057076/,From Russia with Love,"Pinewood Studios, Iver Heath, Buckinghamshire, England, UK",(studio)                        
/title/tt0057076/,From Russia with Love,"Istanbul Sirkeci Terminal, Hoca Pasa, Eminönü, Fatih, Istanbul, Turkey","(Orient Express - Istanbul, Zagreb and Belgrade railway stations)                        "
/title/tt0057076/,From Russia with Love,"Galata Bridge, Istanbul, Turkey",
/title/tt0057076/,From Russia with Love,"Spice Market, Istanbul, Turkey",(Market)                        
/title/tt0057076/,From Russia with Love,"Bridge Of Sighs, Venice, Veneto, Italy",(ending)                        
/title/tt0057076/,From Russia with Love,"Madrid, Spain",(inserts/pick-up shots of rats)                        
/title/tt0057076/,From Russia with Love,"Venice, Veneto, Italy",(ending)                        
/title/tt0057076/,From Russia with Love,UK,
/title/tt0057076/,From Russia with Love,"Bosphorus Strait, Turkey",
/title/tt0057076/,From Russia with Love,"Golden Horn, Istanbul, Turkey",
/title/tt0057076/,From Russia with Love,"Misir Çarsisi, Eminönü, Fatih, Istanbul, Turkey",
/title/tt0057076/,From Russia with Love,"Pendik, Turkey",(village sequence)                        
/title/tt0057076/,From Russia with Love,"Sultanahmet, Istanbul, Turkey",
/title/tt0057076/,From Russia with Love,"Bosphorus Strait, Turkey",(James Bond cross-examines Tatiana Romanova about the Lektor Decoding Device)                        
/title/tt0057076/,From Russia with Love,Italy,
/title/tt1205537/,Jack Ryan: Shadow Recruit,"Liverpool, Merseyside, England, UK","(The night time car chase through the streets of 'Moscow' was filmed in Liverpool city centre. The 'Manhattan' tunnel to which Ryan tracks the real terrorist plot is the entrance to the Queensway Tunnel. The Theatre is Liverpool Town Hall, and the final foot chase is around the Royal Liver Building in Water Street.)                        "
/title/tt1205537/,Jack Ryan: Shadow Recruit,"Moscow, Russia",
/title/tt1205537/,Jack Ryan: Shadow Recruit,"Hatfield, Hertfordshire, England, UK","(Lamentations operation is activated at the St John, Hertfordshire.)                        "
/title/tt1205537/,Jack Ryan: Shadow Recruit,"Wall Street, Manhattan, New York City, New York, USA",
/title/tt1205537/,Jack Ryan: Shadow Recruit,"New Southgate, London, England, UK","(CIA medical recuperation clinic, named the Walter Reed Army Medical Centre)                        "
/title/tt1205537/,Jack Ryan: Shadow Recruit,"London, England, UK","(Bench in New Square, Cherevin's 'Moscow' headquarters, Walter Reed Military Medical Centre, restaurant, Hotel Grushinski)                        "
/title/tt0106126/,Seaquest DSV,"University Of Central Florida - 4000 Central Florida Boulevard, Orlando, Florida, USA",
/title/tt0106126/,Seaquest DSV,"Florida Southern College - 111 Lake Hollingsworth Drive, Lakeland, Florida, USA",
/title/tt0106126/,Seaquest DSV,"Stage 28, Universal Studios - 100 Universal City Plaza, Universal City, California, USA",
/title/tt0106126/,Seaquest DSV,"Team Disney Building, Walt Disney World, Lake Buena Vista, Florida, USA",(interiors)                        
/title/tt0106126/,Seaquest DSV,"Winter Park, Florida, USA",
/title/tt0103855/,The Bodyguard,"Beverly House - 1011 N. Beverly Drive, Beverly Hills, California, USA",(Rachel's estate - exteriors)                        
/title/tt0103855/,The Bodyguard,"Newark, New Jersey, USA",
/title/tt0103855/,The Bodyguard,"Little Tokyo, Los Angeles, California, USA",
/title/tt0103855/,The Bodyguard,"Los Angeles City Hall - 200 North Spring Street, Downtown, Los Angeles, California, USA",
/title/tt0103855/,The Bodyguard,"Downtown, Los Angeles, California, USA",
/title/tt0103855/,The Bodyguard,"Hollywood Palladium - 6215 Sunset Blvd., Hollywood, Los Angeles, California, USA",(backdrop)                        
/title/tt0103855/,The Bodyguard,"Lake Tahoe, California, USA",(Retreat)                        
/title/tt0103855/,The Bodyguard,"Los Angeles, California, USA",
/title/tt0103855/,The Bodyguard,"Park Plaza Hotel - 607 S. Park View Street, Los Angeles, California, USA",(Oscars Academy Awards Ceremony - arrivals and exteriors)                        
