Code,Show Name,Location,Scene
/title/tt0099674/,"Chiesa di Sant'Orsola, Erice, Sicily, Italy",(entrance to convent where Corleone meets Cardinal Lamberto)
/title/tt0099674/,"Cinecittà Studios, Cinecittà, Rome, Lazio, Italy",(studio)
/title/tt0099674/,"Ponte Sant'Angelo, Rome, Lazio, Italy",(Keinszig hung under bridge)
/title/tt0099674/,"Palazzo Farnese, Caprarola, Viterbo, Lazio, Italy","(as Vatican Palace interiors, and white smoke chimney)"
/title/tt0099674/,"Castello Degli Schiavi, Fiumefreddo di Sicilia, Catania, Sicily, Italy","(Don Tommasino's villa, where Corleone finds shelter)"
/title/tt0099674/,"956 5th. Avenue, Manhattan, New York City, New York, USA","(Michael's Manhattan Home, addressed as 957 in the film.)"
/title/tt0099674/,"Waldorf-Astoria Hotel - 301 Park Avenue, Manhattan, New York City, New York, USA",
/title/tt0099674/,"Trump Castle Casino Resort - Huron & Brigantine Boulevard, Atlantic City, New Jersey, USA",
/title/tt0099674/,"St Patrick's Cathedral, Fifth Avenue, Manhattan, New York City, New York, USA",(church exterior)
/title/tt0099674/,"Palermo, Sicily, Italy",
/title/tt0099674/,Vatican City,
/title/tt0099674/,"Park Avenue, Manhattan, New York City, New York, USA",
/title/tt0099674/,"Rome, Lazio, Italy",
/title/tt4844140/,"Winton, Victoria, Australia",
/title/tt7431994/,"Istanbul, Turkey",
/title/tt7431994/,"Kreuzberg, Berlin, Germany",(season 3)
/title/tt0463985/,"Takeshita-don, Harajuku, Tokyo, Japan",
/title/tt0463985/,"Tokyo, Japan",
/title/tt0463985/,"Kabukicho, Shinjuku, Tokyo, Japan",
/title/tt0463985/,"Stage 29, Universal Studios - 100 Universal City Plaza, Universal City, California, USA",
/title/tt0463985/,"Los Angeles, California, USA",
/title/tt1399664/,"Mallorca, Balearic Islands, Spain",
/title/tt1399664/,Egypt,
/title/tt1399664/,"Ca's Patro March, Cala Deia, Majorca, Balearic Islands, Spain",(Seaside restaurant near Roper's villa) (Richard Roper's son Danny gets kidnapped)
/title/tt1399664/,"Riffelalp Resort, Zermatt, Kanton Wallis, Switzerland","(Meisters Hotel, Zermatt. Switzerland)"
/title/tt1399664/,"Es Saadi Hotel, Marrakech, Morocco","(Hotel Nefertiti, Cairo, Egypt)"
/title/tt1399664/,"London, England, UK",(studio)
/title/tt1399664/,"Istanbul, Turkey",(establishment shots)
/title/tt1399664/,"Cala Deià, Mallorca, Balearic Islands, Spain",
/title/tt1399664/,Spain,
/title/tt1399664/,"Balearic Islands, Spain",
/title/tt1399664/,"Iglesia de Santa Eulalia, Palma, Mallorca, Balearic Islands, Spain",
/title/tt1399664/,"Agafay Desert, Morocco",(desert)
/title/tt1399664/,"Palma de Mallorca, Mallorca, Balearic Islands, Spain",
/title/tt1399664/,"Hivemage, Marrakech, Morocco",(Egypt)
/title/tt1399664/,"Majorca, Balearic Islands, Spain",
/title/tt1399664/,"England, UK",
/title/tt1399664/,"Matterhorn, Kanton Wallis, Switzerland",(Snowy mountains)
/title/tt1399664/,"Belmond La Residencia, Cala Deià, Mallorca, Balearic Islands, Spain",
/title/tt0114681/,"Black River, Georgina, Ontario, Canada",(final skating scene)
/title/tt0114681/,"West Montrose, Ontario, Canada",(covered bridge)
/title/tt0114681/,"King City, Ontario, Canada",(High School)
/title/tt0114681/,"Ontario, Canada",
/title/tt0114681/,"Toronto, Ontario, Canada",
/title/tt0114681/,"Florida, USA",
/title/tt0114681/,USA,
/title/tt0114681/,"Cinespace Film Studios - 11030 Highway 27, Kleinburg, Ontario, Canada",(studio)
/title/tt0119008/,"Katz's Delicatessen - 205 East Houston Street, East Village, Manhattan, New York City, New York, USA",
/title/tt0119008/,"Rapids Water Park, 6566 N Military Trail Riviera Beach, Florid, USA",(Scenes at the water park)
/title/tt0119008/,"Florida, USA",
/title/tt0119008/,"59th Street Bridge, Manhattan, New York City, New York, USA",
/title/tt0119008/,"Main Ave & Madison Ave, Clifton, New Jersey, USA",(Joe and Maggie walk to car parked on east side of intersection after counseling session)
/title/tt0119008/,"East Village, Manhattan, New York City, New York, USA",
/title/tt0119008/,"Little Italy, Manhattan, New York City, New York, USA",
/title/tt0119008/,"Mare Chiaro bar ""Toni's nut house"", 179 Mulberry street, Little Italy, Manhattan, New York City, New York, USA",
/title/tt0119008/,"Mulberry Street, Little Italy, Manhattan, New York City, New York, USA",
/title/tt0119008/,"Staten Island, New York City, New York, USA",
/title/tt0217505/,"Silvercup Studios - 4222 22nd Street, Long Island City, Queens, New York City, New York, USA",(studio)
/title/tt0458253/,"Westridge School For Girls - 324 Madeline Drive, Pasadena, California, USA",
/title/tt1723121/,"New Mexico, USA",
/title/tt1723121/,"Santa Fe, New Mexico, USA",
/title/tt1723121/,"420 Market Street, Wilmington, North Carolina, USA",
/title/tt1723121/,"Santa Fe Studios, Santa Fe, New Mexico, USA",
/title/tt8682948/,"Georgia, USA",
/title/tt5431890/,"Leeds, West Yorkshire, England, UK",(Italian Cafe)
/title/tt5431890/,"County Sessions House, Liverpool, Merseyside, England, UK",(interiors)
/title/tt5431890/,"Shipley, Bradford, West Yorkshire, England, UK",
/title/tt5431890/,"Leeds, West Yorkshire, England, UK",(Police Station)
/title/tt5431890/,"City Hall Bradford, Norfolk Gardens, Bradford",(location)
/title/tt5431890/,"Bradford, West Yorkshire, England, UK",
/title/tt8722346/,"New Orleans, Louisiana, USA",
/title/tt8722346/,"7601 S San Pedro St Los Angeles, California, USA",(Spirit of Love Baptist Church)
/title/tt1137450/,"Lachine, Québec, Canada",
/title/tt1137450/,"Des Récollets street, Montréal, Québec, Canada",(Pearlstein Residence Hall)
/title/tt1137450/,"Québec, Canada",
/title/tt1137450/,"Président Kennedy Avenue, Montréal, Québec, Canada",
/title/tt3416536/,"Massachusetts, USA",
/title/tt5563334/,"Berlin, Germany",
/title/tt5563334/,"The Railway, Victoria Road, Teddington, England, UK",(Roy and Betty meet for dinner - externals)
/title/tt5563334/,"Charing Cross Underground Station, Charing Cross, London, England, UK",(Roy is followed by Bryn)
/title/tt5563334/,"East Side Gallery, Friedrichshain, Berlin, Germany","(Roy, Betty and Steven visit the outdoor gallery)"
/title/tt5563334/,"London, England, UK",
/title/tt0160127/,"San Pedro, Los Angeles, California, USA","(Vincent Thomas Bridge, exteriors)"
/title/tt0160127/,"Auto Club Speedway, 9300 Cherry Avenue, Fontana, California, USA",
/title/tt0160127/,"11446 Awenita Court, Chatsworth, Los Angeles, California, USA",
/title/tt0160127/,"Falls Lake, Backlot, Universal Studios - 100 Universal City Plaza, Universal City, California, USA",
/title/tt0160127/,"Los Angeles Theatre - 615 S. Broadway, Downtown, Los Angeles, California, USA",
/title/tt5362988/,"Park City Studios, Utah, USA",
/title/tt5362988/,"Fremont County, Wyoming, USA",(County the above locations are in.)
/title/tt5362988/,"Coalville, Utah, USA",(Summit Co. courthouse as 'Fremont Co. Sheriff's Office')
/title/tt5362988/,"Utah Film Studios, Park City, Utah, USA",(studio)
/title/tt2704998/,"Atlanta, Georgia, USA","(On the ""4th street bridge"")"
/title/tt0117381/,"Keystone, West Virginia, USA",
/title/tt0117381/,"Ballroom, Park Plaza Hotel - 607 S. Park View Street, Los Angeles, California, USA",
/title/tt1219827/,"Hong Kong, China",
/title/tt1219827/,"Stone Street Studios, Stone Street, Miramar, Wellington, New Zealand",
/title/tt1219827/,"Victoria Street, Wellington, New Zealand",
/title/tt1219827/,China,
/title/tt1219827/,"New York City, New York, USA",
/title/tt0473705/,"Americana Hotel - 1400 Jefferson Davis Highway, Arlington, Virginia, USA",
/title/tt0473705/,"Westin Bonaventure Hotel & Suites - 404 S. Figueroa Street, Downtown, Los Angeles, California, USA",
/title/tt0473705/,"Mayfield Senior School - 500 Bellefontaine Street, Pasadena, California, USA",
/title/tt0473705/,"St. Mary's Hospital - 1050 Linden Avenue, Long Beach, California, USA",(hospital)
/title/tt0473705/,"Andrew W. Mellon Auditorium - 1301 Constitution Avenue NW, Washington, District of Columbia, USA",
/title/tt0473705/,"Ben's Chili Bowl - 1213 U Street NW, Washington, District of Columbia, USA",
/title/tt0473705/,"Georgetown, Washington, District of Columbia, USA",
/title/tt0473705/,"Key Bridge, Georgetown, Washington, District of Columbia, USA",
/title/tt0473705/,"Mount Pleasant, Washington, District of Columbia, USA",
/title/tt0473705/,"Scottish Rite Temple, Washington, District of Columbia, USA",
/title/tt0473705/,"U.S. Department of the Interior - 1849 C Street NW, Washington, District of Columbia, USA",
/title/tt0473705/,"Washington, District of Columbia, USA",
/title/tt1103987/,"Chicago, Illinois, USA",(pilot)
/title/tt0368479/,"Los Angeles Center Studios - 450 S. Bixel Street, Downtown, Los Angeles, California, USA",(Philadelphia Police Department headquarters building)
/title/tt0368479/,"Dorris Place Elementary School - 2225 Dorris Place, Los Angeles, California, USA",
/title/tt1343727/,"Cape Town, Western Cape, South Africa",
/title/tt1343727/,"Oriental City Shopping Centre, Colindale, London, England, UK",(opening scenes)
/title/tt1343727/,"Colindale, London, England, UK",
/title/tt0080240/,"Makai Pier, Makapuu Point, Waimanalo, O'ahu, Hawaii, USA",(TC's island hoppers helicopter office and pad)
/title/tt0080240/,"Marks Estate - 3860 Old Pali Rd, Honolulu, O'ahu, Hawaii, USA",(some outdoor scenes of the King Kamehameha club)
/title/tt0080240/,"Honolulu, O'ahu, Hawaii, USA",
/title/tt0080240/,"Hawaii, USA",
/title/tt0080240/,USA,
/title/tt0375679/,"3500 S. Gaffey Street, San Pedro, Los Angeles, California, USA",(overturned car accident)
/title/tt0375679/,"5100 Costello Avenue, Sherman Oaks, Los Angeles, California, USA",(standoff scene in cul de sac)
/title/tt0375679/,"Carney's Restaurant - 12601 Ventura Boulevard, Studio City, Los Angeles, California, USA",(train themed restaurant)
/title/tt0375679/,"Wilmington, Los Angeles, California, USA",
/title/tt0375679/,"San Fernando Valley, Los Angeles, California, USA",
/title/tt0375679/,"Studio City, Los Angeles, California, USA",
/title/tt0375679/,"Westwood Village, Westwood, Los Angeles, California, USA",
/title/tt0375679/,"Chinatown, Los Angeles, California, USA",
/title/tt3110958/,"Teddington Lock, Teddington, Middlesex, England, UK",
/title/tt3110958/,"The Farmiloe Building, 34 St John Street, London, England, UK",(Macau Interior Market Fight Scene/Magic Shop)
/title/tt0108967/,"Bradford, West Yorkshire, England, UK",
/title/tt0108967/,"Westgate Station, Wakefield, West Yorkshire, England, UK",(Denton railway station)
/title/tt0108967/,"Wakefield, West Yorkshire, England, UK",
/title/tt0108967/,"Halifax, West Yorkshire, England, UK",
/title/tt0090481/,"Screen Gems Studios - 1223 North 23rd Street, Wilmington, North Carolina, USA",(studio) (seasons 7 to 9)
/title/tt0090481/,"North Carolina, USA",
/title/tt0090481/,"Universal City, California, USA",
/title/tt0090481/,USA,
/title/tt1321870/,"Santa Clarita, California, USA",
/title/tt1321870/,"Union Station - 800 N. Alameda Street, Downtown, Los Angeles, California, USA",
/title/tt1321870/,"Los Angeles City Hall - 200 North Spring Street, Downtown, Los Angeles, California, USA",
/title/tt1321870/,"1803 Courtney Ave, Los Angeles, California, USA",(as Garden of Allah Apartments)
/title/tt1321870/,"Boardner's by La Belle - 1652 N Cherokee Ave, Los Angeles, California, USA",(exterior: as Cabana Club)
/title/tt1321870/,"1146 Tower Rd, Beverly Hills, California, USA",(Cohen's mansion)
/title/tt1321870/,"S Santa Fe Ave & E 4th Pl, Los Angeles, California, USA",(Gangster Squad set car on fire)
/title/tt1321870/,"MacArthur Park, Los Angeles, California, USA",(O'Mara arrests Cohen)
/title/tt1321870/,"Griffith Observatory, 2800 E Observatory Rd, Los Angeles, California, USA",(Picnic exterior scene)
/title/tt0327056/,"Border Street, East Boston, Boston, Massachusetts, USA",
/title/tt0327056/,"Miller's Market - 336 K Street, South Boston, Boston, Massachusetts, USA",
/title/tt0327056/,"Condor Street, East Boston, Boston, Massachusetts, USA",(abduction scene)
/title/tt0327056/,"Tobin Bridge, Boston, Massachusetts, USA",(angry motorist at road rage accident)
/title/tt0327056/,"Chelsea, Massachusetts, USA",
/title/tt0327056/,"Canton, Massachusetts, USA",
/title/tt0327056/,"Dorchester, Boston, Massachusetts, USA",
/title/tt0327056/,"Mattapan, Boston, Massachusetts, USA",
/title/tt0327056/,"Massachusetts, USA",
/title/tt3631112/,"Dobbs Ferry, New York, USA",(street scenes)
/title/tt3631112/,"18 Macy Avenue, White Plains, New York, USA",(Megan and Scott's house)
/title/tt3631112/,"Old Croton Aqueduct Tunnel - Station Road, Irvington, New York, USA",(Tunnel)
/title/tt3631112/,"Bear Mountain, New York, USA",(Closing scene of the movie)
/title/tt3631112/,"533 Warburton Ave, Hastings-on-Hudson, New York, USA",(Bar where Rachel plays pool)
/title/tt3631112/,"Greenwood Cemetery, Brooklyn, New York City, New York, USA",(Megan's Gravestone at Battle Hill)
/title/tt3631112/,"Alder Manor, Yonkers, New York, USA",(Dr. Kamal Abdic's office)
/title/tt3631112/,"92 Main Street, Dobbs Ferry, New York, USA",(Bar)
/title/tt0290988/,"Lower Sackville, Nova Scotia, Canada",
/title/tt0290988/,"Dartmouth, Nova Scotia, Canada",
/title/tt0290988/,"Cole Harbour, Nova Scotia, Canada",
/title/tt5052474/,"31 Av. 5 de Mayo, Mexico City",(Alejandro's Appartment Bogota Colombia)
/title/tt5052474/,"Avenida Santa Fe 485, Cuajimalpa, Mexico City, Mexico","(Alejandro says ""Adiós"")"
/title/tt5052474/,"Cottonwood Mall, 10000 Coors Blvd Bypass NW, Albuquerque, New Mexico, USA",(Food Court Scenes and Mall Exterior Scenes)
/title/tt5052474/,"900 Walter St SE Albuquerque, New Mexico, USA",(Miguel's sibling are picked up by the McAllen Middle School Bus)
/title/tt5052474/,"71 República de Perú, Mexico City, Mexico",(Isabel Reyes Kidnapping)
/title/tt0480255/,"Arecibo, Puerto Rico",(Radio Telescope)
/title/tt0480255/,"Hato Rey, San Juan, Puerto Rico",
/title/tt0480255/,"Brickell Key, Florida, USA",
/title/tt0480255/,"Rio Grande, Puerto Rico",(Rio Grande Plantation)
/title/tt0480255/,"South Beach, Miami Beach, Florida, USA",
/title/tt3322310/,"General Electric Building, 570 Lexington Avenue, New York City, New York, USA",(Location of lobby of Harold Meachum's penthouse)
/title/tt3322310/,USA,
/title/tt0454848/,"The Four Seasons - 99 East 52nd Street, Manhattan, New York City, New York, USA",
/title/tt0454848/,"Brooklyn Bridge, New York City, New York, USA",
/title/tt0454848/,"Esplanade, Battery Park City, Manhattan, New York City, New York, USA",(Madeleine White meeting with Arthur Case)
/title/tt0454848/,"150 Nassau St, Manhattan, New York City, New York, USA",(White's office)
/title/tt1212450/,"Coweta County, Georgia, USA",
/title/tt1212450/,"Georgia, USA",
/title/tt1212450/,USA,
/title/tt0119488/,"The Lovell Health House - 4616 Dundee Drive, Los Feliz, Los Angeles, California, USA",(Pierce Patchett's house)
/title/tt0119488/,"1279 S Cochran Ave, Los Angeles, California, USA",(Nick's Liquor Store)
/title/tt0119488/,"Baldwin Hills, Los Angeles, California, USA",(Victory Motel set)
/title/tt0119488/,"J & J Sandwich Shoppe - 119 E 6th Street, Los Angeles, California, USA",(Nite Owl Coffee Shop)
/title/tt0119488/,"Lincoln Heights, Los Angeles, California, USA",
/title/tt0119488/,"Church of the Blessed Sacrament - 6657 W. Sunset Blvd., Hollywood, Los Angeles, California, USA",
/title/tt0119488/,"Echo Park, Los Angeles, California, USA",(Leonard Bidwell's house at 1255 Bellevue Ave)
/title/tt0119488/,"Hollywood Center Motel - 6720 W. Sunset Blvd., Hollywood, Los Angeles, California, USA",(motel where Matt Reynolds is found dead)
/title/tt0119488/,"Los Angeles, California, USA",
/title/tt0119488/,"Pantages Theater - 6233 Hollywood Blvd., Hollywood, Los Angeles, California, USA",
/title/tt0119488/,"Montecito Street, Lincoln Heights, Los Angeles, California, USA",(house where prostitute is held captive at Montecito & Ave 28)
/title/tt0119488/,"1704 Morton Avenue, Los Angeles, California, USA",(Mrs. Leffert's house)
/title/tt0119488/,"Former Venice Police Station Division 14, 685 Venice Blvd, Los Angeles, California, USA",(Front desk and stairs of police station on Christmas Eve)
/title/tt0119488/,"California, USA",
/title/tt0119488/,"496 East Avenue 28, Los Angeles, California, USA",(house where the woman is being held captive)
/title/tt0119488/,"1255 Bellevue Avenue, Los Angeles, California, USA",(home of Leonard Bidwell)
/title/tt0119488/,"4216 Rose Avenue, Long Beach, California, USA",(Bud White pulls the Santa Claus off the roof)
/title/tt0119488/,"5620 Hollywood Boulevard, Los Angeles, California, USA",(El Cortez Theatre)
/title/tt0119488/,"Boardner's by La Belle, 1652 North Cherokee Avenue, Los Angeles, California, USA",(Smith gives White his badge back)
/title/tt0119488/,"Hollywood Center Motel, 6720 W. Sunset Boulevard, Hollywood, Los Angeles, California, USA",(discovery of Reynold's body)
/title/tt9704798/,"Normans bay, East Sussex, England, UK",(location)
/title/tt9704798/,"Kent, England, UK",(location)
/title/tt0139654/,"Imperial Courts Housing Project - 11541 Croesus Avenue, Watts, Los Angeles, California, USA",
/title/tt0139654/,"Quality Coffee Shop - 1238 West 7th Street, Los Angeles, California, USA",
/title/tt0139654/,"West Temple Street & Glendale Boulevard - Los Angeles, California, USA",(Alonzo forces Jake to smoke crack)
/title/tt0139654/,"8th Street between South Alvarado Street & South Westlake Avenues - Los Angeles, California, USA",(Jake stops rape of a teenage girl)
/title/tt0139654/,"Echo Park, Los Angeles, California, USA",
/title/tt0139654/,"145 North Toluca Street - Los Angeles, California, USA",(staking out drug deal)
/title/tt0139654/,"Hawthorne, California, USA",
/title/tt0139654/,"Grand Ave & Venice Blvd., Los Angeles, California, USA",(roof of parking lot)
/title/tt0139654/,"Interstate 110, Los Angeles, California, USA",
/title/tt0139654/,"South Central Los Angeles, Los Angeles, California, USA",
/title/tt0139654/,"California, USA",
/title/tt0139654/,"Baldwin Hills, Los Angeles, California, USA",
/title/tt0139654/,"Mona Boulevard, Watts, Los Angeles, California, USA",
/title/tt0120735/,"Stables Market, Chalk Farm Road, Camden, NW1, London, England, UK",(where Winston runs his sadly low-security dope business)
/title/tt0120735/,"Dorney Court, Dorney, Buckinghamshire, England, UK",(the incompetent robbery at the country house)
/title/tt0120735/,"Pedley Street, Shoreditch, London E1, England, UK",(Eddie and Bacon escape from the law)
/title/tt0120735/,"Bethnal Green, London, England, UK",
/title/tt0120735/,"Hackney, London, England, UK",
/title/tt0120735/,"42-44 Cheshire Street, on the corner of Grimsby Street, London, England, UK",('Hatchet' Harry's office)
/title/tt0120735/,"Repton Boys Club, Bethnal Green, London, England, UK",(Boxing scene)
/title/tt0120735/,"Three Mills Studios, Three Mill Lane, Bow, London, England, UK",(studio)
/title/tt0120735/,"London, England, UK",
/title/tt5688068/,"Harlan, Kentucky, USA",
/title/tt5688068/,"Paris, Kentucky, USA",
/title/tt1791528/,"West 2nd Street, Pomona, California, USA",(Doc Sportello and Shasta under the rain in flashback scene)
/title/tt1791528/,"Parker Center - 150 North Los Angeles Street, Downtown, Los Angeles, California, USA",(LAPD exteriors)
/title/tt1791528/,"Ambassador College, Pasadena, California, USA",(Golden Fang interiors)
/title/tt1791528/,"433 S Spring St, Los Angeles, California, USA",(interiors: Hall of Justice)
/title/tt1791528/,"6150 Laurel Canyon Blvd., North Hollywood, California, USA","(Macy's parking lot, site of Doc's turnover of the stolen drugs)"
/title/tt4667888/,"Sault Ste. Marie, Ontario, Canada",
/title/tt0112442/,"Tyler-Adams Hotel & Apartments - 2030 Park Avenue, Miami Beach, Florida, USA",(Lowrey's apartment)
/title/tt0112442/,"Biltmore Hotel - 1200 Anastasia Avenue, Coral Gables, Florida, USA",(Party and killing)
/title/tt0112442/,"Florida, USA",
/title/tt0112442/,"Anastasia Avenue, Coral Gables, Florida, USA",
/title/tt0112442/,"Miami Beach, Florida, USA",
/title/tt0112442/,"South Miami, Florida, USA",
/title/tt1488606/,"Interstate H-3, Hawaii, USA",
/title/tt1488606/,Colombia,
/title/tt1488606/,USA,
/title/tt0090022/,"Ghost Ranch, Abiquiu, New Mexico, USA",
/title/tt0090022/,"Cook Ranch, Galisteo, New Mexico, USA",
/title/tt0090022/,"Eaves Movie Ranch - 105 Rancho Alegre Road, Santa Fe, New Mexico, USA",
/title/tt0090022/,"Galisteo, New Mexico, USA",
/title/tt0090022/,"Tent Rocks, Cochiti Pueblo, New Mexico, USA",
/title/tt0090022/,"Bonanza Creek Ranch - 15 Bonanza Creek Lane, Santa Fe, New Mexico, USA",
/title/tt6533240/,"Manitoba, Canada",
/title/tt0106079/,"Brownstone Street, Backlot, Universal Studios - 100 Universal City Plaza, Universal City, California, USA",
/title/tt0106079/,"Los Angeles, California, USA",
/title/tt0106079/,"New York City, New York, USA",
/title/tt8110232/,"Bendix Diner, Hasbrouck Heights, New Jersey, USA",
/title/tt8110232/,"Holsten's Brookdale Confectionary, Bloomfield, New Jersey, USA",
/title/tt8652642/,"British Columbia, Canada",
/title/tt0824747/,"Los Angeles City Hall - 200 North Spring Street, Downtown, Los Angeles, California, USA",(exteriors: Los Angeles City Hall)
/title/tt0824747/,"San Dimas, California, USA",
/title/tt0824747/,"Daniel Webster Elementary School - 2101 E. Washington Boulevard, Pasadena, California, USA",(Walter's school)
/title/tt0824747/,"Los Angeles, California, USA",
/title/tt0824747/,"Park Plaza Hotel - 607 S. Park View Street, Los Angeles, California, USA",(interiors: Los Angeles City Hall)
/title/tt0824747/,"Long Beach, California, USA",
/title/tt0330793/,"Federal Courthouse, 600 N. Florida Ave., Tampa, Florida, USA",(exterior scene - Mickey exiting building)
/title/tt0330793/,"700 N. Nebraska Ave., Tampa, Florida, USA",(Punisher's headquarters - now parking lot)
/title/tt0330793/,"Falk Theater, 428 W. Kennedy Blvd., Tampa, Florida, USA",(theater exteriors with Saint's wife)
/title/tt0330793/,"Tampa, Florida, USA",
/title/tt0330793/,"Sunshine Skyway Bridge, U.S. 19/I-275, St. Petersburg, Florida, USA",(Punisher on bridge - final shot of movie)
/title/tt0330793/,"Pinellas County, Florida, USA",
/title/tt0330793/,"2001 Odyssey Club, 2309 N. Dale Mabry Ave., Tampa, Florida, USA",(brief view of exterior)
/title/tt0330793/,USA,
/title/tt0765429/,"Old Westbury Gardens - 71 Old Westbury Road, Old Westbury, Long Island, New York, USA",
/title/tt0765429/,"New York, USA",
/title/tt0765429/,Thailand,
/title/tt0765429/,"Briarcliff Manor, New York, USA",
/title/tt0765429/,"Harlem, Manhattan, New York City, New York, USA",
/title/tt0765429/,"Williamsburg, Brooklyn, New York City, New York, USA",
/title/tt0765429/,"Bronx, New York City, New York, USA",(motel scenes)
/title/tt0765429/,"NJ Army National Guard Armory, Morristown, New Jersey, USA",(morgue scenes)
/title/tt0765429/,"Washington Heights, Manhattan, New York City, New York, USA",
/title/tt0765429/,"George Washington Bridge, Manhattan, New York City, New York, USA",
/title/tt4443658/,"Sydney, New South Wales, Australia",
/title/tt0103776/,"Burbank, California, USA",
/title/tt0103776/,"Brownstone Street, Warner Brothers Burbank Studios - 4000 Warner Boulevard, Burbank, California, USA",
/title/tt0103776/,"Stage 11, Warner Brothers Burbank Studios - 4000 Warner Boulevard, Burbank, California, USA",
/title/tt0103776/,"Stage 15, Warner Brothers Burbank Studios - 4000 Warner Boulevard, Burbank, California, USA",
/title/tt0103776/,"Stage 18, Warner Brothers Burbank Studios - 4000 Warner Boulevard, Burbank, California, USA",
/title/tt0103776/,"Stage 21, Warner Brothers Burbank Studios - 4000 Warner Boulevard, Burbank, California, USA",
/title/tt0103776/,"Stage 25, Warner Brothers Burbank Studios - 4000 Warner Boulevard, Burbank, California, USA",
/title/tt4607112/,"Calgary, Alberta, Canada",(location)
/title/tt4607112/,"Dorothy, Alberta, Canada",(location)
/title/tt4607112/,"New Brighton, Wallasey, Merseyside, England, UK",(Series 3)
/title/tt0051744/,"Los Feliz, Los Angeles, California, USA",
/title/tt0181689/,"Willard InterContinental Hotel - 1401 M Street NW, Washington, District of Columbia, USA",
/title/tt0181689/,"Angelus Plaza - 255 South Hill Street, Los Angeles, California, USA",(high rise apartments)
/title/tt0181689/,"Ware Neck Marina, Ware Neck, Virginia, USA",
/title/tt0181689/,"Beaverdam Park - 8687 Roaring Springs Road, Gloucester, Virginia, USA",
/title/tt0181689/,"Hawthorne Plaza - 12124 Hawthorne Blvd., Hawthorne, California, USA",
/title/tt0181689/,"Stage 14, 20th Century Fox Studios - 10201 Pico Blvd., Century City, Los Angeles, California, USA",(studio)
/title/tt0181689/,"The Gap - 1258 Wisconsin Avenue NW, Georgetown, Washington, District of Columbia, USA",
/title/tt0181689/,"Ware Neck Yacht Club, Ware Neck, Virginia, USA",
/title/tt0181689/,"Descanso Gardens - 1418 Descanso Drive, La Cañada-Flintridge, California, USA",
/title/tt0181689/,"Universal Studios - 100 Universal City Plaza, Universal City, California, USA",(studio)
/title/tt0094226/,"Roosevelt University - 430 S. Michigan Avenue, Downtown, Chicago, Illinois, USA","(front entrance and main lobby used as Lexington Hotel, where Al Capone lives)"
/title/tt0094226/,"Blackstone Hotel - 636 S. Michigan Avenue, Downtown, Chicago, Illinois, USA",(ballroom where Capone kills guy with baseball bat)
/title/tt0094226/,"Hardin, Montana, USA",
/title/tt0094226/,"40 miles south, Great Falls, Montana, USA",
/title/tt0094226/,"Michigan Avenue Bridge, Chicago, Illinois, USA",(Ness meets Malone)
/title/tt0094226/,"Our Lady of Sorrows Basilica National Shrine - 3121 W Jackson Blvd, Chicago, Illinois, USA",(Ness meets Malone)
/title/tt0094226/,"208 S LaSalle St, Chicago, Illinois, USA",(USPS office)
