Code,Show Name,Location,Scene
/title/tt0979432/,"Woolworth Mansion, Glen Cove, Long Island, New York, USA",
/title/tt0979432/,"New York City, New York, USA",
/title/tt0979432/,"Ditmas Park, Brooklyn, New York City, New York, USA",
/title/tt0979432/,"Catalpa Avenue, Ridgewood, Queens, New York City, New York, USA",
/title/tt0979432/,"Bedford-Stuyvesant, Brooklyn, New York City, New York, USA",
/title/tt0979432/,"Vinegar Hill, Brooklyn, New York City, New York, USA",(Nucky and Margaret's home)
/title/tt0979432/,"Manhattan, New York City, New York, USA",
/title/tt0979432/,"Steiner Studios - 15 Washington Avenue, Brooklyn Navy Yard, Brooklyn, New York City, New York, USA",
/title/tt0979432/,"Nassau Street, Brooklyn, New York City, New York, USA",(Season 3)
/title/tt0979432/,"Brooklyn, New York City, New York, USA",
/title/tt0979432/,"Westchester Country Club, 99 Biltmore Lane, Rye, New York, USA",(on location)
/title/tt0979432/,"Stuyvesant Heights, Brooklyn, New York City, New York, USA",
/title/tt0112641/,"Le Bistro Lounge, Riviera Hotel & Casino - 2901 Las Vegas Boulevard South, Las Vegas, Nevada, USA",(Tangiers Casino)
/title/tt0112641/,"357 Desert Inn Road, Las Vegas, Nevada, USA",(Sam's San Diego house)
/title/tt0112641/,"Tony Roma's, Main Street Station, Las Vegas, Nevada, USA",(attempt on Sam's life)
/title/tt0112641/,"Bally's Casino Resort - 3645 Las Vegas Boulevard South, Las Vegas, Nevada, USA",(additional 'Tangiers' locations)
/title/tt0112641/,"The Peppermill Fireside Lounge, Las Vegas, Nevada, USA",(Ginger/Ace restaurant scene)
/title/tt0112641/,"Jean Dry Lake, Nevada, USA",(meeting in the desert)
/title/tt0112641/,"3010 S. Valley View Blvd, Las Vegas, Nevada, USA",(San Marino Italian Grocery)
/title/tt0112641/,"721 N. Main St #3., Las Vegas, Nevada, USA",(El Cortez Warehouse)
/title/tt0112641/,"Mojave Desert, California, USA",
/title/tt0112641/,"Park Paseo, Las Vegas, Nevada, USA",(as Vegas Valley Country Club)
/title/tt0112641/,"Regency Motel - 784 N. Main Street, Las Vegas, Nevada, USA",(Lester Diamond beating)
/title/tt0112641/,"Las Vegas, Nevada, USA",
/title/tt0112641/,"Henderson Sky Harbor Airport, Henderson, Nevada, USA",(as Kansas City Airport)
/title/tt0112641/,"Kawasaki Dealership, West Sahara, Las Vegas, Nevada, USA",(Gold Rush LTD - since been demolished)
/title/tt0112641/,"Las Vegas Boulevard South, Las Vegas, Nevada, USA",
/title/tt0112641/,"Our Lady of Las Vegas, Las Vegas, Nevada, USA",
/title/tt0112641/,"The Jockey Club, Las Vegas, Nevada, USA",(Tangiers sports book/Sam's office)
/title/tt0112641/,"Oscar's Steakhouse, Plaza Hotel, 1 Main St., Las Vegas, Nevada, USA",(Ginger & Sam argue over her spending habits during dinner)
/title/tt1551632/,"Port of Los Angeles High School, San Pedro, Los Angeles, California, USA",(Office)
/title/tt5503686/,"New York City, New York, USA",
/title/tt5503686/,"Trading Post, 170 John St, New York City, New York, USA",(location)
/title/tt0489974/,"Berlin, Germany",
/title/tt0489974/,"Prachov Rocks, Prachovské Skály, Czech Republic",
/title/tt0489974/,"Krnsko, Central Bohemian Region, Czech Republic",
/title/tt0489974/,Czech Republic,
/title/tt0489974/,Germany,
/title/tt0489974/,USA,
/title/tt2249007/,"2003 Delphine Lane, Calabasas, California, USA",(Ray Donovan's House)
/title/tt2249007/,"22035 Saddle Peak Rd, Topanga, California, USA",(Ezra Goldman's House)
/title/tt2249007/,"Malibu, California, USA",
/title/tt2249007/,"Beverly Hills, California, USA",
/title/tt2249007/,"South Pasadena, California, USA",
/title/tt2249007/,"Santa Monica, California, USA",
/title/tt5618256/,"North Main Street, Clayton, Rabun County, Georgia, USA",(Bike ride small town)
/title/tt6079516/,"Lakewood, Ohio, USA",
/title/tt6079516/,"Linwood Park, Vermillion, Ohio, USA",
/title/tt6079516/,"15409 Edgewater Dr Lakewood, Ohio, USA",(Main house)
/title/tt7945720/,"Balboa Island, Newport Beach, California, USA",
/title/tt7945720/,"Universal Studios - 100 Universal City Plaza, Universal City, California, USA",(studio)
/title/tt7587890/,"Los Angeles, California, USA",
/title/tt0066921/,"Brunel University, Uxbridge, Middlesex, England, UK",(Ludovico Medical Facility)
/title/tt0066921/,"Bricket Wood, Hertfordshire, England, UK",(Peartree Woods on the Viscount Knutsford Estate - Alex is beaten up by police)
/title/tt0066921/,"Elstree, Hertfordshire, England, UK","(Alex's flat: Municipal Flat Black 18A, Linear North)"
/title/tt0066921/,"Blenheim Mews, Shenley, Hertfordshire, England, UK",(Cat Lady)
/title/tt0066921/,"Taggs Island, Kingston-upon-Thames, London, England, UK",(Billyboy gang fight)
/title/tt0066921/,"EMI-MGM Elstree Studios, Borehamwood, Hertfordshire, England, UK",(studio)
/title/tt0066921/,"Chelsea Embankment, Chelsea, London, England, UK",
/title/tt0066921/,"Princess Alexandra Hospital, Harlow, Essex, England, UK",(hospital scene at the end of the film)
/title/tt0066921/,"Shipton Under Wychwood, Oxford, Oxfordshire, England, UK",(exterior: F. Alexander house)
/title/tt0066921/,"Ward Royal, Windsor, Berkshire, England, UK",
/title/tt0066921/,"Pinewood Studios, Iver Heath, Buckinghamshire, England, UK",(studio)
/title/tt0066921/,"Edgwarebury Hotel, Barnet Lane, Elstree, Hertfordshire, England, UK",(Alex leaps from window)
/title/tt0066921/,"Nettleford Hall, West Norwood Library, West Norwood, London, England, UK",(Alex humiliated in press conference)
/title/tt0066921/,"Woolwich Barracks Prison, Woolwich, London, England, UK",(Parkmoor Prison: interior)
/title/tt0075314/,"Ed Sullivan Theater - 1697 Broadway, Manhattan, New York City, New York, USA",(Travis' phone call to Betsy)
/title/tt0075314/,"226 East 13th Street, Manhattan, New York City, New York, USA",(Apartment block shootout)
/title/tt0075314/,"546 Columbus Ave., New York City, New York, USA","(R&M Supermarket, where Travis shoots a robber)"
/title/tt0075314/,"737 8th Avenue, New York City, New York, USA",(Travis walks southwest down 8th to the Show & Tell theater where he buys concessions for the movie)
/title/tt0075314/,"5th Ave & 19th St, New York City, New York, USA",(Travis is picked up by cab/Easy Andy on northern corner of intersection an)
/title/tt0075314/,"Manhattan, New York City, New York, USA",
/title/tt0075314/,"657 West 57th Street, Manhattan, New York City, New York, USA",(cab company - Swedish American Lines Pier 97 in the background)
/title/tt0075314/,"110 3rd Avenue, Manhattan, New York City, New York, USA",(Travis talks to Iris in front of the Variety Theatre)
/title/tt0075314/,"1866 Broadway, Manhattan, New York City, New York, USA","(Palantine's campaign office, at W. 63rd St.)"
/title/tt0075314/,"East 28th Street and Park Avenue South, Manhattan, New York City, New York, USA",(Travis meets his cabbie buddies at the Belmore Cafeteria)
/title/tt0075314/,"Columbus Circle, Manhattan, New York City, New York, USA",(Travis at Palantine rally after shaving his head into a Mowhawk)
/title/tt0075314/,"1 Times Square, Manhattan, New York City, New York, USA",(Travis drives by building with scrolling news ticker announcing Palantine's arrival in the city)
/title/tt0075314/,"1886 Broadway, New York City, New York, USA",(Palantine campaign headquarters)
/title/tt10584608/,"Duluth, Georgia, USA",
/title/tt10584608/,"Forsyth County, Georgia, USA",
/title/tt10584608/,"Doraville, Georgia, USA",
/title/tt1568346/,"Oslo Airport, Gardermoen, Ullensaker, Akershus, Norway",(airport in Irene Nesser montage)
/title/tt1568346/,"Segersta, Hälsingland, Sweden",(Hedestad bridge)
/title/tt1568346/,"Hofsta Säteri, Katrineholm, Södermanlands län, Sweden",(Vanger Mansion)
/title/tt1568346/,"Sollefteå, Västernorrlands län, Sweden",(Hedestad train station)
/title/tt1568346/,"Sankt Paulsgatan, Södermalm, Stockholm, Stockholms län, Sweden",
/title/tt1568346/,"Ingarö, Stockholms län, Sweden",
/title/tt1568346/,"London, England, UK",
/title/tt1568346/,"Krukmakargatan, Södermalm, Stockholm, Stockholms län, Sweden",
/title/tt1568346/,"Uppsala, Uppsala län, Sweden",
/title/tt1568346/,Switzerland,
/title/tt1568346/,"Sony Pictures Studios - 10202 W. Washington Blvd., Culver City, California, USA",(studio)
/title/tt1568346/,"25 Gresham Street, London, England, UK",(Lisbeth and Mikael talk in the garden)
/title/tt1568346/,"Hollywood, Los Angeles, California, USA",
/title/tt1568346/,USA,
/title/tt1568346/,"Zurich, Switzerland",(Hauptbahnhof)
/title/tt1839578/,"Silvercup Studios - 4222 22nd Street, Long Island City, Queens, New York City, New York, USA",
/title/tt1839578/,"Clinton Diner, Maspeth, Queens, New York City, New York, USA",(Diner)
/title/tt1358522/,"New York City, New York, USA",
/title/tt7456722/,"Newark, New Jersey, USA",
/title/tt7456722/,"Brooklyn, New York, USA",
/title/tt3513548/,"Centennial Olympic Park, Atlanta, Georgia",(on location)
/title/tt3513548/,"Georgia, USA",
/title/tt3513548/,"3127 Maple Drive NE, Atlanta, Georgia, USA",(Bryant's office)
/title/tt3513548/,"3649 Buford Hwy NE, Atlanta, Georgia, USA",(Jewells' apartment exteriors)
/title/tt0096542/,"Hawaii Film Studio - 18th Avenue & Diamond Head Road, Honolulu, O'ahu, Hawaii, USA",(studio) (studio - 1999-2001 seasons)
/title/tt0096542/,"Culver Studios - 9336 W. Washington Blvd., Culver City, California, USA",(studio)
/title/tt0096542/,"Hawaii, USA",(1999-2001 seasons)
/title/tt8712204/,"Vancouver, British Columbia, Canada",
/title/tt8712204/,"British Columbia, Canada",
/title/tt2191671/,"Silvercup Studios - 4222 22nd Street, Long Island City, Queens, New York City, New York, USA",(studio)
/title/tt2357547/,"Hell's Kitchen, New York City, New York, USA",
/title/tt2357547/,USA,
/title/tt2357547/,"New York, USA",
/title/tt9054904/,"Los Angeles, California, USA",
/title/tt0114814/,"Korean Friendship Bell, Angel's Gate Park - 3601 Gaffey Street, San Pedro, Los Angeles, California, USA",
/title/tt0114814/,"Herald Examiner - 1111 S. Broadway, Downtown, Los Angeles, California, USA",(interiors: San Pedro police station)
/title/tt0114814/,"Los Angeles Harbor, San Pedro, Los Angeles, California, USA",(smuggling boat attack on Ways St.)
/title/tt0114814/,"Hollywood Athletic Club - 6525 W. Sunset Blvd., Hollywood, Los Angeles, California, USA",(pool room)
/title/tt0114814/,"New York, USA",
/title/tt0114814/,"New York City, New York, USA",
/title/tt0114814/,"LaGuardia Airport, Queens, New York City, New York, USA",(jewel smuggler's arrival at Delta terminal)
/title/tt0114814/,"Langham Apartments - 715 South Normandie Avenue, Los Angeles, California, USA",(smuggler's car blocked and set on fire)
/title/tt0114814/,"California, USA",
/title/tt4474344/,"Harriman State Park, Bear Mountain, New York, USA",(Seven Lakes Drive)
/title/tt4649466/,"Courmayeur, Aosta, Valle d'Aosta, Italy",(snow sequence) (Skyway rope)
/title/tt4649466/,"Chapel, Old Royal Naval College, Greenwich, London, England, UK",(Eggsy and Tilde's Wedding)
/title/tt4649466/,"(Victoria Square, Colmore Row, Birmingham, England, UK",
/title/tt4649466/,"Berry Brothers and Rudd - 3 St. James's Street, London, England, UK",(New Kingsman headquarters)
/title/tt4649466/,"Central Middlesex Hospital, Acton, London, England, UK",
/title/tt4649466/,"11 Savile Row, London, England, UK",(Original Kingsman headquarters)
/title/tt4649466/,UK,
/title/tt4649466/,"Backlot, Pinewood Studios, Iver Heath, Buckinghamshire, England, UK",(studio)
/title/tt4649466/,"Longcross Studios, Chobham Lane, Longcross, Surrey, England, UK",(studio)
/title/tt5433138/,"Freedom Square, Tbilisi, Georgia",
/title/tt5433138/,"Rustavi, Georgia",
/title/tt5433138/,"Vazha-Pshavela Avenue, Tbilisi, Georgia",
/title/tt5433138/,"Greenham Common, England, UK",
/title/tt0412253/,"University of California San Diego - 9500 Gilman Dr, La Jolla, San Diego, California, USA",
/title/tt0412253/,"San Diego State University, San Diego, California, USA",
/title/tt5027774/,"Black Mountain, North Carolina, USA",(billboards on North Fork Left Fork Road)
/title/tt5027774/,"Maggie Valley, North Carolina, USA",(Restaurant scene)
/title/tt5027774/,"Cullowhee, North Carolina, USA",(Cullowhee Valley Elementary as Ebbing's High School)
/title/tt5027774/,"Clyde, North Carolina, USA",(hospital scenes at Haywood Regional Medical Center)
/title/tt5027774/,USA,
/title/tt3560084/,"Pearl River Turnaround, I-59 at MS state line",
/title/tt3560084/,New Orleans Motorsports Park,(exterior scenes)
/title/tt3560084/,"719 St. Ann St., New Orleans, LA, USA",(NCIS NOLA HQ)
/title/tt4604612/,"Korda Studios, Etyek, Hungary",
/title/tt0264464/,"Montréal, Québec, Canada",(France)
/title/tt0264464/,"Québec City, Québec, Canada",(France)
/title/tt0264464/,"Ontario International Airport - 2900 E. Airport Drive, Ontario, California, USA",(Miami International Airport)
/title/tt0264464/,"Québec, Canada",
/title/tt0264464/,"3077 East California Boulevard, Pasadena, California, USA",(Frank Abagnale Jr.'s mother's white house)
/title/tt0264464/,"Compton, California, USA",
/title/tt0264464/,"Santa Ana, California, USA",
/title/tt0264464/,"Buena Vista Avenue, Yonkers, New York, USA",(Abagnale apartment)
/title/tt0264464/,Canada,
/title/tt0264464/,"Lionel-Groulx Metro Station, Montréal, Québec, Canada",
/title/tt0264464/,"Union Station - 800 N. Alameda Street, Downtown, Los Angeles, California, USA",(Miami Mutual Bank)
/title/tt0264464/,"Old Orange County Courthouse - 211 West Santa Ana Boulevard, Santa Ana, California, USA",
/title/tt0264464/,"Borough Hall - Downtown Brooklyn, Brooklyn, New York City, New York, USA",(Chase Bank)
/title/tt0264464/,"TWA Terminal, JFK International Airport, Jamaica, Queens, New York City, New York, USA",(New York Airport)
/title/tt0264464/,"843 S. El Molino Avenue, Pasadena, California, USA",
/title/tt0264464/,"Fine Arts Auditorium, The Ebell of Los Angeles - 743 S Lucerne Blvd, Los Angeles, California, USA",(university)
/title/tt0264464/,"Launderland Laundromat - 151 Lake Avenue, Yonkers, New York, USA",(Carl Hanratty does laundry)
/title/tt0264464/,"Park Avenue, Manhattan, New York City, New York, USA",(Frank Abagnale makes a phone call)
/title/tt0264464/,"Rose City High School - 351 S Hudson Ave, Pasadena, California, USA",(school)
/title/tt0264464/,"The Ebell of Los Angeles - 743 S Lucerne Blvd, Los Angeles, California, USA",(University)
/title/tt0264464/,"Hollywood, Los Angeles, California, USA",
/title/tt0264464/,"Pasadena, California, USA",
/title/tt0264464/,"Rockwell Defense Plant - Bellflower & Imperial Highway, Downey, California, USA",
/title/tt0264464/,"Quality Coffee Shop - 1238 West 7th Street, Los Angeles, California, USA",
/title/tt11794642/,"British Columbia, Canada",
/title/tt0362357/,"London, England, UK",
/title/tt7134908/,"Madrid, Spain",
/title/tt7134908/,"European University of Madrid, Villaviciosa de Odón, Spain",(Exteriors for Las Encinas school.)
/title/tt7134908/,"Guadarrama, Spain",(Location)
/title/tt5177088/,"Berlin, Germany",
/title/tt5177088/,"Kattwyk Bridge, Hamburg, Germany",
/title/tt5177088/,Sweden,
/title/tt5177088/,"Potsdam, Germany",(studio) (Studio Babelsberg AG)
/title/tt7493974/,"South Place, London, England, UK",(hotel room scenes)
/title/tt7493974/,"Westminster, London, England, UK",
/title/tt7493974/,"Whittington Estate, Archway, London, England, UK",(street scenes)
/title/tt7493974/,"Moorgate, London, England, UK",(police squads gathering)
/title/tt7493974/,"Ropemaker Street, Moorgate, London, England, UK",(on location)
/title/tt7493974/,"Two Temple Place, London, England, UK",(Palace of Westminster interiors)
/title/tt7493974/,"Procter Street, Holborn, London, England, UK",(street scenes)
/title/tt1830617/,"418 SW Hamilton Street, Portland, Oregon, USA",(Monroe's house)
/title/tt1830617/,"U.S. Customs House - 220 NW 8th Avenue, Portland, Oregon, USA",(South Precinct)
/title/tt2304589/,"Leominster, Massachusetts, USA",
/title/tt2304589/,"Newton, Massachusetts, USA",(Cold Spring Park & Mount Ida College)
/title/tt2304589/,"Walpole, Massachusetts, USA",(MCI Cedar Junction)
/title/tt2304589/,"Lowell, Massachusetts, USA",(Tsongas Center at UMass Lowell)
/title/tt2304589/,"Belmont, Massachusetts, USA",
/title/tt6146586/,"New York City, New York, USA",(China Town)
/title/tt6146586/,Western Sahara,(Region)
/title/tt6146586/,"Cunard Building - 25 Broadway, New York City, New York, USA",(Continental Hotel lobby)
/title/tt6146586/,"Haru Sushi, 82 Beaver St, New York City, New York, USA",(Continental Hotel - externals)
/title/tt6146586/,"Brooklyn, New York City, New York, USA",
/title/tt6146586/,"New York Public Library, New York City, New York, USA",
/title/tt0071562/,"Trieste, Friuli-Venezia Giulia, Italy",
/title/tt0071562/,"Santo Domingo, Dominican Republic",
/title/tt0071562/,"Calle Duarte, Santo Domingo, Dominican Republic",(Where rebel blows up bomb)
/title/tt0071562/,"Lake Tahoe, California, USA",
/title/tt0071562/,"via Vecchia Pozzillo, Acireale, Catania, Italy",(Don Ciccio's villa)
/title/tt0071562/,"Hospital Padre Billini, Santo Domingo, Dominican Republic",(Hospital Execution)
/title/tt0071562/,"6th Street, Manhattan, New York City, New York, USA",
/title/tt0071562/,"538 E. 6th. Street, Manhattan, New York City, New York, USA",(Fanucci Residence)
/title/tt0071562/,"Calle Hostos, Santo Domingo, Dominican Republic",
/title/tt0071562/,"Avenida Mella, Santo Domingo, Dominican Republic",
/title/tt0071562/,"East Village, Manhattan, New York City, New York, USA",
/title/tt0071562/,"Las Vegas, Nevada, USA",
/title/tt0071562/,"Miami, Florida, USA",
/title/tt0071562/,"2045 N. Hibiscus Drive, North Miami, Florida, USA",(Hyman Roth residence.)
/title/tt0071562/,"Los Angeles, California, USA",
/title/tt3890160/,"111 Green St, Gainesville, Georgia, USA",(interior for the U.S. Post Office scene -- used the old Regions Bank)
/title/tt3890160/,"New Orleans, Louisiana, USA",
/title/tt3890160/,"Georgia, USA",
/title/tt5439796/,"Clayton County, Georgia, USA",(Clayton County Landfill)
/title/tt5439796/,"Concord, North Carolina, USA",(Charlotte Motor Speedway)
/title/tt2872718/,"Dinah's Family Restaurant - 6521 S. Sepulveda Blvd., Westchester, Los Angeles, California, USA",(interview) (Rick's job interview)
/title/tt2872718/,"KTLA Studios - 5858 Sunset Blvd., Hollywood, Los Angeles, California, USA",(KWLA - local TV station)
/title/tt2872718/,"Ocean Front Walk, Venice Beach, Venice, Los Angeles, California, USA",(stolen bicycle)
/title/tt2872718/,"Interstate 105, El Segundo, California, USA",(car fire on freeway)
/title/tt2872718/,"Los Angeles, California, USA",
/title/tt2872718/,"Los Angeles Police Department, Hollywood Station - 1358 Wilcox Ave, Los Angeles, California, USA",(Police station exterior)
/title/tt0113277/,"Interstate 105, El Segundo, California, USA",(McCauley's drive where Hanna pulls him over)
/title/tt0113277/,"Venice Boulevard at Georgia Street, Los Angeles, California, USA",(Armored truck robbery)
/title/tt0113277/,"Berth 202, Port of Los Angeles, Los Angeles, California, USA",(Container yard scene)
/title/tt0113277/,"5th Street, Flower Street and Figueroa Street., Los Angeles, California, USA",(car chase shootout)
/title/tt0113277/,"Centinela Drive-In Theater - 5700 Centinela Avenue, Westchester, Los Angeles, California, USA",(drive-in movie theatre - now apartments)
/title/tt0113277/,"Broadway Deli - 1457 3rd Street Promenade, Santa Monica, California, USA",(Deli - Neil meets Eady)
/title/tt0113277/,"Harbor Place Tower - 525 E. Seaside Way, Long Beach, California, USA",
/title/tt0113277/,"1284 South Western Avenue, Los Angeles, California, USA",(Waingro meets Michael)
/title/tt0113277/,"Johnie's Broiler - 7447 Firestone Blvd., Downey, California, USA",(restaurant)
/title/tt0113277/,"Metro Green Line, Marine/Redondo Station - 2406 Marine Avenue, Gardena, California, USA",(train station)
/title/tt0113277/,"Malibu, California, USA",
/title/tt0113277/,"St. Mary's Hospital - 1050 Linden Avenue, Long Beach, California, USA",
/title/tt0113277/,"Venice, Los Angeles, California, USA",(Shiherlis apartment)
/title/tt0113277/,"North Beirut Avenue and Via De Las Olas, Pacific Palisades, Los Angeles, California, USA",(Neil talks to Eady)
/title/tt0113277/,"3506 W 8th St, Los Angeles, California, USA",(Vincent meets up with Albert)
/title/tt0113277/,"Angeleno Hotel - 170 N. Church Lane, Los Angeles, California, USA",(hotel looking over freeway)
/title/tt0113277/,"Los Angeles, California, USA",
/title/tt0113277/,"Hennessey + Ingalls, 1254 Third Street Promenade, Santa Monica, California, USA",(bookstore - Eady first sees Neil)
/title/tt0113277/,USA,
/title/tt0275140/,"Clinton Diner, Maspeth, Queens, New York City, New York, USA",(Diner)
/title/tt2278388/,"Kraków, Malopolskie, Poland",(cemetery scene)
/title/tt2278388/,"Hainewalde, Saxony, Germany",(castle Hainewalde)
/title/tt2278388/,"Dresden, Saxony, Germany",
/title/tt2278388/,"Sächsische Schweiz, Saxony, Germany",(wedding scene)
/title/tt2278388/,Poland,
/title/tt2278388/,"Burg Kriebstein, Kriebstein, Saxony, Germany",(Prison Break scene)
/title/tt1442462/,"Clinton Diner, Maspeth, Queens, New York City, New York, USA",(restaurant)
/title/tt1442462/,"Brooklyn, New York City, New York, USA",
/title/tt0102685/,"Ecola State Park - Highway 101, Cannon Beach, Oregon, USA","(as Bells Beach, Australia)"
/title/tt0102685/,"Neptune's Net - 42505 Pacific Coast Highway, Malibu, California, USA",(beach cafe)
/title/tt0102685/,"Hideaway Cafe - 6506 Westward Beach Road, Malibu, California, USA",
/title/tt0102685/,"Waimea Bay, Waimea Bay Beach Park, O'ahu, Hawaii, USA",(surf scenes)
/title/tt0102685/,"6198 W Slauson Ave, Westfield Mall, Culver City, California, USA",(mall chase scene busting thru gate then under the Marina Fwy)
/title/tt0102685/,"Pacific Palisades, Los Angeles, California, USA",
/title/tt0102685/,"2444 Wilshire Boulevard, Santa Monica, California, USA",(Security Independence Bank)
/title/tt0102685/,"3849 Main Street, Culver City, California, USA",(Assured Trust Savings and Loan Bank)
/title/tt0102685/,"Pacific Coast Highway, Malibu, California, USA",
/title/tt0102685/,"Los Angeles, California, USA",
/title/tt0102685/,"6000 Sepulveda Boulevard, Culver City, Califiornia, USA",(Ex-Presidents driving beneath the Marina Freeway in this parking lot.)
/title/tt7772602/,"Ontario, Canada",
/title/tt7772602/,"Chicago Illinois, USA",
/title/tt1250777/,"London, England, UK",
/title/tt1250777/,"Cinespace Film Studios, Toronto, Ontario, Canada",(studio)
/title/tt1250777/,"Dip 'n Sip Donuts - 663 Kingston Road, Toronto, Ontario, Canada",
/title/tt1250777/,"Charles Street, Hamilton, Ontario, Canada",
/title/tt1250777/,"Capri Pizza, John St. North, Hamilton, Ontario, Canada",(Dave gets beat up in the ally)
/title/tt1250777/,"All Star Lanes, Whiteleys Shopping Centre, Bayswater, London, England, UK",
/title/tt1245526/,"Cambridge, Ontario, Canada",
/title/tt1245526/,"Cruickston Park, Cambridge, Ontario, Canada","(as Alexander Dunning's mansion, exterior)"
/title/tt1245526/,"2 Church Street, Toronto, Ontario, Canada",(parking garage for chase scene)
/title/tt1245526/,"Showline Studios, Toronto, Ontario, Canada",
/title/tt1245526/,"Niagara-on-the-Lake, Ontario, Canada",(Eagles Nest Home/Outdoor Shot)
/title/tt1245526/,"Toronto, Ontario, Canada",
/title/tt1245526/,"Richard L. Hearn Generating Station - 440 Unwin Avenue, Port Lands, Toronto, Ontario, Canada",(final showdown)
/title/tt1245526/,"France Rd & France Rd Pkwy, New Orleans, Louisiana, USA",
/title/tt1245526/,"Toronto, Ontario, Canada",(One King West)
/title/tt1245526/,"New Orleans, Louisiana, USA",
/title/tt1245526/,"39 Robert Woodhead Cres, North York, Toronto, Ontario, Canada","(opening: Frank's house, 39 Lawndale Dr, Parma Heights, OH, demolished)"
/title/tt8722888/,"Marietta, Georgia, USA",
/title/tt8722888/,"Douglasville, Georgia, USA",(High School Homecoming Football Game)
/title/tt1838556/,"UMass Memorial Medical Center, 55 Lake Avenue, Worcester, Massachusetts, USA",(it was in the local news)
/title/tt0348914/,"Frazier Park, California, USA",
/title/tt0348914/,"Santa Clarita, California, USA",
/title/tt0289765/,"4160 Country Club Drive, Long Beach, California, USA",
/title/tt0289765/,"Baltimore, Maryland, USA",
/title/tt0289765/,"Washington, District of Columbia, USA",
/title/tt0289765/,"Universal Studios - 100 Universal City Plaza, Universal City, California, USA",(studio)
/title/tt0289765/,"Central Library - 285 E. Walnut Street, Pasadena, California, USA",
/title/tt0289765/,"Pasadena Civic Auditorium - 300 E. Green Street, Pasadena, California, USA",
/title/tt0289765/,"Mount Vernon, Baltimore, Maryland, USA",(urban square)
/title/tt0266697/,"St. Luke's Hospital - 2632 E. Washington Street, Pasadena, California, USA",
/title/tt0266697/,"Hong Kong, China",
/title/tt0266697/,"Austin, Texas, USA",
/title/tt0266697/,"E Ave G & 198th St E, Lancaster, California, USA",
/title/tt0266697/,"American Cement Building, 2404 Wilshire Boulevard, Los Angeles, California, USA",(Parking Garage where Beatrix Kiddo locates the Pussy Wagon.)
/title/tt1693592/,"Snook House, Lindisfarne Causeway, Berwick-upon-Tweed, Northumberland, UK",(Vera's home)
/title/tt0086250/,"656 Park Ln, Santa Barbara, California, USA",(Alejandro Sosa's Bolivian Estate)
/title/tt0086250/,"728 Ocean Drive, Miami Beach, Florida, USA",(Sun Ray Hotel - coke deal with Colombians & chainsaw scene)
/title/tt0086250/,"Torrance, California, USA",(Tony's mother's house)
/title/tt0086250/,"8623 West Sunset Boulevard, West Hollywood, California, USA",(Montana Management Co.)
/title/tt0086250/,"3501 Southwest 130th Avenue, Davie, Florida, USA",(Babylon Club exterior)
/title/tt0086250/,"Miami, Florida, USA",
