Code,Show Name,Location,Scene
/title/tt0086250/,"South Beach, Miami Beach, Florida, USA",
/title/tt0086250/,"Santa Barbara, California, USA",
/title/tt0086250/,"Montecito, California, USA",
/title/tt0086250/,"Stage 12, Universal Studios - 100 Universal City Plaza, Universal City, California, USA",
/title/tt0086250/,"Infiniti - 8825 Wilshire Boulevard - Beverly Hills, California, USA",(Frank Lopez' Mercedes dealership)
/title/tt3460252/,"Schmid Ranch, Telluride, Colorado, USA",(exterior scenes)
/title/tt3460252/,"Los Angeles, California, USA",
/title/tt5164214/,"John F. Kennedy International Airport, Terminal 5 - Jamaica, Queens, New York City, New York, USA",(Rose's Fashion Show)
/title/tt5164214/,"Veselka Cafe - 144 Second Avenue, New York City, New York, USA",(Debbie tells Lou about her plan over a meal)
/title/tt5164214/,"Plaza Hotel - 750 Fifth Avenue, Manhattan, New York City, New York, USA",(Debbie cons her way into getting a suite for the night)
/title/tt5164214/,"Christie's Auction House, Rockefeller Plaza, Manhattan, New York City, New York, USA",(Yardley's Precious Gems Auction)
/title/tt5164214/,"Cartier Mansion - 653 Fifth Avenue, New York City, New York, USA",(Rose and Amita meet with Lawerence and Delarue-Broussard about the Toussaint; Cartier's vault)
/title/tt5164214/,"Cheim & Read Gallery - 547 W 25th Street, New York City, New York, USA",(Claude Becker Gallery)
/title/tt5164214/,"One World Trade Center, Manhattan, New York City, New York, USA",(Vouge Magazine Headquarters)
/title/tt5164214/,"Myrtle Avenue, Richmond Hill, Queens, New York City, New York, USA",(terrace of Veronica and Nine Ball's apartment)
/title/tt5164214/,"Casa Lever Restaurant - 390 Park Avenue, New York City, New York, USA",(Rose's meeting with Penelope)
/title/tt5164214/,"Red Hook, Brooklyn, New York City, New York, USA",(Lou confronts Debbie about Becker)
/title/tt3501584/,"210-555 Brooksbank Ave, Bld. 10 North Vancouver, British Columbia, Canada",(studio)
/title/tt7263154/,"Saint-Malo, France",
/title/tt7263154/,"Veldhoven, Noord-Brabant, Netherlands",
/title/tt7263154/,"Aken, Germany",
/title/tt1800241/,"Worcester, Massachusetts, USA",(interior and street scenes)
/title/tt1800241/,"Essex Superior Courthouse - 34 Federal Street, Salem, Massachusetts, USA",
/title/tt1800241/,"Salem, Massachusetts, USA",(Interior and street scenes)
/title/tt1800241/,"Malden, Massachusetts, USA",(Mayor's house)
/title/tt1800241/,"Union Station, Worcester, Massachusetts, USA",(exterior scenes)
/title/tt1800241/,"Massachusetts, USA",
/title/tt1800241/,"Norwood Memorial Airport, 125 Access Rd, Norwood, Massachusetts, USA",
/title/tt1800241/,"Plaza Hotel - 750 Fifth Avenue, Manhattan, New York City, New York, USA",(on location) (exterior scenes)
/title/tt1800241/,"54 Doonan Street, Medford, Massachusetts, USA",(Irving's house)
/title/tt1800241/,"37 Beltran Street, Malden, Massachusetts, USA",(Carmine's house)
/title/tt1800241/,"Teterboro Airport - 90 Moonachie Avenue, Teterboro, New Jersey, USA",(on location)
/title/tt1800241/,"New York City, New York, USA",(exterior shots)
/title/tt0050083/,"Fox Movietone Studio, New York, USA",(studio)
/title/tt0439100/,"Manhattan Beach, California, USA","(Boston Globe, 6/14/08)"
/title/tt0439100/,"26885 Chaucer Pl, Stevenson Ranch, California, USA",(Nancy's house)
/title/tt12939836/,"Frankfurt, Germany",(interview) (interiors for interviews)
/title/tt3397884/,"Albuquerque, New Mexico, USA",
/title/tt3397884/,"Motel 1, 2001 Candelaria Rd NE, Albuquerque, New Mexico, USA",(Motel Scene)
/title/tt3397884/,"Corrales, New Mexico, USA",(location)
/title/tt3397884/,"9620 Candelaria Road NE, Albuquerque, New Mexico, USA",(bank scene)
/title/tt10293938/,"South Carolina, USA",
/title/tt3581652/,"New York, USA",
/title/tt3581652/,"Newark, New Jersey, USA",
/title/tt3581652/,"National Newark Building, 744 Broad St, Newark, New Jersey, USA",
/title/tt0115355/,"Cambridge, Cambridgeshire, England, UK",
/title/tt0115355/,"Almería, Andalucía, Spain",
/title/tt0190590/,"California, USA",
/title/tt0190590/,"Canton, Mississippi, USA",(political rally where Everett's daughters sing)
/title/tt0190590/,"Vicksburg, Mississippi, USA",(political rally)
/title/tt0190590/,"Falls Lake, Backlot, Universal Studios - 100 Universal City Plaza, Universal City, California, USA",
/title/tt0190590/,"Oxford, Mississippi, USA",
/title/tt0190590/,"Santa Clarita, California, USA",
/title/tt0190590/,"Leland, Mississippi, USA",(train scene)
/title/tt0190590/,"Mississippi, USA",
/title/tt0190590/,USA,
/title/tt0208092/,"Hatton Garden, Clerkenwell, London, England, UK",(as Ye Olde Mitre Tavern/Doug's diamond store)
/title/tt0208092/,"Streatham Hill, Streatham, London, England, UK",(as Caesars Nightclub - location of boxing match)
/title/tt0208092/,"Bethnal Green Town Hall, Bethnal Green, London, England, UK",
/title/tt0208092/,"Perivale, Middlesex, England, UK",(Boris's house)
/title/tt0208092/,"London, England, UK",
/title/tt0208092/,"England, UK",
/title/tt4093826/,"North Bend, Washington, USA",
/title/tt4093826/,"Everett, Washington, USA",
/title/tt4093826/,"Las Vegas, Nevada, USA",
/title/tt4093826/,"Silver Lake, Los Angeles, California, USA",
/title/tt4093826/,"Big Sky Ranch - 4927 Bennett Road, Simi Valley, California, USA",
/title/tt4093826/,"Palmdale, California, USA",
/title/tt4093826/,"Palm Springs, California, USA",
/title/tt1670345/,"Orpheum Theater - 842 South Broadway, Downtown, Los Angeles, California, USA","(Interior of 'The Savoy, New Orleans')"
/title/tt1670345/,"Las Vegas, Nevada, USA",
/title/tt1670345/,"Neon Museum - 770 Las Vegas Boulevard North, Las Vegas, Nevada, USA",
/title/tt1670345/,"New York City, New York, USA",
/title/tt1670345/,"Chicago, Illinois, USA",
/title/tt1670345/,"Downtown, Los Angeles, California, USA",
/title/tt1670345/,"California, USA",
/title/tt1670345/,France,
/title/tt1670345/,"Long Island City, Queens, New York City, New York, USA",
/title/tt1670345/,"Louisiana, USA",
/title/tt0101540/,"Hollywood, Florida, USA",
/title/tt0101540/,"Fort Lauderdale, Florida, USA",
/title/tt0101540/,"H Stage, Shepperton Studios, Shepperton, Surrey, England, UK",(storm scene)
/title/tt0780504/,"Point Mugu, California, USA",(end of the car chase)
/title/tt0780504/,"The Pink Motel & Cadillac Jack's Diner, 9457 San Fernando Road, Sun Valley, California, USA",(interiors: motel)
/title/tt0780504/,"Park Plaza Hotel - 607 S. Park View Street, Los Angeles, California, USA",(interiors: Driver and Irene's apartments)
/title/tt0780504/,"Los Angeles River, California, USA",
/title/tt0780504/,"1710 Naomi Avenue, Los Angeles, California, USA",(electronic store robbery)
/title/tt0780504/,"Picture Car Warehouse - 8400 Reseda Boulevard, Northridge, Los Angeles, California, USA",(Shannon's garage)
/title/tt0780504/,"Santa Clarita, California, USA",
/title/tt0780504/,"California, USA",
/title/tt4425200/,"Montréal, Québec, Canada",(Palais des congrès de Montréal)
/title/tt4425200/,"Montréal, Québec, Canada",(Place-des-Arts)
/title/tt4425200/,"Baths of Caracalla, Rome, Lazio, Italy",(Night party)
/title/tt4425200/,Vatican City,
/title/tt4425200/,"Palazzo delle Assicurazioni Generali, Piazza Venezia, Rome, Lazio, Italy",(Rooftop in Rome scene)
/title/tt4425200/,"Galleria Nazionale d'Arte Moderna e Contemporanea, Rome, Lazio, Italy",(Museum interior scenes)
/title/tt4425200/,"Horti Sallustiani, Piazza Sallustio, Rome, Lazio, Italy",(Gianna D'Antonio's house interior)
/title/tt4425200/,"Grand Hotel Plaza - 126 Via del Corso, Rome, Lazio, Italy",(Hotel Continentale in Rome interior)
/title/tt4209788/,"Toronto, Ontario, Canada",
/title/tt4209788/,"New York City, New York, USA",(where started her game over and became involved with Russian mobsters)
/title/tt5348176/,"Los Angeles, California, USA",
/title/tt0212985/,"Florence, Tuscany, Italy",
/title/tt0212985/,"North Carolina, USA",
/title/tt0212985/,"Sardinia, Italy",
/title/tt0212985/,"Union Station - 50 Massachusetts Avenue NE, Washington, District of Columbia, USA",
/title/tt0212985/,"Virginia, USA",
/title/tt0212985/,USA,
/title/tt4378376/,"Rathaus Schöneberg, Schöneberg, Berlin, Germany","(many interior scenes as Berlin Police Headquarter, e.g. stairs in the main entrance hall where the female secretaries receive their daily tasks)"
/title/tt4378376/,"Haus des Rundfunks, Charlottenburg, Berlin, Germany",(interior scenes where paternoster lift is shown)
/title/tt4378376/,"Historic Harbor at Fischerinsel, Mühlendammschleuse, Mitte, Berlin, Germany",(where the Russian train driver is lying dead in the water)
/title/tt2649356/,"11531 East Rd, Redwood Valley, California, USA","(Calhoun Day Festival, Adora Crellin's victorian home in Windgap)"
/title/tt2649356/,"Los Angeles, California, USA",(shot in the Greater Los Angeles area)
/title/tt2649356/,"Mendocino County, California, USA",(shot in)
/title/tt2649356/,"California, USA",
/title/tt0104952/,"Monticello, Georgia, USA",(courthouse and Sac o Suds)
/title/tt0104952/,"Alto, Georgia, USA",(Arrendale State Prison)
/title/tt0104952/,"Bostwick, Georgia, USA",(plantation scene)
/title/tt0104952/,"Monticello, Georgia, USA",(Historic Downtown Square)
/title/tt0088930/,"Stage 16, Paramount Studios - 5555 Melrose Avenue, Hollywood, Los Angeles, California, USA",(mansion set)
/title/tt0088930/,"Stage 18, Paramount Studios - 5555 Melrose Avenue, Hollywood, Los Angeles, California, USA",(driveway; front door; ground floor)
/title/tt6628394/,"Hidden Valley, California, USA",
/title/tt6628394/,"Heritage Valley, California, USA",
/title/tt6628394/,Canada,
/title/tt6628394/,USA,
/title/tt8206668/,"Greater Roslyn Area, Roslyn, New York, USA",(exterior scenes)
/title/tt8206668/,"Long Island, New York, USA",
/title/tt1232829/,"Riverdale High School, Jefferson, Louisiana, USA",(Sagan High School)
/title/tt1232829/,"Lafreniere Park - 3000 Downs Blvd, Metairie, Louisiana, USA",(bike patrol scenes)
/title/tt0108399/,"The Vista Theatre - 4473 Sunset Drive, Los Angeles, California, USA",(Theater playing Sonny Chiba triple feature where Clarence and Alabama meet)
/title/tt0108399/,"Ambassador Hotel - 3400 Wilshire Boulevard, Los Angeles, California, USA",(hotel lobby)
/title/tt0108399/,"The Athenaeum, California Institute of Technology - 551 S Hill Ave, Pasadena, California, USA",
/title/tt0108399/,"Los Angeles, California, USA",
/title/tt4106514/,"Stockholm, Sweden",
/title/tt4106514/,"Maria Tappgränd, Stockholm, Sweden",(Dessies home)
/title/tt0105236/,"Johnie's Coffee Shop - 6101 Wilshire Boulevard, Fairfax, Los Angeles, California, USA",(Mr. Orange meeting with Randy)
/title/tt0105236/,"York Boulevard and North Avenue 50, Highland Park, Los Angeles, California, USA",
/title/tt0105236/,"Burbank, California, USA",
/title/tt0105236/,"Highland Park, Los Angeles, California, USA",
/title/tt9340526/,"Georgia, USA",
/title/tt6199572/,"Louisiana, USA",
/title/tt6199572/,"18447 Three Rivers Rd, Covington, Louisiana, USA",(The Capone mansion)
/title/tt0240772/,"St. Petersburg, Florida, USA",
/title/tt0240772/,"495 North Milwaukee Avenue, Chicago, Illinois, USA",(Emmit's Pub)
/title/tt0240772/,"Atlantic City, New Jersey, USA",
/title/tt0240772/,"Victorville, California, USA",
/title/tt0240772/,"999 N Patencio, Palm Springs, California, USA",
/title/tt0240772/,"Stage 19, Warner Brothers Burbank Studios - 4000 Warner Boulevard, Burbank, California, USA",
/title/tt0240772/,"Universal Studios - 100 Universal City Plaza, Universal City, California, USA",(studio) (Casino Offices and Rooms)
/title/tt0240772/,"Infinite Horizon Studios, Orlando, Florida, USA",(studio) (Casino Vault and Casino interiers)
/title/tt0240772/,"Las Vegas, Nevada, USA",
/title/tt0240772/,"Deep Nightclub - 1707 N. Vine Street, Hollywood, Los Angeles, California, USA",
/title/tt0240772/,"Musso & Frank Grill - 6667 Hollywood Blvd., Hollywood, Los Angeles, California, USA",(Danny and Rusty discuss the plan for the first time and also at the Bar deciding if 10 is enough.)
/title/tt0240772/,"Trump Plaza Hotel and Casino - 2500 Boardwalk, Atlantic City, New Jersey, USA",(Danny Ocean plays there early in the film)
/title/tt0240772/,"Lawremce Berkeley National Laboratory Campus, Berkeley, California, USA","(Exterior location of building where Ocean's crew goes to steal ""The Pinch"")"
/title/tt0160904/,"Leyden Street, Shoreditch, London, England, UK",
/title/tt6856242/,"Turin, Piedmont, Italy",
/title/tt6856242/,Italy,
/title/tt0840361/,"Fenway Park - 4 Jersey Street, Boston, Massachusetts, USA",
/title/tt0840361/,"Harvard Square, Cambridge, Massachusetts, USA",
/title/tt0840361/,"Boston, Massachusetts, USA",
/title/tt0840361/,"Melrose, Massachusetts, USA",
/title/tt0840361/,"100 Salem Street, Boston, Massachusetts, USA",(North End Truck Robbery)
/title/tt2948356/,"Walt Disney Animation Studios - 2100 Riverside Drive, Burbank, California, USA",
/title/tt2948356/,"New York City, New York, USA",
/title/tt1833116/,"New York, USA",
/title/tt9315054/,"Vancouver, British Columbia, Canada",
/title/tt9315054/,"Portland Oregon, USA",(Fremont Bridge Willamette River)
/title/tt9315054/,"Chicago, Illinois, USA",
/title/tt3062096/,"Hagia Sophia, Istanbul, Turkey",
/title/tt3062096/,Hungary,
/title/tt3062096/,"Florence, Tuscany, Italy",
/title/tt3062096/,"Korda Studios, Etyek, Hungary",(water tank)
/title/tt3062096/,"Palazzo Vecchio, Piazza della Signoria, Florence, Tuscany, Italy",(opening scene: views from inside the tower)
/title/tt3062096/,"Origo Studios, Budapest, Hungary",(studio)
/title/tt3062096/,"Ponte Vecchio, Florence, Tuscany, Italy",(motorcycle scene)
/title/tt3062096/,"Piazza San Marco, Venice, Veneto, Italy",
/title/tt3062096/,"St. Mark's Square, Venice, Veneto, Italy",
/title/tt3062096/,"Vasari Corridor, Florence, Tuscany, Italy",
/title/tt3062096/,"Basilica Cistern, Fatih, Istanbul, Turkey",(Ancient cisterns)
/title/tt2215842/,"Upper Slaughter, Gloucestershire, England, UK",
/title/tt2215842/,"Blockley, Gloucestershire, England, UK",(Father Brown's home)
/title/tt7945440/,"Ontario, Canada",
/title/tt0317248/,"Cidade de Deus, Rio de Janeiro, Rio de Janeiro, Brazil",
/title/tt0087843/,"Don Cesar Hotel - 3400 Gulf Boulevard, St. Petersburg, Florida, USA",(beach scene where Max unveils his plan to rob the Federal Reserve)
/title/tt0087843/,"Hoboken Terminal - 1 Hudson Place, Hoboken, New Jersey, USA",(walked on the set in 1981 in Hoboken terminal)
/title/tt0087843/,"Gare du Nord, Paris 10, Paris, France",(as New York's Grand Central Station in 1930's flashback scene)
/title/tt0087843/,"Woodlawn Cemetery, Bronx, New York City, New York, USA",(ornate vault which Noodles enters - mausoleum is first on left inside from Jerome Ave. entrance)
/title/tt0087843/,"Manhattan Bridge, New York City, New York, USA",
/title/tt0087843/,"Hotel Excelsior Venice, Longomare Guglielmo Marconi 41, Venice, Veneto, Italy",(Noodles date with Deborah)
/title/tt0087843/,"300 Rue de Moyne, Montreal, Quebec, Canada",(Federal Club)
/title/tt0087843/,"449 Rue Saint-Pierre, Montreal, Quebec, Canada",(boys set fire to newsstand)
/title/tt0087843/,"Porto Marghera, Venice, Veneto, Italy",(salt trick with cases of booze)
/title/tt0087843/,"2510 Court Square West, Long Island City, Queens, New York City, New York, USA",(Noodles comes out of prison - Long Island City Courthouse)
/title/tt0087843/,"Guardia di Finanza Tenenza Castelporziano, Via Pontina 690, Castel Porziano, Rome, Lazio, Italy",(Gate entrance to Max's mansion)
/title/tt0087843/,"102 South 6th Street, Brooklyn, New York City, New York, USA",(boys watching drunk come out of bar to roll him)
/title/tt0087843/,"126 South 8th Street, Brooklyn, New York City, New York, USA",(Max's apartment building)
/title/tt0087843/,"1228 Rue Sherbrooke Ouest, Montreal, Quebec, Canada",(Noodles picks up Deborah outside theatre)
/title/tt2481498/,"Fort Thomas, Kentucky, USA",
/title/tt2481498/,"Northern Kentucky University, Highland Heights, Kentucky, USA",(8351)
/title/tt0313043/,"Federal Aviation Administration Credit Union - 14600 Aviation Blvd., Hawthorne, California, USA",(CSI HQ)
/title/tt0313043/,"Raleigh Manhattan Beach Studios - 1600 Rosecrans Avenue, Manhattan Beach, California, USA",(studio)
/title/tt0313043/,"5540 W 118th Street, Inglewood, California, USA",
/title/tt0313043/,"Los Angeles, California, USA",
/title/tt4857264/,"Barcelona, Catalonia, Spain",(Various locations)
/title/tt4857264/,"Parc audiovisual de Catalunya, Terrassa, Catalonia, Spain",(studio)
/title/tt1733785/,"Malmö, Skåne län, Sweden",
/title/tt0120890/,"San Pedro, Los Angeles, California, USA",
/title/tt0120890/,"Greenwich Studios - 12100 Ivan Tors Boulevard, Miami, Florida, USA",(studio)
/title/tt0120890/,"Coral Gables, Florida, USA",
/title/tt0120890/,"Virgina Key, Florida, USA",
/title/tt0120890/,"Fort Lauderdale, Florida, USA",
/title/tt0120890/,"Florida, USA",
/title/tt4139588/,"Royal York Hotel - 100 Front St W, Toronto, Canada",
/title/tt4139588/,"Hearn Generating Station, Toronto, Canada",
/title/tt4139588/,"5337 Main St., Orono, Ontario, Canada",(Marsha's Gift & Supplies)
/title/tt4139588/,"The Omni King Edward Hotel, Toronto, Ontario, Canada",(Duncan's Visions)
/title/tt9698480/,"Bolton, Greater Manchester, England, UK",
/title/tt1656177/,Thailand,
/title/tt1656177/,"British Columbia, Canada",
/title/tt8629748/,"Boston, Massachusetts, USA",(location)
/title/tt0874608/,"Ealing, London, England, UK",
/title/tt0116367/,"Barstow, California, USA",
/title/tt0116367/,"Lancaster, California, USA",
/title/tt0116367/,"Redmond, Washington, USA",
/title/tt3569230/,"14 Watts Street, Wapping, London, England, UK",(Pub the Krays visit.)
/title/tt3569230/,"Teesdale Street, London, England, UK",
/title/tt3569230/,"Burnham Beeches, Buckinghamshire, England, UK",(various scenes)
/title/tt3569230/,"Teesdale Street, Bethnal Green, London, England, UK",(Street scene with Mercedes car.)
/title/tt3569230/,"Cedra Court, Cazenove Road, Stoke Newington, London, England, UK",(Scenes with Frances and Reggie in the Sports Car)
/title/tt3569230/,"Canrobert Street, Bethnal Green, London, England, UK",(Street scene with Mini car.)
/title/tt3569230/,"32 Caradoc Street, Greenwich, London, England, UK",(Frances' house)
/title/tt3569230/,"Hedsor House & Park, Taplow, Buckinghamshire, England, UK",(Main Scenes)
/title/tt3569230/,"16 Whittlesey Street, Lambeth, London, England, UK",(The Krays' home on 178 Vallance Road)
/title/tt1895587/,"Toronto, Ontario, Canada",
/title/tt1895587/,"Boston Massachusetts, USA",(Boston Globe)
/title/tt1895587/,"The Globe and Mail - 444 Front Street West, Toronto, Ontario, Canada",(interiors)
/title/tt1895587/,Canada,
/title/tt1895587/,"Toronto, Ontario, Canada",(Mercatto - restaurant scene)
/title/tt1895587/,"Scarboro Golf and Country Club, Toronto, Ontario, Canada","(golf course scene, 8th hole)"
/title/tt3921180/,"Los Angeles, California, USA",
/title/tt3921180/,"Atlanta, Georgia, USA",(Season 3)
/title/tt1469304/,"Savannah, Georgia, USA",
/title/tt1469304/,"South Inlet Park, Boca Raton Florida, USA",(Beach location for kite surfer rescue opening scene)
/title/tt1469304/,"Deerfield Beach, Florida, USA",(the Baywatch lifeguard building)
/title/tt0290673/,"Paris, France",
/title/tt5742374/,"Astoria, Queens, New York, USA",(Elevated Subway Platform)
/title/tt5742374/,"New York, USA",
/title/tt0118880/,"Wendover, Utah, USA",(Death Valley Desert Landing - Salt Flats)
/title/tt0118880/,"Ogden, Utah, USA",
/title/tt0118880/,"2nd Street Tunnel between Hill and Figueroa, Los Angeles, California, USA",(road tunnel)
/title/tt0118880/,"Elkhart, Indiana, USA",
/title/tt0118880/,"Mill Canyon, Utah, USA",
/title/tt0118880/,"The Strip, Las Vegas, Nevada, USA",(airplane crash)
/title/tt0118880/,"Moab, Utah, USA",
/title/tt0118880/,"Las Vegas Boulevard South, Las Vegas, Nevada, USA",(airplane crash)
/title/tt0118880/,"Sands Hotel - 3355 Las Vegas Boulevard South, Las Vegas, Nevada, USA",(airplane crash)
/title/tt0118880/,"Hollywood Center Studios - 1040 N. Las Palmas Avenue, Hollywood, Los Angeles, California, USA",(studio)
/title/tt0118880/,"Valley of Fire State Park - Route 169, Overton, Nevada, USA",
/title/tt1519931/,"Mahone Bay, Nova Scotia, Canada",
/title/tt1519931/,"Lunenburg, Nova Scotia, Canada",
/title/tt1519931/,"Northwest Cove, Nova Scotia, Canada",
/title/tt7902072/,"Liverpool, Merseyside, England, UK",(Underground Rail scenes)
/title/tt7902072/,"The Con Club, Greenwood Street, Altrincham, Greater Manchester, England, UK",(Restaurant scenes)
/title/tt7902072/,"Walker Art Gallery, William Brown Street, Liverpool, Merseyside, England, UK",(Art gallery scene)
/title/tt7902072/,"Hale, Altrincham, Greater Manchester, England, UK",(Railway Station sequences)
/title/tt0286486/,"Los Angeles, California, USA",
/title/tt0092379/,"Bray Studios, Down Place, Oakley Green, Berkshire, England, UK",(studio)
/title/tt0092379/,"Trout Inn - 195 Godstow Road, Lower Wolvercote, Oxford, Oxfordshire, England, UK",
/title/tt0092379/,"Harrow, Middlesex, England, UK","(police station interiors, Series 3-5)"
/title/tt0092379/,"Randolph Hotel, Beaumont Street, Oxford, Oxfordshire, England, UK",
/title/tt0092379/,"Wellington Place, High Street, Harefield, London, England, UK","(series 6, 7, 8: Thames Valley Police Headquarters)"
/title/tt1179056/,"John Hersey High School, Arlington Heights, Illinois, USA",(high school scenes)
/title/tt1179056/,"Chicago, Illinois, USA",
/title/tt1179056/,"Orland Park, Illinois, USA",
/title/tt1179056/,"City Methodist Church, Gary, Indiana, USA",
/title/tt1179056/,"California, USA",
/title/tt1179056/,"Lake Forest, Illinois, USA",
/title/tt1179056/,"Washington St & 6th Ave, Gary, Indiana, USA",
/title/tt1179056/,"Sherman Oaks, Los Angeles, California, USA",
/title/tt1179056/,USA,
/title/tt0118421/,"New York City, New York, USA",
/title/tt6257970/,"England, UK",
/title/tt9243946/,"501 11th Street NW, Albuquerque, New Mexico, USA",(Pinkman family home)
/title/tt4160708/,"2488 Buena Vista Street, Detroit, Michigan, USA",(exteriors only)
/title/tt8110640/,"Philadelphia, Pennsylvania, USA",(aerial exteriors)
/title/tt3799694/,"Atlanta, Georgia, USA",
/title/tt3799694/,"5335 Northside Drive NW, Atlanta, Georgia, USA",(Home of porn king Sid Shattuck)
/title/tt3799694/,"Cone St NW, Atlanta, Georgia, USA",(street scenes)
/title/tt3799694/,"S Figueroa St & W Jefferson Blvd, Los Angeles, California, USA",(street scenes)
/title/tt3799694/,"Department Of Water And Power - 111 N Hope Street, Los Angeles, California, USA",(March and Healy collect briefcase of money)
/title/tt3799694/,"Sunset Blvd & Horn Ave, Los Angeles, California, USA",(street scenes)
/title/tt3799694/,"Hollywood, Los Angeles, California, USA",
/title/tt3799694/,"Hilton Atlanta & Towers - 255 Courtland Street Northeast, Atlanta, Georgia, USA",
/title/tt3799694/,USA,
/title/tt3532216/,"Medellin, Colombia",
/title/tt3532216/,"New Orleans, Louisiana, USA",
/title/tt3532216/,Colombia,(Colombia) (Costa Rica) (Panama) (Nicaragua)
/title/tt3532216/,USA,
/title/tt3532216/,"Caquetá, Colombia",
/title/tt3532216/,"Georgia, USA",
/title/tt3532216/,"Candler Field, Williamson, Georgia, USA",(location)
/title/tt3532216/,"Ball Ground, Georgia, USA",(Gilmer Ferry Road. Ball Ground Ga 30107)
/title/tt0110475/,"Fire Station 23 - 225 E. 5th Street, Los Angeles, California, USA",(Ripley's Auto Finishing)
/title/tt0110475/,"City Hall - 14410 Sylvan Street, Van Nuys, Los Angeles, California, USA",(Police Station Exterior)
/title/tt0110475/,"Burbank, California, USA",
/title/tt0110475/,"Los Angeles, California, USA",
/title/tt0232500/,"San Bernardino International Airport - 294 S. Leland Norton Way, San Bernardino, California, USA",(Race Wars scenes at former Norton Air Force Base)
/title/tt0232500/,"Neptune's Net - 42505 Pacific Coast Highway, Malibu, California, USA",
/title/tt0232500/,"Echo Park, Los Angeles, California, USA",(Toretto Market & Misc exteriors)
/title/tt0232500/,"San Pedro, Los Angeles, California, USA",(Final race scenes between Brian & Dominic)
/title/tt0232500/,"Cha Cha Cha Restaurant, Silver Lake, Los Angeles, California, USA",(restaurant)
/title/tt0232500/,"1261 Angelo Drive, Beverly Hills, California, USA",
/title/tt0232500/,"Wilmington, Los Angeles, California, USA",
/title/tt0232500/,"Malibu, California, USA",
/title/tt0232500/,"Long Beach Harbor, Long Beach, California, USA",
/title/tt1618434/,Italy,
/title/tt1618434/,"Santa Margherita Ligure, Genoa, Liguria, Italy",(location)
/title/tt1618434/,"Milan, Lombardia, Italy",(street scenes)
/title/tt0112022/,"El Mirage Dry Lake, California, USA",
/title/tt0112022/,"Sydney, New South Wales, Australia",
/title/tt0112022/,"Big Bear Lake, Big Bear Valley, San Bernardino National Forest, California, USA",
/title/tt0112022/,"Long Beach City Hall - 333 W. Ocean Boulevard, Long Beach, California, USA",
/title/tt0112022/,"Santa Clarita Studios - 25135 Anza Drive, Santa Clarita, California, USA",
/title/tt0112022/,"Victorville, California, USA",
/title/tt1637727/,"The Bridge Studios, Burnaby, British Columbia, Canada",
/title/tt5164196/,"Safari Inn - 1911 W. Olive Avenue, Burbank, California, USA",(Cole's motel room)
/title/tt5164196/,"3816 Longridge Avenue, Van Nuys, California, USA",(Murtaugh's house - 1st season)
/title/tt5164196/,"Los Angeles, California, USA",
/title/tt0099674/,"Church of Santa Maria della Quercia, Viterbo, Italy",(Michael's confession to priest)
/title/tt0099674/,"Forza d'Agrò, Messina, Sicily, Italy",(as Corleone town)
/title/tt0099674/,"St. Peter's Basilica, Vatican City",
