Code,Show Name,Location,Scene
/title/tt1070874/,"Chicago, Illinois, USA",
/title/tt1070874/,"Illinois, USA",
/title/tt1070874/,"Patterson, New Jersey, USA","(Paterson, New Jersey, USA)"
/title/tt2306299/,Ireland,
/title/tt2306299/,"Prince, Ontario, Canada",
/title/tt2306299/,"Morroco, Africa",
/title/tt2306299/,Iceland,
/title/tt4786824/,South Africa,
/title/tt4786824/,"New Slains Castle, Cruden Bay, Aberdeenshire, Scotland, UK",(ruins exteriors - Season 1)
/title/tt4786824/,"Old Royal Naval College, Greenwich, London, England, UK",
/title/tt4786824/,"Lancaster House, The Mall, St. James's, London, England, UK",
/title/tt4786824/,"Blythe House, 23 Blythe Road, West Kensington, London, England, UK",(location)
/title/tt4786824/,"Loseley Park, Guildford, Surrey, England, UK",
/title/tt4786824/,"Chenies Manor House, Chenies, Buckinghamshire, England, UK",(Chartwell House)
/title/tt4786824/,"Liverpool, Merseyside, England, UK",(Series 4)
/title/tt4786824/,"Englefield House, Theale, Reading, Berkshire, England, UK",
/title/tt4786824/,"Stage 1, Elstree Studios, Borehamwood, Hertfordshire, England, UK",
/title/tt7435316/,"Udaipur, India",(on location)
/title/tt7549996/,"The Mildmay Club, Newington Green, London, England, UK",
/title/tt7549996/,"Noël Coward Theatre, St. Martin's Lane, Westminster, London, England, UK",(Exterior of the Talk of the Town nightclub)
/title/tt11656892/,"Crouch End, London, UK",(As Cranley Gardens house)
/title/tt11656892/,"HM Prison Holloway, Parkhurst Road, London, England, UK",(Early prison interiors)
/title/tt3833480/,"Nu Boyana Film Studios, Sofia, Bulgaria",
/title/tt3833480/,"Radomir, Bulgaria",(the camp)
/title/tt8503618/,"New York City, New York, USA",
/title/tt7366338/,"Kaunas, Lithuania",(as 6th Moscow clinical hospital)
/title/tt7366338/,"Ignalina, Lithuania",(as Chernobyl Nuclear Power Plant)
/title/tt7366338/,Lithuania,
/title/tt1983079/,"St. Joseph's Missionary College, Lawrence Street, Mill Hill, London, England, UK",(Nonnatus House: Series 1-2)
/title/tt1983079/,"London, England, UK",
/title/tt1983079/,"The Historic Dockyard Chatham, Main Gate Rd, Chatham ME4 4TZ, United Kingdom",
/title/tt1442449/,"Auckland, New Zealand",
/title/tt0185906/,"Ashdown Forest, East Sussex, England, UK",
/title/tt0185906/,"Hambleden, Buckinghamshire, England, UK",
/title/tt0108052/,"Most Pilsudskiego, Kraków, Malopolskie, Poland",
/title/tt0108052/,"Szeroka, Kraków, Malopolskie, Poland",
/title/tt0108052/,"Józefa, Kraków, Malopolskie, Poland",
/title/tt0108052/,Poland,
/title/tt6048922/,"Celtic Media Center, Baton Rouge, Louisiana, USA",
/title/tt0758790/,"Dublin Castle, Dublin, County Dublin, Ireland",
/title/tt0758790/,"Powerscourt Estate, Enniskerry, County Wicklow, Ireland",
/title/tt0758790/,"Dublin, County Dublin, Ireland",
/title/tt0758790/,Ireland,
/title/tt0758790/,"People's Gardens, Phoenix Park, Dublin, County Dublin, Ireland",
/title/tt7984766/,"Páty, Hungary",(location)
/title/tt7984766/,"Lincoln Cathedral, Lincoln, England, UK",
/title/tt7984766/,"Berkeley Castle, Berkeley Gloucestershire, England, UK",
/title/tt6924650/,"Hawaii, USA",
/title/tt5057130/,"Pienza, Siena, Tuscany, Italy",(Piccolomini Palace)
/title/tt5057130/,"Rome, Lazio, Italy",
/title/tt5057130/,"San Quirico d'Orcia, Siena, Tuscany, Italy",
/title/tt5057130/,"Bracciano, Rome, Lazio, Italy",(Odescalchi Castle)
/title/tt5057130/,"Caprarola, Viterbo, Lazio, Italy",(Villa Farnese)
/title/tt2235759/,"Hatfield House, Hatfield, Hertfordshire, England, UK",
/title/tt2235759/,"Belvoir Castle, Belvoir, Leicestershire, England, UK",
/title/tt2235759/,"Ham House, Richmond, Surrey, England, UK",
/title/tt2235759/,"St Clere Estate, Kent, England, UK",(Location)
/title/tt2235759/,"Hever, Kent, England, UK",
/title/tt2235759/,"London, England, UK",
/title/tt2235759/,"York, North Yorkshire, England, UK",
/title/tt2235759/,UK,
/title/tt0979432/,"Richmond Terrace, Staten Island, New York City, New York, USA",
/title/tt0979432/,"Staten Island, New York City, New York, USA",
/title/tt0979432/,"Woolworth Mansion, Glen Cove, Long Island, New York, USA",
/title/tt0979432/,"New York City, New York, USA",
/title/tt0979432/,"Ditmas Park, Brooklyn, New York City, New York, USA",
/title/tt0979432/,"Catalpa Avenue, Ridgewood, Queens, New York City, New York, USA",
/title/tt0979432/,"Bedford-Stuyvesant, Brooklyn, New York City, New York, USA",
/title/tt0979432/,"Vinegar Hill, Brooklyn, New York City, New York, USA",(Nucky and Margaret's home)
/title/tt0979432/,"Manhattan, New York City, New York, USA",
/title/tt0979432/,"Steiner Studios - 15 Washington Avenue, Brooklyn Navy Yard, Brooklyn, New York City, New York, USA",
/title/tt0979432/,"Nassau Street, Brooklyn, New York City, New York, USA",(Season 3)
/title/tt0979432/,"Brooklyn, New York City, New York, USA",
/title/tt0979432/,"Westchester Country Club, 99 Biltmore Lane, Rye, New York, USA",(on location)
/title/tt0979432/,"Stuyvesant Heights, Brooklyn, New York City, New York, USA",
/title/tt4846340/,"Morehouse College, Atlanta Georgia, USA",(Langley Research Center)
/title/tt4846340/,"Monroe, Georgia, USA",(Town used)
/title/tt4846340/,"Columbus, Georgia, USA",
/title/tt4846340/,"Norcross, Georgia, USA",
/title/tt4846340/,"Marietta, Georgia, USA",(Wind tunnel and hangar scenes)
/title/tt5013056/,Netherlands,
/title/tt5013056/,"Daedalus Airfield - Lee on the Solent, Hampshire, England, UK",(Flying and Model aircraft sequences)
/title/tt5013056/,"Point Vicente Interpretive Center and Lighthouse, Rancho Palos Verdes, California, USA",(explosion and gunfire sequences)
/title/tt5013056/,"Swanage Railway, Dorset, England, UK",(train station)
/title/tt5013056/,"IJsselmeer, Netherlands",(Moonstone scenes at sea)
/title/tt5013056/,"Rue des Fusillés, Dunkerque, Nord, France",(platoon running away from enemy fire)
/title/tt5013056/,UK,
/title/tt5013056/,France,
/title/tt9244556/,"Hamilton, Ontario, Canada",
/title/tt0332452/,"Cabo San Lucas, Baja California Sur, Mexico",
/title/tt0332452/,"Gozo Island, Malta",
/title/tt0332452/,"Blue Lagoon, Comino, Malta",
/title/tt0332452/,"Ealing Studios, Ealing, London, England, UK",
/title/tt0112573/,"Arizona, USA",(Impaling of horses in battle sequence)
/title/tt0112573/,"Ardmore Studios, Herbert Road, Bray, County Wicklow, Ireland",(studio)
/title/tt0112573/,"Coronation Plantation, County Wicklow, Ireland",
/title/tt0112573/,"Trim Castle, Trim, County Meath, Ireland",(York and London scenes)
/title/tt0112573/,"Bective Abbey, County Meath, Ireland",(London scenes)
/title/tt0112573/,"King John's Castle, Trim, County Meath, Ireland",
/title/tt0112573/,"Glen Coe, Highland, Scotland, UK",
/title/tt0112573/,"The Curragh, County Kildare, Ireland",
/title/tt0112573/,Ireland,
/title/tt0112573/,"Trim, County Meath, Ireland",
/title/tt0112573/,"Luggala Estate, County Wicklow, Ireland",
/title/tt0112573/,USA,
/title/tt1707386/,"Portsmouth, Hampshire, England, UK",
/title/tt1707386/,"Chatham Historic Dockyard, Chatham, Kent, England, UK",
/title/tt1707386/,"Boughton House, Kettering, Northamptonshire, England, UK",
/title/tt1707386/,"Winchester College, Winchester, Hampshire, England, UK",
/title/tt1707386/,"Ewelme, Oxfordshire, England, UK",
/title/tt1707386/,"Richard Attenborough Stage, Pinewood Studios, Iver Heath, Buckinghamshire, England, UK",
/title/tt1707386/,"Wolvesey Castle, Hampshire, England, UK",
/title/tt10244612/,"Schloss Drachenburg, Königswinter, North Rhine-Westphalia, Germany",
/title/tt10244612/,"Munich, Bavaria, Germany",
/title/tt10244612/,Czech Republic,
/title/tt8417308/,Spain,
/title/tt3636060/,"Chavenage House, Tetbury, Gloucestershire, England, UK",(Trenwith - Charles Poldark's Cornish family home)
/title/tt3636060/,"Porthgwarra, Land's End, Cornwall, England, UK",
/title/tt3636060/,"Charlestown Harbour, Charlestown, Cornwall, England, UK",
/title/tt3636060/,"High Street, Corsham, Wiltshire, England, UK",(street in Truro)
/title/tt3636060/,"St Breward, Cornwall, England, UK","(miners' cottages, Nampara house)"
/title/tt3636060/,"Corsham, Wiltshire, England, UK",
/title/tt3636060/,"Horton Court, Horton, Chipping Sodbury, South Gloucestershire, England, UK",(courtroom scenes)
/title/tt3636060/,"Prior Park College, Bath, Somerset, England, UK",
/title/tt3636060/,"Helston, Cornwall, England, UK",
/title/tt3636060/,"The Bottle Yard Studios, Whitchurch Lane, Bristol, England, UK",(studio)
/title/tt3636060/,"Pedn Vounder Beach, Cornwall, England, UK",
/title/tt3636060/,"Cornwall, England, UK",
/title/tt2119532/,"Pisgah National Forest, North Carolina, USA",(Waterfall is Looking Glass Falls)
/title/tt2119532/,"Camden, New South Wales, Australia",
/title/tt2119532/,"Centennial Park, Sydney, New South Wales, Australia",(Cemetery)
/title/tt2119532/,"Richmond, New South Wales, Australia",(Church and street outside of Cinema)
/title/tt2119532/,Australia,
/title/tt2119532/,USA,
/title/tt1663202/,"Canmore, Alberta, Canada",(Fort Kiowa)
/title/tt1663202/,"Libby, Montana, USA",(waterfall scene at Kootenai Falls)
/title/tt1663202/,"Kananaskis Country, Alberta, Canada",
/title/tt1663202/,"Drumheller, Alberta, Canada",(meteor falling from the sky)
/title/tt1663202/,"Burnaby, British Columbia, Canada",
/title/tt1663202/,"Sierra Madre Occidental, Mexico",
/title/tt1663202/,Argentina,
/title/tt1663202/,"Mammoth Studios, Burnaby, British Columbia, Canada",(studio)
/title/tt1663202/,Canada,
/title/tt1663202/,USA,
/title/tt0348914/,"Frazier Park, California, USA",
/title/tt0348914/,"Santa Clarita, California, USA",
/title/tt1213641/,"Lot108, Atlanta, Georgia, USA",
/title/tt1213641/,"Tyler Perry Studios, Atlanta, Georgia, USA",(studio)
/title/tt1213641/,"Georgia, USA",
/title/tt1596363/,"The Black Horse, Windmill Road, Fulmer, Buckinghamshire, England, UK",(exterior of English pub)
/title/tt1596363/,"Malibu, California, USA",(bathtub)
/title/tt1596363/,UK,
/title/tt0108358/,"Babocomari Ranch, Sonoita, Arizona, USA",
/title/tt0108358/,"Texas Canyon, Arizona, USA",
/title/tt0108358/,"Skeleton Canyon, Arizona, USA",
/title/tt0108358/,"Sonoran Desert, Arizona, USA",
/title/tt0108358/,"Empire Ranch, Sonoita, Arizona, USA",
/title/tt0108358/,"Las Cienegas National Conservation Area, Arizona, USA",
/title/tt0108358/,"Patagonia, Arizona, USA",
/title/tt0108358/,"Whetstone Mountains, Arizona, USA",
/title/tt0108358/,"Dragoon Mountains, Arizona, USA",
/title/tt0108358/,"Turkey Creek, Arizona, USA",
/title/tt0108358/,"Harshaw, Arizona, USA",
/title/tt0108358/,"St. David, Arizona, USA",
/title/tt0108358/,"Benson, Arizona, USA",
/title/tt0108358/,USA,
/title/tt2024544/,"Felicity Plantation, Vacherie, Louisiana, USA",(Epps' house Exteriors)
/title/tt2024544/,"St. Joseph Plantation, Louisiana, USA",
/title/tt2024544/,"New Orleans, Louisiana, USA",(as Saratoga)
/title/tt2024544/,"Urbania, Lower Garden District, New Orleans, Louisiana, USA",(Epps' House Interiors)
/title/tt2024544/,"Destrehan, Louisiana, USA",(Epps plantation barn)
/title/tt2024544/,"Louisiana, USA",
/title/tt9071322/,"Ohio, USA",
/title/tt9071322/,"Hamilton, Ohio, USA",(Parkersburg town and residential neighborhood)
/title/tt9071322/,"50 Tri County Parkway, Springdale, Ohio, USA",(Benihana restaurant)
/title/tt9071322/,"Haven Avenue, Hamilton, Ohio, USA",(girl with black teeth riding bike)
/title/tt9071322/,USA,
/title/tt0384766/,"Cinecittà Studios, Cinecittà, Rome, Lazio, Italy",(studio)
/title/tt4995776/,"Durban, KwaZulu-Natal, South Africa",
/title/tt4995776/,"Lüderitz, Namibia",
/title/tt0112384/,"Johnson Space Center - 2101 NASA Rd., Houston, Texas, USA",
/title/tt0112384/,"Merritt Island, Florida, USA",
/title/tt0112384/,"San Diego, California, USA",
/title/tt0112384/,"Stage 27, Universal Studios - 100 Universal City Plaza, Universal City, California, USA",(studio)
/title/tt0112384/,"Ambassador Hotel - 3400 Wilshire Boulevard, Los Angeles, California, USA",(apartments of Ken Mattingly and Jack Swigert)
/title/tt0112384/,"Falls Lake, Backlot, Universal Studios - 100 Universal City Plaza, Universal City, California, USA",
/title/tt5952634/,"Sale, Morocco",
/title/tt5952634/,"Fez, Fès-Boulemane, Morocco",
/title/tt5952634/,UK,
/title/tt5083738/,"Hampton Court Palace, East Molesey, England, UK",(Tudor kitchens)
/title/tt5083738/,"Danson House - Danson Park, Danson Road, Bexleyheath, England, UK",(Mud bath/Spa room and servants' quarters)
/title/tt5083738/,"Ashbridge, Hertfordshire, England, UK",
/title/tt5083738/,"England, UK",
/title/tt1649419/,"Alicante, Alicante, Comunidad Valenciana, Spain",
/title/tt1649419/,"Madrid, Spain",
/title/tt1649419/,"Barcelona, Catalonia, Spain",
/title/tt0187393/,"Cypress Gardens - 3030 Cypress Gardens Road, Moncks Corner, South Carolina, USA",(Old Spanish Mission Black Swamp Militia HQ)
/title/tt0187393/,"Brattonsville, South Carolina, USA",(Continental Encampment)
/title/tt0187393/,"Botany Bay Plantation - 7510 Botany Bay Road, Edisto Island, South Carolina, USA",
/title/tt0187393/,"Charleston, South Carolina, USA",
/title/tt0187393/,"Fort Lawn, South Carolina, USA",(King's Highway Skirmish)
/title/tt0187393/,"York, South Carolina, USA",
/title/tt0187393/,"Darby Farm, Chester, South Carolina, USA",
/title/tt2708480/,"Budapest, Hungary",(studio) (studio and location)
/title/tt2708480/,Hungary,
/title/tt2708480/,"British Columbia, Canada",(Season 2)
/title/tt2328900/,"Aviemore, CairnGorm National Park, Scotland, UK",(on location)
/title/tt2328900/,"Hardwick Hall, Derbyshire, England, UK",
/title/tt2328900/,"Derbyshire, England, UK",
/title/tt2328900/,"Blackness Castle, Blackness, West Lothian, Scotland, UK",(Scenes outside Holyrood House)
/title/tt2328900/,"Pinewood Studios, Iver Heath, Buckinghamshire, England, UK",(studio)
/title/tt2328900/,"Chiltern Open Air Museum, Buckinghamshire, Newland Park, Gorelands Ln, Chalfont St Peter, Chalfont Saint Giles HP8 4AB, United Kingdom",(The barn where the Queens meet)
/title/tt2328900/,UK,
/title/tt2328900/,"England, UK",
/title/tt2328900/,"The Inner Courtyard, Penshurst Place, Penshurst, Tonbridge, Kent, England, UK",(The procession of spectators waiting to witness Queen Mary's execution)
/title/tt2328900/,"Poldullie Bridge, Strathdon, Upper Donside, Scotland, UK",(the Queen is ambushed)
/title/tt0043949/,"Cinecittà Studios, Cinecittà, Rome, Lazio, Italy","(studio) (studio: produced at Cinecitta Studios, Rome, Italy)"
/title/tt4320258/,"Istanbul, Turkey",
/title/tt0422720/,"Opéra National de Paris Palais Garnier, 8 rue Scribe, Paris 9, Paris, France",(masquerade ball held in the Paris Opera)
/title/tt0422720/,"Vaux-le-Vicomte, Seine-et-Marne, France",
/title/tt0422720/,"Château de Chantilly, Chantilly, Oise, France",
/title/tt0422720/,"Lycee Hoche, Versailles, Yvelines, France",
/title/tt0422720/,"Pinewood Studios, Iver Heath, Buckinghamshire, England, UK",(studio)
/title/tt0422720/,"The Hall of Mirrors, Château de Versailles, Place d'Armes, Versailles, Yvelines, France",(ball scene for the wedding of Marie-Antoinette and Louis XVI)
/title/tt0422720/,"Petit Trianon, Château de Versailles, Place d'Armes, Versailles, Yvelines, France",
/title/tt0422720/,"Basildon Park, Lower Basildon, Reading RG8 9NR, United Kingdom",
/title/tt0086879/,"Kromeríz, Czech Republic",(castle scenes)
/title/tt0086879/,"Wien Südbahnhof - Wiedner Gürtel 1, Favoriten, Vienna, Austria",
/title/tt0086879/,"Hradcanske Námestí, Hradcany, Prague, Czech Republic",(exteriors: Mozart's house)
/title/tt0086879/,"Estates Theatre, Ovocný trh 1, Old Town, Prague, Czech Republic",(Estates Theatre - The Marriage of Figaro conducted by Mozart)
/title/tt0086879/,"Old Town, Prague, Czech Republic",(18th Century Vienna)
/title/tt0086879/,"St Giles' Church, Husova Street, Old Town, Prague, Czech Republic",(Mozart's wedding)
/title/tt0086879/,"Maltese Square, Malá Strana, Prague, Czech Republic",
/title/tt0086879/,Czech Republic,
/title/tt0086879/,Austria,
/title/tt0086879/,"Château de Guermantes, Seine-et-Marne, France",
/title/tt0086879/,France,
/title/tt1509767/,"Castle Herrenchiemsee, Herrenchiemsee, Bavaria, Germany",
/title/tt1509767/,"Bamberg, Bavaria, Germany",
/title/tt1509767/,"Burghausen, Bavaria, Germany",
/title/tt1509767/,"Munich, Bavaria, Germany",
/title/tt5137338/,"Raby Castle, Durham, County Durham, England, UK",
/title/tt5137338/,"Wentworth Woodhouse, Wentworth, Rotherham, South Yorkshire, England, UK",
/title/tt5137338/,"Bramham Park, Bramham, Wetherby, Leeds, West Yorkshire, England, UK",
/title/tt5137338/,"Newby Hall, Skelton on Ure, North Yorkshire, England, UK",
/title/tt5137338/,"Carlton Towers, Selby, North Yorkshire, England, UK",
/title/tt5137338/,"Beverley Minster, Beverley, East Riding of Yorkshire, England, UK",
/title/tt5137338/,"Windsor Castle, Windsor, Berkshire, England, UK",(exteriors - CGI)
/title/tt5137338/,"Church Fenton Studios, Busk Lane, Church Fenton, Tadcaster, North Yorkshire, England, UK",(studio) (studio - Buckingham Palace interiors)
/title/tt5137338/,"Loughborough, Leicestershire, England, UK",
/title/tt5137338/,"Bradford, West Yorkshire, England, UK",
/title/tt1790885/,"Gdansk, Pomorskie, Poland",
/title/tt1790885/,"Patiala, Punjab, India",(market scenes)
/title/tt1790885/,"London, England, UK","(London and Washington, DC scenes)"
/title/tt1790885/,"Pinjore Gardens, Pinjore, Haryana, India",(Abu Faraj arrested)
/title/tt0320661/,"Loarre, Huesca, Aragón, Spain",
/title/tt0320661/,Morocco,
/title/tt0320661/,"Palma del Río, Córdoba, Andalucía, Spain",
/title/tt0320661/,"Alcázar of Sevilla, Sevilla, Spain",
/title/tt0320661/,"Segovia, Castilla y León, Spain",
/title/tt0097441/,"Jekyll Island, Georgia, USA",
/title/tt0097441/,"McDonough, Georgia, USA",
/title/tt0097441/,"African-American National Historic Site - 14 Beacon Street, Boston, Massachusetts, USA",
/title/tt2189461/,"Vysoké Tatry, Slovakia",(Slovakia)
/title/tt2189461/,"Pinewood Iskandar Malaysia Studios, Nusajaya, Malaysia",(studio)
/title/tt0031381/,"Georgia, USA",(title scenes)
/title/tt0031381/,"Bidwell Park - Manzanita Avenue, Chico, California, USA",(shantytown attack)
/title/tt0031381/,"Busch Gardens - S. Grove Avenue, Pasadena, California, USA",(Twelve Oaks gardens during barbecue)
/title/tt0031381/,"Chico, California, USA",(Gerald O'Hara's first ride - Tara cottonfields)
/title/tt0031381/,"Pasadena, California, USA",(Twelve Oaks' gardens)
/title/tt0031381/,"Simi Valley, California, USA",(Tara cottonfields - Gerald O'Hara's last ride)
/title/tt0031381/,"Selznick International Studios - 9336 W. Washington Blvd., Culver City, California, USA",(Twelve Oaks Mansion exterior establishing shot/most interiors of film)
/title/tt0031381/,"Arroyo Boulevard, Pasadena, California, USA",(Twelve Oaks' gardens)
/title/tt0031381/,"Reuss Ranch, Malibu Lake, California, USA",(Gerald O'Hara's walk with Scarlett)
/title/tt0031381/,"Paradise, California, USA",
/title/tt0031381/,"Metro-Goldwyn-Mayer Studios - 10202 W. Washington Blvd., Culver City, California, USA",(Rhett teaching Bonnie to ride pony & Bonnie's last ride)
/title/tt0031381/,"Agoura Hills, California, USA",
/title/tt0031381/,"Woodland Hills, Los Angeles, California, USA",
/title/tt0031381/,"West Hills, Los Angeles, California, USA",(Tara cottonfields - Gerald O'Hara's last ride)
/title/tt0031381/,"Los Angeles, California, USA",
/title/tt0265086/,"Kénitra Airbase, Morocco",
/title/tt0265086/,"Sale, Morocco",
/title/tt0443272/,"Executive Mansion, Capitol Square - Ninth & Grace Streets, Richmond Virginia, USA",(White House interiors)
/title/tt0443272/,"Virginia Rep Center - 114 W. Broad Street, Richmond, Virginia, USA",(theater scenes)
/title/tt0443272/,"Maymont - 2201 Shields Lake Drive, Richmond, Virginia, USA",(Appomattox scenes; President and First Lady's carriage ride)
/title/tt0443272/,"AMF Headquarters, 8100 AMF Drive, Mechanicsville, Mechanicsville, Virginia, USA",(White House interiors)
/title/tt0443272/,"Old Towne Petersburg Farmer's Market - River Street, Petersburg, Virginia, USA",(Grant's Headquarters interiors)
/title/tt0443272/,"South Side Railroad Depot - Rock and River Streets, Petersburg, Virginia, USA",(hospital and restaurant interiors)
/title/tt0443272/,"407 Cockade Alley, Petersburg, Virginia, USA",(scene of argument leading to gunfire)
/title/tt0443272/,"New Millennium Studios - One New Millennium Drive, Petersburg, Virginia, USA",
/title/tt0443272/,"Richmond, Virginia, USA",
/title/tt1390411/,"Lanzarote, Canary Islands, Spain",
/title/tt1390411/,Spain,
/title/tt1390411/,"Leavesden Studios, Leavesden, Hertfordshire, England, UK",(Tank)
/title/tt4172430/,"Mosta, Malta",
/title/tt4172430/,"National Hockey Center, Paola, Malta",
/title/tt2543328/,"Powhatan, Virginia, USA",
/title/tt2543328/,"Richmond, Virginia, USA",
/title/tt2543328/,"Scotchtown - 16120 Chiswell Lane, Beaverdam, Virginia, USA",
/title/tt2543328/,"Kittiewan Plantation - 12104 Weyanoke Road, Charles City, Virginia, USA",
/title/tt0824747/,"Los Angeles City Hall - 200 North Spring Street, Downtown, Los Angeles, California, USA",(exteriors: Los Angeles City Hall)
/title/tt0824747/,"San Dimas, California, USA",
/title/tt0824747/,"Daniel Webster Elementary School - 2101 E. Washington Boulevard, Pasadena, California, USA",(Walter's school)
/title/tt0824747/,"Los Angeles, California, USA",
/title/tt0824747/,"Park Plaza Hotel - 607 S. Park View Street, Los Angeles, California, USA",(interiors: Los Angeles City Hall)
/title/tt0824747/,"Long Beach, California, USA",
/title/tt4686698/,"Louisbourg, Nova Scotia, Canada",(CBC)
/title/tt4686698/,"Morrisburg, Ontario, Canada",(CBC)
/title/tt8000908/,"Scotland, UK",
/title/tt1860357/,"Bristow Galliano Heliport, Galliano, Louisiana, USA",(on location)
/title/tt0363163/,"Berlin, Germany",
/title/tt0363163/,Russia,
/title/tt0363163/,Germany,
/title/tt0116743/,"Jaipur, Rajasthan, India",
/title/tt0443680/,"Winnipeg, Manitoba, Canada",(Rural Shots)
/title/tt0443680/,"Heritage Park, Calgary, Alberta, Canada",(Baron's Snooker Parlour)
/title/tt0443680/,"Burton Cummings Theatre, Winnipeg, Manitoba, Canada",
/title/tt0443680/,"Hidden Hills, California, USA",
/title/tt0443680/,"Winnipeg, Manitoba, Canada",
/title/tt2076298/,"University of Liverpool, Liverpool, Merseyside, England, UK",(United State Department of Justice entrance scene)
/title/tt2076298/,"Church Fenton Studios, Busk Lane, Church Fenton, Tadcaster, North Yorkshire, England, UK",(Marine Base)
/title/tt2076298/,"Crosby Beach, Crosby, Liverpool, Merseyside, England, UK",(San Francisco Exteriors)
/title/tt4572514/,"Boston, Massachusetts, USA",
/title/tt4572514/,"Massachusetts Institute of Technology - 77 Massachusetts Avenue, Cambridge, Massachusetts, USA",
/title/tt4572514/,"1 Technology Drive, Peabody, Massachusetts, USA",
/title/tt4572514/,"Naval Air Station South Weymouth - Weymouth, Massachusetts, USA",(Boylston Street in Boston)
/title/tt4572514/,"Watertown, Massachusetts, USA","(Sgt. Pugliese's house, Dunkin Donuts, and Watertown Police Department, Mobil Gas Station where Dun Meng escapes and calls the police in the film, unlike the actual version)"
/title/tt4572514/,"Lasell College, Rosen Auditorium, 1844 Commonwealth Avenue, Newton, Massachusetts, USA",(David M.)
/title/tt4572514/,"45 Pleasant St. Malden, Massachusetts, USA",(Hugh O'Neill's bar where Patrick & Jessica watch marathon)
/title/tt4572514/,"256 Highland Ave. Malden, Massachusetts, USA",(China Garden Restaurant)
/title/tt4572514/,"Malden, Massachusetts, USA",(Patrick & Jessica's apartment-interior)
/title/tt4572514/,"Doyle's Pub - 3484 Washington Street, Jamaica Plain, Boston, Massachusetts, USA",(police celebration ca. 1: 57: 00)
/title/tt5461944/,"Mumbai, Maharashtra, India",
/title/tt5461944/,"St. Xavier's College, Mumbai, India",(exterior: hotel rescue scene)
/title/tt6679794/,"Doune Castle, Doune, Stirling, Scotland, UK",(Village)
/title/tt6679794/,"Craigmillar Castle, Craigmillar, Edinburgh, Scotland, UK",
/title/tt6679794/,"Talisker, Isle of Skye, Scotland, UK",
/title/tt6679794/,"Quiraing, Isle of Skye, Scotland, UK",
/title/tt6679794/,"Stirling, Scotland, UK",
/title/tt6679794/,"Glencoe, Highland, Scotland, UK",
/title/tt6679794/,"St Michael's Parish Church, Linlithgow, Scotland, UK",
/title/tt6679794/,"Seacliff Beach, East Lothian",(location)
/title/tt6679794/,"Blackness Castle, Blackness, West Lothian, Scotland, UK",(on location)
/title/tt6679794/,UK,
/title/tt0215750/,"Kavallerieschule Kaserne Krampnitz, Potsdam, Brandenburg, Germany",
/title/tt0215750/,"Babelsberg, Potsdam, Brandenburg, Germany",
/title/tt0402399/,"Hatfield House, Hatfield, Hertfordshire, England, UK",
/title/tt0402399/,"Charlestown, Cornwall, England, UK",(arrival in england)
/title/tt0402399/,"Bodleian Library, Broad Street, Oxford, Oxfordshire, England, UK",
/title/tt0402399/,"Hatfield, Hertfordshire, England, UK",
/title/tt0402399/,"England, UK",
/title/tt4648786/,"Richmond, Virginia, USA",
/title/tt4648786/,"Cumberland, Virginia, USA",
/title/tt4648786/,"Hanover, Virginia, USA",
/title/tt4648786/,"Berkeley Plantation - 12602 Harrison Landing Road, Charles City, Virginia, USA",
/title/tt5390504/,"Brockton, Massachusetts, USA",
/title/tt5390504/,"Lawrence, Massachusetts, USA",
/title/tt5390504/,"Dorchester, Boston, Massachusetts, USA",
/title/tt5390504/,USA,
/title/tt5390504/,"Broadway Inn, 551 Broadway Malden, Massachusetts, USA",(Algiers Motel)
/title/tt0408306/,Hungary,
/title/tt0408306/,Malta,
/title/tt0408306/,"Marriott Budapest Hotel, Budapest, Hungary",(London hotel bar and lobby)
/title/tt0408306/,"Tököl Airport, Szigetszentmiklós, Hungary",(Fürstenfeldbruck Airport)
