Code,Show Name,Location,Scene
/title/tt0115988/,"""Old"" United Shoe Factory - 181 Elliott Street, Beverly, Massachusetts, USA",
/title/tt0115988/,"Hog Island, Ipswich, Massachusetts, USA",
/title/tt0469641/,"Clifton, New Jersey, USA",
/title/tt0469641/,"Marina del Rey, California, USA",(World Trade Center set)
/title/tt0469641/,"Port Authority Bus Terminal, Manhattan, New York City, New York, USA",(interiors)
/title/tt0469641/,"New York City, New York, USA",
/title/tt0469641/,"Playa Vista, California, USA",
/title/tt1057500/,"Robben Island, Cape Town, Western Cape, South Africa",
/title/tt1057500/,South Africa,
/title/tt1186830/,"Fort Ricasoli, Kalkara, Malta",
/title/tt1186830/,"Mdina, Malta",
/title/tt1247690/,Czech Republic,
/title/tt1247690/,Denmark,
/title/tt0107007/,"Gettysburg, Pennsylvania, USA",
/title/tt0107007/,"Cashtown Inn - 1325 Old Route 30, Cashtown, Pennsylvania, USA",
/title/tt0107007/,"Adams County, Pennsylvania, USA",
/title/tt1672189/,"Kilruddery House, Bray, County Wicklow, Ireland",(woods and village)
/title/tt1672189/,"Wicklow Mountains, Ireland",
/title/tt1672189/,"Brittas Bay, County Wicklow, Ireland",
/title/tt1672189/,"Luggala Estate, County Wicklow, Ireland",
/title/tt0379725/,"Malibu, California, USA",(seaside villa in Spain)
/title/tt0379725/,"Manitoba, Canada",(shot on location in)
/title/tt0379725/,"Manitoba Legislative Building, Winnipeg, Manitoba, Canada",(as the Finney County Courthouse)
/title/tt0075572/,"St. Simons Island, Georgia, USA",
/title/tt0075572/,USA,
/title/tt0075572/,"Los Angeles County Arboretum & Botanic Garden - 301 N. Baldwin Avenue, Arcadia, California, USA",
/title/tt0075572/,"Georgia, USA",
/title/tt5320412/,"Icheon, Gyeonggi Province, South Korea",(Lake scenes)
/title/tt5320412/,"Naju Image Theme Park, Gongsan-myeon, Naju, Jeollanam, South Korea",(Rain ritual and palace scenes)
/title/tt5320412/,"Unjusa Temple, Hwasun County, South Jeolla, South Korea",
/title/tt5320412/,"Saseongam Hermitage, Mount Osan, Gurye County, South Korea",(Lair of the assassins)
/title/tt5320412/,"Seyeonjeong Pavilion, Bogil island, Jeollanam, South Korea",(palace scenes)
/title/tt5320412/,"Miryang lake, Miryang, South Korea",(The secret lake house meeting place of Wang So and Hae Soo)
/title/tt5320412/,"Seon-gyojang residence, Gangneung, Gangwon, South Korea",(palace scenes)
/title/tt0436697/,"Waddesdon Manor, Waddesdon, Buckinghamshire, England, UK",(fountain garden scene)
/title/tt0436697/,"Buckingham Palace, Westminster, London, England, UK",
/title/tt0436697/,"Tunnel du Pont de l'Alma, Paris 8, Paris, France",
/title/tt0436697/,"Glenfeshie Estate, Kincraig, Highland, Scotland, UK",
/title/tt0436697/,"Place de la Concorde, Paris 8, Paris, France",
/title/tt0436697/,"Hôtel Intercontinental - 2 Rue de Castiglione, Paris 1, Paris, France",
/title/tt0436697/,"London, England, UK",
/title/tt0056197/,"Château de Chantilly, Chantilly, Oise, France",(Kommandantur scenes)
/title/tt0056197/,"Sainte-Mère-Eglise, Manche, France",(parachutists landing in the village)
/title/tt0056197/,"Plage de Saleccia, Saint-Florent, Haute-Corse, France",
/title/tt0056197/,"Rivedoux-Plage, Ile de Ré, Charente-Maritime, France",(mayor celebrating with a champagne bottle)
/title/tt0056197/,"La Rochelle, Charente-Maritime, France",
/title/tt0056197/,"Plage de Lotu, Saint-Florent, Haute-Corse, France",
/title/tt0056197/,"Orne, France",
/title/tt0056197/,France,
/title/tt0146309/,"Biltmore Hotel - 506 S. Grand Avenue, Downtown, Los Angeles, California, USA",
/title/tt0146309/,"Washington, District of Columbia, USA",
/title/tt0146309/,"Los Angeles, California, USA",
/title/tt0146309/,"Newport, Rhode Island, USA",
/title/tt3300980/,"Målselv, Troms, Norway",
/title/tt3300980/,"Sommarøy, Troms, Norway",
/title/tt2177771/,"IWM Duxford, Cambridgeshire, England, UK",(ex RAF Duxford)
/title/tt2177771/,"Halberstadt, Saxony-Anhalt, Germany",(church)
/title/tt2177771/,"Neuschwanstein Castle, Hohenschwangau, Schwangau, Bavaria, Germany",(The castle where the art is stored)
/title/tt2177771/,"Osterwieck, Saxony-Anhalt, Germany",
/title/tt2177771/,"Clausthal-Zellerfeld, Lower Saxony, Germany",(Mine scene)
/title/tt2177771/,"Duxford Imperial War Museum, Cambridgeshire, England, UK",
/title/tt2177771/,"Bad Grund, Lower Saxony, Germany","(Grube Hilfe Gottes as Altaussee Salt Mine, Wiemannsbuchtschacht as Merkers Salt Mine)"
/title/tt2177771/,"Berlin, Germany",
/title/tt2177771/,"Neue Wache, Unter den Linden, Berlin, Germany",(Nazi convoy in Paris)
/title/tt6938856/,"Oxfordshire, England, UK",
/title/tt6938856/,"London, England, UK",(Westminster and London exteriors)
/title/tt3077214/,"Windsor, Berkshire, England, UK",
/title/tt3077214/,"Houses of Parliament, Westminster, London, England, UK",(Maud testifies before Lloyd George)
/title/tt3077214/,"Myddelton Square, London, England, UK",
/title/tt3077214/,"London, England, UK",
/title/tt3077214/,"Chatham, Kent, England, UK",
/title/tt3077214/,UK,
/title/tt7439064/,"Kyiv, Ukraine",
/title/tt0455590/,Uganda,
/title/tt0046889/,"Ladybower Reservoir, Peak District National Park, Derbyshire, England, UK",(aerial shots)
/title/tt0046889/,"Howden Reservoir, Peak District National Park, Derbyshire, England, UK",
/title/tt0046889/,"RAF Scampton, Lincolnshire, England, UK",(Exterior Airfield shots)
/title/tt0046889/,"King's Lynn, Norfolk, England, UK",(Dutch Coast)
/title/tt0046889/,"Weymouth, Dorset, England, UK",
/title/tt1985443/,"Brasov, Romania",
/title/tt1985443/,"Rasnov, Romania",
/title/tt1985443/,"Transylvania, Romania",
/title/tt1985443/,Romania,
/title/tt4951982/,Norway,
/title/tt4951982/,"Egmontstraat 5, Brussels, Belgium",
/title/tt4951982/,"Palace, Markt, Deinze, Belgium",(Press conference room)
/title/tt4951982/,"Brest, Finistère, France",
/title/tt4951982/,France,
/title/tt3169706/,"Onllwyn, Powys, Wales",(they filmed in the town they helped)
/title/tt3169706/,"Kingsgate Road, West Hampstead, London, England, UK","(Marchmont Street, including Gay's the Word bookshop)"
/title/tt3169706/,"Slough, Berkshire, England, UK",
/title/tt3169706/,"London, England, UK",
/title/tt0004972/,"Forest Lawn Hollywood Hills - 6300 Forest Lawn Drive, Hollywood Hills, Los Angeles, California, USA",
/title/tt0004972/,"Whittier, California, USA",
/title/tt0004972/,"Burbank, California, USA",
/title/tt0004972/,"Fullerton, California, USA",
/title/tt0004972/,"San Fernando Valley, Los Angeles, California, USA",(Battle of Gettysburg)
/title/tt0004972/,"Forest Lawn Drive, Burbank, California, USA",
/title/tt0004972/,"Big Bear Lake, Big Bear Valley, San Bernardino National Forest, California, USA",
/title/tt0004972/,"Antelope Valley, California, USA",
/title/tt0498380/,"Sandvík, Iceland",(black beaches)
/title/tt0498380/,"Odessa Canyon, Yermo, California, USA",
/title/tt0498380/,Iceland,
/title/tt0498380/,Japan,
/title/tt0498380/,USA,
/title/tt9784798/,"Mansfield Reformatory - 100 Reformatory Road, Mansfield, Ohio, USA",
/title/tt0870111/,"San Clemente, California, USA",(Nixon compound)
/title/tt0870111/,"Beverly Hilton Hotel - 9876 Wilshire Blvd., Beverly Hills, California, USA",
/title/tt0870111/,"Huntington Beach, California, USA",
/title/tt0475276/,"Boston, Massachusetts, USA",
/title/tt0475276/,"Newark Liberty International Airport - 10 Toler Place, Newark, New Jersey, USA",
/title/tt0475276/,"Pinewood Studios, Iver Heath, Buckinghamshire, England, UK",
/title/tt2638144/,"Cinecittà Studios, Cinecittà, Rome, Lazio, Italy",
/title/tt2638144/,"Painted Canyons, Mecca Hills, California, USA",(2nd Unit Filming Location)
/title/tt6864046/,"Beijing, China",
/title/tt5816682/,"Cairngorms, Highland, Scotland, UK",
/title/tt5816682/,"Knebworth House, Knebworth, Hertfordshire, England, UK",(interior scenes: Windsor Castle and Balmoral Castle)
/title/tt5816682/,"Ham House, Richmond, Surrey, England, UK",
/title/tt5816682/,"West Wycombe House, West Wycombe Park, West Wycombe, Buckinghamshire, England, UK",
/title/tt5816682/,"Delhi, India",
/title/tt5816682/,"Chatham Historic Dockyard, Chatham, Kent, England, UK",(location)
/title/tt5816682/,"Gorhambury House, St Albans, Hertfordshire, England, UK",(location)
/title/tt5816682/,"Glenfeshie Estate, Kincraig, Highland, Scotland, UK",(location)
/title/tt0418689/,"Iwo Jima, Japan",
/title/tt0418689/,"Soldier Field - 1410 South Museum Campus Drive, Chicago, Illinois, USA",(Bond rally)
/title/tt0418689/,"Krueger Funeral Home - 13050 S. Greenwood Avenue, Blue Island, Illinois, USA",
/title/tt0418689/,"Chicago, Illinois, USA",
/title/tt0418689/,"S.S. Lane Victory, Pier 94, San Pedro, Los Angeles, California, USA",
/title/tt0418689/,"Washington, District of Columbia, USA",
/title/tt0418689/,"Los Angeles City Hall - 200 North Spring Street, Downtown, Los Angeles, California, USA",(building in Baltimore)
/title/tt0418689/,"Glencoe Metra Station - Park & Greenbay, Glencoe, Illinois, USA",(Rene Gagnon steps off the train)
/title/tt0418689/,"400 Richmond Road, Kenilworth, Illinois, USA",(Greyhound Bus Station)
/title/tt0418689/,"1611 Milan Avenue, South Pasadena, California, USA",(Bradley Residence)
/title/tt0418689/,"1842 Oxley Street, South Pasadena, California, USA",(Gagnon Residence)
/title/tt7243884/,"Vilnius, Lithuania",
/title/tt0308055/,"Biltmore Hotel - 506 S. Grand Avenue, Downtown, Los Angeles, California, USA",
/title/tt0308055/,"Los Angeles, California, USA",
/title/tt0962736/,"Ham House, Richmond, Surrey, England, UK",(Kensington Palace)
/title/tt0962736/,"Blenheim Palace, Woodstock, Oxfordshire, England, UK","(palace of King Leopold of Belgium, interiors; East Front of Buckingham Palace and Buckingham Palace courtyard and gardens)"
/title/tt0962736/,"Hampton Court Palace, East Molesey, Surrey, England, UK",
/title/tt0962736/,"Balls Park, Hertford, Hertfordshire, England, UK",(first council meeting; Victoria's bedroom at Kensington Palace and dining room scenes)
/title/tt0962736/,"Oxford, Oxfordshire, England, UK",
/title/tt0962736/,"Westminster Abbey, Westminster, London, England, UK",
/title/tt0962736/,"Haileybury and Imperial Service College, Hertford, Hertfordshire, UK",(Houses of Parliament)
/title/tt0962736/,"The Elizabeth Saloon, Belvoir Castle, Belvoir, Grantham, Leicestershire, UK",(Buckingham Palace quarters of The Duchess of Kent and Sir John)
/title/tt0962736/,"The Regents Gallery, Belvoir Castle, Belvoir, Grantham, Leicestershire, UK",(Victoria awaits her coronation)
/title/tt0962736/,"The Tapestry Room, Belvoir Castle, Belvoir, Grantham, Leicestershire, UK",(Victoria's bedroom in Buckingham Palace)
/title/tt0962736/,"Great Hall, Ham House, Ham Street, Richmond-upon-Thames, UK",(Kensington Palace)
/title/tt0962736/,"Gardens, Hampton Court Palace, East Molesey, London, England, UK",(Melbourne and Victoria discuss his successor)
/title/tt0962736/,"The Novello Theatre, Aldwych, London, England, UK",(opera house interior)
/title/tt0962736/,"Woodstock Library, Fletchers House, Park St, Woodstock OX20 1SN, UK",(King Leopold's library)
/title/tt0962736/,"Wilton House, Wilton, Salisbury SP2 0BJ, UK",(Duke of Wellington demonstrates the yo-yo)
/title/tt0962736/,"G Stage, Shepperton Studios, Shepperton, Surrey, England, UK",
/title/tt0962736/,"K Stage, Shepperton Studios, Shepperton, Surrey, England, UK",
/title/tt0962736/,"Lancaster House, The Mall, St. James's, London, England, UK",(Doubling for the Buckingham Palace coronation ball)
/title/tt0962736/,"Osterley Park House, Isleworth, Middlesex, England, UK",(Victoria's sitting room and ante room in Buckingham Palace)
/title/tt0962736/,"Wilton House, Wilton, Salisbury, Wiltshire, England, UK",(Rosenau Castle and Prince Albert's Coburg. The interiors are seen as Buckingham Palace)
/title/tt10937004/,"Gravina, Italy",
/title/tt10937004/,"Anzio, Rome, Lazio, Italy",
/title/tt10937004/,Morocco,
/title/tt10937004/,"Oasis Studios Morocco, Commune de Tarmigt, Ouarzazate, Morocco",
/title/tt0065622/,"Amalfi, Salerno, Campania, Italy",
/title/tt0065622/,"Loire Valley, Maine-et-Loire, France",
/title/tt0065622/,"Caserta Vecchia, Caserta, Campania, Italy",(story of Peronella hiding her lover in a jar)
/title/tt0065622/,"Nepi, Viterbo, Lazio, Italy",
/title/tt0065622/,"Rome, Lazio, Italy",
/title/tt0065622/,"Sorrento, Naples, Campania, Italy",
/title/tt0060107/,"Church of the Holy Trinity, Trinity Lavra of St. Sergius Monastery, Sergiyev Posad, Russia",
/title/tt0060107/,"Trinity Lavra of St. Sergius Monastery, Sergiyev Posad, Russia",
/title/tt0060107/,"Sergiyev Posad, Russia",(Zagorsk)
/title/tt0060107/,"Suzdal, Vladimir province, Russia",
/title/tt1619029/,"Easton Newman Field Airport, Maryland, USA",(Jackie exiting the plane)
/title/tt1619029/,"Tred Avon Manor, Royal Oak, Maryland, USA",(Family Summer Home)
/title/tt1619029/,"US-40, Baltimore, Maryland, USA",(JFK's limo escape route after shooting)
/title/tt1619029/,"Washington, District of Columbia, USA",
/title/tt1619029/,France,
/title/tt1619029/,"14th Street, Washington, District of Columbia, USA",(funeral procession)
/title/tt1536048/,"Cap d'Antibes, Antibes, Alpes-Maritimes, France",
/title/tt1536048/,"Hughenden Manor, Buckinghamshire, England, UK",
/title/tt1536048/,"Trafalgar Square, St James's, London, England, UK",
/title/tt1536048/,"Kensington, London, England, UK",
/title/tt1536048/,"Portofino, Genoa, Liguria, Italy",
/title/tt1536048/,"Waterloo, London, England, UK",
/title/tt1536048/,"New York City, New York, USA",
/title/tt1536048/,France,
/title/tt1536048/,Italy,
/title/tt2404425/,"Shoreham Airport, Shoreham-by-Sea, West Sussex, England, UK",
/title/tt2404425/,"Blythe House, 23 Blythe Road, West Kensington, London, England, UK",(interior)
/title/tt2404425/,"Viennese Giant Ferris Wheel, Riesenplatz 1, Vienna, Austria",
/title/tt2404425/,"Culver City, California, USA",
/title/tt2404425/,"City Hall, Vienna, Austria",
/title/tt2404425/,"Hotel Sacher, Philharmonikerstrasse 4, Vienna, Austria",
/title/tt2404425/,"Rooseveltplatz, Vienna, Austria",
/title/tt2404425/,"Hemel Hempstead, Hertfordshire, England, UK",(interiors of Schoenberg's LA law offices)
/title/tt2404425/,"Wandsworth Town Hall, Wandsworth High Street, Wandsworth, London, England, UK",(interior scenes at the Austrian Ministry of Culture)
/title/tt2404425/,"San Fernando Valley, Los Angeles, California, USA",
/title/tt2404425/,"Semperdepot, Vienna, Austria",
/title/tt2404425/,"Vienna State Opera, Opernring 2, Vienna, Austria",
/title/tt2404425/,"St. Ulrichsplatz, Vienna, Austria",
/title/tt2404425/,"Los Angeles, California, USA",
/title/tt2404425/,USA,
/title/tt2404425/,"Glenville, Los Angeles, California, USA",
/title/tt2404425/,"Norm's Restaurant - 11001 West Pico Boulevard - Los Angeles, California, USA",
/title/tt1276419/,"Prague, Czech Republic",(street scenes)
/title/tt1276419/,"Doksany, Czech Republic",
/title/tt1276419/,"Barrandov Studios, Prague, Czech Republic",
/title/tt1276419/,Czech Republic,
/title/tt1276419/,Denmark,
/title/tt0892255/,Mexico,
/title/tt0892255/,"United Nations - First Avenue at 46th Street, Manhattan, New York City, New York, USA",
/title/tt1441953/,"North Yorkshire Moors Railway, 12 Park Street, Pickering, North Yorkshire, England, UK",(train wide shots)
/title/tt1441953/,"St Bartholomew the Great, West Smithfield, London, England, UK",(Armistice Day scene interior)
/title/tt1441953/,"Darley Dale, Derbyshire, England, UK",(Derbyshire)
/title/tt1441953/,"Leeds Central Library, Leeds, West Yorkshire, England, UK",(Staircase scene)
/title/tt1441953/,"Merton College, Merton Street, Oxford, Oxfordshire, England, UK",(doubles for Somerville College)
/title/tt1441953/,"Little Germany, Bradford, West Yorkshire, England, UK",
/title/tt1441953/,"Keighley & Worth Valley Railway, Haworth, Keighley, Bradford, West Yorkshire, England, UK",
/title/tt1441953/,"Leeds, West Yorkshire, England, UK",
/title/tt0074896/,Libya,
/title/tt6128262/,"Bradford College, Bradford, West Yorkshire, England, UK",
/title/tt6128262/,"Ilkley Moor, Ilkley, Bradford, West Yorkshire, England, UK",
/title/tt6128262/,"Keighley, Bradford, West Yorkshire, England, UK",
/title/tt3385524/,"Great Central Railway Loughborough, Leicestershire, England, UK",(location)
/title/tt3385524/,"Bristol, England, UK",(Irish Dock)
/title/tt3385524/,"Lido, Worthing, Sussex",(Beauty contest)
/title/tt3385524/,Catford Broadway Theatre,"(A packed 1937 audience watch the movie ""Way Out West"")"
/title/tt3385524/,"Lyceum Theatre, Wellington Street, Covent Garden, London, England, UK","(Lyceum Theatre, London - exterior)"
/title/tt3385524/,"Hackney Empire Theatre, Hackney, London, England, UK","(Lyceum Theatre, London - interior)"
/title/tt3385524/,"Savoy Hotel, Strand, London, England, UK",(Savoy Hotel - exterior)
/title/tt3385524/,"18 Adam Street, London, England, UK",(Associated Pictures exterior)
/title/tt3385524/,"Frog Lane, Bristol, UK",(Ollie places horse bet from telephone box)
/title/tt3385524/,"Eltham Palace, Court Road, Eltham, London, England, UK",(studio) (Fox Film Studio Office)
/title/tt7615302/,"London, England, UK",
/title/tt7615302/,"South East, UK",
/title/tt1440732/,"Twickenham Film Studios, St Margarets, Twickenham, Middlesex, England, UK",(studio)
/title/tt1440732/,"London, England, UK",
/title/tt7205942/,"Ferropolis, Gräfenhainichen, Saxony-Anhalt, Germany",
/title/tt7205942/,"Dessau, Saxony-Anhalt, Germany",
/title/tt7205942/,"Neuss, North Rhine-Westphalia, Germany",
/title/tt7205942/,"Berlin, Germany",
/title/tt7205942/,"Leipzig, Saxony, Germany",
/title/tt5789976/,"Ealing Studios, Ealing, London, England, UK",(studio) (studio location)
/title/tt5789976/,"Abbott's Cliff, Dover, Kent, England, UK",(Used in scene where Brian Reader travels to Margate by train.)
/title/tt5789976/,"Margate, Thanet, Kent, England, UK",(location)
/title/tt5789976/,"London, England, Great Britain, UK",(location)
/title/tt5789976/,"Dover, Kent, England, UK",(location)
/title/tt0082484/,"Cairngorm Mountains, Highland, Scotland, UK",
/title/tt0082484/,"Badlands, Alberta, Canada",
/title/tt0082484/,"Tsavo National Park, Kenya",
/title/tt0082484/,"Cathedral Grove, MacMillan Provincial Park, British Columbia, Canada",
/title/tt0082484/,"Bruce Peninsula, Ontario, Canada",
/title/tt0082484/,Canada,
/title/tt0082484/,"British Columbia, Canada",
/title/tt0082484/,Kenya,
/title/tt7074886/,"Atlanta, Georgia, USA",
/title/tt7074886/,"Jackson, Georgia, USA",(on location)
/title/tt3825638/,"Auschwitz-Birkenau Concentration Camp, Oswiecim, Malopolskie, Poland",
/title/tt3825638/,Poland,
/title/tt3825638/,Germany,
/title/tt5436228/,"Tom Ford Ranch, outside Santa Fe, New Mexico, USA",(Catherine pelting scene)
/title/tt0087892/,"Srinagar, Kashmir, India",
/title/tt0087892/,"Udhagamandalam, Tamil Nadu, India",
/title/tt0087892/,"Bangalore, Karnataka, India",(on location)
/title/tt1119176/,"Melbourne, Victoria, Australia",(season 1)
/title/tt1119176/,"Richmond, New South Wales, Australia",(Season 2)
/title/tt1119176/,"Australian Technology Park, Eveleigh, Sydney, New South Wales, Australia","(studio) (studio, season 2)"
/title/tt1119176/,"Centennial Park, Sydney, New South Wales, Australia",
/title/tt1119176/,"Maribyrnong, Melbourne, Victoria, Australia",(season 1)
/title/tt1119176/,"Wahroonga, Sydney, New South Wales, Australia",
/title/tt0064072/,"RAF Hawkinge, Hawkinge, Kent, England, UK",
/title/tt0064072/,"El Corporo air base, Sevilla, Andalucía, Spain",
/title/tt0064072/,"Old War Office Building, Whitehall, Westminster, London, England, UK",(location)
/title/tt0064072/,"Huelva's beach, Huelva, Andalucía, Spain",
/title/tt0064072/,"Tablada air base, Tablada, Sevilla, Andalucía, Spain",
/title/tt0064072/,"Beachy Head, East Sussex, England, UK",(Squadron Leader Canfield's Spitfires intercept German Stukas)
/title/tt0064072/,"Dragon Road, Camberwell, London, England, UK",
/title/tt0064072/,France,
/title/tt0086312/,"Building One, Studios at Las Colinas - 6301 North O'Connor Road, Irving, Texas, USA",(studio)
/title/tt0086312/,"Howe, Texas, USA",(Crescent Cafe)
/title/tt0086312/,"Texas City, Texas, USA",
/title/tt8750956/,South Korea,
/title/tt0058777/,"KwaZulu-Natal, South Africa",
/title/tt0058777/,"Twickenham Film Studios, St Margarets, Twickenham, Middlesex, England, UK",(hospital interior)
/title/tt0058777/,"Royal Natal National Park, South Africa",
/title/tt0058777/,"Natal, South Africa",
/title/tt4602066/,"Boston, Massachusetts, USA",
/title/tt2006295/,"Copiapó, Chile",
/title/tt2006295/,Colombia,
/title/tt2006295/,"Tierra Amarilla, Chile","(""Campamento Esperanza"" and rescue scenes)"
/title/tt0074084/,"Isle of Capri, Naples, Campania, Italy",
/title/tt0074084/,"Voltido, Cremona, Lombardia, Italy",(ball in the barn)
/title/tt0074084/,"Guastalla, Reggio Emilia, Emilia-Romagna, Italy",(procession for the fire's victims funeral: Via Garibaldi and Piazza Mazzini)
/title/tt0074084/,"Parma, Emilia-Romagna, Italy",
/title/tt0074084/,"Reggio Emilia, Emilia-Romagna, Italy",
/title/tt0074084/,"Pieve Saliceto, Reggio Emilia, Emilia-Romagna, Italy",(lying on railroad tracks)
/title/tt0088583/,"The Calhoun Mansion, 16 Meeting Street, Charleston, South Carolina, USA",(Belvedere - The Hazards' mansion)
/title/tt0088583/,"Charleston, South Carolina, USA",
/title/tt0088583/,"Stanton Hall - 401 High Street, Natchez, Mississippi, USA",(interior scenes of 'Mont Royal')
/title/tt0088583/,"Louisiana, USA",
/title/tt0088583/,"Camden, Arkansas, USA",(West Point assault scene)
/title/tt0088583/,"Reader, Arkansas, USA",
/title/tt0088583/,"Washington Park, Charleston, South Carolina, USA",(Celebration of secession in park)
/title/tt0032551/,"Tehachapi, California, USA",(second unit)
/title/tt0032551/,"Daggett, California, USA",(second unit)
/title/tt0032551/,"McAlester, Oklahoma, USA",(2nd unit)
/title/tt0032551/,"Gallup, New Mexico, USA",
/title/tt0032551/,"Iverson Ranch - 1 Iverson Lane, Chatsworth, Los Angeles, California, USA",
/title/tt0032551/,"Petrified Forest National Park, Arizona, USA",
/title/tt0032551/,"Janss Conejo Ranch, Thousand Oaks, California, USA","(""Keene Ranch"")"
/title/tt0032551/,"San Fernando Valley, Los Angeles, California, USA",
/title/tt0032551/,"Backlot, 20th Century Fox Studios - 10201 Pico Blvd., Century City, Los Angeles, California, USA",
/title/tt0032551/,"California, USA",
/title/tt0277941/,"Clunes, Victoria, Australia",
/title/tt0277941/,"Ballarat, Victoria, Australia",(Melbourne)
/title/tt0277941/,"Mount Rothwell, Little River, Victoria, Australia",
/title/tt0277941/,"Melbourne, Victoria, Australia",
/title/tt0277941/,"Broadford, Victoria, Australia",
/title/tt4882376/,"Battambang, Cambodia",
/title/tt0071502/,"Esfahan, Iran",(wedding)
/title/tt0071502/,Eritrea,(African scenes)
/title/tt0071502/,"Sana'a, Yemen",(city gates where Zumurrud is declared king)
/title/tt0071502/,India,
/title/tt0071502/,Iran,
/title/tt0071502/,Nepal,
/title/tt0071502/,"Zabid, Yemen",
/title/tt0120866/,"Rome, Lazio, Italy",
/title/tt0120866/,"Tampa, Florida, USA",
/title/tt0120866/,"Cinecittà Studios, Cinecittà, Rome, Lazio, Italy",(studio)
/title/tt1736341/,"Barrandov Studios, Prague, Czech Republic",
/title/tt1736341/,"Tocnik Castle, Central Bohemia, Czech Republic",
/title/tt1736341/,"Palazzo Farnese, Caprarola, Viterbo, Lazio, Italy",
/title/tt1736341/,"Viterbo, Lazio, Italy",
/title/tt1736341/,"Sermoneta, Latina, Lazio, Italy",
/title/tt1736341/,"Giardino di Ninfa, Latina, Lazio, Italy",
/title/tt1736341/,"Parco degli Acquedotti, Rome, Italy",
/title/tt1736341/,"Svihov Castle, Czech Republic",
/title/tt1736341/,"Pernstejn Castle, Nedvedice pod Perstejnem, Czech Republic",
/title/tt1736341/,"Telc, Czech Republic",
/title/tt1736341/,"Cheb, Czech Republic",
/title/tt1736341/,"Basilica di San Pietro, Tuscania, Viterbo, Lazio, Italy",
/title/tt1736341/,"Vigoleno, Piacenza, Emilia-Romagna, Italy",
/title/tt1736341/,"Rocca degli Alberi, Montagnana, Padua, Veneto, Italy",
/title/tt1736341/,"Odescalchi Castle, Bracciano, Rome, Lazio, Italy",
/title/tt1736341/,"Forte Sangallo, Civita Castellana, Viterbo, Lazio, Italy",
/title/tt1736341/,"Castello di Gorizia, Friuli-Venezia Giulia, Italy",
/title/tt4699982/,"Dublin Castle, Dublin, Ireland",
/title/tt3508050/,"Manchester, Greater Manchester, England, UK",(2014)
/title/tt2548418/,"Trogir, Croatia",
/title/tt2548418/,"Fountains Abbey, Studley Royal, Ripon, North Yorkshire, England, UK",
/title/tt2548418/,"Quebec, Canada",
/title/tt2548418/,"Oakwell Hall and Country Park, Nutter Lane, Birstall, Batley, West Yorkshire, England, UK",(Witches House)
/title/tt2548418/,"Wentworth Woodhouse, Wentworth, Rotherham, South Yorkshire, England, UK",(The Mansion)
/title/tt2548418/,"Appletreewick, Skipton, North Yorkshire, England, UK",
/title/tt2548418/,"Ilkley Moor, Ilkley, Bradford, West Yorkshire, England, UK",
/title/tt2548418/,"Ilkley, Bradford, West Yorkshire, England, UK",
/title/tt1149362/,"Michaelisbruch, Dreetz, Brandenburg, Germany",
/title/tt1149362/,"Lübeck, Schleswig-Holstein, Germany",
/title/tt1613750/,"Nu Boyana Film Studios, Sofia, Bulgaria",(New York exterior scenes)
/title/tt1613750/,Maldives,
/title/tt1613750/,"Khao Lak, Thailand",
/title/tt1613750/,Malta,
/title/tt1613750/,"Phuket, Thailand",
/title/tt1613750/,"Asker, Akershus, Norway",
/title/tt1613750/,"New York City, New York, USA",
/title/tt6474040/,"Skeppsholmen, Stockholm, Sweden",(Exterior of Kreditbanken building)
/title/tt6474040/,"Hamilton, Ontario, Canada",(studio) (Production studio)
/title/tt6474040/,Sweden,(Exterior scenes)
