Code,Show Name,Location,Scene
/title/tt0467200/,"Haddon Hall, Bakewell, Derbyshire, England, UK",(interiors: Hever Castle)
/title/tt0467200/,"Berkeley Castle, Berkeley, Gloucestershire, England, UK",
/title/tt0467200/,"Lacock Abbey, Lacock, Wiltshire, England, UK",(interiors & exteriors: Whitehall Palace)
/title/tt0467200/,"Pinewood Studios, Iver Heath, Buckinghamshire, England, UK",(studio)
/title/tt1181791/,"Ukranenland, Torgelow, Mecklenburg-Western Pomerania, Germany",(The small village)
/title/tt1181791/,"Burg Querfurt, Querfurt, Saxony-Anhalt, Germany",
/title/tt1181791/,"Teufelsmauer, Weddersleben, Harz, Saxony-Anhalt, Germany",(Rock wall crossing scene)
/title/tt1181791/,"Castle Goseck, Goseck, Saxony-Anhalt, Germany",
/title/tt1181791/,"Klostermansfeld, Mansfeld-Südharz, Saxony-Anhalt, Germany",
/title/tt1181791/,"Burg Arnstein, Mansfeld-Südharz, Saxony-Anhalt, Germany",
/title/tt1181791/,"Veckenstedt, Harz, Saxony-Anhalt, Germany",
/title/tt1181791/,"Zitadelle Spandau, Berlin, Germany",
/title/tt1848220/,"Istanbul, Turkey",
/title/tt0127536/,"York Minster, Deangate, York, North Yorkshire, England, UK",
/title/tt0127536/,"Bamburgh Castle, Bamburgh, Northumberland, England, UK",
/title/tt0127536/,"Leeds Castle, Kent, England, UK",
/title/tt0127536/,"Auckland, New Zealand",
/title/tt0127536/,"Bolton Castle, Castle Bolton, Leyburn, North Yorkshire, England, UK",
/title/tt0127536/,"Raby Castle, Durham, County Durham, England, UK",(river pageant)
/title/tt0127536/,"Warkworth Castle, Castle Terrace, Warkworth, Morpeth, Northumberland, England, UK",(cells and torture chamber Tower of London)
/title/tt0127536/,"York Minster, Deangate, York, North Yorkshire, England, UK",(Coronation of Elizabeth)
/title/tt0395169/,Rwanda,
/title/tt0395169/,South Africa,
/title/tt4206804/,"Grey Abbey, Newtownards, UK",
/title/tt4206804/,"Galgorm Castle, Galgorm Road, Galgorm Parks, Ballymena, County Antrim, Northern Ireland, UK",
/title/tt4206804/,"Castle Upton, Antrim Road, Templepatrick, Ballyclare, County Antrim, Northern Ireland, UK",
/title/tt4206804/,"Wolf Hill Quarry, Belfast, County Antrim, Northern Ireland, UK",
/title/tt4206804/,"Down County Museum, The Mall, English Street, Downpatrick, County Down, Northern Ireland, UK",
/title/tt0056937/,Egypt,
/title/tt0056937/,"Ischia Island, Naples, Campania, Italy",
/title/tt0056937/,"Almería, Andalucía, Spain",
/title/tt0056937/,"Malibu, California, USA",
/title/tt0056937/,"Desierto de Tabernas, Almería, Andalucía, Spain",
/title/tt0056937/,Spain,
/title/tt0056937/,"Stage 5, Cinecittà Studios, Cinecittà, Rome, Lazio, Italy",
/title/tt0056937/,UK,
/title/tt0032851/,"Cascade Mountains, Oregon, USA",
/title/tt0032851/,"Idaho, USA",
/title/tt0032851/,"Oregon, USA",
/title/tt5900600/,Belgium,
/title/tt3007512/,"Kayaköy, Turkey",(town at the end of the film)
/title/tt3007512/,"Maslin Beach, Adelaide, South Australia, Australia",(Gallipoli Beach)
/title/tt3007512/,"The Rocks, Sydney, New South Wales, Australia",
/title/tt3007512/,"Burra, South Australia, Australia",
/title/tt3007512/,"Fox Studios, Moore Park, Sydney, New South Wales, Australia",(studio)
/title/tt3007512/,Australia,
/title/tt3007512/,"The Blue Mosque, Istanbul, Turkey",(The Blue Mosque)
/title/tt3007512/,"Sultan Ahmed Mosque, Fatih, Istanbul, Turkey",(The Blue Mosque)
/title/tt3007512/,"Limestone Coast, South Australia, Australia",(Gallipoli Beach)
/title/tt3007512/,"Balat, Istanbul, Turkey",
/title/tt3007512/,"Coast, South Australia, Australia",(Gallipoli Beach)
/title/tt3007512/,"Tlos, Turkey",
/title/tt3007512/,"Lycia, Turkey",(locations: Tlos and Kayaköy)
/title/tt3007512/,"Anatolia, Turkey",(locations: Tlos and Kayaköy)
/title/tt3007512/,"Fethiye, Mugla, Turkey",(location)
/title/tt3007512/,"Canakkale, Turkey",
/title/tt3007512/,"Flinders Ranges, South Australia, Australia",
/title/tt0443543/,"Prague, Czech Republic",(as Vienna)
/title/tt0443543/,"Tábor, Czech Republic",(as Vienna)
/title/tt0443543/,"Divadlo na Vinohradech, Prague, Czech Republic",(the theater where Eisenheim performs)
/title/tt0443543/,"Praha hlavni nadrazi, Wilsonova, Prague, Czech Republic",(Railway station)
/title/tt0445922/,"Cavern Club, Liverpool, Merseyside, England, UK",(location)
/title/tt0445922/,"Museum of the City of New York - 1220 Fifth Avenue, Manhattan, New York City, New York, USA",(Columbia University Protest)
/title/tt0445922/,"Armour-Stiner House, Irvington, New York, USA",
/title/tt0445922/,"Liverpool, Merseyside, England, UK",(location)
/title/tt0445922/,"New Rochelle, New York, USA",(Beechmont residential park; College of New Rochelle)
/title/tt0445922/,"Webster Hall - 125 East 11th Street, Greenwich Village, Manhattan, New York City, New York, USA",(location)
/title/tt0445922/,"Port Authority Grain Terminal, Red Hook, Brooklyn, New York City, New York, USA",(football scene)
/title/tt0299977/,"Hangzhou, Zhejiang, China",
/title/tt0299977/,"Heng Dian, China",
/title/tt0299977/,"Inner Mongolia, China",
/title/tt6914122/,"Bavaria Studios, Munich, Bavaria, Germany",
/title/tt0093389/,"Beijing Studios, Beijing, China",(studio)
/title/tt0093389/,"Dalian, China",(used as city of Tientsin)
/title/tt0093389/,"Beijing, China",
/title/tt0093389/,"Cinecittà Studios, Cinecittà, Rome, Lazio, Italy",(studio)
/title/tt0093389/,"Manchuria, China",
/title/tt0093389/,"Puppet Manchurian Imperial Palace Museum, Changchun, China",(Pu Yi's Palace in Manchukuo)
/title/tt0093389/,"Summer Palace, Beijing, China",(Pu Yi and Pu Chieh visit the High Consorts)
/title/tt0093389/,Italy,
/title/tt5208252/,Argentina,
/title/tt5208252/,"Bariloche, Río Negro, Argentina",
/title/tt1921064/,"Cinespace Film Studios, Toronto, Ontario, Canada",
/title/tt1014763/,"Ostrava, Czech Republic",
/title/tt11093718/,"Riva, Beykoz, Istanbul, Turkey",(location)
/title/tt5690810/,"Sedlec Ossuary, Kutná Hora, Czech Republic",
/title/tt5690810/,Czech Republic,
/title/tt5690810/,"Barrandov Studios, Prague, Czech Republic",(studio)
/title/tt6474236/,"Johannesburg, South Africa",(Production base)
/title/tt6474236/,Pakistan,(Doubling for Afghanistan landscape)
/title/tt6474236/,"Brooklyn, New York, USA",(River Café retirement party for John O'Neill)
/title/tt0491203/,"Norwich Cathedral, Norwich, Norfolk, England, UK",
/title/tt0491203/,"Tilbury, Essex, England, UK",
/title/tt0491203/,Austria,
/title/tt0491203/,"Cobham Hall, Gravesham, Kent, England, UK",(Featured as a 17th century Amsterdam Gracht and a brewery yard. A waterway was also constructed with barges and donkeys crossing humpback bridges.)
/title/tt4776998/,"Lisboa, Portugal",
/title/tt4776998/,"Valletta, Malta",
/title/tt4776998/,Portugal,(filmed on location in)
/title/tt4776998/,"Calomarde, Teruel, Aragón, Spain",
/title/tt4776998/,"Madrid, Spain",
/title/tt4776998/,"Pulpí, Almería, Andalucía, Spain",(mine scenes)
/title/tt4776998/,USA,(filmed on location in)
/title/tt4776998/,"Hospital de Tavera, Toledo, Castilla-La Mancha, Spain",(Courtyard of the Imperial College of Medicine scenes)
/title/tt4776998/,"National Museum of Natural History and Science, R. da Escola Politécnica 56, 1250-102 Lisboa, Portugal",(University interiors)
/title/tt2094262/,"Abbey Cwm Hir Hall, Llandrindod Wells, Powys, Wales, UK",(Medici Palace)
/title/tt2094262/,"Bay Studios, Swansea Gate Business Park, Fabian Way, Swansea, Wales, UK",(studio) (studio - Florence streets and interiors)
/title/tt2094262/,"Port Talbot, Neath Port Talbot, Wales, UK",
/title/tt0277434/,"Morro Bay, California, USA",
/title/tt0277434/,"Fort Benning - Riverside Commandants Home - 102 Vibbert Avenue, Fort Benning, Georgia, USA",(Celebration Dance for the 7th. Cavalry before deployment.)
/title/tt0277434/,"Fort Benning - 178 Miller Loop, Fort Benning, Georgia, USA",(Lt. Col. Hal Moore's base residence)
/title/tt0277434/,"Fort Benning - 153 Sigerfoos Road, Fort Benning, Georgia, USA","(Doughboy Stadium, 7th. Cavalry Ceremony)"
/title/tt0277434/,"Fort Benning - 191 Miller Loop, Fort Benning, Georgia, USA",(Lt. Geoghegan's base residence)
/title/tt0277434/,"Fort Benning - Lawson Army Airfield Hanger #2, Bradshaw Road, Fort Benning, Georgia, USA",(Crandall and the 11th. Air Assault Helicopter Battalion playing baseball on the tarmac.)
/title/tt0277434/,"The Infantry Chapel - Lauber Street & Sigerfoos Road, Fort Benning, Georgia, USA","(Catherine Metsker sings On the Solid Rock I Stand, also cameos by Hal Moore & Barbara Geoghegan with their respective families, deleted scene.)"
/title/tt3906082/,"Château de Colpach-Bas, 1 rue d'Ell, Colpach-Bas, Luxembourg",
/title/tt3906082/,Ireland,
/title/tt3906082/,"Dublin, County Dublin, Ireland",
/title/tt0074119/,"Los Angeles City Hall - 200 North Spring Street, Downtown, Los Angeles, California, USA",(Miami FL County Justice Building)
/title/tt0074119/,"2600 Virginia Avenue NW, Washington, District of Columbia, USA",
/title/tt0074119/,"J. Edgar Hoover FBI Building - 10th Street & Pennsylvania Avenue NW, Washington, District of Columbia, USA",
/title/tt0074119/,"Lafayette Park - Pennsylvania Avenue & H Street NW, Washington, District of Columbia, USA",(site of Bernstein's meeting with phone company contact)
/title/tt0074119/,"McDonald's, Santa Monica, California, USA",(fast food restaurant where Sloane confirms Haldeman's name)
/title/tt0074119/,"Washington Post - 1150 15th Street NW, Washington, District of Columbia, USA",
/title/tt0074119/,"Arlington, Virginia, USA",
/title/tt0074119/,"Stage 4, Warner Brothers Burbank Studios - 4000 Warner Boulevard, Burbank, California, USA",
/title/tt0074119/,"United States Capitol - 545 Seventh Street SE, Washington, District of Columbia, USA",
/title/tt7125774/,"Munich, Bavaria, Germany",
/title/tt7125774/,"Berlin, Germany",
/title/tt8403664/,"Bradford, West Yorkshire, England, UK",
/title/tt8403664/,"Little Germany, Bradford, West Yorkshire, England, UK",
/title/tt4190530/,"Prague, Czech Republic",
/title/tt4190530/,"Barrandov Studios, Prague, Czech Republic",
/title/tt0437954/,"Siena, Tuscany, Italy",
/title/tt0437954/,"Cinecittà Studios, Cinecittà, Rome, Lazio, Italy",(studio)
/title/tt0049357/,"Pinewood Studios, Iver Heath, Buckinghamshire, England, UK",(studio)
/title/tt0049357/,"Côte d'Azur, France",
/title/tt0443649/,"Spitzkoppe, Erongo, Namibia",
/title/tt0443649/,"Southland, New Zealand",
/title/tt0443649/,Namibia,
/title/tt0443649/,South Africa,
/title/tt0443649/,New Zealand,
/title/tt5437928/,Hungary,
/title/tt5437928/,"Cogges Manor Farm, Witney, Oxfordshire, England, UK",(Study/Library scene)
/title/tt0104797/,"Mecca, Saudi Arabia",(second unit)
/title/tt0104797/,"Phakamani Combined School, Soweto, Johannesburg, South Africa",(epilogue)
/title/tt0104797/,"Essex, Connecticut, USA",
/title/tt0104797/,"Park Avenue, Manhattan, New York City, New York, USA",
/title/tt0104797/,"Ridgewood, Queens, New York City, New York, USA","(Boston scenes, exteriors)"
/title/tt0104797/,"300 Wyckoff Avenue, Bushwick, Brooklyn, New York City, New York, USA",
/title/tt0104797/,"Queens, New York City, New York, USA",
/title/tt0104797/,"Sands Point Preserve - 95 Middleneck Road, Port Washington, Long Island, New York, USA",
/title/tt0104797/,"Audobon Ballroom - 3940 Broadway, Washington Heights, Manhattan, New York City, New York, USA",
/title/tt0104797/,"Soweto, Johannesburg, South Africa",
/title/tt0104797/,"Johannesburg, South Africa",
/title/tt0104797/,"Apollo Theatre - 253 W. 125th Street, Harlem, Manhattan, New York City, New York, USA",
/title/tt0104797/,"Brooklyn, New York City, New York, USA",
/title/tt0104797/,"Central Park West, Manhattan, New York City, New York, USA",
/title/tt0104797/,"East 19th Street, Brooklyn, New York City, New York, USA",
/title/tt0104797/,"Alexandra, Johannesburg, South Africa",
/title/tt0104797/,"Hotel Diplomat - 110 West 43rd Street, Manhattan, New York City, New York, USA",(Roseland dance) (demolished)
/title/tt0104797/,"Long Island, New York, USA",
/title/tt0104797/,"Myrtle Avenue & Wyckoff Avenue, Bushwick, Brooklyn, New York City, New York, USA",
/title/tt0104797/,"New York City, New York, USA",
/title/tt0104797/,USA,
/title/tt2884018/,"Bamburgh Castle, Bamburgh, Northumberland, England, UK",
/title/tt2884018/,"Isle of Skye, Scotland, UK",
/title/tt2884018/,"Hankley Common, Elstead, Surrey, England, UK",
/title/tt2884018/,"The Fairy Pools, Glen Brittle, Isle of Skye, Scotland, UK",(Banquo is killed)
/title/tt2884018/,UK,
/title/tt0414055/,"Doune Castle, Doune, Stirling, Scotland, UK",
/title/tt0414055/,"Ely Cathedral, Chapter House, The College, Ely, Cambridgeshire, England, UK",(Whitehall Palace interior)
/title/tt0414055/,"Westminster Cathedral, 42 Francis Street, Westminster, Greater London, England, UK",(Escorial Palace/Lisbon Cathedral interiors)
/title/tt0414055/,"B Stage, Shepperton Studios, Shepperton, Surrey, England, UK",
/title/tt0414055/,"J Stage, Shepperton Studios, Shepperton, Surrey, England, UK",
/title/tt0414055/,"Baddesley Clinton, Warwickshire, England, UK",(Raleigh's house exteriors)
/title/tt0414055/,"Burghley House, Stamford, Lincolnshire, England, UK",(John Dee's house exteriors/London alley/Paris street scene)
/title/tt0414055/,"Dorney Court, Dorney, Buckinghamshire, England, UK",(Raleigh's house/Walsingham's house/chapel interiors)
/title/tt0414055/,"Leeds Castle, Kent, England, UK",(Chartley Hall/Whitehall exteriors)
/title/tt0414055/,"Shepperton Studios, Shepperton, Surrey, England, UK",(studio)
/title/tt0414055/,"Winchester Cathedral, Winchester, Hampshire, England, UK",(St. Paul's Cathedral/The Chapel Royal interiors/gallows scene)
/title/tt1568911/,"Dartmoor, Devon, England, UK",
/title/tt1568911/,"Meavy, Devon, England, UK",(village)
/title/tt1568911/,"Wisley Airfield, Wisley, Surrey, England, UK",(trenches war scenes)
/title/tt1568911/,"Luton Hoo Estate, Luton, Bedfordshire, England, UK",
/title/tt1568911/,"Ditsworthy Warren House, Sheepstor, Devon, England, UK",
/title/tt1568911/,"Longcross Studios, Chobham Lane, Longcross, Surrey, England, UK",
/title/tt0110428/,"Wilton House, Wilton, Salisbury, Wiltshire, England, UK",(Windsor Castle: interior)
/title/tt0110428/,"Eton College, Eton, Berkshire, England, UK",(Houses of Parliament)
/title/tt0110428/,"Bodleian Library, Broad Street, Oxford, Oxfordshire, England, UK",
/title/tt0110428/,"Shepperton Studios, Shepperton, Surrey, England, UK",(studio)
/title/tt0110428/,"Thame Park, Thame, Oxfordshire, England, UK",
/title/tt0110428/,"City of London, England, UK",
/title/tt2025690/,"Quincy, Massachusetts, USA",
/title/tt2025690/,"Marshfield, Massachusetts, USA",(street scenes)
/title/tt2025690/,"Powder Point Bridge, Duxbury, Massachusetts, USA",(Bridge Scenes)
/title/tt2262456/,"Ashridge Estate, Hertfordshire",
/title/tt0808357/,"Hong Kong, China",
/title/tt0808357/,"Kuala Lumpur, Malaysia",
/title/tt0808357/,"Penang, Malaysia",
/title/tt0808357/,"Shanghai, China",
/title/tt0808357/,"Xinchang, Zhejiang, China",
/title/tt0323944/,"Bethesda, Maryland, USA",
/title/tt0323944/,"Washington, District of Columbia, USA",
/title/tt0082517/,"Vaux-le-Vicomte, Seine-et-Marne, France",
/title/tt0082517/,"Stage 32, Paramount Studios - 5555 Melrose Avenue, Hollywood, Los Angeles, California, USA",
/title/tt0082517/,"Park Lake, Backlot, Universal Studios - 100 Universal City Plaza, Universal City, California, USA",
/title/tt0082517/,"Square of Warriors, Backlot, Universal Studios - 100 Universal City Plaza, Universal City, California, USA",
/title/tt0086993/,"Tahiti, French Polynesia",
/title/tt0086993/,"The Reform Club, Pall Mall, St. James's, London, England, UK",(Bligh invitation to sail to Fletcher Christian)
/title/tt0086993/,"15 Montpelier Row, Twickenham, Middlesex, England, UK",(Bligh's House)
/title/tt0086993/,"Wilton House, Wilton, Salisbury, Wiltshire, England, UK",(Court Martial - interiors)
/title/tt0086993/,"Old Royal Naval College, Greenwich, London, England, UK",(Court Martial - exteriors)
/title/tt0086993/,"Middlesex, England, UK",
/title/tt8667956/,Austria,
/title/tt8667956/,"Barrandov Studios, Prague, Czech Republic",(studio) (Studios)
/title/tt8667956/,"Liberec, Czech Republic",
/title/tt1020072/,"Marietta, Georgia, USA",(Marietta-Cobb Museum of Art: Nobel Prize ceremony interiors)
/title/tt1020072/,"Covington, Georgia, USA",(Selma town square and Hotel Albert filmed on Covington Square)
/title/tt1020072/,"Conyers, Georgia, USA",(courthouse interiors: Rockdale County Courthouse)
/title/tt1020072/,"Academy of Medicine, Georgia Tech, Georgia, USA",(White House interiors)
/title/tt6543652/,"Split, Croatia",(The Mazurek Company performs in Yugoslavia)
/title/tt6543652/,"Lódz, Lódzkie, Poland",(studio)
/title/tt6543652/,"Narew River, Mazowieckie, Poland",(Zula and Wiktor in the countryside)
/title/tt6543652/,France,
/title/tt6543652/,"Place Emile Goudeau, Paris 18, Paris, France",
/title/tt6543652/,"Paris, France",
/title/tt7280898/,"Oslo, Norway",
/title/tt7280898/,"Vestfold, Norway",
/title/tt0472027/,"Mechanicsville, Virginia, USA",
/title/tt0472027/,"College of William & Mary, Williamsburg, Virginia, USA",
/title/tt0472027/,"Goochland, Virginia, USA",
/title/tt0472027/,"Danube River, Budapest, Hungary",(Paris scenes)
/title/tt0472027/,"Esterházy Palace, Fertõd, Hungary",(Paris scenes)
/title/tt0472027/,"Hampton Court Palace, East Molesey, Surrey, England, UK",
/title/tt0472027/,"Powhatan, Virginia, USA",
/title/tt0472027/,"Festetics Castle, Böhönye, Hungary",
/title/tt0472027/,Hungary,
/title/tt1023114/,"Vakarel, Bulgaria",
/title/tt1023114/,"New Boyana Film Studios, Sofia, Bulgaria",
/title/tt1023114/,"Darjeeling, West Bengal, India",
/title/tt1023114/,"Sofia, Bulgaria",
/title/tt1023114/,"Ouarzazate, Morocco",
/title/tt4703048/,"Auckland, New Zealand",
/title/tt4807408/,"Cartersville, Georgia, USA",
/title/tt1335975/,"Raleigh Studios Budapest- Felsokert utca 9, Budapest, Hungary",
/title/tt1335975/,Hungary,
/title/tt1335975/,UK,
/title/tt1335975/,"C Stage, Pinewood Studios, Iver Heath, Buckinghamshire, England, UK",
/title/tt1335975/,"E Stage, Shepperton Studios, Shepperton, Surrey, England, UK",
/title/tt1335975/,"K Stage, Shepperton Studios, Shepperton, Surrey, England, UK",
/title/tt1335975/,"R Stage, Shepperton Studios, Shepperton, Surrey, England, UK",
/title/tt0329575/,"Santa Anita Park & Racetrack - 285 West Huntington Drive, Arcadia, California, USA",
/title/tt0329575/,"Fillmore, California, USA",(Train Station)
/title/tt0329575/,"Colorado Street Bridge, Pasadena, California, USA",
/title/tt0329575/,"Paris, Kentucky, USA",
/title/tt0329575/,"The Langham Huntington Hotel - 1401 South Oak Knoll Avenue, Pasadena, California, USA",
/title/tt0329575/,"New York City, New York, USA",
/title/tt0329575/,"Six Points Texas, Backlot, Universal Studios - 100 Universal City Plaza, Universal City, California, USA",
/title/tt0329575/,"Lacy Street Production Center - 2630 Lacy Street, Los Angeles, California, USA",(street scenes)
/title/tt0120657/,"British Columbia, Canada",
/title/tt0120657/,"Pemberton, British Columbia, Canada",(Local Knowledge eye witness)
/title/tt0120657/,Canada,
/title/tt0066993/,"Bamburgh Beach, Bamburgh, Northumberland, England, UK",
/title/tt0087553/,"Royal York Hotel, Toronto, Ontario, Canada",
/title/tt0087553/,"Bangkok, Thailand",
/title/tt0087553/,Canada,
/title/tt0087553/,USA,
/title/tt0087553/,"San Diego, California, USA",
/title/tt6763252/,Germany,
/title/tt0472062/,Morocco,
/title/tt0472062/,"Hancock Park, Los Angeles, California, USA",(house used as set for Joanne Herring's home)
/title/tt0472062/,"Los Angeles, California, USA",
/title/tt3231054/,"Almeria, Andalucia, Spain",
/title/tt3231054/,"Desierto de Tabernas, Almería, Andalucía, Spain",(Desert scenes)
/title/tt3231054/,"La Alcazaba de Málaga, Málaga, Málaga, Andalucía, Spain",(Pilate's Palace)
/title/tt0420293/,"Regina, Saskatchewan, Canada",
/title/tt0420293/,"Los Angeles, California, USA",
/title/tt4005402/,"Munich, Bavaria, Germany",
/title/tt4005402/,"Dachau, Bavaria, Germany",
/title/tt4005402/,Germany,
/title/tt4005402/,"Buenos Aires, Federal District, Argentina",
/title/tt4005402/,"Berlin, Germany",
/title/tt0091530/,"Iguazú Waterfalls, Misiones, Argentina",
/title/tt0091530/,"Cartagena, Bolívar, Colombia",
/title/tt0091530/,"Paraná River, Paraguay",
/title/tt0091530/,Brazil,
/title/tt0091530/,"Fort Amherst, Chatham, Kent, England, UK",
/title/tt0091530/,Argentina,
/title/tt0091530/,Colombia,
/title/tt1730768/,"Boscolo Prague Hotel, Senovazne namesti, Prague, Czech Republic",
/title/tt1730768/,"Zatec, Czech Republic",
/title/tt0864761/,"Somerset House, Strand, London, England, UK",(Devonshire House exteriors)
/title/tt0864761/,"Marble Hall, Kedleston Hall, Kedleston, Derbyshire, England, UK",(Banquet where Georgiana's hair catches fire)
/title/tt0864761/,"Dining Room, Basildon Park, Lower Basildon, Berkshire, England, UK",(Dining room in the Devonshires' rented house in Bath)
/title/tt0864761/,"Holkham Hall and Estate, Norfolk, England, UK",(Devonshire House dining room)
/title/tt0864761/,"Library, Kedleston Hall, Kedleston, Derbyshire, England, UK",(Library in Althorp House)
/title/tt0864761/,"Old Vic Theatre, Bristol, England, UK",
/title/tt0864761/,"The Saloon, Kedleston Hall, Kedleston, Derbyshire, England, UK",(Entrance hall in the Devonshires' rented house in Bath)
/title/tt0864761/,"King William Walk, Greenwich, London, England, UK",
/title/tt0864761/,"University of Greenwich, Greenwich, London, England, UK",
/title/tt0864761/,"West Wycombe Park, West Wycombe, Buckinghamshire, England, UK",
/title/tt0118607/,"Mystic Seaport - 75 Greenmanville Avenue, Mystic, Connecticut, USA",(Port)
/title/tt0118607/,"Marble House - 596 Bellevue Avenue, Newport, Rhode Island, USA",(Queen Isabella's palace)
/title/tt0118607/,"Rosecliff Mansion - 548 Bellevue Avenue, Newport, Rhode Island, USA",(White House dining room)
/title/tt0118607/,"Upstairs Courtroom, Newport Colony House - 82 Touro Street, Washington Square, Newport, Rhode Island, USA",(Africans are arraigned)
/title/tt0118607/,"Groton Long Point, Connecticut, USA",
/title/tt0118607/,"Oak Glen, California, USA",
/title/tt0118607/,"Boston, Massachusetts, USA",
/title/tt0349825/,"MSA Arena, Abbotsford, British Columbia, Canada",
/title/tt0349825/,"University of British Columbia, Robson Square Campus - 800 Robson Street, Vancouver, British Columbia, Canada",
/title/tt0349825/,"Abbotsford, British Columbia, Canada",
/title/tt1124037/,"Jones County, Mississippi, USA",(location)
/title/tt1124037/,"Bush, Louisiana, USA",
/title/tt1124037/,"St Bernard Parish Library, 1201 Bayour Rd, St Bernard, Louisiana, USA",
/title/tt1124037/,"Round Table Club, 6330 St Charles Ave, New Orleans, Louisiana, USA",
/title/tt1124037/,"Creedmoor Plantation, 1800 Bayou Rd, St Bernard, Louisiana, USA",
/title/tt1124037/,"New Orleans, Louisiana, USA",
/title/tt1124037/,"St. John's Episcopal Church - 308 Church St, Washington, Louisiana, USA",(Interior Church Scenes)
/title/tt0070239/,"Dead Sea, Israel",(King Herod's Song)
/title/tt0070239/,"Beit Guvrin, Israel",
/title/tt0070239/,"Avdat, Israel",(main location of the Roman ruins)
/title/tt0070239/,Israel,
/title/tt3556920/,"Montacute House, Montacute, Somerset, England, UK",(Jousting scenes / royal tent / and as Greenwich Palace /)
/title/tt3556920/,"Lacock Abbey, Lacock, Wiltshire, England, UK",(Wolf Hall exteriors)
/title/tt3556920/,"Castell Coch, Tongwynlais, South Glamorgan, Wales, UK",
/title/tt3556920/,"Winchester, St. Cross Hospital, Hampshire, U.K.",
/title/tt3556920/,"Raglan Castle, Raglan, Monmouthshire, Wales, UK",
/title/tt3556920/,"St. Donats Castle, Vale of Glamorgan, Wales, UK","(interior of Tower of London, Westminster, Calais, Blackfriars and Hampton Court)"
/title/tt3556920/,"Sherborne School, Sherborne, Dorset, England, UK",(York Place)
/title/tt3556920/,"Cothay Manor, Greenham, Wellington, Somerset, England, UK",(Thomas More's house)
/title/tt3556920/,"Bradford-on-Avon Tithe Barn, Pound Lane, Bradford-on-Avon, Wiltshire, England, UK",
/title/tt3556920/,"Chastleton House, Oxfordshire, England, UK",(courtyard scenes from Cromwell's childhood / as Wolf Hall interiors)
/title/tt3556920/,"Stanway House, Stow-on-the-Wold, Gloucestershire, England, UK",(Lambeth Palace)
/title/tt3556920/,"Chapter House, Bristol Cathedral, Bristol, UK",(Duke of Norfolk's residence)
/title/tt3556920/,"Hospital Of St. Cross, St Cross Back Street, Winchester, Hampshire, England, UK",
/title/tt3556920/,"Vicars' Close, Wells, Somerset, England, UK",
/title/tt3556920/,"The Eastern Lady Chapel, Bristol Cathedral, College Green, Bristol, England, UK",(altercation between Henry VIII and Thomas Cromwell)
/title/tt3556920/,"The Nave and Crossing, Bristol Cathedral, College Green, Bristol, England, UK",(coronation of Anne Boleyn)
/title/tt3556920/,"The Great Hall, Lacock Abbey, Lacock, Chippenham, Wiltshire, England, UK",(King's Lodging at Calais)
/title/tt0352248/,"Hamilton, Ontario, Canada",(dock scenes)
/title/tt0352248/,"Toronto Film Studios, Toronto, Ontario, Canada",(studio)
/title/tt0352248/,"Ontario Heritage Center, Toronto, Ontario, Canada",
/title/tt0352248/,"Downsview Park Studios, 40 Carl Hall Road, Toronto, Ontario, Canada",
/title/tt7664504/,"Mount Mary Retreat Centre, Hamilton, Ontario, Canada",(School scenes)
/title/tt7664504/,"Ann Arbor, Michigan, USA",
/title/tt8750570/,Thailand,
/title/tt8750570/,"New York City, New York, USA",
/title/tt0115988/,"Rebecca Nurse House - 149 Pine Street, Danvers, Massachusetts, USA",(Rebecca Nurse's home and meeting house scenes)
