,Code,Show Name,Location,Scene,geocodedLocation,latitude,longitude
281,/title/tt2062700/,Song to Song,Mexico,,"Ciudad de México, 06060, México",19.4326296,-99.1331785
282,/title/tt2062700/,Song to Song,"Texas, USA",,"Texas, United States of America",31.8160381,-99.5120986
283,/title/tt2543796/,Girl Meets World,"Los Angeles Center Studios - 450 S. Bixel Street, Downtown, Los Angeles, California, USA",(studio)                        ,,,
284,/title/tt0443489/,Dreamgirls,"Los Angeles Center Studios - 450 S. Bixel Street, Downtown, Los Angeles, California, USA",(studio)                        ,,,
285,/title/tt0443489/,Dreamgirls,"Orpheum Theater - 842 South Broadway, Downtown, Los Angeles, California, USA",,,,
286,/title/tt0443489/,Dreamgirls,"Hollywood Palace Theater - 1735 N. Vine Street, Hollywood, Los Angeles, California, USA",,,,
287,/title/tt9779516/,I Still Believe,"Mobile, Alabama, USA",,"Mobile, Mobile County, Alabama, United States of America",30.6943566,-88.0430541
288,/title/tt9779516/,I Still Believe,"California, USA",,"California, United States of America",36.7014631,-118.7559974
289,/title/tt3228904/,Empire,"Chicago, Illinois, USA",,"Chicago, Cook County, Illinois, United States of America",41.8755616,-87.6244212
290,/title/tt3228904/,Empire,"353 North Clark Street, Chicago, Illinois, USA",(Empire HQ - 3353 Madison Avenue)                        ,"353 North Clark, 353, North Clark Street, Near North Side, Chicago, Cook County, Illinois, 60654, United States of America",41.8889806,-87.63015659327661
291,/title/tt0053291/,Some Like It Hot,"Hotel del Coronado - 1500 Orange Avenue, Coronado, California, USA",(Seminole Ritz Hotel)                        ,"Hotel Del Coronado, 1500, Orange Avenue, Coronado, San Diego County, California, 92118, United States of America",32.68089575,-117.17779096849321
292,/title/tt0053291/,Some Like It Hot,"The Lot - 1041 N. Formosa Avenue, West Hollywood, California, USA",(studio)                        ,,,
293,/title/tt0463398/,Dancing with the Stars,"Studio 46, CBS Television City - 7800 Beverly Boulevard, Fairfax, Los Angeles, California, USA",(studio)                        ,,,
294,/title/tt0088258/,This Is Spinal Tap,"Six Flags Magic Mountain - 26101 Magic Mountain Parkway, Valencia, California, USA",,,,
295,/title/tt0088258/,This Is Spinal Tap,"Sherman Oaks, Los Angeles, California, USA",,"Sherman Oaks, Los Angeles, Los Angeles County, California, 91403, United States of America",34.1508718,-118.4489865
296,/title/tt0088258/,This Is Spinal Tap,USA,,United States,39.7837304,-100.4458825
297,/title/tt0200550/,Coyote Ugly,"South Amboy, New Jersey, USA",,"South Amboy, Middlesex County, New Jersey, United States of America",40.4917725,-74.2832017
298,/title/tt0200550/,Coyote Ugly,"Tower Theatre - 802 S. Broadway, Downtown, Los Angeles, California, USA",,"Tower Theatre, 802, South Broadway, Historic Core District, Downtown, Los Angeles, Los Angeles County, California, 90013, United States of America",34.043458799999996,-118.25452018117771
299,/title/tt0200550/,Coyote Ugly,"Ambassador Hotel - 3400 Wilshire Boulevard, Los Angeles, California, USA",,,,
300,/title/tt0200550/,Coyote Ugly,"South Amboy Knights of Columbus, 308 Fourth Street, South Amboy, New Jersey, USA",(Establishing shot for Gloria's wedding reception)                        ,,,
301,/title/tt0200550/,Coyote Ugly,"The Cheesequake Creek Morgan Drawbridge, South Amboy & Old Bridge, New Jersey, USA",(Deleted scene)                        ,,,
302,/title/tt0200550/,Coyote Ugly,"Downtown, Los Angeles, California, USA",,"Downtown, Los Angeles, Los Angeles County, California, United States of America",34.0428494,-118.2476732
303,/title/tt0200550/,Coyote Ugly,"California, USA",,"California, United States of America",36.7014631,-118.7559974
304,/title/tt0200550/,Coyote Ugly,"New York, USA",,"New York, United States of America",40.7127281,-74.0060152
305,/title/tt4765284/,Pitch Perfect 3,"Atlanta, Georgia, USA",,"Atlanta, Georgia, United States of America",33.7490987,-84.3901849
306,/title/tt4765284/,Pitch Perfect 3,"Promenade des Anglais, Nice, Alpes-Maritimes, France",(Scene)                        ,"Promenade des Anglais, Vieux Nice, Nice, Alpes-Maritimes, Provence-Alpes-Côte d'Azur, France métropolitaine, France",43.686018,7.23752931889528
307,/title/tt4765284/,Pitch Perfect 3,"Cadiz, Spain",,"Cádiz, Bahía de Cádiz, Andalucía, España",36.5297438,-6.2928976
308,/title/tt0051139/,Untamed Youth,"Bakersfield, California, USA",,"Bakersfield, Kern County, California, United States of America",35.3738712,-119.0194639
309,/title/tt0107822/,The Piano,"Auckland, New Zealand",,"Auckland, 1010, New Zealand",-36.852095,174.7631803
310,/title/tt0107822/,The Piano,"Piha, Waitakere, Auckland Region, New Zealand",,,,
311,/title/tt0065333/,The Partridge Family,"Blondie Street, Columbia/Warner Bros. Ranch - 411 North Hollywood Way, Burbank, California, USA",,,,
312,/title/tt0065333/,The Partridge Family,"Columbia/Warner Bros. Ranch - 411 North Hollywood Way, Burbank, California, USA",(stage 29 and most exteriors)                        ,,,
313,/title/tt1068242/,Footloose,"Kennesaw, Georgia, USA",,"Kennesaw, Cobb, Georgia, United States of America",34.0234337,-84.6154897
314,/title/tt1068242/,Footloose,"Dallas, Georgia, USA",,"Dallas, Paulding County, Georgia, United States of America",33.9237141,-84.8407732
315,/title/tt1068242/,Footloose,"Senoia, Georgia, USA",,"Senoia Tree farm, Redbone, Lamar County, Georgia, United States of America",33.004109549999995,-84.12504155771607
316,/title/tt1068242/,Footloose,"Acworth, Georgia, USA",,"Acworth, Cobb, Georgia, United States of America",34.0659329,-84.6768796
317,/title/tt1398426/,Straight Outta Compton,"Los Angeles, California, USA",,"Los Angeles, Los Angeles County, California, United States of America",34.0536909,-118.2427666
318,/title/tt1398426/,Straight Outta Compton,"Los Angeles Memorial Sports Arena - 3939 S. Figueroa Street, Los Angeles, California, USA",(Arena Scenes)                        ,,,
319,/title/tt1398426/,Straight Outta Compton,"Hollywood Forever Cemetery - 6000 Santa Monica Blvd., Hollywood, Los Angeles, California, USA",(Funeral Scene)                        ,,,
320,/title/tt1398426/,Straight Outta Compton,"The Bridge Recording, 736 Salem Street, Glendale, California, USA","(Police Harassment Scene, exterior)                        ",,,
321,/title/tt1321510/,In the Heights,"Washington Heights, New York City, New York, USA",(In Washington Heights)                        ,"Washington Heights, Manhattan Community Board 12, Manhattan, New York County, New York, United States of America",40.8401984,-73.9402214
322,/title/tt2473602/,Get on Up,"Natchez, Mississippi, USA",,"Natchez, Adams County, Mississippi, United States of America",31.5604442,-91.403171
323,/title/tt0108147/,Sister Act 2: Back in the Habit,"Bank of America Building - 555 California Street, San Francisco, California, USA",,"Bank of America Building, 555, California Street, Chinatown, San Francisco, San Francisco City and County, California, 90104, United States of America",37.792103299999994,-122.40374513697353
324,/title/tt0108147/,Sister Act 2: Back in the Habit,"San Francisco, California, USA",,"San Francisco, San Francisco City and County, California, United States of America",37.7790262,-122.4199061
325,/title/tt0108147/,Sister Act 2: Back in the Habit,"City College of San Francisco, Alemany Campus - 750 Eddy Street, San Francisco, California, USA",,,,
326,/title/tt0108147/,Sister Act 2: Back in the Habit,"Las Vegas, Nevada, USA",,"Las Vegas, Clark County, Nevada, United States of America",36.1672559,-115.1485163
327,/title/tt0108147/,Sister Act 2: Back in the Habit,"Ramsay-Durfee Estate - 2425 S Western Ave, Los Angeles, California, USA",,,,
328,/title/tt2042568/,Inside Llewyn Davis,"Medford, Minnesota, USA",(road scenes)                        ,"Medford, Steele County, Minnesota, United States of America",44.1741299,-93.2463242
329,/title/tt2042568/,Inside Llewyn Davis,"422 East 9th Street, Manhattan, New York City, New York, USA",(Gaslight cafe exteriors)                        ,"Good Beer, 422, East 9th Street, East Village, Manhattan Community Board 3, Manhattan, New York County, New York, 10009, United States of America",40.7276003,-73.9838498
330,/title/tt2042568/,Inside Llewyn Davis,"Christopher Street, Greenwich Village, Manhattan, New York City, New York, USA",(Llewyn exits subway with the cat)                        ,"Christopher Street, Greenwich Village, Manhattan Community Board 2, Manhattan, New York County, New York, 10011-6832, United States of America",40.7341288,-73.9993539
331,/title/tt2042568/,Inside Llewyn Davis,"South Holland, Illinois, USA",(Abraham Lincoln Oasis)                        ,"South Holland, Thornton Township, Cook County, Illinois, 60473, United States of America",41.6008681,-87.6069894
332,/title/tt2042568/,Inside Llewyn Davis,"Greenwich Village, Manhattan, New York City, New York, USA",,"Greenwich Village, 7th Avenue South, West Village, Manhattan Community Board 2, Manhattan, New York County, New York, 10014, United States of America",40.7335844,-74.0028172
333,/title/tt2042568/,Inside Llewyn Davis,"New Rochelle, New York, USA",(As per credits)                        ,"New Rochelle, Westchester County, New York, United States of America",40.9115386,-73.7826363
334,/title/tt2042568/,Inside Llewyn Davis,"Pace University - 235 Elm Road, Briarcliff Manor, New York, USA",(Fred Harvey Oasis Dining Room)                        ,,,
335,/title/tt0103855/,The Bodyguard,"Beverly House - 1011 N. Beverly Drive, Beverly Hills, California, USA",(Rachel's estate - exteriors)                        ,,,
336,/title/tt0103855/,The Bodyguard,"Newark, New Jersey, USA",,"Newark, Essex County, New Jersey, United States of America",40.735657,-74.1723667
337,/title/tt0103855/,The Bodyguard,"Little Tokyo, Los Angeles, California, USA",,"Little Tokyo, Los Angeles, Los Angeles County, California, United States of America",34.0510343,-118.2386102
338,/title/tt0103855/,The Bodyguard,"Los Angeles City Hall - 200 North Spring Street, Downtown, Los Angeles, California, USA",,"Los Angeles City Hall, 200, North Spring Street, Civic Center, Downtown, Los Angeles, Los Angeles County, California, 90012, United States of America",34.0537767,-118.2428987
339,/title/tt0103855/,The Bodyguard,"Downtown, Los Angeles, California, USA",,"Downtown, Los Angeles, Los Angeles County, California, United States of America",34.0428494,-118.2476732
340,/title/tt0103855/,The Bodyguard,"Hollywood Palladium - 6215 Sunset Blvd., Hollywood, Los Angeles, California, USA",(backdrop)                        ,,,
341,/title/tt0103855/,The Bodyguard,"Lake Tahoe, California, USA",(Retreat)                        ,"Lake Tahoe, California, 96140, United States of America",39.08854049999999,-120.05035277301698
342,/title/tt0103855/,The Bodyguard,"Los Angeles, California, USA",,"Los Angeles, Los Angeles County, California, United States of America",34.0536909,-118.2427666
343,/title/tt0103855/,The Bodyguard,"Park Plaza Hotel - 607 S. Park View Street, Los Angeles, California, USA",(Oscars Academy Awards Ceremony - arrivals and exteriors)                        ,,,
344,/title/tt0103855/,The Bodyguard,"Sunset Blvd., Hollywood, Los Angeles, California, USA",,"Sunset Boulevard, East Hollywood, Los Angeles, Los Angeles County, California, 90027-5517, United States of America",34.0981514,-118.2912164
345,/title/tt0103855/,The Bodyguard,"Captiva Island, Florida, USA",,"Captiva Island, Lee County, Florida, 33924, United States of America",26.5275781,-82.1948171
346,/title/tt0103855/,The Bodyguard,"Fallen Leaf Road, Lake Tahoe, California, USA",(Retreat)                        ,,,
347,/title/tt0103855/,The Bodyguard,"Fontainebleau Hilton Resort - 4441 Collins Avenue, Miami Beach, Florida, USA",(AIDS Charity Benefit Concert)                        ,,,
348,/title/tt0103855/,The Bodyguard,"Miami Beach, Florida, USA",,"Miami Beach, Miami-Dade County, Florida, United States of America",25.7929198,-80.1353006
349,/title/tt0103855/,The Bodyguard,"Pantages Theater - 6233 Hollywood Blvd., Hollywood, Los Angeles, California, USA",(Oscars Academy Awards Ceremony - interiors)                        ,"Pantages Theater, Walk of Fame, Whitley Heights Historic District, Hollywood, Los Angeles, Los Angeles County, California, 90028-5420, United States of America",34.1022047,-118.32576733237735
350,/title/tt0146882/,High Fidelity,"Double Door - 1572 N. Milwaukee Avenue, West Town, Chicago, Illinois, USA",,,,
351,/title/tt0146882/,High Fidelity,USA,,United States,39.7837304,-100.4458825
352,/title/tt0146882/,High Fidelity,"Lane Technical High School - 2501 W. Addison Street, North Center, Chicago, Illinois, USA",,,,
353,/title/tt0146882/,High Fidelity,"Rogers Park, Chicago, Illinois, USA",,"Rogers Park, Chicago, Cook County, Illinois, 60626, United States of America",42.01053135,-87.67074819664808
354,/title/tt0146882/,High Fidelity,"Illinois, USA",,"Illinois, United States of America",40.0796606,-89.4337288
355,/title/tt0146882/,High Fidelity,"North Center, Chicago, Illinois, USA",,"North Center, Roscoe Village, Chicago, Cook County, Illinois, 60618-9997, United States of America",41.9561073,-87.6791596
356,/title/tt0146882/,High Fidelity,"West Town, Chicago, Illinois, USA",,"West Town, Chicago, Cook County, Illinois, United States of America",41.9014213,-87.6861661
357,/title/tt0146882/,High Fidelity,"Cesar E. Chavez Park - 11 Spinnaker Way, Berkeley, California, USA",,,,
358,/title/tt0146882/,High Fidelity,"Sauganash, Forest Glen, Chicago, Illinois, USA",,"Sauganash Park, Forest Glen, Chicago, Jefferson Township, Cook County, Illinois, United States of America",41.98816135,-87.73725549059438
359,/title/tt0146882/,High Fidelity,"Manhattan, New York City, New York, USA",(Dream Sequence)                        ,"Manhattan, New York County, New York, United States of America",40.7896239,-73.9598939
360,/title/tt6473066/,Clouds,"Montreal, Canada",,"Montréal, Agglomération de Montréal, Montréal (06), Québec, Canada",45.4972159,-73.6103642
361,/title/tt2077886/,The Phantom of the Opera at the Royal Albert Hall,"Royal Albert Hall, South Kensington, London, England, UK",(performance venue)                        ,"Royal Albert Hall, 4, Kensington Gore, Knightsbridge, City of Westminster, London, Greater London, England, SW7 2AP, United Kingdom",51.501004449999996,-0.17739457896545874
362,/title/tt3502172/,Mozart in the Jungle,"Purchase, New York, USA",(interior concert scenes)                        ,"Purchase, Harrison, Westchester County, New York, 10577, United States of America",41.0409305,-73.7145746
363,/title/tt0105417/,Sister Act,"St. Paul's Church, Church Street, Noe Valley, San Francisco, California, USA",,,,
364,/title/tt0105417/,Sister Act,"Reno Main Post Office, 50 S. Virginia Street, Reno, Nevada, USA",(Police Station Exteriors)                        ,,,
365,/title/tt0105417/,Sister Act,"Hollywood United Methodist Church - 6817 Franklin Avenue, Hollywood, Los Angeles, California, USA",,,,
366,/title/tt0105417/,Sister Act,"Virginia Street, Reno, Nevada, USA",,,,
367,/title/tt0105417/,Sister Act,"Santa Monica Airport - 3223 Donald Douglas Loop S., Santa Monica, California, USA",,"Santa Monica Airport, Donald Douglas Loop South, Santa Monica, Los Angeles County, California, 90405, United States of America",34.0174769,-118.44755251631068
368,/title/tt0105417/,Sister Act,"195 N. Virginia Street, Reno, Nevada, USA",(Whoopi Goldberg's Apartment)                        ,"195, North Virginia Street, Reno, Washoe County, Nevada, 89501, United States of America",39.526692499999996,-119.8136225024713
369,/title/tt0105417/,Sister Act,"Hall Realty, Church Street, San Francisco, California, USA",,"Hall Realty, 1651, Church Street, Noe Valley, San Francisco, San Francisco City and County, California, 94110, United States of America",37.7444047,-122.4266021
370,/title/tt0105417/,Sister Act,"Los Angeles, California, USA",,"Los Angeles, Los Angeles County, California, United States of America",34.0536909,-118.2427666
371,/title/tt0105417/,Sister Act,USA,,United States,39.7837304,-100.4458825
372,/title/tt0322330/,Freaky Friday,"Dorris Place Elementary School - 2225 Dorris Place, Los Angeles, California, USA",,,,
373,/title/tt0322330/,Freaky Friday,"Argyle Hotel - 8358 Sunset Blvd., West Hollywood, California, USA",,,,
374,/title/tt0322330/,Freaky Friday,"Palisades High School - 15777 Bowdoin Street, Pacific Palisades, Los Angeles, California, USA",,,,
375,/title/tt0322330/,Freaky Friday,"Pacific Palisades, Los Angeles, California, USA",,"Pacific Palisades, Los Angeles, Los Angeles County, California, United States of America",34.0480643,-118.5264706
376,/title/tt2268016/,Magic Mike XXL,"Tybee Island, Georgia, USA",(Mike's beach rental house at the corner of Solomon and 2nd Avenue)                        ,"Tybee Island, Chatham County, Georgia, 31328, United States of America",31.9987321,-80.8469427
377,/title/tt2268016/,Magic Mike XXL,"Myrtle Beach, South Carolina, USA",,"Myrtle Beach, Horry County, South Carolina, United States of America",33.6956461,-78.8900409
378,/title/tt2268016/,Magic Mike XXL,"Jekyll Island, Georgia, USA",(Jekyll Island Convention Center - Stripper Convention Exterior)                        ,"Jekyll Island, Glynn County, Georgia, 31527, United States of America",31.0655982,-81.41431464659931
379,/title/tt2268016/,Magic Mike XXL,"Tybee Island, Georgia, USA",(Dunes Inn & Suites located at 1409 Butler Avenue) (pool party & hotel room scenes)                        ,"Tybee Island, Chatham County, Georgia, 31328, United States of America",31.9987321,-80.8469427
380,/title/tt2268016/,Magic Mike XXL,"Savannah, Georgia, USA",(Gentlemen's Club located on Montgomery Cross Road) (Mad Mary's Drag Club scene)                        ,"Savannah, Chatham County, Georgia, United States of America",32.0809263,-81.0911768
381,/title/tt0249462/,Billy Elliot,"Easington, Peterlee, County Durham, England, UK",(Rialto Cinema)                        ,"Easington, County Durham, North East England, England, SR8 3FE, United Kingdom",54.7850506,-1.3530807
382,/title/tt0249462/,Billy Elliot,"Tees Transporter Bridge, Middlesbrough, North Yorkshire, England, UK",(Mrs Wilkinson is seen on it)                        ,,,
383,/title/tt0249462/,Billy Elliot,"Canary Wharf Underground Station, Canary Wharf, Isle of Dogs, London, England, UK",,"Adam, Reuters Plaza, Canary Wharf, Isle of Dogs, London Borough of Tower Hamlets, London, Greater London, England, E14 5AJ, United Kingdom",51.5037578,-0.0192977
384,/title/tt0249462/,Billy Elliot,"Dawdon, Seaham, County Durham, England, UK",(Bus station where Billy leaves for London)                        ,"Dawdon Crescent, Seaham, County Durham, North East England, England, SR7 7RH, United Kingdom",54.8305684,-1.3340567
385,/title/tt0249462/,Billy Elliot,"Newbiggin-by-the-Sea, Northumberland, England, UK",,"Newbiggin by the Sea, Northumberland, North East England, England, United Kingdom",55.1853665,-1.5109345
386,/title/tt0249462/,Billy Elliot,"Royal Ballet School, White Lodge, Richmond Park, Richmond, Surrey, England, UK",(Billy studies and trains for ballet)                        ,,,
387,/title/tt0249462/,Billy Elliot,"Pink Lane, Newcastle-Upon-Tyne, Tyne & Wear, England, UK",,"Pink Lane, Grainger Town, Newcastle upon Tyne, Tyne and Wear, North East England, England, NE1 5DW, United Kingdom",54.96967,-1.6189428
388,/title/tt0249462/,Billy Elliot,"Northfield School, Billingham, Middlesbrough, North Yorkshire, England, UK",(The school Billy attends)                        ,,,
389,/title/tt2848292/,Pitch Perfect 2,"Baton Rouge, Louisiana, USA",,"Baton Rouge, East Baton Rouge Parish, Louisiana, United States of America",30.4459596,-91.18738
390,/title/tt0462200/,Black Snake Moan,"Memphis, Tennessee, USA",,"Memphis, Shelby County, Tennessee, United States of America",35.1490215,-90.0516285
391,/title/tt0462200/,Black Snake Moan,"Tennessee, USA",,"Tennessee, United States of America",35.7730076,-86.2820081
392,/title/tt5117428/,Wild Rose,"Glasgow, Scotland, UK",,"Glasgow, Glasgow City, Scotland, G2 9SA, United Kingdom",55.8609825,-4.2488787
393,/title/tt5117428/,Wild Rose,"London, England, UK",,"London, Greater London, England, United Kingdom",51.5073219,-0.1276474
394,/title/tt0411705/,9 Songs,"Brixton Academy - 211 Stockwell Road, Brixton, London, England, UK","(""mosh pit"" concert scenes)                        ","O2 Academy Brixton, 211, Stockwell Road, Stockwell, London Borough of Lambeth, London, Greater London, England, SW9 9SL, United Kingdom",51.4656899,-0.11486140772733028
395,/title/tt0411705/,9 Songs,"Islington, London, England, UK",,"Islington, Greater London, England, N1, United Kingdom",51.5384287,-0.0999051
396,/title/tt0411705/,9 Songs,Norway,,"Norge, Namsos, Trøndelag, Norge",64.5731537,11.52803643954819
397,/title/tt0475290/,"Hail, Caesar!","Warner Brothers Burbank Studios - 4000 Warner Boulevard, Burbank, California, USA",(studio) (Capitol Studios exteriors)                        ,,,
398,/title/tt0475290/,"Hail, Caesar!","Los Angeles, California, USA",,"Los Angeles, Los Angeles County, California, United States of America",34.0536909,-118.2427666
399,/title/tt0475290/,"Hail, Caesar!","Walker Residence - 26336 Scenic Road, Carmel-by-the-Sea, California, USA",(Malibu home where Whitlock is held for ransom.)                        ,,,
400,/title/tt0475290/,"Hail, Caesar!","Good Luck Bar - 1514 Hillhurst Ave, Los Angeles, California, USA",(Chinese restaurant)                        ,"Good Luck Bar, 1514, Hillhurst Avenue, Los Feliz, Los Angeles, Los Angeles County, California, 90027, United States of America",34.0986066,-118.2872764
401,/title/tt0475290/,"Hail, Caesar!","Pelican Cove Park, 31300 Palos Verdes Dr. S., Rancho Palos Verdes, California, USA",(as Malibu)                        ,,,
402,/title/tt0475290/,"Hail, Caesar!","First Congregational Church - 540 S. Commonwealth Avenue, Los Angeles, California, USA",(church interiors)                        ,,,
403,/title/tt0475290/,"Hail, Caesar!","Sony Pictures Studios - 10202 W. Washington Blvd., Culver City, California, USA",(water ballet and other sound stages)                        ,,,
404,/title/tt0475290/,"Hail, Caesar!","Vasquez Rocks Natural Area Park - 10700 W. Escondido Canyon Rd., Agua Dulce, California, USA",(shooting of the western)                        ,,,
405,/title/tt0475290/,"Hail, Caesar!","Harvey Apartments - 5640 Santa Monica Boulevard, Los Angeles, California, USA",(Hotel & Barber Shop across the street from Joseph Silverman's office.)                        ,,,
406,/title/tt0475290/,"Hail, Caesar!","Downtown, Los Angeles, California, USA",,"Downtown, Los Angeles, Los Angeles County, California, United States of America",34.0428494,-118.2476732
407,/title/tt0475290/,"Hail, Caesar!",USA,,United States,39.7837304,-100.4458825
408,/title/tt3544112/,Sing Street,"St. Catherine's Park, Hanbury Lane, Dublin, Ireland",(park exteriors)                        ,,,
409,/title/tt3544112/,Sing Street,"Dún Laoghaire Harbour East, Dún Laoghaire-Rathdown, County Dublin, Ireland","(Site of ""A Beautiful Sea"" video and where Conor returns to look across the sea to Britain after Raphina has left.)                        ",,,
410,/title/tt3544112/,Sing Street,"Dalkey Island, Dublin, County Dublin, Ireland",(Location)                        ,"Dalkey Island, Shankill-Rathsallagh ED, Dalkey, Dún Laoghaire-Rathdown, County Dublin, Leinster, Ireland",53.27186485,-6.084156234497692
411,/title/tt3544112/,Sing Street,"Sancta Maria Primary School, Synge Street, Dublin, Ireland",(First sight of Raphina from the entrance here)                        ,"Sancta Maria Primary School, Synge Street, Portobello, Saint Kevin's, Dublin, County Dublin, Leinster, D08 W8HD, Ireland",53.3335713,-6.267206257780269
412,/title/tt3544112/,Sing Street,"Frederick Street North, Rotunda, Dublin, Ireland","(site of Conor and Raphina's coversation as he ""spins"" her home - site of DeafHear.ie anachronism)                        ",,,
413,/title/tt3544112/,Sing Street,"143 Greenlea Road, Dublin, Ireland","(Eamon's house, where the band practice)                        ","Greenlea Road, Kimmage (pt. Rathfarnham C.P.), Terenure C ED, Dublin, County Dublin, Leinster, DUBLIN 6W, Ireland",53.3082517,-6.2958105
414,/title/tt0445922/,Across the Universe,"Winnipeg, Manitoba, Canada",(location)                        ,"Winnipeg, Winnipeg (city), Manitoba, Canada",49.8955367,-97.1384584
415,/title/tt0445922/,Across the Universe,"Fort Perch Rock, Wirral, Merseyside, England, UK",(the lighthouse)                        ,,,
416,/title/tt0445922/,Across the Universe,"ABC No Rio, 156 Rivington Street, New York City, New York, USA",(Cafe Huh? Exterior)                        ,"ABC No RIo, 156, Rivington Street, Lower East Side, Manhattan Community Board 3, Manhattan, New York County, New York, 10002, United States of America",40.7192813,-73.9853944
417,/title/tt0445922/,Across the Universe,"Katz's Delicatessen - 205 East Houston Street, East Village, Manhattan, New York City, New York, USA",(location)                        ,,,
418,/title/tt0445922/,Across the Universe,"Princeton University, Princeton, New Jersey, USA",(location)                        ,"Art Museum, Elm Drive, Princeton, Mercer County, New Jersey, 08544, United States of America",40.346995,-74.65763484228626
419,/title/tt0445922/,Across the Universe,"New York City, New York, USA",(location)                        ,"New York, United States of America",40.7127281,-74.0060152
420,/title/tt0445922/,Across the Universe,"Yonkers, New York, USA",(location)                        ,"Yonkers, Westchester County, New York, United States of America",40.9312099,-73.8987469
