,Code,Show Name,Location,Scene,geocodedLocation,latitude,longitude
0,/title/tt1086064/,Bill & Ted Face the Music,"18447 Three Rivers Rd, Covington, Louisiana, USA",(Dave Grohl's mansion)                        ,,,
1,/title/tt1327801/,Glee,"Paramount Studios - 5555 Melrose Avenue, Hollywood, Los Angeles, California, USA",(studio)                        ,,,
2,/title/tt1327801/,Glee,"Alex Theatre - 216 North Brand Boulevard, Glendale, California, USA",,,,
3,/title/tt8580274/,Eurovision Song Contest: The Story of Fire Saga,"Húsavík, Iceland",,"Húsavík, Norðurþing, Norðurland eystra, 640, Ísland",66.0433168,-17.3410402
4,/title/tt8580274/,Eurovision Song Contest: The Story of Fire Saga,"The SSE Hydro, Exhibition Way, Glasgow, Scotland, UK",(Eurovision Song Contest - exterior)                        ,,,
5,/title/tt8580274/,Eurovision Song Contest: The Story of Fire Saga,"Warner Bros. Studios, Leavesden, Hertfordshire, England, UK",,"Warner Bros Studios Leavesden, Essex Lane, Warner Bros. Studios Leavesden, Abbots Langley, Three Rivers, Hertfordshire, East of England, England, WD25 7LP, United Kingdom",51.6934642,-0.4205376395864987
6,/title/tt8580274/,Eurovision Song Contest: The Story of Fire Saga,"Knebworth House, Stevenage, Hertfordshire, England, UK",(Alexander Letmov's mansion/castle)                        ,"Knebworth, Station Approach, Knebworth, Hertfordshire, East of England, England, SG3 6AT, United Kingdom",51.8670421,-0.187051
7,/title/tt8580274/,Eurovision Song Contest: The Story of Fire Saga,"Conway Hall, London, England, UK",(Iceland song contest)                        ,"Conway Hall, 25, Red Lion Square, Gray's Inn, Holborn, London Borough of Camden, London, Greater London, England, WC1R 4RL, United Kingdom",51.51976105,-0.11828118182579667
8,/title/tt8580274/,Eurovision Song Contest: The Story of Fire Saga,"University of Iceland, Reykjavík, Iceland",(The Icelandic Public Television building)                        ,"Háskóli Íslands, Tjarnargata, Tjarnarbrekka, Miðborg, Reykjavíkurborg, Höfuðborgarsvæðið, 101, Ísland",64.13994175,-21.949059100908592
9,/title/tt0096928/,Bill & Ted's Excellent Adventure,"Metrocenter Mall - 9801 N. Metro Pkwy W., Phoenix, Arizona, USA",(Joan of Arc scenes)                        ,,,
10,/title/tt0096928/,Bill & Ted's Excellent Adventure,"Coronado High School - 2501 N. 74th Street, Scottsdale, Arizona, USA",,,,
11,/title/tt0096928/,Bill & Ted's Excellent Adventure,"1010 West Southern Avenue, Tempe, Arizona, USA",(Circle K)                        ,"1010, West Southern Avenue, Contempo Tempe, Tempe, Maricopa County, Arizona, 85282, United States of America",33.392953,-111.95246248979592
12,/title/tt0096928/,Bill & Ted's Excellent Adventure,"7337 E 2nd St, Scottsdale, Arizona, USA",(Police Station)                        ,"Scottsdale Radiation Oncology Center, 7337, East 2nd Street, Scottsdale, Maricopa County, Arizona, 85251, United States of America",33.491087449999995,-111.9235819
13,/title/tt0096928/,Bill & Ted's Excellent Adventure,"N. 18th Street & W. Bethany Home Road, Phoenix, Arizona, USA",(Bill's house)                        ,,,
14,/title/tt0096928/,Bill & Ted's Excellent Adventure,"AMF Tempe Village Lanes - 4407 S. Rural Road, Tempe, Arizona, USA",(bowling alley scenes)                        ,,,
15,/title/tt0096928/,Bill & Ted's Excellent Adventure,"Tempe, Arizona, USA",,"Tempe, Maricopa County, Arizona, United States of America",33.4255056,-111.9400125
16,/title/tt0096928/,Bill & Ted's Excellent Adventure,"San Dimas, California, USA",,"San Dimas, Los Angeles County, California, 91773, United States of America",34.1066756,-117.8067257
17,/title/tt0096928/,Bill & Ted's Excellent Adventure,"Scottsdale, Arizona, USA","(San Dimas, California, USA)                        ","Scottsdale, Maricopa County, Arizona, United States of America",33.4942189,-111.9260184
18,/title/tt0096928/,Bill & Ted's Excellent Adventure,Italy,,Italia,42.6384261,12.674297
19,/title/tt0096928/,Bill & Ted's Excellent Adventure,"Arizona, USA",,"Arizona, United States of America",34.395342,-111.7632755
20,/title/tt0096928/,Bill & Ted's Excellent Adventure,"Rome, Lazio, Italy",,"Roma Capitale, Lazio, Italia",41.85223935,12.631036615953583
21,/title/tt6966692/,Green Book,"Houmas House Plantation, Burnside, Louisiana, USA",(Raleigh concert venue)                        ,,,
22,/title/tt6966692/,Green Book,"English Turn Golf & Country Club, 1 Clubhouse Dr, New Orleans, Louisiana, USA",(Birmingham restaurant scene)                        ,,,
23,/title/tt6966692/,Green Book,"Carnegie Hall, New York City, New York, USA",,"Carnegie Hall, 7th Avenue, Midtown, Manhattan Community Board 5, Manhattan, New York County, New York, 10019, United States of America",40.765029999999996,-73.97988681588421
24,/title/tt6966692/,Green Book,"Aloha Motel, Metairie, Louisiana, USA",(First Green Book hotel)                        ,,,
25,/title/tt6966692/,Green Book,"Clover Grill, French Quarter, New Orleans, Louisiana, USA",(Gorman's hot dog competition)                        ,"Clover Grill, 900, Bourbon Street, Vieux Carre Historic District, French Quarter, New Orleans, Orleans Parish, Louisiana, 70130, United States of America",29.9602833,-90.0640319
26,/title/tt6966692/,Green Book,"Northshore Broadcasting building, Hammond, Louisiana, USA",(Vallelonga home exteriors)                        ,,,
27,/title/tt6966692/,Green Book,"The Roosevelt New Orleans - 130 Roosevelt Way, New Orleans, Louisiana, USA",(Memphis hotel exterior)                        ,"The Roosevelt New Orleans, A Waldorf Astoria Hotel, Roosevelt Way, Vieux Carre Historic District, Storyville, New Orleans, Orleans Parish, Louisiana, 70112, United States of America",29.9543187,-90.0720965
28,/title/tt6966692/,Green Book,"Sigle's Antiques, Royal Street, New Orleans, Louisiana, USA",(Pawn shop)                        ,,,
29,/title/tt6966692/,Green Book,"Macon, Georgia",,"Macon, Bibb County, Georgia, United States of America",32.8406946,-83.6324022
30,/title/tt6966692/,Green Book,"Louisiana, USA",,"Louisiana, United States of America",30.8703881,-92.007126
31,/title/tt6966692/,Green Book,"French Quarter, New Orleans, Louisiana, USA",,"French Quarter, New Orleans, Orleans Parish, Louisiana, 70116, United States of America",29.9595056,-90.0655668
32,/title/tt6966692/,Green Book,"Hammond, Louisiana, USA",,"Hammond, Tangipahoa Parish, Louisiana, United States of America",30.5043583,-90.4611995
33,/title/tt6966692/,Green Book,USA,,United States,39.7837304,-100.4458825
34,/title/tt2582802/,Whiplash,"Santa Clarita, California, USA",,"Santa Clarita, Los Angeles County, California, United States of America",34.3916641,-118.542586
35,/title/tt2582802/,Whiplash,"Orpheum Theater - 842 South Broadway, Downtown, Los Angeles, California, USA",(Carnegie Hall)                        ,,,
36,/title/tt1727824/,Bohemian Rhapsody,"Bovingdon Airfield, Bovingdon, Hertfordshire, UK",(Doubling for Wembley Arena Live Aid concert)                        ,"Bovingdon Airfield (disused), Lysander Close, Bovingdon, Hertfordshire, East of England, England, HP3 0RY, United Kingdom",51.7285504,-0.5420498
37,/title/tt1727824/,Bohemian Rhapsody,"Weybridge, Surrey, England, UK",(Church)                        ,"Weybridge, Surrey, South East, England, United Kingdom",51.3727175,-0.4549297
38,/title/tt1727824/,Bohemian Rhapsody,"Union Street, Southwark, London, England, UK",(Freddie throws his manager out of a limo)                        ,"Union Street, Borough, Southwark, London Borough of Southwark, London, Greater London, England, SE1 1SG, United Kingdom",51.5036633,-0.09341
39,/title/tt1727824/,Bohemian Rhapsody,Hong Kong,(studio)                        ,"香港島 Hong Kong Island, 香港 Hong Kong, China 中国",22.2793278,114.1628131
40,/title/tt1727824/,Bohemian Rhapsody,"Munich, Bavaria, Germany",(only establishing shot)                        ,"München, Bayern, Deutschland",48.1371079,11.5753822
41,/title/tt1727824/,Bohemian Rhapsody,"England, UK",,"England, United Kingdom",52.7954791,-0.5402402866174321
42,/title/tt1727824/,Bohemian Rhapsody,UK,,United Kingdom,54.7023545,-3.2765753
43,/title/tt1727824/,Bohemian Rhapsody,"Twickenham, Middlesex, England, UK",(exteriors of Freddy's parents house)                        ,,,
44,/title/tt1517451/,A Star Is Born,"Glastonbury Festival, Pilton, Somerset, England, UK",(festival scenes)                        ,,,
45,/title/tt1517451/,A Star Is Born,"Riverside County, California, USA",(location)                        ,"Riverside County, California, United States of America",33.7219991,-116.0372472
46,/title/tt1517451/,A Star Is Born,"Los Angeles, California, USA",,"Los Angeles, Los Angeles County, California, United States of America",34.0536909,-118.2427666
47,/title/tt1517451/,A Star Is Born,"Shrine Auditorium - 665 W. Jefferson Boulevard, Los Angeles, California, USA",(Grammys)                        ,"Shrine Auditorium, West Jefferson Boulevard, University Park, Los Angeles, Los Angeles County, California, 90089-0871, United States of America",34.0233199,-118.2815445
48,/title/tt1517451/,A Star Is Born,"Sunset Boulevard, Hollywood, California, USA",(Lady Gaga Face on Billboard)                        ,"Sunset Boulevard, East Hollywood, Los Angeles, Los Angeles County, California, 90027-5517, United States of America",34.0981514,-118.2912164
49,/title/tt1517451/,A Star Is Born,"Palm Springs Convention Center, Palm Springs, California, USA",(Pharmaceutical Convention)                        ,"Palm Springs Convention Center, East Amado Road, Old Las Palmas, Palm Springs, Riverside County, California, 92292, United States of America",33.82585005,-116.53796823301772
50,/title/tt1517451/,A Star Is Born,"Chateau Marmont - 8221 Sunset Blvd., Hollywood, Los Angeles, California, USA",(The hotel where they see Ally's face on billboard)                        ,"Chateau Marmont, 8221, West Sunset Boulevard, Sunset Strip, Hollywood Hills West, West Hollywood, Los Angeles County, California, 90046, United States of America",34.098249749999994,-118.36840487975618
51,/title/tt1517451/,A Star Is Born,"Millennium Biltmore Hotel - 506 S Grand Avenue, Downtown, Los Angeles, California, USA",(Service ramp in opening titles)                        ,"Millennium Biltmore Hotel, 506, South Grand Avenue, Financial District, Downtown, Los Angeles, Los Angeles County, California, 90071, United States of America",34.049275,-118.25352705575739
52,/title/tt2380307/,Coco,"Pixar Animation Studios - 1200 Park Avenue, Emeryville, California, USA",,"Pixar Animation Studios, 1200, Park Avenue, Longfellow, Emeryville, Alameda County, California, 94608, United States of America",37.832671399999995,-122.28369454930086
53,/title/tt3890160/,Baby Driver,"Atlanta, Georgia, USA",,"Atlanta, Georgia, United States of America",33.7490987,-84.3901849
54,/title/tt3890160/,Baby Driver,"Dunwoody, Georgia, USA",(exterior scenes)                        ,"Dunwoody, DeKalb County, Georgia, 30338, United States of America",33.9462467,-84.3342749
55,/title/tt3890160/,Baby Driver,"Juliette, Georgia, USA",,"Juliette, Monroe County, Georgia, United States of America",33.1069934,-83.7991173
56,/title/tt3890160/,Baby Driver,USA,,United States,39.7837304,-100.4458825
57,/title/tt3783958/,La La Land,"Griffith Observatory, 2800 E Observatory Rd, Los Angeles, California, USA",(love dance in the planetarium)                        ,"Griffith Observatory, 2800, East Observatory Road, Griffith Park, Los Angeles, Los Angeles County, California, 90027, United States of America",34.11821875,-118.30029332196601
58,/title/tt3783958/,La La Land,"Hermosa Beach Pier, Pier Ave, Hermosa Beach, California, USA",(Sebastian dances on pier)                        ,,,
59,/title/tt3783958/,La La Land,"Long Beach, California, USA",(3rd St. and Gaviota residential)                        ,"Long Beach, Los Angeles County, California, United States of America",33.7690164,-118.1916048
60,/title/tt3783958/,La La Land,"Watts Towers - 1765 E. 107th Street, Watts, Los Angeles, California, USA",(Mia and Sebastian)                        ,"Watts Towers, East 107th Street, Watts, Los Angeles, Los Angeles County, California, 90002, United States of America",33.9386986,-118.2409481
61,/title/tt3783958/,La La Land,"Rialto Theatre - 1023 S. Fair Oaks Avenue, South Pasadena, California, USA","(exterior; Mia & Sebatian attend ""Rebel Without A Cause"")                        ",,,
62,/title/tt3783958/,La La Land,"The Blind Donkey - 149 Linden Ave, Long Beach, California, USA",(Seb's - interior)                        ,,,
63,/title/tt3783958/,La La Land,"W 4th St, Los Angeles, California, USA",(car interior; Mia & husband in traffic jam before pulling onto offramp)                        ,"West 4th Street, Windsor Square, Los Angeles, Los Angeles County, California, 90036-2829, United States of America",34.0671443,-118.3273089
64,/title/tt3783958/,La La Land,"1648 Wilcox Ave, Los Angeles, California, USA",(Lipton's restaurant - exterior)                        ,"1648, Wilcox Avenue, Hancock Park, Los Angeles, Los Angeles County, California, 90028, United States of America",34.09693573913044,-118.33090597658862
65,/title/tt3783958/,La La Land,"Smoke House Restaurant - 4420 West Lakeside Drive, Burbank, California, USA",(Lipton's restaurant - interior)                        ,,,
66,/title/tt3783958/,La La Land,"8225 Beverly Boulevard, Los Angeles, California, USA",(Mia leaves friends in restaurant and walks to her car)                        ,"Beverly Boulevard, Los Angeles, Los Angeles County, California, 90004, United States of America",34.0762868,-118.3008171
67,/title/tt3783958/,La La Land,"1735 Bird Way, Long Beach, California, USA",(Sebastian drives down alley and turns wrong way onto one-way street)                        ,"1735, Bird Way, Long Beach, Los Angeles County, California, 90802, United States of America",33.768893265306126,-118.17055832653061
68,/title/tt3783958/,La La Land,"Santa Clarita, California, USA",(as Boulder City)                        ,"Santa Clarita, Los Angeles County, California, United States of America",34.3916641,-118.542586
69,/title/tt3783958/,La La Land,"Dan Tana's, 9071 California Route 2, West Hollywood, California, USA",(old-timey restaurant where Sebastian plays the piano)                        ,,,
70,/title/tt3783958/,La La Land,"EastWest Studios - 6000 W Sunset Blvd, Hollywood, California, USA",(studio) (Recording Studio - interior)                        ,,,
71,/title/tt3783958/,La La Land,"Cafe Club Fais Do-Do, 5257 W Adams Blvd, Los Angeles, California, USA",(Del Rio Theater - exterior)                        ,"Cafe Club Fais Do Do, 5257, West Adams Boulevard, West Adams, Los Angeles, Los Angeles County, California, 90016, United States of America",34.0327381,-118.35710470408392
72,/title/tt3783958/,La La Land,"Hollywood Center Studios - 1040 N. Las Palmas Avenue, Hollywood, Los Angeles, California, USA",(Looking into the sound stage set)                        ,"Hollywood Center Studios, Romaine Street, Hollywood, Los Angeles, Los Angeles County, California, 90038, United States of America",34.08981165,-118.33500930891499
73,/title/tt3783958/,La La Land,"Regent Theater - 448 S. Main Street, Downtown, Los Angeles, California, USA",(Sebastian at band's photoshoot)                        ,,,
74,/title/tt3783958/,La La Land,"4533 Estrondo Dr, Encino, Los Angeles, California, USA",(pool party)                        ,"4533, Estrondo Drive, Encino, Los Angeles, Los Angeles County, California, 91436, United States of America",34.15258034353461,-118.50042259497157
75,/title/tt3783958/,La La Land,"880 La Loma Rd., Pasadena, California, USA",(Sebastian playing piano at outdoor wedding reception)                        ,"880, La Loma Road, Pasadena, Los Angeles County, California, 91105, United States of America",34.133842183673465,-118.16848253061225
76,/title/tt3783958/,La La Land,"Orcutt Ranch Horticulture Center - 23600 Roscoe Blvd, Canoga Park, Los Angeles, California, USA",(Fantasy montage Mia and Seb house exterior)                        ,,,
77,/title/tt3783958/,La La Land,"St. Luke Medical Center, 2632 E. Washington Blvd., Pasadena, California, USA",(Mia parks her car in a large parking lot before audition)                        ,,,
78,/title/tt3783958/,La La Land,"Will Rogers Memorial Park - 9650 Sunset Blvd, Beverly Hills, California, USA","(Mia's sister's engagement, beside large fountain)                        ",,,
79,/title/tt2066051/,Rocketman,"Royal Albert Hall, South Kensington, London, England, UK",(exterior scenes)                        ,"Royal Albert Hall, 4, Kensington Gore, Knightsbridge, City of Westminster, London, Greater London, England, SW7 2AP, United Kingdom",51.501004449999996,-0.17739457896545874
80,/title/tt2066051/,Rocketman,"Cannes, France",(I'm Still Standing)                        ,"Cannes, Grasse, Alpes-Maritimes, Provence-Alpes-Côte d'Azur, France métropolitaine, France",43.5515198,7.0134418
81,/title/tt2066051/,Rocketman,"Dodger Stadium - 1000 Vin Scully Avenue, Chavez Ravine, Elysian Park, Los Angeles, California, USA",(Rocket Man Scene)                        ,,,
82,/title/tt2066051/,Rocketman,"New York City, New York, USA",,"New York, United States of America",40.7127281,-74.0060152
83,/title/tt2066051/,Rocketman,USA,,United States,39.7837304,-100.4458825
84,/title/tt0190590/,"O Brother, Where Art Thou?","D'Lo Water Park, D'Lo, Mississippi, USA",(sirens scene)                        ,"D'lo Water Park, 135, D'Lo, Simpson County, Mississippi, 39062, United States of America",31.9808427,-89.896592
85,/title/tt0190590/,"O Brother, Where Art Thou?","Jackson, Mississippi, USA",,"Jackson, Hinds County, Mississippi, United States of America",32.2990384,-90.1847691
86,/title/tt0190590/,"O Brother, Where Art Thou?","Edwards, Mississippi, USA",(handcar)                        ,"Edwards, Hinds County, Mississippi, United States of America",32.3301465,-90.6056548
87,/title/tt0190590/,"O Brother, Where Art Thou?","Yazoo City, Mississippi, USA","(bank robbery, and the Woolworth store)                        ","Yazoo City, Yazoo County, Mississippi, 39194, United States of America",32.8551326,-90.4056469
88,/title/tt0190590/,"O Brother, Where Art Thou?","Alligator Lake, Long Lake Road, Vicksburg, Mississippi, USA",(mass baptism)                        ,,,
89,/title/tt0190590/,"O Brother, Where Art Thou?","Valley Park, Mississippi, USA",(radio station)                        ,"Valley Park, Issaquena County, Mississippi, 39177, United States of America",32.6334691,-90.8667691
90,/title/tt0190590/,"O Brother, Where Art Thou?","Los Angeles, California, USA",,"Los Angeles, Los Angeles County, California, United States of America",34.0536909,-118.2427666
91,/title/tt1981677/,Pitch Perfect,"Baton Rouge, Louisiana, USA",,"Baton Rouge, East Baton Rouge Parish, Louisiana, United States of America",30.4459596,-91.18738
92,/title/tt4288182/,Atlanta,"Atlanta, Georgia",,"Atlanta, Georgia, United States of America",33.7490987,-84.3901849
93,/title/tt0070992/,Happy Days,"565 North Cahuenga Avenue, Hancock Park, Los Angeles, California, USA",(exteriors: house)                        ,,,
94,/title/tt0070992/,Happy Days,"Los Angeles, California, USA",,"Los Angeles, Los Angeles County, California, United States of America",34.0536909,-118.2427666
95,/title/tt0181875/,Almost Famous,"San Diego Sports Arena - 3500 Sports Arena Boulevard San Diego, California, USA",(opening concert venue exterior where William first meets Penny)                        ,"Pechanga Arena, 3500, Sports Arena Boulevard, Loma Portal, Old Town, San Diego, San Diego County, California, 92110-9998, United States of America",32.7553042,-117.21226958193277
96,/title/tt0181875/,Almost Famous,"Continental Hyatt Hotel - 8401 W. Sunset Blvd., Hollywood, Los Angeles, California, USA",(Penny and William's encounter with eccentric Led Zeppelin fan)                        ,,,
97,/title/tt0181875/,Almost Famous,"Balboa Park - 1549 El Prado, San Diego, California, USA",,,,
98,/title/tt0181875/,Almost Famous,"Old Ajo Highway, Arizona, USA",,"Ajo, Pima County, Arizona, 85321, United States of America",32.3771926,-112.8645745
99,/title/tt0181875/,Almost Famous,"San Diego, California, USA",,"San Diego, San Diego County, California, United States of America",32.7174209,-117.1627714
100,/title/tt0181875/,Almost Famous,"Ambassador Hotel - 3400 Wilshire Boulevard, Los Angeles, California, USA",,,,
101,/title/tt0181875/,Almost Famous,"Interstate 19, Arizona, USA",,"Interstate Highway 19 Frontage Road, Arivaca Junction, Pima County, Arizona, 85645, United States of America",31.740083,-111.051401
102,/title/tt0181875/,Almost Famous,"Tumacacori, Arizona, USA",,"Tumacacori, Santa Cruz County, Arizona, 85640, United States of America",31.568702,-111.0523126
103,/title/tt0181875/,Almost Famous,"New York City, New York, USA",,"New York, United States of America",40.7127281,-74.0060152
104,/title/tt0181875/,Almost Famous,"Mormon Emmigrant Trail, El Dorado National Forest, California, USA",,,,
105,/title/tt0181875/,Almost Famous,"Los Angeles, California, USA",,"Los Angeles, Los Angeles County, California, United States of America",34.0536909,-118.2427666
106,/title/tt0181875/,Almost Famous,USA,,United States,39.7837304,-100.4458825
107,/title/tt0072562/,Saturday Night Live,"Studio 8H, NBC Studios - 30 Rockefeller Plaza, Manhattan, New York City, New York, USA",,,,
108,/title/tt0072562/,Saturday Night Live,"Los Angeles, California, USA",(Albert Brooks' shorts) (1975-1976)                        ,"Los Angeles, Los Angeles County, California, United States of America",34.0536909,-118.2427666
109,/title/tt0072562/,Saturday Night Live,"Vitagraph Studios - 15th Street & Locust Avenue, Flatbush, Brooklyn, New York City, New York, USA",(some 1976 episodes)                        ,,,
110,/title/tt8079248/,Yesterday,"Penny Lane, Mossley Hill, Liverpool, Merseyside, England, UK",,,,
111,/title/tt8079248/,Yesterday,"Cantley, Norfolk, England, UK",,"Cantley, Station Road, Cantley, Norfolk, East of England, England, NR13 3SH, United Kingdom",52.5787068,1.5136191
112,/title/tt8079248/,Yesterday,"Buckenham, Norfolk, England, UK","(studio) (""Tracks on the Tracks"" studio)                        ","Buckenham, Station Road, Strumpshaw, Broadland, Norfolk, East of England, England, NR13 4HP, United Kingdom",52.5977308,1.4700589
113,/title/tt8079248/,Yesterday,"Park Rd, Gorleston-on-Sea, Great Yarmouth, England, UK",(Malik Family Home)                        ,"Park Road, Magdalen Estate, Gorleston-on-Sea, Great Yarmouth, Norfolk, East of England, England, NR31 6EJ, United Kingdom",52.5682592,1.7271877
114,/title/tt8079248/,Yesterday,"Ramsholt, Woodbridge, Suffolk, England, UK",(Pub where Yesterday is played)                        ,,,
115,/title/tt8079248/,Yesterday,"Pier Hotel Gorleston-on-sea, Norfolk, England, UK",(beach & pier)                        ,"The Pier Hotel, Quay Road, Magdalen Estate, Gorleston-on-Sea, Great Yarmouth, Norfolk, East of England, England, NR31 6PP, United Kingdom",52.5709855,1.7338185813015743
116,/title/tt8079248/,Yesterday,"Reading, England, UK",,"Reading, South East, England, RG1 1DA, United Kingdom",51.456659,-0.9696512
117,/title/tt8079248/,Yesterday,"Moscow, Russia",,"Москва, Центральный административный округ, Москва, Центральный федеральный округ, Россия",55.7504461,37.6174943
118,/title/tt8079248/,Yesterday,Russia,,Россия,64.6863136,97.7453061
119,/title/tt2948372/,Soul,"New York City, New York, USA",,"New York, United States of America",40.7127281,-74.0060152
120,/title/tt7460806/,The Festival,"Ashton Court, Bristol, England, UK",(on location)                        ,"The Ashton, Ashton Road, Long Ashton, Leigh Woods, North Somerset, South West England, England, BS41 9LX, United Kingdom",51.4392615,-2.6349550528595787
121,/title/tt7460806/,The Festival,"Hengrove park, Bristol, England, UK",(location)                        ,"Hengrove Park, Inns Court, Hengrove, Bristol, City of Bristol, South West England, England, United Kingdom",51.41583215,-2.5819245259316417
122,/title/tt7460806/,The Festival,"Monmouth North Services, Monmouth, UK",,,,
123,/title/tt7460806/,The Festival,"Bramham Park, Bramham, Wetherby, Leeds, West Yorkshire, England, UK",,,,
124,/title/tt0253474/,The Pianist,"Instalatorów, Ochota, Warsaw, Mazowieckie, Poland",(Umschlagplatz scenes)                        ,,,
125,/title/tt0253474/,The Pianist,"Beelitz, Brandenburg, Germany",,"Beelitz, Potsdam-Mittelmark, Brandenburg, 14547, Deutschland",52.2363582,12.9700041
126,/title/tt0253474/,The Pianist,"Kozia, Sródmiescie, Warsaw, Mazowieckie, Poland",,"Kozia, Śródmieście Północne, Śródmieście, Warszawa, województwo mazowieckie, 00-075, Polska",52.2454475,21.0130101
127,/title/tt0253474/,The Pianist,"Zabkowska, Praga Pólnoc, Warsaw, Mazowieckie, Poland",,"Ząbkowska, Stara Praga, Praga-Północ, Warszawa, województwo mazowieckie, 03-742, Polska",52.2542953,21.0436457
128,/title/tt0253474/,The Pianist,"Hotel Saski, Plac Bankowy, Sródmiescie, Warsaw, Mazowieckie, Poland",,,,
129,/title/tt0253474/,The Pianist,"Kobylka, Mazowieckie, Poland",,"Kobyłka, powiat wołomiński, województwo mazowieckie, 05-230, Polska",52.33997115,21.190544150080274
130,/title/tt0253474/,The Pianist,"Rembertów, Warsaw, Mazowieckie, Poland",,"Rembertów, Warszawa, województwo mazowieckie, Polska",52.2614149,21.1628191
131,/title/tt0253474/,The Pianist,"Studio Babelsberg, Potsdam, Brandenburg, Germany",(studio)                        ,"Studio Babelsberg, 15, Babelsberg, Potsdam, Brandenburg, 14482, Deutschland",52.38260355,13.113726021425222
132,/title/tt0253474/,The Pianist,"Warsaw, Mazowieckie, Poland",,"Warszawa, województwo mazowieckie, Polska",52.2319581,21.0067249
