,Code,Show Name,Location,Scene,geocodedLocation,latitude,longitude
692,/title/tt0079766/,Quadrophenia,"Paddington Station, Paddington, London, England, UK",(Jimmy catches train to Brighton)                        ,"Paddington Station, Praed Street, Paddington, City of Westminster, London, Greater London, England, W2 1BA, United Kingdom",51.5155439,-0.1755506
693,/title/tt0079766/,Quadrophenia,"East Street, Brighton, East Sussex, England, UK",(where the police make many arrests)                        ,,,
694,/title/tt0079766/,Quadrophenia,"Porchester Halls, Queensway, Bayswater, London, England, UK",(public baths)                        ,,,
695,/title/tt0079766/,Quadrophenia,"Beachy Head, East Sussex, England, UK",(scooter ride)                        ,"Beachy Head, Beachy Head Road, Eastbourne, East Sussex, South East, England, BN20 7YA, United Kingdom",50.738185,0.2494669
696,/title/tt0079766/,Quadrophenia,"Goldhawk Road, Shepherd's Bush, London, England, UK",(chemists they break into - since demolished)                        ,"Goldhawk Road, Brook Green, London Borough of Hammersmith and Fulham, London, Greater London, England, W12 8EG, United Kingdom",51.5017564,-0.2265662
697,/title/tt0079766/,Quadrophenia,"Madeira Drive, Brighton, East Sussex, England, UK",(where mods first park up in Brighton)                        ,,,
698,/title/tt0079766/,Quadrophenia,"Wells House Road, North Acton, London, England, UK",(Cooper house)                        ,,,
699,/title/tt0079766/,Quadrophenia,"Bramley Arms Pub, Bramley Road, Notting Hill, London, England, UK","(the ""Brighton"" pub)                        ",,,
700,/title/tt0079766/,Quadrophenia,"Hammersmith Public Baths, Lime Grove, Shepherd's Bush, London, England, UK",(bath scene)                        ,,,
701,/title/tt0079766/,Quadrophenia,"Lee International Studios, Wembley, London, England, UK",(studio)                        ,,,
702,/title/tt0079766/,Quadrophenia,"Royalty Ballroom, Southgate, London, England, UK",(dance hall balcony jump)                        ,,,
703,/title/tt0079766/,Quadrophenia,"Wormholt Estate, Hemlock Road, Acton, London, England, UK",(estate where Jimmy crashes his scooter)                        ,,,
704,/title/tt0952640/,Alvin and the Chipmunks,"St. Andrews Bungalow Court, Hollywood, Los Angeles, California, USA",(Dave Seville's house)                        ,,,
705,/title/tt0952640/,Alvin and the Chipmunks,"Canoga Park, Los Angeles, California, USA",,"Canoga Park, Los Angeles, Los Angeles County, California, 91303, United States of America",34.2010541,-118.5977282
706,/title/tt0952640/,Alvin and the Chipmunks,"Orpheum Theater - 842 South Broadway, Downtown, Los Angeles, California, USA",,,,
707,/title/tt0952640/,Alvin and the Chipmunks,"Downtown, Los Angeles, California, USA",,"Downtown, Los Angeles, Los Angeles County, California, United States of America",34.0428494,-118.2476732
708,/title/tt0952640/,Alvin and the Chipmunks,"Hollywood, Los Angeles, California, USA",,"Hollywood, Los Angeles, Los Angeles County, California, 90028-8127, United States of America",34.0980031,-118.329523
709,/title/tt0952640/,Alvin and the Chipmunks,"Mammoth Mountain, California, USA",,"Mammoth Mountain, Mammoth Lakes, Mono County, California, United States of America",37.6307692,-119.0326342
710,/title/tt0120770/,A Night at the Roxbury,"Beverly Hills, California, USA",(Butabi home)                        ,"Beverly Hills, Los Angeles County, California, United States of America",34.0696501,-118.3963062
711,/title/tt0120770/,A Night at the Roxbury,"Crunch Gym - 8000 Sunset Blvd., West Hollywood, California, USA",(gym)                        ,,,
712,/title/tt0120770/,A Night at the Roxbury,"Mayan Theater - 1038 Hill Street, Downtown, Los Angeles, California, USA",(Roxbury interior)                        ,,,
713,/title/tt0120770/,A Night at the Roxbury,"Hollywood Moguls - 1650 N. Schrader Blvd., Hollywood, Los Angeles, California, USA",,,,
714,/title/tt0086361/,Staying Alive,"Philharmonic Auditorium - 427 West 5th Street and South Olive Street, Downtown, Los Angeles, California, USA",(Broadway theatre)                        ,,,
715,/title/tt0086361/,Staying Alive,"New York City, New York, USA",,"New York, United States of America",40.7127281,-74.0060152
716,/title/tt0086361/,Staying Alive,"Ethel Barrymore Theater, 243 W 47th St, New York City, New York, USA",,,,
717,/title/tt3793630/,The Lion Guard,Africa,,Africa,11.5024338,17.7578122
718,/title/tt7942742/,Her Smell,"Queens, New York City, New York, USA",,"Queens, Queens County, New York, United States of America",40.7498243,-73.7976337
719,/title/tt7942742/,Her Smell,"Manhattan, New York City, New York, USA",,"Manhattan, New York County, New York, United States of America",40.7896239,-73.9598939
720,/title/tt7942742/,Her Smell,"New York City, New York, USA",,"New York, United States of America",40.7127281,-74.0060152
721,/title/tt7942742/,Her Smell,USA,,United States,39.7837304,-100.4458825
722,/title/tt0096018/,Running on Empty,"89 Highwood Avenue, Tenafly, New Jersey, USA",(Lorna Phillips residence)                        ,"89, Highwood Avenue, Tenafly, Bergen County, New Jersey, 07670, United States of America",40.92672227657714,-73.95917733174329
723,/title/tt0096018/,Running on Empty,"Florida City, Florida, USA",(opening sequence)                        ,"Florida City, Miami-Dade County, Florida, 33034, United States of America",25.4480101,-80.479102
724,/title/tt0096018/,Running on Empty,"Tenafly, New Jersey, USA",,"Tenafly, Bergen County, New Jersey, 07670, United States of America",40.9253766,-73.9629154
725,/title/tt0096018/,Running on Empty,"Route 9W at Southbound Exit 4 of the Palisades Interstate Parkway, Alpine New Jersey, USA","(""Picnic area"" at end of film where family meets and Danny is told he's on his own)                        ",,,
726,/title/tt0096018/,Running on Empty,"Englewood, New Jersey, USA",(high school)                        ,"Englewood, Bergen County, New Jersey, 07361, United States of America",40.8928771,-73.9726381
727,/title/tt0096018/,Running on Empty,"New York City, New York, USA",,"New York, United States of America",40.7127281,-74.0060152
728,/title/tt0108394/,Trois couleurs: Bleu,"Place Monge, Paris 5, Paris, France",(street market)                        ,"Place Monge, Rue Larrey, Paris 5e Arrondissement, Paris, Île-de-France, France métropolitaine, 75005, France",48.8429053,2.3522772
729,/title/tt0108394/,Trois couleurs: Bleu,"Palais de Justice, Paris 1, Paris, France",(hall of justice)                        ,"Palais de Justice - Annexe, Rue de Cambrai, Quartier du Pont-de-Flandre, Paris, Île-de-France, France métropolitaine, 75019, France",48.8960916,2.3807621
730,/title/tt0108394/,Trois couleurs: Bleu,"Cité du Midi, Paris 18, Paris, France",(Julie goes to see Lucille in the sex club)                        ,"Cité du Midi, Quartier des Grandes-Carrières, Paris, Île-de-France, France métropolitaine, 75018, France",48.8830916,2.3354235
731,/title/tt0108394/,Trois couleurs: Bleu,"Rue Mouffetard, Paris 5, Paris, France",(cafe and flute player)                        ,"Rue Mouffetard, Paris 5e Arrondissement, Paris, Île-de-France, France métropolitaine, 75005, France",48.839421,2.3498938
732,/title/tt0758766/,Music and Lyrics,"Adventureland Amusement Park, Farmingdale, Long Island, New York, USA",,,,
733,/title/tt0758766/,Music and Lyrics,"694 Third Avenue, New York City, New York, USA",(exterior of Weight Not facade)                        ,"Third Avenue, The Bronx, Bronx County, New York, 10454-4606, United States of America",40.8109812,-73.9271484
734,/title/tt0758766/,Music and Lyrics,"Nassau Veterans Memorial Coliseum - 1255 Hempstead Turnpike, Uniondale, Long Island, New York, USA",,,,
735,/title/tt0758766/,Music and Lyrics,"Silvercup Studios - 4222 22nd Street, Long Island City, Queens, New York City, New York, USA",(studio)                        ,"Silvercup Studios Main Lot, 42-22, 22nd Street, Queens, Queens County, New York, 11101, United States of America",40.7513513,-73.94424267969767
736,/title/tt1279972/,Treme,"New Orleans, Louisiana, USA",,"New Orleans, Orleans Parish, Louisiana, United States of America",29.9499323,-90.0701156
737,/title/tt1279972/,Treme,"3rd Street & Danneel Street, New Orleans, Louisiana, USA",(Gigi's Lounge)                        ,,,
738,/title/tt0062430/,De val naar de Top,"Redding Center, Connecticut, USA",(Welles' Home in Lawrenceville)                        ,"Redding, Fairfield County, Connecticut, United States of America",41.3025956,-73.3834532
739,/title/tt0062430/,De val naar de Top,"Yale University, New Haven, Connecticut, USA",,"Yale University Art Gallery, 1111, Chapel Street, Downtown, New Haven, New Haven County, Connecticut, 06515, United States of America",41.3084354,-72.93087953034963
740,/title/tt0062430/,De val naar de Top,"Katonah, New York, USA",,"Katonah, Town of Bedford, Westchester County, New York, 10536, United States of America",41.25877,-73.6853852
741,/title/tt0062430/,De val naar de Top,"Santa Monica Courthouse, Santa Monica, California, USA",,"Los Angeles Superior Court, Santa Monica Courthouse, Olympic Drive, Santa Monica, Los Angeles County, California, 90401-2405, United States of America",34.0109216,-118.49042671521224
742,/title/tt0062430/,De val naar de Top,"Stage 15, 20th Century Fox Studios - 10201 Pico Blvd., Century City, Los Angeles, California, USA",(studio)                        ,,,
743,/title/tt0062430/,De val naar de Top,"Stage 19, 20th Century Fox Studios - 10201 Pico Blvd., Century City, Los Angeles, California, USA",,,,
744,/title/tt0101605/,The Commitments,"St Francis Xavier's Church, Gardiner Street, Dublin, County Dublin, Ireland",(church - The song 'A Whiter Shade Of Pale' played on organ)                        ,,,
745,/title/tt0101605/,The Commitments,"Ardmore Studios, Herbert Road, Bray, County Wicklow, Ireland",(studio)                        ,,,
746,/title/tt0101605/,The Commitments,"Sherriff Street, Dublin, County Dublin, Ireland",(opening sequence - Jimmy Rabbitte sells cassettes at the market)                        ,,,
747,/title/tt0101605/,The Commitments,"Guide Hall, Synge Street, Dublin, County Dublin, Ireland",(hall where the band begins)                        ,,,
748,/title/tt0101605/,The Commitments,"Sir John Rogerson's Quay, Dublin, County Dublin, Ireland",,"Sir John Rogerson's Quay, Dublin Docklands, South Dock ED, Dublin 2, County Dublin, Leinster, D02 F540, Ireland",53.3456707,-6.2342947
749,/title/tt0101605/,The Commitments,"Bray Head Hotel, Bray, County Wicklow, Ireland",(concert - expulsion of the keyboard player)                        ,"Bray Head Hotel, Fontenoy Terrace, Newcourt, Bray No 2, The Municipal District of Bray, County Wicklow, Leinster, A98 XW24, Ireland",53.196509899999995,-6.092701730759012
750,/title/tt0101605/,The Commitments,"Dublin, County Dublin, Ireland",(Barrytown)                        ,"Dublin, County Dublin, Leinster, Ireland",53.3497645,-6.2602732
751,/title/tt0101605/,The Commitments,"Ballymun, Dublin, County Dublin, Ireland",(Barrytown)                        ,"Ballymun, Airport ED, Fingal, County Dublin, Leinster, Ireland",53.412090899999995,-6.26316183771776
752,/title/tt0962726/,High School Musical 3: Senior Year,"East High School - 840 S 1300 E, Salt Lake City, Utah, USA",,,,
753,/title/tt0962726/,High School Musical 3: Senior Year,"Salt Lake City, Utah, USA",,"Salt Lake City, Salt Lake County, Utah, United States of America",40.7596198,-111.8867975
754,/title/tt0426931/,August Rush,"Muscoot Farm, Somers, New York, USA",(orphanage)                        ,"Muscoot Reservoir, Town of Somers, Westchester County, New York, 10536, United States of America",41.2964164,-73.6946268
755,/title/tt0426931/,August Rush,"Washington Square Park, Greenwich Village, Manhattan, New York City, New York, USA",,,,
756,/title/tt0426931/,August Rush,"Brooklyn Heights, Brooklyn, New York City, New York, USA",,"Brooklyn Heights, Brooklyn, Kings County, New York, United States of America",40.696084850000005,-73.9950278391265
757,/title/tt0426931/,August Rush,"Columbia University - Broadway & 116th Street, Manhattan, New York City, New York, USA",,,,
758,/title/tt0426931/,August Rush,"Sony Music Studios - 460 W. 54th Street, New York City, New York, USA",,,,
759,/title/tt0133189/,SLC Punk!,"Salt Lake City, Utah, USA",,"Salt Lake City, Salt Lake County, Utah, United States of America",40.7596198,-111.8867975
760,/title/tt0133189/,SLC Punk!,"Evanston, Wyoming, USA",,"Evanston, Uinta County, Wyoming, United States of America",41.2682462,-110.9637586
761,/title/tt1666185/,All Eyez on Me,"Las Vegas, Nevada, USA",,"Las Vegas, Clark County, Nevada, United States of America",36.1672559,-115.1485163
762,/title/tt1666185/,All Eyez on Me,"Los Angeles, California, USA",,"Los Angeles, Los Angeles County, California, United States of America",34.0536909,-118.2427666
763,/title/tt0065466/,Beyond the Valley of the Dolls,"Century City, Los Angeles, California, USA","(Bridge, and surrounding buildings, used in LA montage)                        ","Century City, Los Angeles, Los Angeles County, California, 90067, United States of America",34.0574263,-118.4147267
764,/title/tt0065466/,Beyond the Valley of the Dolls,"Los Angeles, California, USA",,"Los Angeles, Los Angeles County, California, United States of America",34.0536909,-118.2427666
765,/title/tt0065466/,Beyond the Valley of the Dolls,"California, USA",,"California, United States of America",36.7014631,-118.7559974
766,/title/tt1263670/,Crazy Heart,"Hard Rock Pavilion - 5601 University Blvd SE, Albuquerque, New Mexico, USA",(Bad opens for Tommy Sweet here at the Journal Pavilion.)                        ,,,
767,/title/tt1263670/,Crazy Heart,"Albuquerque BioPark Aquarium - 2601 Central Avenue NW, Albuquerque, New Mexico, USA",,,,
768,/title/tt1263670/,Crazy Heart,"Espanola, New Mexico, USA",,"Espanola, Rio Arriba County, New Mexico, United States of America",35.9910962,-106.0808358
769,/title/tt1263670/,Crazy Heart,"First Plaza Galeria, Albuquerque, New Mexico, USA",,"First Plaza Galeria, Copper Avenue Northwest, Downtown Albuquerque, Albuquerque, Bernalillo County, New Mexico, 87102, United States of America",35.0859369,-106.64987345681746
770,/title/tt1263670/,Crazy Heart,"Old St. Vincent Hospital - 228 E. Palace Avenue, Santa Fe, New Mexico, USA",,,,
771,/title/tt1263670/,Crazy Heart,"Santa Fe, New Mexico, USA",,"Santa Fe, Santa Fe County, New Mexico, United States of America",35.6869996,-105.9377997
772,/title/tt1263670/,Crazy Heart,"Galisteo, New Mexico, USA",,"Galisteo, Santa Fe County, New Mexico, United States of America",35.394459,-105.96045655684071
773,/title/tt1294226/,The Last Song,"Tybee Island, Georgia, USA",,"Tybee Island, Chatham County, Georgia, 31328, United States of America",31.9987321,-80.8469427
774,/title/tt1294226/,The Last Song,"Savannah, Georgia, USA",,"Savannah, Chatham County, Georgia, United States of America",32.0809263,-81.0911768
775,/title/tt0236348/,Josie and the Pussycats,Canada,,Canada,61.0666922,-107.9917071
776,/title/tt0236348/,Josie and the Pussycats,"Vancouver Aquarium, Stanley Park, Vancouver, British Columbia, Canada",(aquarium scenes)                        ,,,
777,/title/tt0236348/,Josie and the Pussycats,"British Columbia, Canada",,"British Columbia, Canada",55.001251,-125.002441
778,/title/tt0236348/,Josie and the Pussycats,"Kerrisdale, Vancouver, British Columbia, Canada",,"Kerrisdale, Vancouver, Metro Vancouver Regional District, British Columbia, Canada",49.2209848,-123.1595483795563
779,/title/tt0236348/,Josie and the Pussycats,"Lansdowne Park Shopping Centre, Richmond, British Columbia, Canada",(deleted shopping mall scenes)                        ,,,
780,/title/tt0236348/,Josie and the Pussycats,"North Vancouver, British Columbia, Canada",,"North Vancouver, Metro Vancouver Regional District, British Columbia, V7M 1H9, Canada",49.3207133,-123.0737831
781,/title/tt0236348/,Josie and the Pussycats,"Stanley Park, Vancouver, British Columbia, Canada",,"Stanley Park, Vancouver, Metro Vancouver Regional District, British Columbia, V6G, Canada",49.3019112,-123.14154052837662
782,/title/tt0236348/,Josie and the Pussycats,"Vancouver Art Gallery, 750 Hornby Street, Vancouver, British Columbia, Canada",,"Vancouver Art Gallery, 750, Hornby Street, Downtown, Vancouver, Metro Vancouver Regional District, British Columbia, V6Z 3B7, Canada",49.28287695,-123.1205638545168
783,/title/tt0236348/,Josie and the Pussycats,"Virgin MegaStore, Vancouver, British Columbia, Canada",(MegaStore scenes)                        ,,,
784,/title/tt0120731/,La leggenda del pianista sull'oceano,"Odessa, Ukraine",,"Одеса, Приморський район, Одеса, Одеська область, 65026, Україна",46.4873195,30.7392776
785,/title/tt0120731/,La leggenda del pianista sull'oceano,"Fratelli Cartocci srl, Rome, Lazio, Italy",(studio)                        ,,,
786,/title/tt0365830/,Tenacious D in The Pick of Destiny,"Venice, Los Angeles, California, USA",,"Venice, Los Angeles, Los Angeles County, California, United States of America",33.995044,-118.4668875
787,/title/tt0365830/,Tenacious D in The Pick of Destiny,"Simi Valley, California, USA",,"Simi Valley, Ventura County, California, United States of America",34.2694474,-118.781482
788,/title/tt0365830/,Tenacious D in The Pick of Destiny,"Long Beach, California, USA",,"Long Beach, Los Angeles County, California, United States of America",33.7690164,-118.1916048
789,/title/tt0365830/,Tenacious D in The Pick of Destiny,"Santa Clarita, California, USA",,"Santa Clarita, Los Angeles County, California, United States of America",34.3916641,-118.542586
790,/title/tt3704428/,Untitled Elvis Presley Project,"Village Roadshow Studios, Oxenford, Queensland, Australia",,"Village Roadshow Studios, Entertainment Road, Oxenford, Gold Coast City, Queensland, 4210, Australia",-27.910527700000003,153.3118145855983
791,/title/tt0907657/,Once,"Mountjoy Square East, Dublin, Ireland",(Girl's Home)                        ,"Mountjoy Square East, Mountjoy B ED, Dublin, County Dublin, Leinster, D01KT62, Ireland",53.3569671,-6.256509
792,/title/tt0907657/,Once,"Dunnes Stores, 62 Grafton St, Dublin, Ireland",(both opening busking scenes)                        ,"Dunnes Stores, Grafton Street, Royal Exchange B ED, Dublin 2, County Dublin, Leinster, D02 K198, Ireland",53.3406427,-6.2609772
793,/title/tt0907657/,Once,"Kiliney, County Dublin, Ireland",,,,
794,/title/tt0907657/,Once,"Dublin Airport, Dublin, County Dublin, Ireland",,"Dublin Airport, Swords Road, Cloghran, Airport ED, Swords, Fingal, County Dublin, Leinster, K67 T6P6, Ireland",53.4288026,-6.247592522077657
795,/title/tt5189554/,Soy Luna,"Cancún, Mexico",,"Cancún, Benito Juárez, Quintana Roo, México",21.1617854,-86.8510468
796,/title/tt5189554/,Soy Luna,"Palacio Sans Souci, Buenos Aires, Argentina",(exteriors: Villa Benson)                        ,"Palacio Sans Souci, Martín Fierro, Punta Chica, Victoria, Partido de San Fernando, Buenos Aires, B1644BHH, Argentina",-34.445835599999995,-58.54264190521256
797,/title/tt5189554/,Soy Luna,"Villa La Joya, Cancún, Mexico",(exteriors: Villa in Cancún)                        ,"Cancún, Benito Juárez, Quintana Roo, México",21.1617854,-86.8510468
798,/title/tt1231580/,Alvin en de Chipmunks 2,"Woodrow Wilson High School, Los Angeles, California, USA",,,,
799,/title/tt1231580/,Alvin en de Chipmunks 2,"Long Beach Unified School District, Long Beach, California, USA",,,,
800,/title/tt1231580/,Alvin en de Chipmunks 2,"Staples Center - 1111 S. Figueroa Street, Downtown, Los Angeles, California, USA",,"STAPLES Center, Figueroa Street, South Park, Downtown, Los Angeles, Los Angeles County, California, 90015, United States of America",34.0430046,-118.26705260279402
801,/title/tt1231580/,Alvin en de Chipmunks 2,"Chinatown, Los Angeles, California, USA",,"Chinatown, Los Angeles, Los Angeles County, California, 90012, United States of America",34.0638402,-118.2358676
802,/title/tt1231580/,Alvin en de Chipmunks 2,"Los Angeles, California, USA",,"Los Angeles, Los Angeles County, California, United States of America",34.0536909,-118.2427666
803,/title/tt0032455/,Fantasia,"Walt Disney Studios, 500 South Buena Vista Street, Burbank, California, USA",(Stage 1)                        ,,,
804,/title/tt8364138/,Stage Mother,"Halifax, Nova Scotia, Canada",,"Halifax, Nova Scotia, Canada",44.648618,-63.5859487
805,/title/tt0063462/,The Producers,"Broadway Theatre - 1681 Broadway, Manhattan, New York City, New York, USA",,"Broadway Theatre, 1681, Broadway, Theater District, Manhattan Community Board 5, Times Square, New York County, New York, 10019, United States of America",40.76339815,-73.98335504506701
806,/title/tt0063462/,The Producers,"Cort Theatre - 138 West 48th Street, Manhattan, New York City, New York, USA",,"Cort Theatre, 138, West 48th Street, Theater District, Manhattan Community Board 5, Times Square, New York County, New York, 10036, United States of America",40.75910345,-73.98308983674377
807,/title/tt0063462/,The Producers,"New York City, New York, USA",,"New York, United States of America",40.7127281,-74.0060152
808,/title/tt0063462/,The Producers,"100 East 7th Street, Manhattan, New York City, New York, USA","(Franz Liebkind's stoop with ""concierge"" lady)                        ","100, East 7th Street, East Village, Manhattan Community Board 3, Manhattan, New York County, New York, 10009, United States of America",40.726518999999996,-73.98515899354263
809,/title/tt8800266/,Ema,"Valparaíso, Región de Valparaíso, Chile",,"Valparaíso, Provincia de Valparaíso, Región de Valparaíso, Chile",-33.0458456,-71.6196749
810,/title/tt0062601/,Laugh-In,"Burbank, California, USA",,"Burbank, Los Angeles County, California, United States of America",34.1816482,-118.3258554
811,/title/tt3859310/,How to Talk to Girls at Parties,"Sheffield, South Yorkshire, England, UK",(1970's London)                        ,"Sheffield, Yorkshire and the Humber, England, United Kingdom",53.3806626,-1.4702278
812,/title/tt3859310/,How to Talk to Girls at Parties,"London, England, UK",,"London, Greater London, England, United Kingdom",51.5073219,-0.1276474
813,/title/tt3859310/,How to Talk to Girls at Parties,"Wapping, London, England, UK",(1970's London)                        ,"Wapping, London Borough of Tower Hamlets, London, Greater London, England, E1W 2PY, United Kingdom",51.5054363,-0.0587291
814,/title/tt3859310/,How to Talk to Girls at Parties,"Ham, London, England, UK",(1970's London)                        ,"Ham, London Borough of Richmond upon Thames, London, Greater London, England, TW10 7JB, United Kingdom",51.4347641,-0.3092987
815,/title/tt0078446/,Up in Smoke,"Roxy Theater - 9009 W. Sunset Blvd., Los Angeles, California, USA",(concert scenes)                        ,,,
816,/title/tt0078446/,Up in Smoke,"Pacific Coast Highway, Malibu, California, USA",,"Pacific Coast Highway, Malibu Beach, Malibu, Los Angeles County, California, 90265-4797, United States of America",34.0396049,-118.6665197
817,/title/tt0078446/,Up in Smoke,"Venice, Los Angeles, California, USA",,"Venice, Los Angeles, Los Angeles County, California, United States of America",33.995044,-118.4668875
818,/title/tt0078446/,Up in Smoke,"Tijuana, Baja California Norte, Mexico",,"Tijuana, Municipio de Tijuana, Baja California, 22105, México",32.5010188,-116.9646629
819,/title/tt0078446/,Up in Smoke,"3351 Riverside Drive, Los Angeles, California, USA",(pulled over by police officer)                        ,"Riverside Drive, Griffith Park, Los Angeles, Los Angeles County, California, 91201, United States of America",34.1549312,-118.2939369
820,/title/tt0078446/,Up in Smoke,"Interstate 210 at La Tuna Canyon Rd, Tujunga, California, USA",(hitchhiker pick-up)                        ,,,
821,/title/tt0094715/,Beaches,"Crystal Cove State Park - 8471 Pacific Coast Hwy., Laguna Beach, California, USA",,,,
822,/title/tt0094715/,Beaches,"880 La Loma Rd., Pasadena, California, USA",(Hillary's house)                        ,"880, La Loma Road, Pasadena, Los Angeles County, California, 91105, United States of America",34.133842183673465,-118.16848253061225
823,/title/tt0094715/,Beaches,"Hollywood Bowl - 2301 N. Highland Avenue, Hollywood, Los Angeles, California, USA",,,,
824,/title/tt0094715/,Beaches,"Laguna Beach, California, USA",,"Laguna Beach, Orange County, California, United States of America",33.5426975,-117.785366
825,/title/tt0094715/,Beaches,"Newport Beach, California, USA",,"Newport Beach, Orange County, California, United States of America",33.6170092,-117.9294401
826,/title/tt0094715/,Beaches,"Hollywood, Los Angeles, California, USA",,"Hollywood, Los Angeles, Los Angeles County, California, 90028-8127, United States of America",34.0980031,-118.329523
827,/title/tt0094715/,Beaches,"San Francisco, California, USA",,"San Francisco, San Francisco City and County, California, United States of America",37.7790262,-122.4199061
828,/title/tt0026778/,A Night at the Opera,"Metro-Goldwyn-Mayer Studios - 10202 W. Washington Blvd., Culver City, California, USA",(studio)                        ,,,
829,/title/tt0026778/,A Night at the Opera,"New York City, New York, USA",,"New York, United States of America",40.7127281,-74.0060152
830,/title/tt0117631/,Shine,"Royal Albert Hall, South Kensington, London, England, UK",,"Royal Albert Hall, 4, Kensington Gore, Knightsbridge, City of Westminster, London, Greater London, England, SW7 2AP, United Kingdom",51.501004449999996,-0.17739457896545874
831,/title/tt0117631/,Shine,"Adelaide Botanic Gardens & Park, Adelaide, South Australia, Australia",,"Adelaide Botanic Gardens, Botanic Road, Adelaide, Adelaide City Council, South Australia, 5000, Australia",-34.91821515,138.61147029170678
