,Code,Show Name,Location,Scene,geocodedLocation,latitude,longitude
1119,/title/tt1772288/,Danny Collins,"Hilton Woodcliff Lake, 200 Tice Boulevard, Woodcliff Lake, New Jersey, USA","(Where Danny Collins begins his journey toward family, and self)                        ","Hilton Woodcliff Lake, Tice Boulevard, Tice's Corner Marketplace, Woodcliff Lake, Bergen County, New Jersey, 07677, United States of America",41.0427695,-74.0791977
1120,/title/tt1772288/,Danny Collins,"Chateau Marmont - 8221 Sunset Blvd., Hollywood, Los Angeles, California, USA",(Billboard scene)                        ,"Chateau Marmont, 8221, West Sunset Boulevard, Sunset Strip, Hollywood Hills West, West Hollywood, Los Angeles County, California, 90046, United States of America",34.098249749999994,-118.36840487975618
1121,/title/tt0274309/,24 Hour Party People,"Granada Studios, Quay Street, Manchester, Greater Manchester, England, UK",,"Granada Studios, Back Quay Street, Spinningfields, City Centre, Manchester, Greater Manchester, North West England, England, M3 3BE, United Kingdom",53.4793541,-2.2553765
1122,/title/tt0274309/,24 Hour Party People,"Whitworth Street West, Manchester, Greater Manchester, England, UK",(Haçienda club exteriors)                        ,"Whitworth Street West, City Centre, Manchester, Greater Manchester, North West England, England, M3 4LG, United Kingdom",53.4744247,-2.2516027
1123,/title/tt0274309/,24 Hour Party People,"143 Cross Lane, Salford, Greater Manchester, England, UK",(Curtis' funeral service)                        ,"Salford Funeralcare, 143, Cross Lane, Pendleton, Salford, Greater Manchester, North West England, England, M5 4AL, United Kingdom",53.481519250000005,-2.2798794887084686
1124,/title/tt0274309/,24 Hour Party People,"Castle Street, Manchester, Greater Manchester, England, UK",(reporting on canals)                        ,"Castle Street, Castlefield, City Centre, Manchester, Greater Manchester, North West England, England, M3 4LZ, United Kingdom",53.4741936,-2.2539871
1125,/title/tt0274309/,24 Hour Party People,"Sitch Lane, Hayfield, High Peak, Derbyshire, England, UK",(Tony Wilson's house)                        ,"Sitch Lane, New Mills, High Peak, Derbyshire, East Midlands, England, SK22 1DJ, United Kingdom",53.3829636,-1.968176
1126,/title/tt0037059/,Meet Me in St. Louis,"La Grande Station, Downtown, Los Angeles, California, USA",,,,
1127,/title/tt0965404/,Bubble Guppies,"New York City, New York, USA",,"New York, United States of America",40.7127281,-74.0060152
1128,/title/tt0965404/,Bubble Guppies,"Los Angeles, California, USA",,"Los Angeles, Los Angeles County, California, United States of America",34.0536909,-118.2427666
1129,Code,Show Name,Location,Scene,"Location, Tucker County, West Virginia, United States of America",39.2138905,-79.6371124
1130,/title/tt3614530/,Jem and the Holograms,"Los Angeles, California, USA",,"Los Angeles, Los Angeles County, California, United States of America",34.0536909,-118.2427666
1131,/title/tt2974918/,Alvin and the Chipmunks: The Road Chip,"Olde Town Conyers, Georgia, USA","(Whistle Post Tavern, Center Street, Commercial Street, Railroad Street)                        ","Olde Town Conyers PATH Trail, Conyers, Rockdale County, Georgia, 30013-2028, United States of America",33.6423785,-84.0305231
1132,/title/tt2974918/,Alvin and the Chipmunks: The Road Chip,"Mezcalito's Grant Park, Atlanta, Georgia, USA",(location)                        ,,,
1133,/title/tt2974918/,Alvin and the Chipmunks: The Road Chip,"Shelborne Hotel - 1801 Collins Avenue, Miami Beach, Florida, USA",,,,
1134,/title/tt2974918/,Alvin and the Chipmunks: The Road Chip,"Austin, Texas, USA",,"Austin, Travis County, Texas, United States of America",30.2711286,-97.7436995
1135,/title/tt0770802/,Samsara,"Sultan Ahmed Mosque, Istanbul, Turkey",,,,
1136,/title/tt0770802/,Samsara,Indonesia,,Indonesia,-2.4833826,117.8902853
1137,/title/tt0770802/,Samsara,"Bagan, Burma",,"ပုဂံ, ညောင်ဦးခရိုင်, မန္တလေးတိုင်း, 55000, Myanmar",21.1317111,94.8623644
1138,/title/tt0770802/,Samsara,"Petra, Jordan",,"البتراء (Petra), ""Royal tombs"" footpath, أم صيحون, معان, 71811, Jordan / الأُرْدُن",30.3273975,35.4464006
1139,/title/tt0770802/,Samsara,Palestine,,"الأراضي الفلسطينية, שטח C, יהודה ושומרון, Palestinian Territory",31.94696655,35.27386547291496
1140,/title/tt0770802/,Samsara,"Giza, Egypt",,"الجيزة, محافظة الجيزة‎, 12524, Egypt / مصر",29.9870753,31.2118063
1141,/title/tt0770802/,Samsara,"Tokyo, Japan",,"東京都, 日本 (Japan)",35.6828387,139.7594549
1142,/title/tt0770802/,Samsara,Jordan,,الأردن,31.1667049,36.941628
1143,/title/tt0770802/,Samsara,China,,中国,35.000074,104.999927
1144,/title/tt0770802/,Samsara,"Yosemite Valley, Yosemite National Park, California, USA",,,,
1145,/title/tt0770802/,Samsara,"Tibet, China",,"西藏自治区, China 中国",29.8556443,90.8749807
1146,/title/tt0770802/,Samsara,"City of the Dead, Egypt",,,,
1147,/title/tt0770802/,Samsara,"Adiyaman, Turkey",(location)                        ,"Adıyaman, Güneydoğu Anadolu Bölgesi, Türkiye",37.78936,38.3141101
1148,/title/tt0770802/,Samsara,"Beijing, China",,"北京市, 通州区, 北京市, China 中国",39.9020668,116.718583
1149,/title/tt0770802/,Samsara,"Mont Saint-Michel, Manche, France",,"Le Mont-Saint-Michel, Avranches, Manche, Normandie, France métropolitaine, 50170, France",48.6358559,-1.5126096
1150,/title/tt0770802/,Samsara,"Panmunjom, North Korea",,"판문점, 진서면, 경기도, 대한민국",37.9559717,126.6773137
1151,/title/tt0770802/,Samsara,"Antelope Canyon, Arizona, USA",,"Canyon Antelope X, Coconino County, Arizona, United States of America",36.7988549,-111.3370049
1152,/title/tt0770802/,Samsara,"Canyonlands National Park, Utah, USA",,"Canyonlands National Park, Wayne County, Utah, United States of America",38.1666522,-109.984017
1153,/title/tt0770802/,Samsara,"Arlington National Cemetery, Arlington, Virginia, USA",,"Arlington National Cemetery, Radnor Heights, Arlington, Arlington County, Virginia, United States of America",38.8785384,-77.06911170120969
1154,/title/tt0770802/,Samsara,"Shanghai, China",,"上海市, 黄浦区, China 中国",31.2322758,121.4692071
1155,/title/tt0770802/,Samsara,"Silkeborg, Jylland, Denmark",,"Silkeborg, Silkeborg Kommune, Region Midtjylland, 8600, Danmark",56.169453,9.5495141
1156,/title/tt0770802/,Samsara,"Mont Blanc, Haute-Savoie, France",,"Le Mont-Blanc, Chamonix-Mont-Blanc, Bonneville, Haute-Savoie, Auvergne-Rhône-Alpes, France métropolitaine, 74400, France",45.894405500000005,6.842630900657754
1157,/title/tt0770802/,Samsara,"Paris Metro, Paris, France",,"Gare d'Austerlitz, Cour Seine, Quartier de la Salpêtrière, Paris, Île-de-France, France métropolitaine, 75013, France",48.8405357,2.3671301
1158,/title/tt0770802/,Samsara,"Cathédrale Notre Dame de Reims, Reims, Marne, France",,"Cathédrale Notre-Dame, Rue Robert de Coucy, Quartier Centre Ville, Reims, Marne, Grand Est, France métropolitaine, 51100, France",49.2537696,4.033918868033107
1159,/title/tt0770802/,Samsara,"Naples, Italy",,"Napoli, Campania, Italia",40.8359336,14.2487826
1160,/title/tt0770802/,Samsara,"St. Peter's Basilica, Vatican City",,"Basilica Sancti Petri, Forum Sancti Petri, Città del Vaticano, 00120, Città del Vaticano",41.9021569,12.453712068088656
1161,/title/tt0770802/,Samsara,"Chiba, Japan",,"千葉市, 千葉県, 日本 (Japan)",35.609985,140.118126
1162,/title/tt0770802/,Samsara,"Djenne, Mali",,"Djenné, Cercle de Djenné, Mopti, Mali",13.9051631,-4.5548581
1163,/title/tt0770802/,Samsara,"Quezon City, Metro Manila, Philippines",,"Quezon City, Second District, Metro Manila, Philippines",14.6509905,121.0486155
1164,/title/tt0770802/,Samsara,"Monument Valley, Arizona, USA",,"Monument Valley Navajo Tribal Park, Navajo County, Arizona, United States of America",36.9820026,-110.1108327
1165,/title/tt0770802/,Samsara,"Bishop, California, USA",,"Bishop, Inyo County, California, United States of America",37.363679,-118.3952405
1166,/title/tt0770802/,Samsara,"Long Beach, California, USA",,"Long Beach, Los Angeles County, California, United States of America",33.7690164,-118.1916048
1167,/title/tt0770802/,Samsara,"CostCo - 6100 Sepulveda Boulevard, Van Nuys, Los Angeles, California, USA",,,,
1168,/title/tt0770802/,Samsara,"Los Angeles, California, USA",,"Los Angeles, Los Angeles County, California, United States of America",34.0536909,-118.2427666
1169,/title/tt0770802/,Samsara,"Ninth Ward, New Orleans, Louisiana, USA",,,,
1170,/title/tt1071358/,Another Cinderella Story,"Sullivan Heights Secondary, Surrey, British Columbia, Canada",,,,
1171,/title/tt1551948/,Dance Academy,"Sydney, New South Wales, Australia",,"Sydney, New South Wales, Australia",-33.8548157,151.2164539
1172,/title/tt0074028/,The Muppet Show,"Studio D, BBC Elstree Centre/ATV Studios, Borehamwood, Hertfordshire, England, UK",(studio)                        ,"BBC Elstree D, Essex Road, BBC Elstree Centre, Elstree and Borehamwood, Hertsmere, Hertfordshire, East of England, England, WD6 1BH, United Kingdom",51.659156949999996,-0.2747307096641284
1173,/title/tt3164256/,Rock the Kasbah,Morocco,,Maroc / ⵍⵎⵖⵔⵉⴱ / المغرب,31.1728205,-7.3362482
1174,/title/tt1637574/,Conan,"Stage 15, Warner Brothers Burbank Studios - 4000 Warner Boulevard, Burbank, California, USA",(studio)                        ,,,
1175,/title/tt0420416/,Instant Star,"Toronto, Ontario, Canada",,"Toronto, Peel, Golden Horseshoe, Ontario, Canada",43.6534817,-79.3839347
1176,/title/tt4270458/,Roadies,"Vancouver, British Columbia, Canada",(Pilot)                        ,"Vancouver, Metro Vancouver Regional District, British Columbia, Canada",49.2608724,-123.1139529
1177,/title/tt0098987/,The Adventures of Ford Fairlane,"Red Rocks Amphitheatre, Colorado, USA",,"Red Rocks Amphitheatre, Trading Post Road, Idledale, Jefferson County, Colorado, 80465, United States of America",39.66539950000001,-105.20586468125
1178,/title/tt0098987/,The Adventures of Ford Fairlane,"Cross Roads of The World, Hollywood, California, USA",(Ford Fairlane's office)                        ,,,
1179,/title/tt0098987/,The Adventures of Ford Fairlane,"Sheats Apartments, 10919 Strathmore Dr., Westwood, Los Angeles, California, USA",,"Sheats Apartments, 10919, Strathmore Drive, Westwood Village, Westwood, Los Angeles, Los Angeles County, California, 90024, United States of America",34.0679912,-118.44966457911123
1180,/title/tt0098987/,The Adventures of Ford Fairlane,"Malibu, California, USA",,"Malibu, Los Angeles County, California, 90265-4797, United States of America",34.035591,-118.689423
1181,/title/tt0098987/,The Adventures of Ford Fairlane,"22716 Pacific Coast Hwy, Malibu, California, USA",(Ford Fairlane's home)                        ,"Pacific Coast Highway, Malibu Beach, Malibu, Los Angeles County, California, 90265-4797, United States of America",34.0396049,-118.6665197
1182,/title/tt6423362/,The Sun Is Also a Star,"New York City, New York, USA",,"New York, United States of America",40.7127281,-74.0060152
1183,/title/tt1754109/,Les Misérables in Concert: The 25th Anniversary,"The O2 Arena, London, England, UK",,"The O2 Arena, Up at The O2, Greenwich Peninsula, Royal Borough of Greenwich, London, Greater London, England, SE10 0DX, United Kingdom",51.502918,0.0030255532020142147
1184,/title/tt0097457/,Great Balls of Fire!,"Somerville, Tennessee, USA",,"Somerville, Fayette County, Tennessee, United States of America",35.2436969,-89.3500714
1185,/title/tt0097457/,Great Balls of Fire!,"Memphis, Tennessee, USA",,"Memphis, Shelby County, Tennessee, United States of America",35.1490215,-90.0516285
1186,/title/tt0097457/,Great Balls of Fire!,"West Memphis, Arkansas, USA",(Jet Center)                        ,"West Memphis, Crittenden County, Arkansas, United States of America",35.1464797,-90.1845388
1187,/title/tt0097457/,Great Balls of Fire!,USA,,United States,39.7837304,-100.4458825
1188,/title/tt0097457/,Great Balls of Fire!,"Royal Albert Hall, South Kensington, London, England, UK",,"Royal Albert Hall, 4, Kensington Gore, Knightsbridge, City of Westminster, London, Greater London, England, SW7 2AP, United Kingdom",51.501004449999996,-0.17739457896545874
1189,/title/tt0108265/,Swing Kids,"Prague, Czech Republic",,"Praha, okres Hlavní město Praha, Hlavní město Praha, Praha, Česká republika",50.0874654,14.4212535
1190,/title/tt0361696/,Raise Your Voice,"Flagstaff, Arizona, USA",,"Flagstaff, Coconino County, Arizona, United States of America",35.1987522,-111.6518229
1191,/title/tt0361696/,Raise Your Voice,"University High School - 11800 Texas Avenue, West Los Angeles, Los Angeles, California, USA",(high school)                        ,,,
1192,/title/tt0361696/,Raise Your Voice,"Mary Andrews Clark Memorial Home - 306 S. Loma Dr, Los Angeles, California, USA",(Music School)                        ,"Mary Andrews Clark Memorial Home, Loma Drive, Westlake, Los Angeles, Los Angeles County, California, 90017, United States of America",34.05942495,-118.26538220324139
1193,/title/tt0361696/,Raise Your Voice,"Los Angeles, California, USA",,"Los Angeles, Los Angeles County, California, United States of America",34.0536909,-118.2427666
1194,/title/tt0358135/,Shall We Dance,"South Drive, Winnipeg, Manitoba, Canada",,"South Drive, Wildwood, Fort Rouge–East Fort Garry, Winnipeg, Winnipeg (city), Manitoba, R3T 0B6, Canada",49.845372,-97.1337326
1195,/title/tt0358135/,Shall We Dance,"Winnipeg, Manitoba, Canada",,"Winnipeg, Winnipeg (city), Manitoba, Canada",49.8955367,-97.1384584
1196,/title/tt0352277/,De-Lovely,"Café de Paris, Coventry Street, Soho, London, England, UK",(Nightclub)                        ,,,
1197,/title/tt0352277/,De-Lovely,"Wilton's Music Hall, Grace's Alley, Ensign Street, Whitechapel, London, England, UK",(Theatre in bookend scenes with Gabriel)                        ,,,
1198,/title/tt0352277/,De-Lovely,"London, England, UK",,"London, Greater London, England, United Kingdom",51.5073219,-0.1276474
1199,/title/tt0352277/,De-Lovely,"Luton, Bedfordshire, England, UK",,"Luton Hoo, Hyde, Central Bedfordshire, East of England, England, LU1 3TQ, United Kingdom",51.8546669,-0.39775208129713563
1200,/title/tt0352277/,De-Lovely,Italy,,Italia,42.6384261,12.674297
1201,/title/tt0352277/,De-Lovely,"England, UK",,"England, United Kingdom",52.7954791,-0.5402402866174321
1202,/title/tt1839596/,Rockstar,"Prague, Czech Republic",(Czech Republic)                        ,"Praha, okres Hlavní město Praha, Hlavní město Praha, Praha, Česká republika",50.0874654,14.4212535
1203,/title/tt1839596/,Rockstar,"Mehboob Studios, Mumbai, Maharashtra, India",(studio)                        ,"Mehboob Studio, Mount Carmel Road, Mount Mary, Bandra West, Zone 3, Mumbai, Mumbai Suburban, Maharashtra, 400050, India",19.0524573,72.8247562
1204,/title/tt1839596/,Rockstar,"Betaab Valley, Pahalgam, Jammu & Kashmir, India",(Parts of Katiya Karun Song)                        ,,,
1205,/title/tt1839596/,Rockstar,"Hauz Khas complex, Delhi, India",(Where Heer and JJ drinks for the first time and makes list)                        ,"Hauz Khas, Sri Krishna Chaitanya Mahaprabhu Marg, Hauz Khas, Hauz Khas Tehsil, South Delhi, Delhi, 110017, India",28.5442564,77.2067072
1206,/title/tt1839596/,Rockstar,"Hindu College, Delhi, India",(Jordan's College)                        ,"Hindu College, Sudhir Bose Marg, Delhi University (North Campus), Civil Lines Tehsil, Central Delhi, Delhi, 110007, India",28.6839987,77.2120609
1207,/title/tt1839596/,Rockstar,"Norbulingka Institute, Dharamshala, Himachal Pradesh, India",(Parts of Sadda Haq Song)                        ,,,
1208,/title/tt1839596/,Rockstar,"Karlstejn Castle, Prague, Czech Republic",(Nargis asking Ranbir to drop her home and never meet again)                        ,,,
1209,/title/tt1839596/,Rockstar,"Prague State Opera House, Prague, Czech Republic",(Tum Ho Song)                        ,"Státní opera Praha, 57/75, Legerova, Vinohrady, Praha, okres Hlavní město Praha, Hlavní město Praha, Praha, 11000, Česká republika",50.080486449999995,14.43295481142897
1210,/title/tt1839596/,Rockstar,"Sychrov State Castle, Liberec District, Liberec Region, Czech Republic",(Parts of Hawa Hawa Song)                        ,,,
1211,/title/tt3623726/,Ricki and the Flash,"600 Tuckahoe Rd, Yonkers, New York, USA",(Barney McNabs Bar)                        ,"600, Tuckahoe Road, Mohegan Heights, Yonkers, Westchester County, New York, 10710, United States of America",40.95359532184691,-73.84663221941852
1212,/title/tt3623726/,Ricki and the Flash,"945 N. Broadway, Yonkers, New York, USA",(Untermyer Gardens Conservancy)                        ,"945, North Broadway, Greystone, Yonkers, Westchester County, New York, 10701, United States of America",40.965505,-73.885516
1213,/title/tt0414766/,Rebelde,"Calgary, Alberta, Canada",,"Calgary, Strathmore (town), Alberta, Canada",51.0534234,-114.0625892
1214,/title/tt0414766/,Rebelde,"Valle de Bravo, Estado de México, Mexico",,"Valle de Bravo, Estado de México, México",19.1849101,-100.15126325880992
1215,/title/tt0414766/,Rebelde,"Mexico City, Distrito Federal, Mexico",,"México, Calle Benito Juárez, Unidad Habitacional Integración Latinoamericana, Naucalpan, 04350, México",19.337797000000002,-99.17851255290537
1216,/title/tt6483364/,Teen Spirit,"Montréal, Québec, Canada",,"Montréal, Agglomération de Montréal, Montréal (06), Québec, Canada",45.4972159,-73.6103642
1217,/title/tt6483364/,Teen Spirit,Canada,,Canada,61.0666922,-107.9917071
1218,/title/tt7369974/,Step Up: High Water,"Blackhall Studios, Atlanta, Georgia, USA",,,,
1219,/title/tt0434124/,Kinky Boots,"Northampton, Northamptonshire, England, UK",,"Northampton, Northamptonshire, East Midlands, England, United Kingdom",52.2381355,-0.8963907
1220,/title/tt0434124/,Kinky Boots,"Earl's Barton, Northamptonshire, England, UK",,"Earls Barton, Northamptonshire, East Midlands, England, NN6 0NB, United Kingdom",52.2641644,-0.7523224
1221,/title/tt0434124/,Kinky Boots,"Milan, Lombardia, Italy",,"Milano, Lombardia, Italia",45.4668,9.1905
1222,/title/tt0434124/,Kinky Boots,"London, England, UK",,"London, Greater London, England, United Kingdom",51.5073219,-0.1276474
1223,/title/tt0421082/,Control,"Macclesfield, Cheshire, England, UK",,"Macclesfield, Cheshire East, North West England, England, SK10 1AG, United Kingdom",53.2606635,-2.1255158
1224,/title/tt0421082/,Control,"Manchester, Greater Manchester, England, UK",(location)                        ,"Manchester, Greater Manchester, North West England, England, United Kingdom",53.4794892,-2.2451148
1225,/title/tt0421082/,Control,UK,,United Kingdom,54.7023545,-3.2765753
1226,/title/tt0092580/,Aria,"Las Vegas, Nevada, USA",(Liebestod section)                        ,"Las Vegas, Clark County, Nevada, United States of America",36.1672559,-115.1485163
1227,/title/tt0092580/,Aria,"Vienna, Austria",(Un Ballo In Maschera)                        ,"Wien, 1010, Österreich",48.2083537,16.3725042
1228,/title/tt0092580/,Aria,"North London, London, England, UK",(La Virgine Degli Angeli)                        ,"North, Topping Lane, London Borough of Hillingdon, London, Greater London, England, UB8 2TR, United Kingdom",51.5336005,-0.4798371972842037
1229,/title/tt0092580/,Aria,"Madonna Inn, 100 Madonna Rd., San Luis Obispo, California, USA",(Rigoletto)                        ,"Madonna Inn, 100, Madonna Road, San Luis Obispo, San Luis Obispo County, California, 93405, United States of America",35.2673282,-120.6747253462217
1230,/title/tt0092580/,Aria,"Windsor, Berkshire, England, UK",(Die Tote Stadt)                        ,"Windsor, Windsor and Maidenhead, South East, England, SL4 1SY, United Kingdom",51.4814958,-0.6133183
1231,/title/tt0092580/,Aria,"Battersea, London, England, UK",(Nessun Dorma)                        ,"Battersea, London Borough of Wandsworth, London, Greater London, England, SW11 3HW, United Kingdom",51.4707933,-0.172214
1232,/title/tt0092580/,Aria,"Scotland, UK",(Depuis Le Jour)                        ,"Scotland, United Kingdom",56.7861112,-4.1140518
1233,/title/tt0092580/,Aria,"London, England, UK",(studio) (Depuis Le Jour)                        ,"London, Greater London, England, United Kingdom",51.5073219,-0.1276474
1234,/title/tt0047422/,River of No Return,"Banff National Park, Alberta, Canada",,"Banff National Park, Improvement District No. 9, Alberta, Canada",51.4881335,-115.93804975198333
1235,/title/tt0047422/,River of No Return,"Salmon River, Idaho, USA",(river sequence)                        ,"Salmon River, Idaho County, Idaho, United States of America",45.633942,-116.2844491499316
1236,/title/tt0047422/,River of No Return,"Maligne River, Alberta, Canada",(river sequence)                        ,"Maligne River, Alberta, Canada",52.5430162,-117.4837587
1237,/title/tt0047422/,River of No Return,"Snake Indian River, Alberta, Canada",(river sequence)                        ,"Snake Indian River, Alberta, Canada",53.3600994,-118.4397659
1238,/title/tt0759364/,America's Got Talent,"Los Angeles, California, USA",,"Los Angeles, Los Angeles County, California, United States of America",34.0536909,-118.2427666
1239,/title/tt8521718/,The United States vs. Billie Holiday,"Montreal, Québec, Canada",(location)                        ,"Montréal, Agglomération de Montréal, Montréal (06), Québec, Canada",45.4972159,-73.6103642
1240,/title/tt1710295/,Doc McStuffins,Ireland,,Éire / Ireland,52.865196,-7.9794599
1241,/title/tt1710295/,Doc McStuffins,"Los Angeles, California, USA",,"Los Angeles, Los Angeles County, California, United States of America",34.0536909,-118.2427666
1242,/title/tt3004376/,The Real,"Los Angeles, California, USA",,"Los Angeles, Los Angeles County, California, United States of America",34.0536909,-118.2427666
1243,/title/tt5884230/,Brad's Status,"Boston, Massachusetts, USA",,"Boston, Suffolk County, Massachusetts, United States of America",42.3602534,-71.0582912
1244,/title/tt5884230/,Brad's Status,"Omni Mont-Royal Hotel, Montreal, Quebec, Canada",,,,
1245,/title/tt5884230/,Brad's Status,"Oscar Peterson Concert Hall, Concordia University, Montreal, Quebec, Canada",,,,
1246,/title/tt5884230/,Brad's Status,"Waverly Restaurant, Montreal, Quebec, Canada",,"Rue Waverly, Parc-Jarry, Montréal, Agglomération de Montréal, Montréal (06), Québec, H2N 1M4, Canada",45.538312,-73.6388932
1247,/title/tt5884230/,Brad's Status,"Notre-Dame-de-Grâce neighbourhood, Montreal, Quebec, Canada",,,,
1248,/title/tt0276033/,The Country Bears,"Toluca Lake Car Wash - 10515 Magnolia Boulevard, North Hollywood, Los Angeles, California, USA",,,,
1249,/title/tt0276033/,The Country Bears,"Nashville, Tennessee, USA",,"Nashville-Davidson, Davidson County, Tennessee, United States of America",36.1622296,-86.7743531
1250,/title/tt0276033/,The Country Bears,"Walt Disney's Golden Oak Ranch - 19802 Placerita Canyon Road, Newhall, California, USA",,,,
1251,/title/tt0188674/,Human Traffic,"Cardiff, South Glamorgan, Wales, UK",,"Cardiff Bay Yacht Club, Chandlers Way, Penarth Marina, Penarth, Vale of Glamorgan, Cymru / Wales, CF64 1SP, United Kingdom",51.44749165,-3.1779477884271543
1252,/title/tt0188674/,Human Traffic,"Club X, Charles Street, Cardiff, South Glamorgan, Wales, UK",(interior 'The Asylum' club)                        ,,,
1253,/title/tt0188674/,Human Traffic,"Philharmonic, St Mary Street, Cardiff, South Glamorgan, Wales, UK",(Sunday pub scene)                        ,,,
1254,/title/tt0188674/,Human Traffic,"UCI 12 Cinemas, Atlantic Wharf Leisure Village, Hemingway Road, Cardiff, South Glamorgan, Wales, UK",(Nina's workplace)                        ,,,
1255,/title/tt0108551/,What's Love Got to Do with It,"El Paso, Texas, USA",,"El Paso, El Paso County, Texas, United States of America",31.7754152,-106.4646348
1256,/title/tt0108551/,What's Love Got to Do with It,"Quality Coffee Shop - 1238 West 7th Street, Los Angeles, California, USA",,,,
1257,/title/tt0108551/,What's Love Got to Do with It,"Nutbush, Tennessee, USA",,"Nutbush, Haywood County, Tennessee, United States of America",35.698133,-89.408128
1258,/title/tt0108551/,What's Love Got to Do with It,"New York Street, Backlot, Universal Studios - 100 Universal City Plaza, Universal City, California, USA","(Olympia Theatre, London - exterior)                        ",,,
1259,/title/tt0108551/,What's Love Got to Do with It,"Chicago, Illinois, USA",,"Chicago, Cook County, Illinois, United States of America",41.8755616,-87.6244212
1260,/title/tt0108551/,What's Love Got to Do with It,"Hollywood, Los Angeles, California, USA",,"Hollywood, Los Angeles, Los Angeles County, California, 90028-8127, United States of America",34.0980031,-118.329523
1261,/title/tt0108551/,What's Love Got to Do with It,"London, England, UK",,"London, Greater London, England, United Kingdom",51.5073219,-0.1276474
1262,/title/tt0108551/,What's Love Got to Do with It,"New York City, New York, USA",,"New York, United States of America",40.7127281,-74.0060152
1263,/title/tt0108551/,What's Love Got to Do with It,"Rockwell Defense Plant - Bellflower & Imperial Highway, Downey, California, USA",,,,
1264,/title/tt0108551/,What's Love Got to Do with It,"St. Louis, Missouri, USA",,"Saint Louis, City of Saint Louis, Missouri, 63102-1102, United States of America",38.6264178,-90.1998378
1265,/title/tt0108551/,What's Love Got to Do with It,"Ambassador Hotel - 3400 Wilshire Boulevard, Los Angeles, California, USA",,,,
1266,/title/tt1786751/,CBGB,"Savannah, Georgia, USA",,"Savannah, Chatham County, Georgia, United States of America",32.0809263,-81.0911768
1267,/title/tt1786751/,CBGB,"Georgia, USA",,"Georgia, United States of America",32.3293809,-83.1137366
1268,/title/tt1786751/,CBGB,USA,,United States,39.7837304,-100.4458825
